Diderot_Neveu	582	LUI.	143	0	1	0	0.0	[]	0.0	0.0	0.0	0.0	0.0
Diderot_Neveu	583	--- Point de musique ?	143	1	3	0	0.0	[]	0.0	0.034482758620689655	0.0	0.0	0.0
Diderot_Neveu	584	MOI.---S'il y avait un bon maître d'harmonie, je la lui confierais volontiers deux heures par jour pendant un ou deux ans, pas davantage.	144	0	25	1	0.04	[['pendant']]	0.04	0.02564102564102564	0.04	0.04	0.0
Diderot_Neveu	585	LUI.---Et à la place des choses essentielles que vous supprimez... ?	145	0	11	0	0.0	[]	0.0	0.017241379310344827	0.0	0.0	0.0
Diderot_Neveu	586	MOI.---Je mets de la grammaire, de la fable, de l'histoire, de la géographie, un peu de dessin, et beaucoup de morale.	146	0	22	0	0.0	[]	0.0	0.0	0.0	0.0	0.0
Diderot_Neveu	587	LUI.---Combien il me serait facile de vous prouver l'inutilité de toutes ces connaissances-là dans un monde tel que le nôtre que dis-je, l'inutilité peut-être le danger Mais je m'en tiendrai pour ce moment à une question : Ne lui faudrait-il pas un ou deux maîtres ?	147	0	50	0	0.0	[]	0.0	0.0	0.0	0.0	0.0
Diderot_Neveu	588	MOI.	148	0	1	0	0.0	[]	0.0	0.0	0.0	0.0	0.0
Diderot_Neveu	589	--- Sans doute.	148	1	2	0	0.0	[]	0.0	0.0	0.0	0.0	0.0
Diderot_Neveu	590	LUI.	149	0	1	0	0.0	[]	0.0	0.0	0.0	0.0	0.0
Diderot_Neveu	591	―	149	1	1	0	0.0	[]	0.0	0.0	0.0	0.0	0.0
Diderot_Neveu	592	Ah nous y voilà.	149	2	4	0	0.0	[]	0.0	0.0	0.0	0.0	0.0
Diderot_Neveu	593	Et ces maîtres vous espérez qu'ils sauront la grammaire, la fable, l'histoire, la géographie, la morale dont ils lui donneront des leçons ?	149	3	24	0	0.0	[]	0.0	0.0	0.0	0.0	0.0
Diderot_Neveu	594	Chansons, mon cher maître, chansons s'ils possédaient ces choses assez pour les montrer, ils ne les montreraient pas.	149	4	19	0	0.0	[]	0.0	0.0	0.0	0.0	0.0
Diderot_Neveu	595	MOI.---Et pourquoi ?	150	0	2	0	0.0	[]	0.0	0.0	0.0	0.0	0.0
Diderot_Neveu	596	LUI.---C'est qu'ils auraient passé leur vie à les étudier.	151	0	11	0	0.0	[]	0.03571428571428571	0.03333333333333333	0.028037383177570093	0.02941176470588235	0.036133046833847174
Diderot_Neveu	597	Il faut être profond dans l'art ou dans la science pour en bien posséder les éléments.	151	1	17	1	0.0588235294117647	[['profond']]	0.044444444444444446	0.044444444444444446	0.028037383177570093	0.02941176470588235	0.036133046833847174
Diderot_Neveu	598	Les ouvrages classiques ne peuvent être bien faits que par ceux qui ont blanchi sous le harnois ;	151	2	17	1	0.0588235294117647	[['blanchir']]	0.06382978723404255	0.06382978723404255	0.028037383177570093	0.02941176470588235	0.036133046833847174
Diderot_Neveu	599	c'est le milieu et la fin qui éclaircissent les ténèbres du commencement.	151	3	13	1	0.0769230769230769	[['fin']]	0.03773584905660377	0.03773584905660377	0.028037383177570093	0.02941176470588235	0.036133046833847174
Diderot_Neveu	600	Demandez à votre ami monsieur d'Alembert, le coryphée de la science mathématique, s'il serait trop bon pour en faire des éléments.	151	4	23	0	0.0	[]	0.016129032258064516	0.016129032258064516	0.028037383177570093	0.02941176470588235	0.036133046833847174
Diderot_Neveu	601	Ce n'est qu'après trente ou quarante ans d'exercice que mon oncle a entrevu les profondeurs et les premières lumières de la théorie musicale.	151	5	26	0	0.0	[]	0.0	0.0	0.028037383177570093	0.02941176470588235	0.036133046833847174
Diderot_Neveu	602	MOI.---Ô fou	152	0	2	0	0.0	[]	0.07407407407407407	0.03773584905660377	0.07407407407407407	0.04	0.0565685424949238
Diderot_Neveu	603	, archi-fou m'écriai-je, comment se fait-il que dans ta mauvaise tête il se trouve des idées si justes, pêle-mêle-mêle avec tant d'extravagances ?	152	1	25	2	0.08	[['ton'], ['tête']]	0.07407407407407407	0.06451612903225806	0.07407407407407407	0.04	0.0565685424949238
Diderot_Neveu	604	LUI.---Qui diable sait cela ?	153	0	4	0	0.0	[]	0.0	0.05	0.012987012987012988	0.0	0.015408338784034128
Diderot_Neveu	605	C'est le hasard qui vous les jette, et elles demeurent.	153	1	11	0	0.0	[]	0.0	0.0	0.012987012987012988	0.0	0.015408338784034128
Diderot_Neveu	606	Tant il y a que quand on ne sait pas tout on ne sait rien de bien ;	153	2	17	0	0.0	[]	0.0	0.0	0.012987012987012988	0.0	0.015408338784034128
Diderot_Neveu	607	on ignore où une chose va, d'où une autre vient, où celle-ci ou celle-là veulent être placées, laquelle doit passer la première, ou sera mieux la seconde.	153	3	29	0	0.0	[]	0.0	0.0	0.012987012987012988	0.0	0.015408338784034128
Diderot_Neveu	608	Montre-t-on bien sans la méthode ?	153	4	7	0	0.0	[]	0.0	0.0	0.012987012987012988	0.0	0.015408338784034128
Diderot_Neveu	609	et la méthode, d'où naît-elle ?	153	5	7	0	0.0	[]	0.0	0.0	0.012987012987012988	0.0	0.015408338784034128
Diderot_Neveu	610	Tenez, mon philosophe	153	6	3	0	0.0	[]	0.043478260869565216	0.043478260869565216	0.012987012987012988	0.0	0.015408338784034128
Diderot_Neveu	611	, j'ai dans la tête que la physique sera toujours une pauvre science, une goutte d'eau prise avec la pointe d'une aiguille dans le vaste Océan, un grain détaché de la chaîne des Alpes.	153	7	36	2	0.0555555555555555	[['tête'], ['vaste']]	0.043478260869565216	0.043478260869565216	0.012987012987012988	0.0	0.015408338784034128
Diderot_Neveu	612	Et puis chercher les raisons des phénomènes	153	8	7	0	0.0	[]	0.044444444444444446	0.044444444444444446	0.012987012987012988	0.0	0.015408338784034128
Diderot_Neveu	613	En vérité	153	9	2	0	0.0	[]	0.0	0.0	0.012987012987012988	0.0	0.015408338784034128
Diderot_Neveu	614	, il vaudrait autant ignorer que de savoir si peu et si mal.	153	10	12	0	0.0	[]	0.0	0.0	0.012987012987012988	0.0	0.015408338784034128
Diderot_Neveu	615	Et c'était précisément où j'en étais, lorsque je me fis maître d'accompagnement.	153	11	15	0	0.0	[]	0.0	0.0	0.012987012987012988	0.0	0.015408338784034128
Diderot_Neveu	616	À quoi rêvez-vous ?	153	12	4	0	0.0	[]	0.0	0.0	0.012987012987012988	0.0	0.015408338784034128
Diderot_Neveu	617	MOI.---Je rêve que tout ce que vous venez de dire est plus spécieux que solide.	154	0	15	0	0.0	[]	0.0	0.0	0.0	0.0	0.0
Diderot_Neveu	618	Mais laissons cela ;	154	1	3	0	0.0	[]	0.0	0.0	0.0	0.0	0.0
Diderot_Neveu	619	vous avez montré, dites-vous, l'accompagnement et la composition ?	154	2	10	0	0.0	[]	0.0	0.0	0.0	0.0	0.0
Diderot_Neveu	620	LUI.	155	0	1	0	0.0	[]	0.0	0.0	0.0	0.0	0.0
Diderot_Neveu	621	--- Oui.	155	1	1	0	0.0	[]	0.0	0.0	0.0	0.0	0.0
Diderot_Neveu	622	MOI.	156	0	1	0	0.0	[]	0.0	0.0	0.0	0.0	0.0
Diderot_Neveu	623	--- Et vous n'en saviez rien du tout ?	156	1	8	0	0.0	[]	0.0	0.0	0.0	0.0	0.0
Diderot_Neveu	624	LUI.---Non, ma foi ; et c'est pour cela qu'il y en avait de pires que moi, ceux qui croyaient savoir quelque chose.	157	0	23	0	0.0	[]	0.027777777777777776	0.022727272727272728	0.028985507246376812	0.0303030303030303	0.038748897093369636
Diderot_Neveu	625	Au moins je ne gâtais ni le jugement ni les mains des enfants.	157	1	13	1	0.0769230769230769	[['main']]	0.028985507246376812	0.028985507246376812	0.028985507246376812	0.0303030303030303	0.038748897093369636
Diderot_Neveu	626	En passant de moi à un bon maître, comme ils n'avaient rien appris, du moins ils n'avaient rien à désapprendre, et c'était toujours autant d'argent et de temps épargnés.	157	2	33	1	0.0303030303030303	[['de', 'argent']]	0.043478260869565216	0.0425531914893617	0.028985507246376812	0.0303030303030303	0.038748897093369636
Diderot_Neveu	627	MOI.	158	0	1	0	0.0	[]	0.0	0.02702702702702703	0.0	0.0	0.0
Diderot_Neveu	628	--- Comment faisiez-vous ?	158	1	3	0	0.0	[]	0.0	0.0	0.0	0.0	0.0
Diderot_Neveu	629	LUI.---Comme ils font tous.	159	0	4	0	0.0	[]	0.0	0.0	0.027777777777777776	0.0	0.05000684759538487
Diderot_Neveu	630	J'arrivais, je me jetais dans une chaise.	159	1	8	0	0.0	[]	0.02040816326530612	0.02040816326530612	0.027777777777777776	0.0	0.05000684759538487
Diderot_Neveu	631	« Que le temps est mauvais que le pavé est fatigant » Je bavardais quelques nouvelles : « Mlle Lemierre devait faire un rôle de Vestale dans l'opéra nouveau, mais elle est grosse pour la seconde fois ;	159	2	37	1	0.027027027027027	[['gros']]	0.0196078431372549	0.0196078431372549	0.027777777777777776	0.0	0.05000684759538487
Diderot_Neveu	632	on ne sait qui la doublera.	159	3	6	0	0.0	[]	0.0392156862745098	0.0392156862745098	0.027777777777777776	0.0	0.05000684759538487
Diderot_Neveu	633	Mlle Arnould vient de quitter son petit comte ;	159	4	8	1	0.125	[['petit']]	0.043478260869565216	0.043478260869565216	0.027777777777777776	0.0	0.05000684759538487
Diderot_Neveu	634	on dit qu'elle est en négociation avec Bertin.	159	5	9	0	0.0	[]	0.058823529411764705	0.06896551724137931	0.027777777777777776	0.0	0.05000684759538487
Diderot_Neveu	635	Le petit comte a pourtant trouvé la porcelaine de M. de Montami.	160	0	12	1	0.0833333333333333	[['petit']]	0.03571428571428571	0.02702702702702703	0.03676470588235294	0.0	0.05322196421999677
Diderot_Neveu	636	Il y avait au dernier concert des amateurs une Italienne qui a chanté comme un ange.	160	1	16	0	0.0	[]	0.06818181818181818	0.06818181818181818	0.03676470588235294	0.0	0.05322196421999677
Diderot_Neveu	637	C'est un rare corps que ce Préville il faut le voir dans le Mercure galant ;	160	2	16	2	0.125	[['rare'], ['corps']]	0.05128205128205128	0.05128205128205128	0.03676470588235294	0.0	0.05322196421999677
Diderot_Neveu	638	l'endroit de l'énigme est impayable.	160	3	7	0	0.0	[]	0.05263157894736842	0.05263157894736842	0.03676470588235294	0.0	0.05322196421999677
Diderot_Neveu	639	Cette pauvre Dumesnil ne sait plus ce qu'elle dit ni ce qu'elle fait...	160	4	15	0	0.0	[]	0.0	0.0	0.03676470588235294	0.0	0.05322196421999677
Diderot_Neveu	640	Allons, mademoiselle, prenez votre livre...	160	5	5	0	0.0	[]	0.0	0.0	0.03676470588235294	0.0	0.05322196421999677
Diderot_Neveu	641	».	160	6	1	0	0.0	[]	0.0	0.0	0.03676470588235294	0.0	0.05322196421999677
Diderot_Neveu	642	Tandis que mademoiselle, qui ne se presse pas, cherche son livre qu'elle a égaré, qu'on appelle une femme de chambre, qu'on gronde, je continue :	160	7	27	0	0.0	[]	0.0	0.0	0.03676470588235294	0.0	0.05322196421999677
Diderot_Neveu	643	«	160	8	1	0	0.0	[]	0.0	0.0	0.03676470588235294	0.0	0.05322196421999677
Diderot_Neveu	644	La Clairon est vraiment incompréhensible.	160	9	5	0	0.0	[]	0.07692307692307693	0.07692307692307693	0.03676470588235294	0.0	0.05322196421999677
Diderot_Neveu	645	On parle d'un mariage fort saugrenu ;	160	10	7	1	0.1428571428571428	[['fort']]	0.047619047619047616	0.047619047619047616	0.03676470588235294	0.0	0.05322196421999677
Diderot_Neveu	646	c'est celui de mademoiselle... comment l'appelez-vous ?	160	11	9	0	0.0	[]	0.06451612903225806	0.06451612903225806	0.03676470588235294	0.0	0.05322196421999677
Diderot_Neveu	647	une petite créature que... entretenait, à qui... qui avait été entretenue par tant d'autres.---Allons,	160	12	15	1	0.0666666666666666	[['petit']]	0.041666666666666664	0.04	0.03676470588235294	0.0	0.05322196421999677
Diderot_Neveu	648	Rameau	161	0	1	0	0.0	[]	0.0	0.05555555555555555	0.024691358024691357	0.0	0.03835720991165041
Diderot_Neveu	649	, vous radotez ;	161	1	2	0	0.0	[]	0.0	0.0	0.024691358024691357	0.0	0.03835720991165041
Diderot_Neveu	650	cela ne se peut.---Je ne radote point ;	161	2	7	0	0.0	[]	0.0	0.0	0.024691358024691357	0.0	0.03835720991165041
Diderot_Neveu	651	on dit même que la chose est faite.	161	3	8	0	0.0	[]	0.045454545454545456	0.045454545454545456	0.024691358024691357	0.0	0.03835720991165041
Diderot_Neveu	652	Le bruit court que Voltaire est mort ;	161	4	7	1	0.1428571428571428	[['court']]	0.05	0.05	0.024691358024691357	0.0	0.03835720991165041
Diderot_Neveu	653	tant mieux.---Et pourquoi tant mieux ?	161	5	5	0	0.0	[]	0.045454545454545456	0.045454545454545456	0.024691358024691357	0.0	0.03835720991165041
Diderot_Neveu	654	---C'est qu'il va nous donner quelques bonnes folies ;	161	6	10	0	0.0	[]	0.04	0.04	0.024691358024691357	0.0	0.03835720991165041
Diderot_Neveu	655	c'est son usage que de mourir une quinzaine auparavant...	161	7	10	1	0.1	[['mourir']]	0.038461538461538464	0.038461538461538464	0.024691358024691357	0.0	0.03835720991165041
Diderot_Neveu	656	» Que vous dirai-je encore ?	161	8	6	0	0.0	[]	0.05714285714285714	0.05714285714285714	0.024691358024691357	0.0	0.03835720991165041
Diderot_Neveu	657	Je disais quelques polissonneries que je rapportais des maisons où j'avais été, car nous sommes tous grands colporteurs.	161	9	19	1	0.0526315789473684	[['grand']]	0.02631578947368421	0.02631578947368421	0.024691358024691357	0.0	0.03835720991165041
Diderot_Neveu	658	Je faisais le fou, on m'écoutait, on riait, on s'écriait : «	161	10	13	0	0.0	[]	0.027777777777777776	0.027777777777777776	0.024691358024691357	0.0	0.03835720991165041
Diderot_Neveu	659	Il est toujours charmant.	161	11	4	0	0.0	[]	0.022222222222222223	0.022222222222222223	0.024691358024691357	0.0	0.03835720991165041
Diderot_Neveu	660	» Cependant ce livre de mademoiselle s'était retrouvé sous un fauteuil, où il avait été traîné, mâchonné, déchiré par un jeune doguin, ou par un petit chat.	161	12	28	1	0.0357142857142857	[['petit']]	0.02631578947368421	0.02631578947368421	0.024691358024691357	0.0	0.03835720991165041
Diderot_Neveu	661	Elle se mettait à son clavecin ;	161	13	6	0	0.0	[]	0.017543859649122806	0.017543859649122806	0.024691358024691357	0.0	0.03835720991165041
Diderot_Neveu	662	d'abord elle y faisait du bruit toute seule, ensuite je m'approchais, après avoir fait à la mère un signe d'approbation.	161	14	23	0	0.0	[]	0.0	0.0	0.024691358024691357	0.0	0.03835720991165041
Diderot_Neveu	663	La mère : « Cela ne va pas mal ;	161	15	8	0	0.0	[]	0.0	0.0	0.024691358024691357	0.0	0.03835720991165041
Diderot_Neveu	664	on n'aurait qu'à vouloir, mais on ne veut pas ;	161	16	11	0	0.0	[]	0.027777777777777776	0.027777777777777776	0.024691358024691357	0.0	0.03835720991165041
Diderot_Neveu	665	on aime mieux perdre son temps à jaser, à chiffonner, à courir, à je ne sais quoi.	161	17	17	1	0.0588235294117647	[['chiffonner']]	0.018518518518518517	0.018518518518518517	0.024691358024691357	0.0	0.03835720991165041
Diderot_Neveu	666	Vous n'êtes pas si tôt parti, que le livre est fermé pour ne le rouvrir qu'à votre retour : aussi, vous ne la grondez jamais.	161	18	26	0	0.0	[]	0.03278688524590164	0.03278688524590164	0.024691358024691357	0.0	0.03835720991165041
Diderot_Neveu	667	» Cependant, comme il fallait faire quelque chose, je lui prenais les mains, que je lui plaçais autrement ;	161	19	18	1	0.0555555555555555	[['main']]	0.02040816326530612	0.02040816326530612	0.024691358024691357	0.0	0.03835720991165041
Diderot_Neveu	668	je me dépitais, je criais :	161	20	5	0	0.0	[]	0.03571428571428571	0.03571428571428571	0.024691358024691357	0.0	0.03835720991165041
Diderot_Neveu	669	« Sol, sol, sol, mademoiselle ;	161	21	5	0	0.0	[]	0.0	0.0	0.024691358024691357	0.0	0.03835720991165041
Diderot_Neveu	670	c'est un sol.	161	22	4	0	0.0	[]	0.0	0.0	0.024691358024691357	0.0	0.03835720991165041
Diderot_Neveu	671	» La mère : « Mademoiselle, est-ce que vous n'avez point d'oreille ?	162	0	14	0	0.0	[]	0.0	0.0	0.0	0.0	0.0
Diderot_Neveu	672	Moi qui ne suis pas au clavecin, et qui ne vois pas sur votre livre, je sens qu'il faut un sol.	162	1	22	0	0.0	[]	0.0	0.0	0.0	0.0	0.0
Diderot_Neveu	673	Vous donnez une peine infinie à monsieur ;	163	0	7	0	0.0	[]	0.0	0.0	0.018518518518518517	0.0	0.023056887375133225
Diderot_Neveu	674	je ne conçois pas sa patience ;	163	1	6	0	0.0	[]	0.0	0.0	0.018518518518518517	0.0	0.023056887375133225
Diderot_Neveu	675	vous ne retenez rien de ce qu'il vous dit, vous n'avancez point...	163	2	14	0	0.0	[]	0.02857142857142857	0.02857142857142857	0.018518518518518517	0.0	0.023056887375133225
Diderot_Neveu	676	» Alors je rabattais un peu les coups, et, hochant de la tête, je disais :	163	3	15	1	0.0666666666666666	[['tête']]	0.02857142857142857	0.02857142857142857	0.018518518518518517	0.0	0.023056887375133225
Diderot_Neveu	677	« Pardonnez-moi, madame, pardonnez-moi ;	163	4	6	0	0.0	[]	0.02564102564102564	0.02564102564102564	0.018518518518518517	0.0	0.023056887375133225
Diderot_Neveu	678	cela pourrait aller mieux si mademoiselle voulait, si elle étudiait un peu : mais cela ne va pas mal.	163	5	18	0	0.0	[]	0.0	0.0	0.018518518518518517	0.0	0.023056887375133225
Diderot_Neveu	679	»	163	6	1	0	0.0	[]	0.0	0.0	0.018518518518518517	0.0	0.023056887375133225
Diderot_Neveu	680	La mère : « À votre place	163	7	6	0	0.0	[]	0.023809523809523808	0.023809523809523808	0.018518518518518517	0.0	0.023056887375133225
Diderot_Neveu	681	, je la tiendrais un an sur la même pièce.---Oh pour cela elle n'en sortira pas qu'elle ne soit au-dessus de toute difficulté, et cela ne sera pas aussi long que madame le croit.---Monsieur	163	8	35	1	0.0285714285714285	[['long']]	0.024390243902439025	0.022222222222222223	0.018518518518518517	0.0	0.023056887375133225
Diderot_Neveu	682	Rameau, vous la flattez ;	164	0	4	0	0.0	[]	0.0	0.023255813953488372	0.04040404040404041	0.0	0.035159485861323427
Diderot_Neveu	683	vous êtes trop bon.	164	1	4	0	0.0	[]	0.0	0.0	0.04040404040404041	0.0	0.035159485861323427
Diderot_Neveu	684	Voilà de la leçon la seule chose qu'elle retiendra et qu'elle saura bien me répéter dans l'occasion...	164	2	20	0	0.0	[]	0.05970149253731343	0.05970149253731343	0.04040404040404041	0.0	0.035159485861323427
Diderot_Neveu	685	» L'heure se passait, mon écolière me présentait mon petit cachet avec la grâce du bras et la révérence qu'elle avait apprise du maître à danser : je le mettais dans ma poche, pendant que la mère disait : « Fort bien, mademoiselle ;	164	3	43	4	0.0930232558139534	[['petit'], ['bras'], ['pendant'], ['fort']]	0.057971014492753624	0.057971014492753624	0.04040404040404041	0.0	0.035159485861323427
Diderot_Neveu	686	si Favillier était là, il applaudirait...	164	4	6	0	0.0	[]	0.07017543859649122	0.07017543859649122	0.04040404040404041	0.0	0.035159485861323427
Diderot_Neveu	687	» Je bavardais encore un moment par bienséance ;	164	5	8	0	0.0	[]	0.0	0.0	0.04040404040404041	0.0	0.035159485861323427
Diderot_Neveu	688	je disparaissais ensuite, et voilà ce qu'on appelait alors une leçon d'accompagnement.	164	6	14	0	0.0	[]	0.0	0.0	0.04040404040404041	0.0	0.035159485861323427
Diderot_Neveu	689	MOI.	165	0	1	0	0.0	[]	0.0	0.0	0.0	0.0	0.0
Diderot_Neveu	690	--- Et aujourd'hui c'est donc autre chose ?	165	1	7	0	0.0	[]	0.0	0.0	0.0	0.0	0.0
Diderot_Neveu	691	LUI.---Vertudieu je le crois.	166	0	4	0	0.0	[]	0.0	0.0	0.010869565217391304	0.0	0.015701857325533166
Diderot_Neveu	692	J'arrive, je suis grave ;	166	1	5	0	0.0	[]	0.0	0.0	0.010869565217391304	0.0	0.015701857325533166
Diderot_Neveu	693	je me hâte d'ôter mon manchon, j'ouvre le clavecin, j'essaye les touches.	166	2	15	0	0.0	[]	0.0	0.0	0.010869565217391304	0.0	0.015701857325533166
Diderot_Neveu	694	Je suis toujours pressé ;	166	3	4	0	0.0	[]	0.0	0.0	0.010869565217391304	0.0	0.015701857325533166
Diderot_Neveu	695	si l'on me fait attendre un moment, je crie comme si l'on me volait un écu : Dans une heure d'ici il faut que je sois là, dans deux heures chez Mme la duchesse une telle ;	166	4	38	0	0.0	[]	0.014705882352941176	0.014705882352941176	0.010869565217391304	0.0	0.015701857325533166
Diderot_Neveu	696	je suis attendu à dîner chez une belle marquise, et, au sortir de là, c'est un concert chez M. le baron de B*** .	166	5	26	1	0.0384615384615384	[['bel']]	0.015625	0.013888888888888888	0.010869565217391304	0.0	0.015701857325533166
Diderot_Neveu	697	MOI.---Et cependant vous n'êtes attendu nulle part ?	167	0	8	0	0.0	[]	0.0	0.02857142857142857	0.0	0.0	0.0
Diderot_Neveu	698	LUI.	168	0	1	0	0.0	[]	0.0	0.0	0.0	0.0	0.0
Diderot_Neveu	699	--- Il est vrai.	168	1	3	0	0.0	[]	0.0	0.0	0.0	0.0	0.0
Diderot_Neveu	700	MOI.---Et pourquoi	169	0	2	0	0.0	[]	0.08333333333333333	0.06666666666666667	0.08333333333333333	0.05	0.07071067811865477
Diderot_Neveu	701	employer toutes ces adresses viles, ces indignes petites ruses-là ?	169	1	10	1	0.1	[['petit']]	0.08333333333333333	0.06666666666666667	0.08333333333333333	0.05	0.07071067811865477
Diderot_Neveu	702	LUI.---Viles et pourquoi	170	0	3	0	0.0	[]	0.0	0.058823529411764705	0.029850746268656716	0.0	0.027196414661021052
Diderot_Neveu	703	, s'il vous plaît ?	170	1	4	0	0.0	[]	0.0	0.0	0.029850746268656716	0.0	0.027196414661021052
Diderot_Neveu	704	Elles sont d'usage dans mon état ;	170	2	7	0	0.0	[]	0.0	0.0	0.029850746268656716	0.0	0.027196414661021052
Diderot_Neveu	705	je ne m'avilis pas en faisant comme tout le monde.	170	3	11	0	0.0	[]	0.0	0.0	0.029850746268656716	0.0	0.027196414661021052
Diderot_Neveu	706	Ce n'est pas moi qui les ai inventées, et je serais bizarre et maladroit de ne pas m'y conformer.	170	4	21	0	0.0	[]	0.047619047619047616	0.047619047619047616	0.029850746268656716	0.0	0.027196414661021052
Diderot_Neveu	707	Vraiment, je sais bien que si vous allez appliquer à cela certains principes généraux de je ne sais quelle morale qu'ils ont tous à la bouche et qu'aucun d'eux ne pratique, il se trouvera que ce qui est blanc sera noir, et que ce qui est noir sera blanc.	170	5	52	4	0.0769230769230769	[['bouche'], ['blanc'], ['noir'], ['noir']]	0.0449438202247191	0.0449438202247191	0.029850746268656716	0.0	0.027196414661021052
Diderot_Neveu	708	Mais, monsieur le philosophe, il y a une conscience générale, comme il y une grammaire générale ;	170	6	16	0	0.0	[]	0.045454545454545456	0.045454545454545456	0.029850746268656716	0.0	0.027196414661021052
Diderot_Neveu	709	et puis des exceptions dans chaque langue, que vous appelez, je crois, vous autres savants, des... aidez-moi donc, des...	170	7	20	0	0.0	[]	0.0	0.0	0.029850746268656716	0.0	0.027196414661021052
Diderot_Neveu	710	MOI.	171	0	1	0	0.0	[]	0.0	0.0	0.0	0.0	0.0
Diderot_Neveu	711	--- Idiotismes.	171	1	1	0	0.0	[]	0.0	0.0	0.0	0.0	0.0
Diderot_Neveu	712	LUI.---Tout juste.	172	0	2	0	0.0	[]	0.0	0.0	0.0	0.0	0.0
Diderot_Neveu	713	Eh bien chaque état a ses exceptions de la conscience générale, auxquelles je donnerais volontiers les noms d' idiotismes de métier.	172	1	21	0	0.0	[]	0.0	0.0	0.0	0.0	0.0
Diderot_Neveu	714	MOI.---J'entends.	173	0	2	0	0.0	[]	0.0	0.0	0.0	0.0	0.0
Diderot_Neveu	715	Fontenelle parle bien, écrit bien, quoique son style fourmille d' idiotismes français.	173	1	12	0	0.0	[]	0.0	0.0	0.0	0.0	0.0
Diderot_Neveu	716	LUI.---Et le souverain, le ministre, le financier, le magistrat, le militaire,	174	0	11	0	0.0	[]	0.017857142857142856	0.014705882352941176	0.01818181818181818	0.0	0.03197868312096865
Diderot_Neveu	717	l'homme de lettres, l'avocat, le procureur, le commerçant, le banquier, l'artisan, le maître à chanter, le maître à danser, sont de fort honnêtes gens, quoique leur conduite s'écarte en plusieurs points de la conscience générale, et soit remplie d'idiotismes moraux.	174	1	45	1	0.0222222222222222	[['fort']]	0.014492753623188406	0.014492753623188406	0.01818181818181818	0.0	0.03197868312096865
Diderot_Neveu	718	Plus l'institution des choses est ancienne, plus il y a d'idiotismes ;	174	2	13	0	0.0	[]	0.014705882352941176	0.014705882352941176	0.01818181818181818	0.0	0.03197868312096865
Diderot_Neveu	719	plus les temps sont malheureux, plus les idiotismes se multiplient.	174	3	10	0	0.0	[]	0.0	0.0	0.01818181818181818	0.0	0.03197868312096865
Diderot_Neveu	720	Tant vaut l'homme, tant vaut le métier, et réciproquement.	174	4	10	0	0.0	[]	0.03225806451612903	0.03225806451612903	0.01818181818181818	0.0	0.03197868312096865
Diderot_Neveu	721	À la fin, tant vaut le métier, tant vaut l'homme.	174	5	11	1	0.0909090909090909	[['fin']]	0.037037037037037035	0.037037037037037035	0.01818181818181818	0.0	0.03197868312096865
Diderot_Neveu	722	On fait donc valoir le métier	174	6	6	0	0.0	[]	0.047619047619047616	0.047619047619047616	0.01818181818181818	0.0	0.03197868312096865
Diderot_Neveu	723	tant qu'on peut.	174	7	4	0	0.0	[]	0.0	0.0	0.01818181818181818	0.0	0.03197868312096865
Diderot_Neveu	724	MOI.---Ce que je conçois clairement à tout cet entortillage	175	0	9	0	0.0	[]	0.0	0.0	0.0	0.0	0.0
Diderot_Neveu	725	, c'est qu'il y a peu de métiers honnêtement exercés, ou peu d'honnêtes gens dans leurs métiers.	175	1	19	0	0.0	[]	0.0	0.010752688172043012	0.0	0.0	0.0
Diderot_Neveu	726	LUI.---Bon il n'y en a point ; mais en revanche il y a peu de fripons hors de leur boutique : et tout irait bien sans un certain nombre de gens qu'on appelle assidus, exacts, remplissant rigoureusement leur devoir, stricts, ou, ce qui revient au même, toujours dans leur boutique, et faisant leur métier depuis le matin jusqu'au soir, et ne faisant que cela.	176	0	65	1	0.0153846153846153	[['fripon']]	0.012987012987012988	0.010416666666666666	0.012987012987012988	0.00769230769230765	0.010878565864408364
Diderot_Neveu	727	Aussi sont-ils les seuls qui deviennent opulents et qui saient estimés.	176	1	12	0	0.0	[]	0.012987012987012988	0.01282051282051282	0.012987012987012988	0.00769230769230765	0.010878565864408364
Diderot_Neveu	728	MOI.	177	0	1	0	0.0	[]	0.0	0.0	0.0	0.0	0.0
Diderot_Neveu	729	--- À force d'idiotismes ?	177	1	4	0	0.0	[]	0.0	0.0	0.0	0.0	0.0
Diderot_Neveu	730	LUI.---C'est cela ;	178	0	3	0	0.0	[]	0.0	0.0	0.014563106796116505	0.0	0.019411577417827182
Diderot_Neveu	731	je vois que vous m'avez compris.	178	1	7	0	0.0	[]	0.0	0.0	0.014563106796116505	0.0	0.019411577417827182
Diderot_Neveu	732	Or donc, un idiotisme de presque tous les états, car il y en a de communs à tous les pays, à tous les temps, comme il y a des sottises communes ;	178	2	31	0	0.0	[]	0.0	0.0	0.014563106796116505	0.0	0.019411577417827182
Diderot_Neveu	733	un idiotisme commun est de se procurer le plus de pratiques que l'on peut ;	178	3	15	0	0.0	[]	0.0	0.0	0.014563106796116505	0.0	0.019411577417827182
Diderot_Neveu	734	une sottise commune est de croire que le plus habile est celui qui en a le plus.	178	4	17	0	0.0	[]	0.0	0.0	0.014563106796116505	0.0	0.019411577417827182
Diderot_Neveu	735	Voilà deux exceptions à la conscience générale, auxquelles il faut se plier.	178	5	12	0	0.0	[]	0.0	0.0	0.014563106796116505	0.0	0.019411577417827182
