Diderot_Neveu	1619	plus le chant sera vrai, et plus il sera beau ;	386	6	10	0	0.0	[]	0.0425531914893617	0.0425531914893617	0.02252252252252252	0.0	0.02625936582840754
Diderot_Neveu	1620	et c'est ce qu'ont très-bien senti nos jeunes musiciens.	386	7	12	0	0.0	[]	0.0	0.0	0.02252252252252252	0.0	0.02625936582840754
Diderot_Neveu	1621	Quand on entend, Je suis un pauvre diable, on croit reconnaître la plainte d'un avare ;	386	8	16	0	0.0	[]	0.01639344262295082	0.01639344262295082	0.02252252252252252	0.0	0.02625936582840754
Diderot_Neveu	1622	s'il ne chantait pas, c'est sur les mêmes tons qu'il parlerait à la terre quand il lui confie son or, et qu'il lui dit : Ô terre, reçois mon trésor.	386	9	33	1	0.0303030303030303	[['ton']]	0.02040816326530612	0.02666666666666667	0.02252252252252252	0.0	0.02625936582840754
Diderot_Neveu	1623	Et cette petite fille qui sent palpiter son cœur, qui rougit, qui se trouble, et qui supplie monseigneur de la laisser partir, s'exprimerait-elle autrement ?	387	0	26	1	0.0384615384615384	[['petit']]	0.0392156862745098	0.03571428571428571	0.034482758620689655	0.0135135135135135	0.03891784021042517
Diderot_Neveu	1624	Il y a dans ces ouvrages toutes sortes de caractères, une variété infinie de déclamations : cela est sublime, c'est moi qui vous le dis.	387	1	25	1	0.04	[['sublime']]	0.045454545454545456	0.045454545454545456	0.034482758620689655	0.0135135135135135	0.03891784021042517
Diderot_Neveu	1625	Allez, allez entendre le morceau où le jeune homme qui se sent mourir s'écrie :	387	2	15	1	0.0666666666666666	[['mourir']]	0.04054054054054054	0.04054054054054054	0.034482758620689655	0.0135135135135135	0.03891784021042517
Diderot_Neveu	1626	Mon cœur s'en va Écoutez le chant, écoutez la symphonie, et vous me direz après quelle différence il y a entre les vraies voix d'un moribond et le tour de ce chant ;	387	3	34	1	0.0294117647058823	[['voix']]	0.029411764705882353	0.029411764705882353	0.034482758620689655	0.0135135135135135	0.03891784021042517
Diderot_Neveu	1627	vous verrez si la ligne de la mélodie ne coïncide pas tout entière avec la ligne de la déclamation.	387	4	19	0	0.0	[]	0.014492753623188406	0.014492753623188406	0.034482758620689655	0.0135135135135135	0.03891784021042517
Diderot_Neveu	1628	Je ne vous parle pas de la mesure, qui est encore une des conditions du chant ;	387	5	16	0	0.0	[]	0.013888888888888888	0.013888888888888888	0.034482758620689655	0.0135135135135135	0.03891784021042517
Diderot_Neveu	1629	je m'en tiens à l'expression, et il n'y a rien de plus évident que le passage suivant que j'ai lu quelque part : Musices seminarium accentus, l'accent est la pépinière de la mélodie.	387	6	37	1	0.027027027027027	[['accent']]	0.014084507042253521	0.014084507042253521	0.034482758620689655	0.0135135135135135	0.03891784021042517
Diderot_Neveu	1630	Jugez de là de quelle difficulté et de quelle importance il est de savoir bien faire le récitatif	387	7	18	0	0.0	[]	0.05813953488372093	0.05813953488372093	0.034482758620689655	0.0135135135135135	0.03891784021042517
Diderot_Neveu	1631	Il n'y a point de bel air dont on ne puisse faire un beau récitatif, et point de beau récitatif dont un habile homme ne puisse faire un bel air.	387	8	31	4	0.1290322580645161	[['bel'], ['beau'], ['beau'], ['bel']]	0.06557377049180328	0.06557377049180328	0.034482758620689655	0.0135135135135135	0.03891784021042517
Diderot_Neveu	1632	Je ne voudrais pas assurer que celui qui récite bien chantera bien ;	387	9	12	0	0.0	[]	0.07017543859649122	0.07017543859649122	0.034482758620689655	0.0135135135135135	0.03891784021042517
Diderot_Neveu	1633	mais je serais surpris que celui qui chante bien ne sût pas bien réciter.	387	10	14	0	0.0	[]	0.0	0.0	0.034482758620689655	0.0135135135135135	0.03891784021042517
Diderot_Neveu	1634	Et croyez tout ce que je vous dis là, car c'est le vrai.	387	11	14	0	0.0	[]	0.0	0.02127659574468085	0.034482758620689655	0.0135135135135135	0.03891784021042517
Diderot_Neveu	1635	MOI.---Je ne demanderais pas mieux que de vous en croire, si je n'étais arrêté par un petit inconvénient.	388	0	19	1	0.0526315789473684	[['petit']]	0.05263157894736842	0.029411764705882353	0.05263157894736842	0.0526315789473684	0.0
Diderot_Neveu	1636	LUI.	389	0	1	0	0.0	[]	0.0	0.043478260869565216	0.0	0.0	0.0
Diderot_Neveu	1637	--- Et cet inconvénient ?	389	1	3	0	0.0	[]	0.0	0.02564102564102564	0.0	0.0	0.0
Diderot_Neveu	1638	MOI.---C'est que si cette musique est sublime, il faut que celle du divin Lulli, de Campra, de Destouche, de Mouret, et même, soit dit entre nous, celle du cher maître, soit un peu plate.	390	0	35	1	0.0285714285714285	[['sublime']]	0.02857142857142857	0.022727272727272728	0.02857142857142857	0.0285714285714285	0.0
Diderot_Neveu	1639	LUI, s'approchant de mon oreille	391	0	6	0	0.0	[]	0.0	0.023255813953488372	0.024364406779661018	0.0	0.030592795184667905
Diderot_Neveu	1640	, me répondit :	391	1	2	0	0.0	[]	0.0	0.0	0.024364406779661018	0.0	0.030592795184667905
Diderot_Neveu	1641	---Je ne voudrais pas être entendu, car il y a ici beaucoup de gens qui me connaissent : c'est qu'elle l'est aussi.	391	2	24	0	0.0	[]	0.0	0.0	0.024364406779661018	0.0	0.030592795184667905
Diderot_Neveu	1642	Ce n'est pas que je me soucie du cher maître, puisque cher il y a ;	391	3	16	0	0.0	[]	0.015873015873015872	0.015873015873015872	0.024364406779661018	0.0	0.030592795184667905
Diderot_Neveu	1643	c'est une pierre, il me verrait tirer la langue d'un pied qu'il ne me donnerait pas un verre d'eau.	391	4	23	1	0.0434782608695652	[['pied']]	0.04	0.04	0.024364406779661018	0.0	0.030592795184667905
Diderot_Neveu	1644	Mais il a beau faire, à l'octave, à la septième :	391	5	11	1	0.0909090909090909	[['beau']]	0.05555555555555555	0.05555555555555555	0.024364406779661018	0.0	0.030592795184667905
Diderot_Neveu	1645	Hon, hon ;	391	6	2	0	0.0	[]	0.06666666666666667	0.06666666666666667	0.024364406779661018	0.0	0.030592795184667905
Diderot_Neveu	1646	hin, hin ;	391	7	2	0	0.0	[]	0.0	0.0	0.024364406779661018	0.0	0.030592795184667905
Diderot_Neveu	1647	tu, tu, tu, turlututu, avec un charivari de diable ;	391	8	9	0	0.0	[]	0.0	0.0	0.024364406779661018	0.0	0.030592795184667905
Diderot_Neveu	1648	ceux qui commencent à s'y connaître, et qui ne prennent plus du tintamarre pour de la musique, ne s'accommoderont jamais de cela.	391	9	24	0	0.0	[]	0.0	0.0	0.024364406779661018	0.0	0.030592795184667905
Diderot_Neveu	1649	On devait défendre par une ordonnance de police, à toute personne, de quelque qualité ou condition qu'elle fût, de faire chanter le Stabat de Pergolèse.	391	10	26	0	0.0	[]	0.02564102564102564	0.02564102564102564	0.024364406779661018	0.0	0.030592795184667905
Diderot_Neveu	1650	Ce Stabat, il fallait le faire brûler par la main du bourreau Ma foi, ces maudits bouffons, avec leur Servante maîtresse, leur Tracallo, nous en ont donné rudement...	391	11	28	2	0.0714285714285714	[['brûler'], ['main']]	0.02702702702702703	0.02702702702702703	0.024364406779661018	0.0	0.030592795184667905
Diderot_Neveu	1651	Autrefois, un Tancrède, une Issé , une Europe galante, les Indes, Castor, les Talents lyriques , allaient à quatre, cinq, six mois ;	391	12	20	0	0.0	[]	0.05084745762711865	0.05084745762711865	0.024364406779661018	0.0	0.030592795184667905
Diderot_Neveu	1652	on ne voyait point la fin des représentations d'une Armide .	391	13	11	1	0.0909090909090909	[['fin']]	0.02127659574468085	0.02127659574468085	0.024364406779661018	0.0	0.030592795184667905
Diderot_Neveu	1653	À présent, tout cela vous tombe les uns sur les autres comme des capucins de cartes.	391	14	16	0	0.0	[]	0.03571428571428571	0.03571428571428571	0.024364406779661018	0.0	0.030592795184667905
Diderot_Neveu	1654	Aussi	391	15	1	0	0.0	[]	0.0	0.0	0.024364406779661018	0.0	0.030592795184667905
Diderot_Neveu	1655	Rebel et Francœur	391	16	3	0	0.0	[]	0.0	0.0	0.024364406779661018	0.0	0.030592795184667905
Diderot_Neveu	1656	en jettent-ils feu et flamme.	391	17	6	0	0.0	[]	0.019230769230769232	0.019230769230769232	0.024364406779661018	0.0	0.030592795184667905
Diderot_Neveu	1657	Ils disent que tout est perdu, qu'ils sont ruinés, et que si l'on tolère plus longtemps cette canaille chantante de la foire, la musique nationale est au diable, et que, l'Académie royale du cul-de-sac n'a qu'à fermer boutique.	391	18	43	1	0.0232558139534883	[['royal']]	0.017241379310344827	0.017241379310344827	0.024364406779661018	0.0	0.030592795184667905
Diderot_Neveu	1658	Il y a bien quelque chose de vrai là	391	19	9	0	0.0	[]	0.018867924528301886	0.018867924528301886	0.024364406779661018	0.0	0.030592795184667905
Diderot_Neveu	1659	-dedans.	391	20	1	0	0.0	[]	0.022727272727272728	0.022727272727272728	0.024364406779661018	0.0	0.030592795184667905
Diderot_Neveu	1660	Les vieilles perruques qui viennent là, depuis trente à quarante ans, tous les vendredis, au lieu de s'amuser comme ils ont fait par le passé, s'ennuient et bâillent sans trop savoir pourquoi ;	391	21	34	1	0.0294117647058823	[['vieux']]	0.022727272727272728	0.022727272727272728	0.024364406779661018	0.0	0.030592795184667905
Diderot_Neveu	1661	ils se le demandent et ne sauraient se répondre.	391	22	9	0	0.0	[]	0.02	0.02	0.024364406779661018	0.0	0.030592795184667905
Diderot_Neveu	1662	Que ne s'adressent-ils à moi ?	391	23	7	0	0.0	[]	0.0	0.0	0.024364406779661018	0.0	0.030592795184667905
Diderot_Neveu	1663	La prédiction de Duni s'accomplira ;	391	24	6	0	0.0	[]	0.02127659574468085	0.02127659574468085	0.024364406779661018	0.0	0.030592795184667905
Diderot_Neveu	1664	et, du train que cela prend, je veux mourir si dans quatre ou cinq ans, à dater du Peintre amoureux de son modèle, il y a un chat à ferrer dans la célèbre impasse.	391	25	34	1	0.0294117647058823	[['mourir']]	0.018518518518518517	0.018518518518518517	0.024364406779661018	0.0	0.030592795184667905
Diderot_Neveu	1665	Les bonnes gens ils ont renoncé à leurs symphonies pour jouer des symphonies italiennes.	391	26	14	0	0.0	[]	0.015625	0.015625	0.024364406779661018	0.0	0.030592795184667905
Diderot_Neveu	1666	Ils ont cru qu'ils feraient leurs oreilles à celle-ci, sans conséquence pour leur musique vocale ;	391	27	16	0	0.0	[]	0.021505376344086023	0.021505376344086023	0.024364406779661018	0.0	0.030592795184667905
Diderot_Neveu	1667	comme si la symphonie n'était pas au chant, à un peu de libertinage près inspiré par l'étendue de l'instrument et la mobilité des doigts, ce que le chant est à la déclamation réelle ; comme si le violon n'était pas le singe du chanteur, qui deviendra un jour, lorsque le difficile prendra la place du beau, le singe du violon.	391	28	63	2	0.0317460317460317	[['doigt'], ['beau']]	0.02197802197802198	0.02197802197802198	0.024364406779661018	0.0	0.030592795184667905
Diderot_Neveu	1668	Le premier qui joua Locatelli fut l'apôtre de la nouvelle musique.	391	29	12	0	0.0	[]	0.03389830508474576	0.03389830508474576	0.024364406779661018	0.0	0.030592795184667905
Diderot_Neveu	1669	À d'autres, à d'autres on nous accoutumera à l'imitation des accents de la passion ou des phénomènes de la nature par le chant et la voix, par l'instrument, car voilà toute l'étendue de l'objet de la musique ;	391	30	43	2	0.0465116279069767	[['accent'], ['voix']]	0.028169014084507043	0.028169014084507043	0.024364406779661018	0.0	0.030592795184667905
Diderot_Neveu	1670	et nous conserverons notre goût pour les vols, les lancés, les gloires, les triomphes, les victoires ?	391	31	16	0	0.0	[]	0.029850746268656716	0.029850746268656716	0.024364406779661018	0.0	0.030592795184667905
Diderot_Neveu	1671	Va-t'en voir s'ils viennent, Jean.	391	32	8	0	0.0	[]	0.0	0.0	0.024364406779661018	0.0	0.030592795184667905
Diderot_Neveu	1672	Ils ont imaginé qu'ils pleureraient ou riraient à des scènes de tragédie ou de comédie musiquées ;	391	33	17	0	0.0	[]	0.023809523809523808	0.023809523809523808	0.024364406779661018	0.0	0.030592795184667905
Diderot_Neveu	1673	qu'on porterait à leurs oreilles les accents de la fureur, de la haine, de la jalousie,	391	34	17	1	0.0588235294117647	[['accent']]	0.007936507936507936	0.007936507936507936	0.024364406779661018	0.0	0.030592795184667905
Diderot_Neveu	1674	les vraies plaintes de l'amour, les ironies, les plaisanteries du théâtre italien ou français, et qu'ils resteraient admirateurs de Ragonde ou de Platée (je t'en réponds, Tarare, pompon) ; qu'ils éprouveraient sans cesse avec quelle facilité, quelle flexibilité, quelle mollesse, l'harmonie, la prosodie, les ellipses, les inversions de la langue italienne se prêtaient à l'art, au mouvement, à l'expression, aux tours et à la valeur mesurée du chant, et qu'ils continueraient d'ignorer combien la leur est roide, sourde, lourde, pesante, pédantesque et monotone.	391	35	92	0	0.0	[]	0.008928571428571428	0.008928571428571428	0.024364406779661018	0.0	0.030592795184667905
Diderot_Neveu	1675	Eh oui, oui ;	391	36	3	0	0.0	[]	0.01775147928994083	0.01775147928994083	0.024364406779661018	0.0	0.030592795184667905
Diderot_Neveu	1676	ils se sont persuadé qu'après avoir mêlé leurs larmes aux pleurs d'une mère qui se désole sur la mort de son fils, après avoir frémi de l'ordre d'un tyran qui ordonne un meurtre, ils ne s'ennuieraient pas de leur féerie, de leur insipide mythologie, de leurs petits madrigaux doucereux qui ne marquent pas moins le mauvais goût du poète que la misère de l'art qui s'en accommode.	391	37	74	3	0.0405405405405405	[['pleur'], ['petit'], ['doucereux']]	0.04716981132075472	0.04716981132075472	0.024364406779661018	0.0	0.030592795184667905
Diderot_Neveu	1677	Les bonnes gens cela n'est pas et ne peut être ; le vrai, le bon et le beau ont leurs droits : on les conteste, mais on finit par admirer ;	391	38	29	2	0.0689655172413793	[['beau'], ['droit']]	0.040983606557377046	0.040983606557377046	0.024364406779661018	0.0	0.030592795184667905
Diderot_Neveu	1678	ce qui n'est pas marqué à ce coin, on l'admire un temps, mais on finit par bâiller.	391	39	19	0	0.0	[]	0.03389830508474576	0.03389830508474576	0.024364406779661018	0.0	0.030592795184667905
Diderot_Neveu	1679	Bâillez donc, messieurs, bâillez à votre aise, ne vous gênez pas.	391	40	11	0	0.0	[]	0.013157894736842105	0.013157894736842105	0.024364406779661018	0.0	0.030592795184667905
Diderot_Neveu	1680	L'empire de la nature et de ma trinité, contre laquelle les portes de l'enfer ne prévaudront jamais, le vrai qui est le Père, et qui engendre le bon qui est le Fils, d'où procède le beau qui est le Saint-Esprit, s'établit doucement.	391	41	46	1	0.0217391304347826	[['beau']]	0.0136986301369863	0.0136986301369863	0.024364406779661018	0.0	0.030592795184667905
Diderot_Neveu	1681	Le dieu étranger se place humblement sur l'autel à côté de l'idole du pays ;	391	42	16	0	0.0	[]	0.014492753623188406	0.014492753623188406	0.024364406779661018	0.0	0.030592795184667905
Diderot_Neveu	1682	peu à peu il s'y affermit ;	391	43	7	0	0.0	[]	0.05128205128205128	0.05128205128205128	0.024364406779661018	0.0	0.030592795184667905
Diderot_Neveu	1683	un beau jour il pousse du coude son camarade, et patatras voilà l'idole en bas.	391	44	16	2	0.125	[['beau'], ['coude']]	0.05333333333333334	0.05333333333333334	0.024364406779661018	0.0	0.030592795184667905
Diderot_Neveu	1684	C'est comme cela qu'on dit que les Jésuites ont planté le christianisme à la Chine et aux Indes ; et nos Jansénistes ont beau dire, cette méthode politique qui marche à son but sans bruit, sans effusion de sang, sans martyres, sans un toupet de cheveux arraché, me semble la meilleure.	391	45	52	2	0.0384615384615384	[['beau'], ['cheveux']]	0.058823529411764705	0.05405405405405406	0.024364406779661018	0.0	0.030592795184667905
Diderot_Neveu	1685	MOI.---Il y a de la raison	392	0	6	0	0.0	[]	0.0	0.028985507246376812	0.0	0.0	0.0
Diderot_Neveu	1686	à peu près dans tout ce que vous venez de dire.	392	1	11	0	0.0	[]	0.0	0.0	0.0	0.0	0.0
Diderot_Neveu	1687	LUI.---De la raison tant mieux.	393	0	5	0	0.0	[]	0.0	0.0	0.0	0.0	0.0
Diderot_Neveu	1688	Je veux que le diable m'emporte si j'y tâche.	393	1	11	0	0.0	[]	0.0	0.0	0.0	0.0	0.0
Diderot_Neveu	1689	Cela va comme je te pousse.	393	2	6	0	0.0	[]	0.0	0.0	0.0	0.0	0.0
Diderot_Neveu	1690	Je suis comme les musiciens de l'impasse quand mon maître parut.	393	3	12	0	0.0	[]	0.0	0.0	0.0	0.0	0.0
Diderot_Neveu	1691	Si j'adresse, à la bonne heure.	393	4	7	0	0.0	[]	0.0	0.0	0.0	0.0	0.0
Diderot_Neveu	1692	C'est qu'un garçon charbonnier parlera toujours mieux de son métier que toute une académie, que tous les Duhamel du monde ...	393	5	22	0	0.0	[]	0.0	0.0	0.0	0.0	0.0
Diderot_Neveu	1693	(	394	0	0	0	0.0	[]	0.038461538461538464	0.02702702702702703	0.06735751295336788	0.0555555555555555	0.06392415567895561
Diderot_Neveu	1694	Et puis le voilà qui se met à se promener, en murmurant dans son gosier quelques-uns des airs de l' Ile des fous, du Peintre amoureux de son modèle, du Maréchal-ferrant, de la Plaideuse ; et de temps en temps il s'écriait, en levant les mains et les yeux au ciel :	394	1	52	2	0.0384615384615384	[['main'], ['oeil']]	0.0641025641025641	0.0641025641025641	0.06735751295336788	0.0555555555555555	0.06392415567895561
Diderot_Neveu	1695	« Si cela est beau, mordieu si cela est beau Comment peut-on porter à sa tête une paire d'oreilles, et faire une pareille question ?	394	2	26	3	0.1153846153846153	[['beau'], ['beau'], ['tête']]	0.06930693069306931	0.06930693069306931	0.06735751295336788	0.0555555555555555	0.06392415567895561
Diderot_Neveu	1696	» Il commençait à entrer en passion et à chanter tout bas, il élevait le ton à mesure qu'il se passionnait davantage ;	394	3	23	2	0.0869565217391304	[['bas'], ['ton']]	0.0967741935483871	0.0967741935483871	0.06735751295336788	0.0555555555555555	0.06392415567895561
Diderot_Neveu	1697	vinrent ensuite les gestes, les grimaces du visage et les contorsions du corps ;	394	4	13	1	0.0769230769230769	[['visage']]	0.07407407407407407	0.07407407407407407	0.06735751295336788	0.0555555555555555	0.06392415567895561
Diderot_Neveu	1698	et je dis : « Bon voilà la tête qui se perd, et quelque scène nouvelle qui se prépare...	394	5	18	1	0.0555555555555555	[['tête']]	0.06382978723404255	0.06382978723404255	0.06735751295336788	0.0555555555555555	0.06392415567895561
Diderot_Neveu	1699	» En effet, il part d'un éclat de voix : « Je suis un pauvre misérable...	394	6	16	1	0.0625	[['voix']]	0.03636363636363636	0.03636363636363636	0.06735751295336788	0.0555555555555555	0.06392415567895561
Diderot_Neveu	1700	Monseigneur, monseigneur, laissez-moi partir... Ô terre, reçois mon or, conserve mon trésor, mon âme, mon âme, ma vie Ô terre ...	394	7	21	0	0.0	[]	0.058823529411764705	0.058823529411764705	0.06735751295336788	0.0555555555555555	0.06392415567895561
Diderot_Neveu	1701	Le voilà le petit ami, le voilà le petit ami Aspettar si non venire...	394	8	14	2	0.1428571428571428	[['petit'], ['petit']]	0.05263157894736842	0.05263157894736842	0.06735751295336788	0.0555555555555555	0.06392415567895561
Diderot_Neveu	1702	A Zerbina penserete...	394	9	3	0	0.0	[]	0.13636363636363635	0.13636363636363635	0.06735751295336788	0.0555555555555555	0.06392415567895561
Diderot_Neveu	1703	Sempre in contrasti con te	394	10	5	1	0.2	[['con']]	0.1	0.1	0.06735751295336788	0.0555555555555555	0.06392415567895561
Diderot_Neveu	1704	si sta	394	11	2	0	0.0	[]	0.14285714285714285	0.14285714285714285	0.06735751295336788	0.0555555555555555	0.06392415567895561
Diderot_Neveu	1705	...	394	12	0	0	0.0	[]	0.0	0.0	0.06735751295336788	0.0555555555555555	0.06392415567895561
Diderot_Neveu	1706	» Il entassait et brouillait ensemble trente airs italiens, français, tragiques, comiques, de toutes sortes de caractères.	395	0	17	0	0.0	[]	0.04878048780487805	0.04878048780487805	0.028795811518324606	0.0	0.08603087886317942
Diderot_Neveu	1707	Tantôt avec une voix de basse-taille il descendait jusqu'aux enfers, tantôt, s'égosillant et contrefaisant le fausset, il déchirait le haut des airs ;	395	1	24	2	0.0833333333333333	[['voix'], ['haut']]	0.05660377358490566	0.05660377358490566	0.028795811518324606	0.0	0.08603087886317942
Diderot_Neveu	1708	imitant, de la démarche, du maintien, du geste, les différents personnages chantants ;	395	2	12	1	0.0833333333333333	[['maintien']]	0.12195121951219512	0.12195121951219512	0.028795811518324606	0.0	0.08603087886317942
Diderot_Neveu	1709	successivement furieux, radouci, impérieux, ricaneur.	395	3	5	2	0.4	[['furieux'], ['impérieu']]	0.09375	0.09375	0.028795811518324606	0.0	0.08603087886317942
Diderot_Neveu	1710	Ici c'est une jeune fille qui pleure, et il en rend toute la minauderie ;	395	4	15	0	0.0	[]	0.06666666666666667	0.06666666666666667	0.028795811518324606	0.0	0.08603087886317942
Diderot_Neveu	1711	là il est prêtre, il est roi, il est tyran ;	395	5	10	0	0.0	[]	0.03125	0.03125	0.028795811518324606	0.0	0.08603087886317942
Diderot_Neveu	1712	il menace, il commande, il s'emporte ;	395	6	7	1	0.1428571428571428	[['menacer']]	0.045454545454545456	0.045454545454545456	0.028795811518324606	0.0	0.08603087886317942
Diderot_Neveu	1713	il est esclave, il obéit ;	395	7	5	0	0.0	[]	0.043478260869565216	0.043478260869565216	0.028795811518324606	0.0	0.08603087886317942
Diderot_Neveu	1714	il s'apaise, il se désole, il se plaint, il rit ;	395	8	11	0	0.0	[]	0.03125	0.03125	0.028795811518324606	0.0	0.08603087886317942
Diderot_Neveu	1715	jamais hors de ton, de mesure, du sens des paroles ni du caractère de l'air.	395	9	16	1	0.0625	[['ton']]	0.024390243902439025	0.024390243902439025	0.028795811518324606	0.0	0.08603087886317942
Diderot_Neveu	1716	Tous les pousse-bois avaient quitté leurs échiquiers et s'étaient rassemblés autour de lui ;	395	10	14	0	0.0	[]	0.02127659574468085	0.02127659574468085	0.028795811518324606	0.0	0.08603087886317942
Diderot_Neveu	1717	les fenêtres du café étaient occupées en dehors par les passants qui s'étaient arrêtés au bruit.	395	11	17	0	0.0	[]	0.0	0.0	0.028795811518324606	0.0	0.08603087886317942
Diderot_Neveu	1718	On faisait des éclats de rire à entre'ouvrir le plafond.	395	12	11	0	0.0	[]	0.0	0.0	0.028795811518324606	0.0	0.08603087886317942
Diderot_Neveu	1719	Lui n'apercevait rien ;	395	13	4	0	0.0	[]	0.017857142857142856	0.017857142857142856	0.028795811518324606	0.0	0.08603087886317942
Diderot_Neveu	1720	il continuait, saisi d'une aliénation d'esprit, d'un enthousiasme si voisin de la folie, qu'il est incertain qu'il en revienne et s'il ne faudra pas le jeter dans un fiacre et le mener droit aux Petites-Maisons.	395	14	41	1	0.024390243902439	[['droit']]	0.02040816326530612	0.02040816326530612	0.028795811518324606	0.0	0.08603087886317942
Diderot_Neveu	1721	En chantant un lambeau des Lamentations de Jomelli, il répétait avec une précision, une vérité et une chaleur incroyables les plus beaux endroits de chaque morceau : ce beau récitatif obligé où le prophète peint la désolation de Jérusalem, il l'arrosa d'un torrent de larmes qui en arrachèrent de tous les yeux.	395	15	53	1	0.0188679245283018	[['beau']]	0.018018018018018018	0.018018018018018018	0.028795811518324606	0.0	0.08603087886317942
Diderot_Neveu	1722	Tout y était, et la délicatesse du chant, et la force de l'expression, et la douleur.	395	16	17	0	0.0	[]	0.023529411764705882	0.023529411764705882	0.028795811518324606	0.0	0.08603087886317942
Diderot_Neveu	1723	Il insistait sur les endroits où le musicien s'était particulièrement montré un grand maître.	395	17	15	1	0.0666666666666666	[['grand']]	0.021739130434782608	0.021739130434782608	0.028795811518324606	0.0	0.08603087886317942
Diderot_Neveu	1724	S'il quittait la partie du chant, c'était pour prendre celle des instruments, qu'il laissait subitement pour revenir à la voix, entrelaçant l'une à l'autre de manière à conserver les liaisons et l'unité du tout, s'emparant de nos âmes, et les tenant suspendues dans la situation la plus singulière que j'aie jamais éprouvée.	395	18	60	1	0.0166666666666666	[['voix']]	0.025974025974025976	0.025974025974025976	0.028795811518324606	0.0	0.08603087886317942
Diderot_Neveu	1725	Admirais-je ?	395	19	2	0	0.0	[]	0.015384615384615385	0.015384615384615385	0.028795811518324606	0.0	0.08603087886317942
Diderot_Neveu	1726	oui, j'admirais.	395	20	3	0	0.0	[]	0.0	0.0	0.028795811518324606	0.0	0.08603087886317942
Diderot_Neveu	1727	Étais-je touché de pitié ?	395	21	5	0	0.0	[]	0.0	0.0	0.028795811518324606	0.0	0.08603087886317942
Diderot_Neveu	1728	j'étais touché de pitié ;	395	22	5	0	0.0	[]	0.0	0.0	0.028795811518324606	0.0	0.08603087886317942
Diderot_Neveu	1729	mais une teinte de ridicule était fondue dans ces sentiments, et les dénaturait.	395	23	13	0	0.0	[]	0.0	0.0	0.028795811518324606	0.0	0.08603087886317942
Diderot_Neveu	1730	Mais vous vous seriez échappé en éclats de rire à la manière dont il contrefaisait les différents instruments ;	396	0	18	0	0.0	[]	0.05405405405405406	0.04	0.04888888888888889	0.0	0.06080778040020554
Diderot_Neveu	1731	avec des joues renflées et bouffies, et un son rauque et sombre, il rendait les cors et les bassons ;	396	1	19	2	0.1052631578947368	[['joue'], ['sombre']]	0.04477611940298507	0.04477611940298507	0.04888888888888889	0.0	0.06080778040020554
Diderot_Neveu	1732	il prenait un son éclatant et nasillard pour les hautbois, précipitant sa voix avec une rapidité incroyable pour les instruments à cordes, dont il cherchait les sons les plus approchés ;	396	2	30	1	0.0333333333333333	[['voix']]	0.08620689655172414	0.08620689655172414	0.04888888888888889	0.0	0.06080778040020554
Diderot_Neveu	1733	il sifflait les petites flûtes, il roucoulait les traversières ;	396	3	9	2	0.2222222222222222	[['siffler'], ['petit']]	0.057692307692307696	0.057692307692307696	0.04888888888888889	0.0	0.06080778040020554
Diderot_Neveu	1734	criant, chantant, se dèmenant comme un forcené, faisant à lui seul les danseurs	396	4	13	0	0.0	[]	0.06896551724137931	0.06896551724137931	0.04888888888888889	0.0	0.06080778040020554
