Florian_Galatee	1309	Elles y arriveront deux heures après le départ du navire.	216	10	10	0	0.0	[]	0.037037037037037035	0.037037037037037035	0.01702127659574468	0.0	0.031246889360275632
Florian_Galatee	1310	A force d'argent elles trouvèrent des rameurs qui essayerent de nous rejoindre: le calme survenu seconda leurs efforts;	216	11	19	2	0.1052631578947368	[['de', 'argent'], ['calme']]	0.041666666666666664	0.041666666666666664	0.01702127659574468	0.0	0.031246889360275632
Florian_Galatee	1311	et l'Amour, qui protégeait sans doute ces aimables sœurs, les fit arriver sans accident jusqu'à notre vaisseau.	216	12	19	0	0.0	[]	0.05263157894736842	0.03278688524590164	0.01702127659574468	0.0	0.031246889360275632
Florian_Galatee	1312	Je retrouvois Nisida: mais tu nous manquais, mon cher Fabian, et c'était payer bien cher la faveur que nous faisait la fortune.	217	0	23	0	0.0	[]	0.0	0.0	0.006211180124223602	0.0	0.02564102564102563
Florian_Galatee	1313	Blanche le sentait aussi-bien que moi.	217	1	7	0	0.0	[]	0.023255813953488372	0.023255813953488372	0.006211180124223602	0.0	0.02564102564102563
Florian_Galatee	1314	Ton absence fut du moins le seul malheur dont nous eûmes à gémir.	217	2	13	1	0.0769230769230769	[['ton']]	0.02857142857142857	0.02857142857142857	0.006211180124223602	0.0	0.02564102564102563
Florian_Galatee	1315	Après une heureuse navigation, nous arrivâmes à Barcelone: nous espérions y trouver de tes nouvelles;	217	3	15	0	0.0	[]	0.030303030303030304	0.030303030303030304	0.006211180124223602	0.0	0.02564102564102563
Florian_Galatee	1316	mais nos recherches furent vaines.	217	4	5	0	0.0	[]	0.0	0.0	0.006211180124223602	0.0	0.02564102564102563
Florian_Galatee	1317	Blanche fut la première à dire qu'il fallait parcourir toute l'Espagne, et ne s'arrêter que lorsque nous t'aurions trouvé: elle était bien sûre que cet avis serait suivi.	217	5	32	0	0.0	[]	0.0	0.0	0.006211180124223602	0.0	0.02564102564102563
Florian_Galatee	1318	Nous résolûmes d'aller d'abord à Tolede, où sont établis des parents de Nisida.	217	6	15	0	0.0	[]	0.0	0.0	0.006211180124223602	0.0	0.02564102564102563
Florian_Galatee	1319	Mais, avant tout, nous écrivîmes à son père pour l'instruire de nos aventures, et lui demander la permission de nous marier à Tolede: il a répondu selon nos désirs;	217	7	30	0	0.0	[]	0.0	0.0	0.006211180124223602	0.0	0.02564102564102563
Florian_Galatee	1320	et nous étions en route pour cette ville, nous informant par-tout de Fabian, quand notre bonheur nous a conduits ici.	217	8	21	0	0.0	[]	0.0	0.0	0.006211180124223602	0.0	0.02564102564102563
Florian_Galatee	1321	Telle fut l'histoire de Timbrio.	218	0	6	0	0.0	[]	0.022727272727272728	0.015384615384615385	0.021929824561403508	0.0	0.02337338321493908
Florian_Galatee	1322	Dès qu'il eut cessé de parler, l'hermite le prit en particulier; et le menant dans un coin de sa cellule, il lui dit d'une voix timide: Est-ce que je n'irai pas à Tolede?	218	1	38	1	0.0263157894736842	[['voix']]	0.03333333333333333	0.03333333333333333	0.021929824561403508	0.0	0.02337338321493908
Florian_Galatee	1323	Timbrio, surpris de sa question, le regarde: Fabian baisse les yeux, et laisse échapper quelques larmes.	218	2	16	1	0.0625	[['oeil']]	0.03278688524590164	0.03278688524590164	0.021929824561403508	0.0	0.02337338321493908
Florian_Galatee	1324	Son ami le serre dans ses bras:	218	3	7	0	0.0	[]	0.047619047619047616	0.047619047619047616	0.021929824561403508	0.0	0.02337338321493908
Florian_Galatee	1325	Il faut bien, lui répond-il, que tu viennes à Tolede pour épouser ta chère Blanche: elle t'adore;	218	4	19	1	0.0526315789473684	[['ton']]	0.02631578947368421	0.02631578947368421	0.021929824561403508	0.0	0.02337338321493908
Florian_Galatee	1326	elle n'a pas été un seul instant sans penser à toi.	218	5	12	0	0.0	[]	0.025	0.025	0.021929824561403508	0.0	0.02337338321493908
Florian_Galatee	1327	Tu l'aimes toujours, n'est-il pas vrai?	218	6	9	0	0.0	[]	0.0	0.0	0.021929824561403508	0.0	0.02337338321493908
Florian_Galatee	1328	Plus que ma vie, reprit Fabian: mais je t'aime encore davantage.	218	7	12	0	0.0	[]	0.0125	0.0125	0.021929824561403508	0.0	0.02337338321493908
Florian_Galatee	1329	Allons, ajouta-t-il en souriant, je quitterai cet habit d'hermite, et tu m'en feras trouver un plus convenable à un nouveau marié: mais, si tu m'en crois, quand nous serons les époux de ces deux charmantes sœurs, nous reviendrons ici vivre avec ces bons bergers qui nous aiment, et qui méritent que nous les aimions.	218	8	59	1	0.0169491525423728	[['sourire']]	0.02	0.02	0.021929824561403508	0.0	0.02337338321493908
Florian_Galatee	1330	J'en avais déjà formé le projet, reprit Timbrio: je suis fatigué du monde; et je veux finir ma vie dans ces bois, entre ma femme et mon ami.	218	9	29	1	0.0344827586206896	[['fatiguer']]	0.01834862385321101	0.01834862385321101	0.021929824561403508	0.0	0.02337338321493908
Florian_Galatee	1331	Après cette conversation, ils vinrent en rendre compte aux deux sœurs et aux bergers: tout le monde applaudit à leur dessein.	218	10	21	0	0.0	[]	0.02	0.01818181818181818	0.021929824561403508	0.0	0.02337338321493908
Florian_Galatee	1332	Cependant la nuit était avancée.	219	0	5	0	0.0	[]	0.0	0.0	0.0	0.0	0.0
Florian_Galatee	1333	Élicio conseillait de gagner promptement le village.	219	1	7	0	0.0	[]	0.0	0.0	0.0	0.0	0.0
Florian_Galatee	1334	Je n'ai point de maison à vous offrir, dit-il aux quatre amants; mais je vais vous conduire celle de Galatée: Mœris, son père, se fera un honneur de vous recevoir.	219	2	32	0	0.0	[]	0.0	0.0	0.0	0.0	0.0
Florian_Galatee	1335	Son avis est suivi: on se met en marche;	220	0	9	0	0.0	[]	0.07692307692307693	0.022222222222222223	0.018518518518518517	0.0	0.0795240471434526
Florian_Galatee	1336	on double le pas;	220	1	4	1	0.25	[['double']]	0.06666666666666667	0.06666666666666667	0.018518518518518517	0.0	0.0795240471434526
Florian_Galatee	1337	on arrive.	220	2	2	0	0.0	[]	0.034482758620689655	0.034482758620689655	0.018518518518518517	0.0	0.0795240471434526
Florian_Galatee	1338	Mœris allait se mettre à table avec sa fille, Florise, Téolinde, et les quatre bergers arrivés de Portugal pour emmener le lendemain Galatée.	220	3	23	0	0.0	[]	0.0	0.0	0.018518518518518517	0.0	0.0795240471434526
Florian_Galatee	1339	On frappe à la porte, les chiens abaient;	220	4	8	0	0.0	[]	0.0	0.0	0.018518518518518517	0.0	0.0795240471434526
Florian_Galatee	1340	Mœris vient ouvrir lui-même.	220	5	4	0	0.0	[]	0.0	0.0	0.018518518518518517	0.0	0.0795240471434526
Florian_Galatee	1341	Élicio lui demande l'hospitalité pour Nisida, Blanche, et les deux amis.	220	6	12	0	0.0	[]	0.03225806451612903	0.03225806451612903	0.018518518518518517	0.0	0.0795240471434526
Florian_Galatee	1342	Le vieux berger, honoré de pareils hôtes, les accueille avec respect: il appelle sa fille;	220	7	15	1	0.0666666666666666	[['vieux']]	0.02564102564102564	0.02564102564102564	0.018518518518518517	0.0	0.0795240471434526
Florian_Galatee	1343	il fait ajouter au souper tout ce qu'il a de meilleur;	220	8	12	0	0.0	[]	0.021739130434782608	0.021739130434782608	0.018518518518518517	0.0	0.0795240471434526
Florian_Galatee	1344	et, les invitant à se mettre à table, il s'excuse sur ce qu'ils n'étaient pas attendus.	220	9	19	0	0.0	[]	0.0	0.023809523809523808	0.018518518518518517	0.0	0.0795240471434526
Florian_Galatee	1345	Pendant le repas, Galatée s'efforçait de n'être pas triste.	221	0	11	1	0.0909090909090909	[['pendant']]	0.041666666666666664	0.023255813953488372	0.0364963503649635	0.0131578947368421	0.05324644751232116
Florian_Galatee	1346	Élicio s'était placé le plus loin qu'il avait pu des Portugais;	221	1	13	0	0.0	[]	0.07894736842105263	0.07894736842105263	0.0364963503649635	0.0131578947368421	0.05324644751232116
Florian_Galatee	1347	il les regardait avec colère, et ses yeux rencontraient quelquefois les yeux de Galatée.	221	2	14	2	0.1428571428571428	[['oeil'], ['oeil']]	0.06451612903225806	0.06451612903225806	0.0364963503649635	0.0131578947368421	0.05324644751232116
Florian_Galatee	1348	On sortit de table.	221	3	4	0	0.0	[]	0.07894736842105263	0.07894736842105263	0.0364963503649635	0.0131578947368421	0.05324644751232116
Florian_Galatee	1349	Tous les convives allèrent prendre le frais sur des bancs de pierre qui étaient à la porte de la maison.	221	4	20	1	0.05	[['frais']]	0.03225806451612903	0.03225806451612903	0.0364963503649635	0.0131578947368421	0.05324644751232116
Florian_Galatee	1350	Le vieux Mœris voulut conter à ses hôtes le brillant mariage qu'il avait arrangé pour sa fille: il s'étendit avec complaisance sur les richesses de son gendre, richesses que les Portugais ne manquèrent pas d'exagérer.	221	5	38	1	0.0263157894736842	[['vieux']]	0.024390243902439025	0.024390243902439025	0.0364963503649635	0.0131578947368421	0.05324644751232116
Florian_Galatee	1351	Les deux amis et les deux sœurs se croyaient obligés de féliciter Galatée: elle ne répondait rien; et le malheureux Élicio dévorait ses larmes.	221	6	24	0	0.0	[]	0.013333333333333334	0.013333333333333334	0.0364963503649635	0.0131578947368421	0.05324644751232116
Florian_Galatee	1352	Tout-à-coup le son funèbre d'une trompette se fait entendre dans le village.	221	7	13	0	0.0	[]	0.0	0.0	0.0364963503649635	0.0131578947368421	0.05324644751232116
Florian_Galatee	1353	Mœris	222	0	1	0	0.0	[]	0.10526315789473684	0.0625	0.04918032786885246	0.0	0.049379723584993096
Florian_Galatee	1354	, ses hôtes, tous les habitants alarmés courent vers la grande place d'où semblait venir le triste son.	222	1	18	2	0.1111111111111111	[['grand'], ['triste']]	0.07894736842105263	0.07894736842105263	0.04918032786885246	0.0	0.049379723584993096
Florian_Galatee	1355	Ils aperçoivent quatre bergers vêtus de deuil, et couronnés de cyprès: deux portoient à la main des flambeaux allumés;	222	2	19	1	0.0526315789473684	[['main']]	0.06818181818181818	0.06818181818181818	0.04918032786885246	0.0	0.049379723584993096
Florian_Galatee	1356	les deux autres sonnaient de la trompette.	222	3	7	0	0.0	[]	0.023809523809523808	0.023809523809523808	0.04918032786885246	0.0	0.049379723584993096
Florian_Galatee	1357	Au milieu des quatre bergers était un ministre de l'Éternel, vêtu de ses habits sacerdotaux.	222	4	16	0	0.0	[]	0.0	0.0425531914893617	0.04918032786885246	0.0	0.049379723584993096
Florian_Galatee	1358	C'était le vénérable Salvador, le pasteur des bergers, celui qui les consolait dans leurs peines, et qui remerciait le ciel de leur bonheur.	223	0	24	2	0.0833333333333333	[['vénérable'], ['consoler']]	0.06666666666666667	0.043478260869565216	0.058823529411764705	0.0476190476190476	0.041808149812907675
Florian_Galatee	1359	Tout le village était sa famille	223	1	6	0	0.0	[]	0.058823529411764705	0.058823529411764705	0.058823529411764705	0.0476190476190476	0.041808149812907675
Florian_Galatee	1360	, tous les orphelins ses enfants; depuis quarante années il remplissait le sublime emploi de louer Dieu et de servir les hommes.	223	2	21	1	0.0476190476190476	[['sublime']]	0.037037037037037035	0.018867924528301886	0.058823529411764705	0.0476190476190476	0.041808149812907675
Florian_Galatee	1361	Bergers, s'écria-t-il, c'est demain le jour choisi dans l'année pour honorer les cendres de nos frères dans la vallée des tombeaux.	224	0	26	0	0.0	[]	0.0	0.019230769230769232	0.02040816326530612	0.0	0.03207501495497917
Florian_Galatee	1362	Songez à ce devoir sacré;	224	1	5	0	0.0	[]	0.02040816326530612	0.02040816326530612	0.02040816326530612	0.0	0.03207501495497917
Florian_Galatee	1363	et dès l'aurore rendez-vous sur cette place, dans le triste appareil qui convient à cette touchante cérémonie.	224	2	18	1	0.0555555555555555	[['triste']]	0.043478260869565216	0.10256410256410256	0.02040816326530612	0.0	0.03207501495497917
Florian_Galatee	1364	Après avoir prononcé ces mots d'une voix forte, Salvador reprit le chemin de sa maison.	225	0	16	3	0.1875	[['prononcer'], ['voix'], ['fort']]	0.09090909090909091	0.0784313725490196	0.04918032786885246	0.0	0.07654655446197431
Florian_Galatee	1365	Tout le monde convint de se rassembler au point du jour pour remplir une obligation si sainte.	225	1	17	0	0.0	[]	0.07142857142857142	0.07142857142857142	0.04918032786885246	0.0	0.07654655446197431
Florian_Galatee	1366	Mœris ne voulut pas que sa fille y manquât;	225	2	9	0	0.0	[]	0.0	0.0	0.04918032786885246	0.0	0.07654655446197431
Florian_Galatee	1367	il pria les Portugais de différer leur départ.	225	3	8	0	0.0	[]	0.0	0.0	0.04918032786885246	0.0	0.07654655446197431
Florian_Galatee	1368	Élicio en tressaillit de joie;	225	4	5	0	0.0	[]	0.0	0.0	0.04918032786885246	0.0	0.07654655446197431
Florian_Galatee	1369	Galatée en conçut une heureuse espérance.	225	5	6	0	0.0	[]	0.0	0.0	0.04918032786885246	0.0	0.07654655446197431
Florian_Galatee	1370	Nisida, Blanche, Téolinde, les deux amis,	226	0	6	0	0.0	[]	0.0	0.0	0.028985507246376812	0.0	0.06845669413602481
Florian_Galatee	1371	demandèrent aux habitants du village la permission de les suivre à la vallée des tombeaux: on fut flatté de leur demande.	226	1	21	0	0.0	[]	0.024390243902439025	0.024390243902439025	0.028985507246376812	0.0	0.06845669413602481
Florian_Galatee	1372	Les quatre Portugais solliciterent la même faveur: on les refusa d'une voix unanime;	226	2	14	1	0.0714285714285714	[['voix']]	0.020833333333333332	0.020833333333333332	0.028985507246376812	0.0	0.06845669413602481
Florian_Galatee	1373	ils étaient odieux depuis que l'on savait qu'ils venaient chercher Galatée.	226	3	13	0	0.0	[]	0.06060606060606061	0.06060606060606061	0.028985507246376812	0.0	0.06845669413602481
Florian_Galatee	1374	Ils se retirèrent pleins de dépit;	226	4	6	1	0.1666666666666666	[['plein']]	0.03571428571428571	0.03571428571428571	0.028985507246376812	0.0	0.06845669413602481
Florian_Galatee	1375	et tout le monde alla se livrer au sommeil.	226	5	9	0	0.0	[]	0.06666666666666667	0.10526315789473684	0.028985507246376812	0.0	0.06845669413602481
Florian_Galatee	1376	fin du troisième livre.	227	0	4	1	0.25	[['fin']]	0.25	0.06666666666666667	0.25	0.25	0.0
Florian_Galatee	1377	LIVRE QUATRIEME.	228	0	2	0	0.0	[]	0.0	0.15384615384615385	0.0	0.0	0.0
Florian_Galatee	1378	Je me livre à toi, douce mélancolie;	229	0	7	1	0.1428571428571428	[['douce']]	0.08695652173913043	0.08	0.021834061135371178	0.0	0.04834850980026999
Florian_Galatee	1379	viens répandre sur mes derniers tableaux cette demi-teinte sombre qui plaît à tous les cœurs sensibles.	229	1	16	1	0.0625	[['sombre']]	0.08695652173913043	0.08695652173913043	0.021834061135371178	0.0	0.04834850980026999
Florian_Galatee	1380	Ne crains pas de les émouvoir: les larmes que tu fais couler sont aux âmes tendres ce que la rosée est aux fleurs.	229	2	23	2	0.0869565217391304	[['émouvoir'], ['tendre']]	0.06382978723404255	0.06382978723404255	0.021834061135371178	0.0	0.04834850980026999
Florian_Galatee	1381	Que les souvenirs que tu donnes sont attachants!	229	3	8	0	0.0	[]	0.03225806451612903	0.03225806451612903	0.021834061135371178	0.0	0.04834850980026999
Florian_Galatee	1382	quel est l'amant éloigné de sa maîtresse, l'ami privé de son ami, la mère loin de son fils, qui ne te regarde pas comme son bien le plus cher?	229	4	31	0	0.0	[]	0.0	0.0	0.021834061135371178	0.0	0.04834850980026999
Florian_Galatee	1383	Comme ils sont doux ces moments où, séparé du monde entier, seul avec son cœur et sa mémoire, on se recueille dans soi-même, ou plutôt dans l'objet aimé!	229	5	30	0	0.0	[]	0.0	0.0	0.021834061135371178	0.0	0.04834850980026999
Florian_Galatee	1384	Qu'on a de plaisir à se rappeler toutes les époques de sa tendresse!	229	6	14	0	0.0	[]	0.0	0.0	0.021834061135371178	0.0	0.04834850980026999
Florian_Galatee	1385	Le premier jour où l'on aima, le premier aveu qu'on en fit, l'air dont il fut écouté, les craintes, les soupçons, les querelles;	229	7	26	0	0.0	[]	0.0	0.0	0.021834061135371178	0.0	0.04834850980026999
Florian_Galatee	1386	tout est présent, tout se retrace avec délices.	229	8	8	0	0.0	[]	0.0	0.0	0.021834061135371178	0.0	0.04834850980026999
Florian_Galatee	1387	On jouit de nouveau des plaisirs que l'on a goûtés: on jouit même des chagrins que l'on a soufferts.	229	9	21	0	0.0	[]	0.013513513513513514	0.013513513513513514	0.021834061135371178	0.0	0.04834850980026999
Florian_Galatee	1388	Si toute espérance est ravie, si l'impitoyable mort a moissonné l'objet de notre amour, les pleurs qu'on lui donne ont des charmes; son souvenir laisse encore une impression de bonheur: on serait peut-être plus à plaindre, si l'on pouvait se consoler.	229	10	45	1	0.0222222222222222	[['pleur']]	0.015151515151515152	0.011111111111111112	0.021834061135371178	0.0	0.04834850980026999
Florian_Galatee	1389	Ainsi pensait le sage Salvador: il consacrait un jour de l'année aux larmes de la réconnaissance, de l'amour et de l'amitié.	230	0	24	0	0.0	[]	0.0	0.0136986301369863	0.024096385542168676	0.0	0.024845199749997635
Florian_Galatee	1390	Ce jour était arrivé.	230	1	4	0	0.0	[]	0.03125	0.03125	0.024096385542168676	0.0	0.024845199749997635
Florian_Galatee	1391	Salvador, revêtu de ses plus tristes ornements, se rendit sur la grande place: il vit bientôt paraître tous les habitants du village, couverts de crêpes, couronnés de cyprès, et portant des houlettes garnies de rubans noirs.	230	2	36	2	0.0555555555555555	[['triste'], ['grand']]	0.045454545454545456	0.045454545454545456	0.024096385542168676	0.0	0.024845199749997635
Florian_Galatee	1392	Salvador les rangea lui-même;	230	3	4	0	0.0	[]	0.03636363636363636	0.03636363636363636	0.024096385542168676	0.0	0.024845199749997635
Florian_Galatee	1393	et, séparant les bergers des bergères, il fit marcher toute la troupe sur deux files.	230	4	15	0	0.0	[]	0.0	0.02631578947368421	0.024096385542168676	0.0	0.024845199749997635
Florian_Galatee	1394	Du côté droit, Nisida, Blanche, Téolinde, Florise, et toutes les jeunes filles, s'avançaient sous la conduite de Galatée.	231	0	19	1	0.0526315789473684	[['droit']]	0.05128205128205128	0.037037037037037035	0.0425531914893617	0.0	0.05499370776538836
Florian_Galatee	1395	Du côté gauche, vis-à-vis d'elles, marchaient Timbrio, Fabian, Damon, Tircis, tous les jeunes garçons, ayant à leur tête Élicio.	231	1	20	1	0.05	[['tête']]	0.046511627906976744	0.046511627906976744	0.0425531914893617	0.0	0.05499370776538836
Florian_Galatee	1396	Le seul Érastre manquait.	231	2	4	0	0.0	[]	0.037037037037037035	0.037037037037037035	0.0425531914893617	0.0	0.05499370776538836
Florian_Galatee	1397	Après eux venaient	231	3	3	0	0.0	[]	0.0	0.0	0.0425531914893617	0.0	0.05499370776538836
Florian_Galatee	1398	les épouses, conduites par Silvérie; et les époux, menés par Daranio	231	4	11	0	0.0	[]	0.0	0.0	0.0425531914893617	0.0	0.05499370776538836
Florian_Galatee	1399	.	231	5	0	0	0.0	[]	0.045454545454545456	0.045454545454545456	0.0425531914893617	0.0	0.05499370776538836
Florian_Galatee	1400	Cette troupe d'heureux était presque aussi belle que la première.	231	6	11	1	0.0909090909090909	[['bel']]	0.045454545454545456	0.045454545454545456	0.0425531914893617	0.0	0.05499370776538836
Florian_Galatee	1401	Elle était suivie d'une troisième moins brillante et plus respectable;	231	7	11	0	0.0	[]	0.025	0.025	0.0425531914893617	0.0	0.05499370776538836
Florian_Galatee	1402	c'étaient les veuves et les vieillards: ils étaient guidés par Mœris, et par la mère d'Érastre.	231	8	18	0	0.0	[]	0.06521739130434782	0.06521739130434782	0.0425531914893617	0.0	0.05499370776538836
Florian_Galatee	1403	Leurs cheveux blancs n'avaient point de couronnes: leurs mains tremblantes s'appuyaient sur des bâtons noueux.	231	9	17	3	0.1764705882352941	[['cheveux'], ['blanc'], ['main']]	0.08333333333333333	0.08333333333333333	0.0425531914893617	0.0	0.05499370776538836
Florian_Galatee	1404	Hélas!	231	10	1	0	0.0	[]	0.06818181818181818	0.06818181818181818	0.0425531914893617	0.0	0.05499370776538836
Florian_Galatee	1405	c'était pour eux sur-tout que la cérémonie était intéressante: ils allaient pleurer sur la tombe d'un fils, d'une sœur, ou d'un époux.	231	11	26	0	0.0	[]	0.0	0.0	0.0425531914893617	0.0	0.05499370776538836
Florian_Galatee	1406	Salvador fermait la marche: il avait choisi cette place pour être plus près des plus malheureux.	232	0	16	0	0.0	[]	0.023809523809523808	0.014705882352941176	0.015625	0.0	0.02220577958421634
Florian_Galatee	1407	A ses côtés huit beaux enfants, vêtus de robes de lin, et couronnés de fleurs, portoient avec respect l'eau lustrale, l'encens et le feu.	232	1	26	1	0.0384615384615384	[['beau']]	0.015625	0.015625	0.015625	0.0	0.02220577958421634
Florian_Galatee	1408	Fiers de cet emploi, qui était la récompense d'une année entière de sagesse, ils s'avançaient plus gravement que les vieillards.	232	2	22	0	0.0	[]	0.020833333333333332	0.025	0.015625	0.0	0.02220577958421634
Florian_Galatee	1409	Pour arriver à la vallée des tombeaux, il fallait faire à-peu-près une lieue toujours sur la rive du Tage, et sous une voûte de verdure que formait un double rang de peupliers.	233	0	32	1	0.03125	[['double']]	0.020833333333333332	0.014285714285714285	0.030303030303030304	0.03125	0.03118023928872012
Florian_Galatee	1410	Les bergers en silence marchaient sur un gazon semé de fleurs humides encore de la rosée.	233	1	16	0	0.0	[]	0.02702702702702703	0.02702702702702703	0.030303030303030304	0.03125	0.03118023928872012
Florian_Galatee	1411	Le soleil commençait à dorer la cime des montagnes, et annonçait un des plus beaux jours de l'été: le ciel était par-tout d'azur;	233	2	26	1	0.0384615384615384	[['dorer']]	0.04285714285714286	0.04285714285714286	0.030303030303030304	0.03125	0.03118023928872012
Florian_Galatee	1412	un doux zéphyr agitait les arbres, et berçait mollement les petits oiseaux dans leurs nids: l'alouette, déjà perdue dans les airs, se faisait entendre sans être aperçu;	233	3	28	2	0.0714285714285714	[['dou'], ['petit']]	0.057971014492753624	0.057971014492753624	0.030303030303030304	0.03125	0.03118023928872012
Florian_Galatee	1413	le rossignol, fatigué d'avoir chanté toute la nuit, se ranimait pour saluer le jour;	233	4	15	1	0.0666666666666666	[['fatiguer']]	0.047619047619047616	0.047619047619047616	0.030303030303030304	0.03125	0.03118023928872012
Florian_Galatee	1414	la tourterelle et le ramier répondaient par des plaintes au chant joyeux du pivert: les fleurs exhalaient tous leurs parfums;	233	5	20	0	0.0	[]	0.015873015873015872	0.015873015873015872	0.030303030303030304	0.03125	0.03118023928872012
Florian_Galatee	1415	les poissons se jouaient sur les eaux du fleuve: toute la nature, au moment de son réveil, semblait remercier le Créateur du nouveau bienfait qu'il lui accordait.	233	6	28	0	0.0	[]	0.0	0.0	0.030303030303030304	0.03125	0.03118023928872012
Florian_Galatee	1416	Timbrio, Blanche et Nisida, peu accoutumés à ce spectacle ravissant, le contemplaient avec surprise.	234	0	14	0	0.0	[]	0.0	0.0	0.0	0.0	0.0
Florian_Galatee	1417	L'entrée de la vallée des tombeaux leur causa bientôt une nouvelle admiration.	234	1	13	0	0.0	[]	0.0	0.046153846153846156	0.0	0.0	0.0
Florian_Galatee	1418	Sur la rive de ce beau fleuve, qui roule de l'or dans son sein, est un espace d'un mille quarré, ceint de toutes parts d'une chaîne de collines: on y pénétré par une seule entrée.	235	0	38	3	0.0789473684210526	[['beau'], ['sein'], ['pénétrer']]	0.1	0.08433734939759036	0.08843537414965986	0.1019736842105263	0.06024065993043241
Florian_Galatee	1419	Ce long défilé est garni des deux côtés d'une haie de cyprès plantés en amphithéâtre, et si serrés, que leurs branches entrelacées forment un mur épais aussi haut que les montagnes.	235	1	32	4	0.125	[['long'], ['serrer'], ['éper'], ['haut']]	0.11363636363636363	0.11363636363636363	0.08843537414965986	0.1019736842105263	0.06024065993043241
Florian_Galatee	1420	Quelques rosiers, quelques jasmins sauvages, parsement de fleurs rouges et jaunes le vert sombre de ces deux murailles.	235	2	18	3	0.1666666666666666	[['rouge'], ['jaune'], ['sombre']]	0.13793103448275862	0.13793103448275862	0.08843537414965986	0.1019736842105263	0.06024065993043241
Florian_Galatee	1421	Jamais aucun troupeau ne pénétra dans cet asile;	235	3	8	1	0.125	[['pénétrer']]	0.10810810810810811	0.10810810810810811	0.08843537414965986	0.1019736842105263	0.06024065993043241
Florian_Galatee	1422	jamais le bûcheron ne porta la hache dans ce bois sacré.	235	4	11	0	0.0	[]	0.05084745762711865	0.05084745762711865	0.08843537414965986	0.1019736842105263	0.06024065993043241
Florian_Galatee	1423	Un silence profond y règne: l'on n'entend que le bruit de quelques sources qui descendent sous le feuillage, se réunissent dans un lit de mousse, et vont porter à quelques pas dans le Tage leurs petits flots argentés.	235	5	40	2	0.05	[['profond'], ['petit']]	0.0392156862745098	0.045454545454545456	0.08843537414965986	0.1019736842105263	0.06024065993043241
Florian_Galatee	1424	A l'extrémité de cette avenue est un antique sapin qui semble fermer la vallée.	236	0	15	1	0.0666666666666666	[['extrémité']]	0.045454545454545456	0.04838709677419355	0.0392156862745098	0.0333333333333333	0.041661735408389515
Florian_Galatee	1425	Sur son écorce sont gravées ces paroles:	236	1	7	0	0.0	[]	0.05714285714285714	0.05714285714285714	0.0392156862745098	0.0333333333333333	0.041661735408389515
Florian_Galatee	1426	Passant, respecte cet asile: Si ton cœur est pervers, tremble d'y pénétrer;	236	2	13	1	0.0769230769230769	[['ton']]	0.027777777777777776	0.027777777777777776	0.0392156862745098	0.0333333333333333	0.041661735408389515
Florian_Galatee	1427	Mais, s'il est vertueux, marche d'un pas tranquille, A ces tombeaux tu peux pleurer.	236	3	16	0	0.0	[]	0.034482758620689655	0.025	0.0392156862745098	0.0333333333333333	0.041661735408389515
Florian_Galatee	1428	Dans l'intérieur de la vallée, les mêmes cyprès règnent alentour.	237	0	11	0	0.0	[]	0.0	0.0	0.017241379310344827	0.0	0.025
