Florian_Galatee	369	mais tout le monde était occupé de l'étranger.	80	1	9	0	0.0	[]	0.0625	0.0625	0.043478260869565216	0.0344827586206896	0.05460390164428455
Florian_Galatee	370	On lui demandait d'achever une chanson que notre arrivée avait interrompue: il la reprit, et je tremblai qu'elle ne parlât d'amour.	80	2	24	1	0.0416666666666666	[['trembler']]	0.020833333333333332	0.020833333333333332	0.043478260869565216	0.0344827586206896	0.05460390164428455
Florian_Galatee	371	S'il est amoureux, me disais-je, il ne doit songer qu'à l'amour.	80	3	15	0	0.0	[]	0.029411764705882353	0.029411764705882353	0.043478260869565216	0.0344827586206896	0.05460390164428455
Florian_Galatee	372	Heureusement il ne chanta que les plaisirs de la vie pastorale, et les moyens de conserver les troupeaux: il ne dit rien de ce qui fait mourir les bergères.	80	4	29	1	0.0344827586206896	[['mourir']]	0.022727272727272728	0.01639344262295082	0.043478260869565216	0.0344827586206896	0.05460390164428455
Florian_Galatee	373	A peine avait-il achevé, que nous vîmes revenir ceux qui étaient allés nous couper des rameaux.	81	0	17	0	0.0	[]	0.041666666666666664	0.03896103896103896	0.023391812865497075	0.0	0.025730551403211593
Florian_Galatee	374	Ils en étaient si chargés que, marchant sur la même ligne serrés les uns contre les autres, on aurait cru voir s'approcher une petite colline toute couverte de ses arbres.	81	1	31	2	0.064516129032258	[['serrer'], ['petit']]	0.031746031746031744	0.031746031746031744	0.023391812865497075	0.0	0.025730551403211593
Florian_Galatee	375	Quand ils furent près de nous, ils entonnerent une ronde villageoise à laquelle nous répondîmes.	81	2	15	0	0.0	[]	0.03225806451612903	0.03225806451612903	0.023391812865497075	0.0	0.025730551403211593
Florian_Galatee	376	Bientôt ils déposerent leurs fardeaux, et vinrent offrir à chaque bergère une guirlande de différentes fleurs.	81	3	16	0	0.0	[]	0.018518518518518517	0.018518518518518517	0.023391812865497075	0.0	0.025730551403211593
Florian_Galatee	377	Nous acceptâmes leurs dons, et nous nous disposions à retourner au village, lorsque le plus vieux d'entre eux, nommé Éleuco, nous arrêta:	81	4	23	1	0.0434782608695652	[['vieux']]	0.015873015873015872	0.015873015873015872	0.023391812865497075	0.0	0.025730551403211593
Florian_Galatee	378	Il faut, dit-il, que chacune de vous nous récompense de nos peines, en donnant sa guirlande à celui qu'elle aimera le mieux.	81	5	24	0	0.0	[]	0.02564102564102564	0.02564102564102564	0.023391812865497075	0.0	0.025730551403211593
Florian_Galatee	379	Cela est trop juste, répondit une de mes compagnes en posant sa guirlande sur la tête de son cousin: les autres suivirent son exemple, et choisirent toutes un de leurs parents.	81	6	31	1	0.032258064516129	[['tête']]	0.014492753623188406	0.014492753623188406	0.023391812865497075	0.0	0.025730551403211593
Florian_Galatee	380	Je restai la dernière, et par bonheur je n'avais point là de cousin.	81	7	14	0	0.0	[]	0.022222222222222223	0.012195121951219513	0.023391812865497075	0.0	0.025730551403211593
Florian_Galatee	381	Je fis semblant d'être incertaine, puis m'approchant de l'inconnu, Je vous donne cette guirlande, lui dis-je, au nom de toutes mes compagnes, pour vous remercier du plaisir que nous a fait votre chanson.	82	0	37	0	0.0	[]	0.07246376811594203	0.060240963855421686	0.07246376811594203	0.078125	0.11048543456039805
Florian_Galatee	382	Je prononçai ce peu de mots tout d'une haleine, sans oser lever les yeux sur celui que je couronnois; et ma main tremblait si fort, que la guirlande pensa m'échapper.	82	1	32	5	0.15625	[['prononcer'], ['oeil'], ['main'], ['trembler'], ['fort']]	0.07246376811594203	0.0603448275862069	0.07246376811594203	0.078125	0.11048543456039805
Florian_Galatee	383	L'étranger reçut mon bienfait avec réconnaissance et modestie: il saisit l'instant où personne ne pouvait l'entendre pour me dire à voix basse: Je vous ai payé bien cher la guirlande que j'ai reçue: vous ne m'avez donné que des fleurs; et moi....	83	0	47	2	0.0425531914893617	[['voix'], ['bas']]	0.0392156862745098	0.08433734939759036	0.05263157894736842	0.059738134206219304	0.04457776306404068
Florian_Galatee	384	Il ne put achever.	83	1	4	0	0.0	[]	0.04838709677419355	0.04838709677419355	0.05263157894736842	0.059738134206219304	0.04457776306404068
Florian_Galatee	385	Mes compagnes me pressaient de partir: je ne lui répondis pas;	83	2	11	1	0.0909090909090909	[['presser']]	0.07142857142857142	0.07142857142857142	0.05263157894736842	0.059738134206219304	0.04457776306404068
Florian_Galatee	386	mais je le regardai le plus long-temps qu'il me fut possible.	83	3	13	1	0.0769230769230769	[['long']]	0.08823529411764706	0.08823529411764706	0.05263157894736842	0.059738134206219304	0.04457776306404068
Florian_Galatee	387	Je ne m'occupai que de lui pendant le chemin;	83	4	10	1	0.1	[['pendant']]	0.06060606060606061	0.06060606060606061	0.05263157894736842	0.059738134206219304	0.04457776306404068
Florian_Galatee	388	je ne songeai qu'à lui quand je fus arrivée.	83	5	10	0	0.0	[]	0.05	0.038461538461538464	0.05263157894736842	0.059738134206219304	0.04457776306404068
Florian_Galatee	389	Le lendemain, jour de la fête, après avoir adoré l'Éternel, tous les habitants du village et des environs se rassemblerent sur la grande place pour s'exercer à différents jeux champêtres.	84	0	32	1	0.03125	[['grand']]	0.01639344262295082	0.014084507042253521	0.020833333333333332	0.0	0.053511975111188444
Florian_Galatee	390	Une troupe de jeunes gens, fiers de leur âge, de leur force, de leur agilité, se présente pour disputer le prix de la lutte, du saut, de la course.	84	1	29	0	0.0	[]	0.014705882352941176	0.014705882352941176	0.020833333333333332	0.0	0.053511975111188444
Florian_Galatee	391	Chacun d'eux paraît devoir l'emporter.	84	2	7	0	0.0	[]	0.0	0.0	0.020833333333333332	0.0	0.053511975111188444
Florian_Galatee	392	Je ne m'intéressois que pour un seul; mes vœux furent exaucés.	84	3	12	0	0.0	[]	0.0	0.0	0.020833333333333332	0.0	0.053511975111188444
Florian_Galatee	393	Artidore, c'était le nom de mon étranger, fut vainqueur dans tous les jeux, fut applaudi par tout le monde.	84	4	20	0	0.0	[]	0.02564102564102564	0.02564102564102564	0.020833333333333332	0.0	0.053511975111188444
Florian_Galatee	394	Alanio, disait-on, court mieux que Silvain;	84	5	7	1	0.1428571428571428	[['court']]	0.05128205128205128	0.05128205128205128	0.020833333333333332	0.0	0.053511975111188444
Florian_Galatee	395	Marsille est plus fort que Lisandre: mais Artidore l'emporte sur tous.	84	6	12	1	0.0833333333333333	[['fort']]	0.045454545454545456	0.045454545454545456	0.020833333333333332	0.0	0.053511975111188444
Florian_Galatee	396	J'écoutais ces paroles, et n'osais pas les redire: mais je faisais semblant de ne pas les avoir entendues, pour me les faire répéter.	84	7	25	0	0.0	[]	0.02702702702702703	0.04878048780487805	0.020833333333333332	0.0	0.053511975111188444
Florian_Galatee	397	Ce beau jour finit.	85	0	4	1	0.25	[['beau']]	0.05555555555555555	0.023255813953488372	0.05343511450381679	0.0	0.08502782730966656
Florian_Galatee	398	Le lendemain nous nous rassemblâmes une douzaine de jeunes filles, l'élite du village.	85	1	14	0	0.0	[]	0.034482758620689655	0.034482758620689655	0.05343511450381679	0.0	0.08502782730966656
Florian_Galatee	399	Précédées d'une musette, et nous tenant toutes par la main	85	2	11	0	0.0	[]	0.0	0.0	0.05343511450381679	0.0	0.08502782730966656
Florian_Galatee	400	, nous allâmes gagner en dansant une prairie où nous trouvâmes Artidore avec tous nos jeunes gens.	85	3	16	0	0.0	[]	0.0	0.0	0.05343511450381679	0.0	0.08502782730966656
Florian_Galatee	401	Dès qu'ils nous virent, ils coururent se mêler à notre danse;	85	4	12	0	0.0	[]	0.0	0.0	0.05343511450381679	0.0	0.08502782730966656
Florian_Galatee	402	chaque berger sépara deux bergères, et rompit notre chaîne pour la doubler.	85	5	12	0	0.0	[]	0.057692307692307696	0.057692307692307696	0.05343511450381679	0.0	0.08502782730966656
Florian_Galatee	403	Alors les flûtes, les tambourins, se joignirent à notre musette: la danse devint plus vive, et mon bonheur voulut que ma main se trouvât dans celle d'Artidore.	85	6	28	3	0.1071428571428571	[['joindre'], ['vif'], ['main']]	0.07547169811320754	0.07547169811320754	0.05343511450381679	0.0	0.08502782730966656
Florian_Galatee	404	Le saisissement que cette main me causa pensa me faire rompre la chaîne.	85	7	13	1	0.0769230769230769	[['main']]	0.0967741935483871	0.0967741935483871	0.05343511450381679	0.0	0.08502782730966656
Florian_Galatee	405	Artidore s'en aperçut, et m'enleva fortement en me pressant contre son sein: le remède était pire que le mal.	85	8	21	2	0.0952380952380952	[['presser'], ['sein']]	0.08823529411764706	0.06976744186046512	0.05343511450381679	0.0	0.08502782730966656
Florian_Galatee	406	La danse finie, nous nous assîmes sur l'herbe.	86	0	9	0	0.0	[]	0.0	0.04878048780487805	0.044444444444444446	0.0	0.05555555555555555
Florian_Galatee	407	Tout le monde desiroit d'entendre chanter Artidore: il y consentit.	86	1	11	0	0.0	[]	0.0	0.0	0.044444444444444446	0.0	0.05555555555555555
Florian_Galatee	408	Je n'ai jamais oublié sa chanson;	86	2	7	0	0.0	[]	0.05555555555555555	0.05555555555555555	0.044444444444444446	0.0	0.05555555555555555
Florian_Galatee	409	et je vais vous la répéter, malgré les pleurs que je donnerai peut-être à un si doux souvenir.	86	3	18	2	0.1111111111111111	[['pleur'], ['dou']]	0.08	0.08771929824561403	0.044444444444444446	0.0	0.05555555555555555
Florian_Galatee	410	Jamais nous ne verrions briller un jour serein, Toujours par la douleur l'âme serait flétrie, Si l'amour ne venait consoler notre vie, Et semer quelques fleurs sur ce triste chemin.	87	0	32	3	0.09375	[['briller'], ['consoler'], ['triste']]	0.07692307692307693	0.08771929824561403	0.015706806282722512	0.0	0.02209708691207961
Florian_Galatee	411	Amour, l'on doit bénir tes chaînes:	87	1	7	0	0.0	[]	0.05660377358490566	0.05660377358490566	0.015706806282722512	0.0	0.02209708691207961
Florian_Galatee	412	Si deux amants ont à souffrir, Ils n'ont que la moitié des peines;	87	2	14	0	0.0	[]	0.0	0.0	0.015706806282722512	0.0	0.02209708691207961
Florian_Galatee	413	Et tu sais doubler leur plaisir.	87	3	6	0	0.0	[]	0.0	0.0	0.015706806282722512	0.0	0.02209708691207961
Florian_Galatee	414	Il n'est point de malheur pour un amant aimé;	87	4	10	0	0.0	[]	0.0	0.0	0.015706806282722512	0.0	0.02209708691207961
Florian_Galatee	415	D'un seul mot, d'un souris, dépend sa destinée:	87	5	10	0	0.0	[]	0.0	0.0	0.015706806282722512	0.0	0.02209708691207961
Florian_Galatee	416	Le sort voudrait	87	6	3	0	0.0	[]	0.0	0.0	0.015706806282722512	0.0	0.02209708691207961
Florian_Galatee	417	en vain	87	7	2	0	0.0	[]	0.0	0.0	0.015706806282722512	0.0	0.02209708691207961
Florian_Galatee	418	la rendre infortunée;	87	8	3	0	0.0	[]	0.0	0.0	0.015706806282722512	0.0	0.02209708691207961
Florian_Galatee	419	On lui dit, je vous aime, et son cœur est calmé.	87	9	11	0	0.0	[]	0.0	0.0	0.015706806282722512	0.0	0.02209708691207961
Florian_Galatee	420	Amour, l'on doit bénir tes chaînes:	87	10	7	0	0.0	[]	0.0	0.0	0.015706806282722512	0.0	0.02209708691207961
Florian_Galatee	421	Si deux amants ont à souffrir, Ils n'ont que la moitié des peines;	87	11	14	0	0.0	[]	0.0	0.0	0.015706806282722512	0.0	0.02209708691207961
Florian_Galatee	422	Et tu sais doubler leur plaisir.	87	12	6	0	0.0	[]	0.0	0.0	0.015706806282722512	0.0	0.02209708691207961
Florian_Galatee	423	L'autre jour deux amants, à l'ombre d'un tilleul, Sur leur hymen futur se contaient leurs alarmes;	87	13	19	0	0.0	[]	0.0	0.0	0.015706806282722512	0.0	0.02209708691207961
Florian_Galatee	424	J'entendis qu'ils disaient, en essuyant leurs larmes, Souffrir deux est plus doux que d'être heureux tout seul.	87	14	20	0	0.0	[]	0.0	0.0	0.015706806282722512	0.0	0.02209708691207961
Florian_Galatee	425	Amour, l'on doit bénir tes chaînes:	87	15	7	0	0.0	[]	0.0	0.0	0.015706806282722512	0.0	0.02209708691207961
Florian_Galatee	426	Si deux amants ont à souffrir, Ils n'ont que la moitié des peines;	87	16	14	0	0.0	[]	0.0	0.0	0.015706806282722512	0.0	0.02209708691207961
Florian_Galatee	427	Et tu sais doubler leur plaisir.	87	17	6	0	0.0	[]	0.0	0.02857142857142857	0.015706806282722512	0.0	0.02209708691207961
Florian_Galatee	428	Il était temps de retourner au village: chaque berger offrit le bras à sa bergère.	88	0	15	1	0.0666666666666666	[['bras']]	0.041666666666666664	0.03333333333333333	0.02702702702702703	0.0	0.040912097355700464
Florian_Galatee	429	Soit hasard, soit adresse, Artidore me donna la main.	88	1	9	0	0.0	[]	0.019230769230769232	0.019230769230769232	0.02702702702702703	0.0	0.040912097355700464
Florian_Galatee	430	Nous marchions en silence, sans oser nous regarder; mais chacun de nous deux observait l'instant où l'autre ne pouvait le voir, pour lui jeter un coup-d'œil;	88	2	28	0	0.0	[]	0.02	0.02	0.02702702702702703	0.0	0.040912097355700464
Florian_Galatee	431	et dès que nos yeux se rencontraient, ils se baissaient vers la terre.	88	3	13	1	0.0769230769230769	[['oeil']]	0.028169014084507043	0.028169014084507043	0.02702702702702703	0.0	0.040912097355700464
Florian_Galatee	432	Enfin je lui dis: Artidore, le peu de jours que vous nous donnez vous sembleront des années, si vous avez laissé dans votre village quelqu'un qui vous soit cher.	88	4	30	1	0.0333333333333333	[['luire']]	0.031746031746031744	0.031746031746031744	0.02702702702702703	0.0	0.040912097355700464
Florian_Galatee	433	Je donnerais tout ce que je possède, me répondit-il, pour que ces heureux jours durassent autant que ma vie.	88	5	20	0	0.0	[]	0.02	0.02	0.02702702702702703	0.0	0.040912097355700464
Florian_Galatee	434	=	88	6	0	0	0.0	[]	0.0	0.0	0.02702702702702703	0.0	0.040912097355700464
Florian_Galatee	435	Vous aimez donc bien les fêtes?	88	7	6	0	0.0	[]	0.0	0.0	0.02702702702702703	0.0	0.040912097355700464
Florian_Galatee	436	= Ah!	88	8	1	0	0.0	[]	0.0	0.0	0.02702702702702703	0.0	0.040912097355700464
Florian_Galatee	437	ce ne sont pas les fêtes...	88	9	6	0	0.0	[]	0.0	0.0	0.02702702702702703	0.0	0.040912097355700464
Florian_Galatee	438	Il fit un soupir;	88	10	4	0	0.0	[]	0.05555555555555555	0.05555555555555555	0.02702702702702703	0.0	0.040912097355700464
Florian_Galatee	439	je soupirai aussi: il me serra la main;	88	11	8	1	0.125	[['serrer']]	0.05	0.05	0.02702702702702703	0.0	0.040912097355700464
Florian_Galatee	440	je ne crois pas le lui avoir rendu.	88	12	8	0	0.0	[]	0.0625	0.06382978723404255	0.02702702702702703	0.0	0.040912097355700464
Florian_Galatee	441	Nous en étions là, lorsque le vieux Éleuco, dont on respectait tous les avis, proposa de chanter une ronde, pour rentrer dans le village aussi gaiement que nous en étions sortis.	89	0	31	2	0.064516129032258	[['vieux'], ['rentrer']]	0.05555555555555555	0.045454545454545456	0.015267175572519083	0.0	0.01862420223192339
Florian_Galatee	442	Je m'en chargeai volontiers;	89	1	5	0	0.0	[]	0.03636363636363636	0.03636363636363636	0.015267175572519083	0.0	0.01862420223192339
Florian_Galatee	443	et saisissant cette occasion de donner quelques avis à Artidore, voici la ronde que je chantai en le regardant:	89	2	19	0	0.0	[]	0.0	0.0	0.015267175572519083	0.0	0.01862420223192339
Florian_Galatee	444	Voulez-vous être heureux amant?	89	3	5	0	0.0	[]	0.0	0.0	0.015267175572519083	0.0	0.01862420223192339
Florian_Galatee	445	Soyez guidé par le mystère;	89	4	5	0	0.0	[]	0.0	0.0	0.015267175572519083	0.0	0.01862420223192339
Florian_Galatee	446	Celui qui sait le mieux se taire En amour est le plus savant.	89	5	13	0	0.0	[]	0.0	0.0	0.015267175572519083	0.0	0.01862420223192339
Florian_Galatee	447	Pour être aimé soyez discret;	89	6	5	0	0.0	[]	0.0	0.0	0.015267175572519083	0.0	0.01862420223192339
Florian_Galatee	448	La clef des cœurs, c'est le secret (1).	89	7	10	0	0.0	[]	0.0	0.0	0.015267175572519083	0.0	0.01862420223192339
Florian_Galatee	449	En vain de l'amour on médit, Le secret épure sa flamme;	89	8	12	0	0.0	[]	0.0	0.0	0.015267175572519083	0.0	0.01862420223192339
Florian_Galatee	450	L'amour est la vertu de l'âme Quand le mystère le conduit.	89	9	13	0	0.0	[]	0.0	0.0	0.015267175572519083	0.0	0.01862420223192339
Florian_Galatee	451	Pour être aimé soyez discret;	89	10	5	0	0.0	[]	0.0	0.0	0.015267175572519083	0.0	0.01862420223192339
Florian_Galatee	452	La clef des cœurs, c'est le secret.	89	11	8	0	0.0	[]	0.0	0.037037037037037035	0.015267175572519083	0.0	0.01862420223192339
Florian_Galatee	453	Souvent un seul mot peut ravir Le prix d'une longue constance; (1)	90	0	14	1	0.0714285714285714	[['long']]	0.05263157894736842	0.037037037037037035	0.013333333333333334	0.0	0.023809523809523798
Florian_Galatee	454	Cachez jusqu'à votre souffrance	90	1	5	0	0.0	[]	0.041666666666666664	0.041666666666666664	0.013333333333333334	0.0	0.023809523809523798
Florian_Galatee	455	Pour savoir cacher le plaisir.	90	2	5	0	0.0	[]	0.0	0.0	0.013333333333333334	0.0	0.023809523809523798
Florian_Galatee	456	Pour être aimé soyez discret;	90	3	5	0	0.0	[]	0.0	0.0	0.013333333333333334	0.0	0.023809523809523798
Florian_Galatee	457	La clef des cœurs, c'est le secret.	90	4	8	0	0.0	[]	0.0	0.0	0.013333333333333334	0.0	0.023809523809523798
Florian_Galatee	458	Ne confiez qu'à votre cœur Vos succès et votre victoire;	90	5	11	0	0.0	[]	0.0	0.0	0.013333333333333334	0.0	0.023809523809523798
Florian_Galatee	459	Tout ce que l'on perd de la gloire Retourne au profit du bonheur.	90	6	14	0	0.0	[]	0.0	0.0	0.013333333333333334	0.0	0.023809523809523798
Florian_Galatee	460	Pour être aimé soyez discret;	90	7	5	0	0.0	[]	0.0	0.0	0.013333333333333334	0.0	0.023809523809523798
Florian_Galatee	461	La clef des cœurs, c'est le secret.	90	8	8	0	0.0	[]	0.0	0.0	0.013333333333333334	0.0	0.023809523809523798
Florian_Galatee	462	J'ignore si ma chanson plut à Artidore;	91	0	8	0	0.0	[]	0.0	0.0	0.02	0.0	0.015193428136569093
Florian_Galatee	463	mais il en profita.	91	1	4	0	0.0	[]	0.02	0.02	0.02	0.0	0.015193428136569093
Florian_Galatee	464	Pendant tout le séjour qu'il fit avec nous, il mit tant de circonspection, tant de prudence dans les soins qu'il me rendit, que la langue la plus maligne ne trouva pas un seul mot à dire.	91	2	38	1	0.0263157894736842	[['pendant']]	0.023809523809523808	0.015873015873015872	0.02	0.0	0.015193428136569093
Florian_Galatee	465	J'étais certaine d'être aimée, et je n'avais pu cacher à mon amant que mon cœur était à lui.	92	0	21	0	0.0	[]	0.0	0.01098901098901099	0.0	0.0	0.0
Florian_Galatee	466	Nous étions convenus qu'il retournerait à son village, comme il l'avait annoncé, et que peu de jours après il enverrait un ami de sa famille me demander à mon père.	92	1	32	0	0.0	[]	0.0	0.0	0.0	0.0	0.0
Florian_Galatee	467	Nous étions sûrs tous deux que nos parents consentiraient à ce mariage: tout semblait d'accord avec nos projets, quand, deux jours avant le départ d'Artidore, mon malheur fit revenir ma sœur jumelle d'un village voisin où elle était allée voir une de mes tantes.	92	2	47	0	0.0	[]	0.0	0.011111111111111112	0.0	0.0	0.0
Florian_Galatee	468	Cette sœur, par une fatalité bien rare, est mon portrait vivant.	93	0	11	1	0.0909090909090909	[['rare']]	0.11428571428571428	0.04878048780487805	0.06896551724137931	0.0909090909090909	0.06461637162587872
Florian_Galatee	469	Son visage, sa taille, sa voix, tout est si semblable entre nous deux, que nos parents nous donnaient des habits différents pour nous reconnaître.	93	1	24	3	0.125	[['visage'], ['taille'], ['voix']]	0.06896551724137931	0.06896551724137931	0.06896551724137931	0.0909090909090909	0.06461637162587872
Florian_Galatee	470	Mais nos caractères sont bien loin de cette ressemblance; et si nos cœurs avaient été jumeaux, je ne verserois pas tant de larmes.	93	2	23	0	0.0	[]	0.06382978723404255	0.043478260869565216	0.06896551724137931	0.0909090909090909	0.06461637162587872
Florian_Galatee	471	Dès le lendemain de son retour, ma sœur fit sortir le troupeau, et le conduisit au pâturage avant que je fusse éveillée.	94	0	22	0	0.0	[]	0.0	0.0	0.020134228187919462	0.0	0.023168198930994553
Florian_Galatee	472	Je voulus aller la rejoindre;	94	1	5	0	0.0	[]	0.0	0.0	0.020134228187919462	0.0	0.023168198930994553
Florian_Galatee	473	mais mon père me retint toute la journée: il fallut renoncer à l'espérance de voir Artidore.	94	2	17	0	0.0	[]	0.0	0.0	0.020134228187919462	0.0	0.023168198930994553
Florian_Galatee	474	Le soir ma sœur revint, et me dit avec mystère qu'elle avait à me parler de quel-que chose d'important.	94	3	22	0	0.0	[]	0.0	0.0	0.020134228187919462	0.0	0.023168198930994553
Florian_Galatee	475	Le cœur me battit;	94	4	4	0	0.0	[]	0.0	0.0	0.020134228187919462	0.0	0.023168198930994553
Florian_Galatee	476	je devinai mon malheur.	94	5	4	0	0.0	[]	0.0	0.0	0.020134228187919462	0.0	0.023168198930994553
Florian_Galatee	477	J'allai m'enfermer avec elle: jugez de ce que je devins en entendant ces paroles:	94	6	16	0	0.0	[]	0.014925373134328358	0.014925373134328358	0.020134228187919462	0.0	0.023168198930994553
Florian_Galatee	478	Ce matin, ma sœur, je conduisais le troupeau sur les rives de l'Hénarès, lorsque j'ai vu venir à moi un jeune berger qui m'est inconnu: il m'a saluée, et m'a pris la main avec une familiarité qui m'a surprise et offensée.	94	7	47	1	0.0212765957446808	[['main']]	0.023529411764705882	0.023529411764705882	0.020134228187919462	0.0	0.023168198930994553
Florian_Galatee	479	Mon silence, et l'altération qu'il a dû remarquer sur mon visage, n'ont pas été capables d'arrêter ses transports.	94	8	22	1	0.0454545454545454	[['visage']]	0.03333333333333333	0.03333333333333333	0.020134228187919462	0.0	0.023168198930994553
Florian_Galatee	480	Eh quoi! ma belle Téolinde, m'a-t-il dit, ne reconnaissez-vous pas celui qui vous aime plus que lui-même?	94	9	21	1	0.0476190476190476	[['bel']]	0.03614457831325301	0.03614457831325301	0.020134228187919462	0.0	0.023168198930994553
Florian_Galatee	481	J'ai bien vu, ma sœur, que j'étais prise pour vous; mais comme votre réputation m'est chère, et qu'un berger aussi hardi pourrait lui faire grand tort, j'ai voulu vous débarrasser pour jamais de cet importun.	94	10	40	1	0.025	[['grand']]	0.027777777777777776	0.027777777777777776	0.020134228187919462	0.0	0.023168198930994553
Florian_Galatee	482	Je me suis gardée de lui dire qu'il se trompait;	94	11	11	0	0.0	[]	0.038461538461538464	0.038461538461538464	0.020134228187919462	0.0	0.023168198930994553
Florian_Galatee	483	et, prenant le ton que Téolinde aurait dû toujours avoir, j'ai répondu à ses discours avec une fierté, avec un dédain qui l'ont fort étonné;	94	12	27	2	0.074074074074074	[['ton'], ['fort']]	0.0425531914893617	0.0425531914893617	0.020134228187919462	0.0	0.023168198930994553
Florian_Galatee	484	ce qui ne vous justifie pas trop, ma sœur.	94	13	9	0	0.0	[]	0.043478260869565216	0.043478260869565216	0.020134228187919462	0.0	0.023168198930994553
Florian_Galatee	485	Mais, heureusement pour vous, mes paroles lui ont fait impression;	94	14	10	0	0.0	[]	0.0	0.0	0.020134228187919462	0.0	0.023168198930994553
Florian_Galatee	486	il m'a quittée en me nommant perfide, ingrate; et je crois pouvoir vous répondre que vous ne le reverrez plus.	94	15	21	0	0.0	[]	0.0	0.024390243902439025	0.020134228187919462	0.0	0.023168198930994553
Florian_Galatee	487	Vous comprenez, aimables bergères, combien je souffrais pendant ce récit.	95	0	10	1	0.1	[['pendant']]	0.03125	0.018867924528301886	0.025806451612903226	0.0	0.0349842003126171
Florian_Galatee	488	J'aurois donné la moitié de ma vie pour être au lendemain, pour aller à l'instant même détromper mon malheureux amant.	95	1	22	0	0.0	[]	0.04	0.04	0.025806451612903226	0.0	0.0349842003126171
Florian_Galatee	489	Ah! que la nuit me parut longue! les étoiles brillaient encore, que j'étais déjà dans les champs.	95	2	18	1	0.0555555555555555	[['long']]	0.02040816326530612	0.02040816326530612	0.025806451612903226	0.0	0.0349842003126171
Florian_Galatee	490	Jamais mes pauvres brebis n'avaient marché si vite.	95	3	9	0	0.0	[]	0.02564102564102564	0.02564102564102564	0.025806451612903226	0.0	0.0349842003126171
Florian_Galatee	491	J'arrive à l'endroit où j'avais coutume de trouver Artidore;	95	4	12	0	0.0	[]	0.0	0.0	0.025806451612903226	0.0	0.0349842003126171
Florian_Galatee	492	je le cherche, je l'appelle, je parcours le rivage, le bois, la campagne;	95	5	14	0	0.0	[]	0.0	0.0	0.025806451612903226	0.0	0.0349842003126171
Florian_Galatee	493	je ne trouve point Artidore.	95	6	5	0	0.0	[]	0.0	0.0	0.025806451612903226	0.0	0.0349842003126171
Florian_Galatee	494	Reviens, m'écriai-je; reviens, mon bien aimé: voici la véritable Téolinde, celle qui ne vit que pour t'aimer.	95	7	20	0	0.0	[]	0.0	0.0	0.025806451612903226	0.0	0.0349842003126171
Florian_Galatee	495	L'écho répète mes paroles;	95	8	5	0	0.0	[]	0.0	0.0	0.025806451612903226	0.0	0.0349842003126171
Florian_Galatee	496	et Artidore ne vient point.	95	9	5	0	0.0	[]	0.044444444444444446	0.044444444444444446	0.025806451612903226	0.0	0.0349842003126171
Florian_Galatee	497	Enfin, lassée de tant de recherches, je vais m'asseoir au pied d'un saule, et j'attends que le jour soit plus grand, pour parcourir de nouveau tous les lieux que j'avais parcourus.	95	10	35	2	0.0571428571428571	[['pied'], ['grand']]	0.05	0.031746031746031744	0.025806451612903226	0.0	0.0349842003126171
Florian_Galatee	498	A peine l'aube du matin laissait distinguer les objets, que j'aperçois des caractères tracés sur l'écorce d'un peuplier blanc.	96	0	23	0	0.0	[]	0.025974025974025976	0.03571428571428571	0.025974025974025976	0.0185185185185185	0.02618914004394618
