Fourqueux_Zely	326	Nassès a souvent tenu des discours peu “respectueux de nos Loix et de notre “Maître: j'aurai soin de les divulguer.	52	14	23	0	0.0	[]	0.0	0.0	0.03294117647058824	0.0	0.036568070676660264
Fourqueux_Zely	327	Il ne peut éviter la mort:	52	15	6	0	0.0	[]	0.03636363636363636	0.03636363636363636	0.03294117647058824	0.0	0.036568070676660264
Fourqueux_Zely	328	“alors je t'offre ma main: je saurai “m'élever à un rang digne de moi, “et ta grandeur suivra la mienne“.	52	16	26	2	0.0769230769230769	[['main'], ['ton']]	0.0625	0.06060606060606061	0.03294117647058824	0.0	0.036568070676660264
Fourqueux_Zely	329	O	53	0	1	0	0.0	[]	0.0	0.07142857142857142	0.012987012987012988	0.0	0.026243194054073903
Fourqueux_Zely	330	monstre!	53	1	1	0	0.0	[]	0.0	0.0	0.012987012987012988	0.0	0.026243194054073903
Fourqueux_Zely	331	ô comble d'horreurs!	53	2	4	0	0.0	[]	0.0	0.0	0.012987012987012988	0.0	0.026243194054073903
Fourqueux_Zely	332	s'écria Zély en fuyant rapidement.	53	3	6	0	0.0	[]	0.0	0.0	0.012987012987012988	0.0	0.026243194054073903
Fourqueux_Zely	333	O malheureux	53	4	2	0	0.0	[]	0.0	0.0	0.012987012987012988	0.0	0.026243194054073903
Fourqueux_Zely	334	Nassès!	53	5	1	0	0.0	[]	0.07142857142857142	0.07142857142857142	0.012987012987012988	0.0	0.026243194054073903
Fourqueux_Zely	335	Que ton sort est funeste, et que tu le mérites peu!	53	6	11	1	0.0909090909090909	[['ton']]	0.038461538461538464	0.038461538461538464	0.012987012987012988	0.0	0.026243194054073903
Fourqueux_Zely	336	Se peut-il que le masque de la Vertu cache des trahisons aussi noires?	53	7	14	0	0.0	[]	0.03125	0.03125	0.012987012987012988	0.0	0.026243194054073903
Fourqueux_Zely	337	Faut-il que je sois destiné moi	53	8	7	0	0.0	[]	0.0	0.0	0.012987012987012988	0.0	0.026243194054073903
Fourqueux_Zely	338	-même à troubler tous les lieux que j'habite?	53	9	9	0	0.0	[]	0.0	0.0	0.012987012987012988	0.0	0.026243194054073903
Fourqueux_Zely	339	Fuyons de ce séjour dangereux;	53	10	5	0	0.0	[]	0.0	0.0	0.012987012987012988	0.0	0.026243194054073903
Fourqueux_Zely	340	mais auparavant tirons mon ami d'une erreur fatale: mettons en sûreté des jours si chers.	53	11	16	0	0.0	[]	0.0	0.030303030303030304	0.012987012987012988	0.0	0.026243194054073903
Fourqueux_Zely	341	Accablé des plus tristes réflexions, Zély s'était enfermé dans son appartement.	54	0	12	1	0.0833333333333333	[['triste']]	0.07142857142857142	0.045454545454545456	0.030456852791878174	0.03005226480836235	0.031456699110652075
Fourqueux_Zely	342	Nassès le fit prier de se joindre à quelques amis qui s'étaient rassemblés chez lui.	54	1	16	1	0.0625	[['joindre']]	0.06818181818181818	0.06818181818181818	0.030456852791878174	0.03005226480836235	0.031456699110652075
Fourqueux_Zely	343	Encore troublé de ses idées noires, il vit avec étonnement régner la joie et la tranquilité.	54	2	16	1	0.0625	[['noir']]	0.06060606060606061	0.06060606060606061	0.030456852791878174	0.03005226480836235	0.031456699110652075
Fourqueux_Zely	344	Jamais	54	3	1	0	0.0	[]	0.044444444444444446	0.044444444444444446	0.030456852791878174	0.03005226480836235	0.031456699110652075
Fourqueux_Zely	345	l'Epouse de Nassès n'avait paru plus tendre ni plus satisfaite: il passa une soirée charmante, et réfléchit toute la nuit sur la fausseté incompréhensible des femmes.	54	4	28	1	0.0357142857142857	[['tendre']]	0.04	0.04	0.030456852791878174	0.03005226480836235	0.031456699110652075
Fourqueux_Zely	346	Le lendemain il se trouva incertain de ce qu'il devait faire: ses yeux avaient démenti ce qu'il avait entendu.	54	5	21	1	0.0476190476190476	[['oeil']]	0.02666666666666667	0.02666666666666667	0.030456852791878174	0.03005226480836235	0.031456699110652075
Fourqueux_Zely	347	Il croyait dans des moment avoir fait un songe funeste: tantôt il trouvait affreux de laisser par son silence la vie de son ami en danger;	54	6	26	0	0.0	[]	0.014925373134328358	0.014925373134328358	0.030456852791878174	0.03005226480836235	0.031456699110652075
Fourqueux_Zely	348	tantôt il trouvait cruel d'anéantir, par un avis dépourvu de toute vraisemblance, un bonheur dont Nassès paraissait si touché.	54	7	20	0	0.0	[]	0.0	0.0	0.030456852791878174	0.03005226480836235	0.031456699110652075
Fourqueux_Zely	349	Dans cette incertitude, il résolut d'attendre, de peur de l'assassiner en croyant le servir.	54	8	16	0	0.0	[]	0.012987012987012988	0.012987012987012988	0.030456852791878174	0.03005226480836235	0.031456699110652075
Fourqueux_Zely	350	Plusieurs jours se passèrent: Zély observait tout avec attention, et ne voyait rien que la paix, qu'une union toujours tendre dont chaque jour semblait augmenter les plaisirs: il évitait avec soin de se trouver seul avec l'Epouse de Nassès.	54	9	41	1	0.024390243902439	[['tendre']]	0.017543859649122806	0.012048192771084338	0.030456852791878174	0.03005226480836235	0.031456699110652075
Fourqueux_Zely	351	Un jour elle le fit demander: il fut tenté de la fuir, mais il aimait: il raisonna et vôla auprès d'elle pour servir son ami.	55	0	26	0	0.0	[]	0.0	0.010309278350515464	0.011450381679389313	0.0	0.019745953841316062
Fourqueux_Zely	352	„Il est bien doux, lui “dit-elle, d'avoir un ami tel que vous: “comment, avec si peu d'expérience, “a-t-on tant de discrétion?	55	1	30	0	0.0	[]	0.018691588785046728	0.018691588785046728	0.011450381679389313	0.0	0.019745953841316062
Fourqueux_Zely	353	Je vous ai “mis à une épreuve assez forte: il est “temps de dissiper les soupçons que “vous pourriez avoir conçus: avec “plus d'usage du monde vous auriez “vu à l'instant à quel point ma conduite dément ce que ma bouche “vous disait.	55	2	51	2	0.0392156862745098	[['fort'], ['bouche']]	0.01834862385321101	0.01834862385321101	0.011450381679389313	0.0	0.019745953841316062
Fourqueux_Zely	354	J'ai peur que vous “n'ayez pas assez bien vu, et votre “estime m'est chère.--Qu'entends-je “et que vous me rendez heureux!	55	3	28	0	0.0	[]	0.017857142857142856	0.017857142857142856	0.011450381679389313	0.0	0.019745953841316062
Fourqueux_Zely	355	“s'écria Zély: il n'est donc pas vrai “que Nassès vous soit odieux, et que “je sois..... Arrêtez, lui dit-elle, l'exclamation ne serait pas galante.--Ah! pardonnez Madame;	55	4	33	0	0.0	[]	0.0	0.0	0.011450381679389313	0.0	0.019745953841316062
Fourqueux_Zely	356	dit Zély: “le bonheur de mon ami me touche “si sensiblement que ma raison en est “troublée.--Ce trouble est plus “obligeant pour lui que pour moi, “répondit-elle: nous étions convenus “ensemble de tout ce que je vous ai “dit, et nous ne voulions que vous “éprouver: votre raison peut cesser “de s'alarmer, nous ne verrons point “aujourd'hui Nassés;	55	5	70	0	0.0	[]	0.007874015748031496	0.007874015748031496	0.011450381679389313	0.0	0.019745953841316062
Fourqueux_Zely	357	mais ce qui me “console de son absence, c'est qu'un “ami aussi tendre le remplace auprès “de moi“.	55	6	24	1	0.0416666666666666	[['tendre']]	0.010638297872340425	0.010526315789473684	0.011450381679389313	0.0	0.019745953841316062
Fourqueux_Zely	358	Zély	56	0	1	0	0.0	[]	0.0	0.03571428571428571	0.010416666666666666	0.0	0.008547008547008532
Fourqueux_Zely	359	, comblé de joie	56	1	3	0	0.0	[]	0.0	0.0	0.010416666666666666	0.0	0.008547008547008532
Fourqueux_Zely	360	, s'engagea avec l'Epouse de Nassès dans une conversation très-animée.	56	2	12	0	0.0	[]	0.0	0.0	0.010416666666666666	0.0	0.008547008547008532
Fourqueux_Zely	361	Ils parlèrent long	56	3	3	0	0.0	[]	0.0	0.0	0.010416666666666666	0.0	0.008547008547008532
Fourqueux_Zely	362	-	56	4	0	0	0.0	[]	0.0	0.0	0.010416666666666666	0.0	0.008547008547008532
Fourqueux_Zely	363	temps de l'absent	56	5	4	0	0.0	[]	0.0	0.0	0.010416666666666666	0.0	0.008547008547008532
Fourqueux_Zely	364	, ensuite d'eux	56	6	3	0	0.0	[]	0.0	0.0	0.010416666666666666	0.0	0.008547008547008532
Fourqueux_Zely	365	-mêmes, des douceurs de l'amitié, des plaisirs de l'amour: une conversation où le cœur a plus de part que l'esprit, devient dangereuse entre deux personnes qui s'aiment.	56	7	31	0	0.0	[]	0.0136986301369863	0.0136986301369863	0.010416666666666666	0.0	0.008547008547008532
Fourqueux_Zely	366	Zély, loué sur sa vertu, sur sa figure, sur ses grâces, s'égara: il oublia que notre ami n'est que la moitié de nous-mêmes: il crut sans doute être en effet Nassès et remplit réellement sa place.	56	8	39	1	0.0256410256410256	[['figure']]	0.014285714285714285	0.010752688172043012	0.010416666666666666	0.0	0.008547008547008532
Fourqueux_Zely	367	Dans un cœur vertueux qui s'égare, le remords est bien près du crime: l'ivresse de Zély ne dura qu'un instant.	57	0	23	0	0.0	[]	0.0	0.014084507042253521	0.011494252873563218	0.0	0.021113952437237196
Fourqueux_Zely	368	Le sentiment qui y succéda fut un étonnement stupide;	57	1	9	0	0.0	[]	0.01818181818181818	0.01818181818181818	0.011494252873563218	0.0	0.021113952437237196
Fourqueux_Zely	369	mais ce qui le surprit le plus, ce fut de voir l'Epouse de Nassès le regarder avec un long éclat de rire.	57	2	23	1	0.0434782608695652	[['long']]	0.030303030303030304	0.030303030303030304	0.011494252873563218	0.0	0.021113952437237196
Fourqueux_Zely	370	„	57	3	1	0	0.0	[]	0.02040816326530612	0.02040816326530612	0.011494252873563218	0.0	0.021113952437237196
Fourqueux_Zely	371	Ami généreux, lui dit-elle, “quand on est prodigue de sa raison, “il se trouve des moment essentiels “où elle nous manque.	57	4	25	0	0.0	[]	0.02127659574468085	0.02127659574468085	0.011494252873563218	0.0	0.021113952437237196
Fourqueux_Zely	372	Vous avez “bien de la vertu, il est impossible de “vous corrompre, mais assez aisé de “vous séduire.	57	5	21	1	0.0476190476190476	[['aiser']]	0.009615384615384616	0.009615384615384616	0.011494252873563218	0.0	0.021113952437237196
Fourqueux_Zely	373	Je vous aimais, je vous “l'ai dit, vous n'avez pas voulu m'entendre, vous m'avez forcé à vous “le prouver: remettez-vous et ne “craignez rien de tragique: votre ami “Nassès en sera quitte pour ce malheur: il n'est pas le seul Epoux chéri “à qui il soit arrivé.	57	6	58	0	0.0	[]	0.010752688172043012	0.010752688172043012	0.011494252873563218	0.0	0.021113952437237196
Fourqueux_Zely	374	Vous avez gardé “mon secret: songez que celui-ci est “le vôtre“.	57	7	14	0	0.0	[]	0.0	0.0	0.011494252873563218	0.0	0.021113952437237196
Fourqueux_Zely	375	Loin de calmer Zély, ce discours ne fit qu'affliger sa vertu, et révolter son amour-propre.	58	0	17	0	0.0	[]	0.0	0.0	0.022082018927444796	0.0	0.04385422516439045
Fourqueux_Zely	376	Il quitta brusquement cette femme infidèle et courut s'enfermer et raisonner.	58	1	12	0	0.0	[]	0.0	0.0	0.022082018927444796	0.0	0.04385422516439045
Fourqueux_Zely	377	Quelque mécontent qu'il fût de lui-même, sa conduite à l'égard de Nassès l'embarrassait encore plus.	58	2	18	0	0.0	[]	0.02631578947368421	0.02631578947368421	0.022082018927444796	0.0	0.04385422516439045
Fourqueux_Zely	378	De quel front le verrai-je? disait-il.	58	3	8	1	0.125	[['front']]	0.029411764705882353	0.029411764705882353	0.022082018927444796	0.0	0.04385422516439045
Fourqueux_Zely	379	Ma honte me trahira, que lui dirai-je?	58	4	8	0	0.0	[]	0.02127659574468085	0.02127659574468085	0.022082018927444796	0.0	0.04385422516439045
Fourqueux_Zely	380	J'ai été discret une fois, et j'ai eu raison: répéter des discours en l'air, troubler son bonheur pour les rêveries d'une femme, c'eût été une folie.	58	5	31	0	0.0	[]	0.012195121951219513	0.012195121951219513	0.022082018927444796	0.0	0.04385422516439045
Fourqueux_Zely	381	On ne fait point périr son mari; mais ici ce sont des faits, sa femme est infidèle, je partage son crime, les Dieux sont témoins que ce n'est pas ma faute; mais à ses yeux je n'en serai pas plus innocent.	58	6	43	1	0.0232558139534883	[['oeil']]	0.031914893617021274	0.031914893617021274	0.022082018927444796	0.0	0.04385422516439045
Fourqueux_Zely	382	Fuyons pour jamais ses regards, mais conservons son estime: qu'il me croie un homme faible, sans esprit, sans expérience;	58	7	20	2	0.1	[['regard'], ['faible']]	0.043478260869565216	0.043478260869565216	0.022082018927444796	0.0	0.04385422516439045
Fourqueux_Zely	383	mais non un séducteur, un traître.	58	8	6	0	0.0	[]	0.05263157894736842	0.05263157894736842	0.022082018927444796	0.0	0.04385422516439045
Fourqueux_Zely	384	Qu'il me déteste, qu'il m'accable, s'il le veut;	58	9	12	0	0.0	[]	0.0	0.0	0.022082018927444796	0.0	0.04385422516439045
Fourqueux_Zely	385	mais qu'il ne puisse que me plaindre et jamais me mépriser.	58	10	12	0	0.0	[]	0.030303030303030304	0.030303030303030304	0.022082018927444796	0.0	0.04385422516439045
Fourqueux_Zely	386	Un accablement profond succéda aux murmures de sa raison.	58	11	9	1	0.1111111111111111	[['profond']]	0.05	0.05	0.022082018927444796	0.0	0.04385422516439045
Fourqueux_Zely	387	L'excès de ses remords produisit le même effet que le calme de la bonne conscience, il dormit longtemps.	58	12	19	1	0.0526315789473684	[['calme']]	0.05	0.05	0.022082018927444796	0.0	0.04385422516439045
Fourqueux_Zely	388	Sa raison vint à son réveil l'assiéger avec la même vivacité.	58	13	12	0	0.0	[]	0.019230769230769232	0.019230769230769232	0.022082018927444796	0.0	0.04385422516439045
Fourqueux_Zely	389	Que je le plains! disait-il: il aime sa femme, il est haï: il a confiance en elle, elle en abusera.	58	14	21	0	0.0	[]	0.0	0.0	0.022082018927444796	0.0	0.04385422516439045
Fourqueux_Zely	390	Qui m'a dit que je suis le premier qu'elle ait aimé?	58	15	13	0	0.0	[]	0.0	0.0	0.022082018927444796	0.0	0.04385422516439045
Fourqueux_Zely	391	Peut-être l'amour de Nassès le rend ridicule: peut-être est-elle capable d'attenter à ses jours?	58	16	17	0	0.0	[]	0.0	0.0	0.022082018927444796	0.0	0.04385422516439045
Fourqueux_Zely	392	Il faut le tirer d'une erreur dangereuse: il ne faut le quitter qu'en lui donnant une marque d'amitié: je rougirai, je le fais;	58	17	26	0	0.0	[]	0.017857142857142856	0.017857142857142856	0.022082018927444796	0.0	0.04385422516439045
Fourqueux_Zely	393	mais mes intentions ont toujours été pures et Nassès en jugera comme moi.	58	18	13	1	0.0769230769230769	[['pur']]	0.02564102564102564	0.01818181818181818	0.022082018927444796	0.0	0.04385422516439045
Fourqueux_Zely	394	Le même sentiment qui inspirait ce parti à Zély, lui fit juger l'exécution très-pressée.	59	0	16	0	0.0	[]	0.0	0.02702702702702703	0.009708737864077669	0.0	0.01736627780139402
Fourqueux_Zely	395	Il fit demander un entretien secret à Nassès.	59	1	8	0	0.0	[]	0.023809523809523808	0.023809523809523808	0.009708737864077669	0.0	0.01736627780139402
Fourqueux_Zely	396	Celui-ci accourut à l'instant, et le trouva triste et déconcerté: il lui en demanda la cause.	59	2	18	1	0.0555555555555555	[['triste']]	0.029411764705882353	0.029411764705882353	0.009708737864077669	0.0	0.01736627780139402
Fourqueux_Zely	397	Puis-je ne pas succomber à ma douleur?	59	3	8	0	0.0	[]	0.027777777777777776	0.027777777777777776	0.009708737864077669	0.0	0.01736627780139402
Fourqueux_Zely	398	répondit-il: il faut que je vous quitte, Nassès, et en vous quittant, je suis coupable envers vous.--Expliquez-moi cette exclamation tragique, dit Nassès: auriez-vous brûlé ma maison, pris mon bien, ou séduit ma femme?--Ce propos redoubla le trouble de Zély, qui perdit toute contenance.	59	4	46	1	0.0217391304347826	[['brûler']]	0.011235955056179775	0.011235955056179775	0.009708737864077669	0.0	0.01736627780139402
Fourqueux_Zely	399	Quoi! reprit son ami, vous êtes confondu, vous ne repondez point!--Comment le pourrais-je? répondit-il: je n'ai point séduit votre femme, mais vous n'en êtes pas plus heureux, ni moi plus innocent.	59	5	35	0	0.0	[]	0.011494252873563218	0.011494252873563218	0.009708737864077669	0.0	0.01736627780139402
Fourqueux_Zely	400	Ce n'est pas tout encore.....	59	6	6	0	0.0	[]	0.0	0.0	0.009708737864077669	0.0	0.01736627780139402
Fourqueux_Zely	401	Eh! de grâce, s'écria Nassès, épargnez-moi le reste de cette étrange confidence: j'en sais déjà trop.	59	7	19	0	0.0	[]	0.0	0.0	0.009708737864077669	0.0	0.01736627780139402
Fourqueux_Zely	402	Mais dites-moi, au nom des Dieux, est-ce ignorance, est-ce méchanceté qui vous engage à m'assassiner de ce cruel propos?	59	8	23	0	0.0	[]	0.0	0.0	0.009708737864077669	0.0	0.01736627780139402
Fourqueux_Zely	403	Quel mal me faisait votre crime, si je l'avais ignoré;	59	9	11	0	0.0	[]	0.0	0.0	0.009708737864077669	0.0	0.01736627780139402
Fourqueux_Zely	404	et quel autre que vous dans la Nature entière pouvait s'aviser de m'en instruire.	59	10	16	0	0.0	[]	0.0	0.01694915254237288	0.009708737864077669	0.0	0.01736627780139402
Fourqueux_Zely	405	Zély s'aperçut, mais trop tard, que sa raison lui avait fait faire une sottise: il tomba au genoux de son ami, et lui fit pitié à force de pleurer sa faute;	60	0	32	1	0.03125	[['genou']]	0.02631578947368421	0.018518518518518517	0.009174311926605505	0.0	0.011250330289774296
Fourqueux_Zely	406	mais il ne la réparait pas.	60	1	6	0	0.0	[]	0.02040816326530612	0.02040816326530612	0.009174311926605505	0.0	0.011250330289774296
Fourqueux_Zely	407	Nassès, sentant que son mal était sans remède, prit son parti.	60	2	11	0	0.0	[]	0.0	0.0	0.009174311926605505	0.0	0.011250330289774296
Fourqueux_Zely	408	Levez-vous mon ami, lui dit-il: le mal que vous vous reprochez le plus est le moindre.	60	3	18	0	0.0	[]	0.0	0.0	0.009174311926605505	0.0	0.011250330289774296
Fourqueux_Zely	409	Je connais votre cœur, vous n'avez sûrement pas eu le projet de m'offenser.	60	4	15	0	0.0	[]	0.0	0.0	0.009174311926605505	0.0	0.011250330289774296
Fourqueux_Zely	410	Votre simplicité m'a fait tort;	60	5	6	0	0.0	[]	0.012658227848101266	0.012658227848101266	0.009174311926605505	0.0	0.011250330289774296
Fourqueux_Zely	411	mais si je vous haïssais, je serais injuste: assurez-moi seulement (car votre sincérité me fait trembler) que vous n'avez mis que moi dans la confidence: et si cela est, restez tranquillement avec nous: vous serez sans doute plus sage une autre fois: si vous ne l'étiez pas, vous n'avez plus rien à me faire.	60	6	58	1	0.0172413793103448	[['trembler']]	0.009708737864077669	0.009708737864077669	0.009174311926605505	0.0	0.011250330289774296
Fourqueux_Zely	412	Confondu d'avoir fait en si peu de temps deux sottises aussi marquées, Zély lui protesta qu'il n'ôserait jamais reparaître à ses yeux.--C'est apparemment, lui dit Nassès, la seule façon de m'affliger qui vous reste.	60	7	39	0	0.0	[]	0.007692307692307693	0.007692307692307693	0.009174311926605505	0.0	0.011250330289774296
Fourqueux_Zely	413	A la bonne-heure, je ne veux pas vous faire violence: soyez plus heureux ailleurs: comptez-moi toujours au nombre de vos amis, mais sur-tout gardez-vous d'être aussi sincère une autre fois.	60	8	33	0	0.0	[]	0.0	0.0	0.009174311926605505	0.0	0.011250330289774296
Fourqueux_Zely	414	Séparé de Nassès, Zély fut long	61	0	6	0	0.0	[]	0.0	0.0	0.012658227848101266	0.0	0.013385189851274182
Fourqueux_Zely	415	-temps absorbé dans ses réflexions: il ne pouvait pardonner à sa raison le mauvais tour qu'elle venait de lui jouer; et, calculant tout ce qu'un mauvais raisonnement lui avait fait perdre d'avantages	61	1	35	0	0.0	[]	0.0196078431372549	0.0196078431372549	0.012658227848101266	0.0	0.013385189851274182
Fourqueux_Zely	416	, il crut devoir choisir l'état où on est le moins à portée de raisonner: il jugea que le plus brillant était le plus convenable à ses vues: il choisit à l'instant un Palais magnifique, y transporta ses richesses, le remplit d'Esclaves superbement vétus, de meubles précieux, et pour remplacer un ami, il fit un grand nombre de connaissances.	61	2	61	2	0.0327868852459016	[['magnifique'], ['grand']]	0.015625	0.015625	0.012658227848101266	0.0	0.013385189851274182
Fourqueux_Zely	417	Il avait des qualités aimables, dépensait beaucoup et procurait des plaisirs: tout ce que l'Empire avait de Grands et d'Agréables, le rechercha par curiosité et s'y attacha par goût.	61	3	32	0	0.0	[]	0.018018018018018018	0.018018018018018018	0.012658227848101266	0.0	0.013385189851274182
Fourqueux_Zely	418	Le tourbillon d'une vie amusante lui ôta le temps de raisonner: dès ce moment tout lui réussit;	61	4	18	0	0.0	[]	0.0	0.0	0.012658227848101266	0.0	0.013385189851274182
Fourqueux_Zely	419	cependant les plaisirs altérèrent sa santé.	61	5	6	0	0.0	[]	0.0	0.0	0.012658227848101266	0.0	0.013385189851274182
Fourqueux_Zely	420	Il eut un accès de vapeurs et de raison: il se reprocha d'exister sans avoir d'état, et sans être utile à sa patrie: il desira un emploi à la Cour, et en obtint un considérable, sans avoir eu le temps de le solliciter.	62	0	45	0	0.0	[]	0.0	0.0	0.006779661016949152	0.0	0.02554658323673351
Fourqueux_Zely	421	Sa nouvelle grandeur l'enchanta quelques jours: il s'aperçut bien-tôt qu'il avait perdu sa liberté, acquis des ennemis et fait des mécontent.	62	1	24	0	0.0	[]	0.0	0.0	0.006779661016949152	0.0	0.02554658323673351
Fourqueux_Zely	422	Il regretta le temps où il avait été libre;	62	2	9	0	0.0	[]	0.0	0.0	0.006779661016949152	0.0	0.02554658323673351
Fourqueux_Zely	423	mais, chargé de devoirs, il résolut de les remplir sans songer à lui, ou à l'opinion publique.	62	3	18	0	0.0	[]	0.0	0.0	0.006779661016949152	0.0	0.02554658323673351
Fourqueux_Zely	424	Ce qu'il avait conservé de vertu le rendait clair-voyant sur les vices d'autrui.	62	4	15	0	0.0	[]	0.0	0.0	0.006779661016949152	0.0	0.02554658323673351
Fourqueux_Zely	425	La fausseté, la flatterie, la bassesse, l'intérêt, toutes les vertus de Cour excitaient son indignation.	62	5	16	0	0.0	[]	0.022727272727272728	0.022727272727272728	0.006779661016949152	0.0	0.02554658323673351
Fourqueux_Zely	426	S'il la marquait à quelques Grands vertueux en apparence, on en riait.	62	6	13	1	0.0769230769230769	[['grand']]	0.02564102564102564	0.02564102564102564	0.006779661016949152	0.0	0.02554658323673351
Fourqueux_Zely	427	Entreprendrez-vous, lui disait-on, la réforme du Genre-Humain?	62	7	10	0	0.0	[]	0.02	0.02	0.006779661016949152	0.0	0.02554658323673351
Fourqueux_Zely	428	Laissez les hommes tels qu'ils sont: soyez comme eux, si vous êtes sage.--Quoi! disait-il quelquefois, serais-je donc assez lâche pour suivre cette absurde morale?	62	8	27	0	0.0	[]	0.0	0.0	0.006779661016949152	0.0	0.02554658323673351
Fourqueux_Zely	429	Que les Souverains sont malheureux!	62	9	5	0	0.0	[]	0.0	0.0	0.006779661016949152	0.0	0.02554658323673351
Fourqueux_Zely	430	L'erreur qui les environne assez souvent, éloigne d'eux la vérité: ceux qui doivent les servir, les trompent quelquefois, parce qu'ils sont eux	62	10	25	0	0.0	[]	0.0	0.0	0.006779661016949152	0.0	0.02554658323673351
Fourqueux_Zely	431	-mêmes abusés et trompés.	62	11	4	0	0.0	[]	0.0	0.0	0.006779661016949152	0.0	0.02554658323673351
Fourqueux_Zely	432	Les Rois et leurs Ministres sont vertueux dans le cœur: une espèce de fatalité semble s'opposer aux effets de leur bienveillance, et leur administration paraît injuste: le nombre et la nécessité des circonstances formentun voile impénétrable, qui les empêche de voir et de connaître les moyens qui rempliraient leurs vœux pour le bien de l'Humanité.	62	12	57	0	0.0	[]	0.0	0.0	0.006779661016949152	0.0	0.02554658323673351
Fourqueux_Zely	433	Témoin de tant d'obstacles	62	13	5	0	0.0	[]	0.0	0.0	0.006779661016949152	0.0	0.02554658323673351
Fourqueux_Zely	434	, je veux les faire cesser.	62	14	5	0	0.0	[]	0.0	0.0	0.006779661016949152	0.0	0.02554658323673351
Fourqueux_Zely	435	La vérité est sacrée;	62	15	4	0	0.0	[]	0.045454545454545456	0.045454545454545456	0.006779661016949152	0.0	0.02554658323673351
Fourqueux_Zely	436	quand elle est dure, elle déplaît: je vais l'adoucir sans la déguiser.	62	16	13	1	0.0769230769230769	[['dur']]	0.058823529411764705	0.015151515151515152	0.006779661016949152	0.0	0.02554658323673351
Fourqueux_Zely	437	Zély, appelé auprès de son Souverain, oublia ses projets de modération: l'activité de son zèle lui inspira des expressions dont l'énergie parut amère et insultante au Prince, qui, pour punir son audace et son peu de respect, lui retira son emploi et le chassa de sa Cour.	63	0	49	0	0.0	[]	0.0	0.012987012987012988	0.0	0.0	0.0
Fourqueux_Zely	438	Le jour suivant, on vint dire à Zély qu'un ami demandait à le voir.	64	0	15	0	0.0	[]	0.0	0.0	0.008403361344537815	0.0	0.02335882960755782
Fourqueux_Zely	439	Je ne croyais pas en avoir aujourd'hui, dit-il: amenez moi cet homme singulier.	64	1	14	0	0.0	[]	0.0	0.0	0.008403361344537815	0.0	0.02335882960755782
Fourqueux_Zely	440	Il parut: c'était Nassès.	64	2	5	0	0.0	[]	0.0	0.0	0.008403361344537815	0.0	0.02335882960755782
Fourqueux_Zely	441	Est-ce une illusion?	64	3	4	0	0.0	[]	0.0	0.0	0.008403361344537815	0.0	0.02335882960755782
Fourqueux_Zely	442	dit Zély confondu: vous vous dites mon ami le jour où ce titre est une injure.	64	4	16	0	0.0	[]	0.0	0.0	0.008403361344537815	0.0	0.02335882960755782
Fourqueux_Zely	443	Vous avez donc oublié ce que j'ai fait, et vous ignorez ce qui m'est arrivé?--Je sais votre disgrâce, dit Nassès;	64	5	22	0	0.0	[]	0.0	0.0	0.008403361344537815	0.0	0.02335882960755782
Fourqueux_Zely	444	et c'est ce qui m'amène.	64	6	7	0	0.0	[]	0.018867924528301886	0.018867924528301886	0.008403361344537815	0.0	0.02335882960755782
Fourqueux_Zely	445	Vous m'avez donné des avis, quand vous avez cru qu'ils m'étaient utiles: je viens vous consoler, quand vous en avez besoin.	64	7	24	1	0.0416666666666666	[['consoler']]	0.019230769230769232	0.019230769230769232	0.008403361344537815	0.0	0.02335882960755782
Fourqueux_Zely	446	Vous avez passé plus d'un an dans la grandeur, j'étais au-dessous de vous et je vous étais inutile.	64	8	21	0	0.0	[]	0.02	0.02	0.008403361344537815	0.0	0.02335882960755782
Fourqueux_Zely	447	Votre malheur nous rend égaux;	64	9	5	0	0.0	[]	0.0	0.0	0.008403361344537815	0.0	0.02335882960755782
