Fourqueux_Zely	690	Le désirs de me “consoler attirait auprès de moi tous “nos jeunes Citoyens: on disait que “j'avais quelque beauté: mes Consolateurs devinrent mes Amans, “tous desiraient obtenir ma main: on “me pressait de choisir un Epoux, “j'eus la complaisance de céder.	95	5	49	3	0.0612244897959183	[['consoler'], ['main'], ['presser']]	0.037037037037037035	0.037037037037037035	0.021052631578947368	0.0	0.03186407779630088
Fourqueux_Zely	691	J'aimais Salem, il eut la préférence: “ses Rivaux soupirerent, mais ils ne “pûrent blâmer mon choix.	95	6	19	0	0.0	[]	0.034482758620689655	0.034482758620689655	0.021052631578947368	0.0	0.03186407779630088
Fourqueux_Zely	692	Je ne “vous ferai point son portrait: votre “aventure prouve à quel point vous “lui ressemblez.	95	7	19	0	0.0	[]	0.015151515151515152	0.015151515151515152	0.021052631578947368	0.0	0.03186407779630088
Fourqueux_Zely	693	Vous avez la même “figure et sans doute les mêmes vertus: en me rappellent sa perte, vous “me faites presque douter qu'elle soit “réelle.	95	8	28	1	0.0357142857142857	[['figure']]	0.013157894736842105	0.013157894736842105	0.021052631578947368	0.0	0.03186407779630088
Fourqueux_Zely	694	J'étais unie à lui depuis deux “ans: mon bonheur aurait été parfait, “s'il y en avait en amour, mais ma “félicité a été troublée.	95	9	29	0	0.0	[]	0.013333333333333334	0.013333333333333334	0.021052631578947368	0.0	0.03186407779630088
Fourqueux_Zely	695	J'ai vu changer Salem, je l'ai vu me traiter “avec indifférence et bientôt avec mépris.	95	10	18	0	0.0	[]	0.043478260869565216	0.043478260869565216	0.021052631578947368	0.0	0.03186407779630088
Fourqueux_Zely	696	J'avais depuis l'enfance une “tendre amitié pour un jeune Parent “plein de vertus et d'une figure charmante;	95	11	22	3	0.1363636363636363	[['tendre'], ['plein'], ['figure']]	0.061224489795918366	0.061224489795918366	0.021052631578947368	0.0	0.03186407779630088
Fourqueux_Zely	697	mon Epoux m'en a fait un “crime.	95	12	9	0	0.0	[]	0.07894736842105263	0.07894736842105263	0.021052631578947368	0.0	0.03186407779630088
Fourqueux_Zely	698	Je ne l'avais jamais vu jaloux:	95	13	7	0	0.0	[]	0.0	0.0	0.021052631578947368	0.0	0.03186407779630088
Fourqueux_Zely	699	“je n'ai pas douté que cette jalousie “feinte ne couvrît quelque mystère, “et bientôt j'ai été éclaircie.	95	14	22	0	0.0	[]	0.0	0.0	0.021052631578947368	0.0	0.03186407779630088
Fourqueux_Zely	700	Il aimait “une jeune Beauté de cette Ville:	95	15	9	0	0.0	[]	0.0	0.0	0.021052631578947368	0.0	0.03186407779630088
Fourqueux_Zely	701	“j'aurais peut-être eu la force de voir “sans chagrin mon Epoux heureux “avec une autre; mais son bonheur “était hors de toute vraisemblance.	95	16	28	0	0.0	[]	0.0	0.0	0.021052631578947368	0.0	0.03186407779630088
Fourqueux_Zely	702	“	95	17	1	0	0.0	[]	0.029850746268656716	0.029850746268656716	0.021052631578947368	0.0	0.03186407779630088
Fourqueux_Zely	703	La vertu est plus naturelle aux femmes de notre Ville, que la coquetterie à celles de la Capitale de ce “grand Empire: j'ai désiré d'épargner “à Salem les tourments d'un amour “malheureux.	95	18	38	2	0.0526315789473684	[['naturel'], ['grand']]	0.022988505747126436	0.022988505747126436	0.021052631578947368	0.0	0.03186407779630088
Fourqueux_Zely	704	Il est d'ailleurs une justice qu'on se doit à soi-même: j'avais “à tous égards tant d'avantages sur “l'objet aimé, que j'aurais cru trahir “mon Epoux en ne m'opposant pas à “un échange où il perdait trop.	95	19	48	0	0.0	[]	0.025210084033613446	0.025210084033613446	0.021052631578947368	0.0	0.03186407779630088
Fourqueux_Zely	705	Je me “suis flattée de le ramener par tout ce “que la raison et la tendresse ont de “plus puissant: l'amour est aveugle et “a trompé mes espérances.	95	20	33	1	0.0303030303030303	[['puissant']]	0.01098901098901099	0.01098901098901099	0.021052631578947368	0.0	0.03186407779630088
Fourqueux_Zely	706	Salem m'a “abandonnée, ily a environ un mois:	95	21	10	0	0.0	[]	0.012345679012345678	0.012345679012345678	0.021052631578947368	0.0	0.03186407779630088
Fourqueux_Zely	707	“il a enlevé la jeune personne qu'il “aimait, et s'est embarqué avec elle “pour aller vivre dans d'autres climats, “mais il semble que le Ciel ait voulu “punir sa perfidie.	95	22	38	0	0.0	[]	0.0	0.0	0.021052631578947368	0.0	0.03186407779630088
Fourqueux_Zely	708	Son vaisseau a fait “naufrage: un Esclave fidèle que “j'avais envoyé sur ses pas, ne m'a “rapporté que l'affreuse nouvelle de “sa perte.	95	23	30	0	0.0	[]	0.0	0.009615384615384616	0.021052631578947368	0.0	0.03186407779630088
Fourqueux_Zely	709	“Quoique nos lois n'ordonnent “pas positivement de mourir avec son “Epoux, l'honneur et la mode ne me “permettraient pas décemment de “lui survivre, si cette nouvelle était “publique.	96	0	36	1	0.0277777777777777	[['mourir']]	0.03125	0.02127659574468085	0.024630541871921183	0.0	0.04502866987386139
Fourqueux_Zely	710	Des intérêts pressant m'ont “obligée de la cacher jusqu'à ce moment: d'ailleurs je n'avais pas encore “perdu toute espérance de le revoir:	96	1	28	1	0.0357142857142857	[['presser']]	0.05063291139240506	0.05063291139240506	0.024630541871921183	0.0	0.04502866987386139
Fourqueux_Zely	711	“il eût été triste de mourir sans être “bien convaincu de la nécessité.	96	2	15	2	0.1333333333333333	[['triste'], ['mourir']]	0.047619047619047616	0.047619047619047616	0.024630541871921183	0.0	0.04502866987386139
Fourqueux_Zely	712	“N'allez pas croire cependant que ce “soit par faiblesse que je suis attachée “à la vie.	96	3	20	0	0.0	[]	0.02631578947368421	0.02631578947368421	0.024630541871921183	0.0	0.04502866987386139
Fourqueux_Zely	713	Lorsque vous êtes arrivé “dans ces lieux, le nom de Salem a “retenti de toutes parts: tout m'annonçait son retour, j'ai suivi la “foule qui vous accompagnait, j'ai “cru voir en effet mon Epoux.	96	4	41	0	0.0	[]	0.0	0.0	0.024630541871921183	0.0	0.04502866987386139
Fourqueux_Zely	714	Quand “vous avez rejeté ce titre, j'ai cru “	96	5	11	0	0.0	[]	0.015384615384615385	0.015384615384615385	0.024630541871921183	0.0	0.04502866987386139
Fourqueux_Zely	715	que Salem me désavouait, et j'ai “pensé en mourir de douleur	96	6	13	1	0.0769230769230769	[['mourir']]	0.041666666666666664	0.041666666666666664	0.024630541871921183	0.0	0.04502866987386139
Fourqueux_Zely	716	.	96	7	0	0	0.0	[]	0.05	0.05	0.024630541871921183	0.0	0.04502866987386139
Fourqueux_Zely	717	Bientôt “j'ai reconnu mon erreur;	96	8	7	0	0.0	[]	0.0	0.0	0.024630541871921183	0.0	0.04502866987386139
Fourqueux_Zely	718	mais j'ai “pris le parti de feindre, persuadée “que vous consentiriez à passer pour “mon Epoux pour sauver ce que j'ai “de plus cher au monde.	96	9	32	0	0.0	[]	0.0	0.02666666666666667	0.024630541871921183	0.0	0.04502866987386139
Fourqueux_Zely	719	“Madame, dit Zély, j'avoue qu'il “est bien fâcheux de laisser mourir “une jeune et belle femme, sur-tout “quand, pour la sauver, il ne faut que “se croire son Mari;	97	0	36	2	0.0555555555555555	[['mourir'], ['bel']]	0.045454545454545456	0.02631578947368421	0.02973977695167286	0.0	0.028372514562846493
Fourqueux_Zely	720	mais mettez-vous “à ma place“.	97	1	8	0	0.0	[]	0.036585365853658534	0.036585365853658534	0.02973977695167286	0.0	0.028372514562846493
Fourqueux_Zely	721	En cet endroit de sa réponse, l'Epouse de Salem laissa par hasard tomber son voile, et découvrit une physionomie si touchante, de si beaux yeux, tant de grâces et d'agrément, que Zély interdit perdit la parole.	97	2	38	1	0.0263157894736842	[['oeil']]	0.011764705882352941	0.011764705882352941	0.02973977695167286	0.0	0.028372514562846493
Fourqueux_Zely	722	Elle l'avertit, qu'il avait commencé à parler, il reprit avec trouble: „Imaginez un malheureux trahi et “dépouillé par un ami, trompé et “chassé indignement par sa Maitresse, “réduit à détester le Genre-Humain.	97	3	39	0	0.0	[]	0.01904761904761905	0.01904761904761905	0.02973977695167286	0.0	0.028372514562846493
Fourqueux_Zely	723	“Vous n'avez encore qu'une faible “idée de mes infortunes: jugez par “l'état de mon cœur, si je suis digne “de vous.	97	4	28	1	0.0357142857142857	[['faible']]	0.014705882352941176	0.014705882352941176	0.02973977695167286	0.0	0.028372514562846493
Fourqueux_Zely	724	Votte	97	5	1	0	0.0	[]	0.04081632653061224	0.04081632653061224	0.02973977695167286	0.0	0.028372514562846493
Fourqueux_Zely	725	histoire me touche “beaucoup: cette prodigieuse ressemblance qui trompe tous les yeux, “me flatterait, s'il était possible.	97	6	20	1	0.05	[['oeil']]	0.02702702702702703	0.02702702702702703	0.02973977695167286	0.0	0.028372514562846493
Fourqueux_Zely	726	Tout “le monde me croit votre Mari, “peut-être daigneriez-vous le croire “vous	97	7	16	0	0.0	[]	0.02702702702702703	0.02702702702702703	0.02973977695167286	0.0	0.028372514562846493
Fourqueux_Zely	727	-même;	97	8	1	0	0.0	[]	0.0	0.0	0.02973977695167286	0.0	0.028372514562846493
Fourqueux_Zely	728	il serait bien doux de “vous faire illusion;	97	9	9	0	0.0	[]	0.0	0.0	0.02973977695167286	0.0	0.028372514562846493
Fourqueux_Zely	729	mais ce titre “d'Epoux me fait frémir.	97	10	9	0	0.0	[]	0.0	0.0	0.02973977695167286	0.0	0.028372514562846493
Fourqueux_Zely	730	Je sens combien je dois vous plaindre.	97	11	7	0	0.0	[]	0.0	0.0	0.02973977695167286	0.0	0.028372514562846493
Fourqueux_Zely	731	Ah, Madame!	97	12	2	0	0.0	[]	0.0	0.0	0.02973977695167286	0.0	0.028372514562846493
Fourqueux_Zely	732	la pitié n'est pas faite pour “vous, mais je ne suis pas fait pour “l'amour;	97	13	19	0	0.0	[]	0.0	0.0	0.02973977695167286	0.0	0.028372514562846493
Fourqueux_Zely	733	cependant vous allez mourir.	97	14	4	0	0.0	[]	0.05454545454545454	0.05454545454545454	0.02973977695167286	0.0	0.028372514562846493
Fourqueux_Zely	734	En disant ces derniers mots, la force l'abandonnait, sa voix devenait tremblante, ses yeux étaient pleins de larmes, il s'aperçut de son trouble et se tut, craignant de l'augmenter.	97	15	32	3	0.09375	[['voix'], ['oeil'], ['plein']]	0.08333333333333333	0.07017543859649122	0.02973977695167286	0.0	0.028372514562846493
Fourqueux_Zely	735	„Jusqu'ici, dit la belle Affligée, “je n'ai rien exigé de vous: la pitié “me flatterait peu;	98	0	21	1	0.0476190476190476	[['bel']]	0.04	0.07017543859649122	0.021505376344086023	0.0	0.021083477628324576
Fourqueux_Zely	736	méfiez-vous de “	98	1	4	0	0.0	[]	0.037037037037037035	0.037037037037037035	0.021505376344086023	0.0	0.021083477628324576
Fourqueux_Zely	737	l'Amour,	98	2	2	0	0.0	[]	0.019230769230769232	0.019230769230769232	0.021505376344086023	0.0	0.021083477628324576
Fourqueux_Zely	738	il est peut-être plus près “de vous que vous ne pensez: vous “prenez beaucoup sur vous en me “parlant, les grands efforts sont toujours une preuve de faiblesse: je “vous ai instruit de mes malheurs, “je veux vous révéler mon secret.	98	3	46	1	0.0217391304347826	[['grand']]	0.014705882352941176	0.014705882352941176	0.021505376344086023	0.0	0.021083477628324576
Fourqueux_Zely	739	“Quand vous m'aurez entendu, vous “serez plus en état de vous rendre “compte de vos sentiment.	98	4	20	0	0.0	[]	0.015151515151515152	0.024096385542168676	0.021505376344086023	0.0	0.021083477628324576
Fourqueux_Zely	740	“Quand j'ai appris la triste destinée “de Salem, j'ai résolu de le rejoindre:	99	0	17	1	0.0588235294117647	[['triste']]	0.02702702702702703	0.017543859649122806	0.008403361344537815	0.0	0.015825191193791215
Fourqueux_Zely	741	“je me trouvais malheureuse de lui “survivre, et criminelle de différer “l'instant qui devait nous réunir.	99	1	20	0	0.0	[]	0.021739130434782608	0.021739130434782608	0.008403361344537815	0.0	0.015825191193791215
Fourqueux_Zely	742	“C'était le premier mouvement, mais “hélas!	99	2	9	0	0.0	[]	0.0	0.0	0.008403361344537815	0.0	0.015825191193791215
Fourqueux_Zely	743	on ne se voit point chez les “morts: mes amis m'auraient perdue, “mon Epoux n'aurait rien gagné:	99	3	21	0	0.0	[]	0.0	0.0	0.008403361344537815	0.0	0.015825191193791215
Fourqueux_Zely	744	“je suis jeune, j'ai un fils, malheureux et unique gage de l'amour de “Salem: j'ai des amis auxquels ma “mort fera verser bien des larmes;	99	4	31	0	0.0	[]	0.0	0.0	0.008403361344537815	0.0	0.015825191193791215
Fourqueux_Zely	745	“je l'avouerai, ces motifs m'ont fait “quelquefois souhaiter de vivre.	99	5	14	0	0.0	[]	0.02197802197802198	0.02197802197802198	0.008403361344537815	0.0	0.015825191193791215
Fourqueux_Zely	746	Vous “croirez peut-être que j'ai les passions “vives et la raison faible, vous vous “tromperiez: j'ai écouté la voix de “la Nature, on ne peut pas toujours “s'y refuser; mais celle de l'honneur “est plus puissante.	99	6	46	2	0.0434782608695652	[['faible'], ['voix']]	0.033707865168539325	0.033707865168539325	0.008403361344537815	0.0	0.015825191193791215
Fourqueux_Zely	747	L'usage n'est pas “ici de survivre à son Mari: une “femme n'est point estimée, si elle “ne meurt soit d'amour ou autrement.	99	7	29	1	0.0344827586206896	[['mourir']]	0.027522935779816515	0.027522935779816515	0.008403361344537815	0.0	0.015825191193791215
Fourqueux_Zely	748	“La perte de Salem ne peut pas toujours être ignorée: j'ai jouï jusqu'ici “d'une estime générale, je perdrais “cette réputation sans tache qu i afait “mon bonheur.	99	8	34	0	0.0	[]	0.011764705882352941	0.011764705882352941	0.008403361344537815	0.0	0.015825191193791215
Fourqueux_Zely	749	Craindre la mort n'est “qu'une faiblesse, mais vivre sans “honneur est une indignité: mon “parti est pris.	99	9	22	0	0.0	[]	0.0	0.0	0.008403361344537815	0.0	0.015825191193791215
Fourqueux_Zely	750	Apprenez maintenant “	99	10	3	0	0.0	[]	0.0	0.0	0.008403361344537815	0.0	0.015825191193791215
Fourqueux_Zely	751	ce que j'attends de vous	99	11	6	0	0.0	[]	0.0	0.0	0.008403361344537815	0.0	0.015825191193791215
Fourqueux_Zely	752	: je vous ai “parlé de mon fils	99	12	8	0	0.0	[]	0.0	0.0	0.008403361344537815	0.0	0.015825191193791215
Fourqueux_Zely	753	, je l'adore, il “perd tout en me perdant.	99	13	10	0	0.0	[]	0.0	0.0	0.008403361344537815	0.0	0.015825191193791215
Fourqueux_Zely	754	Des Etrangers vont envahir ses richesses et “négliger son éducation: mon fils “sera sans bien et peut-être sans vertu.	99	14	21	0	0.0	[]	0.0	0.0	0.008403361344537815	0.0	0.015825191193791215
Fourqueux_Zely	755	“Vous pouvez le sauver de ces malheurs: vous ressemblez trop à son “Pere pour n'être pas vertueux.	99	15	20	0	0.0	[]	0.0	0.0	0.008403361344537815	0.0	0.015825191193791215
Fourqueux_Zely	756	Je “veux vous confier ce fils si cher et “toutes ses richesses, vous apprendrez “bientôt ma mort.	99	16	20	0	0.0	[]	0.0	0.0	0.008403361344537815	0.0	0.015825191193791215
Fourqueux_Zely	757	Feignez une vive “douleur, dites que vous êtes Salem: “vous serez en possession de tout ce qui “lui appartenait,	99	17	22	0	0.0	[]	0.0	0.0	0.008403361344537815	0.0	0.015825191193791215
Fourqueux_Zely	758	excepté ce qui peut-être a fait son malheur. C'est à moi “de vous en délivrer, et vous le serez “bientôt: vous vous éloignerez alors “de ces lieux avec le dépôt que je “veux vous confier: jurez-moi de “remplir exactement ce que j'attends “de vous.	99	18	53	0	0.0	[]	0.0	0.0	0.008403361344537815	0.0	0.015825191193791215
Fourqueux_Zely	759	Après votre serment, je “serai tranquille: vivez plus heureux “que Salem, et soyez-moi plus fidèle.	99	19	18	0	0.0	[]	0.0	0.0	0.008403361344537815	0.0	0.015825191193791215
Fourqueux_Zely	760	“Je n'ai plus qu'un mot à vous dire:	99	20	11	0	0.0	[]	0.0	0.0	0.008403361344537815	0.0	0.015825191193791215
Fourqueux_Zely	761	“vous m'aimez, je n'en puis pas douter: soyez sûr que j'en étais digne;	99	21	17	0	0.0	[]	0.0	0.0	0.008403361344537815	0.0	0.015825191193791215
Fourqueux_Zely	762	“	99	22	1	0	0.0	[]	0.0	0.0	0.008403361344537815	0.0	0.015825191193791215
Fourqueux_Zely	763	mais apprenez en même temps que “vous pouvez encore avoir une faiblesse, puisque vous l'avez eue sans “me connaître“.	99	23	23	0	0.0	[]	0.0	0.08	0.008403361344537815	0.0	0.015825191193791215
Fourqueux_Zely	764	Zély, enivré d'amour et pénétré d'admiration, se jeta aux pieds de l'Etrangere: il saisit sa belle main et l'arrosa de ses larmes.	100	0	26	4	0.1538461538461538	[['pénétrer'], ['pied'], ['bel'], ['main']]	0.12903225806451613	0.07407407407407407	0.05747126436781609	0.0	0.06517269158358396
Fourqueux_Zely	765	„A quoi pensez-vous?	100	1	5	0	0.0	[]	0.0784313725490196	0.0784313725490196	0.05747126436781609	0.0	0.06517269158358396
Fourqueux_Zely	766	lui dit-elle: sont-ce là les “sentiment que j'exige ou ceux que “vous m'avez offerts?	100	2	20	0	0.0	[]	0.02702702702702703	0.02702702702702703	0.05747126436781609	0.0	0.06517269158358396
Fourqueux_Zely	767	La pitié est “moins tendre, la vertu est plus “tranquille.	100	3	12	1	0.0833333333333333	[['tendre']]	0.023255813953488372	0.023255813953488372	0.05747126436781609	0.0	0.06517269158358396
Fourqueux_Zely	768	Levez-vous, songez à “mon fils et oubliez moi“.	100	4	11	0	0.0	[]	0.027777777777777776	0.027777777777777776	0.05747126436781609	0.0	0.06517269158358396
Fourqueux_Zely	769	A ces mots, elle le quitta sans lui donner le temps de répondre.	100	5	13	0	0.0	[]	0.0	0.0	0.05747126436781609	0.0	0.06517269158358396
Fourqueux_Zely	770	Zély resta dans une situation difficile à dépeindre: il était dans cette ivresse d'amour qui tient plus aux sens qu'au cœur, et qui n'en est que plus violente: sa raison était troublée, mais elle ne l'avait pas entièrement abandonné.	101	0	43	0	0.0	[]	0.02197802197802198	0.019230769230769232	0.016611295681063124	0.0	0.018459781063834113
Fourqueux_Zely	771	Tantôt il se représentait la jeune inconnue expirante: jaloux de Salem, il lui enviait une Epouse assez tendre pour l'aller rejoindre chez les morts: il était prêt à remplir le Palais de ses cris, à dire qu'il était Salem, à réclamer les droits de cet Epoux.	101	1	48	2	0.0416666666666666	[['tendre'], ['droit']]	0.018518518518518517	0.018518518518518517	0.016611295681063124	0.0	0.018459781063834113
Fourqueux_Zely	772	Tantôt une lueur de raison reprenait le dessus et lui laissait envisager la bizarrerie de son aventure.	101	2	17	0	0.0	[]	0.023255813953488372	0.023255813953488372	0.016611295681063124	0.0	0.018459781063834113
Fourqueux_Zely	773	Suis-je donc amoureux, disait-il, et qui peut m'avoir séduit en un instant au point d'oublier mes serments?	101	3	21	0	0.0	[]	0.02564102564102564	0.02564102564102564	0.016611295681063124	0.0	0.018459781063834113
Fourqueux_Zely	774	Une figure agréable, un son de voix touchant, quelques larmes versées avec art, une histoire qui n'a pas le sens commun: car enfin, quoiqu'on ait perdu son Mari, on peut se dispenser de se tuer: si on s'y croit obligée par honneur, on ne cherche pas à lui donner un successeur: si c'est par excès d'amour, on ne délibere pas un mois: la ressemblance, quelque parfaite qu'elle soit, ne fait illusion à personne.	101	4	79	3	0.0379746835443038	[['figure'], ['agréable'], ['voix']]	0.02097902097902098	0.02097902097902098	0.016611295681063124	0.0	0.018459781063834113
Fourqueux_Zely	775	L'Inconnue ne se tuera point, elle aime la vie et peut-être le jeune parent dont elle me parlait: cependant, si je la croyais, je serais parjure: j'accepterais la place de Salem, et je serais trompé comme il l'était sans doute.	101	5	43	0	0.0	[]	0.0196078431372549	0.0196078431372549	0.016611295681063124	0.0	0.018459781063834113
Fourqueux_Zely	776	L'image de l'Inconnue venait souvent interrompre les réflexions de Zély: il flottait entre l'amour et le raisonnement, lorsqu'un Esclave ouvrit la porte et lui remit un billet.	101	6	31	0	0.0	[]	0.0	0.0	0.016611295681063124	0.0	0.018459781063834113
Fourqueux_Zely	777	Il l'ouvrit avec précipitation, et perdit au premier coup d'œil tout ce qui lui restait de raison.	101	7	19	0	0.0	[]	0.0	0.0	0.016611295681063124	0.0	0.018459781063834113
Fourqueux_Zely	778	„Vous pouvez, lui mandait - on, “avouer que vous êtes Salem, sans “craindre pour vos serments.	102	0	18	0	0.0	[]	0.0	0.0	0.0	0.0	0.0
Fourqueux_Zely	779	Je ne “vivrai plus, quand vous recevrez “cette lettre.	102	1	11	0	0.0	[]	0.0	0.0	0.0	0.0	0.0
Fourqueux_Zely	780	Un Esclave fidèle vous “conduira dans ma maison;	102	2	9	0	0.0	[]	0.0	0.0	0.0	0.0	0.0
Fourqueux_Zely	781	il vous “remettra mon fils et ses richesses.	102	3	9	0	0.0	[]	0.0	0.0	0.0	0.0	0.0
Fourqueux_Zely	782	Il “est malheureux, il a besoin de secours, “et vous avez de la vertu.	102	4	16	0	0.0	[]	0.0	0.0	0.0	0.0	0.0
Fourqueux_Zely	783	Songez “que sa Mere vous a inspiré de l'amour “et qu'elle méritait votre estime.	102	5	18	0	0.0	[]	0.0	0.0	0.0	0.0	0.0
Fourqueux_Zely	784	Zély fit retentir l'appartement où il était, des gémissement les plus pitoyables: il s'arracha les cheveux et se reprochait d'être le meurtrier de la plus aimable des femmes: il sortit avec impétuosité et se fit conduire, ou plutôt vôla à la maison de l'Inconnue.	103	0	48	0	0.0	[]	0.0	0.0	0.009259259259259259	0.0	0.0185185185185185
Fourqueux_Zely	785	Le spectacle qui le frappa aurait augmenté son trouble, s'il n'eût pas été excessif.	103	1	16	0	0.0	[]	0.01098901098901099	0.01098901098901099	0.009259259259259259	0.0	0.0185185185185185
Fourqueux_Zely	786	L'Epouse de Salem vivait encore, elle embrassait son fils et répandait des pleurs: un poignard placé près d'elle annonçait le sacrifice qu'elle allait faire.	103	2	27	1	0.037037037037037	[['pleur']]	0.016666666666666666	0.016666666666666666	0.009259259259259259	0.0	0.0185185185185185
Fourqueux_Zely	787	Toute sa personne était dans un désordre touchant, si propre à troubler une raison déjà bien faible.	103	3	17	0	0.0	[]	0.022727272727272728	0.03125	0.009259259259259259	0.0	0.0185185185185185
Fourqueux_Zely	788	Zély, que l'idée de sa mort avait pénétré d'horreur, sentit pourtant un léger étonnement de la revoir vivante;	104	0	20	1	0.05	[['pénétrer']]	0.034482758620689655	0.021739130434782608	0.03184713375796178	0.0369047619047619	0.028110255156229884
Fourqueux_Zely	789	mais l'amour étouffa ce sentiment dès sa naissance.	104	1	9	0	0.0	[]	0.0425531914893617	0.0425531914893617	0.03184713375796178	0.0369047619047619	0.028110255156229884
Fourqueux_Zely	790	„J'avais résolu de ne vous “plus voir, lui dit-elle d'une voix “charmante;	104	2	18	1	0.0555555555555555	[['voix']]	0.02631578947368421	0.02631578947368421	0.03184713375796178	0.0369047619047619	0.028110255156229884
Fourqueux_Zely	791	je ne sais quel pouvoir “inconnu a arrêté mon bras.	104	3	11	0	0.0	[]	0.045454545454545456	0.045454545454545456	0.03184713375796178	0.0369047619047619	0.028110255156229884
Fourqueux_Zely	792	Je n'ai “pu me refuser en mourant la douceur de vous confier moi	104	4	15	1	0.0666666666666666	[['mourir']]	0.020833333333333332	0.020833333333333332	0.03184713375796178	0.0369047619047619	0.028110255156229884
Fourqueux_Zely	793	-même ce “dépôt: je sens quelque plaisir à vous “marquer ma reconnaissance des bien-faits qu'il recevra de vous“.	104	5	22	0	0.0	[]	0.02531645569620253	0.02531645569620253	0.03184713375796178	0.0369047619047619	0.028110255156229884
Fourqueux_Zely	794	Zély, hors de lui, s'était déjà saisi du poignard et l'avait jeté bien loin de la jeune Affligée: il tomba à ses pieds et la conjura de vivre avec toute l'ardeur que l'amour le plus violent peut inspirer.	104	6	42	1	0.0238095238095238	[['pied']]	0.023809523809523808	0.023809523809523808	0.03184713375796178	0.0369047619047619	0.028110255156229884
Fourqueux_Zely	795	L'Amour est bien éloquent, et le sujet était favorable: cependant il ne se flattait pas encore d'avoir persuadé.	104	7	20	1	0.05	[['éloquent']]	0.03225806451612903	0.03529411764705882	0.03184713375796178	0.0369047619047619	0.028110255156229884
Fourqueux_Zely	796	Le Chef de la Ville, instruit du trouble de Zély et de sa fuite précipitée, arriva dans ce moment suivi de quelques Anciens.	105	0	23	1	0.0434782608695652	[['chef']]	0.057692307692307696	0.05555555555555555	0.025252525252525252	0.0	0.028562088021677465
Fourqueux_Zely	797	Zély ne douta pas que sa présence ne fût décisive, et ne le mît en état de triompher de l'aversion que la belle Inconnue marquait pour la vie.	105	1	29	2	0.0689655172413793	[['triompher'], ['bel']]	0.05660377358490566	0.05660377358490566	0.025252525252525252	0.0	0.028562088021677465
Fourqueux_Zely	798	„	105	2	1	0	0.0	[]	0.04838709677419355	0.04838709677419355	0.025252525252525252	0.0	0.028562088021677465
Fourqueux_Zely	799	Venez à mon secours, s'écria-“t-il, Vieillard vénérable: venez sauver “les jours de la plus aimable des femmes que l'égarement de ma raison “a pensé conduire au tombeau.	105	3	32	1	0.03125	[['vénérable']]	0.017857142857142856	0.017857142857142856	0.025252525252525252	0.0	0.028562088021677465
Fourqueux_Zely	800	Oui, “je suis ce malheureux Salem si cher “dans votre société, et si peu digne “d'en goûter les douceurs.	105	4	23	0	0.0	[]	0.01639344262295082	0.01639344262295082	0.025252525252525252	0.0	0.028562088021677465
Fourqueux_Zely	801	Je me suis “méconnu moi	105	5	6	0	0.0	[]	0.021739130434782608	0.021739130434782608	0.025252525252525252	0.0	0.028562088021677465
Fourqueux_Zely	802	-même pendant quelques moment de délire, et cette “Epouse charmante ne veut plus me “reconnaître.	105	6	17	1	0.0588235294117647	[['pendant']]	0.014925373134328358	0.014925373134328358	0.025252525252525252	0.0	0.028562088021677465
