Fourqueux_Zely	932	L'indigence le tira de l'ivresse du plaisir, et il se disait, (car il aimait quelquefois à réflechir): Il est bien doux d'avoir une jolie Maitresse; mais, quand on est pauvre, on n'est pas tout-à-fait heureux.	119	3	40	0	0.0	[]	0.0	0.013333333333333334	0.013157894736842105	0.0	0.0263157894736842
Fourqueux_Zely	933	Convaincu de cette vérité, il s'attacha â une Dame d'un âge grave, et d'une humeur libérale.	120	0	19	1	0.0526315789473684	[['grave']]	0.037037037037037035	0.014925373134328358	0.041666666666666664	0.0476190476190476	0.029048184880056314
Fourqueux_Zely	934	Les plaisirs le quittèrent, l'opulence les remplaça;	120	1	8	0	0.0	[]	0.041666666666666664	0.041666666666666664	0.041666666666666664	0.0476190476190476	0.029048184880056314
Fourqueux_Zely	935	mais il se disait souvent: quand on achète son bien-être d'une vieille femme, on n'est point du tout heureux.	120	2	21	1	0.0476190476190476	[['vieux']]	0.034482758620689655	0.023255813953488372	0.041666666666666664	0.0476190476190476	0.029048184880056314
Fourqueux_Zely	936	Il résolut de changer de méthode, et de devoir son bonheur à l'Amour.	121	0	14	0	0.0	[]	0.05555555555555555	0.05263157894736842	0.057692307692307696	0.0568181818181818	0.05033224692891163
Fourqueux_Zely	937	Zima était jeune et beau: une Dame jeune et belle lui inspira une passion violente, et brûla pour lui des mêmes feux.	121	1	22	2	0.0909090909090909	[['beau'], ['bel']]	0.043478260869565216	0.043478260869565216	0.057692307692307696	0.0568181818181818	0.05033224692891163
Fourqueux_Zely	938	Les plaisirs les plus vifs l'enchaînaient pour jamais; mais un Mari jaloux et brutal, ayant surpris les Amans dans une situation suspecte, fit, pour réparation d'honneur, jeter Zima par la fenêtre.	121	2	33	1	0.0303030303030303	[['vif']]	0.06944444444444445	0.06944444444444445	0.057692307692307696	0.0568181818181818	0.05033224692891163
Fourqueux_Zely	939	Il se rompit un bras, et tout plein de sa passion il disait, un peu tristement: O	121	3	17	2	0.1176470588235294	[['bras'], ['plein']]	0.05357142857142857	0.05357142857142857	0.057692307692307696	0.0568181818181818	0.05033224692891163
Fourqueux_Zely	940	Amour, que tes faveurs sont délicieuses!	121	4	6	0	0.0	[]	0.08571428571428572	0.08571428571428572	0.057692307692307696	0.0568181818181818	0.05033224692891163
Fourqueux_Zely	941	qu'elles rendent heureux, quand on n'a point le bras cassé!	121	5	12	1	0.0833333333333333	[['bras']]	0.05555555555555555	0.02127659574468085	0.057692307692307696	0.0568181818181818	0.05033224692891163
Fourqueux_Zely	942	Il conçut pourtant que le vrai bonheur ne doit pas habiter avec les passions, mais qu'il est réservé à la Raison de le connaître et d'en jouir.	122	0	29	0	0.0	[]	0.0	0.01639344262295082	0.0	0.0	0.0
Fourqueux_Zely	943	Conséquemment il résolut de ne plus suivre qu'elle, et pour cela de faire ce que fait tout le monde.	122	1	20	0	0.0	[]	0.0	0.0	0.0	0.0	0.0
Fourqueux_Zely	944	Il parut à la Cour, sollicita des grâces, les obtint et en souhaita d'autres.	122	2	15	0	0.0	[]	0.0	0.0	0.0	0.0	0.0
Fourqueux_Zely	945	Ses succès multiplierent ses désirs, il en sentit enfin le néant et dit: c'est bien de l'honneur pour un Sujet de bàiller dans l'anti-chambre de son Maître, mais cela ne rend point du tout heureux: c'est une vie libre et tranquille qui fait la vraie félicité: chassons loin de nous l'ambition et l'esclavage, et cherchons une Epouse honnête: enfin vivons pour nous.	122	3	68	0	0.0	[]	0.0	0.0	0.0	0.0	0.0
Fourqueux_Zely	946	Il trouva en effet un parti avantageux.	123	0	7	0	0.0	[]	0.043478260869565216	0.01098901098901099	0.08208955223880597	0.0416666666666666	0.15560616854876658
Fourqueux_Zely	947	C'était une fille noble et majeure, grandement vertueuse, qui lui promit de l'aimer beaucoup.	123	1	16	1	0.0625	[['noble']]	0.20512820512820512	0.20512820512820512	0.08208955223880597	0.0416666666666666	0.15560616854876658
Fourqueux_Zely	948	Elle avait la taille haute, le visage long et maigre, le teint jaune, les yeux baissés.	123	2	16	7	0.4375	[['taille'], ['visage'], ['long'], ['maigre'], ['teint'], ['jaune'], ['oeil']]	0.1568627450980392	0.1568627450980392	0.08208955223880597	0.0416666666666666	0.15560616854876658
Fourqueux_Zely	949	Son caractère était sérieux, elle cultivait les Sciences, étudiait la Théologie et avait pour la morale une vénération particulière.	123	3	19	0	0.0	[]	0.13793103448275862	0.13793103448275862	0.08208955223880597	0.0416666666666666	0.15560616854876658
Fourqueux_Zely	950	Zima, qui avait négligé cette partie de la Philosophie, ne fut pas long-temps sans choquer les principes d'une personne si parfaite.	123	4	23	1	0.0434782608695652	[['long']]	0.030303030303030304	0.030303030303030304	0.08208955223880597	0.0416666666666666	0.15560616854876658
Fourqueux_Zely	951	Il fut prêché, repris, contredit cent fois par jour, et si peu corrigible que sa tendre moitié ne pouvait se défendre de l'aigreur.	123	5	24	1	0.0416666666666666	[['tendre']]	0.039473684210526314	0.039473684210526314	0.08208955223880597	0.0416666666666666	0.15560616854876658
Fourqueux_Zely	952	Il se disait souvent: c'est un avantage rare d'avoir une femme qui a de la vertu, mais cela ne rend pas aussi heureux qu'on le croit.	123	6	29	1	0.0344827586206896	[['rare']]	0.03773584905660377	0.02631578947368421	0.08208955223880597	0.0416666666666666	0.15560616854876658
Fourqueux_Zely	953	Revenant une nuit de la Campagne, il entra étourdîment dans l'appartement de Madame: cette visite, à heure indue, causa un scandale énorme.	124	0	23	0	0.0	[]	0.0	0.014492753623188406	0.009009009009009009	0.0	0.011664236870396059
Fourqueux_Zely	954	Vivement prêché sur l'abus des voyages de nuit, il reçut l'ordre positif de se retirer.	124	1	17	0	0.0	[]	0.013333333333333334	0.013333333333333334	0.009009009009009009	0.0	0.011664236870396059
Fourqueux_Zely	955	Assez disposé à la complaisance, il voulut au moins réparer ses torts par quelques marques d'amitié: il s'approcha du lit, et aperçut le Directeur occupant modestement la plus petite portion possible du lit.	124	2	35	1	0.0285714285714285	[['petit']]	0.018867924528301886	0.018867924528301886	0.009009009009009009	0.0	0.011664236870396059
Fourqueux_Zely	956	Oh!	124	3	1	0	0.0	[]	0.018867924528301886	0.018867924528301886	0.009009009009009009	0.0	0.011664236870396059
Fourqueux_Zely	957	oh! dit-il, quand on a une femme laide, difficile, envieuse, on n'est pas fâché qu'	124	4	17	0	0.0	[]	0.0	0.0	0.009009009009009009	0.0	0.011664236870396059
Fourqueux_Zely	958	un Ami charitable veuille bien faire diversion: cependant on ne peut pas dire que cela rende tout-à-fait heureux.	124	5	18	0	0.0	[]	0.0	0.0	0.009009009009009009	0.0	0.011664236870396059
Fourqueux_Zely	959	Zima résolut de s'affranchir des ennuis du ménage.	125	0	9	0	0.0	[]	0.0	0.0	0.0	0.0	0.0
Fourqueux_Zely	960	Il se retira dans ses terres, et goûta quelque temps le plaisir de n'être ni contredit ni grondé;	125	1	19	0	0.0	[]	0.0	0.0	0.0	0.0	0.0
Fourqueux_Zely	961	mais il n'avait rien à faire, et il se disait: si la tranquilité est un bien, l'oisiveté est un mal: cette dernière produit l'ennui, et quand on s'ennuie, on n'est point heureux.	125	2	37	0	0.0	[]	0.0	0.0	0.0	0.0	0.0
Fourqueux_Zely	962	Il habitait une Province maritime, il imagina de se faire un amusement du Commerce: tout lui réussit.	126	0	17	0	0.0	[]	0.0	0.0	0.013157894736842105	0.0	0.027950849718747374
Fourqueux_Zely	963	Il se vit en peu de temps la fortune la plus brillante;	126	1	12	0	0.0	[]	0.0	0.0	0.013157894736842105	0.0	0.027950849718747374
Fourqueux_Zely	964	mais Zima n'était point avare, et l'or ne pouvait remplir son cœur.	126	2	14	0	0.0	[]	0.0	0.0	0.013157894736842105	0.0	0.027950849718747374
Fourqueux_Zely	965	Je le vois bien, disait-il, on peut avoir bien du bonheur et n'être point heureux.	126	3	17	0	0.0	[]	0.02127659574468085	0.02127659574468085	0.013157894736842105	0.0	0.027950849718747374
Fourqueux_Zely	966	Mes coffres sont pleins, et mon âme est vide: cessons d'amasser et tâchons de jouir.	126	4	16	1	0.0625	[['plein']]	0.030303030303030304	0.02	0.013157894736842105	0.0	0.027950849718747374
Fourqueux_Zely	967	Quoique sa femme fût bien laide, il était père d'une fille, et cette fille était aimable.	127	0	17	0	0.0	[]	0.011904761904761904	0.02	0.011904761904761904	0.00746268656716415	0.010553832555023056
Fourqueux_Zely	968	Il avait des amis, parce qu'il méritait d'en avoir: il maria sa fille avantageusement, rassembla chez lui les gens qui lui étaient chers, et se trouvant en pleine liberté au sein de l'amitié et de l'opulence, il se flatta de goûter des douceurs que rien ne pourrait troubler; mais le Bonheur même a ses inconvéniens, et le temps ne perd point ses droits.	127	1	67	1	0.0149253731343283	[['sein']]	0.011904761904761904	0.01	0.011904761904761904	0.00746268656716415	0.010553832555023056
Fourqueux_Zely	969	Zima n'était plus jeune, il avait vécu: l'excès des plaisirs produit des fruits amers.	128	0	16	0	0.0	[]	0.02040816326530612	0.017241379310344827	0.00819672131147541	0.0	0.012371160317086755
Fourqueux_Zely	970	Il disait un jour à ses amis: j'ai l'âme sensible et tendre: j'ai l'esprit disposé à la gaieté: ce qui m'entoure me plaît, aucun souvenir ne me trouble.	128	1	33	1	0.0303030303030303	[['tendre']]	0.014285714285714285	0.014285714285714285	0.00819672131147541	0.0	0.012371160317086755
Fourqueux_Zely	971	Je suis libre, je vis dans l'abondance: de tout ce qui excite les désirs des hommes, rien ne me manque;	128	2	21	0	0.0	[]	0.015151515151515152	0.015151515151515152	0.00819672131147541	0.0	0.012371160317086755
Fourqueux_Zely	972	mais quand on a la goutte, on n'est pas parfaitement heureux.	128	3	12	0	0.0	[]	0.0	0.0	0.00819672131147541	0.0	0.012371160317086755
Fourqueux_Zely	973	Je connais tout ce qu'on peut connaître: j'ai épuisé les folies de l'amour et de l'ambition.	128	4	20	0	0.0	[]	0.0	0.0	0.00819672131147541	0.0	0.012371160317086755
Fourqueux_Zely	974	J'ai savouré les douceurs de l'amitié, de la raison, de la liberté, de l'étude, des richesses, etc.	128	5	20	0	0.0	[]	0.0	0.0	0.00819672131147541	0.0	0.012371160317086755
Fourqueux_Zely	975	Le bonheur seul m'est échappé.	129	0	6	0	0.0	[]	0.0	0.0	0.0	0.0	0.0
Fourqueux_Zely	976	Dites-moi: croyez-vous sérieusement qu'il existe?	129	1	8	0	0.0	[]	0.0	0.0	0.0	0.0	0.0
Fourqueux_Zely	977	FIN.	130	0	1	0	0.0	[]	0.0	0.0	0.0	0.0	0.0
Fourqueux_Zely	978	LES AMOURS DE VICTORINE ET DE PHILOGÈNE.	131	0	7	0	0.0	[]	0.0	0.0	0.0	0.0	0.0
Fourqueux_Zely	979	IL y avait plus de trois semaines que je n'avais vu mon sincère ami Philogène, et j'en étais étonné: car depuis notre première jeunesse, nous n'avions jamais cessé d'être amis, n'ayant rien de caché l'un pour l'autre, partageant mutuellement nos plaisirs et nos peines, et communément on nous appelait les Inséparables.	132	0	58	0	0.0	[]	0.0	0.019801980198019802	0.0	0.0	0.0
Fourqueux_Zely	980	Ce qui redoublait mon inquiétude, c'est que depuis un certain temps, je m'appercevais de quelque inégalité dans son caractère: né gai, agréable, enjoué, quoique d'un esprit solide, il était bien toujours le même;	133	0	36	2	0.0555555555555555	[['agréable'], ['solide']]	0.037037037037037035	0.017857142857142856	0.018292682926829267	0.0	0.024059035711511037
Fourqueux_Zely	981	mais depuis près d'un an je le voyais souvent sérieux jusqu'à la tristesse, distrait et rêveur.	133	1	18	0	0.0	[]	0.025	0.025	0.018292682926829267	0.0	0.024059035711511037
Fourqueux_Zely	982	Je l'avais quelquefois raillé sur ce changement: d'autres fois je l'avais exhorté, au nom de notre fidèle amitié, de m'apprendre ses peines.	133	2	26	0	0.0	[]	0.0	0.0	0.018292682926829267	0.0	0.024059035711511037
Fourqueux_Zely	983	Un jour que je le pressais plus vivement de s'expliquer, il me répondit sérieusement: „	133	3	16	0	0.0	[]	0.00909090909090909	0.00909090909090909	0.018292682926829267	0.0	0.024059035711511037
Fourqueux_Zely	984	Au nom de notre ancienne “et tendre union, je te conjure de “ne me rien demander: plains-moi “seulement: quelque jour je trouverai “bon que tu me traites de fou et “d'insensé; mais attends que j'en convienne, et n'exige rien de moi d'aujourd'hui à ce temps: le secret que “je te fais ne saurait blesser l'amitié“.	133	4	68	1	0.0147058823529411	[['tendre']]	0.011904761904761904	0.008771929824561403	0.018292682926829267	0.0	0.024059035711511037
Fourqueux_Zely	985	Ce dernier mot arrêta ma curiosité, et depuis cette conversation je ne lui en avais plus parlé: je souffrais ses caprices et ses bisarreries, sans pouvoir en démêler le sujet.	134	0	30	0	0.0	[]	0.0	0.009345794392523364	0.0	0.0	0.0
Fourqueux_Zely	986	Cette interruption de commerce depuis trois semaines m'inquiéta;	134	1	9	0	0.0	[]	0.0	0.0	0.0	0.0	0.0
Fourqueux_Zely	987	je craignis d'avoir donné, sans le savoir, occasion à ce refroidissement, je lui écrivis en ces termes:	134	2	18	0	0.0	[]	0.0	0.0	0.0	0.0	0.0
Fourqueux_Zely	988	„	134	3	1	0	0.0	[]	0.0	0.0	0.0	0.0	0.0
Fourqueux_Zely	989	L'Amitié doit être traitée avec “autant de délicatesse que l'Amour.	134	4	13	0	0.0	[]	0.0	0.0	0.0	0.0	0.0
Fourqueux_Zely	990	Je “ne vous vois plus, cher ami: c'en “est assez pour m'alarmer.	134	5	16	0	0.0	[]	0.0	0.0	0.0	0.0	0.0
Fourqueux_Zely	991	Ai-je tort “	134	6	4	0	0.0	[]	0.0	0.0	0.0	0.0	0.0
Fourqueux_Zely	992	avec vous	134	7	2	0	0.0	[]	0.0	0.0	0.0	0.0	0.0
Fourqueux_Zely	993	?	134	8	0	0	0.0	[]	0.0	0.0	0.0	0.0	0.0
Fourqueux_Zely	994	Apprenez le moi promptement: il ne me sera pas difficile, “je crois, de me justifier; car mon “cœur n'a pu avoir part à quelque “chose qui vous déplaise“.	134	9	33	0	0.0	[]	0.0	0.0	0.0	0.0	0.0
Fourqueux_Zely	995	Ce billet fit tout l'effet que j'en pouvais attendre: je reçus cette réponse le même jour.	135	0	18	0	0.0	[]	0.0	0.0	0.0	0.0	0.0
Fourqueux_Zely	996	„	136	0	1	0	0.0	[]	0.041666666666666664	0.023809523809523808	0.043478260869565216	0.0217391304347826	0.026351805510057662
Fourqueux_Zely	997	Je suis dans mon tort, cher et “fidèle Antonin, et les premiers mots “de ton billet me l'ont fait sentir;	136	1	23	1	0.0434782608695652	[['ton']]	0.04	0.04	0.043478260869565216	0.0217391304347826	0.026351805510057662
Fourqueux_Zely	998	“	136	2	1	0	0.0	[]	0.044444444444444446	0.044444444444444446	0.043478260869565216	0.0217391304347826	0.026351805510057662
Fourqueux_Zely	999	mais je compte sur ton indulgence, “après m'avoir entendu: j'irai demain “dîner chez toi, soyons seuls“.	136	3	21	1	0.0476190476190476	[['ton']]	0.045454545454545456	0.03125	0.043478260869565216	0.0217391304347826	0.026351805510057662
Fourqueux_Zely	1000	Je fus charmé de retrouver mon ami, je relus son billet: je me rappelai les termes du mien, et je vis que j'avais deviné, sans y penser, qu'il y avait quelque inclination, quelque amour qui l'avait séparé de moi.	137	0	42	1	0.0238095238095238	[['charmer']]	0.028169014084507043	0.03260869565217391	0.020100502512562814	0.0119047619047619	0.016364632526079677
Fourqueux_Zely	1001	Différentes circonstances me revinrent à l'esprit, et je conclus que mon ami était heureux, et qu'il avait apparemment voulu presser les derniers moment d'une intelligence parfaite.	137	1	29	1	0.0344827586206896	[['presser']]	0.02247191011235955	0.02247191011235955	0.020100502512562814	0.0119047619047619	0.016364632526079677
Fourqueux_Zely	1002	Il n'est pas étonnant, me disais-je, que, dans ces situations, on oublie le reste du monde.	137	2	18	0	0.0	[]	0.014285714285714285	0.014285714285714285	0.020100502512562814	0.0119047619047619	0.016364632526079677
Fourqueux_Zely	1003	Je me rappelai tout ce que je pus, pour découvrir l'objet qui pouvait l'avoir assujetti: je me perdis dans mes recherches.	137	3	23	0	0.0	[]	0.01834862385321101	0.01834862385321101	0.020100502512562814	0.0119047619047619	0.016364632526079677
Fourqueux_Zely	1004	Je ne lui avais point vu faire de connaissance nouvelle dans les premiers instants de la naissance de sa passion: j'appelle de ce nom le temps où je vis changer son naturel, lorsqu'il était absorbé dans ses rêveries, et dans ses distractions: je relus de nouveau son billet, et je le trouvai écrit d'un esprit calme, en termes précis, tels que l'amitié les dicte.	137	4	68	2	0.0294117647058823	[['naturel'], ['calme']]	0.01818181818181818	0.01818181818181818	0.020100502512562814	0.0119047619047619	0.016364632526079677
Fourqueux_Zely	1005	Je me fis un plaisir de son bonheur, et j'attendis avec impatience le moment de l'en féliciter.	137	5	19	0	0.0	[]	0.022988505747126436	0.027777777777777776	0.020100502512562814	0.0119047619047619	0.016364632526079677
Fourqueux_Zely	1006	Il entra chez moi, avec cet air aisé que je lui avais toujours vu: il m'embrassa tendrement, en me disant:	138	0	21	1	0.0476190476190476	[['aiser']]	0.02040816326530612	0.014705882352941176	0.006578947368421052	0.0	0.01799830823853462
Fourqueux_Zely	1007	„Si “l'on est capable de faire des fautes “contre l'amitié, rien ne fait plus de “plaisir que l'occasion de les réparer.	138	1	28	0	0.0	[]	0.014705882352941176	0.014705882352941176	0.006578947368421052	0.0	0.01799830823853462
Fourqueux_Zely	1008	“J'ai mille choses à te dire, mon cher “Ami, et je ne sais par où commencer.......	138	2	19	0	0.0	[]	0.0	0.0	0.006578947368421052	0.0	0.01799830823853462
Fourqueux_Zely	1009	Dites-moi que vous “êtes heureux et content, lui dis-je, “je n'en veux pas davantage.--Oui, “je le suis, mon cher Antonin, re-“prit-il, “ prit-il, et je me suis procuré un “bonheur où je n'osais prétendre;	138	3	44	0	0.0	[]	0.0	0.0	0.006578947368421052	0.0	0.01799830823853462
Fourqueux_Zely	1010	“mais comment as	138	4	4	0	0.0	[]	0.0	0.0	0.006578947368421052	0.0	0.01799830823853462
Fourqueux_Zely	1011	-tu pu le savoir?	138	5	4	0	0.0	[]	0.0	0.0	0.006578947368421052	0.0	0.01799830823853462
Fourqueux_Zely	1012	“C'est ce qui me passe.--Je ne sais “rien, répondis-je, et l'amitié défend, “ce me semble, toute curiosité contre “l'aveu de la personne intéressée“.	138	6	32	0	0.0	[]	0.0	0.012345679012345678	0.006578947368421052	0.0	0.01799830823853462
Fourqueux_Zely	1013	“Ton billet, reprit Philogène, m'a “fait voir que quelquefois la discrétion échappe: il est vrai que l'amour “m'a fait oublier pour quelques jours “l'amitié, mais il est juste qu'à son “tour celle-ci reprenne ses droits.	139	0	45	1	0.0222222222222222	[['ton']]	0.009259259259259259	0.007142857142857143	0.004830917874396135	0.0	0.008399210511316152
Fourqueux_Zely	1014	Je “dis plus: c'est que l'amour y trouvera son compte, puisqu'en parlant “du mien, je ne puis que le redoubler par la certitude de me voir “applaudir.--Il se mêle, lui répon-“dis-je, “ dis-je, un peu d'amour-propre à “tout ceci; et plus on est fortuné, “plus on désir d'avoir un Confident.	139	1	63	0	0.0	[]	0.008771929824561403	0.008771929824561403	0.004830917874396135	0.0	0.008399210511316152
Fourqueux_Zely	1015	“--Trève de morale, cher Antonin:	139	2	6	0	0.0	[]	0.0	0.0	0.004830917874396135	0.0	0.008399210511316152
Fourqueux_Zely	1016	“j'adore ma Maitresse; mais elle me “permet, que dis-je?	139	3	13	0	0.0	[]	0.0	0.0	0.004830917874396135	0.0	0.008399210511316152
Fourqueux_Zely	1017	elle m'ordonne “d'aimer mon ami: il sait en partie “mon secret, et je dois avoir honte “de ne pas le lui avoir appris.	139	4	28	0	0.0	[]	0.0	0.0	0.004830917874396135	0.0	0.008399210511316152
Fourqueux_Zely	1018	Dînons “vite,	139	5	3	0	0.0	[]	0.0	0.0	0.004830917874396135	0.0	0.008399210511316152
Fourqueux_Zely	1019	et je vais te faire, après cela, “un ample détail de toute mon aventure, où le hasard le plus inespéré “m'a donné occasion de me déclarer, “et tu sauras qu'une conversation “étrangère, sotte et extravagante, m'a “procuré le comble du bonheur.	139	6	49	0	0.0	[]	0.0	0.0	0.004830917874396135	0.0	0.008399210511316152
Fourqueux_Zely	1020	Après le dîner, Philogène me tint parole, et commença en ces termes:	140	0	12	0	0.0	[]	0.0	0.0	0.0	0.0	0.0
Fourqueux_Zely	1021	Vous savez, mon cher ami, que je n'ai jamais rien eu de caché pour vous, que nous avons toujours vécu ensemble, fréquenté les mêmes compagnies, et fait les mêmes parties: vous savez de plus combien j'ai été éloigné de ces attachement de cœur, qui chez les uns ne sont que des goûts passagers, que l'on pourrait plutôt appeler libertinage et coquetterie;	140	1	64	0	0.0	[]	0.0	0.0	0.0	0.0	0.0
Fourqueux_Zely	1022	et qui chez les autres font un bouleversement et un dérangement si considérable d'esprit et de conduite, qu'ils les rendent impraticables et inutiles à la société et à toutes affaires, n'étant occupés que de leur seul objet.	140	2	40	0	0.0	[]	0.0	0.0	0.0	0.0	0.0
Fourqueux_Zely	1023	Vous m'avez toujours entendu parler de cette façon, et vous m'avez vu aussi agir en conséquence;	140	3	18	0	0.0	[]	0.0	0.0	0.0	0.0	0.0
Fourqueux_Zely	1024	mais, mon cher ami, que l'on est dupe des beaux principes de morale!	140	4	14	0	0.0	[]	0.0	0.0	0.0	0.0	0.0
Fourqueux_Zely	1025	Les sentiment du cœur sont des maîtres absolus: quand ils commandent, nous en devenons esclaves: le Philosophe n'est plus qu'un homme;	140	5	23	0	0.0	[]	0.0	0.0	0.0	0.0	0.0
Fourqueux_Zely	1026	et, s'il lui reste quelque raisonnement, il n'est employé qu'à justifier à soi-même son goût et ses actions.	140	6	22	0	0.0	[]	0.0	0.0	0.0	0.0	0.0
Fourqueux_Zely	1027	Voilà en bref mon Portrait: qui aurait pu croire qu'après dix ans et plus de fréquentation chez une Dame, où les seules raisons de la vie civile nous conduisaient, j'eusse pu donner l'exemple d'une passion aussi vive,	141	0	41	0	0.0	[]	0.0	0.0	0.0	0.0	0.0
Fourqueux_Zely	1028	que celle qui me tourmentait depuis un an.	141	1	8	0	0.0	[]	0.0	0.0	0.0	0.0	0.0
Fourqueux_Zely	1029	De-là toutes les railleries de tristesse, de distractions, et d'inégalités, que vous et tant d'autres m'avez reprochées.	141	2	20	0	0.0	[]	0.0	0.017857142857142856	0.0	0.0	0.0
Fourqueux_Zely	1030	Voilà, interrompis-je, le grand secret mis au jour: je m'en étais toujours douté: mais, ne sachant sur qui porter la vue, mes recherches demeuraient en suspens.	142	0	28	1	0.0357142857142857	[['grand']]	0.03571428571428571	0.02	0.03571428571428571	0.0357142857142857	0.0
Fourqueux_Zely	1031	Philogène reprit:	143	0	2	0	0.0	[]	0.0	0.017241379310344827	0.0	0.0	0.0
Fourqueux_Zely	1032	Que vous m'êtes cruel d'avoir pu me soupçonner d'aimer, et de n'avoir pas conclu sur le champ que ce ne pouvait-être que Victorine!	143	1	28	0	0.0	[]	0.0	0.0	0.0	0.0	0.0
Fourqueux_Zely	1033	Victorine!	143	2	1	0	0.0	[]	0.0	0.0	0.0	0.0	0.0
Fourqueux_Zely	1034	m'écriai-je.	144	0	3	0	0.0	[]	0.0	0.0	0.0	0.0	0.0
Fourqueux_Zely	1035	--Oui	145	0	1	0	0.0	[]	0.058823529411764705	0.05	0.009933774834437087	0.0	0.01731844487734915
Fourqueux_Zely	1036	, Victorine: outre les traits, la taille et la grâce qui l'accompagnent, quelle sagesse de conduite!	145	1	16	1	0.0625	[['taille']]	0.045454545454545456	0.045454545454545456	0.009933774834437087	0.0	0.01731844487734915
Fourqueux_Zely	1037	quelle prudence dans ses discours!	145	2	5	0	0.0	[]	0.03225806451612903	0.03225806451612903	0.009933774834437087	0.0	0.01731844487734915
Fourqueux_Zely	1038	quelle justesse dans ses sentiment! quelle droiture dans le cœur!	145	3	10	0	0.0	[]	0.0	0.0	0.009933774834437087	0.0	0.01731844487734915
Fourqueux_Zely	1039	quel esprit en tout!	145	4	4	0	0.0	[]	0.0	0.0	0.009933774834437087	0.0	0.01731844487734915
Fourqueux_Zely	1040	ah,	145	5	1	0	0.0	[]	0.0	0.0	0.009933774834437087	0.0	0.01731844487734915
Fourqueux_Zely	1041	cher ami!	145	6	2	0	0.0	[]	0.0	0.0	0.009933774834437087	0.0	0.01731844487734915
Fourqueux_Zely	1042	sincère et fidèle Antonin, n'a-t-elle pas toujours fait votre admiration comme la mienne?	145	7	16	0	0.0	[]	0.0	0.0	0.009933774834437087	0.0	0.01731844487734915
Fourqueux_Zely	1043	Devriez	145	8	1	0	0.0	[]	0.0	0.0	0.009933774834437087	0.0	0.01731844487734915
Fourqueux_Zely	1044	-vous vous y méprendre?	145	9	4	0	0.0	[]	0.02857142857142857	0.02857142857142857	0.009933774834437087	0.0	0.01731844487734915
Fourqueux_Zely	1045	Sans doute, lui répondis-je, que, s'il est une femme qui possède ces qualités, ce ne peut-être que Victorine: il n'y a pas deux voix sur son chapître;	145	10	30	1	0.0333333333333333	[['voix']]	0.008620689655172414	0.008620689655172414	0.009933774834437087	0.0	0.01731844487734915
Fourqueux_Zely	1046	mais ce sont ces mêmes qualités qui m'empêchent d'imaginer que vous ayez pu faire naître une passion égale et correspondante à la vôtre.--C'est cependant, dit Philogène, ce qui m'a entraîné: l'admiration commence, la réflexion suit, et elle fait aisément naître le désirs: ce dernier devient passion, la passion absorbe, et l'on n'est plus occupé d'autre chose: les difficultés irritent, on ne pense qu'à les lever: elles accablent quelquefois, mais elles ne rebutent point.	145	11	82	0	0.0	[]	0.0070921985815602835	0.0070921985815602835	0.009933774834437087	0.0	0.01731844487734915
Fourqueux_Zely	1047	Combien de fois me suis-je regardé comme le plus malheureux homme du monde dans une entreprise aussi douteuse et aussi dangereuse que celle de vouloir plaire à Victorine!	145	12	29	0	0.0	[]	0.0	0.0	0.009933774834437087	0.0	0.01731844487734915
Fourqueux_Zely	1048	Que d'étude à faire sur mes discours et sur ma conduite!	145	13	12	0	0.0	[]	0.0	0.0	0.009933774834437087	0.0	0.01731844487734915
Fourqueux_Zely	1049	tu sais que les propos qui passeraient chez d'autres femmes pour galanterie, sont traités par elle de fadeurs; que les assiduités auprès d'elle sont des importunités.	145	14	28	0	0.0	[]	0.009900990099009901	0.009900990099009901	0.009933774834437087	0.0	0.01731844487734915
