Leonard_Clementine	766	amour ne soit pas un crime, où la foi soit respectée, où la bienfaisance ouvre un asile à deux époux persécutés.	39	31	21	0	0.0	[]	0.0	0.0	0.030181086519114688	0.0	0.04779163569459131
Leonard_Clementine	767	Tous les climats me sont indifférents;	39	32	6	0	0.0	[]	0.0	0.0	0.030181086519114688	0.0	0.04779163569459131
Leonard_Clementine	768	tous les lieux me plairont avec toi, pourvu que nous y soyons à l' abri de nos tyrans.	39	33	18	0	0.0	[]	0.025	0.025	0.030181086519114688	0.0	0.04779163569459131
Leonard_Clementine	769	Il est, dans le nouveau monde, une île délicieuse qui sembleavoir été destinée pour deux amants.	39	34	16	1	0.0625	[['délicieux']]	0.020833333333333332	0.020833333333333332	0.030181086519114688	0.0	0.04779163569459131
Leonard_Clementine	770	C' est une terre enchantée, où sont réunies toutes les merveilles de la nature.	39	35	14	0	0.0	[]	0.03333333333333333	0.03333333333333333	0.030181086519114688	0.0	0.04779163569459131
Leonard_Clementine	771	Là, dans des solitudes fleuries, au milieu d' un printemps éternel, nous vivrons pour nous, tranquilles, indépendants, riches des biens que le ciel prodigue à l' homme sauvage et content.	39	36	30	1	0.0333333333333333	[['riche']]	0.03278688524590164	0.03278688524590164	0.030181086519114688	0.0	0.04779163569459131
Leonard_Clementine	772	Si tu veux me suivre, ce voyage nous sera facile... mais je connais tes scrupules: faible amante!	39	37	17	1	0.0588235294117647	[['faible']]	0.07017543859649122	0.07017543859649122	0.030181086519114688	0.0	0.04779163569459131
Leonard_Clementine	773	Tu ne sais qu' obéir, et trembler sous ton despote.	39	38	10	2	0.2	[['trembler'], ['ton']]	0.10344827586206896	0.10344827586206896	0.030181086519114688	0.0	0.04779163569459131
Leonard_Clementine	774	Eh bien?	39	39	2	0	0.0	[]	0.17391304347826086	0.17391304347826086	0.030181086519114688	0.0	0.04779163569459131
Leonard_Clementine	775	Vas donc présenter ta tête au joug affreux qui t' attend;	39	40	11	2	0.1818181818181818	[['ton'], ['tête']]	0.07692307692307693	0.07692307692307693	0.030181086519114688	0.0	0.04779163569459131
Leonard_Clementine	776	vas te jeter dans les bras de Norton: mais crains de me trouver aux autels, et d' y voir couler tout le sang de mon rival!	39	41	26	1	0.0384615384615384	[['bras']]	0.08108108108108109	0.07142857142857142	0.030181086519114688	0.0	0.04779163569459131
Leonard_Clementine	777	LETTRE 21 Henriette à Seligny.	40	0	5	0	0.0	[]	0.0	0.030303030303030304	0.0	0.0	0.0
Leonard_Clementine	778	homme ingrat!	41	0	2	0	0.0	[]	0.0	0.0	0.017361111111111112	0.0	0.056697863140107115
Leonard_Clementine	779	Quel temps choisissez-vous pour me faire des reproches!	41	1	9	0	0.0	[]	0.0	0.0	0.017361111111111112	0.0	0.056697863140107115
Leonard_Clementine	780	C' est le moment où j' essuie pour vous les persécutions les plus cruelles!	41	2	14	0	0.0	[]	0.0	0.0	0.017361111111111112	0.0	0.056697863140107115
Leonard_Clementine	781	Connoissez celle que vous outragez.	41	3	5	0	0.0	[]	0.027777777777777776	0.027777777777777776	0.017361111111111112	0.0	0.056697863140107115
Leonard_Clementine	782	On menace de m' ensevelir dans un cloître, si je n' épouse Norton: mais je reste inébranlable.	41	4	17	1	0.0588235294117647	[['menacer']]	0.05714285714285714	0.05714285714285714	0.017361111111111112	0.0	0.056697863140107115
Leonard_Clementine	783	Mon corps est à cette mère inhumaine: mais mon cœur est à toi.	41	5	13	1	0.0769230769230769	[['corps']]	0.047619047619047616	0.047619047619047616	0.017361111111111112	0.0	0.056697863140107115
Leonard_Clementine	784	Tu peux compter sur ma promesse: je la scellerois de mon sang.	41	6	12	0	0.0	[]	0.030303030303030304	0.030303030303030304	0.017361111111111112	0.0	0.056697863140107115
Leonard_Clementine	785	J' écris à la dérobée:je suis observée;	41	7	8	0	0.0	[]	0.0	0.0	0.017361111111111112	0.0	0.056697863140107115
Leonard_Clementine	786	je crains d' être surprise.	41	8	5	0	0.0	[]	0.0	0.0	0.017361111111111112	0.0	0.056697863140107115
Leonard_Clementine	787	Plaignez-moi: soyez juste, et n' affligez point l' amante la plus tendre.	41	9	13	0	0.0	[]	0.07692307692307693	0.07692307692307693	0.017361111111111112	0.0	0.056697863140107115
Leonard_Clementine	788	Mes yeux sont obscurcis par les pleurs: ah!	41	10	8	2	0.25	[['oeil'], ['pleur']]	0.06451612903225806	0.06451612903225806	0.017361111111111112	0.0	0.056697863140107115
Leonard_Clementine	789	Du moins, n' en faites point couler de plus amers!	41	11	10	0	0.0	[]	0.0392156862745098	0.0392156862745098	0.017361111111111112	0.0	0.056697863140107115
Leonard_Clementine	790	Je n' ai pas besoin de réfléchir sur la proposition que vous me faites, toute séduisante qu' elle est: le ciel sait que le plus cher de mes vœux est de vous posséder.	41	12	33	0	0.0	[]	0.0	0.0	0.017361111111111112	0.0	0.056697863140107115
Leonard_Clementine	791	Demandez-moi que je vous sacrifie mon repos, mon bonheur et ma vie: vous le pouvez;	41	13	16	0	0.0	[]	0.0	0.0	0.017361111111111112	0.0	0.056697863140107115
Leonard_Clementine	792	ils sont à vous: mais laissez-moi mavertu.	41	14	8	0	0.0	[]	0.0	0.0	0.017361111111111112	0.0	0.056697863140107115
Leonard_Clementine	793	ô Seligny!	41	15	2	0	0.0	[]	0.0	0.0	0.017361111111111112	0.0	0.056697863140107115
Leonard_Clementine	794	Voudrois	41	16	1	0	0.0	[]	0.0	0.0	0.017361111111111112	0.0	0.056697863140107115
Leonard_Clementine	795	-tu me l' enlever cette vertu, qui élève au fond de mon âme une consolation secrète?	41	17	16	0	0.0	[]	0.0	0.0	0.017361111111111112	0.0	0.056697863140107115
Leonard_Clementine	796	Et quand je pourrais me résoudre à fuir avec toi, que ferions-nous sans fortune, sans amis, poursuivis par les lois, déshérités par une mère, et livrés à tous les fléaux de l' humanité?	41	18	34	0	0.0	[]	0.0	0.0	0.017361111111111112	0.0	0.056697863140107115
Leonard_Clementine	797	Non, mon âme est plus fière: mes pensées sont plus hautes.	41	19	11	0	0.0	[]	0.0	0.0	0.017361111111111112	0.0	0.056697863140107115
Leonard_Clementine	798	Je veux faire rougir une mère de sa haine: je ne lui donnerai point le plaisir odieux d' être justifiée par ma conduite.	41	20	23	0	0.0	[]	0.0	0.0	0.017361111111111112	0.0	0.056697863140107115
Leonard_Clementine	799	N' est-ce point assezd' être malheureux, sans nous rendre coupables?	41	21	11	0	0.0	[]	0.023255813953488372	0.023255813953488372	0.017361111111111112	0.0	0.056697863140107115
Leonard_Clementine	800	Quant à Norton, est-il digne de ta vengeance?	41	22	9	1	0.1111111111111111	[['ton']]	0.03571428571428571	0.03571428571428571	0.017361111111111112	0.0	0.056697863140107115
Leonard_Clementine	801	On ne doit punir qu' un rival aimé.	41	23	8	0	0.0	[]	0.058823529411764705	0.05263157894736842	0.017361111111111112	0.0	0.056697863140107115
Leonard_Clementine	802	LETTRE 22	42	0	2	0	0.0	[]	0.0	0.0	0.0	0.0	0.0
Leonard_Clementine	803	Seligny à M	42	1	3	0	0.0	[]	0.0	0.0	0.0	0.0	0.0
Leonard_Clementine	804	De Murcé	42	2	2	0	0.0	[]	0.0	0.0	0.0	0.0	0.0
Leonard_Clementine	805	.	42	3	0	0	0.0	[]	0.0	0.0	0.0	0.0	0.0
Leonard_Clementine	806	que d' infructueux voyages!	43	0	4	0	0.0	[]	0.0	0.0	0.0024390243902439024	0.0	0.011225331376673435
Leonard_Clementine	807	Que d' allées et de venues pour un objet que je ne peux plus revoir!	43	1	15	0	0.0	[]	0.0	0.0	0.0024390243902439024	0.0	0.011225331376673435
Leonard_Clementine	808	Henriette est perdue pour moi: sa mère me l' a ravie.	43	2	11	0	0.0	[]	0.0	0.0	0.0024390243902439024	0.0	0.011225331376673435
Leonard_Clementine	809	Toutes les informations, toutes les courses que j' ai faites	43	3	10	0	0.0	[]	0.0	0.0	0.0024390243902439024	0.0	0.011225331376673435
Leonard_Clementine	810	, n' ont servi qu' à me plonger dans l' horreur du doute.	43	4	12	0	0.0	[]	0.0	0.0	0.0024390243902439024	0.0	0.011225331376673435
Leonard_Clementine	811	Les barbares!	43	5	2	0	0.0	[]	0.0	0.0	0.0024390243902439024	0.0	0.011225331376673435
Leonard_Clementine	812	Ils vont la sacrifier: ils la feront mourir!	43	6	8	0	0.0	[]	0.0	0.0	0.0024390243902439024	0.0	0.011225331376673435
Leonard_Clementine	813	Est-ce ainsi qu' on ramène un cœur?	43	7	8	0	0.0	[]	0.0	0.0	0.0024390243902439024	0.0	0.011225331376673435
Leonard_Clementine	814	J' irai chez Madame De Berville: je lui demanderai compte de safille: il faudra qu' elle m' apprenne quel cachos l' enferme, ou j' aurai recours aux lois.	43	8	28	0	0.0	[]	0.0	0.0	0.0024390243902439024	0.0	0.011225331376673435
Leonard_Clementine	815	Les lois sont l' appui de l' opprimé: tout citoyen est sous leur garde, et la puissance paternelle leur est soumise.	43	9	21	0	0.0	[]	0.0	0.0	0.0024390243902439024	0.0	0.011225331376673435
Leonard_Clementine	816	Il est injuste, il est affreux qu' une mère puisse, au gré de ses caprices, tyranniser sa fille.	43	10	18	0	0.0	[]	0.0	0.0	0.0024390243902439024	0.0	0.011225331376673435
Leonard_Clementine	817	Cette fille est un dépôt qui lui est confié par l' état, et c' est un crime d' en abuser.	43	11	20	0	0.0	[]	0.0	0.0	0.0024390243902439024	0.0	0.011225331376673435
Leonard_Clementine	818	Je connais Madame De Berville: je connais cette marâtre à qui la nature ne s' est jamais fait entendre.	43	12	19	0	0.0	[]	0.01818181818181818	0.01818181818181818	0.0024390243902439024	0.0	0.011225331376673435
Leonard_Clementine	819	Elle mettra le poignard sur le sein de l' infortunée,pour la forcer de se livrer;	43	13	16	1	0.0625	[['sein']]	0.02127659574468085	0.02127659574468085	0.0024390243902439024	0.0	0.011225331376673435
Leonard_Clementine	820	et je ne volerois pas au devant du coup qui la menace!	43	14	12	0	0.0	[]	0.03125	0.03125	0.0024390243902439024	0.0	0.011225331376673435
Leonard_Clementine	821	Chere et généreuse Henriette!	43	15	4	0	0.0	[]	0.0	0.0	0.0024390243902439024	0.0	0.011225331376673435
Leonard_Clementine	822	C' est pour moi qu' elle souffre!	43	16	7	0	0.0	[]	0.0	0.0	0.0024390243902439024	0.0	0.011225331376673435
Leonard_Clementine	823	Et je serais tranquille!	43	17	4	0	0.0	[]	0.0	0.0	0.0024390243902439024	0.0	0.011225331376673435
Leonard_Clementine	824	Non, j' irai la sauver de sa prison.	43	18	8	0	0.0	[]	0.0	0.0	0.0024390243902439024	0.0	0.011225331376673435
Leonard_Clementine	825	Si mes efforts sont vains, ne vous attendez plus à me revoir.	43	19	12	0	0.0	[]	0.0	0.0	0.0024390243902439024	0.0	0.011225331376673435
Leonard_Clementine	826	Je fuirai les hommes: je traînerai dans les déserts une vie empoisonnée par la douleur: j' irai, dans quelque île éloignée, porter le souvenir de mon amante.	43	20	27	0	0.0	[]	0.0	0.0	0.0024390243902439024	0.0	0.011225331376673435
Leonard_Clementine	827	Je ne vois plus qu' avec horreur ce jour qui éclaire des coupables: je suis étranger dans lemonde.	43	21	18	0	0.0	[]	0.0	0.0	0.0024390243902439024	0.0	0.011225331376673435
Leonard_Clementine	828	L' orgueil et l' intérêt en sont les dieux.	43	22	9	0	0.0	[]	0.0	0.0	0.0024390243902439024	0.0	0.011225331376673435
Leonard_Clementine	829	Le plus saint des contrats, l' union la plus auguste, est un vil marché,	43	23	14	0	0.0	[]	0.0	0.0	0.0024390243902439024	0.0	0.011225331376673435
Leonard_Clementine	830	où le plus offrant l' emporte.	43	24	6	0	0.0	[]	0.0	0.0	0.0024390243902439024	0.0	0.011225331376673435
Leonard_Clementine	831	On sacrifie à des titres vains, à des richesses d' opinion, la paix, l' estime, l' amitié, la confiance;	43	25	19	0	0.0	[]	0.0	0.0	0.0024390243902439024	0.0	0.011225331376673435
Leonard_Clementine	832	et, parcequ' on s' est moins occupé d' assortir les cœurs que les fortunes, on fait des malheureux qui se détestent, et qui maudissent tous les jours de leur vie l' instant de leur union.	43	26	35	0	0.0	[]	0.0	0.0	0.0024390243902439024	0.0	0.011225331376673435
Leonard_Clementine	833	Que je méprise ce monde avare et lâche!	43	27	8	0	0.0	[]	0.0	0.0	0.0024390243902439024	0.0	0.011225331376673435
Leonard_Clementine	834	ô mon ami!	43	28	3	0	0.0	[]	0.0	0.0	0.0024390243902439024	0.0	0.011225331376673435
Leonard_Clementine	835	Vous n' aurez jamais à rougir de votre élève;	43	29	9	0	0.0	[]	0.0	0.0	0.0024390243902439024	0.0	0.011225331376673435
Leonard_Clementine	836	jeserai toujours digne de vous, digne de la vertu: mais l' amour fait mon destin, et je prévois qu' il fera ma perte.	43	30	23	0	0.0	[]	0.0	0.0	0.0024390243902439024	0.0	0.011225331376673435
Leonard_Clementine	837	LETTRE 23 M	44	0	3	0	0.0	[]	0.0	0.0	0.0	0.0	0.0
Leonard_Clementine	838	De Murcé	44	1	2	0	0.0	[]	0.0	0.0	0.0	0.0	0.0
Leonard_Clementine	839	à Seligny	44	2	2	0	0.0	[]	0.0	0.0	0.0	0.0	0.0
Leonard_Clementine	840	.	44	3	0	0	0.0	[]	0.0	0.0	0.0	0.0	0.0
Leonard_Clementine	841	vous avez raison de crier à l' injustice.	45	0	8	0	0.0	[]	0.027777777777777776	0.027777777777777776	0.01386748844375963	0.0	0.023034121182941795
Leonard_Clementine	842	Il est inoui qu' une mère enferme sa fille pour l' éloigner de vous, pour rendre le calme à ses sens, pour ôter toute voie à la séduction.	45	1	28	1	0.0357142857142857	[['calme']]	0.015151515151515152	0.015151515151515152	0.01386748844375963	0.0	0.023034121182941795
Leonard_Clementine	843	C' est un crime qui mérite toute la sévérité des lois, et vous ferez bien de les invoquer: les tribunaux ne pourront vous entendre sans être émus de vos plaintes.	45	2	30	0	0.0	[]	0.011235955056179775	0.011235955056179775	0.01386748844375963	0.0	0.023034121182941795
Leonard_Clementine	844	Vous ferez bien encore d' aller chez Madame De Berville, lui demander compte de sa fille:elle vous le doit, ce compte, par l' intérêt que vous prenez à sa famille;	45	3	31	0	0.0	[]	0.0	0.0	0.01386748844375963	0.0	0.023034121182941795
Leonard_Clementine	845	et elle ne manquera point de vous exposer les motifs de sa conduite...	45	4	13	0	0.0	[]	0.0	0.0	0.01386748844375963	0.0	0.023034121182941795
Leonard_Clementine	846	insensé!	45	5	1	0	0.0	[]	0.0	0.0	0.01386748844375963	0.0	0.023034121182941795
Leonard_Clementine	847	Votre lettre me fait pitié!	45	6	5	0	0.0	[]	0.038461538461538464	0.038461538461538464	0.01386748844375963	0.0	0.023034121182941795
Leonard_Clementine	848	Je n' y reconnais plus cette raison qui paraissait jeter quelques lueurs dans la nuit des passions: elle m' alarme sur votre état, et je crains que l' amour n' achève d' éteindre en vous ces faibles étincelles que j' avais pris soin d' y nourrir.	45	7	46	2	0.0434782608695652	[['éteindre'], ['faible']]	0.03571428571428571	0.03571428571428571	0.01386748844375963	0.0	0.023034121182941795
Leonard_Clementine	849	Que les hommes sont injustes!	45	8	5	0	0.0	[]	0.03636363636363636	0.03636363636363636	0.01386748844375963	0.0	0.023034121182941795
Leonard_Clementine	850	Qu' ils sont inconséquents!	45	9	4	0	0.0	[]	0.0	0.0	0.01386748844375963	0.0	0.023034121182941795
Leonard_Clementine	851	Mettez-vous à la place de cette mère, et jugez-vous.	45	10	11	0	0.0	[]	0.0	0.0	0.01386748844375963	0.0	0.023034121182941795
Leonard_Clementine	852	Est-ce à vous, monsieur, qu' elle doit sa fille?	45	11	10	0	0.0	[]	0.0	0.0	0.01386748844375963	0.0	0.023034121182941795
Leonard_Clementine	853	à vous qui n' avez que vos talents?	45	12	8	0	0.0	[]	0.0	0.0	0.01386748844375963	0.0	0.023034121182941795
Leonard_Clementine	854	La blâmerez-vous, de préferer un homme dont la fortune et le rang lui conviennent?	45	13	15	0	0.0	[]	0.018518518518518517	0.018518518518518517	0.01386748844375963	0.0	0.023034121182941795
Leonard_Clementine	855	Il serait digne d' une tête exaltée comme la vôtre, d' aller vous mesurer avec Norton, de faire un éclat scandaleux qui compromît votre amante, et qui vous perdît tous deux.	45	14	31	1	0.032258064516129	[['tête']]	0.02	0.02	0.01386748844375963	0.0	0.023034121182941795
Leonard_Clementine	856	Mais, qui êtes-vous?	45	15	4	0	0.0	[]	0.022727272727272728	0.022727272727272728	0.01386748844375963	0.0	0.023034121182941795
Leonard_Clementine	857	Pour aller imposer des lois chez Madame De Berville?	45	16	9	0	0.0	[]	0.0	0.0	0.01386748844375963	0.0	0.023034121182941795
Leonard_Clementine	858	Pour vouloir en chasser quelqu' un dont elle a fait choix?	45	17	11	0	0.0	[]	0.0	0.0	0.01386748844375963	0.0	0.023034121182941795
Leonard_Clementine	859	Est-ce là le prix de l' hospitalité?	45	18	8	0	0.0	[]	0.0	0.0	0.01386748844375963	0.0	0.023034121182941795
Leonard_Clementine	860	Est-ce ainsi que vouspayez vos hôtes de leur accueil?	45	19	10	0	0.0	[]	0.0	0.0	0.01386748844375963	0.0	0.023034121182941795
Leonard_Clementine	861	Prenez-y garde, monsieur, non pour vous, qui êtes accoutumé à l' infortune, mais pour Henriette, qui a toujours vécu dans l' aisance, et qui ne connaît encore de peines que celles du cœur.	45	20	34	0	0.0	[]	0.0	0.0	0.01386748844375963	0.0	0.023034121182941795
Leonard_Clementine	862	Si vous lui faites manquer son établissement, si vous lui persuadez même de fuir avec vous (ce qui serait le comble de la démence), que deviendrez-vous, frappé de la malédiction d' une mère qui demandera vengeance au ciel contre le séducteur de sa fille?	45	21	46	0	0.0	[]	0.0	0.0	0.01386748844375963	0.0	0.023034121182941795
Leonard_Clementine	863	Eh!	45	22	1	0	0.0	[]	0.0	0.0	0.01386748844375963	0.0	0.023034121182941795
Leonard_Clementine	864	Ne croyez pas que votre amour vous console:il faut laisser aux romans ces folles illusions.	45	23	16	0	0.0	[]	0.0196078431372549	0.0196078431372549	0.01386748844375963	0.0	0.023034121182941795
Leonard_Clementine	865	Quand la voix impérieuse du besoin se fait entendre, quand l' infortune aigrit l' âme, quand on est entouré du désespoir, du remors et des terreurs de l' avenir, est-on porté vers la tendresse?	45	24	34	1	0.0294117647058823	[['voix']]	0.014925373134328358	0.014925373134328358	0.01386748844375963	0.0	0.023034121182941795
Leonard_Clementine	866	Je ne dis rien de vos projets de retraite, c' est le rêve d' un cerveau malade.	45	25	17	0	0.0	[]	0.02247191011235955	0.02247191011235955	0.01386748844375963	0.0	0.023034121182941795
Leonard_Clementine	867	Vous rougirez, après la fièvre, des discours que vous teniez dans l' accès: s' ils étaient le fruit de vos réflexions, si vous pouviez, de sang-froid, renoncer à l' amitié, aux humains, à l' espoird' être utile;	45	26	38	1	0.0263157894736842	[['froid']]	0.011764705882352941	0.011764705882352941	0.01386748844375963	0.0	0.023034121182941795
Leonard_Clementine	868	si vous pouviez m' abandonner, moi qui ai pris soin de votre enfance, qui vous ai toujours chéri comme un fils, qui ai versé pour vous tant de larmes, ingrat!	45	27	30	0	0.0	[]	0.013513513513513514	0.013513513513513514	0.01386748844375963	0.0	0.023034121182941795
Leonard_Clementine	869	Cette lettre serait mon dernier adieu.	45	28	6	0	0.0	[]	0.0	0.0	0.01386748844375963	0.0	0.023034121182941795
Leonard_Clementine	870	Mais n' est-il pas temps de s' éveiller?	45	29	9	0	0.0	[]	0.0	0.0	0.01386748844375963	0.0	0.023034121182941795
Leonard_Clementine	871	Que signifient toutes ces courses?	45	30	5	0	0.0	[]	0.0	0.0	0.01386748844375963	0.0	0.023034121182941795
Leonard_Clementine	872	Et pourquoi ne pas laisser en paix cette victime qui vous échappe?	45	31	12	0	0.0	[]	0.0	0.0	0.01386748844375963	0.0	0.023034121182941795
Leonard_Clementine	873	Je vous invitois à revenir à moi: vous m' avez longtemps éludé;	45	32	12	0	0.0	[]	0.0	0.0	0.01386748844375963	0.0	0.023034121182941795
Leonard_Clementine	874	trop de nœuds vous attachaient: maintenant qu' ilssont rompus, qui vous arrête encore?	45	33	13	0	0.0	[]	0.0	0.0	0.01386748844375963	0.0	0.023034121182941795
Leonard_Clementine	875	ô mon fils!	45	34	3	0	0.0	[]	0.0	0.0	0.01386748844375963	0.0	0.023034121182941795
Leonard_Clementine	876	Mon cher fils!	45	35	3	0	0.0	[]	0.0	0.0	0.01386748844375963	0.0	0.023034121182941795
Leonard_Clementine	877	Revenez à votre père.	45	36	4	0	0.0	[]	0.08	0.08	0.01386748844375963	0.0	0.023034121182941795
Leonard_Clementine	878	Venez, dans le sein de l' amitié, chercher des secours contre l' amour: mes bras vous sont ouverts:	45	37	18	2	0.1111111111111111	[['sein'], ['bras']]	0.09090909090909091	0.09090909090909091	0.01386748844375963	0.0	0.023034121182941795
Leonard_Clementine	879	je vous consolerai: j' adoucirai vos peines: je fermerai votre blessure.	45	38	11	1	0.0909090909090909	[['consoler']]	0.07317073170731707	0.07317073170731707	0.01386748844375963	0.0	0.023034121182941795
Leonard_Clementine	880	Vous craignez peut-être un censeur qui vous gêne: mes principes vous effarouchent.	45	39	12	0	0.0	[]	0.04	0.04	0.01386748844375963	0.0	0.023034121182941795
Leonard_Clementine	881	Mais, monsieur!	45	40	2	0	0.0	[]	0.0	0.0	0.01386748844375963	0.0	0.023034121182941795
Leonard_Clementine	882	étouffez une passion sans espoir: osez penser, agir en homme!	45	41	10	0	0.0	[]	0.0	0.0	0.01386748844375963	0.0	0.023034121182941795
Leonard_Clementine	883	Occupez-vous de vos devoirs;	45	42	5	0	0.0	[]	0.0	0.0	0.01386748844375963	0.0	0.023034121182941795
Leonard_Clementine	884	ils sont sans nombre.	45	43	4	0	0.0	[]	0.0	0.0	0.01386748844375963	0.0	0.023034121182941795
Leonard_Clementine	885	Rendez uncitoyen à l' état, rendez-vous à vous-même, et vous ne craindrez plus la vérité.	45	44	16	0	0.0	[]	0.0	0.0	0.01386748844375963	0.0	0.023034121182941795
Leonard_Clementine	886	LETTRE 24 Henriette à Seligny.	46	0	5	0	0.0	[]	0.0	0.0	0.0	0.0	0.0
Leonard_Clementine	887	comment vous faire parvenir cette lettre?	47	0	6	0	0.0	[]	0.0	0.0	0.025906735751295335	0.0	0.04332556829345876
Leonard_Clementine	888	Et quel est mon but en l' écrivant?	47	1	8	0	0.0	[]	0.037037037037037035	0.037037037037037035	0.025906735751295335	0.0	0.04332556829345876
Leonard_Clementine	889	Je ne vous reverrai jamais: je suis condamnée à vivre, à mourir ici.	47	2	13	1	0.0769230769230769	[['mourir']]	0.027777777777777776	0.027777777777777776	0.025906735751295335	0.0	0.04332556829345876
Leonard_Clementine	890	Chaque jour resserre mes chaînes, et je n' ai plus d' espoir de les briser.	47	3	15	0	0.0	[]	0.025	0.025	0.025906735751295335	0.0	0.04332556829345876
Leonard_Clementine	891	Vous, dont l' âme honnête avait mérité tous mes sentiments, ô Seligny!	47	4	12	0	0.0	[]	0.0	0.0	0.025906735751295335	0.0	0.04332556829345876
Leonard_Clementine	892	Que faites-vous maintenant?	47	5	4	0	0.0	[]	0.0	0.0	0.025906735751295335	0.0	0.04332556829345876
Leonard_Clementine	893	Où êtes-vous?	47	6	3	0	0.0	[]	0.0	0.0	0.025906735751295335	0.0	0.04332556829345876
Leonard_Clementine	894	Connoissez-vous mon sort?	47	7	4	0	0.0	[]	0.0	0.0	0.025906735751295335	0.0	0.04332556829345876
Leonard_Clementine	895	Hélas!	47	8	1	0	0.0	[]	0.0	0.0	0.025906735751295335	0.0	0.04332556829345876
Leonard_Clementine	896	Vous ignorez combien je souffre;	47	9	5	0	0.0	[]	0.0	0.0	0.025906735751295335	0.0	0.04332556829345876
Leonard_Clementine	897	le ciel seul en esttémoin: c' est devant lui que je répands mon cœur ulcéré par la douleur;	47	10	18	0	0.0	[]	0.0	0.0	0.025906735751295335	0.0	0.04332556829345876
Leonard_Clementine	898	c' est à lui que j' adresse mes plaintes: et ce ciel est impitoyable!	47	11	14	0	0.0	[]	0.0	0.0	0.025906735751295335	0.0	0.04332556829345876
Leonard_Clementine	899	Le brillant avenir qui s' offrait à mon esprit séduit a disparu comme un rêve.	47	12	15	0	0.0	[]	0.04	0.04	0.025906735751295335	0.0	0.04332556829345876
Leonard_Clementine	900	Ton image même, ton image adorée, n' est plus qu' un fantôme qui se perd dans la nuit de mes songes.	47	13	21	2	0.0952380952380952	[['ton'], ['ton']]	0.05128205128205128	0.05128205128205128	0.025906735751295335	0.0	0.04332556829345876
Leonard_Clementine	901	ô mon ami!	47	14	3	0	0.0	[]	0.07142857142857142	0.07142857142857142	0.025906735751295335	0.0	0.04332556829345876
Leonard_Clementine	902	Tu n' es pas ici pour me consoler: tu es peut-être bien loin: tu me cherches peut-être... va!	47	15	18	1	0.0555555555555555	[['consoler']]	0.05660377358490566	0.05660377358490566	0.025906735751295335	0.0	0.04332556829345876
Leonard_Clementine	903	Tu n' es pas le plus à plaindre: ta liberté ne t' est pas ravie: tu n' as point à respecter la main quite frappe: tes murmures ne sont pas un crime...	47	16	32	2	0.0625	[['ton'], ['main']]	0.057692307692307696	0.057692307692307696	0.025906735751295335	0.0	0.04332556829345876
Leonard_Clementine	904	mais, moi!	47	17	2	0	0.0	[]	0.04878048780487805	0.04878048780487805	0.025906735751295335	0.0	0.04332556829345876
Leonard_Clementine	905	Que mon état est digne de pitié!	47	18	7	0	0.0	[]	0.0	0.0	0.025906735751295335	0.0	0.04332556829345876
Leonard_Clementine	906	Parmi de pieuses solitaires qui cachent le fiel dans leur cœur, au milieu des haines, des jalousies, des intrigues!	47	19	19	0	0.0	[]	0.0	0.0	0.025906735751295335	0.0	0.04332556829345876
Leonard_Clementine	907	Et cependant il faut vivre avec ces passions, qui se nourrissent dans le silence du cloître!	47	20	16	0	0.0	[]	0.0	0.0	0.025906735751295335	0.0	0.04332556829345876
Leonard_Clementine	908	Il faut essuyer les sermons de ces froides vestales!	47	21	9	0	0.0	[]	0.0	0.0	0.025906735751295335	0.0	0.04332556829345876
Leonard_Clementine	909	Et toi, mon ami, tu viens me tourmenter aussi!	47	22	9	0	0.0	[]	0.041666666666666664	0.041666666666666664	0.025906735751295335	0.0	0.04332556829345876
Leonard_Clementine	910	Et ton idée qui me poursuit, et ma religion qui m' épouvante, et mon dieu qui m' appelle, et ma merequi me menace, tout se réunit pour déchirer ma blessure!	47	23	30	2	0.0666666666666666	[['ton'], ['menacer']]	0.05	0.05	0.025906735751295335	0.0	0.04332556829345876
Leonard_Clementine	911	ô!	47	24	1	0	0.0	[]	0.04878048780487805	0.04878048780487805	0.025906735751295335	0.0	0.04332556829345876
Leonard_Clementine	912	Que cette religion est impuissante contre le délire des passions!	47	25	10	0	0.0	[]	0.0	0.0	0.025906735751295335	0.0	0.04332556829345876
Leonard_Clementine	913	Non, je n' écouterai point sa voix;	47	26	7	0	0.0	[]	0.0	0.0	0.025906735751295335	0.0	0.04332556829345876
Leonard_Clementine	914	je ne serai point parjure à mon amant.	47	27	8	0	0.0	[]	0.0	0.0	0.025906735751295335	0.0	0.04332556829345876
