Mercier_An	1900	Le temps n'a voituré jusqu'à nous que les choses légères brillantes qui ont eu l'approbation de la multitude, tandis qu'il a englouti les pensées mâles fortes qui étaient trop simples ou trop élevées pour plaire au vulgaire.	306	5	41	1	0.024390243902439	[['mâle']]	0.07017543859649122	0.045454545454545456	0.05142857142857143	0.0121951219512195	0.07412815429221539
Mercier_An	1901	Comme nos jours sont bornés, qu'ils ne doivent pas être consumés dans une philosophie puérile, nous avons porté un coup décisif aux misérables controverses de l'école.---Qu'avez vous fait ?	307	0	31	0	0.0	[]	0.01694915254237288	0.02	0.012552301255230125	0.0	0.023478603098927027
Mercier_An	1902	Achevez, s'il vous plaît.---D'un consentement unanime, nous avons rassemblé dans une vaste plaine tous les livres que nous avons jugé ou frivoles ou inutiles ou dangereux ;	307	1	28	1	0.0357142857142857	[['vaste']]	0.024096385542168676	0.024096385542168676	0.012552301255230125	0.0	0.023478603098927027
Mercier_An	1903	nous en avons formé une pyramide qui ressemblait en hauteur en grosseur à une tour énorme : c'était assurément une nouvelle tour de Babel.	307	2	24	1	0.0416666666666666	[['énorme']]	0.025974025974025976	0.025974025974025976	0.012552301255230125	0.0	0.023478603098927027
Mercier_An	1904	Les journaux couronnaient ce bizarre édifice, il était flanqué de toutes parts de mandemens d'évêques, de remontrances de parlemens, de réquisitoires d'oraisons funèbres.	307	3	25	0	0.0	[]	0.011904761904761904	0.011904761904761904	0.012552301255230125	0.0	0.023478603098927027
Mercier_An	1905	Il était composé de cinq ou six cent mille commentateurs, de huit cent mille volumes de jurisprudence, de cinquante mille dictionnaires, de cent mille poèmes, de seize cent mille voyages d'un milliard de romans.	307	4	35	0	0.0	[]	0.0	0.0	0.012552301255230125	0.0	0.023478603098927027
Mercier_An	1906	Nous avons mis le feu à cette masse épouvantable, comme un sacrifice expiatoire offert à la vérité, au bon sens, au vrai goût.	307	5	23	0	0.0	[]	0.0	0.0	0.012552301255230125	0.0	0.023478603098927027
Mercier_An	1907	Les flammes ont dévoré par torrent les sottises des hommes, tant anciens que modernes.	307	6	14	0	0.0	[]	0.0	0.0	0.012552301255230125	0.0	0.023478603098927027
Mercier_An	1908	L'embrasement fut long.	307	7	4	0	0.0	[]	0.029411764705882353	0.029411764705882353	0.012552301255230125	0.0	0.023478603098927027
Mercier_An	1909	Quelques auteurs se sont vus brûler tout vivant, mais leurs cris ne nous ont point arrêtés ;	307	8	16	1	0.0625	[['brûler']]	0.01694915254237288	0.01694915254237288	0.012552301255230125	0.0	0.023478603098927027
Mercier_An	1910	cependant nous avons trouvé au milieu des cendres quelques feuilles des œuvres de P***, de De La H***, de l'abbé A***, qui, vu leur extrême froideur, n'avaient jamais pu être consumées.	307	9	39	0	0.0	[]	0.01818181818181818	0.0136986301369863	0.012552301255230125	0.0	0.023478603098927027
Mercier_An	1911	Ainsi nous avons renouvelé par un zèle éclairé ce qu'avait exécuté jadis le zèle aveugle des barbares.	308	0	18	0	0.0	[]	0.0	0.0	0.011235955056179775	0.0	0.015421158465515766
Mercier_An	1912	Cependant comme nous ne sommes ni injustes ni semblables aux Sarrazins qui chauffaient leurs bains avec des chef	308	1	18	0	0.0	[]	0.0	0.0	0.011235955056179775	0.0	0.015421158465515766
Mercier_An	1913	-d'œuvres	308	2	2	0	0.0	[]	0.02040816326530612	0.02040816326530612	0.011235955056179775	0.0	0.015421158465515766
Mercier_An	1914	, nous avons fait un choix : de bons esprits ont tiré la substance de mille volumes in-folio, qu'ils ont fait passer tout entiers dans un petit in-douze ;	308	3	29	1	0.0344827586206896	[['petit']]	0.018867924528301886	0.018867924528301886	0.011235955056179775	0.0	0.015421158465515766
Mercier_An	1915	à peu près comme ces habiles chymistes, qui expriment la vertu des plantes, la concentrent dans une phiole, jettent le marc grossier .	308	4	22	0	0.0	[]	0.0196078431372549	0.015384615384615385	0.011235955056179775	0.0	0.015421158465515766
Mercier_An	1916	Nous avons fait des abrégés de ce qu'il y avait de plus important ;	309	0	14	0	0.0	[]	0.0	0.0	0.00847457627118644	0.0	0.00907218423253028
Mercier_An	1917	on a réimprimé le meilleur : le tout a été corrigé d'après les vrais principes de la morale.	309	1	18	0	0.0	[]	0.0	0.0	0.00847457627118644	0.0	0.00907218423253028
Mercier_An	1918	Nos compilateurs sont des gens estimables chers à la nation ;	309	2	10	0	0.0	[]	0.0	0.0	0.00847457627118644	0.0	0.00907218423253028
Mercier_An	1919	ils avaient du goût, comme ils étaient en état de créer ils ont su choisir l'excellent, rejeter ce qui ne l'était pas.	309	3	24	0	0.0	[]	0.012658227848101266	0.012658227848101266	0.00847457627118644	0.0	0.00907218423253028
Mercier_An	1920	Nous avons remarqué (car il faut être juste) qu'il n'appartenait qu'à des siècles philosophiques de composer très peu d'ouvrages ; mais que dans le vôtre, où les connaissances réelles solides n'étaient pas suffisamment établies, on ne pouvait trop entasser les matériaux.	309	4	45	1	0.0222222222222222	[['solide']]	0.013157894736842105	0.013157894736842105	0.00847457627118644	0.0	0.00907218423253028
Mercier_An	1921	Les manœuvres doivent travailler avant les architectes.	309	5	7	0	0.0	[]	0.019230769230769232	0.01282051282051282	0.00847457627118644	0.0	0.00907218423253028
Mercier_An	1922	Dans les commencement chaque science se traite par partie, chacun porte son attention sur la portion qui lui est échue : rien n'échappe par ce moyen ;	310	0	26	0	0.0	[]	0.03125	0.02564102564102564	0.02702702702702703	0.0	0.07384222976806251
Mercier_An	1923	on observe les plus petits détails.	310	1	6	1	0.1666666666666666	[['petit']]	0.023255813953488372	0.023255813953488372	0.02702702702702703	0.0	0.07384222976806251
Mercier_An	1924	Il était nécessaire que vous fissiez une multitude innombrable de livres ;	310	2	11	0	0.0	[]	0.038461538461538464	0.038461538461538464	0.02702702702702703	0.0	0.07384222976806251
Mercier_An	1925	c'était à nous de rassembler ces parties dispersées.	310	3	9	0	0.0	[]	0.034482758620689655	0.034482758620689655	0.02702702702702703	0.0	0.07384222976806251
Mercier_An	1926	Les hommes qui ont la tête vide des demi-lueurs	310	4	9	1	0.1111111111111111	[['tête']]	0.03225806451612903	0.03225806451612903	0.02702702702702703	0.0	0.07384222976806251
Mercier_An	1927	, sont d'éternels babillards : l'homme sage instruit parle peu, mais parle bien.	310	5	13	0	0.0	[]	0.045454545454545456	0.02857142857142857	0.02702702702702703	0.0	0.07384222976806251
Mercier_An	1928	Vous voyez ce cabinet : il renferme les livres qui ont échappé aux flammes ;	311	0	13	0	0.0	[]	0.05555555555555555	0.03225806451612903	0.03333333333333333	0.0	0.11547005383792518
Mercier_An	1929	ils sont en petit nombre ;	311	1	5	1	0.2	[['petit']]	0.03333333333333333	0.03333333333333333	0.03333333333333333	0.0	0.11547005383792518
Mercier_An	1930	mais ceux qui sont restés ont mérité l'approbation de notre siècle.	311	2	12	0	0.0	[]	0.058823529411764705	0.05555555555555555	0.03333333333333333	0.0	0.11547005383792518
Mercier_An	1931	Curieux	312	0	1	0	0.0	[]	0.0	0.0	0.014084507042253521	0.0	0.044721359549995794
Mercier_An	1932	, je m'approchai, consultant la première armoire, je vis qu'on avait conservé parmi les Grecs, Homere, Sophocle, Euripide, Demostene, Platon, surtout notre ami Plutarque ;	312	1	25	0	0.0	[]	0.027777777777777776	0.027777777777777776	0.014084507042253521	0.0	0.044721359549995794
Mercier_An	1933	mais on avait brûlé Hérodote, Sapho, Anacréon, le vil Aristophane.	312	2	10	1	0.1	[['brûler']]	0.022222222222222223	0.022222222222222223	0.014084507042253521	0.0	0.044721359549995794
Mercier_An	1934	Je voulus défendre un peu la cause du défunt Anacréon ;	312	3	10	0	0.0	[]	0.022222222222222223	0.022222222222222223	0.014084507042253521	0.0	0.044721359549995794
Mercier_An	1935	mais on me donna les meilleures raisons du monde, que je n'exposerai point ici, parce qu'elles ne seraient point entendues de mon siècle.	312	4	25	0	0.0	[]	0.0	0.0	0.014084507042253521	0.0	0.044721359549995794
Mercier_An	1936	Dans la deuxiéme armoire, destinée aux auteurs Latins, je trouvai Virgile, Pline en entier, ainsi que Tite Live ;	313	0	18	0	0.0	[]	0.024390243902439025	0.015151515151515152	0.042682926829268296	0.0	0.04809833963456061
Mercier_An	1937	mais on avait brûlé Lucrece, à l'exception de quelques morceaux poétiques, parce que sa physique est fausse que sa morale est dangereuse.	313	1	23	1	0.0434782608695652	[['brûler']]	0.03636363636363636	0.03636363636363636	0.042682926829268296	0.0	0.04809833963456061
Mercier_An	1938	On avait supprimé les longs plaidoyers de Cicéron, habile rhéteur plutôt qu'homme éloquent ;	313	2	14	1	0.0714285714285714	[['long']]	0.03773584905660377	0.03773584905660377	0.042682926829268296	0.0	0.04809833963456061
Mercier_An	1939	mais on avait conservé ses ouvrages philosophiques, un des morceaux les plus précieux de l'antiquité.	313	3	16	0	0.0	[]	0.030303030303030304	0.030303030303030304	0.042682926829268296	0.0	0.04809833963456061
Mercier_An	1940	Saluste était resté.	313	4	3	0	0.0	[]	0.0	0.0	0.042682926829268296	0.0	0.04809833963456061
Mercier_An	1941	Ovide Horace avaient été purgés : les odes du dernier paraissaient bien inférieures à ses épitres.	313	5	15	0	0.0	[]	0.0	0.0	0.042682926829268296	0.0	0.04809833963456061
Mercier_An	1942	Sénéque était réduit à un quart.	313	6	6	0	0.0	[]	0.0	0.0	0.042682926829268296	0.0	0.04809833963456061
Mercier_An	1943	Tacite avait été conservé ;	313	7	4	0	0.0	[]	0.06451612903225806	0.06451612903225806	0.042682926829268296	0.0	0.04809833963456061
Mercier_An	1944	mais comme il règne dans ses écrits une teinte sombre qui montre l'humanité en noir, qu'il faut n'avoir pas une mauvaise idée de la nature humaine, parce que ses tyrans ne sont pas elle, on ne permettait la lecture de cet auteur profond qu'à des cœurs bien faits.	313	8	52	4	0.0769230769230769	[['teindre'], ['sombre'], ['noir'], ['profond']]	0.06451612903225806	0.06451612903225806	0.042682926829268296	0.0	0.04809833963456061
Mercier_An	1945	Catulle avait disparu, ainsi que Petrone.	313	9	6	0	0.0	[]	0.07692307692307693	0.07692307692307693	0.042682926829268296	0.0	0.04809833963456061
Mercier_An	1946	Quintilien était d'un volume fort mince.	313	10	7	1	0.1428571428571428	[['fort']]	0.07692307692307693	0.05	0.042682926829268296	0.0	0.04809833963456061
Mercier_An	1947	La troisième armoire contenait les livres anglais .	314	0	7	0	0.0	[]	0.0	0.043478260869565216	0.006578947368421052	0.0	0.009803921568627432
Mercier_An	1948	C'était celle qui renfermait le plus de volumes.	314	1	9	0	0.0	[]	0.0	0.0	0.006578947368421052	0.0	0.009803921568627432
Mercier_An	1949	On y rencontrait tous les philosophes qu'a produit cette île guerrière, commerçante politique.	314	2	14	0	0.0	[]	0.0	0.0	0.006578947368421052	0.0	0.009803921568627432
Mercier_An	1950	Milton, Shakespear, Pope, Young , Richardson jouissaient encore de toute leur renommée.	314	3	11	0	0.0	[]	0.0	0.0	0.006578947368421052	0.0	0.009803921568627432
Mercier_An	1951	Leur génie créateur, ce génie que rien ne captivait, tandis que nous étions obligés de mesurer tous nos mots ;	314	4	19	0	0.0	[]	0.0	0.0	0.006578947368421052	0.0	0.009803921568627432
Mercier_An	1952	l'énergie féconde de ces âmes libres faisait l'admiration d'un siècle difficile.	314	5	14	0	0.0	[]	0.014925373134328358	0.014925373134328358	0.006578947368421052	0.0	0.009803921568627432
Mercier_An	1953	Le reproche futile que nous leur faisions de manquer de goût était effacé devant des hommes qui, amoureux d'idées vraies fortes, se donnaient la peine de lire savaient ensuite méditer sur leur lecture.	314	6	34	1	0.0294117647058823	[['fort']]	0.014705882352941176	0.014705882352941176	0.006578947368421052	0.0	0.009803921568627432
Mercier_An	1954	On avait retranché cependant du nombre des philosophes ces sceptiques dangereux qui avaient voulu ébranler les fondemens de la morale.	314	7	20	0	0.0	[]	0.01282051282051282	0.01282051282051282	0.006578947368421052	0.0	0.009803921568627432
Mercier_An	1955	Ce peuple vertueux, conduit par le sentiment, avait dédaigné ces vaines subtilités, rien n'avait pu lui persuader que la vertu fût une chimère.	314	8	24	0	0.0	[]	0.0	0.0	0.006578947368421052	0.0	0.009803921568627432
Mercier_An	1956	La quatrième armoire offrait les livres italiens.	315	0	7	0	0.0	[]	0.05	0.022727272727272728	0.03614457831325301	0.0	0.04385754713805775
Mercier_An	1957	La Jérusalem délivrée, le plus beau des poèmes connus, était à la tête.	315	1	13	1	0.0769230769230769	[['beau']]	0.06060606060606061	0.06060606060606061	0.03614457831325301	0.0	0.04385754713805775
Mercier_An	1958	On avait brûlé une bibliothèque entière de critiques faites contre ce poème enchanteur.	315	2	13	1	0.0769230769230769	[['brûler']]	0.045454545454545456	0.045454545454545456	0.03614457831325301	0.0	0.04385754713805775
Mercier_An	1959	Le fameux traité des délits des peines avait reçu toute la perfection dont cet important ouvrage était susceptible.	315	3	18	0	0.0	[]	0.02702702702702703	0.02702702702702703	0.03614457831325301	0.0	0.04385754713805775
Mercier_An	1960	Je fus agréablement surpris en voyant	315	4	6	0	0.0	[]	0.02857142857142857	0.02857142857142857	0.03614457831325301	0.0	0.04385754713805775
Mercier_An	1961	nombre d'ouvrages pensés philosophiques sortis du sein de cette nation ;	315	5	11	1	0.0909090909090909	[['sein']]	0.03125	0.03125	0.03614457831325301	0.0	0.04385754713805775
Mercier_An	1962	elle avait brisé le talisman qui semblait devoir perpétuer chez elle la superstition l'ignorance.	315	6	15	0	0.0	[]	0.038461538461538464	0.058823529411764705	0.03614457831325301	0.0	0.04385754713805775
Mercier_An	1963	Enfin j'arrivai en face des écrivains français .	316	0	8	1	0.125	[['face']]	0.13043478260869565	0.07894736842105263	0.04054054054054054	0.037037037037037	0.06620300994937499
Mercier_An	1964	Je portai une main avide sur les trois premiers volumes : c'étaient Descartes, Montaigne Charron.	316	1	15	2	0.1333333333333333	[['main'], ['avide']]	0.05454545454545454	0.05454545454545454	0.04054054054054054	0.037037037037037	0.06620300994937499
Mercier_An	1965	Montaigne avait souffert quelque retranchement : mais comme il est le philosophe qui a mieux connu la nature humaine, on avait conservé ses écrits, quoique toutes ses idées ne saient pas absolument irréprochables.	316	2	32	0	0.0	[]	0.06451612903225806	0.06451612903225806	0.04054054054054054	0.037037037037037	0.06620300994937499
Mercier_An	1966	On avait brûlé Mallebranche le visionnaire, le triste Nicole, l'impitoyable Arnauld, le cruel Bourdaloue.	316	3	15	2	0.1333333333333333	[['brûler'], ['triste']]	0.022988505747126436	0.022988505747126436	0.04054054054054054	0.037037037037037	0.06620300994937499
Mercier_An	1967	Tout ce qui concernait les disputes scholastiques était tellement anéanti, que lorsque je parlai des Lettres Provinciales de la destruction des Jésuites, le savant bibliothécaire fit un anachronisme des plus considérables : je le relevai poliment, il me remercia avec sincérité.	316	4	40	0	0.0	[]	0.036585365853658534	0.036585365853658534	0.04054054054054054	0.037037037037037	0.06620300994937499
Mercier_An	1968	Je ne pus jamais rencontrer ces Lettres Provinciales, ni l'histoire même plus moderne qui contenait le détail de cette grande affaire : elle était alors bien petite!	316	5	27	1	0.037037037037037	[['grand']]	0.01282051282051282	0.01282051282051282	0.04054054054054054	0.037037037037037	0.06620300994937499
Mercier_An	1969	On parlait des Jésuites comme nous parlons aujourd'hui des anciens Druides.	316	6	11	0	0.0	[]	0.02631578947368421	0.023809523809523808	0.04054054054054054	0.037037037037037	0.06620300994937499
Mercier_An	1970	On avait fait rentrer dans le néant, dont elle n'aurait jamais dû sortir, cette foule de théologiens dits pères de l'église , les écrivains les plus sophistiques, les plus bizarres, les plus obscurs, les plus déraisonnables, qui furent jamais, diamétralement opposés aux Loke, aux Clarke ;	317	0	46	1	0.0217391304347826	[['rentrer']]	0.016666666666666666	0.014084507042253521	0.016666666666666666	0.0108695652173913	0.015371886547533636
Mercier_An	1971	ils semblaient (me dit le bibliothécaire) avoir posé les bornes de la démence humaine.	317	1	14	0	0.0	[]	0.016666666666666666	0.014084507042253521	0.016666666666666666	0.0108695652173913	0.015371886547533636
Mercier_An	1972	J'ouvrois, je feuilletois, je cherchais les écrivains de ma connaissance.	318	0	11	0	0.0	[]	0.0	0.0	0.029508196721311476	0.0	0.04976720203742793
Mercier_An	1973	Ciel, quelle destruction!	318	1	3	0	0.0	[]	0.047619047619047616	0.047619047619047616	0.029508196721311476	0.0	0.04976720203742793
Mercier_An	1974	Que de gros livres évaporés en fumée!	318	2	7	1	0.1428571428571428	[['gros']]	0.04	0.04	0.029508196721311476	0.0	0.04976720203742793
Mercier_An	1975	Où est donc ce fameux Bossuet, imprimé de mon temps en vingt-deux volumes in quarto ?	318	3	15	0	0.0	[]	0.037037037037037035	0.037037037037037035	0.029508196721311476	0.0	0.04976720203742793
Mercier_An	1976	---Tout a disparu, me répondit	318	4	5	0	0.0	[]	0.0	0.0	0.029508196721311476	0.0	0.04976720203742793
Mercier_An	1977	on.---Quoi!	318	5	1	0	0.0	[]	0.0	0.0	0.029508196721311476	0.0	0.04976720203742793
Mercier_An	1978	cet aigle, qui planait dans la haute région des airs, ce génie...	318	6	12	0	0.0	[]	0.0	0.0	0.029508196721311476	0.0	0.04976720203742793
Mercier_An	1979	---En conscience	318	7	2	0	0.0	[]	0.0	0.0	0.029508196721311476	0.0	0.04976720203742793
Mercier_An	1980	, que pouvions-nous conserver ?	318	8	4	0	0.0	[]	0.0	0.0	0.029508196721311476	0.0	0.04976720203742793
Mercier_An	1981	Il avait du génie, d'accord ;	318	9	6	0	0.0	[]	0.0	0.0	0.029508196721311476	0.0	0.04976720203742793
Mercier_An	1982	mais il en a fait un pitoyable usage.	318	10	8	0	0.0	[]	0.0	0.0	0.029508196721311476	0.0	0.04976720203742793
Mercier_An	1983	Nous avons adopté la maxime de Montaigne : il ne faut pas s'enquérir quel est le plus savant, mais quel est le mieux savant .	318	11	24	0	0.0	[]	0.0	0.0	0.029508196721311476	0.0	0.04976720203742793
Mercier_An	1984	L'histoire universelle de ce Bossuet n'était qu'un pauvre squelette chronologique , sans vie sans couleur ;	318	12	17	0	0.0	[]	0.037037037037037035	0.037037037037037035	0.029508196721311476	0.0	0.04976720203742793
Mercier_An	1985	puis il avait donné un tour si forcé, si extraordinaire aux longues réflexions qui accompagnaient cette maigre production, que nous avons peine à croire qu'on ait lu cet ouvrage pendant plus de cinquante années.---Mais du moins ses oraisons funèbres...	318	13	40	3	0.075	[['long'], ['maigre'], ['pendant']]	0.06349206349206349	0.06349206349206349	0.029508196721311476	0.0	0.04976720203742793
Mercier_An	1986	---Nous ont fort irrité contre lui.	318	14	6	1	0.1666666666666666	[['fort']]	0.06779661016949153	0.06779661016949153	0.029508196721311476	0.0	0.04976720203742793
Mercier_An	1987	C'était bien là le misérable langage de la servitude de la flatterie.	318	15	13	0	0.0	[]	0.025974025974025976	0.025974025974025976	0.029508196721311476	0.0	0.04976720203742793
Mercier_An	1988	Qu'est-ce qu'un ministre du dieu de paix, du dieu de vérité, qui monte en chaire pour louer un politique sombre, un ministre avare, une femme vulgaire, un héros meurtrier, qui tout occupé, comme un poète, d'une description de bataille, ne laisse pas échapper un seul soupir sur cet horrible fléau qui désole la terre ?	318	16	58	1	0.0172413793103448	[['sombre']]	0.0297029702970297	0.0297029702970297	0.029508196721311476	0.0	0.04976720203742793
Mercier_An	1989	En ce moment il ne pensait point à soutenir les droits de l'humanité, à présenter au monarque ambitieux, par l'organe sacré de la religion, des vérités fortes terribles ;	318	17	30	2	0.0666666666666666	[['droit'], ['fort']]	0.03	0.03	0.029508196721311476	0.0	0.04976720203742793
Mercier_An	1990	il songeait plutôt à faire dire : voilà un homme qui parle bien ;	318	18	12	0	0.0	[]	0.0410958904109589	0.0410958904109589	0.029508196721311476	0.0	0.04976720203742793
Mercier_An	1991	il fait l'éloge des morts lorsque leurs cendres sont encore tièdes : à plus forte raison donnera-t-il une bonne dose d'encens aux rois qui ne sont pas décédés .	318	19	31	1	0.032258064516129	[['fort']]	0.023255813953488372	0.0196078431372549	0.029508196721311476	0.0	0.04976720203742793
Mercier_An	1992	Nous ne sommes point amis de ce Bossuet.	319	0	8	0	0.0	[]	0.0425531914893617	0.038461538461538464	0.05504587155963303	0.055944055944055895	0.030995575716137976
Mercier_An	1993	Outre qu'il était un homme orgueilleux, dur, un courtisan souple ambitieux, c'est lui qui a accrédité ces oraisons funèbres qui depuis se sont multipliées comme les flambeaux funéraires, qui, comme eux, exhalent en passant une odeur empoisonnée.	319	1	39	2	0.0512820512820512	[['dur'], ['souple']]	0.05263157894736842	0.05263157894736842	0.05504587155963303	0.055944055944055895	0.030995575716137976
Mercier_An	1994	Ce genre nous a paru le plus mauvais, le plus futile, le plus dangereux de tous, parce qu'il était tout à la fois faux, froid, menteur, fade, impudent ;	319	2	29	2	0.0689655172413793	[['faux'], ['froid']]	0.0594059405940594	0.0594059405940594	0.05504587155963303	0.055944055944055895	0.030995575716137976
Mercier_An	1995	en ce qu'il contredisait toujours le cri public qui allait frapper les murailles ou l'orateur, qui déclamait avec faste, riait lui-même tout bas des couleurs mensongères dont il parait son idole.	319	3	33	2	0.0606060606060606	[['bas'], ['couleur']]	0.06451612903225806	0.06349206349206349	0.05504587155963303	0.055944055944055895	0.030995575716137976
Mercier_An	1996	Voyez	320	0	1	0	0.0	[]	0.02631578947368421	0.04225352112676056	0.03680981595092025	0.0135135135135135	0.053565334782145334
Mercier_An	1997	son rival, son vainqueur doux modeste, cet aimable, ce sensible Fenelon, auteur du Télémaque de plusieurs autres ouvrages que nous avons soigneusement conservés, parce qu'on y trouve l'accord rare heureux de la raison du sentiment .	320	1	37	1	0.027027027027027	[['rare']]	0.018518518518518517	0.018518518518518517	0.03680981595092025	0.0135135135135135	0.053565334782145334
Mercier_An	1998	Avoir composé le Télémaque à la cour de Louis XIV nous semble une vertu étonnante, admirable.	320	2	16	0	0.0	[]	0.013333333333333334	0.013333333333333334	0.03680981595092025	0.0135135135135135	0.053565334782145334
Mercier_An	1999	Certainement le monarque n'a pas compris le livre, c'est ce qu'on peut avancer de plus favorable en son honneur.	320	3	22	0	0.0	[]	0.018867924528301886	0.018867924528301886	0.03680981595092025	0.0135135135135135	0.053565334782145334
Mercier_An	2000	Sans doute il manque à cet ouvrage des lumières plus vastes, des connaissances plus approfondies ;	320	4	15	1	0.0666666666666666	[['vaste']]	0.02	0.02	0.03680981595092025	0.0135135135135135	0.053565334782145334
Mercier_An	2001	mais que dans sa simplicité il a de force, de noblesse de vérité!	320	5	13	0	0.0	[]	0.03636363636363636	0.03636363636363636	0.03680981595092025	0.0135135135135135	0.053565334782145334
Mercier_An	2002	Nous avons mis à côté de cet écrivain les œuvres du bon abbé de St Pierre, dont la plume était faible, mais dont le cœur était sublime.	320	6	27	1	0.037037037037037	[['faible']]	0.057692307692307696	0.057692307692307696	0.03680981595092025	0.0135135135135135	0.053565334782145334
Mercier_An	2003	Sept siècles ont donné à ses grandes belles idées la maturité convenable.	320	7	12	2	0.1666666666666666	[['grand'], ['beau']]	0.07547169811320754	0.07547169811320754	0.03680981595092025	0.0135135135135135	0.053565334782145334
Mercier_An	2004	C'étaient ceux qui le raillaient d'être visionnaire, qui embrassaient de pures chimères.	320	8	14	1	0.0714285714285714	[['pur']]	0.09375	0.09375	0.03680981595092025	0.0135135135135135	0.053565334782145334
Mercier_An	2005	Ses rêves sont devenus des réalités.	320	9	6	0	0.0	[]	0.05	0.043478260869565216	0.03680981595092025	0.0135135135135135	0.053565334782145334
Mercier_An	2006	Parmi les poète(s)	321	0	3	0	0.0	[]	0.0	0.0	0.043478260869565216	0.0	0.050570584729294835
Mercier_An	2007	François, je revis Corneille, Racine, Molière ;	321	1	6	0	0.0	[]	0.06666666666666667	0.06666666666666667	0.043478260869565216	0.0	0.050570584729294835
Mercier_An	2008	mais on avait brûlé leurs commentaires .	321	2	6	1	0.1666666666666666	[['brûler']]	0.05714285714285714	0.05714285714285714	0.043478260869565216	0.0	0.050570584729294835
Mercier_An	2009	Je fis au bibliothécaire la question que l'on fera encore probablement pendant sept cents années : auquel donneriez-vous la préférence des trois ?	321	3	23	1	0.0434782608695652	[['pendant']]	0.05263157894736842	0.05263157894736842	0.043478260869565216	0.0	0.050570584729294835
Mercier_An	2010	---Nous n'entendons plus guères Molière, me répondit-il ;	321	4	9	0	0.0	[]	0.025	0.025	0.043478260869565216	0.0	0.050570584729294835
Mercier_An	2011	les mœurs qu'il a peintes ont passé.	321	5	8	0	0.0	[]	0.0	0.0	0.043478260869565216	0.0	0.050570584729294835
Mercier_An	2012	Nous pensons qu'il a plus frappé le ridicule que le vice, vous aviez plus de vices que de ridicules .	321	6	20	0	0.0	[]	0.02631578947368421	0.02631578947368421	0.043478260869565216	0.0	0.050570584729294835
Mercier_An	2013	Pour les deux tragiques, dont les couleurs étaient plus durables	321	7	10	1	0.1	[['couleur']]	0.022727272727272728	0.022727272727272728	0.043478260869565216	0.0	0.050570584729294835
Mercier_An	2014	, je ne sais comment un homme de votre âge peut faire une pareille question.	321	8	14	0	0.0	[]	0.05	0.05	0.043478260869565216	0.0	0.050570584729294835
