Mercier_An	2771	Un ordre aveugle, émané du trône, ne vient point porter le trouble dans des lieux où l'œil du souverain n'a jamais pu pénétrer.	457	6	25	0	0.0	[]	0.0	0.0	0.017777777777777778	0.0	0.026533901787297982
Mercier_An	2772	Chaque province se trouve dépositaire de sa sûreté de son bonheur : son principe de vie n'est pas éloigné d'elle ;	457	7	21	0	0.0	[]	0.015384615384615385	0.015384615384615385	0.017777777777777778	0.0	0.026533901787297982
Mercier_An	2773	il est dans son propre sein, toujours prêt à féconder l'ensemble, à remédier aux maux qui pourraient arriver.	457	8	19	1	0.0526315789473684	[['sein']]	0.028985507246376812	0.028985507246376812	0.017777777777777778	0.0	0.026533901787297982
Mercier_An	2774	Le secours présent est remis à des mains intéressées qui ne pallieront point la cure, ou qui même ne se réjouiront pas des coups qui peuvent affaiblir la patrie.	457	9	29	1	0.0344827586206896	[['main']]	0.041666666666666664	0.0392156862745098	0.017777777777777778	0.0	0.026533901787297982
Mercier_An	2775	La souveraineté absolue	458	0	3	0	0.0	[]	0.0	0.02857142857142857	0.010309278350515464	0.0	0.04517539514526254
Mercier_An	2776	fut donc abolie.	458	1	3	0	0.0	[]	0.07692307692307693	0.07692307692307693	0.010309278350515464	0.0	0.04517539514526254
Mercier_An	2777	Le chef conserva le nom de roi ;	458	2	7	1	0.1428571428571428	[['chef']]	0.04	0.04	0.010309278350515464	0.0	0.04517539514526254
Mercier_An	2778	mais il n'entreprit pas follement de porter tout le fardeau qui accablait ses ancêtres.	458	3	15	0	0.0	[]	0.03125	0.03125	0.010309278350515464	0.0	0.04517539514526254
Mercier_An	2779	Les États assemblés du royaume eurent seuls la puissance législatrice.	458	4	10	0	0.0	[]	0.0	0.0	0.010309278350515464	0.0	0.04517539514526254
Mercier_An	2780	L'administration des affaires, tant politiques que civiles, est confiée au sénat ;	458	5	12	0	0.0	[]	0.0	0.0	0.010309278350515464	0.0	0.04517539514526254
Mercier_An	2781	le monarque armé du glaive veille à l'exécution des lois.	458	6	11	0	0.0	[]	0.0	0.0	0.010309278350515464	0.0	0.04517539514526254
Mercier_An	2782	Il propose tous les établissement utiles.	458	7	6	0	0.0	[]	0.0	0.0	0.010309278350515464	0.0	0.04517539514526254
Mercier_An	2783	Le sénat est responsable au roi, le roi le sénat sont responsables aux États qui s'assemblent tous les deux ans.	458	8	21	0	0.0	[]	0.0	0.0	0.010309278350515464	0.0	0.04517539514526254
Mercier_An	2784	Tout s'y décide à la pluralité des voix.	458	9	9	0	0.0	[]	0.0	0.0	0.010309278350515464	0.0	0.04517539514526254
Mercier_An	2785	Loix nouvelles, charges vacantes, griefs à redresser, voilà ce qui est de son ressort.	459	0	14	0	0.0	[]	0.0	0.0	0.0	0.0	0.0
Mercier_An	2786	Les cas particuliers ou imprévus sont abandonnés à la sagesse du monarque.	459	1	12	0	0.0	[]	0.0	0.02040816326530612	0.0	0.0	0.0
Mercier_An	2787	Il est heureux , son trône est affermi sur une base d'autant plus solide que la liberté de la nation garantit sa couronne .	460	0	23	1	0.0434782608695652	[['solide']]	0.04878048780487805	0.03773584905660377	0.0410958904109589	0.0434782608695652	0.024424816927725447
Mercier_An	2788	Des âmes qui n'auraient été que communes doivent leurs vertus à ce ressort éternel des grandes choses.	460	1	18	1	0.0555555555555555	[['grand']]	0.04	0.04	0.0410958904109589	0.0434782608695652	0.024424816927725447
Mercier_An	2789	Le citoyen n'est point séparé de l'État ;	460	2	9	0	0.0	[]	0.04	0.04	0.0410958904109589	0.0434782608695652	0.024424816927725447
Mercier_An	2790	il fait corps avec lui : aussi faut-il voir avec quel zèle il se porte à tout ce qui peut intéresser sa splendeur.	460	3	23	1	0.0434782608695652	[['corps']]	0.03125	0.02	0.0410958904109589	0.0434782608695652	0.024424816927725447
Mercier_An	2791	Chaque arrêt émané du sénat est motivé, le sénat explique en peu de mots ses motifs son intention.	461	0	18	0	0.0	[]	0.0	0.01020408163265306	0.02142857142857143	0.0	0.02941176470588235
Mercier_An	2792	Nous ne concevons pas comment dans votre siècle (soi-disant éclairé) vos magistrats osaient dans leur morgue orgueilleuse vous proposer des arrêts dogmatiques, semblables aux décrets des théologiens, comme si la loi n'était pas la raison publique, comme s'il ne fallait pas que le peuple fût instruit pour se porter plus rapidement à l'obéissance.	461	1	57	0	0.0	[]	0.023809523809523808	0.023809523809523808	0.02142857142857143	0.0	0.02941176470588235
Mercier_An	2793	Ces Messieurs à triple mortier, qui se disaient les pères de la patrie, ignoraient donc le grand art de la persuasion, cet art qui agit sans efforts si puissamment, ou plutôt n'ayant ni point de vue fixe, ni marche assurée, tour-à-tour brouillons, séditieux, esclaves rampant, ils encensaient fatiguaient le trône ;	461	2	51	3	0.0588235294117647	[['triple'], ['grand'], ['fixe']]	0.02459016393442623	0.02459016393442623	0.02142857142857143	0.0	0.02941176470588235
Mercier_An	2794	tantôt se cabrant pour des minuties, tantôt vendant le peuple à beaux deniers comptans.	461	3	14	0	0.0	[]	0.046153846153846156	0.031578947368421054	0.02142857142857143	0.0	0.02941176470588235
Mercier_An	2795	Vous pensez bien que nous avons réformé ces magistrats, accoutumés de jeunesse à toute l'insensibilité nécessaire pour disposer froidement de la vie, des biens de l'honneur des citoyens ;	462	0	30	0	0.0	[]	0.016129032258064516	0.013157894736842105	0.010416666666666666	0.0	0.015625
Mercier_An	2796	hardis pour la défense de leurs minces privilèges, lâches dès qu'il s'agissait de l'intérêt public : on s'épargnait dans les derniers temps jusqu'à la peine de les corrompre ;	462	1	32	1	0.03125	[['mince']]	0.014492753623188406	0.014492753623188406	0.010416666666666666	0.0	0.015625
Mercier_An	2797	ils étaient tombés dans une indolence perpétuelle.	462	2	7	0	0.0	[]	0.015151515151515152	0.015151515151515152	0.010416666666666666	0.0	0.015625
Mercier_An	2798	Nos magistrats sont bien différents : le nom de pères du peuple, dont nous les honorons, est un titre qu'ils méritent dans toute l'étendue du terme.	462	3	27	0	0.0	[]	0.0	0.0	0.010416666666666666	0.0	0.015625
Mercier_An	2799	Aujourd'hui	463	0	1	0	0.0	[]	0.0625	0.023255813953488372	0.013071895424836602	0.0	0.02544215959138937
Mercier_An	2800	les rênes du gouvernement sont confiées à des mains fermes sages qui suivent un plan.	463	1	15	1	0.0666666666666666	[['main']]	0.037037037037037035	0.037037037037037035	0.013071895424836602	0.0	0.02544215959138937
Mercier_An	2801	Les lois règnent, aucun homme n'est au dessus d'elles ;	463	2	11	0	0.0	[]	0.027777777777777776	0.027777777777777776	0.013071895424836602	0.0	0.02544215959138937
Mercier_An	2802	ce qui était un inconvénient affreux dans vos gouvernements gothiques.	463	3	10	0	0.0	[]	0.0	0.0	0.013071895424836602	0.0	0.02544215959138937
Mercier_An	2803	Le bonheur général de la patrie est fondé sur la sûreté de chaque sujet en particulier : il ne craint point les hommes, mais les lois ;	463	4	25	0	0.0	[]	0.0	0.0	0.013071895424836602	0.0	0.02544215959138937
Mercier_An	2804	le souverain lui-même les aperçoit au-dessus de sa tête .	463	5	9	0	0.0	[]	0.0	0.0	0.013071895424836602	0.0	0.02544215959138937
Mercier_An	2805	Sa vigilance rend les sénateurs plus attentifs à leur charge à leur devoir ;	463	6	13	0	0.0	[]	0.0	0.0	0.013071895424836602	0.0	0.02544215959138937
Mercier_An	2806	sa confiance en eux soulage leurs peines, son autorité donne la force la vigueur nécessaires à leurs décisions.	463	7	18	0	0.0	[]	0.020833333333333332	0.020833333333333332	0.013071895424836602	0.0	0.02544215959138937
Mercier_An	2807	Ainsi le sceptre, dont la pesanteur opprimait vos rois, est léger dans les mains de notre monarque.	463	8	17	1	0.0588235294117647	[['main']]	0.018867924528301886	0.018867924528301886	0.013071895424836602	0.0	0.02544215959138937
Mercier_An	2808	Ce n'est plus une victime pompeusement parée, incessamment sacrifiée aux besoins de l'État : il ne porte	463	9	18	0	0.0	[]	0.0196078431372549	0.0196078431372549	0.013071895424836602	0.0	0.02544215959138937
Mercier_An	2809	que le fardeau que lui permet la force limitée qu'il a reçue de la nature.	463	10	16	0	0.0	[]	0.0	0.012987012987012988	0.013071895424836602	0.0	0.02544215959138937
Mercier_An	2810	Nous possédons un prince craignant Dieu, pieux juste, qui porte dans son cœur l'éternel la patrie, qui redoute la vengeance divine le blâme de la postérité, qui regarde une bonne conscience une gloire sans tache comme le plus haut degré de félicité.	464	0	43	1	0.0232558139534883	[['haut']]	0.03896103896103896	0.03225806451612903	0.030612244897959183	0.0	0.02575673103113916
Mercier_An	2811	Ce sont moins de grands talents du côté de l'esprit, des connaissances étendues, qui font le bien, que le désir sincère d'un cœur droit qui le chérit qui aime à l'accomplir.	464	1	34	2	0.0588235294117647	[['grand'], ['droit']]	0.038461538461538464	0.038461538461538464	0.030612244897959183	0.0	0.02575673103113916
Mercier_An	2812	Souvent	464	2	1	0	0.0	[]	0.041666666666666664	0.041666666666666664	0.030612244897959183	0.0	0.02575673103113916
Mercier_An	2813	le génie vanté d'un monarque, loin d'avancer le bonheur du royaume	464	3	13	0	0.0	[]	0.0	0.0	0.030612244897959183	0.0	0.02575673103113916
Mercier_An	2814	, se tourne contre la liberté du pays.	464	4	7	0	0.0	[]	0.0	0.0	0.030612244897959183	0.0	0.02575673103113916
Mercier_An	2815	Nous avons concilié ce qui paraissait presque impraticable à accorder, le bien de l'État avec le bien des particuliers.	465	0	20	0	0.0	[]	0.0	0.0	0.017699115044247787	0.0	0.06388765649999396
Mercier_An	2816	On prétendait même que le bonheur public d'un État était nécessairement distinctif du bonheur de quelques-uns de ses membres.	465	1	20	0	0.0	[]	0.0	0.0	0.017699115044247787	0.0	0.06388765649999396
Mercier_An	2817	Nous n'avons point épousé cette politique barbare, fondée sur l'ignorance des véritables lois ou sur le mépris des hommes les plus pauvres les plus utiles.	465	2	27	0	0.0	[]	0.0	0.0	0.017699115044247787	0.0	0.06388765649999396
Mercier_An	2818	Il était des lois abominables cruelles, qui supposaient les hommes méchant : mais nous sommes très disposés à croire qu'ils ne le sont devenus que depuis l'institution de ces mêmes lois.	465	3	32	0	0.0	[]	0.0273972602739726	0.0273972602739726	0.017699115044247787	0.0	0.06388765649999396
Mercier_An	2819	Le despotisme a fatigué le cœur humain, en l'irritant l'a desséché corrompu.	465	4	14	2	0.1428571428571428	[['fatiguer'], ['dessécher']]	0.043478260869565216	0.045454545454545456	0.017699115044247787	0.0	0.06388765649999396
Mercier_An	2820	Notre roi a tout le pouvoir l'autorité nécessaires pour faire le bien, les bras liés pour faire le mal.	466	0	20	1	0.05	[['bras']]	0.022222222222222223	0.05084745762711865	0.022222222222222223	0.025	0.03535533905932738
Mercier_An	2821	On lui expose la nation sous un jour toujours favorable : on présente sa valeur, sa fidélité envers le prince, son horreur pour tout joug étranger.	466	1	25	0	0.0	[]	0.022222222222222223	0.025	0.022222222222222223	0.025	0.03535533905932738
Mercier_An	2822	Il est des censeurs qui ont droit de chasser d'auprès du prince tous ceux qui inclineraient à l'irréligion, au libertinage, au mensonge, à l'art plus funeste de couvrir la vertu de ridicule .	467	0	35	1	0.0285714285714285	[['droit']]	0.02040816326530612	0.016260162601626018	0.025157232704402517	0.0158730158730158	0.034450295750531185
Mercier_An	2823	On ne connaît plus aussi parmi nous cette classe d'hommes, qui sous le titre de noblesse (qui pour comble de ridicule était vénale,) accourait ramper autour du trône, ne voulait suivre que le métier des armes ou celui de courtisan, vivait dans l'oisiveté, rassasiait son orgueil de vieux parchemins, présentait le déplorable spectacle d'une vanité égale à sa misère.	467	1	63	1	0.0158730158730158	[['vieux']]	0.03278688524590164	0.03278688524590164	0.025157232704402517	0.0158730158730158	0.034450295750531185
Mercier_An	2824	Vos grenadiers versaient leur sang avec autant d'intrépidité que le plus noble d'entre eux, ne le mettaient pas à si haut prix.	467	2	24	2	0.0833333333333333	[['noble'], ['haut']]	0.02912621359223301	0.02912621359223301	0.025157232704402517	0.0158730158730158	0.034450295750531185
Mercier_An	2825	D'ailleurs, une telle dénomination dans notre république aurait offensé les autres ordres de l'État.	467	3	16	0	0.0	[]	0.03278688524590164	0.03278688524590164	0.025157232704402517	0.0158730158730158	0.034450295750531185
Mercier_An	2826	Les citoyens sont égaux : la seule distinction est celle que mettent naturellement entre les hommes la vertu, le génie le travail .	467	4	21	0	0.0	[]	0.0	0.0	0.025157232704402517	0.0158730158730158	0.034450295750531185
Mercier_An	2827	Malgré tant de remparts, de barrières, de précautions, afin que le monarque n'oublie point, en cas de calamités publiques, ce qu'il doit aux pauvres, il observe chaque année un jeûne solemnel qui dure trois jours.	468	0	37	0	0.0	[]	0.020833333333333332	0.014492753623188406	0.01875	0.0	0.0356593891666501
Mercier_An	2828	Pendant ce temps notre roi souffre la faim, endure la soif	468	1	11	1	0.0909090909090909	[['pendant']]	0.028985507246376812	0.028985507246376812	0.01875	0.0	0.0356593891666501
Mercier_An	2829	, est couché sur un grabat : ce jeûne terrible salutaire lui imprime dans le cœur une commisération plus tendre envers les nécessiteux.	468	2	21	1	0.0476190476190476	[['tendre']]	0.041666666666666664	0.041666666666666664	0.01875	0.0	0.0356593891666501
Mercier_An	2830	Notre souverain n'a pas besoin, il est vrai, d'être averti par cette sensation physique ;	468	3	16	0	0.0	[]	0.019230769230769232	0.019230769230769232	0.01875	0.0	0.0356593891666501
Mercier_An	2831	mais c'est une loi de l'État, une loi sacrée, jusqu'ici suivie respectée.	468	4	15	0	0.0	[]	0.0	0.0	0.01875	0.0	0.0356593891666501
Mercier_An	2832	À l'exemple du monarque, tout ministre, tout homme qui touche aux rênes du gouvernement, se fait un devoir de sentir par lui-même ce que c'est que le besoin et la douleur qui en résulte ;	468	5	36	0	0.0	[]	0.013333333333333334	0.013333333333333334	0.01875	0.0	0.0356593891666501
Mercier_An	2833	il en est plus disposé dans la suite à soulager ceux qui se trouveraient soumis à l'impérieuse dure loi de l'extrême nécessité .	468	6	24	1	0.0416666666666666	[['dur']]	0.016666666666666666	0.0273972602739726	0.01875	0.0	0.0356593891666501
Mercier_An	2834	---Mais, lui dis-je, de tels changement ont dû être longs, pénibles, difficultueux.	469	0	13	1	0.0769230769230769	[['long']]	0.0625	0.05	0.024390243902439025	0.0	0.03109666927208643
Mercier_An	2835	Que d'efforts	469	1	3	0	0.0	[]	0.05555555555555555	0.05555555555555555	0.024390243902439025	0.0	0.03109666927208643
Mercier_An	2836	il vous a fallu faire!---Le sage, souriant avec douceur, répondit : le bien n'est pas plus difficile que le mal.	469	2	20	1	0.05	[['sourire']]	0.03333333333333333	0.03333333333333333	0.024390243902439025	0.0	0.03109666927208643
Mercier_An	2837	Les passions humaines sont de terribles obstacles.	469	3	7	0	0.0	[]	0.023809523809523808	0.023809523809523808	0.024390243902439025	0.0	0.03109666927208643
Mercier_An	2838	Mais dès que les esprits sont éclairés sur leurs véritables intérêts, ils deviennent justes droits.	469	4	15	0	0.0	[]	0.0	0.0	0.024390243902439025	0.0	0.03109666927208643
Mercier_An	2839	Il me semble qu'un seul homme pourrait gouverner le monde, si les cœurs étaient disposés à la tolérance à l'équité.	469	5	22	0	0.0	[]	0.01694915254237288	0.01694915254237288	0.024390243902439025	0.0	0.03109666927208643
Mercier_An	2840	Malgré l'inconséquence ordinaire aux gens de votre siècle, on avait su prévoir que la raison ferait un jour de grands progrès ;	469	6	22	1	0.0454545454545454	[['grand']]	0.015384615384615385	0.015384615384615385	0.024390243902439025	0.0	0.03109666927208643
Mercier_An	2841	les effets en sont devenus sensibles, les principes heureux d'un sage gouvernement ont été le premier fruit de la réforme.	469	7	21	0	0.0	[]	0.023255813953488372	0.022222222222222223	0.024390243902439025	0.0	0.03109666927208643
Mercier_An	2842	CHAPITRE XXXVII.	470	0	2	0	0.0	[]	0.0	0.0	0.0	0.0	0.0
Mercier_An	2843	De l'héritier du Trône.	471	0	5	0	0.0	[]	0.0	0.0	0.0	0.0	0.0
Mercier_An	2844	Plus interrogeant que ne le fut jamais le bailli du huron , je continuai à exercer la patience de mes voisins.---J'ai bien vu le monarque assis sur son trône ;	472	0	29	0	0.0	[]	0.0	0.0	0.028985507246376812	0.0	0.044472798226039265
Mercier_An	2845	mais j'ai oublié, messieurs, de vous demander où était le fils du roi, de mon temps appelé dauphin ?	472	1	19	0	0.0	[]	0.017543859649122806	0.017543859649122806	0.028985507246376812	0.0	0.044472798226039265
Mercier_An	2846	---Le plus poli prit la parole et me dit :	472	2	9	1	0.1111111111111111	[['poli']]	0.043478260869565216	0.043478260869565216	0.028985507246376812	0.0	0.044472798226039265
Mercier_An	2847	Convaincus que nous sommes que c'est de l'éducation des grands que dépend le bonheur des peuples, que la vertu s'apprend comme le vice se communique, nous veillons avec le plus grand soin sur les jeunes années des princes.	472	3	41	2	0.048780487804878	[['grand'], ['grand']]	0.03614457831325301	0.03614457831325301	0.028985507246376812	0.0	0.044472798226039265
Mercier_An	2848	L'héritier du trône n'est point à la cour, où quelques flatteurs oseraient peut-être lui persuader qu'il est plus que les autres hommes, que ceux-ci sont moins que des insectes ;	472	4	33	0	0.0	[]	0.024691358024691357	0.024691358024691357	0.028985507246376812	0.0	0.044472798226039265
Mercier_An	2849	on lui cache soigneusement ses hautes destinées.	472	5	7	0	0.0	[]	0.03278688524590164	0.03278688524590164	0.028985507246376812	0.0	0.044472798226039265
Mercier_An	2850	Dès qu'il est né, on lui a imprimé sur l'épaule une empreinte royale qui servira à le faire reconnaître.	472	6	21	2	0.0952380952380952	[['épaule'], ['royal']]	0.06	0.06	0.028985507246376812	0.0	0.044472798226039265
Mercier_An	2851	On l'a remis entre les mains de gens dont la fidélité discrette n'a pas moins été éprouvée que la probité.	472	7	22	1	0.0454545454545454	[['main']]	0.043478260869565216	0.043478260869565216	0.028985507246376812	0.0	0.044472798226039265
Mercier_An	2852	Ils font serment devant l'être suprême de ne jamais révéler au prince qu'il doit être roi : serment redoutable, qu'ils n'osent jamais enfreindre.	472	8	26	0	0.0	[]	0.020833333333333332	0.02040816326530612	0.028985507246376812	0.0	0.044472798226039265
Mercier_An	2853	Aussi	473	0	1	0	0.0	[]	0.034482758620689655	0.01818181818181818	0.018633540372670808	0.0	0.016622838100640285
Mercier_An	2854	-tôt qu'il est sorti des mains des femmes, on le promène, on le fait voyager, on dispose son éducation physique qui doit toujours précéder l'éducation morale.	473	1	28	1	0.0357142857142857	[['main']]	0.02631578947368421	0.02631578947368421	0.018633540372670808	0.0	0.016622838100640285
Mercier_An	2855	Il est vêtu comme le fils d'un paysan.	473	2	9	0	0.0	[]	0.025974025974025976	0.025974025974025976	0.018633540372670808	0.0	0.016622838100640285
Mercier_An	2856	On l'accoutume aux mets les plus ordinaires : on lui enseigne de bonne heure la sobriété, il connaitre mieux un jour que sa propre économie doit servir d'exemple, qu'une fausse prodigalité ruine un état deshonore l'extravagant dissipateur.	473	3	40	1	0.025	[['faux']]	0.01818181818181818	0.01818181818181818	0.018633540372670808	0.0	0.016622838100640285
Mercier_An	2857	Il visite successivement toutes les provinces.	473	4	6	0	0.0	[]	0.015384615384615385	0.015384615384615385	0.018633540372670808	0.0	0.016622838100640285
Mercier_An	2858	On lui fait connaître tous les travaux de la campagne, les ouvrages des manufactures, les productions des divers terrains.	473	5	19	0	0.0	[]	0.019230769230769232	0.019230769230769232	0.018633540372670808	0.0	0.016622838100640285
Mercier_An	2859	Il voit tout de ses propres yeux : il entre dans la cabane des laboureurs, mange à leur table, s'associe à leurs travaux, apprend à les respecter.	473	6	27	1	0.037037037037037	[['oeil']]	0.017857142857142856	0.017857142857142856	0.018633540372670808	0.0	0.016622838100640285
Mercier_An	2860	Il converse familiérement avec tous les hommes qu'il rencontre.	473	7	10	0	0.0	[]	0.017241379310344827	0.017241379310344827	0.018633540372670808	0.0	0.016622838100640285
Mercier_An	2861	On permet à son caractère de se déployer librement, il se croit aussi éloigné du trône qu'il en est près.	473	8	21	0	0.0	[]	0.0	0.0	0.018633540372670808	0.0	0.016622838100640285
Mercier_An	2862	Beaucoup de rois sont devenus tyrans, non parce qu'ils avaient un mauvais cœur, mais parce que l'état des pauvres de leur pays n'avait jamais pu parvenir jusqu'à eux .	474	0	32	0	0.0	[]	0.0	0.0	0.010416666666666666	0.0	0.023094010767585032
Mercier_An	2863	Si l'on abandonnait ce jeune prince aux idées flatteuses d'un pouvoir assuré, peut-être même avec une âme droite, vu la pente infortunée du cœur humain, chercherait-il dans la suite à étendre les limites de son autorité .	474	1	39	0	0.0	[]	0.010416666666666666	0.010416666666666666	0.010416666666666666	0.0	0.023094010767585032
Mercier_An	2864	C'est en cela que plusieurs souverains faisaient malheureusement consister la grandeur royale, par conséquent leur intérêt était toujours opposé à celui de la nation.	474	2	25	1	0.04	[['royal']]	0.015625	0.010752688172043012	0.010416666666666666	0.0	0.023094010767585032
Mercier_An	2865	Dès que le jeune prince a atteint l'âge de vingt-ans, plutôt même, si son âme est formée de meilleure heure, on le conduit dans la salle du trône.	475	0	29	0	0.0	[]	0.0	0.015625	0.018867924528301886	0.0	0.02551551815399144
Mercier_An	2866	Il est caché dans la foule comme un simple spectateur.	475	1	10	0	0.0	[]	0.0	0.0	0.018867924528301886	0.0	0.02551551815399144
Mercier_An	2867	Tous les ordres de l'État sont assemblés ce jour-là, tous ont reçu le mot.	475	2	16	0	0.0	[]	0.0	0.0	0.018867924528301886	0.0	0.02551551815399144
Mercier_An	2868	Tout-à-coup le monarque se lève, appelle par trois fois le jeune homme.	475	3	12	0	0.0	[]	0.0	0.0	0.018867924528301886	0.0	0.02551551815399144
Mercier_An	2869	Les flots de la foule s'ouvrent.	475	4	7	0	0.0	[]	0.0392156862745098	0.0392156862745098	0.018867924528301886	0.0	0.02551551815399144
Mercier_An	2870	Étonné, il s'avance d'un pas timide vers le trône, il y monte en tremblant : le roi l'embrasse, déclare aux yeux de tous les citoyens qu'il est son fils.	475	5	32	2	0.0625	[['trembler'], ['oeil']]	0.05128205128205128	0.06666666666666667	0.018867924528301886	0.0	0.02551551815399144
Mercier_An	2871	Le ciel , dit-il d'une voix touchante majestueuse, le ciel vous a destiné à porter le fardeau de la royauté ;	476	0	21	2	0.0952380952380952	[['voix'], ['majestueux']]	0.06976744186046512	0.06666666666666667	0.033112582781456956	0.0	0.03392404388727618
Mercier_An	2872	on a travaillé vingt ans à vous en rendre digne, ne trompez pas l'espoir de ce grand peuple qui vous voit.	476	1	22	1	0.0454545454545454	[['grand']]	0.06666666666666667	0.06666666666666667	0.033112582781456956	0.0	0.03392404388727618
Mercier_An	2873	Mon fils!	476	2	2	0	0.0	[]	0.02631578947368421	0.02631578947368421	0.033112582781456956	0.0	0.03392404388727618
Mercier_An	2874	J'attends de vous le même zèle que j'ai eu pour l'État .	476	3	14	0	0.0	[]	0.0	0.0	0.033112582781456956	0.0	0.03392404388727618
Mercier_An	2875	Quel moment!	476	4	2	0	0.0	[]	0.0	0.0	0.033112582781456956	0.0	0.03392404388727618
Mercier_An	2876	quelle foule d'idées entrent dans son âme!	476	5	8	0	0.0	[]	0.03125	0.03125	0.033112582781456956	0.0	0.03392404388727618
Mercier_An	2877	Le monarque alors lui montre la tombe où repose le monarque prédécesseur, cette tombe où est gravé en gros caractères : l'Éternité.	476	6	22	1	0.0454545454545454	[['gros']]	0.0425531914893617	0.0425531914893617	0.033112582781456956	0.0	0.03392404388727618
Mercier_An	2878	Il continue d'une voix non moins imposante : Mon fils, on a tout fait pour ce moment.	476	7	17	1	0.0588235294117647	[['voix']]	0.03333333333333333	0.03333333333333333	0.033112582781456956	0.0	0.03392404388727618
Mercier_An	2879	Vous êtes sur la cendre de votre aïeul, vous devez le faire renaître ; faites le serment d'être juste comme lui.	476	8	21	0	0.0	[]	0.016129032258064516	0.016129032258064516	0.033112582781456956	0.0	0.03392404388727618
Mercier_An	2880	Je vais bientôt descendre pour occuper sa place, songez que je vous accuserois du fond de cette tombe, si vous abusiez de votre pouvoir.	476	9	24	0	0.0	[]	0.0	0.0	0.033112582781456956	0.0	0.03392404388727618
Mercier_An	2881	Ah!	476	10	1	0	0.0	[]	0.02564102564102564	0.02564102564102564	0.033112582781456956	0.0	0.03392404388727618
Mercier_An	2882	mon cher fils, l'Être suprême le royaume ont les yeux ouverts sur vous ;	476	11	14	1	0.0714285714285714	[['oeil']]	0.045454545454545456	0.045454545454545456	0.033112582781456956	0.0	0.03392404388727618
Mercier_An	2883	aucune de vos pensées ne leur échappera.	476	12	7	0	0.0	[]	0.03571428571428571	0.03571428571428571	0.033112582781456956	0.0	0.03392404388727618
Mercier_An	2884	Si quelque mouvement d'ambition ou d'orgueil régnait en ce moment au fond de votre âme, il est encore temps de le subjuguer ; abdiquez le diadème, descendez de ce trône, rentrez dans la foule ;	476	13	35	1	0.0285714285714285	[['rentrer']]	0.03571428571428571	0.03571428571428571	0.033112582781456956	0.0	0.03392404388727618
Mercier_An	2885	vous serez plus grand, plus respecté, citoyen obscur, que monarque vain ou sans courage.	476	14	14	1	0.0714285714285714	[['grand']]	0.05194805194805195	0.05194805194805195	0.033112582781456956	0.0	0.03392404388727618
