filename	sentence nr	sentence	paragraph nr	sentence nr in paragraph	words	matches	sentence density	vocabulary words matched	density (range=3,same_paragraph=True)	density (range=3,same_paragraph=False)	paragraph density	paragraph density median	paragraph density std
Mercier_An	0	ÉPÎTRE	0	0	1	0	0.0	[]	0.0	0.0	0.0	0.0	0.0
Mercier_An	1	DÉDICATOIRE	0	1	1	0	0.0	[]	0.0	0.0	0.0	0.0	0.0
Mercier_An	2	À L'ANNÉE DEUX MILLE QUATRE CENT	0	2	7	0	0.0	[]	0.0	0.0	0.0	0.0	0.0
Mercier_An	3	QUARANTE.	0	3	1	0	0.0	[]	0.0	0.0	0.0	0.0	0.0
Mercier_An	4	Auguste et respectable	1	0	3	0	0.0	[]	0.0	0.0	0.033783783783783786	0.0	0.03570151702230075
Mercier_An	5	Année, qui dois amener la félicité sur la terre ;	1	1	9	0	0.0	[]	0.0	0.0	0.033783783783783786	0.0	0.03570151702230075
Mercier_An	6	toi, hélas ?	1	2	2	0	0.0	[]	0.07272727272727272	0.07272727272727272	0.033783783783783786	0.0	0.03570151702230075
Mercier_An	7	que je n'ai vue qu'en songe, quand tu viendras à jaillir du sein de l'éternité, ceux qui verront ton soleil fouleront aux pieds mes cendres et celles de trente générations, successivement éteintes et disparues dans le profond abîme de la mort.	1	3	44	4	0.0909090909090909	[['sein'], ['ton'], ['pied'], ['profond']]	0.06896551724137931	0.06896551724137931	0.033783783783783786	0.0	0.03570151702230075
Mercier_An	8	Les Rois qui sont aujourd'hui assis sur des trônes ne seront plus ;	1	4	12	0	0.0	[]	0.05128205128205128	0.05128205128205128	0.033783783783783786	0.0	0.03570151702230075
Mercier_An	9	leur postérité ne sera plus : et toi, tu jugeras et ces Monarques décédés et les écrivains qui vivaient soumis à leur puissance.	1	5	22	0	0.0	[]	0.0196078431372549	0.0196078431372549	0.033783783783783786	0.0	0.03570151702230075
Mercier_An	10	Les noms des amis, des défenseurs de l'humanité, brilleront honorés : leur gloire sera pure et radieuse.	1	6	17	1	0.0588235294117647	[['pur']]	0.01282051282051282	0.01282051282051282	0.033783783783783786	0.0	0.03570151702230075
Mercier_An	11	Mais cette vile populace de Rois qui auront, en tout sens, tourmenté l'espèce humaine, plus enfoncés encore dans l'oubli que dans la région des morts, ne s'échapperont de l'opprobre qu'à la faveur du néant.	1	7	39	0	0.0	[]	0.017857142857142856	0.016129032258064516	0.033783783783783786	0.0	0.03570151702230075
Mercier_An	12	La pensée survit à l'homme ;	2	0	6	0	0.0	[]	0.0	0.0	0.03773584905660377	0.0172413793103448	0.03942650210923057
Mercier_An	13	et voilà son plus glorieux appanage!	2	1	6	0	0.0	[]	0.041666666666666664	0.041666666666666664	0.03773584905660377	0.0172413793103448	0.03942650210923057
Mercier_An	14	La pensée s'élève de son tombeau, prend un corps durable, immortel ;	2	2	12	1	0.0833333333333333	[['corps']]	0.0425531914893617	0.0425531914893617	0.03773584905660377	0.0172413793103448	0.03942650210923057
Mercier_An	15	et tandis que les tonnerres du despotisme tombent et s'éteignent, la plume d'un écrivain franchit l'intervalle des temps, absout, ou punit les maîtres de l'univers.	2	3	29	1	0.0344827586206896	[['éteindre']]	0.04878048780487805	0.03773584905660377	0.03773584905660377	0.0172413793103448	0.03942650210923057
Mercier_An	16	J'ai usé de l'empire que j'ai reçû en naissant ;	3	0	12	0	0.0	[]	0.0	0.016129032258064516	0.045714285714285714	0.0434782608695652	0.04205368908344406
Mercier_An	17	j'ai cité devant ma raison solitaire les lois, les abus, les coutumes du pays où je vivais inconnu et obscur.	3	1	21	0	0.0	[]	0.0	0.0	0.045714285714285714	0.0434782608695652	0.04205368908344406
Mercier_An	18	J'ai connu cette haine vertueuse que l'être sensible doit à l'oppresseur : j'ai détesté la tyrannie, je l'ai flétrie, je l'ai combattue avec les forces qui étaient en mon pouvoir.	3	2	35	0	0.0	[]	0.03571428571428571	0.03571428571428571	0.045714285714285714	0.0434782608695652	0.04205368908344406
Mercier_An	19	Mais, auguste et respectable Année, j'ai eu beau, en te contemplant, élever, enflammer mes idées, elles ne seront peut-être à tes yeux que des idées de servitude.	3	3	28	3	0.1071428571428571	[['beau'], ['ton'], ['oeil']]	0.046875	0.046875	0.045714285714285714	0.0434782608695652	0.04205368908344406
Mercier_An	20	Pardonne!	3	4	1	0	0.0	[]	0.07692307692307693	0.07692307692307693	0.045714285714285714	0.0434782608695652	0.04205368908344406
Mercier_An	21	Le génie de mon siècle me presse et m'environne : la stupeur règne : le calme de ma patrie ressemble à celui des tombeaux.	3	5	23	1	0.0434782608695652	[['calme']]	0.058823529411764705	0.058823529411764705	0.045714285714285714	0.0434782608695652	0.04205368908344406
Mercier_An	22	Autour de moi, que de cadavres colorés qui parlent, qui marchent, et chez qui le principe actif de la vie n'a jamais poussé le moindre rejetons!	3	6	27	2	0.074074074074074	[['cadavre'], ['colorer']]	0.06153846153846154	0.06153846153846154	0.045714285714285714	0.0434782608695652	0.04205368908344406
Mercier_An	23	Déjà même la voix de la philosophie, lasse et découragée, a perdu de sa force ;	3	7	15	1	0.0666666666666666	[['voix']]	0.07272727272727272	0.07272727272727272	0.045714285714285714	0.0434782608695652	0.04205368908344406
Mercier_An	24	elle crie au milieu des hommes comme au sein d'un immense désert.	3	8	13	1	0.0769230769230769	[['sein']]	0.07142857142857142	0.04	0.045714285714285714	0.0434782608695652	0.04205368908344406
Mercier_An	25	Oh, si je pouvais partager le temps de mon existence en deux portions, comme je descendrois à l'instant même au cercueil!	4	0	22	0	0.0	[]	0.028985507246376812	0.036585365853658534	0.022900763358778626	0.0	0.02038458657263629
Mercier_An	26	Comme je perdrais avec joie l'aspect de mes tristes, de mes malheureux contemporains, pour aller me réveiller au milieu de ces jours purs que tu dois faire éclore, sous ce ciel fortuné, où l'homme aura repris son courage, sa liberté, son indépendance et ses vertus.	4	1	47	2	0.0425531914893617	[['triste'], ['pur']]	0.022988505747126436	0.022988505747126436	0.022900763358778626	0.0	0.02038458657263629
Mercier_An	27	Que ne puis-je te voir autrement qu'en songe, année si désirée et que mes vœux appellent!	4	2	18	0	0.0	[]	0.030303030303030304	0.030303030303030304	0.022900763358778626	0.0	0.02038458657263629
Mercier_An	28	Hâte	4	3	1	0	0.0	[]	0.0	0.0	0.022900763358778626	0.0	0.02038458657263629
Mercier_An	29	-toi!	4	4	1	0	0.0	[]	0.0	0.0	0.022900763358778626	0.0	0.02038458657263629
Mercier_An	30	Viens éclairer le bonheur du monde!	4	5	6	0	0.0	[]	0.0	0.0	0.022900763358778626	0.0	0.02038458657263629
Mercier_An	31	Mais, que dis-je ? délivré des prestiges d'un sommeil favorable, je crains, hélas!	4	6	14	0	0.0	[]	0.023809523809523808	0.023809523809523808	0.022900763358778626	0.0	0.02038458657263629
Mercier_An	32	Je crains plutôt que ton soleil ne vienne un jour à luire tristement sur un informe amas de cendres et de ruines!	4	7	22	1	0.0454545454545454	[['ton']]	0.027777777777777776	0.02127659574468085	0.022900763358778626	0.0	0.02038458657263629
Mercier_An	33	AVANT-PROPOS Desirer que tout soit bien est le vœu du philosophe.	5	0	11	0	0.0	[]	0.0	0.015151515151515152	0.018691588785046728	0.0	0.036451860600544395
Mercier_An	34	J'entends par ce mot, dont on a sans doute abusé, l'être vertueux et sensible qui veut le bonheur général, parce qu'il a des idées précises d'ordre et d'harmonie.	5	1	33	0	0.0	[]	0.01818181818181818	0.01818181818181818	0.018691588785046728	0.0	0.036451860600544395
Mercier_An	35	Le mal fatigue les regards du Sage, il s'en plaint ;	5	2	11	1	0.0909090909090909	[['regard']]	0.019230769230769232	0.019230769230769232	0.018691588785046728	0.0	0.036451860600544395
Mercier_An	36	on soupçonne qu'il a de l'humeur ;	5	3	8	0	0.0	[]	0.045454545454545456	0.045454545454545456	0.018691588785046728	0.0	0.036451860600544395
Mercier_An	37	on a tort.	5	4	3	0	0.0	[]	0.019230769230769232	0.019230769230769232	0.018691588785046728	0.0	0.036451860600544395
Mercier_An	38	Le Sage sait que le mal abonde sur la terre ; mais en même temps il a toujours présente à l'esprit cette perfection si belle et si touchante, qui peut et qui doit même être l'ouvrage de l'homme raisonnable.	5	5	41	1	0.024390243902439	[['bel']]	0.022727272727272728	0.02531645569620253	0.018691588785046728	0.0	0.036451860600544395
Mercier_An	39	En effet, pourquoi nous serait-il défendu d'espérer qu'après avoir décrit ce cercle extravagant de sottises autour duquel l'égarent ses passions, l'homme ennuyé reviendra à la lumière pure de l'entendement ?	6	0	35	1	0.0285714285714285	[['pur']]	0.02127659574468085	0.022727272727272728	0.02702702702702703	0.0	0.07240601069999317
Mercier_An	40	Pourquoi le genre humain ne serait-il pas semblable à l'individu ?	6	1	12	0	0.0	[]	0.018518518518518517	0.018518518518518517	0.02702702702702703	0.0	0.07240601069999317
Mercier_An	41	Emporté, violent, étourdi dans son jeune âge ;	6	2	7	0	0.0	[]	0.04	0.04	0.02702702702702703	0.0	0.07240601069999317
Mercier_An	42	sage, doux, modéré dans sa vieillesse .	6	3	6	1	0.1666666666666666	[['dou']]	0.037037037037037035	0.037037037037037035	0.02702702702702703	0.0	0.07240601069999317
Mercier_An	43	L'homme qui pense ainsi, s'impose à lui-même le devoir d'être juste.	6	4	14	0	0.0	[]	0.05	0.034482758620689655	0.02702702702702703	0.0	0.07240601069999317
Mercier_An	44	Mais savons-nous ce que c'est que perfection ?	7	0	9	0	0.0	[]	0.05	0.029411764705882353	0.0625	0.0714285714285714	0.047864381791116836
Mercier_An	45	Peut-elle être le partage d'un être faible et borné ?	7	1	11	1	0.0909090909090909	[['faible']]	0.0625	0.0625	0.0625	0.0714285714285714	0.047864381791116836
Mercier_An	46	Ce grand secret n'est-il pas caché sous celui de la vie ? et ne faudra-t-il pas dépouiller notre vêtement mortel pour percer cette sublime énigme ?	7	2	28	2	0.0714285714285714	[['grand'], ['sublime']]	0.07692307692307693	0.05	0.0625	0.0714285714285714	0.047864381791116836
Mercier_An	47	En attendant tâchons de rendre les choses passables, ou, si c'est encore trop, rêvons du moins qu'elles le sont.	8	0	21	0	0.0	[]	0.0	0.034482758620689655	0.013888888888888888	0.0	0.013551927136362359
Mercier_An	48	Pour moi, concentré avec Platon, je rêve comme lui.	8	1	9	0	0.0	[]	0.0	0.0	0.013888888888888888	0.0	0.013551927136362359
Mercier_An	49	Ô mes chers concitoyens!	8	2	4	0	0.0	[]	0.021739130434782608	0.021739130434782608	0.013888888888888888	0.0	0.013551927136362359
Mercier_An	50	Vous que j'ai vu gémir si fréquemment sur cette foule d'abus dont on est las de se plaindre, quand verrons-nous nos grands projets, quand verrons-nous nos songes se réaliser!	8	3	33	1	0.0303030303030303	[['grand']]	0.023809523809523808	0.023809523809523808	0.013888888888888888	0.0	0.013551927136362359
Mercier_An	51	Dormir, voilà donc notre félicité.	8	4	5	0	0.0	[]	0.02631578947368421	0.025	0.013888888888888888	0.0	0.013551927136362359
Mercier_An	52	CHAPITRE PREMIER.	9	0	2	0	0.0	[]	0.0	0.0	0.0	0.0	0.0
Mercier_An	53	Paris	10	0	1	0	0.0	[]	0.25	0.2	0.25	0.14285714285714285	0.20203050891044214
Mercier_An	54	entre les mains d'un vieil Anglois.	10	1	7	2	0.2857142857142857	[['main'], ['vieux']]	0.25	0.15384615384615385	0.25	0.14285714285714285	0.20203050891044214
Mercier_An	55	Fâcheux ami, pourquoi m'éveilles	11	0	5	0	0.0	[]	0.0	0.15384615384615385	0.037037037037037035	0.0	0.029530983162465704
Mercier_An	56	-tu ?	11	1	1	0	0.0	[]	0.0	0.0	0.037037037037037035	0.0	0.029530983162465704
Mercier_An	57	Ah, quel tort tu viens de me faire!	11	2	8	0	0.0	[]	0.038461538461538464	0.038461538461538464	0.037037037037037035	0.0	0.029530983162465704
Mercier_An	58	Tu m'ôtes un songe dont je préférois la douce illusion au jour importun de la vérité.	11	3	17	1	0.0588235294117647	[['douce']]	0.046511627906976744	0.046511627906976744	0.037037037037037035	0.0	0.029530983162465704
Mercier_An	59	Que mon erreur était délicieuse, et que ne puis-je y demeurer plongé le reste de ma vie!	11	4	18	1	0.0555555555555555	[['délicieux']]	0.04081632653061224	0.04081632653061224	0.037037037037037035	0.0	0.029530983162465704
Mercier_An	60	Mais non, me voilà retombé dans le cahot affreux dont je me croyais dégagé.	11	5	14	0	0.0	[]	0.030303030303030304	0.030303030303030304	0.037037037037037035	0.0	0.029530983162465704
Mercier_An	61	Assieds	11	6	1	0	0.0	[]	0.0	0.0	0.037037037037037035	0.0	0.029530983162465704
Mercier_An	62	toi	11	7	1	0	0.0	[]	0.05555555555555555	0.05555555555555555	0.037037037037037035	0.0	0.029530983162465704
Mercier_An	63	et m'écoutes, tandis que mon esprit est encore plein des objets qui l'ont frappé	11	8	16	1	0.0625	[['plein']]	0.058823529411764705	0.09375	0.037037037037037035	0.0	0.029530983162465704
Mercier_An	64	Je conversai hier fort tard avec ce vieil Anglois dont l'âme est si franche.	12	0	15	2	0.1333333333333333	[['fort'], ['vieux']]	0.08333333333333333	0.075	0.04225352112676056	0.0	0.05798894799865588
Mercier_An	65	Tu sais que j'aime l'homme vraiment anglais .	12	1	9	0	0.0	[]	0.0625	0.0625	0.04225352112676056	0.0	0.05798894799865588
Mercier_An	66	On ne trouve nulle part de meilleurs amis ;	12	2	8	0	0.0	[]	0.0	0.0	0.04225352112676056	0.0	0.05798894799865588
Mercier_An	67	on ne rencontre chez aucun autre peuple des hommes d'un caractère aussi ferme et aussi généreux.	12	3	17	0	0.0	[]	0.02127659574468085	0.02127659574468085	0.04225352112676056	0.0	0.05798894799865588
Mercier_An	68	Cet esprit de liberté qui les anime, leur donne un degré de force et de constance bien rare chez les autres peuples.	12	4	22	1	0.0454545454545454	[['rare']]	0.02564102564102564	0.014925373134328358	0.04225352112676056	0.0	0.05798894799865588
Mercier_An	69	Votre nation, me disait-il, est remplie d'abus aussi étranges que multipliés : on ne peut ni les concevoir ni les nombrer, et l'esprit s'y perd.	13	0	28	0	0.0	[]	0.02040816326530612	0.028169014084507043	0.021739130434782608	0.0	0.02839451399999731
Mercier_An	70	Rien ne me confond surtout, comme ce repos, ce calme apparent qui couve les débats affreux de tant de guerres intestines.	13	1	21	1	0.0476190476190476	[['calme']]	0.01818181818181818	0.01818181818181818	0.021739130434782608	0.0	0.02839451399999731
Mercier_An	71	Votre capitale est un composé incroyable .	13	2	6	0	0.0	[]	0.021739130434782608	0.021739130434782608	0.021739130434782608	0.0	0.02839451399999731
Mercier_An	72	Ce monstre difforme est le réceptacle de l'extrême opulence et de l'excessive misère : leur lutte est éternelle.	13	3	19	0	0.0	[]	0.023255813953488372	0.023255813953488372	0.021739130434782608	0.0	0.02839451399999731
Mercier_An	73	Quel prodige! que ce corps dévorant qui se consume dans chaque partie, puisse subsister dans son épouvantable inégalité .	13	4	18	1	0.0555555555555555	[['corps']]	0.02702702702702703	0.018518518518518517	0.021739130434782608	0.0	0.02839451399999731
Mercier_An	74	On fait tout dans votre Royaume pour cette capitale : on lui sacrifie des villes, des provinces entières.	14	0	17	0	0.0	[]	0.0	0.02127659574468085	0.0	0.0	0.0
Mercier_An	75	Eh, qu'est-elle autre chose qu'un diamant entouré de fumier!	14	1	12	0	0.0	[]	0.0	0.0	0.0	0.0	0.0
Mercier_An	76	Quel mélange inouï d'esprit et de bêtise, de génie et d'extravagance, de grandeur et de bassesse!	14	2	18	0	0.0	[]	0.0	0.0	0.0	0.0	0.0
Mercier_An	77	Je quitte l'Angleterre, je me presse, j'accours, je crois arriver dans un centre éclairé, où les hommes, en unissant leurs talents mutuels, auraient dû faire régner tous les plaisirs ensemble, et cette aisance, cette commodité qui ajoutent à leur charme.	14	3	42	0	0.0	[]	0.0	0.0	0.0	0.0	0.0
Mercier_An	78	Mais, Dieu! que mon espérance est cruellement deçue!	14	4	8	0	0.0	[]	0.0	0.0	0.0	0.0	0.0
Mercier_An	79	Sur ce point où tout abonde, je vois des malheureux qui souffrent la faim.	14	5	14	0	0.0	[]	0.0	0.0	0.0	0.0	0.0
Mercier_An	80	Au milieu de tant de lois sages, on commet mille crimes.	14	6	11	0	0.0	[]	0.0	0.0	0.0	0.0	0.0
Mercier_An	81	Parmi tant de réglement de police, tout est en désordre.	14	7	10	0	0.0	[]	0.0	0.0	0.0	0.0	0.0
Mercier_An	82	Ce ne sont partout qu'entraves, qu'embarras, qu'usages contraires au bien public.	14	8	14	0	0.0	[]	0.0	0.031746031746031744	0.0	0.0	0.0
Mercier_An	83	La foule risque à chaque instant d'être écrasée par cette innombrable profusion de voitures, où sont portés tout à leur aise des gens qui valent infiniment moins que ceux qu'ils éclaboussent et qu'ils menacent d'écraser.	15	0	39	2	0.0512820512820512	[['écraser'], ['menacer']]	0.05714285714285714	0.047619047619047616	0.043010752688172046	0.0512820512820512	0.0340766794716964
Mercier_An	84	Je frissonne dès que j'entends les pas précipités d'une paire de chevaux qui avancent à toutes jambes dans une ville peuplée de femmes grosses, de vieillards et d'enfants.	15	1	31	2	0.064516129032258	[['jambe'], ['gros']]	0.043010752688172046	0.043010752688172046	0.043010752688172046	0.0512820512820512	0.0340766794716964
Mercier_An	85	En vérité, rien n'est plus insultant à la nature humaine, que cette indifférence cruelle sur les dangers qui renaissent à chaque minute .	15	2	23	0	0.0	[]	0.037037037037037035	0.03571428571428571	0.043010752688172046	0.0512820512820512	0.0340766794716964
Mercier_An	86	Vos affaires	16	0	2	0	0.0	[]	0.0	0.0	0.0	0.0	0.0
Mercier_An	87	vous appellent malgré vous dans tel quartier, et il s'en exhale une odeur fétide qui tue.	16	1	17	0	0.0	[]	0.0	0.0	0.0	0.0	0.0
Mercier_An	88	Des milliers d'hommes respirent forcement cet air empoisonné .	16	2	9	0	0.0	[]	0.0	0.0	0.0	0.0	0.0
Mercier_An	89	Vos temples scandalisent plus qu'ils n'édifient.	17	0	8	0	0.0	[]	0.0	0.0	0.0	0.0	0.0
Mercier_An	90	On en fait des lieux de passage et quelquefois pis.	17	1	10	0	0.0	[]	0.0	0.0	0.0	0.0	0.0
Mercier_An	91	On ne s'y assied que pour de l'argent : indécent monopole dans un lieu saint où tous les hommes devant l'Être	17	2	23	0	0.0	[]	0.0	0.0	0.0	0.0	0.0
Mercier_An	92	Suprême doivent se regarder, au moins, comme égaux entre eux.	17	3	10	0	0.0	[]	0.0	0.0	0.0	0.0	0.0
Mercier_An	93	Si vous copiez d'après les Grecs et les Romains, vous n'avez pas seulement l'esprit de vous tenir dans leur genre ;	18	0	23	0	0.0	[]	0.0	0.0	0.022727272727272728	0.0	0.03693553920740494
Mercier_An	94	vous gâtez leur manière qui est simple et noble ;	18	1	9	0	0.0	[]	0.017241379310344827	0.017241379310344827	0.022727272727272728	0.0	0.03693553920740494
Mercier_An	95	vous la gâtez, dis-je, vous la défigurez par la petitesse de vos vues, et par cette fureur puérile que vous avez tous pour le joli.	18	2	26	1	0.0384615384615384	[['défigurer']]	0.0425531914893617	0.0425531914893617	0.022727272727272728	0.0	0.03693553920740494
Mercier_An	96	Vous avez quelques pièces de théâtre qui sont des chef-d'œuvres.	18	3	12	1	0.0833333333333333	[['chef']]	0.03571428571428571	0.03571428571428571	0.022727272727272728	0.0	0.03693553920740494
Mercier_An	97	Si sur leur lecture il me prend envie de les aller voir représenter, je ne les reconnais plus.	18	4	18	0	0.0	[]	0.03333333333333333	0.07894736842105263	0.022727272727272728	0.0	0.03693553920740494
Mercier_An	98	Vous avez trois petits théâtres sombres et mesquins.	19	0	8	2	0.25	[['petit'], ['sombre']]	0.1875	0.08823529411764706	0.0440251572327044	0.039938556067588296	0.08618823755551913
Mercier_An	99	Dans le premier on chante à grands frais ;	19	1	8	1	0.125	[['grand']]	0.09375	0.09375	0.0440251572327044	0.039938556067588296	0.08618823755551913
Mercier_An	100	on vous étourdit magnifiquement, et le ridicule machiniste prodigue des miracles au milieu desquels vous bâillez.	19	2	16	0	0.0	[]	0.05405405405405406	0.05405405405405406	0.0440251572327044	0.039938556067588296	0.08618823755551913
Mercier_An	101	Dans le second on vous fait rire, quand on devrait vous faire pleurer.	19	3	13	1	0.0769230769230769	[['rir']]	0.04225352112676056	0.04225352112676056	0.0440251572327044	0.039938556067588296	0.08618823755551913
Mercier_An	102	Le costume est toujours manqué ; et outre vos pitoyables acteurs tragiques que l'on ne se donne pas même la peine de critiquer, vous avez telle confidente dont le nez plat ou gigantesque suffirait seul pour faire évanouir la plus parfaite illusion.	19	4	42	2	0.0476190476190476	[['nez'], ['plat']]	0.04	0.04	0.0440251572327044	0.039938556067588296	0.08618823755551913
Mercier_An	103	Quant au troisième, ce sont des farceurs qui tantôt secouent le grelot de Momus, et tantôt glapissent de fades ariettes.	19	5	20	0	0.0	[]	0.03225806451612903	0.03225806451612903	0.0440251572327044	0.039938556067588296	0.08618823755551913
Mercier_An	104	Je les préfère cependant à vos fades comédiens François, parce qu'ils ont plus de naturel, et par conséquent plus de grâces, parce qu'ils servent un peu mieux le public ;	19	6	31	1	0.032258064516129	[['naturel']]	0.013888888888888888	0.013888888888888888	0.0440251572327044	0.039938556067588296	0.08618823755551913
Mercier_An	105	mais j'avoue en même temps qu'il faut être excédé de loisir pour s'amuser des frivolités qu'ils débitent.	19	7	21	0	0.0	[]	0.019230769230769232	0.02608695652173913	0.0440251572327044	0.039938556067588296	0.08618823755551913
Mercier_An	106	Ce qui me fait sourire de pitié, c'est que de pareilles gens, auxquels chaque particulier fait en quelque sorte l'aumône, entassent impertinemment leurs juges dans un parterre étroit, où debout et serrés les uns contre les autres, ils souffrent mille tortures, et où il ne leur est pas seulement permis de crier qu'ils étoufent quand ils vont rendre l'âme.	20	0	63	2	0.0317460317460317	[['sourire'], ['serrer']]	0.023255813953488372	0.018691588785046728	0.02586206896551724	0.0317460317460317	0.018803550945943746
Mercier_An	107	Un peuple qui jusques dans ses plaisirs endure une servitude aussi gênante, prouve jusqu'à quel point on peut le réduire en esclavage.	20	1	23	0	0.0	[]	0.02586206896551724	0.02586206896551724	0.02586206896551724	0.0317460317460317	0.018803550945943746
Mercier_An	108	Ainsi tous ces plaisirs vantés de loin, de près sont troublés, corrompus, et il faut marcher sur la tête de la multitude si l'on veut respirer à son aise.	20	2	30	1	0.0333333333333333	[['tête']]	0.018867924528301886	0.015151515151515152	0.02586206896551724	0.0317460317460317	0.018803550945943746
Mercier_An	109	Comme je ne me sens pas ce barbare courage, adieu, je me retire.	21	0	13	0	0.0	[]	0.014925373134328358	0.020618556701030927	0.014925373134328358	0.00925925925925925	0.01309457002197309
Mercier_An	110	Soyez fiers de tous vos beaux monument qui tombent en ruine : montrez avec admiration votre Louvre dont l'aspect vous fait plus de honte que d'honneur, surtout lorsque l'on aperçoit de tout côté tant de colifichets brillant qui vous coûtent plus à entretenir que vos monument publics ne vous coûteraient à achever.	21	1	54	1	0.0185185185185185	[['beau']]	0.014925373134328358	0.013513513513513514	0.014925373134328358	0.00925925925925925	0.01309457002197309
Mercier_An	111	Mais tout cela n'est encore rien.	22	0	7	0	0.0	[]	0.0	0.014084507042253521	0.033707865168539325	0.0	0.05813458204571207
Mercier_An	112	Si je m'étendois sur l'horrible disproportion des fortunes ;	22	1	10	0	0.0	[]	0.034482758620689655	0.034482758620689655	0.033707865168539325	0.0	0.05813458204571207
Mercier_An	113	si j'étalois au grand jour les raisons secrets qui la causent ;	22	2	12	1	0.0833333333333333	[['grand']]	0.08108108108108109	0.08108108108108109	0.033707865168539325	0.0	0.05813458204571207
Mercier_An	114	si je parlais de vos mœurs dures et superbes sous des dehors faciles et polis ;	22	3	15	2	0.1333333333333333	[['dur'], ['superbe']]	0.06382978723404255	0.06382978723404255	0.033707865168539325	0.0	0.05813458204571207
Mercier_An	115	si je retraçois l'indigence du misérable et l'impossibilité où il est d'en sortir en conservant sa probité ;	22	4	20	0	0.0	[]	0.03333333333333333	0.03333333333333333	0.033707865168539325	0.0	0.05813458204571207
Mercier_An	116	si je comptais les rentes qu'un malhonnête homme acquiert, et les degrés de considération dont il jouit à mesure qu'il devient plus fripon...	22	5	25	0	0.0	[]	0.0	0.0	0.033707865168539325	0.0	0.05813458204571207
Mercier_An	117	tout cela me meneroit trop loin : bon soir.	23	0	8	0	0.0	[]	0.0	0.0	0.0	0.0	0.0
Mercier_An	118	Je pars demain ;	23	1	3	0	0.0	[]	0.0	0.0	0.0	0.0	0.0
Mercier_An	119	je pars demain, vous dis-je : je ne puis être plus longtemps dans une ville si malheureuse, avec tant de moyens de ne l'être pas.	23	2	26	0	0.0	[]	0.0	0.0	0.0	0.0	0.0
Mercier_An	120	Je suis dégoûté de Paris comme de Londres.	24	0	8	0	0.0	[]	0.07142857142857142	0.025	0.047619047619047616	0.048924731182795646	0.077256150159734
Mercier_An	121	Toutes les grandes villes se ressemblent ;	24	1	6	1	0.1666666666666666	[['grand']]	0.1	0.1	0.047619047619047616	0.048924731182795646	0.077256150159734
Mercier_An	122	Rousseau l'a fort bien dit.	24	2	6	1	0.1666666666666666	[['fort']]	0.07142857142857142	0.07142857142857142	0.047619047619047616	0.048924731182795646	0.077256150159734
Mercier_An	123	Il semble que plus les hommes font de lois pour être heureux en se réunissant en corps, plus ils se dépravent, et plus ils augmentent la somme de leurs maux.	24	3	30	1	0.0333333333333333	[['corps']]	0.03333333333333333	0.03333333333333333	0.047619047619047616	0.048924731182795646	0.077256150159734
Mercier_An	124	On pouvait cependant raisonnablement penser qu'il devait en arriver le contraire ; mais trop de gens sont intéressés à s'oposer au bien général.	24	4	24	0	0.0	[]	0.03529411764705882	0.03529411764705882	0.047619047619047616	0.048924731182795646	0.077256150159734
Mercier_An	125	Je vais chercher quelque village où, dans un air pur et des plaisirs tranquilles, je puisse déplorer le sort des tristes habitants de ces fastueuses prisons que l'on nomme villes .	24	5	31	2	0.064516129032258	[['pur'], ['triste']]	0.03636363636363636	0.03614457831325301	0.047619047619047616	0.048924731182795646	0.077256150159734
