Mercier_An	957	En voyant des frères unis, des pères heureux, des familles tranquilles, ils regrettèrent de ne pas partager ce bonheur : ils soupirèrent en secret sur ce moment d'erreur qui leur avait fait abjurer une vie plus douce ;	170	1	37	0	0.0	[]	0.0	0.0	0.006578947368421052	0.0	0.01944039478399347
Mercier_An	958	et se maudissant les uns les autres, comme des forçats dans les chaînes , ils hâtèrent l'instant qui devait ouvrir les portes de leur prison.	170	2	25	0	0.0	[]	0.0	0.0	0.006578947368421052	0.0	0.01944039478399347
Mercier_An	959	Il ne tarda pas : le joug fut secoué sans crise et sans efforts, parce que l'heure était venue.	170	3	19	0	0.0	[]	0.0	0.0	0.006578947368421052	0.0	0.01944039478399347
Mercier_An	960	Ainsi l'on voit un fruit mûr se détacher à la plus légère secousse de la branche qui le portait .	170	4	20	0	0.0	[]	0.016666666666666666	0.016666666666666666	0.006578947368421052	0.0	0.01944039478399347
Mercier_An	961	Sortis en foule, et avec toutes les démonstrations de la plus grande allégresse, ils redevinrent hommes, d'esclaves qu'ils étaient.	170	5	21	1	0.0476190476190476	[['grand']]	0.024390243902439025	0.04395604395604396	0.006578947368421052	0.0	0.01944039478399347
Mercier_An	962	Ces moines robustes , en qui semblait revivre la santé des premiers âges du monde, le front vermeil d'amour et de joie, épousèrent ces colombes gémissantes, ces vierges pures, qui sous le voile monastique avaient soupiré plus d'une fois après un état un peu moins saint et plus doux .	171	0	50	3	0.06	[['front'], ['vermeil'], ['pur']]	0.04918032786885246	0.04878048780487805	0.03937007874015748	0.0416666666666666	0.036863110135864664
Mercier_An	963	Elles accomplirent les devoirs de l'hymen avec une ferveur édifiante ;	171	1	11	0	0.0	[]	0.0547945205479452	0.0547945205479452	0.03937007874015748	0.0416666666666666	0.036863110135864664
Mercier_An	964	leurs chastes flancs enfantèrent des rejetons dignes d'un si beau lien.	171	2	12	1	0.0833333333333333	[['beau']]	0.018867924528301886	0.018867924528301886	0.03937007874015748	0.0416666666666666	0.036863110135864664
Mercier_An	965	Leurs époux fortunés et non moins radieux, eurent moins d'empressement à solliciter la canonisation de quelques os vermoulus : ils se contentèrent tout uniment d'être bons pères, bons citoyens ;	171	3	30	0	0.0	[]	0.030303030303030304	0.030303030303030304	0.03937007874015748	0.0416666666666666	0.036863110135864664
Mercier_An	966	et je crois fermement qu'ils n'en allèrent pas moins en paradis après leur mort, sans avoir fait leur enfer pendant leur vie.	171	4	24	1	0.0416666666666666	[['pendant']]	0.018518518518518517	0.0136986301369863	0.03937007874015748	0.0416666666666666	0.036863110135864664
Mercier_An	967	Il est vrai, qu'au temps de cette réforme cela parut un peu extraordinaire à l'évêque de Rome ;	172	0	19	0	0.0	[]	0.0	0.017543859649122806	0.009259259259259259	0.0	0.007104475976429119
Mercier_An	968	mais lui-même eut bientôt de si sérieuses affaires à démêler pour son propre compte...	172	1	14	0	0.0	[]	0.0	0.0	0.009259259259259259	0.0	0.007104475976429119
Mercier_An	969	---Qu'appellez-vous l'évêque de Rome ?	172	2	7	0	0.0	[]	0.0	0.0	0.009259259259259259	0.0	0.007104475976429119
Mercier_An	970	---C'est le pape, pour parler conformément à vos expressions ;	172	3	10	0	0.0	[]	0.0	0.0	0.009259259259259259	0.0	0.007104475976429119
Mercier_An	971	mais, comme je vous l'ai dit, nous avons changé beaucoup de termes gothiques.	172	4	14	0	0.0	[]	0.0	0.0	0.009259259259259259	0.0	0.007104475976429119
Mercier_An	972	Nous ne savons plus ce que c'est que canonicats, bulles, bénéfices, évêchés d'un revenu immense .	172	5	17	0	0.0	[]	0.01	0.01	0.009259259259259259	0.0	0.007104475976429119
Mercier_An	973	On ne va plus baiser les pantoufles du successeur d'un apôtre, à qui son maître n'a donné que des exemples d'humilité : et comme ce même apôtre prêchait la pauvreté, tant par son exemple que par sa parole, nous n'avons plus envoyé l'or le plus pur, le plus nécessaire à l'état, pour des indulgences dont ce bon magicien n'était rien moins qu'avare.	172	6	69	1	0.0144927536231884	[['pur']]	0.010526315789473684	0.010526315789473684	0.009259259259259259	0.0	0.007104475976429119
Mercier_An	974	Tout cela lui a causé d'abord quelques déplaisirs ;	172	7	9	0	0.0	[]	0.014814814814814815	0.014814814814814815	0.009259259259259259	0.0	0.007104475976429119
Mercier_An	975	car on n'aime pas à perdre de ses droits, lors même qu'ils sont peu légitimes : mais bientôt il a senti que son véritable appanage était le ciel ; que les choses terrestres n'étaient pas de son règne, et qu'enfin les richesses du monde étaient des vanités, comme tout ce qui est sous le soleil.	172	8	57	1	0.0175438596491228	[['droit']]	0.015151515151515152	0.033707865168539325	0.009259259259259259	0.0	0.007104475976429119
Mercier_An	976	Le temps, dont la main invisible et sourde mine les tours orgueilleuses, a sappé ce superbe et incroyable monument de la crédulité humaine .	173	0	23	2	0.0869565217391304	[['main'], ['superbe']]	0.058823529411764705	0.03296703296703297	0.043478260869565216	0.0217391304347826	0.041627265554623386
Mercier_An	977	Il est tombé sans bruit : sa force était dans l'opinion ;	173	1	11	0	0.0	[]	0.043478260869565216	0.043478260869565216	0.043478260869565216	0.0217391304347826	0.041627265554623386
Mercier_An	978	l'opinion a changé, et le tout s'est exhalé en fumée.	173	2	12	0	0.0	[]	0.021739130434782608	0.021739130434782608	0.043478260869565216	0.0217391304347826	0.041627265554623386
Mercier_An	979	C'est ainsi qu'après un redoutable incendie on ne voit plus qu'une vapeur insensible et légère, où régnait un vaste embrasement.	173	3	23	1	0.0434782608695652	[['vaste']]	0.02857142857142857	0.04081632653061224	0.043478260869565216	0.0217391304347826	0.041627265554623386
Mercier_An	980	Un Prince digne de régner tient sous sa main cette partie de l'Italie ;	174	0	14	1	0.0714285714285714	[['main']]	0.04878048780487805	0.046875	0.05	0.050125313283208	0.014385444448721538
Mercier_An	981	et cette Rome antique a revu des Césars : j'entends par ce mot des Titus, des Marc-Aurele, et non ces monstres qui portoient une face humaine.	174	1	27	1	0.037037037037037	[['face']]	0.04838709677419355	0.04838709677419355	0.05	0.050125313283208	0.014385444448721538
Mercier_An	982	Ce beau pays s'est ranimé, dès qu'il a été purgé de cette vermine oisive qui végétoit dans la crasse.	174	2	21	1	0.0476190476190476	[['beau']]	0.046511627906976744	0.046511627906976744	0.05	0.050125313283208	0.014385444448721538
Mercier_An	983	Ce royaume tient aujourd'hui son rang ; et porte une physionomie vive et parlante, après avoir été emmaillotté pendant plus de dix-sept siècles dans des haillons ridicules et superstitieux qui lui coupaient la parole et lui gènaient la respiration.	174	3	38	2	0.0526315789473684	[['vif'], ['pendant']]	0.05084745762711865	0.04918032786885246	0.05	0.050125313283208	0.014385444448721538
Mercier_An	984	CHAPITRE XVIII.	175	0	2	0	0.0	[]	0.0	0.045454545454545456	0.0	0.0	0.0
Mercier_An	985	Les ministres de paix.	176	0	4	0	0.0	[]	0.0	0.1111111111111111	0.0	0.0	0.0
Mercier_An	986	Poursuivez, charmant endoctrineur!	177	0	3	1	0.3333333333333333	[['charmer']]	0.05	0.041666666666666664	0.015384615384615385	0.0	0.09597493331650775
Mercier_An	987	Cette révolution, dites-vous, s'est faite de la manière la plus paisible et la plus heureuse ?	177	1	17	0	0.0	[]	0.017857142857142856	0.017857142857142856	0.015384615384615385	0.0	0.09597493331650775
Mercier_An	988	---Elle a été l'ouvrage de la philosophie : elle agit sans bruit, elle agit comme la nature, avec une force d'autant plus sûre qu'elle est insensible.---Mais j'ai bien des difficultés à vous proposer.	177	2	36	0	0.0	[]	0.0	0.0	0.015384615384615385	0.0	0.09597493331650775
Mercier_An	989	Il faut une Religion.---Sans doute, reprit-il avec transport.	177	3	9	0	0.0	[]	0.0	0.0	0.015384615384615385	0.0	0.09597493331650775
Mercier_An	990	Eh!	177	4	1	0	0.0	[]	0.0	0.0	0.015384615384615385	0.0	0.09597493331650775
Mercier_An	991	quel est l'ingrat qui demeurera muet au milieu des miracles de la création, sous la voûte brillante du firmament ?	177	5	20	0	0.0	[]	0.0	0.0	0.015384615384615385	0.0	0.09597493331650775
Mercier_An	992	Nous adorons l'Être Suprême ;	177	6	5	0	0.0	[]	0.0	0.0	0.015384615384615385	0.0	0.09597493331650775
Mercier_An	993	mais le culte qu'on lui rend ne cause plus aucun trouble, aucun débat.	177	7	14	0	0.0	[]	0.0	0.0	0.015384615384615385	0.0	0.09597493331650775
Mercier_An	994	Nous avons peu de ministres : ils sont sages, éclairés, tolérans ;	177	8	10	0	0.0	[]	0.03076923076923077	0.03076923076923077	0.015384615384615385	0.0	0.09597493331650775
Mercier_An	995	ils ignorent l'esprit de faction, et en sont plus chéris, plus respectés : ils ne sont jaloux que d'élever des mains pures vers le trône du Père des humains : ils les chérissent tous à l'imitation du Dieu de bonté ;	177	9	41	2	0.048780487804878	[['main'], ['pur']]	0.0273972602739726	0.0273972602739726	0.015384615384615385	0.0	0.09597493331650775
Mercier_An	996	l'esprit de paix et de concorde anime leurs actions, autant que leurs discours, aussi, vous dis-je, sont-ils universellement animés.	177	10	22	0	0.0	[]	0.025	0.025	0.015384615384615385	0.0	0.09597493331650775
Mercier_An	997	Nous avons un saint prélat qui vit avec ses pasteurs comme avec ses égaux et ses frères.	177	11	17	0	0.0	[]	0.0	0.013157894736842105	0.015384615384615385	0.0	0.09597493331650775
Mercier_An	998	Ces places ne s'accordent qu'à l'âge de quarante ans, parce que c'est alors seulement que les passions turbulentes s'éteignent, et que la raison si tardive dans l'homme exerce son paisible empire.	178	0	37	1	0.027027027027027	[['éteindre']]	0.04081632653061224	0.030303030303030304	0.027586206896551724	0.027027027027027	0.0326930511178844
Mercier_An	999	Leur vie exemplaire marque le plus haut degré de la vertu humaine.	178	1	12	1	0.0833333333333333	[['haut']]	0.03896103896103896	0.03896103896103896	0.027586206896551724	0.027027027027027	0.0326930511178844
Mercier_An	1000	Ce sont eux qui consolent les affligés, qui découvrent aux malheureux un Dieu bon, qui veille sur eux et qui contemple leurs combats pour les récompenser un jour.	178	2	28	1	0.0357142857142857	[['consoler']]	0.03333333333333333	0.03333333333333333	0.027586206896551724	0.027027027027027	0.0326930511178844
Mercier_An	1001	Ils cherchent l'indigence cachée sous le manteau de la honte, et lui donnent des secours sans la faire rougir.	178	3	20	0	0.0	[]	0.015873015873015872	0.015873015873015872	0.027586206896551724	0.027027027027027	0.0326930511178844
Mercier_An	1002	Ils réconcilient les esprits divisés, en leur portant des paroles de douceur et de paix.	178	4	15	0	0.0	[]	0.019230769230769232	0.019230769230769232	0.027586206896551724	0.027027027027027	0.0326930511178844
Mercier_An	1003	Les plus fiers ennemis s'embrassent en leur présence, et leurs cœurs attendris ne sont plus ulcerés.	178	5	17	1	0.0588235294117647	[['attendrir']]	0.020833333333333332	0.020833333333333332	0.027586206896551724	0.027027027027027	0.0326930511178844
Mercier_An	1004	Enfin ils remplissent tous les devoirs d'hommes qui osent parler au nom du Maître Éternel.	178	6	16	0	0.0	[]	0.030303030303030304	0.02857142857142857	0.027586206896551724	0.027027027027027	0.0326930511178844
Mercier_An	1005	---J'aime beaucoup ces ministres, repris-je : mais vous n'avez donc plus parmi vous de gens spécialement consacrés à réciter à toutes les heures du jour d'une voix nasale des cantiques, des pseaumes, des hymnes ?	179	0	37	1	0.027027027027027	[['voix']]	0.022222222222222223	0.01639344262295082	0.023121387283236993	0.0094339622641509	0.014934615255884017
Mercier_An	1006	Aucun parmi vous n'aspire à la canonisation ?	179	1	8	0	0.0	[]	0.02040816326530612	0.02040816326530612	0.023121387283236993	0.0094339622641509	0.014934615255884017
Mercier_An	1007	Qu'est-elle devenue ?	179	2	4	0	0.0	[]	0.0	0.0	0.023121387283236993	0.0094339622641509	0.014934615255884017
Mercier_An	1008	Quels sont vos saints ?	179	3	4	0	0.0	[]	0.0	0.0	0.023121387283236993	0.0094339622641509	0.014934615255884017
Mercier_An	1009	---Nos saints!	179	4	2	0	0.0	[]	0.027777777777777776	0.027777777777777776	0.023121387283236993	0.0094339622641509	0.014934615255884017
Mercier_An	1010	Vous voulez, sans doute, dénoter ceux qui prétendent à un plus haut degré de perfection, qui s'élèvent au-dessus de la faiblesse humaine : oui, nous avons de ces hommes célestes ;	179	5	30	1	0.0333333333333333	[['haut']]	0.023529411764705882	0.023529411764705882	0.023121387283236993	0.0094339622641509	0.014934615255884017
Mercier_An	1011	mais vous croyez bien qu'ils ne mènent pas une vie obscure et solitaire, qu'ils ne se font pas un mérite de jeûner, de psalmodier de mauvais latin, ou de demeurer muets et sots toute leur vie : c'est au grand jour qu'ils montrent la force, la constance de leurs âmes.	179	6	53	1	0.0188679245283018	[['grand']]	0.025423728813559324	0.025423728813559324	0.023121387283236993	0.0094339622641509	0.014934615255884017
Mercier_An	1012	Apprenez qu'ils se chargent volontairement de tous les travaux pénibles ou qui dégoûtent le reste des hommes : ils pensent que les bons offices, les œuvres charitables, sont plus agréables à Dieu que la prière.	179	7	35	1	0.0285714285714285	[['agréable']]	0.022727272727272728	0.026595744680851064	0.023121387283236993	0.0094339622641509	0.014934615255884017
Mercier_An	1013	S'agit-il, par exemple, de curer les égouts, les puits, de transporter les immondices, de s'assujettir aux emplois les plus bas, les plus abjects ou les plus dangereux, comme de porter au milieu d'un incendie le secours des pompes, de marcher sur des poutres brûlantes, de s'élancer dans les eaux pour sauver la vie à un malheureux prêt à périr, etc. ces généreuses victimes du bien public se remplissent, s'enflamment d'un courage actif, par l'idée grande et sublime de se rendre utiles et d'épargner le sentiment de la douleur à leurs compatriotes.	180	0	100	3	0.03	[['bas'], ['grand'], ['sublime']]	0.03571428571428571	0.03428571428571429	0.025210084033613446	0.0285714285714285	0.02155675943993021
Mercier_An	1014	Ils se font un devoir de ces occupations, avec autant de joie et de plaisir que si c'étaient les plus douces, les plus belles : ils font tout pour l'humanité, tout pour la patrie, et jamais rien pour eux.	180	1	40	2	0.05	[['douce'], ['bel']]	0.03428571428571429	0.03428571428571429	0.025210084033613446	0.0285714285714285	0.02155675943993021
Mercier_An	1015	Les uns sont cloués au chevet du lit des malades, et les servent de leurs mains, d'autres descendent dans les carriéres, en détachent, en arrachent les pierres : tour à tour manœuvres, pionniers, porte-faix, etc.	180	2	35	1	0.0285714285714285	[['main']]	0.033707865168539325	0.033707865168539325	0.025210084033613446	0.0285714285714285	0.02155675943993021
Mercier_An	1016	ils semblent des esclaves qu'un tyran a courbés sous un joug de fer.	180	3	14	0	0.0	[]	0.01020408163265306	0.01020408163265306	0.025210084033613446	0.0285714285714285	0.02155675943993021
Mercier_An	1017	Mais ces âmes charitables ont en vue le désir de plaire à l'Éternel en servant leurs semblables : insensibles aux maux présent, ils attendent que Dieu les récompensera, parce que le sacrifice des voluptés de ce monde est fondé sur une utilité réelle et non sur un caprice bigot.	180	4	49	0	0.0	[]	0.0	0.012048192771084338	0.025210084033613446	0.0285714285714285	0.02155675943993021
Mercier_An	1018	Je n'ai pas besoin de vous dire que nos respects les accompagnent pendant leur vie et après leur mort ;	181	0	20	1	0.05	[['pendant']]	0.03636363636363636	0.019230769230769232	0.03636363636363636	0.03928571428571425	0.015152288168283212
Mercier_An	1019	et comme notre plus vive réconnaissance serait insuffisante, nous laissons à l'auteur de tout bien cette dette immense à acquitter, persuadés qu'il est le seul qui sache la juste mesure des récompenses méritées.	181	1	35	1	0.0285714285714285	[['vif']]	0.03636363636363636	0.02531645569620253	0.03636363636363636	0.03928571428571425	0.015152288168283212
Mercier_An	1020	Tels sont les saints que nous vénérons, sans croire autre chose sinon qu'ils ont perfectionné la nature humaine dont ils sont l'honneur.	182	0	24	0	0.0	[]	0.0	0.0136986301369863	0.01812688821752266	0.0	0.022231813841037742
Mercier_An	1021	Ils ne font d'autres miracles que ceux dont je viens de vous entretenir.	182	1	14	0	0.0	[]	0.0	0.0	0.01812688821752266	0.0	0.022231813841037742
Mercier_An	1022	Les martyrs du christianisme avaient assurément leur dignité.	182	2	8	0	0.0	[]	0.009174311926605505	0.009174311926605505	0.01812688821752266	0.0	0.022231813841037742
Mercier_An	1023	Il était beau, sans doute, de braver les tyrans des âmes, de souffrir la mort la plus horrible, plutôt que d'immoler le sentiment intime d'une vérité qu'on a adoptée de cœur et d'esprit : mais qu'il y a plus de grandeur à consacrer une vie entière à des ouvrages renaissant et serviles, à se rendre les bienfaiteurs perpétuels de l'humanité affligée et plaintive, à sécher toutes les larmes qui coulent , à arrêter, à prévenir l'effusion d'une seule goutte de sang.	182	3	87	1	0.0114942528735632	[['beau']]	0.00909090909090909	0.00909090909090909	0.01812688821752266	0.0	0.022231813841037742
Mercier_An	1024	Ces hommes extraordinaires ne présentent point leur genre de vie comme un modèle à suivre ;	182	4	15	0	0.0	[]	0.00909090909090909	0.00909090909090909	0.01812688821752266	0.0	0.022231813841037742
Mercier_An	1025	ils ne se glorifient point de leur héroïsme ;	182	5	8	0	0.0	[]	0.0	0.0	0.01812688821752266	0.0	0.022231813841037742
Mercier_An	1026	ils ne s'abaissent point pour attirer la vénération publique : surtout ils ne censurent point les défauts du prochain ;	182	6	19	0	0.0	[]	0.023255813953488372	0.023255813953488372	0.01812688821752266	0.0	0.022231813841037742
Mercier_An	1027	beaucoup plus attentifs à lui procurer une vie douce et commode, fruit de leurs innombrables soins.	182	7	16	1	0.0625	[['douce']]	0.03333333333333333	0.03333333333333333	0.01812688821752266	0.0	0.022231813841037742
Mercier_An	1028	Lorsque ces âmes augustes vont rejoindre l'Être parfait dont elles sont émanées, nous n'enchassons point leurs cadavres dans un métal plus vil encore ;	182	8	25	1	0.04	[['cadavre']]	0.027777777777777776	0.027777777777777776	0.01812688821752266	0.0	0.022231813841037742
Mercier_An	1029	nous écrivons l'histoire de leur vie, et nous tâchons de l'imiter, au moins dans son détail.---Plus j'avance, plus je vois des changement inattendus.---Vous en verrez bien d'autres!	182	9	31	0	0.0	[]	0.013513513513513514	0.013513513513513514	0.01812688821752266	0.0	0.022231813841037742
Mercier_An	1030	Si vingt plumes n'attestaient la même chose, nous révoquerions assurément en doute l'histoire de votre siècle.	182	10	18	0	0.0	[]	0.0	0.0	0.01812688821752266	0.0	0.022231813841037742
Mercier_An	1031	Comment!	182	11	1	0	0.0	[]	0.0	0.0	0.01812688821752266	0.0	0.022231813841037742
Mercier_An	1032	les serviteurs des autels étaient turbulens, cabaleurs, intolérans.	182	12	8	0	0.0	[]	0.045454545454545456	0.045454545454545456	0.01812688821752266	0.0	0.022231813841037742
Mercier_An	1033	De misérables vermisseaux se persécutaient et se haissaient pendant le court espace de leur vie, parce que souvent ils ne pensaient pas de même sur de vaines subtilités et sur des choses incompréhensibles : de faibles créatures avaient l'audace de fonder les desseins du Tout-puissant, en les marquant au coin de leurs passions minutieuses, orgueilleuses et folles.	182	13	57	3	0.0526315789473684	[['pendant'], ['court'], ['faible']]	0.046153846153846156	0.023622047244094488	0.01812688821752266	0.0	0.022231813841037742
Mercier_An	1034	J'ai lu que ceux qui avaient moins de charité, et par conséquent de religion, étaient ceux qui la prêchoient aux autres ; que l'on avait fait un métier de prier Dieu ; que le nombre de ceux qui portoient cet habit lucratif, gage d'une indolente paresse, s'était multiplié à un point incroyable ; qu'ils vivaient enfin, dans un célibat scandaleux .	183	0	62	0	0.0	[]	0.0	0.017543859649122806	0.0	0.0	0.0
Mercier_An	1035	On ajoute que vos églises ressemblaient à des marchés, que la vue et l'odorat y étaient également blessés, et que vos cérémonies étaient plus faites pour distraire, que pour élever l'âme vers Dieu... mais j'entends la trompette sacrée, qui annonce l'heure de la prière par ses sons édifians.	183	1	52	0	0.0	[]	0.0	0.0	0.0	0.0	0.0
Mercier_An	1036	Venez connaitre notre religion, venez dans le temple voisin rendre grâces au Créateur d'avoir vu lever son soleil.	183	2	19	0	0.0	[]	0.0	0.0	0.0	0.0	0.0
Mercier_An	1037	CHAPITRE XIX.	184	0	2	0	0.0	[]	0.0	0.0	0.0	0.0	0.0
Mercier_An	1038	Le Temple.	185	0	2	0	0.0	[]	0.0	0.03225806451612903	0.0	0.0	0.0
Mercier_An	1039	Nous tournâmes le coin d'une rue, et j'aperçu au milieu d'une belle place un temple en forme de rotonde, couronné d'un dôme magnifique.	186	0	27	1	0.037037037037037	[['bel']]	0.05	0.047619047619047616	0.048	0.0385185185185185	0.06077789813699763
Mercier_An	1040	Cet édifice soutenu sur un seul rang de colonnes avait quatre grands portails.	186	1	13	1	0.0769230769230769	[['grand']]	0.04	0.04	0.048	0.0385185185185185	0.06077789813699763
Mercier_An	1041	Sur chaque fronton on lisait cette inscription : Temple de Dieu .	186	2	10	0	0.0	[]	0.08823529411764706	0.08823529411764706	0.048	0.0385185185185185	0.06077789813699763
Mercier_An	1042	Le temps avait déjà imprimé une teinte vénérable à ses murailles ;	186	3	11	2	0.1818181818181818	[['teindre'], ['vénérable']]	0.07407407407407407	0.07407407407407407	0.048	0.0385185185185185	0.06077789813699763
Mercier_An	1043	elles en avaient plus de majesté.	186	4	6	0	0.0	[]	0.075	0.075	0.048	0.0385185185185185	0.06077789813699763
Mercier_An	1044	Arrivé à la porte du temple, quel fut mon étonnement lorsque je lus dans un tableau ces quatre vers tracés en gros caractères :	186	5	23	1	0.0434782608695652	[['gros']]	0.037037037037037035	0.037037037037037035	0.048	0.0385185185185185	0.06077789813699763
Mercier_An	1045	Loin de rien décider sur cet Être Suprême, Gardons, en l'adorant, un silence profond, Sa nature est immense et l'esprit s'y confond,	186	6	25	1	0.04	[['profond']]	0.034482758620689655	0.034482758620689655	0.048	0.0385185185185185	0.06077789813699763
Mercier_An	1046	Pour savoir ce qu'il est, il faut être lui-même.	186	7	10	0	0.0	[]	0.02857142857142857	0.027777777777777776	0.048	0.0385185185185185	0.06077789813699763
Mercier_An	1047	Oh!	187	0	1	0	0.0	[]	0.05263157894736842	0.041666666666666664	0.03296703296703297	0.0208333333333333	0.028091147935284704
Mercier_An	1048	pour le coup, lui dis-je à voix basse, vous ne direz pas que ceci soit de votre siècle.---Cela ne fait pas plus l'éloge du votre, reprit-il, car vos théologiens devaient s'en tenir-là.	187	1	37	2	0.054054054054054	[['voix'], ['bas']]	0.04838709677419355	0.04838709677419355	0.03296703296703297	0.0208333333333333	0.028091147935284704
Mercier_An	1049	Mais cette réponse qui semble avoir été faite par Dieu même, est restée confondue parmi les vers dont on ne faisait pas grand cas ;	187	2	24	1	0.0416666666666666	[['grand']]	0.03333333333333333	0.03333333333333333	0.03296703296703297	0.0208333333333333	0.028091147935284704
Mercier_An	1050	je ne sais cependant s'il y en a de plus beaux pour le sens qu'ils renferment, et je crois qu'ils sont ici à leur véritable place.	187	3	29	0	0.0	[]	0.018867924528301886	0.013513513513513514	0.03296703296703297	0.0208333333333333	0.028091147935284704
Mercier_An	1051	Nous suivimes le peuple qui, d'un air recueilli, d'un pas tranquille et modeste, allait remplir la profondeur du temple.	188	0	21	0	0.0	[]	0.047619047619047616	0.028169014084507043	0.040268456375838924	0.0	0.05641454388689002
Mercier_An	1052	Chacun s'asseyait à son tour sur des rangs de petits sièges sans dos, et les hommes étaient séparés des femmes.	188	1	21	2	0.0952380952380952	[['petit'], ['siège']]	0.0425531914893617	0.0425531914893617	0.040268456375838924	0.0	0.05641454388689002
Mercier_An	1053	L'autel était au centre ;	188	2	5	0	0.0	[]	0.04878048780487805	0.04878048780487805	0.040268456375838924	0.0	0.05641454388689002
Mercier_An	1054	il était absolument nud, et chacun pouvait distinguer le prêtre qui faisait fumer l'encens.	188	3	15	0	0.0	[]	0.05263157894736842	0.05263157894736842	0.040268456375838924	0.0	0.05641454388689002
Mercier_An	1055	À l'instant où sa voix prononçait les cantiques sacrés, le chœur des assistant élevait alternativement la sienne.	188	4	18	2	0.1111111111111111	[['voix'], ['prononcer']]	0.044444444444444446	0.044444444444444446	0.040268456375838924	0.0	0.05641454388689002
Mercier_An	1056	Leur chant doux et modéré peignait le sentiment respectueux de leur cœur ;	188	5	12	0	0.0	[]	0.08108108108108109	0.08108108108108109	0.040268456375838924	0.0	0.05641454388689002
Mercier_An	1057	ils semblaient pénétrés de la majesté divine.	188	6	7	1	0.1428571428571428	[['pénétrer']]	0.06896551724137931	0.06896551724137931	0.040268456375838924	0.0	0.05641454388689002
Mercier_An	1058	Point de statues, point de figures allégoriques, point de tableaux .	188	7	10	1	0.1	[['figure']]	0.09090909090909091	0.09090909090909091	0.040268456375838924	0.0	0.05641454388689002
Mercier_An	1059	Le saint nom de Dieu	188	8	5	0	0.0	[]	0.037037037037037035	0.037037037037037035	0.040268456375838924	0.0	0.05641454388689002
Mercier_An	1060	mille fois répété, tracé en plusieurs langues, régnait sur toutes les murailles.	188	9	12	0	0.0	[]	0.0	0.0	0.040268456375838924	0.0	0.05641454388689002
