Montesquieu_Arsace	540	mais je m' aperçus bientôt qu' il ne pouvait me pardonner mon courage et sa frayeur.	0	540	16	0	0.0	[]	0.0	0.0	0.01736013494517852	0.0	0.040931542455649526
Montesquieu_Arsace	541	Ma présence le mettait dans l' embarras;	0	541	7	0	0.0	[]	0.0	0.0	0.01736013494517852	0.0	0.040931542455649526
Montesquieu_Arsace	542	il ne pouvait donc pas	0	542	5	0	0.0	[]	0.0	0.0	0.01736013494517852	0.0	0.040931542455649526
Montesquieu_Arsace	543	m' aimer.	0	543	2	0	0.0	[]	0.0	0.0	0.01736013494517852	0.0	0.040931542455649526
Montesquieu_Arsace	544	Ses courtisans s' en aperçurent, et dès lors ils se donnèrent bien garde de me trop estimer;	0	544	17	0	0.0	[]	0.0	0.0	0.01736013494517852	0.0	0.040931542455649526
Montesquieu_Arsace	545	et, pour que je n' eusse pas sauvé l' état du péril, tout le monde convenait à la cour qu' il n' y avait pas eu de péril.	0	545	28	0	0.0	[]	0.010526315789473684	0.010526315789473684	0.01736013494517852	0.0	0.040931542455649526
Montesquieu_Arsace	546	Ainsi, également dégoûté de l' esclavage et des esclaves, je ne connus plus d' autre passion que mon amour pour Ardasire, et je m' estimai cent fois plus heureux de rester dans la seule dépendance que j' aimais, que de rentrer dans une autre que je ne pouvais que haïr.	0	546	50	1	0.02	[['rentrer']]	0.011494252873563218	0.011494252873563218	0.01736013494517852	0.0	0.040931542455649526
Montesquieu_Arsace	547	Il nous parut que le génie nous avait suivis.	0	547	9	0	0.0	[]	0.0136986301369863	0.0136986301369863	0.01736013494517852	0.0	0.040931542455649526
Montesquieu_Arsace	548	Nous nous retrouvâmes dans la même abondance, et nous vîmes toujours de nouveaux prodiges.	0	548	14	0	0.0	[]	0.046511627906976744	0.046511627906976744	0.01736013494517852	0.0	0.040931542455649526
Montesquieu_Arsace	549	Un pêcheur vint nous vendre un poisson: onm' apporta une bague fort riche qu' on avait trouvée dans son gosier.	0	549	20	2	0.1	[['fort'], ['riche']]	0.03076923076923077	0.03076923076923077	0.01736013494517852	0.0	0.040931542455649526
Montesquieu_Arsace	550	Un jour, manquant d' argent, j' envoyai vendre quelques pierreries à la ville prochaine: on m' en apporta le prix, et quelques jours après, je vis sur ma table les pierreries.	0	550	31	0	0.0	[]	0.05660377358490566	0.05660377358490566	0.01736013494517852	0.0	0.040931542455649526
Montesquieu_Arsace	551	Grands dieux!	0	551	2	1	0.5	[['grand']]	0.02702702702702703	0.02702702702702703	0.01736013494517852	0.0	0.040931542455649526
Montesquieu_Arsace	552	Dis-je en moi	0	552	4	0	0.0	[]	0.06666666666666667	0.06666666666666667	0.01736013494517852	0.0	0.040931542455649526
Montesquieu_Arsace	553	-même, il m' est donc impossible de m' appauvrir!	0	553	9	0	0.0	[]	0.0	0.0	0.01736013494517852	0.0	0.040931542455649526
Montesquieu_Arsace	554	Nous voulûmes tenter le génie, et nous lui demandâmes une somme immense.	0	554	12	0	0.0	[]	0.0	0.0	0.01736013494517852	0.0	0.040931542455649526
Montesquieu_Arsace	555	Il nous fit bien voir que nos vœux étaient indiscrets.	0	555	10	0	0.0	[]	0.02564102564102564	0.02564102564102564	0.01736013494517852	0.0	0.040931542455649526
Montesquieu_Arsace	556	Nous trouvâmes, quelques jours après, sur la table, la plus petite somme que nous eussions encore reçue.	0	556	17	1	0.0588235294117647	[['petit']]	0.02702702702702703	0.02702702702702703	0.01736013494517852	0.0	0.040931542455649526
Montesquieu_Arsace	557	Nous ne pûmes, en la voyant, nous empêcher de rire.	0	557	10	0	0.0	[]	0.06060606060606061	0.06060606060606061	0.01736013494517852	0.0	0.040931542455649526
Montesquieu_Arsace	558	Le génie nous joue, dit Ardasire.	0	558	6	1	0.1666666666666666	[['joue']]	0.058823529411764705	0.058823529411764705	0.01736013494517852	0.0	0.040931542455649526
Montesquieu_Arsace	559	Ah	0	559	1	0	0.0	[]	0.14285714285714285	0.14285714285714285	0.01736013494517852	0.0	0.040931542455649526
Montesquieu_Arsace	560	!	0	560	0	0	0.0	[]	0.0	0.0	0.01736013494517852	0.0	0.040931542455649526
Montesquieu_Arsace	561	M' écriai-je, les dieux sont de bons dispensateurs: la médiocrité qu' ils nous accordent vaut bien mieux que les trésors qu' ils nous refusent.	0	561	25	0	0.0	[]	0.0	0.0	0.01736013494517852	0.0	0.040931542455649526
Montesquieu_Arsace	562	Nous n' avions aucune des passions tristes.	0	562	7	0	0.0	[]	0.0	0.0	0.01736013494517852	0.0	0.040931542455649526
Montesquieu_Arsace	563	L' aveugle ambition, la soif d' acquérir, l' envie de dominer, semblaient s' éloigner de nous, et être les passions d' un autre univers.	0	563	24	0	0.0	[]	0.0	0.0	0.01736013494517852	0.0	0.040931542455649526
Montesquieu_Arsace	564	Ces sortes de biens ne sont faits que pour entrer dans le vide des âmes que la nature n' a point remplies.	0	564	22	0	0.0	[]	0.0	0.0	0.01736013494517852	0.0	0.040931542455649526
Montesquieu_Arsace	565	Ils n' ont été imaginés que par ceux qui se sont trouvés incapables de bien sentir les autres.	0	565	18	0	0.0	[]	0.017543859649122806	0.017543859649122806	0.01736013494517852	0.0	0.040931542455649526
Montesquieu_Arsace	566	Je vous ai déjà dit que nous étions adorés de cette petite nation qui formait notre maison.	0	566	17	1	0.0588235294117647	[['petit']]	0.03389830508474576	0.03389830508474576	0.01736013494517852	0.0	0.040931542455649526
Montesquieu_Arsace	567	Nous nous aimions, Ardasire et moi; et sans doute que l' effet naturel de l' amour est de rendre heureux ceux qui s' aiment.	0	567	24	1	0.0416666666666666	[['naturel']]	0.03125	0.03125	0.01736013494517852	0.0	0.040931542455649526
Montesquieu_Arsace	568	Mais cette bienveillance générale que nous trouvons dans tous ceux qui sont autour de nous peut rendre plus heureux que l' amour même.	0	568	23	0	0.0	[]	0.014925373134328358	0.014925373134328358	0.01736013494517852	0.0	0.040931542455649526
Montesquieu_Arsace	569	Il est impossible que ceux qui ont le cœur bien fait ne se plaisent au milieu de cette bienveillance générale.	0	569	20	0	0.0	[]	0.0	0.0	0.01736013494517852	0.0	0.040931542455649526
Montesquieu_Arsace	570	étrange effet de la nature!	0	570	5	0	0.0	[]	0.0	0.0	0.01736013494517852	0.0	0.040931542455649526
Montesquieu_Arsace	571	L' homme n' est jamais si peu à lui que lorsqu' il paraît l' être davantage.	0	571	16	0	0.0	[]	0.0	0.0	0.01736013494517852	0.0	0.040931542455649526
Montesquieu_Arsace	572	Le cœur n' est jamais le cœur que quand il se donne, parce que ses jouissances sont hors de lui.	0	572	20	0	0.0	[]	0.0	0.0	0.01736013494517852	0.0	0.040931542455649526
Montesquieu_Arsace	573	C' est ce qui fait que ces idées de grandeur, qui retirent toujours le cœur vers lui-même, trompent ceux qui en sont enivrés;	0	573	23	0	0.0	[]	0.0	0.0	0.01736013494517852	0.0	0.040931542455649526
Montesquieu_Arsace	574	c' est ce qui fait qu' ils s' étonnent de n' être point heureux au milieu de ce qu' ils craient être le bonheur;	0	574	24	0	0.0	[]	0.0	0.0	0.01736013494517852	0.0	0.040931542455649526
Montesquieu_Arsace	575	que, ne le trouvant point dans la grandeur, ils cherchent plus de grandeur encore.	0	575	14	0	0.0	[]	0.0	0.0	0.01736013494517852	0.0	0.040931542455649526
Montesquieu_Arsace	576	S' ils n' y peuventatteindre, ils se craient plus malheureux;	0	576	10	0	0.0	[]	0.0	0.0	0.01736013494517852	0.0	0.040931542455649526
Montesquieu_Arsace	577	s' ils y atteignent, ils ne trouvent pas encore le bonheur.	0	577	11	0	0.0	[]	0.0	0.0	0.01736013494517852	0.0	0.040931542455649526
Montesquieu_Arsace	578	C' est l' orgueil qui, à force de nous posséder, nous empêche de nous posséder, et qui, nous concentrant dans nous-mêmes, y porte toujours la tristesse.	0	578	27	0	0.0	[]	0.0	0.0	0.01736013494517852	0.0	0.040931542455649526
Montesquieu_Arsace	579	Cette tristesse vient de la solitude du cœur, qui se sent toujours fait pour jouir, et qui ne jouit pas;	0	579	20	0	0.0	[]	0.0	0.0	0.01736013494517852	0.0	0.040931542455649526
Montesquieu_Arsace	580	qui se sent toujours fait pour les autres, et qui ne les trouve pas.	0	580	14	0	0.0	[]	0.0	0.0	0.01736013494517852	0.0	0.040931542455649526
Montesquieu_Arsace	581	Ainsi nous aurions goûté des plaisirs que donne la nature toutes les fois qu' on ne la fuit pas.	0	581	19	0	0.0	[]	0.0	0.0	0.01736013494517852	0.0	0.040931542455649526
Montesquieu_Arsace	582	Nous aurions passé notre vie dans la joie, l' innocence et la paix.	0	582	13	0	0.0	[]	0.0	0.0	0.01736013494517852	0.0	0.040931542455649526
Montesquieu_Arsace	583	Nous aurions compté nos années par le renouvellement des fleurs et des fruits;	0	583	13	0	0.0	[]	0.0	0.0	0.01736013494517852	0.0	0.040931542455649526
Montesquieu_Arsace	584	nous aurions perdu nos années dans la rapidité d' une vie heureuse.	0	584	12	0	0.0	[]	0.024390243902439025	0.024390243902439025	0.01736013494517852	0.0	0.040931542455649526
Montesquieu_Arsace	585	J' aurois vu tous les jours Ardasire, et je lui aurois dit que je l' aimais.	0	585	16	1	0.0625	[['luire']]	0.02631578947368421	0.02631578947368421	0.01736013494517852	0.0	0.040931542455649526
Montesquieu_Arsace	586	La même terre aurait repris son âme et la mienne.	0	586	10	0	0.0	[]	0.022727272727272728	0.022727272727272728	0.01736013494517852	0.0	0.040931542455649526
Montesquieu_Arsace	587	Mais tout à coup mon bonheur s' évanouit, et j' éprouvai le revers du monde le plus affreux.	0	587	18	0	0.0	[]	0.0	0.0	0.01736013494517852	0.0	0.040931542455649526
Montesquieu_Arsace	588	Le prince du pays était un tyran capable de tous les crimes;	0	588	12	0	0.0	[]	0.0	0.0	0.01736013494517852	0.0	0.040931542455649526
Montesquieu_Arsace	589	mais rien ne le rendait si odieux que les outrages continuels qu' il faisait à un sexe sur lequel il n' est pas seulement permis de lever les yeux.	0	589	29	0	0.0	[]	0.01639344262295082	0.01639344262295082	0.01736013494517852	0.0	0.040931542455649526
Montesquieu_Arsace	590	Il apprit, par une esclave sortie du sérail d' Ardasire, qu' elle était la plus belle personne de l' Orient.	0	590	20	1	0.05	[['bel']]	0.016129032258064516	0.016129032258064516	0.01736013494517852	0.0	0.040931542455649526
Montesquieu_Arsace	591	Il n' en fallut pas davantage pour le déterminer à me l' enlever.	0	591	13	0	0.0	[]	0.03508771929824561	0.03508771929824561	0.01736013494517852	0.0	0.040931542455649526
Montesquieu_Arsace	592	Une nuit, une grosse troupe de gens armés entoura ma maison, et le matin je reçus un ordre du tyran de lui envoyer Ardasire.	0	592	24	1	0.0416666666666666	[['gros']]	0.022222222222222223	0.022222222222222223	0.01736013494517852	0.0	0.040931542455649526
Montesquieu_Arsace	593	Je vis l' impossibilité de la faire sauver.	0	593	8	0	0.0	[]	0.02040816326530612	0.02040816326530612	0.01736013494517852	0.0	0.040931542455649526
Montesquieu_Arsace	594	Ma première idée fut de lui aller donner la mort dans le sommeil où elle était ensevelie.	0	594	17	0	0.0	[]	0.0	0.0	0.01736013494517852	0.0	0.040931542455649526
Montesquieu_Arsace	595	Je pris mon épée, je courus, j' entrai dans sa chambre, j' ouvris les rideaux;	0	595	15	0	0.0	[]	0.0	0.0	0.01736013494517852	0.0	0.040931542455649526
Montesquieu_Arsace	596	je reculai d' horreur, et tous mes sens se glacèrent.	0	596	10	0	0.0	[]	0.0	0.0	0.01736013494517852	0.0	0.040931542455649526
Montesquieu_Arsace	597	Une nouvelle rage me saisit: je voulus aller me jeter au milieu de ces satellites, et immoler tout ce qui se présenterait à moi.	0	597	24	0	0.0	[]	0.0	0.0	0.01736013494517852	0.0	0.040931542455649526
Montesquieu_Arsace	598	Mon esprit s' ouvrit pour un dessein plus suivi, et je me calmai.	0	598	13	0	0.0	[]	0.0	0.0	0.01736013494517852	0.0	0.040931542455649526
Montesquieu_Arsace	599	Je résolus de prendre les habits que j' avais eus il y avait quelques mois, de monter, sous le nom d' Ardasire, dans la litière que le tyran lui avait destinée, de me faire mener à lui.	0	599	37	0	0.0	[]	0.0	0.0	0.01736013494517852	0.0	0.040931542455649526
Montesquieu_Arsace	600	Outre que je ne voyais point d' autre ressource, je sentais en moi-même du plaisir à faire une action de courage sous les mêmes habits avec lesquels l' aveugle amour avait auparavant avili mon sexe.	0	600	36	0	0.0	[]	0.0	0.0	0.01736013494517852	0.0	0.040931542455649526
Montesquieu_Arsace	601	J' exécutai tout de sang	0	601	5	0	0.0	[]	0.0	0.0	0.01736013494517852	0.0	0.040931542455649526
Montesquieu_Arsace	602	-	0	602	0	0	0.0	[]	0.0	0.0	0.01736013494517852	0.0	0.040931542455649526
Montesquieu_Arsace	603	froid	0	603	1	0	0.0	[]	0.0	0.0	0.01736013494517852	0.0	0.040931542455649526
Montesquieu_Arsace	604	.	0	604	0	0	0.0	[]	0.0	0.0	0.01736013494517852	0.0	0.040931542455649526
Montesquieu_Arsace	605	J' ordonnai que l' on cachât à Ardasire le péril que je courais, et que, sitôt que je serais parti, on la fît sauver dans un autre pays.	0	605	28	0	0.0	[]	0.0	0.0	0.01736013494517852	0.0	0.040931542455649526
Montesquieu_Arsace	606	Je pris avec moi un esclave dont je connaissais le courage, et je me livrai aux femmes et aux eunuques que le tyran avait envoyés.	0	606	25	0	0.0	[]	0.0	0.0	0.01736013494517852	0.0	0.040931542455649526
Montesquieu_Arsace	607	Je ne restai pas deux jours en chemin, et, quand j' arrivai, la nuit était déjà avancée.	0	607	17	0	0.0	[]	0.0	0.0	0.01736013494517852	0.0	0.040931542455649526
Montesquieu_Arsace	608	Le tyran donnait un festin à ses femmes et à ses courtisans dans une salle de ses jardins.	0	608	18	0	0.0	[]	0.018867924528301886	0.018867924528301886	0.01736013494517852	0.0	0.040931542455649526
Montesquieu_Arsace	609	Il était dans cette gaîté stupide que donne la débauche lorsqu' elle a été portée à l' excès.	0	609	18	1	0.0555555555555555	[['stupide']]	0.022727272727272728	0.022727272727272728	0.01736013494517852	0.0	0.040931542455649526
Montesquieu_Arsace	610	Il ordonna que l' on me fît venir.	0	610	8	0	0.0	[]	0.019230769230769232	0.019230769230769232	0.01736013494517852	0.0	0.040931542455649526
Montesquieu_Arsace	611	J' entrai dans la salle du festin: il me fit mettre auprès de lui, et je sus cacher ma fureur et le désordre de mon âme.	0	611	26	0	0.0	[]	0.0	0.0	0.01736013494517852	0.0	0.040931542455649526
Montesquieu_Arsace	612	J' étais comme incertain dans mes souhaits.	0	612	7	0	0.0	[]	0.019230769230769232	0.019230769230769232	0.01736013494517852	0.0	0.040931542455649526
Montesquieu_Arsace	613	Je voulais attirer les regards du tyran, et, quand il les tournait vers moi, je sentais redoubler ma rage.	0	613	19	1	0.0526315789473684	[['regard']]	0.024390243902439025	0.024390243902439025	0.01736013494517852	0.0	0.040931542455649526
Montesquieu_Arsace	614	Parce qu' il me croit Ardasire, disais-je en moi-même, il ose m' aimer.	0	614	15	0	0.0	[]	0.018518518518518517	0.018518518518518517	0.01736013494517852	0.0	0.040931542455649526
Montesquieu_Arsace	615	Il me semblait que je voyais multiplier ses outrages, et qu' il avait trouvé mille manières d' offenser mon amour.	0	615	20	0	0.0	[]	0.0	0.0	0.01736013494517852	0.0	0.040931542455649526
Montesquieu_Arsace	616	Cependant j' étais prêt à jouir de la plus affreuse vengeance.	0	616	11	0	0.0	[]	0.0	0.0	0.01736013494517852	0.0	0.040931542455649526
Montesquieu_Arsace	617	Il s' enflammait, et je le voyais insensiblement approcher de son malheur.	0	617	12	0	0.0	[]	0.0	0.0	0.01736013494517852	0.0	0.040931542455649526
Montesquieu_Arsace	618	Il sortit de la salle du festin, et me mena dans un appartement plus reculé de ses jardins, suivi d' un seul eunuque et de mon esclave.	0	618	27	0	0.0	[]	0.0	0.0	0.01736013494517852	0.0	0.040931542455649526
Montesquieu_Arsace	619	Déjà sa fureur brutale allait l' éclaircir sur mon sexe.	0	619	10	0	0.0	[]	0.0	0.0	0.01736013494517852	0.0	0.040931542455649526
Montesquieu_Arsace	620	Ce fer, m' écriai-je, t' apprendra mieux que je suis un homme.	0	620	13	0	0.0	[]	0.0	0.0	0.01736013494517852	0.0	0.040931542455649526
Montesquieu_Arsace	621	Meurs, et qu' on dise aux enfers que l' époux d' Ardasire a puni tes crimes.	0	621	16	0	0.0	[]	0.022222222222222223	0.022222222222222223	0.01736013494517852	0.0	0.040931542455649526
Montesquieu_Arsace	622	Il tomba à mes pieds, et dans ce moment la porte de l' appartement s' ouvrit;	0	622	16	1	0.0625	[['pied']]	0.037037037037037035	0.037037037037037035	0.01736013494517852	0.0	0.040931542455649526
Montesquieu_Arsace	623	car sitôt que mon esclave avait entendu ma voix, il avait tué l' eunuque qui la gardait, et s' en était saisi.	0	623	22	1	0.0454545454545454	[['voix']]	0.05	0.05	0.01736013494517852	0.0	0.040931542455649526
Montesquieu_Arsace	624	Nous fuîmes;	0	624	2	0	0.0	[]	0.034482758620689655	0.034482758620689655	0.01736013494517852	0.0	0.040931542455649526
Montesquieu_Arsace	625	nous errions dans les jardins;	0	625	5	0	0.0	[]	0.0	0.0	0.01736013494517852	0.0	0.040931542455649526
Montesquieu_Arsace	626	nous rencontrâmes un homme;	0	626	4	0	0.0	[]	0.03225806451612903	0.03225806451612903	0.01736013494517852	0.0	0.040931542455649526
Montesquieu_Arsace	627	je le saisis: je te plongerai, lui dis-je, ce poignard dans le sein, si tu ne me fais sortir d' ici.	0	627	22	1	0.0454545454545454	[['sein']]	0.023255813953488372	0.023255813953488372	0.01736013494517852	0.0	0.040931542455649526
Montesquieu_Arsace	628	C' était un jardinier, qui, tout tremblant de peur, me mena à une porte qu' il ouvrit;	0	628	17	0	0.0	[]	0.02	0.02	0.01736013494517852	0.0	0.040931542455649526
Montesquieu_Arsace	629	je la lui fis refermer, et lui ordonnai de me suivre.	0	629	11	0	0.0	[]	0.0	0.0	0.01736013494517852	0.0	0.040931542455649526
Montesquieu_Arsace	630	Je jetai mes habits, et pris un manteau d' esclave.	0	630	10	0	0.0	[]	0.0	0.0	0.01736013494517852	0.0	0.040931542455649526
Montesquieu_Arsace	631	Nous errâmes dans les bois, et, par un bonheur inespéré, lorsque nous étions accablés de lassitude, nous trouvâmes un marchand qui faisait paître ses chameaux;	0	631	25	0	0.0	[]	0.0	0.0	0.01736013494517852	0.0	0.040931542455649526
Montesquieu_Arsace	632	nous l' obligeâmes de nous mener hors de ce funeste pays.à mesure que j' évitois tant de dangers, mon cœur devenait moins tranquille.	0	632	23	0	0.0	[]	0.0	0.0	0.01736013494517852	0.0	0.040931542455649526
Montesquieu_Arsace	633	Il fallait revoir Ardasire, et tout me faisait craindre pour elle.	0	633	11	0	0.0	[]	0.0	0.0	0.01736013494517852	0.0	0.040931542455649526
Montesquieu_Arsace	634	Ses femmes et ses eunuques lui avaient caché l' horreur de notre situation;	0	634	13	0	0.0	[]	0.0	0.0	0.01736013494517852	0.0	0.040931542455649526
Montesquieu_Arsace	635	mais, ne me voyant plus auprès d' elle, elle me croyait coupable;	0	635	12	0	0.0	[]	0.0	0.0	0.01736013494517852	0.0	0.040931542455649526
Montesquieu_Arsace	636	elle s' imaginait que j' avais manqué à tant de serments que je lui avais faits.	0	636	16	0	0.0	[]	0.0	0.0	0.01736013494517852	0.0	0.040931542455649526
Montesquieu_Arsace	637	Elle ne pouvait concevoir cette barbarie de l' avoir fait enlever sans lui rien dire.	0	637	15	0	0.0	[]	0.0	0.0	0.01736013494517852	0.0	0.040931542455649526
Montesquieu_Arsace	638	L' amour voit tout ce qu' il craint.	0	638	8	0	0.0	[]	0.0	0.0	0.01736013494517852	0.0	0.040931542455649526
Montesquieu_Arsace	639	La vie lui devint insupportable;	0	639	5	0	0.0	[]	0.0	0.0	0.01736013494517852	0.0	0.040931542455649526
Montesquieu_Arsace	640	elle prit du poison;	0	640	4	0	0.0	[]	0.0	0.0	0.01736013494517852	0.0	0.040931542455649526
Montesquieu_Arsace	641	il ne fit pas son effet violemment.	0	641	7	0	0.0	[]	0.0	0.0	0.01736013494517852	0.0	0.040931542455649526
Montesquieu_Arsace	642	J' arrivai et je la trouvai mourante.	0	642	7	0	0.0	[]	0.0	0.0	0.01736013494517852	0.0	0.040931542455649526
Montesquieu_Arsace	643	Ardasire, lui dis-je, je vous perds, vous mourez!	0	643	9	0	0.0	[]	0.0	0.0	0.01736013494517852	0.0	0.040931542455649526
Montesquieu_Arsace	644	Cruelle Ardasire!	0	644	2	0	0.0	[]	0.0	0.0	0.01736013494517852	0.0	0.040931542455649526
Montesquieu_Arsace	645	Hélas!	0	645	1	0	0.0	[]	0.0	0.0	0.01736013494517852	0.0	0.040931542455649526
Montesquieu_Arsace	646	Qu' avais-je fait? ...	0	646	5	0	0.0	[]	0.0	0.0	0.01736013494517852	0.0	0.040931542455649526
Montesquieu_Arsace	647	elle versa quelques larmes.	0	647	4	0	0.0	[]	0.0	0.0	0.01736013494517852	0.0	0.040931542455649526
Montesquieu_Arsace	648	Arsace, me dit-elle, il n' y a qu' un moment que la mort me semblait délicieuse;	0	648	17	0	0.0	[]	0.0	0.0	0.01736013494517852	0.0	0.040931542455649526
Montesquieu_Arsace	649	elle me paraît terrible depuis que je vous vois.	0	649	9	0	0.0	[]	0.0	0.0	0.01736013494517852	0.0	0.040931542455649526
Montesquieu_Arsace	650	Je sens que je voudrais revivre pour vous, et que mon âme me quitte malgré elle.	0	650	16	0	0.0	[]	0.0	0.0	0.01736013494517852	0.0	0.040931542455649526
Montesquieu_Arsace	651	Conservez mon souvenir;	0	651	3	0	0.0	[]	0.0	0.0	0.01736013494517852	0.0	0.040931542455649526
Montesquieu_Arsace	652	et, si j' apprends qu' il vous est cher, comptez que je ne serai point tourmentée chez les ombres.	0	652	19	0	0.0	[]	0.027777777777777776	0.027777777777777776	0.01736013494517852	0.0	0.040931542455649526
Montesquieu_Arsace	653	J' ai du moins cette consolation, mon cher Arsace, de mourir dans vos bras.	0	653	14	1	0.0714285714285714	[['mourir']]	0.02857142857142857	0.02857142857142857	0.01736013494517852	0.0	0.040931542455649526
Montesquieu_Arsace	654	Elle expira.	0	654	2	0	0.0	[]	0.03571428571428571	0.03571428571428571	0.01736013494517852	0.0	0.040931542455649526
Montesquieu_Arsace	655	Il me serait impossible de dire comment je n' expirai pas aussi.	0	655	12	0	0.0	[]	0.0	0.0	0.01736013494517852	0.0	0.040931542455649526
Montesquieu_Arsace	656	On m' arracha d' Ardasire, et je crus qu' on me séparait de moi-même.	0	656	15	0	0.0	[]	0.024390243902439025	0.024390243902439025	0.01736013494517852	0.0	0.040931542455649526
Montesquieu_Arsace	657	Je fixai mes yeux sur elle, et je restai immobile: j' étais devenu stupide.	0	657	14	1	0.0714285714285714	[['oeil']]	0.022727272727272728	0.022727272727272728	0.01736013494517852	0.0	0.040931542455649526
Montesquieu_Arsace	658	On m' ôta ce terrible spectacle, et je sentis mon âme reprendre toute sa sensibilité.	0	658	15	0	0.0	[]	0.046511627906976744	0.046511627906976744	0.01736013494517852	0.0	0.040931542455649526
Montesquieu_Arsace	659	On m' entraîna: je tournois les yeux vers ce fatal objet de ma douleur;	0	659	14	1	0.0714285714285714	[['oeil']]	0.025	0.025	0.01736013494517852	0.0	0.040931542455649526
Montesquieu_Arsace	660	j' aurois donné mille vies pour le voir encore un moment.	0	660	11	0	0.0	[]	0.030303030303030304	0.030303030303030304	0.01736013494517852	0.0	0.040931542455649526
Montesquieu_Arsace	661	J' entrai en fureur, je pris mon épée;	0	661	8	0	0.0	[]	0.0	0.0	0.01736013494517852	0.0	0.040931542455649526
Montesquieu_Arsace	662	j' allois me percer le sein;	0	662	6	0	0.0	[]	0.0	0.0	0.01736013494517852	0.0	0.040931542455649526
Montesquieu_Arsace	663	on m' arrêta.	0	663	3	0	0.0	[]	0.0	0.0	0.01736013494517852	0.0	0.040931542455649526
Montesquieu_Arsace	664	Je sortis de ce palais funeste;	0	664	6	0	0.0	[]	0.0	0.0	0.01736013494517852	0.0	0.040931542455649526
Montesquieu_Arsace	665	je n' y rentrai plus.	0	665	5	0	0.0	[]	0.0	0.0	0.01736013494517852	0.0	0.040931542455649526
Montesquieu_Arsace	666	Mon esprit s' aliéna;	0	666	4	0	0.0	[]	0.0	0.0	0.01736013494517852	0.0	0.040931542455649526
Montesquieu_Arsace	667	je courais dans les bois;	0	667	5	0	0.0	[]	0.0	0.0	0.01736013494517852	0.0	0.040931542455649526
Montesquieu_Arsace	668	je remplissois l' air de mes cris.	0	668	7	0	0.0	[]	0.0	0.0	0.01736013494517852	0.0	0.040931542455649526
Montesquieu_Arsace	669	Quand je devenais plus tranquille, toutes les forces de mon âme la fixaient à ma douleur.	0	669	16	0	0.0	[]	0.0	0.0	0.01736013494517852	0.0	0.040931542455649526
Montesquieu_Arsace	670	Il me sembla qu' il ne me restait plus rien dans le monde que ma tristesse et le nom d' Ardasire.	0	670	21	0	0.0	[]	0.019230769230769232	0.019230769230769232	0.01736013494517852	0.0	0.040931542455649526
Montesquieu_Arsace	671	Ce nom, je le prononçois d' une voix terrible, et je rentrois dans le silence.	0	671	15	1	0.0666666666666666	[['voix']]	0.0196078431372549	0.0196078431372549	0.01736013494517852	0.0	0.040931542455649526
Montesquieu_Arsace	672	Je résolus de m' ôter la vie et tout à coup j' entrai en fureur.	0	672	15	0	0.0	[]	0.05263157894736842	0.05263157894736842	0.01736013494517852	0.0	0.040931542455649526
Montesquieu_Arsace	673	Tu veux mourir, me disais-je à moi	0	673	8	1	0.125	[['mourir']]	0.03333333333333333	0.03333333333333333	0.01736013494517852	0.0	0.040931542455649526
Montesquieu_Arsace	674	-même, et Ardasire n' est pas vengée!	0	674	7	0	0.0	[]	0.0625	0.0625	0.01736013494517852	0.0	0.040931542455649526
Montesquieu_Arsace	675	Tu veux mourir, et le fils du tyran est en Hyrcanie, qui se baigne dans les délices!	0	675	17	1	0.0588235294117647	[['mourir']]	0.03333333333333333	0.03333333333333333	0.01736013494517852	0.0	0.040931542455649526
Montesquieu_Arsace	676	Il vit, et tu veux mourir!	0	676	6	0	0.0	[]	0.030303030303030304	0.030303030303030304	0.01736013494517852	0.0	0.040931542455649526
Montesquieu_Arsace	677	Je me suis mis en chemin pour l' aller chercher.	0	677	10	0	0.0	[]	0.0	0.0	0.01736013494517852	0.0	0.040931542455649526
Montesquieu_Arsace	678	J' aiappris qu' il vous avait déclaré la guerre;	0	678	9	0	0.0	[]	0.0	0.0	0.01736013494517852	0.0	0.040931542455649526
Montesquieu_Arsace	679	j' ai volé à vous.	0	679	5	0	0.0	[]	0.0	0.0	0.01736013494517852	0.0	0.040931542455649526
Montesquieu_Arsace	680	Je suis arrivé trois jours avant la bataille, et j' ai fait l' action que vous connaissez.	0	680	17	0	0.0	[]	0.0	0.0	0.01736013494517852	0.0	0.040931542455649526
Montesquieu_Arsace	681	J' aurais percé le fils du tyran;	0	681	7	0	0.0	[]	0.0	0.0	0.01736013494517852	0.0	0.040931542455649526
Montesquieu_Arsace	682	j' ai mieux aimé le faire prisonnier.	0	682	7	0	0.0	[]	0.0	0.0	0.01736013494517852	0.0	0.040931542455649526
