Montesquieu_Arsace	683	Je veux qu' il traîne dans la honte et dans les fers une vie aussi malheureuse que la mienne.	0	683	19	0	0.0	[]	0.023809523809523808	0.023809523809523808	0.01736013494517852	0.0	0.040931542455649526
Montesquieu_Arsace	684	J' espère que quelque jour il apprendra que j' aurai fait mourir le dernier des siens.	0	684	16	1	0.0625	[['mourir']]	0.0196078431372549	0.0196078431372549	0.01736013494517852	0.0	0.040931542455649526
Montesquieu_Arsace	685	J' avoue pourtant que, depuis que je suis vengé, je ne me trouve pas plus heureux;	0	685	16	0	0.0	[]	0.020833333333333332	0.020833333333333332	0.01736013494517852	0.0	0.040931542455649526
Montesquieu_Arsace	686	et je sens bien que l' espoir de la vengeance flatte plus que la vengeance même.	0	686	16	0	0.0	[]	0.0	0.0	0.01736013494517852	0.0	0.040931542455649526
Montesquieu_Arsace	687	Ma rage que j' ai satisfaite, l' action que vous avez vue, les acclamations du peuple, seigneur, votre amitié même, ne me rendent point ce que j' ai perdu.	0	687	29	0	0.0	[]	0.0	0.0	0.01736013494517852	0.0	0.040931542455649526
Montesquieu_Arsace	688	La surprise d' Aspar avait commencé presque avec le récit qu' il avait entendu.	0	688	14	0	0.0	[]	0.0	0.0	0.01736013494517852	0.0	0.040931542455649526
Montesquieu_Arsace	689	Sitôt qu' il avait ouï le nom d' Arsace, il avait reconnu le mari de la reine.	0	689	17	0	0.0	[]	0.0	0.0	0.01736013494517852	0.0	0.040931542455649526
Montesquieu_Arsace	690	Des raisons d' état l' avaient obligé d' envoyer chez les mèdes Isménie, la plus jeune des filles du dernier roi, et il l' y avait fait élever en secret sous le nom d' Ardasire.	0	690	35	0	0.0	[]	0.0	0.0	0.01736013494517852	0.0	0.040931542455649526
Montesquieu_Arsace	691	Il l' avait mariée à Arsace;	0	691	6	0	0.0	[]	0.0	0.0	0.01736013494517852	0.0	0.040931542455649526
Montesquieu_Arsace	692	il avait toujours eu des gens affidés dans le sérail d' Arsace;	0	692	12	0	0.0	[]	0.0	0.0	0.01736013494517852	0.0	0.040931542455649526
Montesquieu_Arsace	693	il était le génie qui, par ces mêmes gens, avait répandu tant de richesses dans la maison d' Arsace, et qui, par des voies très simples, avait fait imaginer tant de prodiges.	0	693	32	0	0.0	[]	0.01694915254237288	0.01694915254237288	0.01736013494517852	0.0	0.040931542455649526
Montesquieu_Arsace	694	Il avait eu de très grandes raisons pour cacher à Arsace la naissance d' Ardasire.	0	694	15	1	0.0666666666666666	[['grand']]	0.029411764705882353	0.029411764705882353	0.01736013494517852	0.0	0.040931542455649526
Montesquieu_Arsace	695	Arsace, qui avait beaucoup de courage, aurait pu faire valoir les droits de sa femme sur la Bactriane, et la troubler.	0	695	21	1	0.0476190476190476	[['droit']]	0.034482758620689655	0.034482758620689655	0.01736013494517852	0.0	0.040931542455649526
Montesquieu_Arsace	696	Mais ces raisons ne subsistaient plus, et, quand il entendit le récit d' Arsace, il eut mille fois envie de l' interrompre;	0	696	22	0	0.0	[]	0.017241379310344827	0.017241379310344827	0.01736013494517852	0.0	0.040931542455649526
Montesquieu_Arsace	697	mais il crut qu' il n' était pas encore temps de lui apprendre son sort.	0	697	15	0	0.0	[]	0.0	0.0	0.01736013494517852	0.0	0.040931542455649526
Montesquieu_Arsace	698	Un ministre accoutumé à arrêter ses mouvements revenait toujours à la prudence;	0	698	12	0	0.0	[]	0.025	0.025	0.01736013494517852	0.0	0.040931542455649526
Montesquieu_Arsace	699	il pensait à préparer un grand événement, et non pas à le hâter.	0	699	13	1	0.0769230769230769	[['grand']]	0.046511627906976744	0.046511627906976744	0.01736013494517852	0.0	0.040931542455649526
Montesquieu_Arsace	700	Deux jours après, le bruit se répandit que l' eunuque avait mis sur le trône une fausse Isménie.	0	700	18	1	0.0555555555555555	[['faux']]	0.05263157894736842	0.05263157894736842	0.01736013494517852	0.0	0.040931542455649526
Montesquieu_Arsace	701	On passa des murmures à la sédition.	0	701	7	0	0.0	[]	0.06451612903225806	0.06451612903225806	0.01736013494517852	0.0	0.040931542455649526
Montesquieu_Arsace	702	Le peuple furieux entoura le palais;	0	702	6	1	0.1666666666666666	[['furieux']]	0.13636363636363635	0.13636363636363635	0.01736013494517852	0.0	0.040931542455649526
Montesquieu_Arsace	703	il demanda à haute voix la tête d' Aspar.	0	703	9	2	0.2222222222222222	[['voix'], ['tête']]	0.09090909090909091	0.09090909090909091	0.01736013494517852	0.0	0.040931542455649526
Montesquieu_Arsace	704	L' eunuque fit ouvrir une des portes, et, monté sur un éléphant, il s' avança dans la foule.	0	704	18	0	0.0	[]	0.0625	0.0625	0.01736013494517852	0.0	0.040931542455649526
Montesquieu_Arsace	705	Bactriens, dit-il, écoutez-moi.	0	705	5	0	0.0	[]	0.0	0.0	0.01736013494517852	0.0	0.040931542455649526
Montesquieu_Arsace	706	Et, comme on murmurait encore: écoutez-moi, vous dis-je.	0	706	10	0	0.0	[]	0.058823529411764705	0.058823529411764705	0.01736013494517852	0.0	0.040931542455649526
Montesquieu_Arsace	707	Si vous pouvez me faire mourir à présent,vous pourrez dans un moment me faire, mourir tout de même.	0	707	19	2	0.1052631578947368	[['mourir'], ['mourir']]	0.06666666666666667	0.06666666666666667	0.01736013494517852	0.0	0.040931542455649526
Montesquieu_Arsace	708	Voici un papier écrit et scellé de la main du feu roi: prosternez-vous, adorez-le;	0	708	16	1	0.0625	[['main']]	0.07692307692307693	0.07692307692307693	0.01736013494517852	0.0	0.040931542455649526
Montesquieu_Arsace	709	je vais le lire.	0	709	4	0	0.0	[]	0.045454545454545456	0.045454545454545456	0.01736013494517852	0.0	0.040931542455649526
Montesquieu_Arsace	710	"Il le lut: "" le ciel m' a donné deux filles qui se ressemblent au point que tous les yeux peuvent s' y tromper."	0	710	24	1	0.0416666666666666	[['oeil']]	0.043478260869565216	0.043478260869565216	0.01736013494517852	0.0	0.040931542455649526
Montesquieu_Arsace	711	Je crains que cela ne donne occasion à de plus grands troubles et à des guerres plus funestes.	0	711	18	1	0.0555555555555555	[['grand']]	0.03636363636363636	0.03636363636363636	0.01736013494517852	0.0	0.040931542455649526
Montesquieu_Arsace	712	Vous donc, Aspar, lumière de l' empire, prenez la plus jeune des deux;	0	712	13	0	0.0	[]	0.023809523809523808	0.023809523809523808	0.01736013494517852	0.0	0.040931542455649526
Montesquieu_Arsace	713	envoyez-la secrètement dans la Médie, et faites-en prendre soin.	0	713	11	0	0.0	[]	0.0	0.0	0.01736013494517852	0.0	0.040931542455649526
Montesquieu_Arsace	714	Qu' elle y reste sous un nom supposé, tant que le bien de l' état le demandera.	0	714	17	0	0.0	[]	0.025	0.025	0.01736013494517852	0.0	0.040931542455649526
Montesquieu_Arsace	715	""" il porta cet écrit au-dessus de sa tête, et il s' inclina;"	0	715	12	1	0.0833333333333333	[['tête']]	0.02702702702702703	0.02702702702702703	0.01736013494517852	0.0	0.040931542455649526
Montesquieu_Arsace	716	"puis, reprenant la parole: "" Isménie est morte;"	0	716	8	0	0.0	[]	0.041666666666666664	0.041666666666666664	0.01736013494517852	0.0	0.040931542455649526
Montesquieu_Arsace	717	n' en doutez pas;	0	717	4	0	0.0	[]	0.0	0.0	0.01736013494517852	0.0	0.040931542455649526
Montesquieu_Arsace	718	mais sa sœur, la jeune Isménie, est sur le trône.	0	718	10	0	0.0	[]	0.0	0.0	0.01736013494517852	0.0	0.040931542455649526
Montesquieu_Arsace	719	Voudriez-vous vous plaindre de ce que, voyant la mort de la reine approcher, j' ai fait venir sa sœur du fond de l' Asie?	0	719	25	0	0.0	[]	0.0	0.0	0.01736013494517852	0.0	0.040931542455649526
Montesquieu_Arsace	720	Me reprocheriez-vous d' avoir été assez heureux	0	720	8	0	0.0	[]	0.0	0.0	0.01736013494517852	0.0	0.040931542455649526
Montesquieu_Arsace	721	pour vous la rendre et la placer sur un trône qui, depuis la mort de la reine sa sœur, lui appartient?	0	721	21	0	0.0	[]	0.0	0.0	0.01736013494517852	0.0	0.040931542455649526
Montesquieu_Arsace	722	Si j' ai tu la mort de la reine, l' état des affaires ne l' a-t-il pas demandé?	0	722	20	0	0.0	[]	0.0	0.0	0.01736013494517852	0.0	0.040931542455649526
Montesquieu_Arsace	723	Me blâmez-vous d' avoir fait une action de fidélité avec prudence?	0	723	12	0	0.0	[]	0.0	0.0	0.01736013494517852	0.0	0.040931542455649526
Montesquieu_Arsace	724	Posez donc les armes.	0	724	4	0	0.0	[]	0.0	0.0	0.01736013494517852	0.0	0.040931542455649526
Montesquieu_Arsace	725	Jusqu' ici vous n' êtes point coupables;	0	725	7	0	0.0	[]	0.0	0.0	0.01736013494517852	0.0	0.040931542455649526
Montesquieu_Arsace	726	dès ce moment vous le seriez.	0	726	6	0	0.0	[]	0.037037037037037035	0.037037037037037035	0.01736013494517852	0.0	0.040931542455649526
Montesquieu_Arsace	727	""" Aspar expliqua ensuite comment il avait confié la jeune Isménie à deux vieux eunuques;"	0	727	14	1	0.0714285714285714	[['vieux']]	0.03225806451612903	0.03225806451612903	0.01736013494517852	0.0	0.040931542455649526
Montesquieu_Arsace	728	comment on l' avait transportée en Médie sous un nom supposé;	0	728	11	0	0.0	[]	0.05555555555555555	0.05555555555555555	0.01736013494517852	0.0	0.040931542455649526
Montesquieu_Arsace	729	comment il l' avait mariée à un grand seigneur du pays;	0	729	11	1	0.0909090909090909	[['grand']]	0.02631578947368421	0.02631578947368421	0.01736013494517852	0.0	0.040931542455649526
Montesquieu_Arsace	730	comment il l' avait fait suivre dans tous les lieux où la fortune l' avait conduite;	0	730	16	0	0.0	[]	0.020833333333333332	0.020833333333333332	0.01736013494517852	0.0	0.040931542455649526
Montesquieu_Arsace	731	comment la maladie de la reine l' avait déterminé à la faire enlever pour être gardée en secret dans le sérail;	0	731	21	0	0.0	[]	0.0	0.0	0.01736013494517852	0.0	0.040931542455649526
Montesquieu_Arsace	732	comment, après la mort de la reine, il l' avait placée sur le trône.	0	732	14	0	0.0	[]	0.0	0.0	0.01736013494517852	0.0	0.040931542455649526
Montesquieu_Arsace	733	Comme les flots de la mer agitée s' apaisent par les zéphyrs, le peuple se calma par les paroles d' Aspar.	0	733	21	0	0.0	[]	0.0	0.0	0.01736013494517852	0.0	0.040931542455649526
Montesquieu_Arsace	734	On n' entendit plus que des acclamations de joie;	0	734	9	0	0.0	[]	0.0	0.0	0.01736013494517852	0.0	0.040931542455649526
Montesquieu_Arsace	735	tous les temples retentirent du nom de la jeune Isménie.	0	735	10	0	0.0	[]	0.02702702702702703	0.02702702702702703	0.01736013494517852	0.0	0.040931542455649526
Montesquieu_Arsace	736	Aspar inspira à Isménie de voir l' étranger qui avait rendu un si grand service à la Bactriane;	0	736	18	1	0.0555555555555555	[['grand']]	0.02702702702702703	0.02702702702702703	0.01736013494517852	0.0	0.040931542455649526
Montesquieu_Arsace	737	il lui inspira de lui donner une audience éclatante.	0	737	9	0	0.0	[]	0.03571428571428571	0.03571428571428571	0.01736013494517852	0.0	0.040931542455649526
Montesquieu_Arsace	738	Il fut résolu que les grands et les peuples seraient assemblés; que là il serait déclaré général des armées de l' état, et que la reine luiceindroit l' épée.	0	738	29	1	0.0344827586206896	[['grand']]	0.03225806451612903	0.03225806451612903	0.01736013494517852	0.0	0.040931542455649526
Montesquieu_Arsace	739	Les principaux de la nation étaient rangés autour d' une grande salle, et une foule de peuple en occupait le milieu et l' entrée.	0	739	24	1	0.0416666666666666	[['grand']]	0.03125	0.03125	0.01736013494517852	0.0	0.040931542455649526
Montesquieu_Arsace	740	La reine était sur son trône, vêtue d' un habit superbe.	0	740	11	0	0.0	[]	0.047619047619047616	0.047619047619047616	0.01736013494517852	0.0	0.040931542455649526
Montesquieu_Arsace	741	Elle avait la tête couverte de pierreries;	0	741	7	1	0.1428571428571428	[['tête']]	0.05128205128205128	0.05128205128205128	0.01736013494517852	0.0	0.040931542455649526
Montesquieu_Arsace	742	elle avait, selon l' usage de ces solennités, levé son voile, et l' on voyait le visage de la beauté même.	0	742	21	1	0.0476190476190476	[['visage']]	0.05555555555555555	0.05555555555555555	0.01736013494517852	0.0	0.040931542455649526
Montesquieu_Arsace	743	Arsace parut, et le peuple commença ses acclamations.	0	743	8	0	0.0	[]	0.06172839506172839	0.06172839506172839	0.01736013494517852	0.0	0.040931542455649526
Montesquieu_Arsace	744	Arsace, les yeux baissés par respect, resta un moment dans le silence, et, adressant la parole à la reine: madame, lui dit-il d' une voix basse et entrecoupée, si quelque chose pouvait rendre à mon âme quelque tranquillité, et me consoler de mes malheurs... la reine ne le laissa pas achever;	0	744	52	4	0.0769230769230769	[['oeil'], ['voix'], ['bas'], ['consoler']]	0.08108108108108109	0.08108108108108109	0.01736013494517852	0.0	0.040931542455649526
Montesquieu_Arsace	745	elle crut d' abord reconnaître le visage, elle reconnut encore la voix d' Arsace.	0	745	14	2	0.1428571428571428	[['visage'], ['voix']]	0.07954545454545454	0.07954545454545454	0.01736013494517852	0.0	0.040931542455649526
Montesquieu_Arsace	746	Toute hors d' elle-même, et ne se connaissant plus, elle se précipita de son trône, et se jeta aux genoux d' Arsace.	0	746	22	1	0.0454545454545454	[['genou']]	0.08	0.08	0.01736013494517852	0.0	0.040931542455649526
Montesquieu_Arsace	747	Mes malheurs ont été plus grands que les tiens, dit-elle, mon cher Arsace.	0	747	14	1	0.0714285714285714	[['grand']]	0.05405405405405406	0.05405405405405406	0.01736013494517852	0.0	0.040931542455649526
Montesquieu_Arsace	748	Hélas!	0	748	1	0	0.0	[]	0.034482758620689655	0.034482758620689655	0.01736013494517852	0.0	0.040931542455649526
Montesquieu_Arsace	749	Je croyais ne te revoir jamais depuis le fatal moment qui nous a séparés.	0	749	14	0	0.0	[]	0.0	0.0	0.01736013494517852	0.0	0.040931542455649526
Montesquieu_Arsace	750	Mes douleurs ont été mortelles.	0	750	5	0	0.0	[]	0.014285714285714285	0.014285714285714285	0.01736013494517852	0.0	0.040931542455649526
Montesquieu_Arsace	751	Et, comme si elle avait passé tout à coup d' une manière d' aimer à une autre manière d' aimer, ou qu' elle se trouvât incertaine sur l' impétuosité de l' action qu' elle venait de faire, elle se releva tout à coup, et une rougeur modeste parut sur son visage.	0	751	51	1	0.0196078431372549	[['relever']]	0.028169014084507043	0.028169014084507043	0.01736013494517852	0.0	0.040931542455649526
Montesquieu_Arsace	752	Bactriens, dit-elle, c' est aux genoux de mon époux que vous m' avez vue.	0	752	15	1	0.0666666666666666	[['genou']]	0.02531645569620253	0.02531645569620253	0.01736013494517852	0.0	0.040931542455649526
Montesquieu_Arsace	753	C' est ma félicité d' avoir pu faire paraître devant vous mon amour.	0	753	13	0	0.0	[]	0.017857142857142856	0.017857142857142856	0.01736013494517852	0.0	0.040931542455649526
Montesquieu_Arsace	754	J' ai descendu de mon trône, parce que je n' y étais pas avec lui, et j' atteste les dieux que je n' y remonterai pas sans lui.	0	754	28	0	0.0	[]	0.017543859649122806	0.017543859649122806	0.01736013494517852	0.0	0.040931542455649526
Montesquieu_Arsace	755	Je goûte ce plaisir que la plus belle action de mon règne, c' est par lui	0	755	16	1	0.0625	[['bel']]	0.016666666666666666	0.016666666666666666	0.01736013494517852	0.0	0.040931542455649526
Montesquieu_Arsace	756	qu' elle a été faite, et que c' est pour moi qu' il l' a faite.	0	756	16	0	0.0	[]	0.02	0.02	0.01736013494517852	0.0	0.040931542455649526
Montesquieu_Arsace	757	Grands, peuples et citoyens, croyez-vous que celui qui règne sur moi soit digne de régner sur vous?	0	757	18	0	0.0	[]	0.0	0.0	0.01736013494517852	0.0	0.040931542455649526
Montesquieu_Arsace	758	Approuvez-vous mon choix? élisez-vous Arsace?	0	758	7	0	0.0	[]	0.0	0.0	0.01736013494517852	0.0	0.040931542455649526
Montesquieu_Arsace	759	Dites-le-moi, parlez.	0	759	2	0	0.0	[]	0.0	0.0	0.01736013494517852	0.0	0.040931542455649526
Montesquieu_Arsace	760	à peine les dernières paroles de la reine furent-elles entendues, tout le palais retentit d' acclamations;	0	760	17	0	0.0	[]	0.0	0.0	0.01736013494517852	0.0	0.040931542455649526
Montesquieu_Arsace	761	on n' entendit plus que le nom d' Arsace et celui d' Isménie.	0	761	13	0	0.0	[]	0.02631578947368421	0.02631578947368421	0.01736013494517852	0.0	0.040931542455649526
Montesquieu_Arsace	762	Pendant tout ce temps, Arsace était comme stupide.	0	762	8	1	0.125	[['pendant']]	0.07142857142857142	0.07142857142857142	0.01736013494517852	0.0	0.040931542455649526
Montesquieu_Arsace	763	Il voulut parler, sa voix s' arrêta;	0	763	7	1	0.1428571428571428	[['voix']]	0.08333333333333333	0.08333333333333333	0.01736013494517852	0.0	0.040931542455649526
Montesquieu_Arsace	764	il voulut se mouvoir,et il resta sans action.	0	764	9	0	0.0	[]	0.045454545454545456	0.045454545454545456	0.01736013494517852	0.0	0.040931542455649526
Montesquieu_Arsace	765	Il ne voyait pas la reine;	0	765	6	0	0.0	[]	0.0	0.0	0.01736013494517852	0.0	0.040931542455649526
Montesquieu_Arsace	766	il ne voyait pas le peuple;	0	766	6	0	0.0	[]	0.0	0.0	0.01736013494517852	0.0	0.040931542455649526
Montesquieu_Arsace	767	à peine entendait-il les acclamations: la joie le troublait tellement, que son âme ne put sentir toute sa félicité.	0	767	20	0	0.0	[]	0.045454545454545456	0.045454545454545456	0.01736013494517852	0.0	0.040931542455649526
Montesquieu_Arsace	768	Mais, quand Aspar eut fait retirer le peuple, Arsace pencha la tête sur la main de la reine.	0	768	18	2	0.1111111111111111	[['tête'], ['main']]	0.04878048780487805	0.04878048780487805	0.01736013494517852	0.0	0.040931542455649526
Montesquieu_Arsace	769	Ardasire, vous vivez!	0	769	3	0	0.0	[]	0.07692307692307693	0.07692307692307693	0.01736013494517852	0.0	0.040931542455649526
Montesquieu_Arsace	770	Vous vivez, ma chère Ardasire!	0	770	5	0	0.0	[]	0.06666666666666667	0.06666666666666667	0.01736013494517852	0.0	0.040931542455649526
Montesquieu_Arsace	771	Je mourais tous les jours de douleur.	0	771	7	1	0.1428571428571428	[['mourir']]	0.045454545454545456	0.045454545454545456	0.01736013494517852	0.0	0.040931542455649526
Montesquieu_Arsace	772	Comment les dieux vous ont-ils rendue à la vie?	0	772	10	0	0.0	[]	0.02857142857142857	0.02857142857142857	0.01736013494517852	0.0	0.040931542455649526
Montesquieu_Arsace	773	Elle se hâta de lui raconter comment une de ses femmes avait substitué au poison une liqueur enivrante.	0	773	18	0	0.0	[]	0.0	0.0	0.01736013494517852	0.0	0.040931542455649526
Montesquieu_Arsace	774	Elle avait été trois jours sans mouvement;	0	774	7	0	0.0	[]	0.0	0.0	0.01736013494517852	0.0	0.040931542455649526
Montesquieu_Arsace	775	on l' avait rendue à la vie: sa première parole avait été le nom d' Arsace;	0	775	16	0	0.0	[]	0.030303030303030304	0.030303030303030304	0.01736013494517852	0.0	0.040931542455649526
Montesquieu_Arsace	776	ses yeux ne s' étaient ouverts que pour le voir;	0	776	10	1	0.1	[['oeil']]	0.03225806451612903	0.03225806451612903	0.01736013494517852	0.0	0.040931542455649526
Montesquieu_Arsace	777	elle l' avait fait chercher;	0	777	5	0	0.0	[]	0.05	0.05	0.01736013494517852	0.0	0.040931542455649526
Montesquieu_Arsace	778	elle l' avait cherché elle-même.	0	778	5	0	0.0	[]	0.0	0.0	0.01736013494517852	0.0	0.040931542455649526
Montesquieu_Arsace	779	Aspar l' avait fait enlever, et, après la mort de sa sœur, il l' avait placée sur le trône.	0	779	19	0	0.0	[]	0.0	0.0	0.01736013494517852	0.0	0.040931542455649526
Montesquieu_Arsace	780	Aspar avait rendu éclatante l' entrevue d' Arsace et d' Isménie.	0	780	11	0	0.0	[]	0.0	0.0	0.01736013494517852	0.0	0.040931542455649526
Montesquieu_Arsace	781	Il se ressouvenoit de la dernière sédition.	0	781	7	0	0.0	[]	0.0	0.0	0.01736013494517852	0.0	0.040931542455649526
Montesquieu_Arsace	782	Il croyait qu' après avoir pris sur lui de mettre Isménie sur le trône, il n' était pas à propos qu' il parût encore avoir contribué à y placer Arsace.	0	782	30	0	0.0	[]	0.015625	0.015625	0.01736013494517852	0.0	0.040931542455649526
Montesquieu_Arsace	783	Il avait pour maxime de ne faire jamais lui-même ce que les autres pouvaient faire, et d' aimer le bien, de quelque main qu' il pût venir.	0	783	27	1	0.037037037037037	[['main']]	0.01282051282051282	0.01282051282051282	0.01736013494517852	0.0	0.040931542455649526
Montesquieu_Arsace	784	D' ailleurs, connaissant la beauté du caractère d' Arsace et d' Isménie, il désirait de les faire paraître dans leur jour.	0	784	21	0	0.0	[]	0.02857142857142857	0.02857142857142857	0.01736013494517852	0.0	0.040931542455649526
Montesquieu_Arsace	785	Il voulait leur concilier ce respect que s' attirent toujours les grandes âmes dans toutes les occasions où elles peuvent se montrer.	0	785	22	1	0.0454545454545454	[['grand']]	0.03225806451612903	0.03225806451612903	0.01736013494517852	0.0	0.040931542455649526
Montesquieu_Arsace	786	Il cherchait à leur attirer cet amour que l' on porte à ceux qui ont éprouvé de grands malheurs.	0	786	19	1	0.0526315789473684	[['grand']]	0.04838709677419355	0.04838709677419355	0.01736013494517852	0.0	0.040931542455649526
Montesquieu_Arsace	787	Il voulait faire naître cette admiration que l' on a pour tous ceux qui sont capables de sentir les belles passions.	0	787	21	1	0.0476190476190476	[['beau']]	0.02666666666666667	0.02666666666666667	0.01736013494517852	0.0	0.040931542455649526
Montesquieu_Arsace	788	Enfin il croyait que rien n' était plus propre à faire perdre à Arsace le titre d' étranger, et à lui faire trouver celui de bactrien dans tous les cœurs des peuples de la Bactriane.	0	788	35	0	0.0	[]	0.015384615384615385	0.015384615384615385	0.01736013494517852	0.0	0.040931542455649526
Montesquieu_Arsace	789	Arsace jouissait d' un bonheur qui lui paraissait inconcevable.	0	789	9	0	0.0	[]	0.0	0.0	0.01736013494517852	0.0	0.040931542455649526
Montesquieu_Arsace	790	Ardasire, qu' il croyait morte, lui était rendue;	0	790	8	0	0.0	[]	0.0	0.0	0.01736013494517852	0.0	0.040931542455649526
Montesquieu_Arsace	791	Ardasire était Isménie;	0	791	3	0	0.0	[]	0.0	0.0	0.01736013494517852	0.0	0.040931542455649526
Montesquieu_Arsace	792	Ardasire était reine de Bactriane;	0	792	5	0	0.0	[]	0.0	0.0	0.01736013494517852	0.0	0.040931542455649526
Montesquieu_Arsace	793	Ardasire l' en avait fait roi.	0	793	6	0	0.0	[]	0.0	0.0	0.01736013494517852	0.0	0.040931542455649526
Montesquieu_Arsace	794	Il passait du sentiment de sa grandeur au sentiment de son amour.	0	794	12	0	0.0	[]	0.01818181818181818	0.01818181818181818	0.01736013494517852	0.0	0.040931542455649526
Montesquieu_Arsace	795	Il aimait ce diadème qui, bien loin d' être un signe d' indépendance, l' avertissait sans cesse qu' il était à elle; ilaimoit ce trône, parce qu' il voyait la main qui l' y avait fait monter.	0	795	37	1	0.027027027027027	[['main']]	0.03076923076923077	0.03076923076923077	0.01736013494517852	0.0	0.040931542455649526
Montesquieu_Arsace	796	Isménie goûtat, pour la première fois, le plaisir de voir qu' elle était une grande reine.	0	796	16	1	0.0625	[['grand']]	0.036585365853658534	0.036585365853658534	0.01736013494517852	0.0	0.040931542455649526
Montesquieu_Arsace	797	Avant l' arrivée d' Arsace, elle avait une grande fortune, mais il lui manquait un cœur capable de la sentir: au milieu de sa cour, elle se trouvait seule;	0	797	29	1	0.0344827586206896	[['grand']]	0.05172413793103448	0.05172413793103448	0.01736013494517852	0.0	0.040931542455649526
Montesquieu_Arsace	798	dix millions d' hommes étaient à ses pieds, et elle se croyait abandonnée.	0	798	13	1	0.0769230769230769	[['pied']]	0.0392156862745098	0.0392156862745098	0.01736013494517852	0.0	0.040931542455649526
Montesquieu_Arsace	799	Arsace fit d' abord venir le prince d' Hyrcanie.	0	799	9	0	0.0	[]	0.02631578947368421	0.02631578947368421	0.01736013494517852	0.0	0.040931542455649526
Montesquieu_Arsace	800	Vous avez, lui dit-il, paru devant moi, et les fers ont tombé de vos mains;	0	800	16	0	0.0	[]	0.0	0.0	0.01736013494517852	0.0	0.040931542455649526
Montesquieu_Arsace	801	il ne faut point qu' il y ait d' infortuné dans l' empire du plus heureux des mortels.	0	801	18	0	0.0	[]	0.0	0.0	0.01736013494517852	0.0	0.040931542455649526
Montesquieu_Arsace	802	Quoique	0	802	1	0	0.0	[]	0.0	0.0	0.01736013494517852	0.0	0.040931542455649526
Montesquieu_Arsace	803	je vous aie vaincu	0	803	4	0	0.0	[]	0.0	0.0	0.01736013494517852	0.0	0.040931542455649526
Montesquieu_Arsace	804	, je ne crois pas que vous m' ayez cédé en courage;	0	804	11	0	0.0	[]	0.0	0.0	0.01736013494517852	0.0	0.040931542455649526
Montesquieu_Arsace	805	je vous prie de consentir que vous me cédiez en générosité.	0	805	11	0	0.0	[]	0.023255813953488372	0.023255813953488372	0.01736013494517852	0.0	0.040931542455649526
Montesquieu_Arsace	806	Le caractère de la reine était la douceur, et sa fierté naturelle disparoissait toujours toutes les fois qu' elle devait disparaitre.	0	806	21	1	0.0476190476190476	[['naturel']]	0.018518518518518517	0.018518518518518517	0.01736013494517852	0.0	0.040931542455649526
Montesquieu_Arsace	807	Pardonnez-moi, dit-elle au prince d' Hyrcanie, si je n' ai pas répondu à des feux qui n' étaient pas légitimes.	0	807	22	0	0.0	[]	0.018867924528301886	0.018867924528301886	0.01736013494517852	0.0	0.040931542455649526
Montesquieu_Arsace	808	L' épouse d' Arsace ne pouvait pas être la vôtre;	0	808	10	0	0.0	[]	0.0	0.0	0.01736013494517852	0.0	0.040931542455649526
Montesquieu_Arsace	809	vous ne devez vous plaindre que du destin.	0	809	8	0	0.0	[]	0.0	0.0	0.01736013494517852	0.0	0.040931542455649526
Montesquieu_Arsace	810	Si l' Hyrcanie et la Bactriane ne forment pas un même empire, ce sont des états faits pour être alliés.	0	810	20	0	0.0	[]	0.0	0.0	0.01736013494517852	0.0	0.040931542455649526
Montesquieu_Arsace	811	Isménie peut promettre de l' amitié, si elle n' a pu promettre de l' amour.	0	811	15	0	0.0	[]	0.0	0.0	0.01736013494517852	0.0	0.040931542455649526
