Riccoboni_LettresFanni	612	un moment de délire ne m' a point mise dans ses bras: je me suis donnée;	58	9	16	1	0.0625	[['bras']]	0.023809523809523808	0.023809523809523808	0.014367816091954023	0.0	0.04148748829311298
Riccoboni_LettresFanni	613	mes saveurs sont le fruit de l' amour, sont le prix de l' amour.	58	10	14	0	0.0	[]	0.02702702702702703	0.02702702702702703	0.014367816091954023	0.0	0.04148748829311298
Riccoboni_LettresFanni	614	Oui, mon cher Alfred, je suis contente.	58	11	7	0	0.0	[]	0.0	0.0	0.014367816091954023	0.0	0.04148748829311298
Riccoboni_LettresFanni	615	Puis-je ne pas l' être, quand je suis àtoi?	58	12	10	0	0.0	[]	0.0	0.0	0.014367816091954023	0.0	0.04148748829311298
Riccoboni_LettresFanni	616	Oui, toute à toi?	58	13	4	0	0.0	[]	0.025	0.025	0.014367816091954023	0.0	0.04148748829311298
Riccoboni_LettresFanni	617	Momens délicieux, plaisir ravissant, redoublez la tendresse de mon amant, comme vous augmentez la mienne! ... il m' écrit dans l' instant où j' écris moi	58	14	26	1	0.0384615384615384	[['délicieux']]	0.03333333333333333	0.03333333333333333	0.014367816091954023	0.0	0.04148748829311298
Riccoboni_LettresFanni	618	-	58	15	0	0	0.0	[]	0.037037037037037035	0.037037037037037035	0.014367816091954023	0.0	0.04148748829311298
Riccoboni_LettresFanni	619	même	58	16	1	0	0.0	[]	0.0	0.0	0.014367816091954023	0.0	0.04148748829311298
Riccoboni_LettresFanni	620	... ah!	58	17	1	0	0.0	[]	0.0	0.0	0.014367816091954023	0.0	0.04148748829311298
Riccoboni_LettresFanni	621	Prends garde, prends garde, mon cher Alfred, le bonheur ou le malheur de ma vie est dans tes mains!	58	18	19	0	0.0	[]	0.0	0.0	0.014367816091954023	0.0	0.04148748829311298
Riccoboni_LettresFanni	622	Cette lettre que j' attends va détruire ou confirmer ma joie... mon dieu!	58	19	13	0	0.0	[]	0.0	0.0	0.014367816091954023	0.0	0.04148748829311298
Riccoboni_LettresFanni	623	Si un peu moins de vivacité dans votre style... S' il vous échappait...	58	20	13	0	0.0	[]	0.0	0.0	0.014367816091954023	0.0	0.04148748829311298
Riccoboni_LettresFanni	624	Si un seul mot me faisait craindre... non, je ne crains rien, je suis aimée...	58	21	15	0	0.0	[]	0.0	0.0	0.014367816091954023	0.0	0.04148748829311298
Riccoboni_LettresFanni	625	je ne vous verrai point demain: quoi!	58	22	7	0	0.0	[]	0.0	0.0	0.014367816091954023	0.0	0.04148748829311298
Riccoboni_LettresFanni	626	Je ne vous verrai point?	58	23	5	0	0.0	[]	0.0	0.0	0.014367816091954023	0.0	0.04148748829311298
Riccoboni_LettresFanni	627	Penserez-vous à moi?	58	24	4	0	0.0	[]	0.07142857142857142	0.07142857142857142	0.014367816091954023	0.0	0.04148748829311298
Riccoboni_LettresFanni	628	Sentirez-vous cette petite absence?	58	25	5	1	0.2	[['petit']]	0.06666666666666667	0.06666666666666667	0.014367816091954023	0.0	0.04148748829311298
Riccoboni_LettresFanni	629	Viendrez-vous de bonne heure vendredi?	58	26	6	0	0.0	[]	0.08333333333333333	0.08333333333333333	0.014367816091954023	0.0	0.04148748829311298
Riccoboni_LettresFanni	630	... hélas!	58	27	1	0	0.0	[]	0.0	0.0	0.014367816091954023	0.0	0.04148748829311298
Riccoboni_LettresFanni	631	Ces jours heureux passent avec rapidité;	58	28	6	0	0.0	[]	0.0	0.0	0.014367816091954023	0.0	0.04148748829311298
Riccoboni_LettresFanni	632	ils me conduisent à celui qui va me priver de vous, qui va m' enlever mon bien le plus cher!	58	29	20	0	0.0	[]	0.029411764705882353	0.029411764705882353	0.014367816091954023	0.0	0.04148748829311298
Riccoboni_LettresFanni	633	Ah, les vilains révoltés, que je les hais!	58	30	8	1	0.125	[['vilain']]	0.027777777777777776	0.027777777777777776	0.014367816091954023	0.0	0.04148748829311298
Riccoboni_LettresFanni	634	Faut-il que vous me quittiez pour eux?	58	31	8	0	0.0	[]	0.03333333333333333	0.03333333333333333	0.014367816091954023	0.0	0.04148748829311298
Riccoboni_LettresFanni	635	Ils méritent bien d' être punis, puisqu' ils vous font aller dans votre gouvernement.	58	32	14	0	0.0	[]	0.0	0.0	0.014367816091954023	0.0	0.04148748829311298
Riccoboni_LettresFanni	636	Adieu, mon aimable, mon cher Alfred.	58	33	6	0	0.0	[]	0.0	0.0	0.014367816091954023	0.0	0.04148748829311298
Riccoboni_LettresFanni	637	Lettre 31.	58	34	2	0	0.0	[]	0.0	0.0	0.014367816091954023	0.0	0.04148748829311298
Riccoboni_LettresFanni	638	jeudi à minuit.	59	0	3	0	0.0	[]	0.0	0.0	0.0	0.0	0.0
Riccoboni_LettresFanni	639	oh!	60	0	1	0	0.0	[]	0.0	0.0	0.005291005291005291	0.0	0.009720197391996735
Riccoboni_LettresFanni	640	Qui peut rendre, qui peut exprimer le plaisir que m' a fait cette visite!	60	1	14	0	0.0	[]	0.0	0.0	0.005291005291005291	0.0	0.009720197391996735
Riccoboni_LettresFanni	641	Aimable garçon!	60	2	2	0	0.0	[]	0.0	0.0	0.005291005291005291	0.0	0.009720197391996735
Riccoboni_LettresFanni	642	Le voir entrer dans ma chambre, quand je le crois à Hamptoncourt;	60	3	12	0	0.0	[]	0.0	0.0	0.005291005291005291	0.0	0.009720197391996735
Riccoboni_LettresFanni	643	prendre une heure pour me la donner;	60	4	7	0	0.0	[]	0.0	0.0	0.005291005291005291	0.0	0.009720197391996735
Riccoboni_LettresFanni	644	que cette attention est charmante!	60	5	5	0	0.0	[]	0.0	0.0	0.005291005291005291	0.0	0.009720197391996735
Riccoboni_LettresFanni	645	Mon dieu, qu' il était bien!	60	6	6	0	0.0	[]	0.0	0.0	0.005291005291005291	0.0	0.009720197391996735
Riccoboni_LettresFanni	646	Que cet habit lui sied!	60	7	5	0	0.0	[]	0.0	0.0	0.005291005291005291	0.0	0.009720197391996735
Riccoboni_LettresFanni	647	Que de goût dans sa parure!	60	8	6	0	0.0	[]	0.0	0.0	0.005291005291005291	0.0	0.009720197391996735
Riccoboni_LettresFanni	648	Que de grâce dans son air!	60	9	6	0	0.0	[]	0.0	0.0	0.005291005291005291	0.0	0.009720197391996735
Riccoboni_LettresFanni	649	Regardez	60	10	1	0	0.0	[]	0.0	0.0	0.005291005291005291	0.0	0.009720197391996735
Riccoboni_LettresFanni	650	-	60	11	0	0	0.0	[]	0.0	0.0	0.005291005291005291	0.0	0.009720197391996735
Riccoboni_LettresFanni	651	le, princesse, regardez-le bien;	60	12	5	0	0.0	[]	0.0	0.0	0.005291005291005291	0.0	0.009720197391996735
Riccoboni_LettresFanni	652	enviez mon bonheur, mais ne m' en privez pas;	60	13	9	0	0.0	[]	0.0	0.0	0.005291005291005291	0.0	0.009720197391996735
Riccoboni_LettresFanni	653	il est à moi, il a juré d' être toujours à moi.	60	14	12	0	0.0	[]	0.023809523809523808	0.023809523809523808	0.005291005291005291	0.0	0.009720197391996735
Riccoboni_LettresFanni	654	Mon sort est plus heureux, mille fois plus heureux que le vôtre... ma chère petite lettre, que je vous lise encore.	60	15	21	1	0.0476190476190476	[['petit']]	0.02702702702702703	0.02702702702702703	0.005291005291005291	0.0	0.009720197391996735
Riccoboni_LettresFanni	655	Qu' elle est tendre!	60	16	4	0	0.0	[]	0.034482758620689655	0.034482758620689655	0.005291005291005291	0.0	0.009720197391996735
Riccoboni_LettresFanni	656	Qu' elle est folle!	60	17	4	0	0.0	[]	0.0	0.0	0.005291005291005291	0.0	0.009720197391996735
Riccoboni_LettresFanni	657	Que je me fais bon gré de la mériter!	60	18	9	0	0.0	[]	0.0	0.0	0.005291005291005291	0.0	0.009720197391996735
Riccoboni_LettresFanni	658	Qu' elle assure ma joie! ... mais parlerai-je toujours de ma félicité?	60	19	13	0	0.0	[]	0.0	0.0	0.005291005291005291	0.0	0.009720197391996735
Riccoboni_LettresFanni	659	Je vous ennuierai, mon cher Alfred: mais n' est-ce point à vous que je dois les mouvement de cette joie?	60	20	21	0	0.0	[]	0.0	0.0	0.005291005291005291	0.0	0.009720197391996735
Riccoboni_LettresFanni	660	C' est un ruisseau qui retourne vers sa source.	60	21	9	0	0.0	[]	0.0	0.0	0.005291005291005291	0.0	0.009720197391996735
Riccoboni_LettresFanni	661	Eh!	60	22	1	0	0.0	[]	0.0	0.0	0.005291005291005291	0.0	0.009720197391996735
Riccoboni_LettresFanni	662	Comment vous lasseriez-vous de mon bonheur, vous qui le faites, vous qui m' aimez?Lettre 32.	60	23	16	0	0.0	[]	0.0	0.0	0.005291005291005291	0.0	0.009720197391996735
Riccoboni_LettresFanni	663	vendredi.	61	0	1	0	0.0	[]	0.0	0.0	0.0	0.0	0.0
Riccoboni_LettresFanni	664	êtes-vous revenu, mon cher Alfred?	62	0	6	0	0.0	[]	0.0	0.0	0.0	0.0	0.0
Riccoboni_LettresFanni	665	Vous êtes-vous souvenu de votre chère maîtresse?	62	1	8	0	0.0	[]	0.0	0.0	0.0	0.0	0.0
Riccoboni_LettresFanni	666	Son idée vous a-t-elle été présente, dans un séjour où l' orgueil et l' intérêt ont établi leur domicile?	62	2	21	0	0.0	[]	0.0	0.0	0.0	0.0	0.0
Riccoboni_LettresFanni	667	Miss Betzi s' est enfermée avec moi;	62	3	7	0	0.0	[]	0.0	0.0	0.0	0.0	0.0
Riccoboni_LettresFanni	668	nous avions nos raisons pour rester seules;	62	4	7	0	0.0	[]	0.0	0.0	0.0	0.0	0.0
Riccoboni_LettresFanni	669	elle voulait étudier;	62	5	3	0	0.0	[]	0.0	0.0	0.0	0.0	0.0
Riccoboni_LettresFanni	670	je voulais rêver.	62	6	3	0	0.0	[]	0.0	0.0	0.0	0.0	0.0
Riccoboni_LettresFanni	671	Elle a commencé à lire son maudit français , annonçant chaque phrase, et mettant Zaïde en pièces;	62	7	16	0	0.0	[]	0.0	0.0	0.0	0.0	0.0
Riccoboni_LettresFanni	672	et moi je n' écoutais point, le ciel me faisait la grâce de ne point écouter;	62	8	16	0	0.0	[]	0.0	0.0	0.0	0.0	0.0
Riccoboni_LettresFanni	673	cependant le portrait de Consalve a ramené mon attention;	62	9	9	0	0.0	[]	0.0	0.0	0.0	0.0	0.0
Riccoboni_LettresFanni	674	je me suis imaginé qu' il vous ressemblait: en vérité, il vous ressemble.	62	10	13	0	0.0	[]	0.0	0.0	0.0	0.0	0.0
Riccoboni_LettresFanni	675	à trois heures.	63	0	3	0	0.0	[]	0.0	0.0	0.0	0.0	0.0
Riccoboni_LettresFanni	676	cette aiguille semble immobile;	64	0	4	0	0.0	[]	0.0	0.0	0.0	0.0	0.0
Riccoboni_LettresFanni	677	elle marche pourtant, elle va d' un pas égal.	64	1	9	0	0.0	[]	0.0	0.0	0.0	0.0	0.0
Riccoboni_LettresFanni	678	Mes désirs ne peuvent hâter ni ralentir son mouvement.	64	2	9	0	0.0	[]	0.0	0.0	0.0	0.0	0.0
Riccoboni_LettresFanni	679	Quand ira-t-elle sur six heures? ... j' écris pour calmer mon impatience... j' écris pour écrire... mon amant écrit pour peindre, pour enchanter;	64	3	25	0	0.0	[]	0.0	0.0	0.0	0.0	0.0
Riccoboni_LettresFanni	680	c' est un tableau riant que sa plume dessine: l' esprit, l' amouret la variété brillent dans ses lettres: moi, je ne sais que dire je vous aime...	64	4	28	0	0.0	[]	0.0	0.0	0.0	0.0	0.0
Riccoboni_LettresFanni	681	il faut me le pardonner, mon cher Alfred, c' est qu' en vérité, je ne pense que cela: je ne devrais pas le dire si souvent;	64	5	26	0	0.0	[]	0.0	0.0	0.0	0.0	0.0
Riccoboni_LettresFanni	682	il faut de l' art pour conserver un cœur.	64	6	9	0	0.0	[]	0.0	0.0	0.0	0.0	0.0
Riccoboni_LettresFanni	683	Ladi Charlotte le dit, et ladi Charlotte sait bien ce qu' elle dit... de l' art, mon cher Alfred!	64	7	19	0	0.0	[]	0.0	0.0	0.0	0.0	0.0
Riccoboni_LettresFanni	684	Quoi!	64	8	1	0	0.0	[]	0.0	0.0	0.0	0.0	0.0
Riccoboni_LettresFanni	685	De l' art avec toi!	64	9	5	0	0.0	[]	0.0	0.0	0.0	0.0	0.0
Riccoboni_LettresFanni	686	... te cacher que je t' adore! ...	64	10	7	0	0.0	[]	0.0	0.0	0.0	0.0	0.0
Riccoboni_LettresFanni	687	ah!	64	11	1	0	0.0	[]	0.0	0.0	0.0	0.0	0.0
Riccoboni_LettresFanni	688	Jamais, non, jamais.	64	12	3	0	0.0	[]	0.0	0.0	0.0	0.0	0.0
Riccoboni_LettresFanni	689	Lettre 33.	64	13	2	0	0.0	[]	0.0	0.0	0.0	0.0	0.0
Riccoboni_LettresFanni	690	dimanche à midi.	65	0	3	0	0.0	[]	0.0	0.0	0.0	0.0	0.0
Riccoboni_LettresFanni	691	ne cherchez point des noms plus doux pour me les donner: celui de votre maîtresse est le plus flatteur pour moi;	66	0	21	0	0.0	[]	0.0	0.0	0.01485148514851485	0.0	0.022053597817637043
Riccoboni_LettresFanni	692	il m' est plus cher que tous les titres qui peuvent exciter les désirs de la femme la plus vaine et la plus ambitieuse.	66	1	24	0	0.0	[]	0.0	0.0	0.01485148514851485	0.0	0.022053597817637043
Riccoboni_LettresFanni	693	Ah!	66	2	1	0	0.0	[]	0.0	0.0	0.01485148514851485	0.0	0.022053597817637043
Riccoboni_LettresFanni	694	Que l' or et les pierreries brillent sur mes égales;	66	3	10	0	0.0	[]	0.0	0.0	0.01485148514851485	0.0	0.022053597817637043
Riccoboni_LettresFanni	695	qu' elles prisent des biens que la noblesse de mes sentiment me fait dédaigner;	66	4	14	0	0.0	[]	0.025	0.025	0.01485148514851485	0.0	0.022053597817637043
Riccoboni_LettresFanni	696	ton amour me parera bien mieux que la richesse et la grandeur ne pourraient le faire.	66	5	16	1	0.0625	[['ton']]	0.04	0.04	0.01485148514851485	0.0	0.022053597817637043
Riccoboni_LettresFanni	697	Embellie par tes caresses, je devrai mon éclat à tes plaisirs, à l' heureuse certitude d' être chérie de toi!	66	6	20	1	0.05	[['ton']]	0.05405405405405406	0.05405405405405406	0.01485148514851485	0.0	0.022053597817637043
Riccoboni_LettresFanni	698	Eh!	66	7	1	0	0.0	[]	0.034482758620689655	0.034482758620689655	0.01485148514851485	0.0	0.022053597817637043
Riccoboni_LettresFanni	699	Quel rang, quel état est au-dessus du mien!	66	8	8	0	0.0	[]	0.0	0.0	0.01485148514851485	0.0	0.022053597817637043
Riccoboni_LettresFanni	700	Aimer, pouvoir justifier sonamour par l' objet qui l' inspire; oser se dire, je l' avouerois sans honte: oui, mon cher Alfred, si l' usage, si la décence n' était pas blessée par cet aveu, je dirais avec vanité, j' aime milord duc;	66	9	43	0	0.0	[]	0.0	0.0	0.01485148514851485	0.0	0.022053597817637043
Riccoboni_LettresFanni	701	je suis à lui;	66	10	4	0	0.0	[]	0.0	0.0	0.01485148514851485	0.0	0.022053597817637043
Riccoboni_LettresFanni	702	je mets ma gloire et mon bonheur à lui prouver ma tendresse.	66	11	12	0	0.0	[]	0.0	0.0	0.01485148514851485	0.0	0.022053597817637043
Riccoboni_LettresFanni	703	Qu' il la partage.	66	12	4	0	0.0	[]	0.02631578947368421	0.02631578947368421	0.01485148514851485	0.0	0.022053597817637043
Riccoboni_LettresFanni	704	Que j' excite un moment de plaisir dans son cœur, je n' envierai pas le sort du plus grand roi du monde.	66	13	22	1	0.0454545454545454	[['grand']]	0.03571428571428571	0.03571428571428571	0.01485148514851485	0.0	0.022053597817637043
Riccoboni_LettresFanni	705	Lettre 34.	66	14	2	0	0.0	[]	0.041666666666666664	0.04	0.01485148514851485	0.0	0.022053597817637043
Riccoboni_LettresFanni	706	vendredi.	67	0	1	0	0.0	[]	0.0	0.0	0.0	0.0	0.0
Riccoboni_LettresFanni	707	elle n' a donc plus que deux jours à vous voir, cette pauvre Fanni!	68	0	14	0	0.0	[]	0.0	0.0	0.014814814814814815	0.0	0.03711799643782037
Riccoboni_LettresFanni	708	Que cette idée l' afflige!	68	1	5	0	0.0	[]	0.0	0.0	0.014814814814814815	0.0	0.03711799643782037
Riccoboni_LettresFanni	709	Vous ne me quitterez point sans regret, mon cher Alfred;	68	2	10	0	0.0	[]	0.0	0.0	0.014814814814814815	0.0	0.03711799643782037
Riccoboni_LettresFanni	710	car vous m' aimez, je me le dis à moi-même.	68	3	11	0	0.0	[]	0.0	0.0	0.014814814814814815	0.0	0.03711799643782037
Riccoboni_LettresFanni	711	J' ai besoin de me le dire quand je ne vous vois point;	68	4	13	0	0.0	[]	0.0	0.0	0.014814814814814815	0.0	0.03711799643782037
Riccoboni_LettresFanni	712	mais vous m' en assurez bien mieux.	68	5	7	0	0.0	[]	0.0	0.0	0.014814814814814815	0.0	0.03711799643782037
Riccoboni_LettresFanni	713	Que de jours à passer sans vous voir, sans espérer de vous voir, sans écouter si ce carrosse entre, sans me dire, le voilà!	68	6	24	0	0.0	[]	0.020833333333333332	0.020833333333333332	0.014814814814814815	0.0	0.03711799643782037
Riccoboni_LettresFanni	714	Combien de fois cinq heures sonneront, sans que mon cœur sente ce battement, doux avant-coureur du plaisir!	68	7	17	1	0.0588235294117647	[['dou']]	0.023809523809523808	0.023809523809523808	0.014814814814814815	0.0	0.03711799643782037
Riccoboni_LettresFanni	715	Ah!	68	8	1	0	0.0	[]	0.03225806451612903	0.03225806451612903	0.014814814814814815	0.0	0.03711799643782037
Riccoboni_LettresFanni	716	Miss Betzi, Miss Betzi, que vous allez avoir besoin de votre aimable complaisance!	68	9	13	0	0.0	[]	0.0	0.0	0.014814814814814815	0.0	0.03711799643782037
Riccoboni_LettresFanni	717	Que j' en abuserai!	68	10	4	0	0.0	[]	0.0	0.0	0.014814814814814815	0.0	0.03711799643782037
Riccoboni_LettresFanni	718	Combien de fois lui répéterai	68	11	5	0	0.0	[]	0.0	0.0	0.014814814814814815	0.0	0.03711799643782037
Riccoboni_LettresFanni	719	-je,il est charmant.	68	12	4	0	0.0	[]	0.038461538461538464	0.038461538461538464	0.014814814814814815	0.0	0.03711799643782037
Riccoboni_LettresFanni	720	N' est-ce pas, miss, qu' il est charmant, que je ne puis trop l' aimer! ... et puis tant de récits, tant de détails, tant de confidences... et puis toutes les folies, tous les vains projets dont une âme tendre s' amuse...	68	13	43	2	0.0465116279069767	[['charmer'], ['tendre']]	0.041666666666666664	0.041666666666666664	0.014814814814814815	0.0	0.03711799643782037
Riccoboni_LettresFanni	721	ah!	68	14	1	0	0.0	[]	0.037037037037037035	0.037037037037037035	0.014814814814814815	0.0	0.03711799643782037
Riccoboni_LettresFanni	722	Ce cachet, le divin cachet de Salomon, où est-il?	68	15	10	0	0.0	[]	0.0	0.0	0.014814814814814815	0.0	0.03711799643782037
Riccoboni_LettresFanni	723	Que ne l' ai-je à présent!	68	16	7	0	0.0	[]	0.0	0.0	0.014814814814814815	0.0	0.03711799643782037
Riccoboni_LettresFanni	724	Je vous suivrais... mais quoi!	68	17	5	0	0.0	[]	0.0	0.0	0.014814814814814815	0.0	0.03711799643782037
Riccoboni_LettresFanni	725	Mon cher Alfred serait-il gouverneur d' une province de la Grande-Bretagne?	68	18	12	0	0.0	[]	0.0	0.0	0.014814814814814815	0.0	0.03711799643782037
Riccoboni_LettresFanni	726	Aurait-il un maître dont les ordres pussent l' éloigner de moi?	68	19	12	0	0.0	[]	0.0	0.0	0.014814814814814815	0.0	0.03711799643782037
Riccoboni_LettresFanni	727	... lui?	68	20	1	0	0.0	[]	0.0	0.0	0.014814814814814815	0.0	0.03711799643782037
Riccoboni_LettresFanni	728	...	68	21	0	0	0.0	[]	0.0	0.0	0.014814814814814815	0.0	0.03711799643782037
Riccoboni_LettresFanni	729	non...	68	22	1	0	0.0	[]	0.0	0.0	0.014814814814814815	0.0	0.03711799643782037
Riccoboni_LettresFanni	730	il a les vertus de Titus...	68	23	6	0	0.0	[]	0.0	0.0	0.014814814814814815	0.0	0.03711799643782037
Riccoboni_LettresFanni	731	je lui donnerais l' empire de Néron...	68	24	7	0	0.0	[]	0.0	0.0	0.014814814814814815	0.0	0.03711799643782037
Riccoboni_LettresFanni	732	on dit que ce prince fut un jour souverain paisible du monde connu.	68	25	13	0	0.0	[]	0.0	0.0	0.014814814814814815	0.0	0.03711799643782037
Riccoboni_LettresFanni	733	Mon cher Alfred en serait le monarque chéri, révéré.	68	26	9	0	0.0	[]	0.0	0.0	0.014814814814814815	0.0	0.03711799643782037
Riccoboni_LettresFanni	734	Ah!	68	27	1	0	0.0	[]	0.06666666666666667	0.06666666666666667	0.014814814814814815	0.0	0.03711799643782037
Riccoboni_LettresFanni	735	Le beau conte de fées!	68	28	5	1	0.2	[['beau']]	0.1111111111111111	0.1111111111111111	0.014814814814814815	0.0	0.03711799643782037
Riccoboni_LettresFanni	736	... je suis folle.	68	29	3	0	0.0	[]	0.08333333333333333	0.08333333333333333	0.014814814814814815	0.0	0.03711799643782037
Riccoboni_LettresFanni	737	Adieu, mon cher Alfred.	68	30	4	0	0.0	[]	0.0	0.0	0.014814814814814815	0.0	0.03711799643782037
Riccoboni_LettresFanni	738	Lettre 35.	68	31	2	0	0.0	[]	0.0	0.0	0.014814814814814815	0.0	0.03711799643782037
Riccoboni_LettresFanni	739	lundi à deux heures du matin.	69	0	6	0	0.0	[]	0.0	0.0	0.0	0.0	0.0
Riccoboni_LettresFanni	740	ce n' est donc pas moi qui vous donnerai cette lettre, mon cher Alfred;	70	0	14	0	0.0	[]	0.05	0.038461538461538464	0.018633540372670808	0.0	0.05447979312346375
Riccoboni_LettresFanni	741	une autre main vous la présentera;	70	1	6	1	0.1666666666666666	[['main']]	0.058823529411764705	0.058823529411764705	0.018633540372670808	0.0	0.05447979312346375
Riccoboni_LettresFanni	742	vous ne lirez point dans mes yeux la vérité des sentiment qu' elle contient...	70	2	14	1	0.0714285714285714	[['oeil']]	0.058823529411764705	0.058823529411764705	0.018633540372670808	0.0	0.05447979312346375
Riccoboni_LettresFanni	743	je ne lirai point dans les vôtres, l' impression qu' elle fera sur vous.	70	3	14	0	0.0	[]	0.04	0.04	0.018633540372670808	0.0	0.05447979312346375
Riccoboni_LettresFanni	744	Mes regards suivaient tous vos mouvement, et je m' applaudissoisde l' air satisfait avec lequel vous lisiez les assurances de mon amour.	70	4	22	1	0.0454545454545454	[['regard']]	0.05	0.05	0.018633540372670808	0.0	0.05447979312346375
Riccoboni_LettresFanni	745	Aimable et douce habitude	70	5	4	1	0.25	[['douce']]	0.04878048780487805	0.04878048780487805	0.018633540372670808	0.0	0.05447979312346375
Riccoboni_LettresFanni	746	, que votre perte est sensible! ... demain viendra et n' amènera point le moment désiré;	70	6	15	0	0.0	[]	0.023809523809523808	0.023809523809523808	0.018633540372670808	0.0	0.05447979312346375
Riccoboni_LettresFanni	747	les heures passeront, et celle où je vous voyais passera comme les autres: elle passera, mon cher Alfred, et vous ne viendrez point.	70	7	23	0	0.0	[]	0.0	0.0	0.018633540372670808	0.0	0.05447979312346375
Riccoboni_LettresFanni	748	Ah!	70	8	1	0	0.0	[]	0.0	0.0	0.018633540372670808	0.0	0.05447979312346375
Riccoboni_LettresFanni	749	Mon dieu, vous ne viendrez point!	70	9	6	0	0.0	[]	0.0	0.0	0.018633540372670808	0.0	0.05447979312346375
Riccoboni_LettresFanni	750	Que mon cœur est pressé!	70	10	5	0	0.0	[]	0.0	0.0	0.018633540372670808	0.0	0.05447979312346375
Riccoboni_LettresFanni	751	J' ai retenu mes larmes;	70	11	5	0	0.0	[]	0.0	0.0	0.018633540372670808	0.0	0.05447979312346375
Riccoboni_LettresFanni	752	mais je ne puis plus les retenir... le voilà ce portrait;	70	12	11	0	0.0	[]	0.0	0.0	0.018633540372670808	0.0	0.05447979312346375
Riccoboni_LettresFanni	753	qu' il est différent de vous!	70	13	6	0	0.0	[]	0.0	0.0	0.018633540372670808	0.0	0.05447979312346375
Riccoboni_LettresFanni	754	Votre lettre vous peint bien mieux;	70	14	6	0	0.0	[]	0.02127659574468085	0.02127659574468085	0.018633540372670808	0.0	0.05447979312346375
Riccoboni_LettresFanni	755	elle me parle au moins, et l' amour, plus habile que l' artiste, me rend naturellement ces traits chéris que je cherche en vain dans cette image... est-ce là cet air fin, ce souris?	70	15	35	1	0.0285714285714285	[['fin']]	0.018518518518518517	0.018518518518518517	0.018633540372670808	0.0	0.05447979312346375
Riccoboni_LettresFanni	756	Non, ce ne l' est pas... mais il est tard, le chagrin appesantit.	70	16	13	0	0.0	[]	0.014084507042253521	0.014084507042253521	0.018633540372670808	0.0	0.05447979312346375
Riccoboni_LettresFanni	757	Si j' allois dormir, et passer l' heure d' envoyer à la poste, mon cher Alfred ne trouverait point de lettre en arrivant;	70	17	23	0	0.0	[]	0.0	0.0	0.018633540372670808	0.0	0.05447979312346375
Riccoboni_LettresFanni	758	il accuserait sa maîtresse de négligence, de froideur peut-être.	70	18	9	0	0.0	[]	0.0	0.0	0.018633540372670808	0.0	0.05447979312346375
Riccoboni_LettresFanni	759	Ah!	70	19	1	0	0.0	[]	0.0	0.0	0.018633540372670808	0.0	0.05447979312346375
Riccoboni_LettresFanni	760	Cette crainte m' éveillera, il la trouvera cette lettre;	70	20	9	0	0.0	[]	0.03571428571428571	0.03571428571428571	0.018633540372670808	0.0	0.05447979312346375
Riccoboni_LettresFanni	761	il se dira avec complaisance: ma tendre amie m' est attachée, elle est ardente à me le prouver.	70	21	18	1	0.0555555555555555	[['tendre']]	0.03125	0.03125	0.018633540372670808	0.0	0.05447979312346375
Riccoboni_LettresFanni	762	Il m' en aimera davantage;	70	22	5	0	0.0	[]	0.03225806451612903	0.03225806451612903	0.018633540372670808	0.0	0.05447979312346375
Riccoboni_LettresFanni	763	il connaît le prix d' un cœur sincère;	70	23	8	0	0.0	[]	0.0	0.0	0.018633540372670808	0.0	0.05447979312346375
Riccoboni_LettresFanni	764	l' éloignement ne détruira pas le plaisir qu' il sent à m' occuper; et plus je lui dirai que je l' aime, plus il m' aimera lui-même.	70	24	27	0	0.0	[]	0.0	0.0	0.018633540372670808	0.0	0.05447979312346375
Riccoboni_LettresFanni	765	Adieu, mon aimable ami, adieu.	70	25	5	0	0.0	[]	0.0	0.0	0.018633540372670808	0.0	0.05447979312346375
Riccoboni_LettresFanni	766	Que ce mot me fait de peineà présent!	70	26	8	0	0.0	[]	0.0	0.0	0.018633540372670808	0.0	0.05447979312346375
Riccoboni_LettresFanni	767	Pensez à moi.	70	27	3	0	0.0	[]	0.0	0.0	0.018633540372670808	0.0	0.05447979312346375
Riccoboni_LettresFanni	768	Ah!	70	28	1	0	0.0	[]	0.0	0.0	0.018633540372670808	0.0	0.05447979312346375
Riccoboni_LettresFanni	769	Pensez y toujours.	70	29	3	0	0.0	[]	0.0	0.0	0.018633540372670808	0.0	0.05447979312346375
Riccoboni_LettresFanni	770	Lettre 36.	70	30	2	0	0.0	[]	0.0	0.0	0.018633540372670808	0.0	0.05447979312346375
Riccoboni_LettresFanni	771	mardi à minuit.	71	0	3	0	0.0	[]	0.0	0.0	0.0	0.0	0.0
Riccoboni_LettresFanni	772	enfin il est fini ce jour dont rien n' a trompé la longueur;	72	0	13	0	0.0	[]	0.0	0.0	0.0223463687150838	0.0	0.03737629417659166
Riccoboni_LettresFanni	773	il est fini, et demain ne sera pas plus heureux.	72	1	10	0	0.0	[]	0.0	0.0	0.0223463687150838	0.0	0.03737629417659166
Riccoboni_LettresFanni	774	Je n' aurai point de lettres, pas la moindre marque de votre souvenir.	72	2	13	0	0.0	[]	0.0	0.0	0.0223463687150838	0.0	0.03737629417659166
Riccoboni_LettresFanni	775	Ah!	72	3	1	0	0.0	[]	0.07142857142857142	0.07142857142857142	0.0223463687150838	0.0	0.03737629417659166
Riccoboni_LettresFanni	776	Que cela est dur pour un cœur accoutumé aux plus tendres soins du vôtre!	72	4	14	2	0.1428571428571428	[['dur'], ['tendre']]	0.06451612903225806	0.06451612903225806	0.0223463687150838	0.0	0.03737629417659166
Riccoboni_LettresFanni	777	Vous fuyez, mon cher Alfred, vous vous éloignez avec vitesse d' une femme qui vous adore.	72	5	16	0	0.0	[]	0.06451612903225806	0.06451612903225806	0.0223463687150838	0.0	0.03737629417659166
Riccoboni_LettresFanni	778	Hélas!	72	6	1	0	0.0	[]	0.0	0.0	0.0223463687150838	0.0	0.03737629417659166
Riccoboni_LettresFanni	779	Où êtes-vous déjà?	72	7	4	0	0.0	[]	0.0	0.0	0.0223463687150838	0.0	0.03737629417659166
Riccoboni_LettresFanni	780	Ce portrait est donc tout ce qui me reste... il me paraît moins mal qu' hier...	72	8	16	0	0.0	[]	0.0	0.0	0.0223463687150838	0.0	0.03737629417659166
Riccoboni_LettresFanni	781	à force de le tourner, de le pencher, j' y trouve une ombre légère de ce que j' aime;	72	9	19	0	0.0	[]	0.0	0.0	0.0223463687150838	0.0	0.03737629417659166
Riccoboni_LettresFanni	782	je sens qu' il me devient cher;	72	10	7	0	0.0	[]	0.024390243902439025	0.024390243902439025	0.0223463687150838	0.0	0.03737629417659166
