Souza_Adele	811	J'en fus peu effrayé;	90	1	5	0	0.0	[]	0.0	0.0	0.04285714285714286	0.0	0.04264026303048989
Souza_Adele	812	non qu'un excès de courage m'aveuglât sur notre situation, ou m'y rendît insensible: mais j'étais si occupé de la terreur dont cette jeune femme était saisie!	90	2	30	0	0.0	[]	0.0	0.0	0.04285714285714286	0.0	0.04264026303048989
Souza_Adele	813	Elle regardait ses enfants avec tant d'amour!	90	3	8	0	0.0	[]	0.03333333333333333	0.03333333333333333	0.04285714285714286	0.0	0.04264026303048989
Souza_Adele	814	elle les prenait dans ses bras, et les pressait contre son cœur, comme si elle eût pu les sauver ou les défendre.	90	4	22	2	0.0909090909090909	[['bras'], ['presser']]	0.07407407407407407	0.07407407407407407	0.04285714285714286	0.0	0.04264026303048989
Souza_Adele	815	Je ne tremblais que pour elle, et je suis sûr qu'un grand intérêt, non-seulement empêche la crainte, mais distrait de la douleur même;	90	5	24	2	0.0833333333333333	[['trembler'], ['grand']]	0.075	0.075	0.04285714285714286	0.0	0.04264026303048989
Souza_Adele	816	car après que le premier danger fut passé, je m'aperçus que je m'étais fait une forte contusion à la tête, sans que j'aie pu alors me rappeler ni où ni comment.	90	6	34	2	0.0588235294117647	[['fort'], ['tête']]	0.06896551724137931	0.05970149253731343	0.04285714285714286	0.0	0.04264026303048989
Souza_Adele	817	"""Quand nous fûmes un peu plus tranquilles, mylord B"	91	0	9	0	0.0	[]	0.0	0.03333333333333333	0.009398496240601503	0.0	0.015674425663210634
Souza_Adele	818	… vint à moi, et me jura une amitié que rien, disait-il, de pouvait plus détruire.	91	1	17	0	0.0	[]	0.0	0.0	0.009398496240601503	0.0	0.015674425663210634
Souza_Adele	819	Effectivement, dans ces moment de trouble, on se montre tel que l'on est; et peut-être me savait-il gré de n'avoir pas un instant pensé à moi-même.	91	2	30	0	0.0	[]	0.0125	0.0125	0.009398496240601503	0.0	0.015674425663210634
Souza_Adele	820	Pour lui, toujours froid, toujours raisonnable, il s'occupait de sa femme avec le regret de la voir souffrir, mais sans rien prévoir de ce qui pouvait la soulager, ou tromper son inquiétude.	91	3	33	1	0.0303030303030303	[['froid']]	0.014084507042253521	0.014084507042253521	0.009398496240601503	0.0	0.015674425663210634
Souza_Adele	821	Nous arrivâmes à Douvres le lendemain au soir.	91	4	8	0	0.0	[]	0.023255813953488372	0.023255813953488372	0.009398496240601503	0.0	0.015674425663210634
Souza_Adele	822	Lady B	91	5	2	0	0.0	[]	0.0	0.0	0.009398496240601503	0.0	0.015674425663210634
Souza_Adele	823	… avait à peine la force de marcher: on la porta jusqu'à l'auberge, où elle se coucha;	91	6	19	0	0.0	[]	0.0	0.0	0.009398496240601503	0.0	0.015674425663210634
Souza_Adele	824	et je ne la revis plus du reste de la journée.	91	7	11	0	0.0	[]	0.0	0.0	0.009398496240601503	0.0	0.015674425663210634
Souza_Adele	825	Son mari vint me retrouver;	91	8	5	0	0.0	[]	0.0	0.0	0.009398496240601503	0.0	0.015674425663210634
Souza_Adele	826	nous soupâmes ensemble.	91	9	3	0	0.0	[]	0.03571428571428571	0.03571428571428571	0.009398496240601503	0.0	0.015674425663210634
Souza_Adele	827	Pendant le repas, m'ayant entendu dire qu'aucune affaire ne m'appelait directement à Londres, et que la curiosité ne m'y attirait même pas, il me proposa d'aller passer quelques semaines dans leur terre qui n'était qu'à une petite distance de cette ville.	91	10	48	2	0.0416666666666666	[['pendant'], ['petit']]	0.028169014084507043	0.028169014084507043	0.009398496240601503	0.0	0.015674425663210634
Souza_Adele	828	J'y consentis avec un sentiment de répugnance que je ne pouvais m'expliquer, et qui me tourmentait malgré moi;	91	11	20	0	0.0	[]	0.024691358024691357	0.024691358024691357	0.009398496240601503	0.0	0.015674425663210634
Souza_Adele	829	je crois que le cœur pressent toujours les peines qu'il doit éprouver.	91	12	13	0	0.0	[]	0.015625	0.015625	0.009398496240601503	0.0	0.015674425663210634
Souza_Adele	830	Cependant aucune bonne raison ne se présentant pour justifier mon refus, j'acceptai, par cette sorte d'embarras, qui est une suite naturelle de la manière dont on m'avait élevé.	91	13	31	1	0.032258064516129	[['naturel']]	0.01818181818181818	0.01818181818181818	0.009398496240601503	0.0	0.015674425663210634
Souza_Adele	831	Il fut décidé que nous partirions le lendemain de bonne heure.	91	14	11	0	0.0	[]	0.02040816326530612	0.02040816326530612	0.009398496240601503	0.0	0.015674425663210634
Souza_Adele	832	Je me retirai dans ma chambre, contrarié;	91	15	7	0	0.0	[]	0.03125	0.03125	0.009398496240601503	0.0	0.015674425663210634
Souza_Adele	833	je fus long-temps sans pouvoir m'endormir: je m'éveillai de mauvaise humeur;	91	16	14	1	0.0714285714285714	[['long']]	0.02857142857142857	0.02857142857142857	0.009398496240601503	0.0	0.015674425663210634
Souza_Adele	834	j'étais fâché de les suivre, je l'aurais été encore plus de rester.	91	17	14	0	0.0	[]	0.03333333333333333	0.03333333333333333	0.009398496240601503	0.0	0.015674425663210634
Souza_Adele	835	Lady B	91	18	2	0	0.0	[]	0.0	0.0	0.009398496240601503	0.0	0.015674425663210634
Souza_Adele	836	… m'attendait;	91	19	3	0	0.0	[]	0.0	0.0	0.009398496240601503	0.0	0.015674425663210634
Souza_Adele	837	elle me fit les plus touchant remercîmens pour les soins que je lui avais rendus;	91	20	15	0	0.0	[]	0.0	0.0	0.009398496240601503	0.0	0.015674425663210634
Souza_Adele	838	et me présentant ses enfants, elle leur dit de m'aimer, parce que je serais toujours l'ami de leur père et le sien.	91	21	24	0	0.0	[]	0.0	0.0	0.009398496240601503	0.0	0.015674425663210634
Souza_Adele	839	Je les embrassai tous, et après le déjeuner nous partîmes.	91	22	10	0	0.0	[]	0.0	0.0	0.009398496240601503	0.0	0.015674425663210634
Souza_Adele	840	Je montai dans sa voiture;	91	23	5	0	0.0	[]	0.0	0.0	0.009398496240601503	0.0	0.015674425663210634
Souza_Adele	841	les enfants allèrent dans la mienne.	91	24	6	0	0.0	[]	0.0	0.0	0.009398496240601503	0.0	0.015674425663210634
Souza_Adele	842	Je ne vous ferai point la description de la terre de lord B	91	25	13	0	0.0	[]	0.0	0.0	0.009398496240601503	0.0	0.015674425663210634
Souza_Adele	843	…;	91	26	1	0	0.0	[]	0.0	0.0	0.009398496240601503	0.0	0.015674425663210634
Souza_Adele	844	vous devez la connaître aussi bien que moi, mais pas mieux, ajouta-t-il, car c'est le temps de ma vie, peut-être le seul, dont j'aie parfaitement conservé le souvenir.	91	27	32	0	0.0	[]	0.0	0.0	0.009398496240601503	0.0	0.015674425663210634
Souza_Adele	845	Depuis le premier moment où j'aperçus lady B…	91	28	10	0	0.0	[]	0.0	0.0	0.009398496240601503	0.0	0.015674425663210634
Souza_Adele	846	jusqu'au jour où je m'éloignai d'elle, il n'est pas un instant dont je ne me souvienne.	91	29	20	0	0.0	[]	0.0	0.0	0.009398496240601503	0.0	0.015674425663210634
Souza_Adele	847	Il semble que ce soit un temps séparé du reste de ma vie;	91	30	13	0	0.0	[]	0.0	0.0	0.009398496240601503	0.0	0.015674425663210634
Souza_Adele	848	avant, après, j'ai beaucoup oublié; mais tout ce qui la regarde m'est présent et cher.	91	31	17	0	0.0	[]	0.0	0.0	0.009398496240601503	0.0	0.015674425663210634
Souza_Adele	849	Ce que je ne saurais vous rendre, c'est l'espèce de charme qui régnait autour d'elle, et qui faisait que tout ce qui l'approchait paraissait heureux: une réunion de qualités telles que j'ai mille fois entendu faire son éloge, et presque toujours d'une manière différente; mais tous la louaient, car il semblait qu'elle eût particulièrement ce qui plaisait à chacun.	91	32	66	0	0.0	[]	0.0	0.009259259259259259	0.009398496240601503	0.0	0.015674425663210634
Souza_Adele	850	"""Cependant j'étais dans une si triste disposition d'esprit, que les premiers jours je fus peu frappé de tout le mérite de lady B"	92	0	25	1	0.04	[['triste']]	0.038461538461538464	0.010869565217391304	0.00392156862745098	0.0	0.00917221679395309
Souza_Adele	851	….	92	1	1	0	0.0	[]	0.021739130434782608	0.021739130434782608	0.00392156862745098	0.0	0.00917221679395309
Souza_Adele	852	Insensiblement je me sentis attiré près d'elle; et je l'aimais déjà beaucoup, sans avoir pensé à l'admirer.	92	2	20	0	0.0	[]	0.0	0.0	0.00392156862745098	0.0	0.00917221679395309
Souza_Adele	853	Les premiers jours que je fus chez elle je me promenais seul;	92	3	12	0	0.0	[]	0.0	0.0	0.00392156862745098	0.0	0.00917221679395309
Souza_Adele	854	et lorsque le hasard me faisait trouver avec du monde, je restais dans le silence, sans chercher à plaire, ni souhaiter d'être remarqué.	92	4	24	0	0.0	[]	0.0	0.0	0.00392156862745098	0.0	0.00917221679395309
Souza_Adele	855	Le mari, les entours de Lady…. devaient dire de moi, que j'étais ennuyeux et sauvage;	92	5	17	0	0.0	[]	0.0	0.0	0.00392156862745098	0.0	0.00917221679395309
Souza_Adele	856	elle seule devina que j'avais des chagrins et une timidité excessive.	92	6	12	0	0.0	[]	0.0	0.0	0.00392156862745098	0.0	0.00917221679395309
Souza_Adele	857	Elle essaya de me rapprocher d'elle, et de me faire parler, en me questionnant sur des objets qu'elle connaissait sûrement;	92	7	22	0	0.0	[]	0.0	0.0	0.00392156862745098	0.0	0.00917221679395309
Souza_Adele	858	aussi ne lui répondis-je que des demi-mots, qui ne faisaient que m'embarrasser davantage.	92	8	15	0	0.0	[]	0.0	0.0	0.00392156862745098	0.0	0.00917221679395309
Souza_Adele	859	Sa bonté lui fit sentir qu'il fallait d'abord m'accoutumer à elle, avant d'obtenir ma confiance.	92	9	19	0	0.0	[]	0.0	0.0	0.00392156862745098	0.0	0.00917221679395309
Souza_Adele	860	Elle me proposa de l'accompagner dans ses promenades: dès le lendemain je commençai à la suivre.	92	10	17	0	0.0	[]	0.0	0.0	0.00392156862745098	0.0	0.00917221679395309
Souza_Adele	861	Elle me fit faire le tour de son parc; et passant devant un temple qu'elle avait fait bâtir, elle en prit occasion de me parler de la complaisance de son mari pour ses goûts, et de sa reconnaissance.	92	11	39	0	0.0	[]	0.0	0.0	0.00392156862745098	0.0	0.00917221679395309
Souza_Adele	862	De ce jour, sans me rien dire que ce qu'elle aurait permis que tout le monde sût, elle me traita avec un air de confiance et d'estime qui m'entraînait et me flattait.	92	12	35	0	0.0	[]	0.0	0.0	0.00392156862745098	0.0	0.00917221679395309
Souza_Adele	863	C'est toujours en me parlant d'elle-même que, peu à peu, elle m'amena à oser lui confier mes peines.	92	13	21	0	0.0	[]	0.0	0.0	0.00392156862745098	0.0	0.00917221679395309
Souza_Adele	864	Alors elle me donna toute son attention: elle m'écoutait avec intérêt, me questionnait sans curiosité, et finit par m'inspirer le besoin d'être toujours avec elle, et de lui tout dire.	92	14	33	0	0.0	[]	0.0	0.0	0.00392156862745098	0.0	0.00917221679395309
Souza_Adele	865	Je trouvai en elle les avis et les consolations d'une amie éclairée;	92	15	13	0	0.0	[]	0.0	0.0	0.00392156862745098	0.0	0.00917221679395309
Souza_Adele	866	une politesse dans le langage, qui aurait rappelé le respect du plus audacieux, et une bienveillance dans les manières qui attirait toutes les affections.	92	16	24	0	0.0	[]	0.0	0.0	0.00392156862745098	0.0	0.00917221679395309
Souza_Adele	867	Je lui parlai de mon père avec amertume;	92	17	8	0	0.0	[]	0.0	0.0	0.00392156862745098	0.0	0.00917221679395309
Souza_Adele	868	elle me plaignit d'abord: mais bientôt, reprenant sur moi l'ascendant qu'elle devait avoir;	92	18	16	0	0.0	[]	0.0	0.0	0.00392156862745098	0.0	0.00917221679395309
Souza_Adele	869	sans se donner la peine d'examiner si mon père avait usé de trop de rigueur, peu à peu elle me conduisit à penser que les torts des autres deviennent un titre à l'estime, lorsqu'ils n'influent point sur notre conduite, mais ne sont jamais une excuse lorsqu'ils nous irritent au point de nous rendre répréhensibles.	92	19	59	0	0.0	[]	0.0	0.0	0.00392156862745098	0.0	0.00917221679395309
Souza_Adele	870	Enfin elle sut prendre tant d'empire sur mon esprit, que je n'avais plus une seule idée qu'elle ne devinât.	92	20	22	0	0.0	[]	0.0072992700729927005	0.0072992700729927005	0.00392156862745098	0.0	0.00917221679395309
Souza_Adele	871	Elle lisait sur ma figure, rectifiait toutes mes opinions, et fit de moi, l'homme bon et honnête qui n'a jamais pensé à elle sans devenir meilleur; et qui, depuis qu'il l'a connue, peut se dire qu'il n'existe pas une seule personne à qui il ait fait un moment de peine.	92	21	56	1	0.0178571428571428	[['figure']]	0.01282051282051282	0.011764705882352941	0.00392156862745098	0.0	0.00917221679395309
Souza_Adele	872	"""Je commençais à me trouver parfaitement heureux;"	93	0	7	0	0.0	[]	0.0	0.014705882352941176	0.02586206896551724	0.0	0.03779457305045415
Souza_Adele	873	j'adorais lady B….	93	1	5	0	0.0	[]	0.0	0.0	0.02586206896551724	0.0	0.03779457305045415
Souza_Adele	874	comme les sauvages adorent le soleil;	93	2	6	0	0.0	[]	0.0	0.0	0.02586206896551724	0.0	0.03779457305045415
Souza_Adele	875	je la cherchais sans cesse.	93	3	5	0	0.0	[]	0.01639344262295082	0.01639344262295082	0.02586206896551724	0.0	0.03779457305045415
Souza_Adele	876	Mon père ne m'avait point appris à cacher mes sentiment sous ces formes qui donnent, aux hommes et aux choses, un poli qui les rend tous semblables: je ne vivais que pour elle, je n'aimais qu'elle, et il n'était que trop facile de s'en apercevoir.	93	4	50	1	0.02	[['poli']]	0.017543859649122806	0.017543859649122806	0.02586206896551724	0.0	0.03779457305045415
Souza_Adele	877	Mylord B	93	5	2	0	0.0	[]	0.015625	0.015625	0.02586206896551724	0.0	0.03779457305045415
Souza_Adele	878	… ne paraissait plus chez sa femme qu'aux heures des repas;	93	6	12	0	0.0	[]	0.04	0.04	0.02586206896551724	0.0	0.03779457305045415
Souza_Adele	879	il parlait fort peu, et moins à moi qu'à personne.	93	7	11	1	0.0909090909090909	[['fort']]	0.03333333333333333	0.03333333333333333	0.02586206896551724	0.0	0.03779457305045415
Souza_Adele	880	Je le remarquai sans m'en embarrasser;	93	8	7	0	0.0	[]	0.06896551724137931	0.06896551724137931	0.02586206896551724	0.0	0.03779457305045415
Souza_Adele	881	mais je la voyais souvent pensive, et cela m'inquiétait vivement.	93	9	11	1	0.0909090909090909	[['pensif']]	0.05555555555555555	0.022222222222222223	0.02586206896551724	0.0	0.03779457305045415
Souza_Adele	882	"""Un jour, après dîner, au lieu de rester dans le salon avec ses enfants, elle suivit son mari et ne reparut plus du reste de la journée."	94	0	27	0	0.0	[]	0.0	0.018867924528301886	0.02973977695167286	0.0	0.026748957072196145
Souza_Adele	883	Le soir, à l'heure du souper, ils vinrent tous deux se mettre à table.	94	1	15	0	0.0	[]	0.02666666666666667	0.02666666666666667	0.02973977695167286	0.0	0.026748957072196145
Souza_Adele	884	Je la trouvai fort pâle, et je vis qu'elle avait beaucoup pleuré: j'en fus si bouleversé, que je ne cessai de la regarder, sans m'apercevoir combien cette attention était inconvenante.	94	2	33	2	0.0606060606060606	[['fort'], ['pâle']]	0.030303030303030304	0.030303030303030304	0.02973977695167286	0.0	0.026748957072196145
Souza_Adele	885	Je ne pensai plus au souper, j'oubliai de déployer ma serviette: elle ne mangea pas non plus.	94	3	18	0	0.0	[]	0.03773584905660377	0.03773584905660377	0.02973977695167286	0.0	0.026748957072196145
Souza_Adele	886	Lord B	94	4	2	0	0.0	[]	0.017543859649122806	0.017543859649122806	0.02973977695167286	0.0	0.026748957072196145
Souza_Adele	887	… ne soupait jamais; et au bout de dix minutes, je l'entendis qui poussait sa chaise avec humeur, en disant, que puisque personne n'avait appétit, il était inutile de rester à table plus long-temps.	94	5	37	1	0.027027027027027	[['long']]	0.023809523809523808	0.023809523809523808	0.02973977695167286	0.0	0.026748957072196145
Souza_Adele	888	— Lady B	94	6	3	0	0.0	[]	0.03896103896103896	0.03896103896103896	0.02973977695167286	0.0	0.026748957072196145
Souza_Adele	889	… toujours douce, toujours occupée des autres, vint me dire qu'une forte migraine la forçait à se retirer de bonne heure; mais qu'elle me priait de la suivre le lendemain à sa promenade du matin.	94	7	37	2	0.054054054054054	[['douce'], ['fort']]	0.03389830508474576	0.03389830508474576	0.02973977695167286	0.0	0.026748957072196145
Souza_Adele	890	Je la regardai sans lui répondre, car je ne pensais qu'à deviner ce qui pouvait l'avoir affligée.	94	8	19	0	0.0	[]	0.03076923076923077	0.03076923076923077	0.02973977695167286	0.0	0.026748957072196145
Souza_Adele	891	Elle me quitta, et ils s'en allèrent ensemble.	94	9	9	0	0.0	[]	0.0	0.0	0.02973977695167286	0.0	0.026748957072196145
Souza_Adele	892	Je regagnai ma chambre, où, pour la première fois, je connus à quel point je l'aimais.	94	10	17	0	0.0	[]	0.0	0.0	0.02973977695167286	0.0	0.026748957072196145
Souza_Adele	893	Je passai toute la nuit sans me coucher.	94	11	8	0	0.0	[]	0.043478260869565216	0.043478260869565216	0.02973977695167286	0.0	0.026748957072196145
Souza_Adele	894	J'avais beau chercher, me creuser la tête, je ne concevais rien à sa douleur: et me perdant en conjectures, je ne sentais, bien clairement, que le chagrin de lui savoir des peines, et le désir de donner ma vie pour la voir heureuse.	94	12	44	3	0.0681818181818181	[['beau'], ['creuser'], ['tête']]	0.057692307692307696	0.03571428571428571	0.02973977695167286	0.0	0.026748957072196145
Souza_Adele	895	"""Dès que le jour parut, j'allai me promener, jusqu'à l'heure où elle descendait ordinairement: alors, ne la trouvant point dans le salon, je montai la chercher chez ses enfants."	95	0	32	0	0.0	[]	0.0	0.0375	0.022026431718061675	0.0	0.029972904383431465
Souza_Adele	896	Leur chambre était ouverte;	95	1	4	0	0.0	[]	0.0	0.0	0.022026431718061675	0.0	0.029972904383431465
Souza_Adele	897	je m'arrêtai en voyant lady B	95	2	7	0	0.0	[]	0.037037037037037035	0.037037037037037035	0.022026431718061675	0.0	0.029972904383431465
Souza_Adele	898	… assise, le dos tourné à la porte, ayant ses quatre enfants à genoux devant elle;	95	3	16	1	0.0625	[['genou']]	0.030303030303030304	0.030303030303030304	0.022026431718061675	0.0	0.029972904383431465
Souza_Adele	899	le cinquième, qu'elle nourrissait encore, était sur ses genoux.	95	4	10	0	0.0	[]	0.02	0.02	0.022026431718061675	0.0	0.029972904383431465
Souza_Adele	900	Ces enfants faisaient leur prière du matin: lorsqu'ils eurent prié pour la santé de leur père et de leur mère, elle leur dit:	95	5	24	0	0.0	[]	0.016666666666666666	0.016666666666666666	0.022026431718061675	0.0	0.029972904383431465
Souza_Adele	901	Demandez aussi à Dieu que monsieur de Sénange, qui a eu tant de soin de vous pendant la tempête, n'éprouve aucun accident pour son retour .	95	6	26	1	0.0384615384615384	[['pendant']]	0.05063291139240506	0.05063291139240506	0.022026431718061675	0.0	0.029972904383431465
Souza_Adele	902	— Elle prit les deux petites mains de ce dernier enfant, les joignit dans les siennes, en levant les yeux au ciel, et sembla s'unir à leur prière.	95	7	29	3	0.1034482758620689	[['petit'], ['main'], ['oeil']]	0.0625	0.0625	0.022026431718061675	0.0	0.029972904383431465
Souza_Adele	903	Je n'avais pas encore pensé à mon départ;	95	8	9	0	0.0	[]	0.06	0.06	0.022026431718061675	0.0	0.029972904383431465
Souza_Adele	904	jugez de ce que devins, lorsque je l'entendis parler de voyage.	95	9	12	0	0.0	[]	0.0	0.0	0.022026431718061675	0.0	0.029972904383431465
Souza_Adele	905	Elle me trouva encore appuyé sur la porte;	95	10	8	0	0.0	[]	0.0	0.0	0.022026431718061675	0.0	0.029972904383431465
Souza_Adele	906	je ne pouvais revenir de mon saisissement;	95	11	7	0	0.0	[]	0.0	0.0	0.022026431718061675	0.0	0.029972904383431465
Souza_Adele	907	elle devina que je l'avais entendue, et m'emmena dans les jardins.	95	12	13	0	0.0	[]	0.0	0.0	0.022026431718061675	0.0	0.029972904383431465
Souza_Adele	908	Je la suivis sans lui parler;	95	13	6	0	0.0	[]	0.0	0.0	0.022026431718061675	0.0	0.029972904383431465
Souza_Adele	909	elle garda aussi quelque temps le même silence: puis, le rompit tout-à-coup, et me pria de l'écouter avec attention et sans l'interrompre.	95	14	24	0	0.0	[]	0.0	0.0	0.022026431718061675	0.0	0.029972904383431465
Souza_Adele	910	""""	95	15	0	0	0.0	[]	0.0	0.0	0.022026431718061675	0.0	0.029972904383431465
Souza_Adele	911	Lorsque je vous rencontrai , me dit-elle, je fus sensible à l'intérêt que je vous vis témoigner à mes enfants; et dès-lors vous m'en inspirâtes un réel.	96	0	30	0	0.0	[]	0.0	0.0	0.015	0.0	0.03157135758138513
Souza_Adele	912	Le danger que nous courûmes ensemble, et votre sensibilité l'augmentèrent encore, mais la mélancolie qui vous dominait, lorsque vous vîntes ici, me toucha davantage.	96	1	25	0	0.0	[]	0.0	0.0	0.015	0.0	0.03157135758138513
Souza_Adele	913	La première peine, le premier revers influe si essentiellement sur le reste de la vie!	96	2	15	0	0.0	[]	0.016666666666666666	0.016666666666666666	0.015	0.0	0.03157135758138513
Souza_Adele	914	Je craignais que livré à vous-même, seul, dans une terre étrangère, vous ne pussiez résister à cette grande épreuve;	96	3	20	1	0.05	[['grand']]	0.018518518518518517	0.018518518518518517	0.015	0.0	0.03157135758138513
Souza_Adele	915	et je vous voyais près de vous laisser abattre par le malheur, au lieu de chercher à le surmonter.	96	4	19	0	0.0	[]	0.020833333333333332	0.020833333333333332	0.015	0.0	0.03157135758138513
Souza_Adele	916	Je ne connaissais pas la cause de vos chagrins;	96	5	9	0	0.0	[]	0.024390243902439025	0.024390243902439025	0.015	0.0	0.03157135758138513
Souza_Adele	917	j'essayai de pénétrer dans votre cœur, et vous me devîntes vraiment cher.	96	6	13	1	0.0769230769230769	[['pénétrer']]	0.023255813953488372	0.023255813953488372	0.015	0.0	0.03157135758138513
Souza_Adele	918	Vous savez si je ne vous ai pas toujours donné les conseils que je voudrais que mes fils reçussent de vous.	96	7	21	0	0.0	[]	0.018867924528301886	0.018867924528301886	0.015	0.0	0.03157135758138513
Souza_Adele	919	Quel plaisir je ressentais lorsque j'avais adouci votre caractère, rendu vos idées plus justes, vos dispositions plus heureuses!	96	8	19	0	0.0	[]	0.0	0.0	0.015	0.0	0.03157135758138513
Souza_Adele	920	Mais ce bonheur si innocent a été mal interprété;	96	9	9	0	0.0	[]	0.025	0.025	0.015	0.0	0.03157135758138513
Souza_Adele	921	"on m'accuse d'avoir pour vous des sentiment trop tendres… """	96	10	12	1	0.0833333333333333	[['tendre']]	0.045454545454545456	0.045454545454545456	0.015	0.0	0.03157135758138513
Souza_Adele	922	Ah!	96	11	1	0	0.0	[]	0.05	0.05	0.015	0.0	0.03157135758138513
Souza_Adele	923	que je serais heureux, m'écriai-je!	96	12	7	0	0.0	[]	0.0	0.0	0.015	0.0	0.03157135758138513
Souza_Adele	924	Ne m'interrompez pas , me dit-elle, sévèrement;	97	0	8	0	0.0	[]	0.0	0.0	0.019801980198019802	0.0	0.05430808395153629
Souza_Adele	925	et reprenant bientôt sa bonté, sa bienveillance ordinaire, elle ajouta: Mon mari en a pris de l'ombrage, sans que je m'en sois doutée: hier il m'a avoué le tourment qu'il éprouve, et je lui ai promis que vous partiriez aujourd'hui ….	97	1	45	0	0.0	[]	0.014925373134328358	0.014925373134328358	0.019801980198019802	0.0	0.05430808395153629
Souza_Adele	926	"""Non, par pitié, non, lui dis-je, en prenant ses mains dans les miennes;"	97	2	14	1	0.0714285714285714	[['main']]	0.014492753623188406	0.014492753623188406	0.019801980198019802	0.0	0.05430808395153629
Souza_Adele	927	"que deviendrais-je! je suis tout seul au monde!"""	97	3	10	0	0.0	[]	0.019230769230769232	0.019230769230769232	0.019801980198019802	0.0	0.05430808395153629
Souza_Adele	928	— Si même je m'oubliais jusqu'à permettre que vous restassiez près de moi, vous ne pouvez y demeurer toujours: rendons notre séparation utile à tous deux;	97	4	28	0	0.0	[]	0.0	0.0	0.019801980198019802	0.0	0.05430808395153629
Souza_Adele	929	car vous ne voudriez pas faire le malheur de ma vie en troublant le repos de lord B	97	5	18	0	0.0	[]	0.0	0.0	0.019801980198019802	0.0	0.05430808395153629
Souza_Adele	930	….	97	6	1	0	0.0	[]	0.0	0.0	0.019801980198019802	0.0	0.05430808395153629
Souza_Adele	931	Allons, mon jeune ami, du courage, vos chevaux vous attendent ….	97	7	11	0	0.0	[]	0.0	0.0	0.019801980198019802	0.0	0.05430808395153629
Souza_Adele	932	"""Comment, mes chevaux! et qui les a demandés?"	97	8	8	0	0.0	[]	0.0	0.0	0.019801980198019802	0.0	0.05430808395153629
Souza_Adele	933	"…"" — Moi;"	97	9	3	0	0.0	[]	0.03571428571428571	0.03571428571428571	0.019801980198019802	0.0	0.05430808395153629
Souza_Adele	934	ma tendre amitié a voulu vous éviter les préparatifs d'une séparation trop affligeante pour nous …	97	10	17	1	0.0588235294117647	[['tendre']]	0.047619047619047616	0.047619047619047616	0.019801980198019802	0.0	0.05430808395153629
Souza_Adele	935	….	97	11	1	0	0.0	[]	0.10714285714285714	0.10714285714285714	0.019801980198019802	0.0	0.05430808395153629
Souza_Adele	936	""" et détournant ses yeux pleins de larmes, elle se leva."	97	12	10	2	0.2	[['oeil'], ['plein']]	0.06451612903225806	0.06451612903225806	0.019801980198019802	0.0	0.05430808395153629
Souza_Adele	937	J'étais si frappé, je m'attendais si peu à ce prompt éloignement, qu'il ne me vint aucune objection;	97	13	20	0	0.0	[]	0.05263157894736842	0.05263157894736842	0.019801980198019802	0.0	0.05430808395153629
Souza_Adele	938	d'ailleurs, je ne savais que lui obéir.	97	14	8	0	0.0	[]	0.0	0.0	0.019801980198019802	0.0	0.05430808395153629
Souza_Adele	939	"""Elle regagna"	98	0	2	0	0.0	[]	0.0	0.0	0.015915119363395226	0.0	0.03426403946920235
Souza_Adele	940	le château le plus vite qu'il lui était possible; et montant aussitôt avec moi dans la chambre de ses enfants	98	1	21	0	0.0	[]	0.027777777777777776	0.027777777777777776	0.015915119363395226	0.0	0.03426403946920235
Souza_Adele	941	, elle sembla devenir plus calme dans cet asile de paix et d'innocence.	98	2	13	1	0.0769230769230769	[['calme']]	0.031746031746031744	0.031746031746031744	0.015915119363395226	0.0	0.03426403946920235
