Souza_Adele	2604	Le père m'a prié de venir voir son jardin: le terrain était si peu étendu, si précieux, qu'on n'y avait laissé que de petits sentiers où nos pieds pouvaient à peine se placer.	262	13	36	2	0.0555555555555555	[['petit'], ['pied']]	0.043478260869565216	0.043478260869565216	0.02654867256637168	0.0	0.04490331489663639
Souza_Adele	2605	Nous marchions l'un après l'autre; et la famille, jusqu'au dernier petit enfant, nous suivait, comme s'ils entraient dans ce jardin pour la première fois.	262	14	28	1	0.0357142857142857	[['petit']]	0.038461538461538464	0.038461538461538464	0.02654867256637168	0.0	0.04490331489663639
Souza_Adele	2606	Au milieu de ce tableau si touchant, je trouvais quelque chose de triste à ne voir que des arbustes dépouillés, des tiges dont on avait coupé les fleurs, ou quelques boutons prêts à éclore, et impatiemment attendus pour les vendre.	262	15	40	1	0.025	[['triste']]	0.02197802197802198	0.02197802197802198	0.02654867256637168	0.0	0.04490331489663639
Souza_Adele	2607	Cela me présentait l'image d'une existence précaire, dépendante des caprices de la coquetterie et de toutes les variations de l'atmosphère.	262	16	23	0	0.0	[]	0.012048192771084338	0.012048192771084338	0.02654867256637168	0.0	0.04490331489663639
Souza_Adele	2608	Je pensais, pour la première fois, que les inquiétudes du besoin pouvaient être attachées à la croissance d'une fleur!	262	17	20	0	0.0	[]	0.0	0.0	0.02654867256637168	0.0	0.04490331489663639
Souza_Adele	2609	… J'ai abrégé cette promenade qui me devenait pénible.	262	18	10	0	0.0	[]	0.014084507042253521	0.014084507042253521	0.02654867256637168	0.0	0.04490331489663639
Souza_Adele	2610	Revenu près de la maison, j'ai appelé Françoise, et lui ai donné quelques louis pour s'acheter un habit: sa mère les lui a arrachés des mains, en disant qu'il fallait garder cela pour les provisions de l'hiver.	262	19	41	1	0.024390243902439	[['main']]	0.028169014084507043	0.028169014084507043	0.02654867256637168	0.0	0.04490331489663639
Souza_Adele	2611	— J'y aurais songé, lui ai-je dit avec humeur; et j'ai encore donné à ma petite Françoise;	262	20	20	1	0.05	[['petit']]	0.022727272727272728	0.022727272727272728	0.02654867256637168	0.0	0.04490331489663639
Souza_Adele	2612	puis j'ai offert au bon père de quoi habiller tous ses enfants, et j'ai demandé que cette somme ne fût employée qu'à cet usage .	262	21	27	0	0.0	[]	0.02666666666666667	0.02666666666666667	0.02654867256637168	0.0	0.04490331489663639
Souza_Adele	2613	Je m'en allais, lorsque j'ai réfléchi que j'avais pu affliger madame Antoine, en m'occupant plutôt du plaisir des enfants que des besoins du ménage;	262	22	28	1	0.0357142857142857	[['de', 'enfant']]	0.012658227848101266	0.012658227848101266	0.02654867256637168	0.0	0.04490331489663639
Souza_Adele	2614	je sentais que les sollicitudes d'une mère sont encore de l'amour, et que son avarice n'est souvent qu'une sage précaution.	262	23	24	0	0.0	[]	0.039473684210526314	0.039473684210526314	0.02654867256637168	0.0	0.04490331489663639
Souza_Adele	2615	Je suis alors retourné vers elle, et lui ai serré la main: Je reviendrai, lui ai-je dit, pour les provisions de l'hiver.	262	24	24	2	0.0833333333333333	[['serrer'], ['main']]	0.04	0.04	0.02654867256637168	0.0	0.04490331489663639
Souza_Adele	2616	— Ah!	262	25	2	0	0.0	[]	0.0625	0.0625	0.02654867256637168	0.0	0.04490331489663639
Souza_Adele	2617	vous reviendrez, s'est écriée Françoise!	262	26	6	0	0.0	[]	0.0	0.0	0.02654867256637168	0.0	0.04490331489663639
Souza_Adele	2618	Il reviendra, disaient les petits!	262	27	5	0	0.0	[]	0.0	0.0	0.02654867256637168	0.0	0.04490331489663639
Souza_Adele	2619	Vous le promettez, dit le père?	262	28	6	0	0.0	[]	0.0	0.0	0.02654867256637168	0.0	0.04490331489663639
Souza_Adele	2620	Ne nous oubliez pas, dit la mère!	262	29	7	0	0.0	[]	0.05263157894736842	0.05263157894736842	0.02654867256637168	0.0	0.04490331489663639
Souza_Adele	2621	Françoise tenait mon habit, le père une de mes mains, la mère s'était saisie de l'autre, les enfants se pressaient contre mes jambes.	262	30	25	2	0.08	[['main'], ['presser']]	0.03636363636363636	0.03636363636363636	0.02654867256637168	0.0	0.04490331489663639
Souza_Adele	2622	En me voyant ainsi entouré de ces bonnes gens, en pensant au bonheur que je leur avais procuré, j'oubliais mes propres peines;	262	31	23	0	0.0	[]	0.03125	0.03125	0.02654867256637168	0.0	0.04490331489663639
Souza_Adele	2623	et quoique tous mes chagrins vinssent du cœur, je remerciais le ciel d'être né sensible.	262	32	16	0	0.0	[]	0.0	0.0	0.02654867256637168	0.0	0.04490331489663639
Souza_Adele	2624	Après les avoir quittés, je suis revenu tranquille par ce même chemin que j'avais traversé avec tant d'agitation.	263	0	20	0	0.0	[]	0.0	0.0	0.013513513513513514	0.0	0.031219789453508597
Souza_Adele	2625	Le jour était sur son déclin;	263	1	6	0	0.0	[]	0.0	0.0	0.013513513513513514	0.0	0.031219789453508597
Souza_Adele	2626	j'admirais les derniers rayons du soleil: la paix de cette bonne famille avait passé dans mon âme.	263	2	18	0	0.0	[]	0.027777777777777776	0.027777777777777776	0.013513513513513514	0.0	0.031219789453508597
Souza_Adele	2627	Pour un moment, je me suis senti plus fort que l'amour;	263	3	12	1	0.0833333333333333	[['fort']]	0.017857142857142856	0.017857142857142856	0.013513513513513514	0.0	0.031219789453508597
Souza_Adele	2628	car j'ai pensé que, si je ne pouvais pas être heureux sans Adèle, au moins il pouvait y avoir sans elle des moment de satisfaction.	263	4	26	0	0.0	[]	0.0392156862745098	0.0392156862745098	0.013513513513513514	0.0	0.031219789453508597
Souza_Adele	2629	Plus calme, j'ai cru que sa colère était trop injuste pour durer;	263	5	13	1	0.0769230769230769	[['calme']]	0.018518518518518517	0.018518518518518517	0.013513513513513514	0.0	0.031219789453508597
Souza_Adele	2630	et, en repassant devant son appartement, je me suis dit avec une tristesse moins douloureuse:	263	6	15	0	0.0	[]	0.024390243902439025	0.024390243902439025	0.013513513513513514	0.0	0.031219789453508597
Souza_Adele	2631	Si elle a eu pour moi une affection véritable, nous nous raccommoderons bientôt;	263	7	13	0	0.0	[]	0.0	0.0	0.013513513513513514	0.0	0.031219789453508597
Souza_Adele	2632	… et si elle ne m'aimait pas!	263	8	8	0	0.0	[]	0.0	0.0	0.013513513513513514	0.0	0.031219789453508597
Souza_Adele	2633	… si Adèle ne m'aimait pas!	263	9	7	0	0.0	[]	0.0	0.0	0.013513513513513514	0.0	0.031219789453508597
Souza_Adele	2634	ah!	263	10	1	0	0.0	[]	0.0	0.0	0.013513513513513514	0.0	0.031219789453508597
Souza_Adele	2635	qu'au moins je ne prévoie pas mon malheur!	263	11	9	0	0.0	[]	0.0	0.0	0.013513513513513514	0.0	0.031219789453508597
Souza_Adele	2636	P.S	264	0	1	0	0.0	[]	0.0	0.0	0.0	0.0	0.0
Souza_Adele	2637	.	265	0	0	0	0.0	[]	0.0	0.0	0.02631578947368421	0.0	0.027950849718747374
Souza_Adele	2638	Il est dix heures;	265	1	4	0	0.0	[]	0.0	0.0	0.02631578947368421	0.0	0.027950849718747374
Souza_Adele	2639	on vient de me dire que monsieur de Sénange est avec elle;	265	2	12	0	0.0	[]	0.0	0.0	0.02631578947368421	0.0	0.027950849718747374
Souza_Adele	2640	je vais m'y présenter encore.	265	3	6	0	0.0	[]	0.029411764705882353	0.029411764705882353	0.02631578947368421	0.0	0.027950849718747374
Souza_Adele	2641	Il est bien difficile que, chez eux, ils continuent long-temps à ne pas me recevoir.	265	4	16	1	0.0625	[['long']]	0.045454545454545456	0.041666666666666664	0.02631578947368421	0.0	0.027950849718747374
Souza_Adele	2642	LETTRE XXXVI.	266	0	2	0	0.0	[]	0.0	0.045454545454545456	0.0	0.0	0.0
Souza_Adele	2643	Une heure du matin.	267	0	4	0	0.0	[]	0.0	0.0	0.0	0.0	0.0
Souza_Adele	2644	Je la quitte, Henri: c'est cet infernal cocher qui a tout dit;	268	0	13	0	0.0	[]	0.0	0.0	0.014729950900163666	0.0	0.028358101983417566
Souza_Adele	2645	et c'est sa maladroite indiscrétion qui m'a jeté dans toutes les folies que je crois vous avoir écrites.	268	1	20	0	0.0	[]	0.0	0.0	0.014729950900163666	0.0	0.028358101983417566
Souza_Adele	2646	J'ai trouvé Adèle couchée sur un canapé;	268	2	8	0	0.0	[]	0.0	0.0	0.014729950900163666	0.0	0.028358101983417566
Souza_Adele	2647	monsieur de Sénange était près d'elle.	268	3	7	0	0.0	[]	0.0196078431372549	0.0196078431372549	0.014729950900163666	0.0	0.028358101983417566
Souza_Adele	2648	Ma présence, quoiqu'ils m'eussent permis de venir les joindre, a eu l'air de les étonner l'un et l'autre: je me suis assez légèrement excusé de n'être point revenu pour dîner.	268	4	36	1	0.0277777777777777	[['joindre']]	0.03508771929824561	0.03508771929824561	0.014729950900163666	0.0	0.028358101983417566
Souza_Adele	2649	Monsieur de Sénange m'a demandé d'un air froid où j'avais été;	268	5	14	1	0.0714285714285714	[['froid']]	0.05333333333333334	0.05333333333333334	0.014729950900163666	0.0	0.028358101983417566
Souza_Adele	2650	je lui ai répondu que, sans m'en apercevoir, je m'étais trouvé à une trop grande distance pour espérer d'être rentré à temps.	268	6	25	2	0.08	[['grand'], ['rentrer']]	0.05555555555555555	0.05555555555555555	0.014729950900163666	0.0	0.028358101983417566
Souza_Adele	2651	Je me suis mis à leur parler de Françoise, de son père, du jardin….	268	7	15	0	0.0	[]	0.057692307692307696	0.057692307692307696	0.014729950900163666	0.0	0.028358101983417566
Souza_Adele	2652	Pas la plus petite interruption de monsieur de Sénange, ni d'Adèle.	268	8	12	1	0.0833333333333333	[['petit']]	0.0196078431372549	0.0196078431372549	0.014729950900163666	0.0	0.028358101983417566
Souza_Adele	2653	Cependant, lorsque j'en suis venu aux adieux de cette bonne famille, j'ai vu que je faisais quelque impression sur monsieur de Sénange.	268	9	24	0	0.0	[]	0.021739130434782608	0.021739130434782608	0.014729950900163666	0.0	0.028358101983417566
Souza_Adele	2654	Il m'a demandé si j'avais foi aux compensations?	268	10	10	0	0.0	[]	0.0	0.0	0.014729950900163666	0.0	0.028358101983417566
Souza_Adele	2655	— Je ne l'ai pas compris, et l'ai avoué franchement.	268	11	12	0	0.0	[]	0.0	0.0	0.014729950900163666	0.0	0.028358101983417566
Souza_Adele	2656	"— ""Croyez-vous donc, m'a-t-il dit, qu'on puisse enlever une femme aujourd'hui, et réparer ce scandale le lendemain, en secourant une famille?"	268	12	26	0	0.0	[]	0.0	0.0	0.014729950900163666	0.0	0.028358101983417566
Souza_Adele	2657	""" — Ce mot enlever m'a éclairé aussitôt: j'ai regardé Adèle qui baissait les yeux."	268	13	16	0	0.0	[]	0.0	0.0	0.014729950900163666	0.0	0.028358101983417566
Souza_Adele	2658	Je vois, leur ai-je dit, qu'on vous a parlé d'une aventure à laquelle, peut-être, je me suis livré sans réfléchir;	268	14	23	0	0.0	[]	0.0	0.0	0.014729950900163666	0.0	0.028358101983417566
Souza_Adele	2659	mais vous me pardonnerez, j'espère, de n'avoir pas hésité lorsqu'il s'agissait d'arracher quelqu'un au dernier désespoir.	268	15	22	0	0.0	[]	0.0	0.0	0.014729950900163666	0.0	0.028358101983417566
Souza_Adele	2660	Et, sans attendre leur réponse, j'ai tiré de ma poche la lettre d'Eugénie que j'ai lue tout haut.	268	16	21	0	0.0	[]	0.0	0.0	0.014729950900163666	0.0	0.028358101983417566
Souza_Adele	2661	A mesure que j'avançais, l'attendrissement de monsieur de Sénange augmentait;	268	17	12	0	0.0	[]	0.0	0.0	0.014729950900163666	0.0	0.028358101983417566
Souza_Adele	2662	Adèle même a laissé tomber quelques larmes.	268	18	7	0	0.0	[]	0.0	0.0	0.014729950900163666	0.0	0.028358101983417566
Souza_Adele	2663	Lorsque j'ai eu fini, il s'est approché de moi en m'embrassant:	268	19	14	0	0.0	[]	0.0	0.0	0.014729950900163666	0.0	0.028358101983417566
Souza_Adele	2664	"""C'est à vous à nous excuser, m'a-t-il dit, de vous avoir soupçonné, au moment où tant de générosité vous conduisait."	268	20	24	0	0.0	[]	0.0	0.0	0.014729950900163666	0.0	0.028358101983417566
Souza_Adele	2665	Pardonnez-moi, mon jeune ami, je vous aime comme un père, et les meilleurs pères grondent quelquefois mal à propos.	268	21	20	0	0.0	[]	0.0	0.0	0.014729950900163666	0.0	0.028358101983417566
Souza_Adele	2666	""" — Pour Adèle, elle n'allait pas si vite: et elle m'a demandé où j'avais placé cette religieuse."	268	22	20	0	0.0	[]	0.013888888888888888	0.013888888888888888	0.014729950900163666	0.0	0.028358101983417566
Souza_Adele	2667	Dès que j'ai dit qu'elle était partie le matin même pour l'Angleterre, elle a paru soulagée, et a respiré comme si je l'eusse délivrée d'un grand poids.	268	23	32	1	0.03125	[['grand']]	0.015873015873015872	0.015873015873015872	0.014729950900163666	0.0	0.028358101983417566
Souza_Adele	2668	Il fallait, a-t-elle repris, nous mettre dans votre secret;	268	24	11	0	0.0	[]	0.02040816326530612	0.02040816326530612	0.014729950900163666	0.0	0.028358101983417566
Souza_Adele	2669	nous aurions partagé votre bonne action.	268	25	6	0	0.0	[]	0.0	0.0	0.014729950900163666	0.0	0.028358101983417566
Souza_Adele	2670	— Ne me reprochez pas mon silence, lui ai-je répondu, il y a une sorte d'embarras à parler du peu de bien qu'on peut faire.	268	26	28	0	0.0	[]	0.0	0.0	0.014729950900163666	0.0	0.028358101983417566
Souza_Adele	2671	— Pourquoi? a-t-elle reparti vivement, moi, j'en ferais exprès pour vous le dire.	268	27	16	0	0.0	[]	0.0	0.0	0.014729950900163666	0.0	0.028358101983417566
Souza_Adele	2672	— A ces mots, soit que monsieur de Sénange ait aperçu pour la première fois les sentiment d'Adèle, soit qu'en effet quelque douleur soudaine l'ai saisi, il s'est levé en disant qu'il souffrait.	268	28	38	0	0.0	[]	0.013888888888888888	0.013888888888888888	0.014729950900163666	0.0	0.028358101983417566
Souza_Adele	2673	— Je lui ai offert mon bras pour descendre chez lui: il l'a pris sans me répondre.	268	29	18	1	0.0555555555555555	[['bras']]	0.016666666666666666	0.016666666666666666	0.014729950900163666	0.0	0.028358101983417566
Souza_Adele	2674	Elle nous a suivis.	268	30	4	0	0.0	[]	0.023809523809523808	0.023809523809523808	0.014729950900163666	0.0	0.028358101983417566
Souza_Adele	2675	A peine avons-nous été arrivés dans son appartement, qu'il a demandé à se reposer et a renvoyé Adèle.	268	31	20	0	0.0	[]	0.044444444444444446	0.044444444444444446	0.014729950900163666	0.0	0.028358101983417566
Souza_Adele	2676	En sortant, elle m'a salué de la main en signe de paix, et avec un sourire d'une douceur ravissante.	268	32	21	2	0.0952380952380952	[['main'], ['sourire']]	0.03508771929824561	0.03508771929824561	0.014729950900163666	0.0	0.028358101983417566
Souza_Adele	2677	Je me suis avancé vers elle: Pardonnez-moi , avons-nous dit tous deux en même temps.	268	33	16	0	0.0	[]	0.05405405405405406	0.03636363636363636	0.014729950900163666	0.0	0.028358101983417566
Souza_Adele	2678	J'ai été obligé de la quitter aussitôt, car j'ai entendu monsieur de Sénange qui m'appelait.	269	0	18	0	0.0	[]	0.0	0.0	0.010344827586206896	0.0	0.01764224433648896
Souza_Adele	2679	Cependant, lorsque je me suis approché de son lit, il ne m'a point parlé;	269	1	15	0	0.0	[]	0.0	0.0	0.010344827586206896	0.0	0.01764224433648896
Souza_Adele	2680	il se retournait, s'agitait, et gardait le silence.	269	2	9	0	0.0	[]	0.0	0.0	0.010344827586206896	0.0	0.01764224433648896
Souza_Adele	2681	De peur de le gêner, je suis allé m'asseoir un peu loin de lui;	269	3	15	0	0.0	[]	0.0	0.0	0.010344827586206896	0.0	0.01764224433648896
Souza_Adele	2682	j'attendais toujours ce qu'il pouvait avoir à me dire;	269	4	11	0	0.0	[]	0.0	0.0	0.010344827586206896	0.0	0.01764224433648896
Souza_Adele	2683	mais j'ai attendu vainement.	269	5	5	0	0.0	[]	0.0	0.0	0.010344827586206896	0.0	0.01764224433648896
Souza_Adele	2684	Au bout d'une heure, il m'a prié de me retirer, en ajoutant, qu'il ne voulait pas me déranger, et que le lendemain il me parlerait.	269	6	28	0	0.0	[]	0.0	0.0	0.010344827586206896	0.0	0.01764224433648896
Souza_Adele	2685	— Que veut-il me dire?….	269	7	7	0	0.0	[]	0.0	0.0	0.010344827586206896	0.0	0.01764224433648896
Souza_Adele	2686	S'il allait croire mon absence nécessaire!….	269	8	8	0	0.0	[]	0.0	0.0	0.010344827586206896	0.0	0.01764224433648896
Souza_Adele	2687	Ce n'est plus mon bonheur seul que je sacrifierais, c'est Adèle même qu'il faudrait affliger, et jamais je n'en aurai le courage.	269	9	26	0	0.0	[]	0.0	0.0	0.010344827586206896	0.0	0.01764224433648896
Souza_Adele	2688	— Que ma situation est horrible!	269	10	6	0	0.0	[]	0.0	0.0	0.010344827586206896	0.0	0.01764224433648896
Souza_Adele	2689	Chacune des peines de l'amour paraît la plus forte	269	11	10	0	0.0	[]	0.0	0.0	0.010344827586206896	0.0	0.01764224433648896
Souza_Adele	2690	que l'on puisse supporter.	269	12	5	0	0.0	[]	0.025	0.025	0.010344827586206896	0.0	0.01764224433648896
Souza_Adele	2691	A ce bal, lorsque j'ai pensé qu'elle ne m'aimait pas, j'ai cru que c'était le plus grand des malheurs!….	269	13	25	1	0.04	[['grand']]	0.0196078431372549	0.0196078431372549	0.010344827586206896	0.0	0.01764224433648896
Souza_Adele	2692	Hier, quand on parlait de sa maladie, ses souffrances m'accablaient, j'étais prêt à sacrifier et son affection et moi	269	14	21	0	0.0	[]	0.021739130434782608	0.021739130434782608	0.010344827586206896	0.0	0.01764224433648896
Souza_Adele	2693	-	269	15	0	0	0.0	[]	0.0	0.0	0.010344827586206896	0.0	0.01764224433648896
Souza_Adele	2694	même;	269	16	1	0	0.0	[]	0.06666666666666667	0.06666666666666667	0.010344827586206896	0.0	0.01764224433648896
Souza_Adele	2695	il ne me fallait plus rien que de ne pas trembler pour sa vie.	269	17	14	1	0.0714285714285714	[['trembler']]	0.028169014084507043	0.028169014084507043	0.010344827586206896	0.0	0.01764224433648896
Souza_Adele	2696	Aujourd'hui que je serai peut-être condamné à m'éloigner d'elle, si monsieur de Sénange l'exige; que peut-être il portera la prudence jusqu'à vouloir qu'elle ignore que c'est lui qui a ordonné mon départ! que deviendrai-je, lorsqu'en prenant congé d'elle, ses regards me reprocheront de m'en aller volontairement?	269	18	56	1	0.0178571428571428	[['regard']]	0.02564102564102564	0.02564102564102564	0.010344827586206896	0.0	0.01764224433648896
Souza_Adele	2697	… jamais je ne pourrai le supporter….	269	19	8	0	0.0	[]	0.015151515151515152	0.015151515151515152	0.010344827586206896	0.0	0.01764224433648896
Souza_Adele	2698	jamais….	269	20	2	0	0.0	[]	0.0	0.0	0.010344827586206896	0.0	0.01764224433648896
Souza_Adele	2699	LETTRE XXXVII.	270	0	2	0	0.0	[]	0.0	0.0	0.0	0.0	0.0
Souza_Adele	2700	Ce 9 septembre, 6 heures du matin.	271	0	7	0	0.0	[]	0.0	0.0	0.0	0.0	0.0
Souza_Adele	2701	Il n'y avait pas deux heures que j'étais couché, lorsque j'ai entendu frapper à ma porte, et quelqu'un m'appeler vivement.	272	0	25	0	0.0	[]	0.0	0.0	0.024390243902439025	0.0	0.05576614130350677
Souza_Adele	2702	J'ai ouvert aussitôt;	272	1	4	0	0.0	[]	0.0	0.0	0.024390243902439025	0.0	0.05576614130350677
Souza_Adele	2703	et l'on m'a dit de descendre bien vite, que monsieur de Sénange venait d'être frappé d'une attaque d'apoplexie.	272	2	23	0	0.0	[]	0.0	0.0	0.024390243902439025	0.0	0.05576614130350677
Souza_Adele	2704	Je l'ai trouvé sans aucune connaissance.	272	3	7	0	0.0	[]	0.020833333333333332	0.020833333333333332	0.024390243902439025	0.0	0.05576614130350677
Souza_Adele	2705	Le médecin était près de lui: lorsqu'il a rouvert les yeux, je le tenais dans mes bras;	272	4	18	1	0.0555555555555555	[['oeil']]	0.06451612903225806	0.06451612903225806	0.024390243902439025	0.0	0.05576614130350677
Souza_Adele	2706	il m'a regardé long-temps.	272	5	6	1	0.1666666666666666	[['long']]	0.07692307692307693	0.07692307692307693	0.024390243902439025	0.0	0.05576614130350677
Souza_Adele	2707	Ses yeux se fixaient de même sur tout ce qui l'entourait, sans reconnaître personne.	272	6	15	1	0.0666666666666666	[['oeil']]	0.06	0.06	0.024390243902439025	0.0	0.05576614130350677
Souza_Adele	2708	— Le médecin m'a dit qu'il le trouvait fort mal, que son pouls était très-mauvais, et qu'il fallait promptement instruire sa famille de son état.	272	7	29	1	0.0344827586206896	[['fort']]	0.024691358024691357	0.024691358024691357	0.024390243902439025	0.0	0.05576614130350677
Souza_Adele	2709	J'ai chargé une des femmes d'Adèle de l'avertir, n'osant pas y aller moi-même: je sentais que ce n'était pas à moi de lui apprendre le genre de malheur qui la menaçait.	272	8	37	0	0.0	[]	0.015151515151515152	0.011627906976744186	0.024390243902439025	0.0	0.05576614130350677
Souza_Adele	2710	Quel spectacle pour elle, que d'assister à l'effrayante décomposition d'un être qu'elle aime comme son père	273	0	20	0	0.0	[]	0.0	0.0	0.01020408163265306	0.0	0.019641855032959635
Souza_Adele	2711	!	273	1	0	0	0.0	[]	0.02631578947368421	0.02631578947368421	0.01020408163265306	0.0	0.019641855032959635
Souza_Adele	2712	Monsieur de Sénange est défiguré, sans mouvement, sans parole: la douleur de cette malheureuse enfant déchire mon âme;	273	2	18	1	0.0555555555555555	[['défigurer']]	0.03125	0.03125	0.01020408163265306	0.0	0.019641855032959635
Souza_Adele	2713	mais au moins Adèle n'a point de remords, et j'en suis accablé.	273	3	14	0	0.0	[]	0.021739130434782608	0.021739130434782608	0.01020408163265306	0.0	0.019641855032959635
Souza_Adele	2714	Elle ne s'est pas aperçue de la peine qu'elle lui a causée;	273	4	14	0	0.0	[]	0.0	0.0	0.01020408163265306	0.0	0.019641855032959635
Souza_Adele	2715	et moi, j'étais sûr qu'il se couchait mécontent.	273	5	10	0	0.0	[]	0.0	0.0	0.01020408163265306	0.0	0.019641855032959635
Souza_Adele	2716	Il a vu ses larmes;	273	6	5	0	0.0	[]	0.0	0.0	0.01020408163265306	0.0	0.019641855032959635
Souza_Adele	2717	il a entendu ces mots si touchant: Moi, je ferais du bien exprès pour vous le dire!	273	7	17	0	0.0	[]	0.0	0.02857142857142857	0.01020408163265306	0.0	0.019641855032959635
Souza_Adele	2718	Il en aura senti une douleur vive, qui peut-être aura causé son accident.	274	0	13	1	0.0769230769230769	[['vif']]	0.0625	0.030303030303030304	0.02877697841726619	0.0	0.05073260663610035
Souza_Adele	2719	Quelle récompense!….	274	1	3	0	0.0	[]	0.043478260869565216	0.043478260869565216	0.02877697841726619	0.0	0.05073260663610035
Souza_Adele	2720	il m'a reçu comme un fils;	274	2	7	0	0.0	[]	0.0	0.0	0.02877697841726619	0.0	0.05073260663610035
Souza_Adele	2721	et non-seulement j'aime Adèle, mais je n'ai pas même eu la force de cacher mes sentiment!	274	3	18	0	0.0	[]	0.0	0.0	0.02877697841726619	0.0	0.05073260663610035
Souza_Adele	2722	J'ai bien besoin qu'il revienne tout-à-fait à lui, et que je puisse lui dire que nous l'avons toujours chéri, respecté;	274	4	23	0	0.0	[]	0.0	0.0	0.02877697841726619	0.0	0.05073260663610035
Souza_Adele	2723	que jamais nous n'avons été ingrats ni coupables envers lui;	274	5	11	0	0.0	[]	0.04	0.04	0.02877697841726619	0.0	0.05073260663610035
Souza_Adele	2724	et s'il doit mourir de cette maladie, au moins que son dernier regard nous bénisse!	274	6	16	2	0.125	[['mourir'], ['regard']]	0.07142857142857142	0.07142857142857142	0.02877697841726619	0.0	0.05073260663610035
Souza_Adele	2725	….	274	7	1	0	0.0	[]	0.125	0.125	0.02877697841726619	0.0	0.05073260663610035
Souza_Adele	2726	S'il doit mourir, que deviendra Adèle?	274	8	7	1	0.1428571428571428	[['mourir']]	0.043478260869565216	0.043478260869565216	0.02877697841726619	0.0	0.05073260663610035
Souza_Adele	2727	Me sera-t-il permis de m'affliger avec elle, de chercher à la consoler?	274	9	15	0	0.0	[]	0.04	0.04	0.02877697841726619	0.0	0.05073260663610035
Souza_Adele	2728	Son âge….	274	10	3	0	0.0	[]	0.0	0.0	0.02877697841726619	0.0	0.05073260663610035
Souza_Adele	2729	le mien….	274	11	3	0	0.0	[]	0.0	0.0	0.02877697841726619	0.0	0.05073260663610035
Souza_Adele	2730	j'ignore les usages de ce pays….	274	12	8	0	0.0	[]	0.0	0.0	0.02877697841726619	0.0	0.05073260663610035
Souza_Adele	2731	Combien j'aurais besoin de votre amitié et de vos conseils!	274	13	11	0	0.0	[]	0.0	0.0	0.02877697841726619	0.0	0.05073260663610035
Souza_Adele	2732	LETTRE XXXVIII.	275	0	2	0	0.0	[]	0.0	0.0	0.0	0.0	0.0
Souza_Adele	2733	Ce 10 septembre, 5 heures du matin.	276	0	7	0	0.0	[]	0.0	0.0	0.0	0.0	0.0
Souza_Adele	2734	On croit que monsieur de Sénange est un peu mieux;	277	0	10	0	0.0	[]	0.03333333333333333	0.02702702702702703	0.030303030303030304	0.0227272727272727	0.028493400116027866
Souza_Adele	2735	ce qu'il y a de sûr, c'est qu'il a reconnu Adèle, et lui a serré la main.	277	1	20	1	0.05	[['serrer']]	0.0425531914893617	0.0425531914893617	0.030303030303030304	0.0227272727272727	0.028493400116027866
Souza_Adele	2736	Il a plusieurs fois jeté les yeux sur moi, mais sans le plus léger signe d'affection.	277	2	17	1	0.0588235294117647	[['oeil']]	0.03636363636363636	0.03636363636363636	0.030303030303030304	0.0227272727272727	0.028493400116027866
Souza_Adele	2737	Sûrement il m'accuse: puisse-t-il avoir le temps d'apprendre combien mes sentiment ont été purs!	277	3	18	0	0.0	[]	0.02127659574468085	0.02127659574468085	0.030303030303030304	0.0227272727272727	0.028493400116027866
Souza_Adele	2738	J'ai dit, il est vrai, à Adèle que je l'aimais;	277	4	12	0	0.0	[]	0.019230769230769232	0.019230769230769232	0.030303030303030304	0.0227272727272727	0.028493400116027866
Souza_Adele	2739	mais ce mot si tendre, ce mot je vous aime n'appartient-il pas autant à l'amitié qu'à l'amour?	277	5	22	1	0.0454545454545454	[['tendre']]	0.029411764705882353	0.023255813953488372	0.030303030303030304	0.0227272727272727	0.028493400116027866
Souza_Adele	2740	Monsieur de Sénange paraît avoir repris toute sa connaissance;	278	0	9	0	0.0	[]	0.0	0.024390243902439025	0.0	0.0	0.0
Souza_Adele	2741	et cette nuit il a eu des moment de sommeil.	278	1	10	0	0.0	[]	0.0	0.0	0.0	0.0	0.0
Souza_Adele	2742	Adèle ne l'a pas quitté.	278	2	6	0	0.0	[]	0.0	0.0	0.0	0.0	0.0
Souza_Adele	2743	Dans les intervalles, elle lui parlait, le rassurait, cherchait à le distraire;	278	3	12	0	0.0	[]	0.0	0.0	0.0	0.0	0.0
