Souza_Adele	1619	Les enfants ont toutes les passions en miniature.	159	5	8	0	0.0	[]	0.0	0.0	0.014925373134328358	0.0	0.01841934725122586
Souza_Adele	1620	Leur vie est, comme celle des personnes faites, partagée entre le mal, le bien et le mieux.	159	6	17	0	0.0	[]	0.0	0.0	0.014925373134328358	0.0	0.01841934725122586
Souza_Adele	1621	Nous reprenons vigoureusement celles qui annoncent des dispositions fâcheuses;	159	7	9	0	0.0	[]	0.0	0.0	0.014925373134328358	0.0	0.01841934725122586
Souza_Adele	1622	nous montrons, nous conseillons doucement le bien.	159	8	7	0	0.0	[]	0.0	0.0	0.014925373134328358	0.0	0.01841934725122586
Souza_Adele	1623	Ce n'est pas l'obéissance, mais le goût qui doit y porter;	159	9	13	0	0.0	[]	0.0	0.0	0.014925373134328358	0.0	0.01841934725122586
Souza_Adele	1624	et nous louons, nous chérissons celles qui, plus avancées, craient à la perfection, et la cherchent.	159	10	16	0	0.0	[]	0.0	0.0	0.014925373134328358	0.0	0.01841934725122586
Souza_Adele	1625	""""	159	11	0	0	0.0	[]	0.0	0.0	0.014925373134328358	0.0	0.01841934725122586
Souza_Adele	1626	Nous arrivâmes à l'hôpital: représentez-vous, Henri, une voûte immense, éclairée par trois lampes placées à une si juste distance les unes des autres, qu'on y voyait assez, quoique la lumière y fût sans éclat.	160	0	37	0	0.0	[]	0.01818181818181818	0.01818181818181818	0.029045643153526972	0.0	0.04338761417697898
Souza_Adele	1627	Une table fort étroite, et occupant toute la longueur de la salle, était couverte de nappes très-blanches.	160	1	18	1	0.0555555555555555	[['fort']]	0.014705882352941176	0.014705882352941176	0.029045643153526972	0.0	0.04338761417697898
Souza_Adele	1628	Une centaine de pauvres y étaient assis, tous rangés sur la même ligne.	160	2	13	0	0.0	[]	0.017241379310344827	0.017241379310344827	0.029045643153526972	0.0	0.04338761417697898
Souza_Adele	1629	On avait écrit sur les murs des sentences des livres saints, qui invitaient à la charité, et à ne jamais manquer l'occasion d'une bonne œuvre.	160	3	27	0	0.0	[]	0.0	0.0	0.029045643153526972	0.0	0.04338761417697898
Souza_Adele	1630	Dans le milieu de cette salle était un prie-dieu;	160	4	10	0	0.0	[]	0.03278688524590164	0.03278688524590164	0.029045643153526972	0.0	0.04338761417697898
Souza_Adele	1631	après, un socle sur lequel on avait posé un grand bassin rempli d'une soupe assez épaisse pour les nourrir, et cependant fort appétissante.	160	5	24	2	0.0833333333333333	[['grand'], ['fort']]	0.05263157894736842	0.05263157894736842	0.029045643153526972	0.0	0.04338761417697898
Souza_Adele	1632	La supérieure la servit;	160	6	4	0	0.0	[]	0.058823529411764705	0.058823529411764705	0.029045643153526972	0.0	0.04338761417697898
Souza_Adele	1633	quatre jeunes religieuses lui apportaient promptement, et successivement, de petites écuelles de terre qu'elle emplissait, et qu'elles reportaient à chaque pauvre;	160	7	23	1	0.0434782608695652	[['petit']]	0.05555555555555555	0.05555555555555555	0.029045643153526972	0.0	0.04338761417697898
Souza_Adele	1634	ensuite on leur donna à chacun un petit plat, dans lequel était un ragoût mêlé de viande et de légumes, avec deux livres de pain bis-blanc.	160	8	27	2	0.074074074074074	[['petit'], ['plat']]	0.08064516129032258	0.08064516129032258	0.029045643153526972	0.0	0.04338761417697898
Souza_Adele	1635	Pendant leur repas, une jeune pensionnaire fit tout haut une lecture pieuse.	160	9	12	2	0.1666666666666666	[['pendant'], ['haut']]	0.08196721311475409	0.08196721311475409	0.029045643153526972	0.0	0.04338761417697898
Souza_Adele	1636	Le grand silence qui régnait dans cette salle, prouvait également la reconnaissance du pauvre, et le respect des religieuses pour le malheur.	160	10	22	1	0.0454545454545454	[['grand']]	0.06382978723404255	0.06382978723404255	0.029045643153526972	0.0	0.04338761417697898
Souza_Adele	1637	Je m'informai avec soin des revenus et des dépenses de cet établissement.	160	11	13	0	0.0	[]	0.02040816326530612	0.02040816326530612	0.029045643153526972	0.0	0.04338761417697898
Souza_Adele	1638	Vous seriez étonné de peu qu'il en coûte pour faire autant de bien.	160	12	14	0	0.0	[]	0.02631578947368421	0.02631578947368421	0.029045643153526972	0.0	0.04338761417697898
Souza_Adele	1639	A ma prière, la supérieure entra dans les plus grands détails.	160	13	11	1	0.0909090909090909	[['grand']]	0.024390243902439025	0.024390243902439025	0.029045643153526972	0.0	0.04338761417697898
Souza_Adele	1640	Avec quelle modestie elle passait sur les peines que devait lui donner une surveillance si étendue!	160	14	16	0	0.0	[]	0.027777777777777776	0.027777777777777776	0.029045643153526972	0.0	0.04338761417697898
Souza_Adele	1641	C'était toujours des usages qu'elle avait trouvés;	160	15	9	0	0.0	[]	0.0	0.0	0.029045643153526972	0.0	0.04338761417697898
Souza_Adele	1642	des exemples qu'elle avait reçus;	160	16	6	0	0.0	[]	0.0	0.0	0.029045643153526972	0.0	0.04338761417697898
Souza_Adele	1643	des secours et des consolations que ses religieuses lui donnaient .	160	17	10	0	0.0	[]	0.0	0.0	0.029045643153526972	0.0	0.04338761417697898
Souza_Adele	1644	""""	160	18	0	0	0.0	[]	0.0	0.0	0.029045643153526972	0.0	0.04338761417697898
Souza_Adele	1645	Une des premières règles de cette maison, me dit-elle, est de ne rien perdre, et de croire que tout peut servir.	160	19	22	0	0.0	[]	0.02	0.02	0.029045643153526972	0.0	0.04338761417697898
Souza_Adele	1646	Par exemple, après le dîner de nos pensionnaires, une religieuse a le soin de ramasser dans une serviette tous les petits morceaux de pain que les enfants laissent;	160	20	28	1	0.0357142857142857	[['petit']]	0.015384615384615385	0.015384615384615385	0.029045643153526972	0.0	0.04338761417697898
Souza_Adele	1647	car la gourmandise trouve à se placer, même en ne mangeant que du pain sec;	160	21	15	0	0.0	[]	0.017543859649122806	0.017543859649122806	0.029045643153526972	0.0	0.04338761417697898
Souza_Adele	1648	et je suis toujours étonnée du choix et des différences qu'elles y trouvent.	160	22	14	0	0.0	[]	0.0	0.0	0.029045643153526972	0.0	0.04338761417697898
Souza_Adele	1649	On porte ces restes dans le bassin des pauvres;	160	23	9	0	0.0	[]	0.0	0.0	0.029045643153526972	0.0	0.04338761417697898
Souza_Adele	1650	une pensionnaire suit la religieuse, qui se garde bien de lui dire: regardez , mais qui lui montre que tout est utile.	160	24	21	0	0.0	[]	0.0	0.0	0.029045643153526972	0.0	0.04338761417697898
Souza_Adele	1651	Travaillent	160	25	1	0	0.0	[]	0.0	0.0	0.029045643153526972	0.0	0.04338761417697898
Souza_Adele	1652	-elles?	160	26	1	0	0.0	[]	0.1111111111111111	0.1111111111111111	0.029045643153526972	0.0	0.04338761417697898
Souza_Adele	1653	Le plus petit chiffon, un bout de fil est serré, et finit toujours par être employé.	160	27	16	2	0.125	[['petit'], ['serrer']]	0.039473684210526314	0.039473684210526314	0.029045643153526972	0.0	0.04338761417697898
Souza_Adele	1654	En leur faisant ainsi pratiquer ensemble la charité qui ne refuse aucun malheureux, et l'économie qui seule nous met en état de les secourir tous, elles apprennent de bonne heure qu'avec de l'ordre, la fortune la plus bornée peut encore faire du bien; et qu'avec de l'attention, les riches en font chaque jour davantage?	160	28	59	1	0.0169491525423728	[['riche']]	0.04	0.04	0.029045643153526972	0.0	0.04338761417697898
Souza_Adele	1655	""""	160	29	0	0	0.0	[]	0.01694915254237288	0.0136986301369863	0.029045643153526972	0.0	0.04338761417697898
Souza_Adele	1656	Après le souper, qui dura une demi-heure, tous les pauvres se mirent à genoux;	161	0	14	0	0.0	[]	0.043478260869565216	0.043478260869565216	0.09090909090909091	0.0714285714285714	0.08437975443782811
Souza_Adele	1657	et la plus jeune des religieuses, se mettant aussi à genoux devant un prie-dieu, fit tout haut la prière, à laquelle ils répondirent avec une dévotion que leur gratitude augmentait sûrement.	161	1	32	2	0.0625	[['genou'], ['haut']]	0.08620689655172414	0.08620689655172414	0.09090909090909091	0.0714285714285714	0.08437975443782811
Souza_Adele	1658	Je fus frappé de la voix douce et tendre de cette religieuse.	161	2	12	3	0.25	[['voix'], ['douce'], ['tendre']]	0.11320754716981132	0.11320754716981132	0.09090909090909091	0.0714285714285714	0.08437975443782811
Souza_Adele	1659	La pâleur de la mort était sur son visage;	161	3	9	1	0.1111111111111111	[['pâleur']]	0.14285714285714285	0.14285714285714285	0.09090909090909091	0.0714285714285714	0.08437975443782811
Souza_Adele	1660	elle me parut si faible, que je craignais qu'elle n'élevât la voix.	161	4	14	1	0.0714285714285714	[['faible']]	0.08823529411764706	0.08823529411764706	0.09090909090909091	0.0714285714285714	0.08437975443782811
Souza_Adele	1661	Après la prière je lui demandai s'il y avait long	161	5	11	1	0.0909090909090909	[['luire']]	0.07692307692307693	0.07692307692307693	0.09090909090909091	0.0714285714285714	0.08437975443782811
Souza_Adele	1662	-temps	161	6	1	0	0.0	[]	0.1111111111111111	0.1111111111111111	0.09090909090909091	0.0714285714285714	0.08437975443782811
Souza_Adele	1663	qu'elle avait prononcé ses vœux	161	7	6	1	0.1666666666666666	[['prononcer']]	0.14285714285714285	0.14285714285714285	0.09090909090909091	0.0714285714285714	0.08437975443782811
Souza_Adele	1664	.	161	8	0	0	0.0	[]	0.16666666666666666	0.07142857142857142	0.09090909090909091	0.0714285714285714	0.08437975443782811
Souza_Adele	1665	Il y a six mois , me répondit-elle	162	0	8	0	0.0	[]	0.0	0.0	0.05	0.0	0.05248638810814779
Souza_Adele	1666	….	162	1	1	0	0.0	[]	0.05	0.05	0.05	0.0	0.05248638810814779
Souza_Adele	1667	après un long soupir, elle ajouta: j'étais bien jeune alors!	162	2	11	1	0.0909090909090909	[['long']]	0.08333333333333333	0.07692307692307693	0.05	0.0	0.05248638810814779
Souza_Adele	1668	…	163	0	1	0	0.0	[]	0.0	0.0625	0.010416666666666666	0.0	0.021493307799035896
Souza_Adele	1669	et elle s'éloigna.	163	1	4	0	0.0	[]	0.0	0.0	0.010416666666666666	0.0	0.021493307799035896
Souza_Adele	1670	"— ""Ah!"	163	2	2	0	0.0	[]	0.0	0.0	0.010416666666666666	0.0	0.021493307799035896
Souza_Adele	1671	m'écriai-je, en me rapprochant de la supérieure, y en aurait-il parmi vous qui regrettassent leur liberté?	163	3	19	0	0.0	[]	0.027777777777777776	0.027777777777777776	0.010416666666666666	0.0	0.021493307799035896
Souza_Adele	1672	— Ne m'interrogez pas sur ma plus grande peine, me dit-elle en rougissant:	163	4	15	1	0.0666666666666666	[['grand']]	0.017241379310344827	0.017241379310344827	0.010416666666666666	0.0	0.021493307799035896
Souza_Adele	1673	veuillez croire seulement qu'alors ce ne serait pas ma faute, et que je leur donnerais toutes les consolations qui seraient en ma puissance.	163	5	24	0	0.0	[]	0.02040816326530612	0.02040816326530612	0.010416666666666666	0.0	0.021493307799035896
Souza_Adele	1674	Leurs vertus, leur résignation peuvent les rendre heureuses sans moi;	163	6	10	0	0.0	[]	0.0	0.0	0.010416666666666666	0.0	0.021493307799035896
Souza_Adele	1675	mais elles ne sauraient avoir de peines que je ne les partage.	163	7	12	0	0.0	[]	0.022727272727272728	0.022727272727272728	0.010416666666666666	0.0	0.021493307799035896
Souza_Adele	1676	Comme la plus simple religieuse, je n'ai que ma voix pour admettre, ou pour refuser celles qui veulent prendre le voile.	163	8	22	1	0.0454545454545454	[['voix']]	0.02127659574468085	0.02127659574468085	0.010416666666666666	0.0	0.021493307799035896
Souza_Adele	1677	Lorsqu'une vraie dévotion les détermine, elles ne regrettent rien sur la terre.	163	9	13	0	0.0	[]	0.013888888888888888	0.013888888888888888	0.010416666666666666	0.0	0.021493307799035896
Souza_Adele	1678	Mais il est de jeunes novices qu'un excès de ferveur trompe elles-mêmes; et d'autres qui, se fiant à leur courage, renoncent au monde pour des intérêts de famille, et nous le cachent avec soin.	163	10	37	0	0.0	[]	0.0	0.0	0.010416666666666666	0.0	0.021493307799035896
Souza_Adele	1679	Le sort des religieuses qui se repentent est d'autant plus à plaindre, que notre état est le seul dans la vie où il n'y ait jamais de changement, ni aucune espérance.	163	11	33	0	0.0	[]	0.0	0.0	0.010416666666666666	0.0	0.021493307799035896
Souza_Adele	1680	""""	163	12	0	0	0.0	[]	0.0	0.0	0.010416666666666666	0.0	0.021493307799035896
Souza_Adele	1681	Comme elle disait ces mots, Adèle revint avec deux ou trois de ses jeunes compagnes.	164	0	15	0	0.0	[]	0.0	0.0	0.020833333333333332	0.0	0.019882125369526965
Souza_Adele	1682	Ni son retour, ni leur gaieté ne purent dissiper la tristesse que m'avaient inspirée les dernières paroles de la supérieure.	164	1	21	0	0.0	[]	0.021052631578947368	0.021052631578947368	0.020833333333333332	0.0	0.019882125369526965
Souza_Adele	1683	J'en étais encore affecté, lorsqu'elle nous avertit que, le souper des pauvres étant fini, il fallait leur laisser prendre un repos dont ils avaient besoin; et après nous avoir dit adieu, avoir encore embrassé Adèle, qu'elle appelait sa chère fille , elle regagna une grande porte de fer qui sépare l'hôpital de l'intérieur du couvent.	164	2	59	2	0.0338983050847457	[['grand'], ['de', 'fer']]	0.02830188679245283	0.02830188679245283	0.020833333333333332	0.0	0.019882125369526965
Souza_Adele	1684	Elle y entra, et referma cette porte sur elle, avec ce même bruit de verroux, de triple serrure, qui donnait trop l'idée d'une prison.	164	3	26	1	0.0384615384615384	[['triple']]	0.027777777777777776	0.027777777777777776	0.020833333333333332	0.0	0.019882125369526965
Souza_Adele	1685	Je pensai à la douleur que devait éprouver cette jeune religieuse quand, chaque jour, ce bruit lui renouvelait le sentiment de son esclavage.	164	4	23	0	0.0	[]	0.02040816326530612	0.012195121951219513	0.020833333333333332	0.0	0.019882125369526965
Souza_Adele	1686	"Lorsque nous arrivâmes à Neuilly, monsieur de Sénange se fit traîner au-devant de nous, et reçut Adèle avec un plaisir qui prouvait bien l'ennui que lui avait causé son absence: """	165	0	33	0	0.0	[]	0.0	0.0	0.01834862385321101	0.0	0.041026772268531735
Souza_Adele	1687	"Bonjour, mes enfants,"" nous dit-il avec joie."	165	1	9	0	0.0	[]	0.0	0.0	0.01834862385321101	0.0	0.041026772268531735
Souza_Adele	1688	Mon cœur tressaillit en l'entendant nous réunir ainsi, quoique ce fût sûrement sans y avoir pensé.	165	2	17	0	0.0	[]	0.0	0.0	0.01834862385321101	0.0	0.041026772268531735
Souza_Adele	1689	Je lui rendis compte de ce que j'avais vu, des impressions que j'avais ressenties.	165	3	16	0	0.0	[]	0.0	0.0	0.01834862385321101	0.0	0.041026772268531735
Souza_Adele	1690	Mais quand j'en vins à cette jeune religieuse, j'osai le remercier d'avoir sauvé Adèle d'un pareil sort.	165	4	21	0	0.0	[]	0.0	0.0	0.01834862385321101	0.0	0.041026772268531735
Souza_Adele	1691	"""Sans vous, lui dis-je vivement; sans vous, dans six mois, elle aurait été bien malheureuse!"	165	5	16	0	0.0	[]	0.0	0.0	0.01834862385321101	0.0	0.041026772268531735
Souza_Adele	1692	— Et malheureuse pour toujours!	165	6	5	0	0.0	[]	0.0	0.0	0.01834862385321101	0.0	0.041026772268531735
Souza_Adele	1693	""" me répondit-il."	165	7	3	0	0.0	[]	0.0	0.0	0.01834862385321101	0.0	0.041026772268531735
Souza_Adele	1694	— Il la regarda avec attendrissement;	165	8	6	0	0.0	[]	0.05	0.05	0.01834862385321101	0.0	0.041026772268531735
Souza_Adele	1695	son visage était serein, mais des larmes tombaient de ses yeux.	165	9	11	1	0.0909090909090909	[['visage']]	0.10810810810810811	0.10810810810810811	0.01834862385321101	0.0	0.041026772268531735
Souza_Adele	1696	Adèle, entraînée par tant de bonté, se jeta à genoux devant lui, et baisa sa main avec une tendre reconnaissance.	165	10	20	3	0.15	[['genou'], ['main'], ['tendre']]	0.09615384615384616	0.09615384615384616	0.01834862385321101	0.0	0.041026772268531735
Souza_Adele	1697	"""Ma chère enfant, lui dit-il en la pressant contre son cœur, dites-moi que vous ne regrettez pas notre union;"	165	11	21	1	0.0476190476190476	[['presser']]	0.0851063829787234	0.0851063829787234	0.01834862385321101	0.0	0.041026772268531735
Souza_Adele	1698	je ne veux que votre bonheur;	165	12	6	0	0.0	[]	0.02702702702702703	0.02702702702702703	0.01834862385321101	0.0	0.041026772268531735
Souza_Adele	1699	"cherchez, demandez-moi tout ce qui pourra y ajouter!"""	165	13	10	0	0.0	[]	0.0	0.0	0.01834862385321101	0.0	0.041026772268531735
Souza_Adele	1700	— Tant d'émotions firent mal à ce bon vieillard;	165	14	10	0	0.0	[]	0.03571428571428571	0.03571428571428571	0.01834862385321101	0.0	0.041026772268531735
Souza_Adele	1701	il pleurait et tremblait, sans pouvoir parler davantage.	165	15	8	1	0.125	[['trembler']]	0.027777777777777776	0.027777777777777776	0.01834862385321101	0.0	0.041026772268531735
Souza_Adele	1702	Je fis éloigner Adèle, et je donnai à monsieur de Sénange tous les soins que je pus imaginer;	165	16	18	0	0.0	[]	0.029411764705882353	0.029411764705882353	0.01834862385321101	0.0	0.041026772268531735
Souza_Adele	1703	mais il fallut le porter dans son lit.	165	17	8	0	0.0	[]	0.0	0.0	0.01834862385321101	0.0	0.041026772268531735
Souza_Adele	1704	Lorsqu'il fut un peu clamé, il s'endormit.	165	18	9	0	0.0	[]	0.0	0.0	0.01834862385321101	0.0	0.041026772268531735
Souza_Adele	1705	Je revins dans ma chambre, où il me fut impossible de trouver le repos.	165	19	14	0	0.0	[]	0.0	0.0	0.01834862385321101	0.0	0.041026772268531735
Souza_Adele	1706	J'ai lu, je me suis promené;	165	20	7	0	0.0	[]	0.0	0.0	0.01834862385321101	0.0	0.041026772268531735
Souza_Adele	1707	je vous écris depuis trois heures, il en est cinq, et le sommeil est encore bien loin.	165	21	17	0	0.0	[]	0.0	0.0	0.01834862385321101	0.0	0.041026772268531735
Souza_Adele	1708	Cependant, je suis tranquille, satisfait, sans remords.	165	22	7	0	0.0	[]	0.0	0.0	0.01834862385321101	0.0	0.041026772268531735
Souza_Adele	1709	Je ne me crois plus obligé de fuir;	165	23	8	0	0.0	[]	0.0	0.0	0.01834862385321101	0.0	0.041026772268531735
Souza_Adele	1710	j'avais trop peu de confiance en moi-même.	165	24	9	0	0.0	[]	0.0	0.0	0.01834862385321101	0.0	0.041026772268531735
Souza_Adele	1711	Serait-il possible que mon cœur éprouvât jamais un sentiment dont cet excellent homme eût à se plaindre?	165	25	18	0	0.0	[]	0.0	0.0	0.01834862385321101	0.0	0.041026772268531735
Souza_Adele	1712	LETTRE XXIV.	166	0	2	0	0.0	[]	0.0	0.0	0.0	0.0	0.0
Souza_Adele	1713	Neuilly, ce 1er septembre, 2 heures après-midi.	167	0	7	0	0.0	[]	0.0	0.0	0.0	0.0	0.0
Souza_Adele	1714	Vous, mon cher Henri, qui avez eu si souvent à supporter ma détestable humeur, jouissez de la situation nouvelle dans laquelle je me trouve.	168	0	24	0	0.0	[]	0.0	0.0	0.0	0.0	0.0
Souza_Adele	1715	Je suis content de moi, content des autres: j'aime, j'estime tout ce qui m'environne;	168	1	17	0	0.0	[]	0.0	0.0	0.0	0.0	0.0
Souza_Adele	1716	je reçois des preuves continuelles que j'ai inspiré les mêmes sentiment.	168	2	12	0	0.0	[]	0.0	0.0	0.0	0.0	0.0
Souza_Adele	1717	Que faut-il de plus pour être heureux?	168	3	8	0	0.0	[]	0.0	0.0	0.0	0.0	0.0
Souza_Adele	1718	Ce matin, l'esprit encore fortement occupé de tout ce que j'avais vu dans le couvent d'Adèle, j'ai écrit à la supérieure, pour lui demander la permission d'augmenter la fondation de l'hôpital.	169	0	37	0	0.0	[]	0.013888888888888888	0.0125	0.011560693641618497	0.0	0.014973554353954139
Souza_Adele	1719	On y garde, comme je vous l'ai dit, les voyageurs pendant trois jours; et le quatrième, ils sont obligés de quitter cette maison: c'est de ce quatrième jour que je me suis occupé.	169	1	35	1	0.0285714285714285	[['pendant']]	0.010752688172043012	0.010752688172043012	0.011560693641618497	0.0	0.014973554353954139
Souza_Adele	1720	J'ai offert une somme assez considérable pour que l'on puisse leur donner de quoi faire deux jours de route.	169	2	21	0	0.0	[]	0.022222222222222223	0.022222222222222223	0.011560693641618497	0.0	0.014973554353954139
Souza_Adele	1721	A l'obligation qu'ils doivent avoir pour l'asile qui leur a été accordé, ils ajouteront une reconnaissance, peut-être plus vive encore, pour le secours qu'ils recevront au moment de leur départ.	169	3	34	1	0.0294117647058823	[['vif']]	0.011494252873563218	0.011494252873563218	0.011560693641618497	0.0	0.014973554353954139
Souza_Adele	1722	Quand un homme se trouve seul, il est bien plus sensible aux services qu'on lui rend, et dont il jouit, que lorsqu'il partage le même bienfait avec beaucoup d'autres;	169	4	32	0	0.0	[]	0.0125	0.0125	0.011560693641618497	0.0	0.014973554353954139
Souza_Adele	1723	car alors, il croit seulement que c'est un devoir qui a été rempli.	169	5	14	0	0.0	[]	0.0	0.0	0.011560693641618497	0.0	0.014973554353954139
Souza_Adele	1724	J'ai prié l'abbesse de donner cette aumône au nom d' Adèle de Joyeuse , pour qu'on la bénît, et qu'on priât pour son bonheur.	170	0	27	0	0.0	[]	0.0	0.0	0.016853932584269662	0.0	0.03263410441591322
Souza_Adele	1725	Quoique j'aime monsieur de Sénange, j'ai eu plus de plaisir à employer le nom de famille d'Adèle.	170	1	20	0	0.0	[]	0.0	0.0	0.016853932584269662	0.0	0.03263410441591322
Souza_Adele	1726	— Adèle m'occupe uniquement: parle-t-on d'un malheur, d'une peine vivement sentie?	170	2	16	0	0.0	[]	0.0	0.0	0.016853932584269662	0.0	0.03263410441591322
Souza_Adele	1727	je tremble que le cours de sa vie n'en sot pas exempt;	170	3	13	0	0.0	[]	0.0	0.0	0.016853932584269662	0.0	0.03263410441591322
Souza_Adele	1728	et je voudrais qu'il me fût possible de supporter toutes celles qui lui sont réservées.	170	4	16	0	0.0	[]	0.02040816326530612	0.02040816326530612	0.016853932584269662	0.0	0.03263410441591322
Souza_Adele	1729	— S'attendrit-on sur la maladie, sur la mort d'une jeune personne enlevée au monde avant le temps?	170	5	20	1	0.05	[['attendrir']]	0.04081632653061224	0.04081632653061224	0.016853932584269662	0.0	0.03263410441591322
Souza_Adele	1730	je frémis pour Adèle: sa fraîcheur, sa jeunesse ne me rassurent plus assez.	170	6	13	1	0.0769230769230769	[['fraîcheur']]	0.06382978723404255	0.06382978723404255	0.016853932584269662	0.0	0.03263410441591322
Souza_Adele	1731	Et si le mot de bonheur est prononcé devant moi, mon cœur s'émeut;	170	7	14	1	0.0714285714285714	[['prononcer']]	0.047619047619047616	0.047619047619047616	0.016853932584269662	0.0	0.03263410441591322
Souza_Adele	1732	je forme le vœu sincère qu'elle jouisse de tout celui qui m'est destiné!	170	8	15	0	0.0	[]	0.018867924528301886	0.018867924528301886	0.016853932584269662	0.0	0.03263410441591322
Souza_Adele	1733	— Enfin, je l'aime jusqu'à sentir que je ne puis plus souffrir que de ses peines, ni être heureux que par elle.	170	9	24	0	0.0	[]	0.0	0.0	0.016853932584269662	0.0	0.03263410441591322
Souza_Adele	1734	Après avoir fait partir	171	0	4	0	0.0	[]	0.0	0.0	0.0058823529411764705	0.0	0.039621442587516355
Souza_Adele	1735	ma lettre pour le couvent	171	1	5	0	0.0	[]	0.0	0.0	0.0058823529411764705	0.0	0.039621442587516355
Souza_Adele	1736	, je suis descendu chez monsieur de Sénange.	171	2	7	0	0.0	[]	0.0	0.0	0.0058823529411764705	0.0	0.039621442587516355
Souza_Adele	1737	J'avais sans doute cet air satisfait qui suit toujours les bonnes actions;	171	3	13	0	0.0	[]	0.0	0.0	0.0058823529411764705	0.0	0.039621442587516355
Souza_Adele	1738	car il a été le premier à le remarquer, et à m'en faire compliment.	171	4	15	0	0.0	[]	0.0	0.0	0.0058823529411764705	0.0	0.039621442587516355
Souza_Adele	1739	Pour Adèle, elle m'en a tout simplement demandé la raison: sans vouloir la donner, je suis convenu qu'il y en avait une qui touchait mon cœur.	171	5	28	0	0.0	[]	0.0	0.0	0.0058823529411764705	0.0	0.039621442587516355
Souza_Adele	1740	Elle s'est épuisée en recherches, en conjectures.	171	6	8	0	0.0	[]	0.023255813953488372	0.023255813953488372	0.0058823529411764705	0.0	0.039621442587516355
Souza_Adele	1741	Sa curiosité amusait fort le bon vieillard;	171	7	7	1	0.1428571428571428	[['fort']]	0.041666666666666664	0.041666666666666664	0.0058823529411764705	0.0	0.039621442587516355
Souza_Adele	1742	mais elle est restée confondue de me voir rire;	171	8	9	0	0.0	[]	0.022222222222222223	0.022222222222222223	0.0058823529411764705	0.0	0.039621442587516355
Souza_Adele	1743	de m'entendre la prier de me féliciter, et l'assurer en même temps que non-seulement je n'avais vu personne, mais que je n'avais reçu aucune lettre.	171	9	29	0	0.0	[]	0.0	0.0	0.0058823529411764705	0.0	0.039621442587516355
Souza_Adele	1744	— Alors feignant d'être effrayée, elle m'a dit que mes accès de tristesse et de gaieté avaient des symptômes de folie auxquels il fallait prendre garde.	171	10	28	0	0.0	[]	0.0	0.0	0.0058823529411764705	0.0	0.039621442587516355
Souza_Adele	1745	Elle se moquait de moi, et ma paraissait charmante;	171	11	9	0	0.0	[]	0.0	0.0	0.0058823529411764705	0.0	0.039621442587516355
Souza_Adele	1746	sa bonne humeur ajoutait encore à la mienne.	171	12	8	0	0.0	[]	0.0	0.0	0.0058823529411764705	0.0	0.039621442587516355
Souza_Adele	1747	Comme le déjeuner a duré trois fois plus qu'à l'ordinaire, mon valet de chambre a eu le temps de revenir avec la réponse de la supérieure, qu'il m'a remise sans me dire de quelle part.	172	0	39	0	0.0	[]	0.0	0.0	0.005780346820809248	0.0	0.014537095115739484
Souza_Adele	1748	— C'est pour le coup que la curiosité d'Adèle a été à son comble: mais voulant continuer ce badinage, j'ai mis cette lettre dans ma poche sans l'ouvrir.	172	1	32	0	0.0	[]	0.0	0.0	0.005780346820809248	0.0	0.014537095115739484
Souza_Adele	1749	— Adèle me regardait avec inquiétude, me traitant toujours comme un homme en démence.	172	2	14	0	0.0	[]	0.0	0.0	0.005780346820809248	0.0	0.014537095115739484
Souza_Adele	1750	Enfin, cette plaisanterie s'est prolongée sans perdre de sa grâce.	172	3	11	0	0.0	[]	0.0	0.0	0.005780346820809248	0.0	0.014537095115739484
Souza_Adele	1751	Mais, mon cher Henri, malgré votre goût pour les détails, je m'arrête.	172	4	13	0	0.0	[]	0.02	0.02	0.005780346820809248	0.0	0.014537095115739484
