3620	Mandez-nous bien en détail dans quel lieu est la terre de Monsieur votre époux;	11	3478	15	0	0.0	[]
3621	s'il ne pourra point obtenir de Madame sa mère la permission de venir nous rendre une visite à Paris dans le temps de mes couches.	11	3479	26	0	0.0	[]
3622	Vous sentez bien que si j'en étais crue, je n'attendrois pas que vous me prévins	11	3480	17	0	0.0	[]
3623	-	11	3481	0	0	0	[]
3624	siez, etamp;	11	3482	2	0	0.0	[]
3625	que j'aurois une grande joie de conduire chez vous Madame votre mère, mais mon état, etamp;	11	3483	17	1	0.058823529411764705	[['grand']]
3626	le procès de Milord qui se jugera dans peu, ne me permettront pas de quitter Paris avant six ou sept mois, qui me paroî-tront six ou sept siècles.	11	3484	29	0	0.0	[]
3627	Madame Derby etamp;	11	3485	3	0	0.0	[]
3628	"mon époux me chargent d'embrasser <pb n=""277""/> <fw> <hi rend=""small caps"">Clarice.</hi> 263</fw>"	11	3486	15	0	0.0	[]
3629	<O/>pour	11	3487	1	0	0.0	[]
3630	eux	11	3488	1	0	0.0	[]
3631	Monsieur le Baron, etamp;	11	3489	4	0	0.0	[]
3632	je le fais sans scrupule, je n'en aurois pas plus s'il était ici à leur rendre ce ser-vice autrement qu'en idée;	11	3490	25	0	0.0	[]
3633	car sur mon honneur, je l'aime de passion, etamp;	11	3491	10	0	0.0	[]
3634	malgré ma prévention pour ma Clarice, je le crois digne d'elle.	11	3492	12	0	0.0	[]
3635	"<hi rend=""italic"">Nota.</hi>"	11	3493	2	0	0.0	[]
3636	N'allez pas, nous vous en conjurons, vous piquer d'un excès de générosité à l'égard de Sir Derby;	11	3494	20	0	0.0	[]
3637	il avait consenti à vous abandonner l'argent que vous avez sur la ban	11	3495	14	0	0.0	[]
3638	-que de Gênes, pourquoi le lui lais	11	3496	7	0	0.0	[]
3639	"-seriez-vous? <graphic/> <head> <hi rend=""italic"">REPONSE</hi> DE CLARICE <hi rend=""italic;"	11	3497	13	0	0.0	[]
3640	"small caps"">a"	11	3498	2	0	0.0	[]
3641	Lady	11	3499	1	0	0.0	[]
3642	"Hariote.</hi> </head> <hi rend=""small caps""> <hi rend=""caps"" type=""initials"">Q</hi>Ue</hi> ne vous dois-je pas, chère amie, pour m'avoir conservé ma mère aux dépends de vos jours, etamp;"	11	3500	31	0	0.0	[]
3643	"quelles actions de grâces ne dois-je pas rendre à Dieu tous les jours de <pb n=""278""/> <fw>264 <hi rend=""small caps"">La Nouvelle</hi> </fw> <O/>ma vie pour vous avoir préservée des suites que devait avoir votre coura-geuse amitié?"	11	3501	41	0	0.0	[]
3644	Et vous Milord, mon généreux protecteur, comment recon	11	3502	8	0	0.0	[]
3645	-naître tant de fatigues, tant d'inquié	11	3503	7	0	0.0	[]
3646	-tudes etamp	11	3504	2	0	0.0	[]
3647	;	11	3505	0	0	0	[]
3648	tant de soins?	11	3506	3	0	0.0	[]
3649	Quitter une épouse chérie, dans les circonstances critiques où était la vôtre, la sacrifier, pour ainsi dire, en lui permettant de s'exposer comme elle a fait, ah!	11	3507	28	0	0.0	[]
3650	c'en est trop, etamp;	11	3508	5	0	0.0	[]
3651	la multitude de vos bien-faits me réduit à l'ingratitude: avec tous les sentiments de la plus vive réconnaissance, je sens que je suis fort au dessous de mes obligations.	11	3509	30	2	0.06666666666666667	[['vif'], ['fort']]
3652	Que Dieu soit votre récompense, c'est ce que je lui demande presque aussi souvent que je respire.	11	3510	18	0	0.0	[]
3653	J'espère qu'il aura été celle de la pauvre Mistriss Cosby;	11	3511	12	0	0.0	[]
3654	elle avait commencé tard à travailler à la vigne du Seigneur;	11	3512	11	0	0.0	[]
3655	mais ce bon père de famille veut bien payer ceux qui commencent à la sixième heure, comme ceux qui ont supporté le poids du jour, pourvu qu'ils aient travaillé avec ardeur: je lui rendrai toute ma vie mes actions de grâces pour cette pauvre pénitente qui m'a tirée du précipice où j'allois tomber.	11	3513	56	0	0.0	[]
3656	"Elle obtiendra pour son fils la grâce <pb n=""279""/> <fw> <hi rend=""small caps"">Clarice.</hi> 265</fw> <O/>la persévérance, etamp;"	11	3514	20	0	0.0	[]
3657	si mes faibles prières sont agréables au Seigneur, il répa	11	3515	10	1	0.1	[['faible']]
3658	-rera par une vraie pénitence	11	3516	5	0	0.0	[]
3659	, les éga-rements de sa jeunesse.	11	3517	6	0	0.0	[]
3660	Ce malheureux jeune homme avait eu de bons prin	11	3518	9	0	0.0	[]
3661	-cipes	11	3519	1	0	0.0	[]
3662	, à ce que sa mère m'a assurée, etamp;	11	3520	9	0	0.0	[]
3663	il y avait lieu d'espérer que les semen-ces vertueuses qui avaient été comme étouffées par la fougue des passions, porteroient à la fin d'heureux fruits.	11	3521	28	1	0.03571428571428571	[['fin']]
3664	Plût à Dieu que je pusse acheter aux dépens de tout mon sang, une pas	11	3522	15	0	0.0	[]
3665	-reille grâce pour mon infortuné père.	11	3523	6	0	0.0	[]
3666	Malheur, Malheur à ceux qui ont gâté sa jeunesse, etamp;	11	3524	10	0	0.0	[]
3667	répandu dans son esprit l'irréligion, source de toutes ses fautes.	11	3525	11	0	0.0	[]
3668	Hélas!	11	3526	1	0	0.0	[]
3669	comme Milord l'a remarqué, il faut un miracle;	11	3527	9	0	0.0	[]
3670	je me dévouerois volontiers pour l'obtenir, à l'indigence la plus complete: jugez avec quel plaisir je sacrifierai le super-flu.	11	3528	21	0	0.0	[]
3671	Je suis résolue à ne réclamer aucune partie de mon bien.	11	3529	11	0	0.0	[]
3672	Je veux prouver à mon père l'excellence de cette religion, qu'il méprise, plus par mes exemples que par mes paroles.	11	3530	22	0	0.0	[]
3673	Je ne lui demanderai pour prix du sacrifice que je lui fais de toute mon âme, que le retour de sa tendresse, etamp;	11	3531	23	0	0.0	[]
3674	"la liberté de lui donner de temps en <pb n=""280""/> <fw>266 <hi rend=""small caps"">La Nouvelle</hi> </fw> <O/>temps des preuves de la mienne."	11	3532	25	0	0.0	[]
3675	Mon époux applaudit à ma résolution, son désintéressement passe tout ce qui se peut imaginer, etamp;	11	3533	16	0	0.0	[]
3676	j'ose dire que ce n'est pas la seule vertu dans laquelle il soit supérieur aux autres hommes: chaque jour, chaque heure me décou-vre en lui de nouvelles perfections.	11	3534	31	0	0.0	[]
3677	Pourrois -je souhaiter quelque chose avec un tel partage?	11	3535	9	0	0.0	[]
3678	Comme j'ai été extrêmement fati	11	3536	6	0	0.0	[]
3679	-guée de la mer, je suis forcée de rester quelques jours à Bordeaux pour me reposer, etamp;	11	3537	17	0	0.0	[]
3680	je profite de ce temps pour vous achever le récit de mes aventures.	11	3538	13	0	0.0	[]
3681	Monsieur Beker vous a instruite du contretemps qui nous empêcha de profiter de l'asile qu'il nous avait mé	11	3539	20	0	0.0	[]
3682	-nagé chez sa mère.	11	3540	4	0	0.0	[]
3683	Nous arrivâmes dans le village qu'elle habitait, sur les cinq heures du matin, etamp;	11	3541	15	0	0.0	[]
3684	j'étais si fatiguée, que je fus forcée de me re-poser quelques heures dans un mauvais cabaret, la bonne Dame à laquelle nous étions adressés, étant si pauvre qu'elle n'avait point de domestiques, etamp; avait emporté par conséquent les clefs de son chétif appartement.	11	3542	46	0	0.0	[]
3685	"Après avoir donné quelques heures au som-meil, il fallut délibérer sur le parti que <pb n=""281""/> <fw> <hi rend=""small caps"">Clarice.</hi> 267</fw> <O/>nous avions à prendre."	11	3543	29	0	0.0	[]
3686	Vous savez que j'avais fort peu d'argent, etamp;	11	3544	10	2	0.2	[['fort'], ['de', 'argent']]
3687	je sentais que je n'étais nullement ça-pable de faire un grand chemin à pied.	11	3545	16	1	0.0625	[['grand']]
3688	Mon dessein était de me retirer au-près du bon fermier Ryding;	11	3546	12	0	0.0	[]
3689	mais il y avait soixante milles du lieu où nous étions, etamp;	11	3547	12	0	0.0	[]
3690	après avoir récompensé notre guide, il ne nous eût pas resté assez d'argent pour acheter des che-vaux.	11	3548	19	1	0.05263157894736842	[['de', 'argent']]
3691	L'honnête homme qui nous avait accompagnés parut si sensible à notre embarras, que nous crûmes pouvoir nous ouvrir à lui.	11	3549	21	0	0.0	[]
3692	J'ai des effets considérables, lui dit mon époux, mais des raisons très-fortes m'empê	11	3550	16	1	0.0625	[['fort']]
3693	-chent de les vendre: ne connoîtriez-vous point aux environs	11	3551	10	0	0.0	[]
3694	quelque Juif qui voulût nous avancer une somme en gardant quelques-uns de nos bijoux	11	3552	14	0	0.0	[]
3695	;	11	3553	0	0	0	[]
3696	car je ne voudrais pas les mettre chez un Orfevre?	11	3554	10	0	0.0	[]
3697	Notre guide rêva un peu, puis il nous dit: Je suis bien sûr que Monsieur Beker ne se serait point mêlé de vous si vous n'é	11	3555	27	0	0.0	[]
3698	-tiez d'honnêtes gens, ainsi je m'offre à vous rendre ce service;	11	3556	13	0	0.0	[]
3699	il y a à douze milles d'ici un Juif que je connais, parce que je l'ai servi, il est fort riche, etamp;	11	3557	24	2	0.08333333333333333	[['fort'], ['riche']]
3700	"sait bien que pour tout <pb n=""282""/> <fw>268 <hi rend=""small caps"">La Nouvelle</hi> </fw> <O/>l'or du monde, je ne voudrais pas faire un mauvais commerce."	11	3558	28	0	0.0	[]
3701	Donnez-moi ce que vous voulez mettre en gage, je le lui porterai, si vous voulez vous fier à moi, s'entend.	11	3559	22	0	0.0	[]
3702	Il serait encore plus à propos que vous vinssiez jusques là, cela ne vous écartera pas beaucoup de la route que vous voulez prendre, vous resterez dans un village qui sert de fauxbourg à la ville, etamp;	11	3560	37	0	0.0	[]
3703	vous ver-rez s'il vous convient de prendre ce qu'on vous offrira.	11	3561	14	0	0.0	[]
3704	Comme cette ville n'était point sur la grande route, qu'elle nous avançait de neuf milles dans le chemin que nous voulions prendre, nous suivîmes le conseil de cet homme.	11	3562	31	1	0.03225806451612903	[['grand']]
3705	Nous louâmes des che- vaux, etamp;	11	3563	6	0	0.0	[]
3706	dès le lendemain nous nous y rendîmes.	11	3564	7	0	0.0	[]
3707	J'avais un collier de perles estimé quatorze cents livres sterling;	11	3565	11	0	0.0	[]
3708	nous le remîmes à notre guide avec la riche robe que j'avais sur moi lors-que je m'échappai, etamp;	11	3566	21	1	0.047619047619047616	[['riche']]
3709	il porta le tout à son Juif, auquel il dit que des personnes qui étaient venu passer l'été dans un village proche du sien, se trouvant en besoin d'argent, lui avaient confié ces effets, etamp;	11	3567	37	1	0.02702702702702703	[['de', 'argent']]
3710	deman-doient cinq cents livres sterling dessus, pour six mois.	11	3568	10	0	0.0	[]
3711	"Le Juif ne fit aucune <pb n=""283""/> <fw> <hi rend=""small caps"">Clarice.</hi> 269</fw> <O/>difficulté de prêter cette somme sur un effet qui valait deux fois autant, etamp;"	11	3569	29	0	0.0	[]
3712	notre guide nous remit quatre cents livres en billets de banque, etamp;	11	3570	12	0	0.0	[]
3713	le reste en or.	11	3571	4	0	0.0	[]
3714	Mon époux me mit le tout entre les mains, etamp;	11	3572	10	1	0.1	[['main']]
3715	je donnai sur le champ dix guinées à notre conducteur, qui me combla de bénédictions.	11	3573	15	0	0.0	[]
3716	En-suite nous cachâmes nos billets de banque dans un des plis de ma robe où ils furent cousus, etamp;	11	3574	20	0	0.0	[]
3717	mon époux prit la même précaution par rapport à notre or qu'il cousit dans différentes parties de son habit, parce qu'ayant à faire une route de traverse, il fallait éviter les mauvaises rencontres.	11	3575	35	0	0.0	[]
3718	Le reste de mes diamants fut mis dans un coin de la chaise que nous louâ-mes, etamp;	11	3576	18	0	0.0	[]
3719	nous fîmes la moitié de notre chemin sans aucun contretemps.	11	3577	10	0	0.0	[]
3720	Arrivés à Staford, nous commençâmes à respirer;	11	3578	7	0	0.0	[]
3721	une journée suffisait pour nous conduire chez Monsieur Ryding, etamp;	11	3579	10	0	0.0	[]
3722	nous croyions toucher à la fin de nos peines: je dirais presque que les plus sensibles me restaient à essuyer.	11	3580	20	1	0.05	[['fin']]
3723	Ce fut un Samedi au soir que nous arrivâmes à Staford, etamp;	11	3581	12	0	0.0	[]
3724	j'avais un grand désirs d'entendre la messe avant de partir le lendemain.	11	3582	14	1	0.07142857142857142	[['grand']]
3725	"L'hôtesse qui <pb n=""284""/> <fw>270 <hi rend=""small caps"">La Nouvelle</hi> </fw> <O/>était fort obligeante, étant montée dans ma chambre pour m'offrir ses services, je l'invitai à prendre une tasse de thé avec moi, etamp;"	11	3583	39	1	0.02564102564102564	[['fort']]
3726	comme elle parut sensible à ma politesse, je me hasardai à lui demander s'il y avait beaucoup de catholiques dans cet endroit.	11	3584	23	0	0.0	[]
3727	Apparemment que Madame l'est, me répondit-elle, etamp;	11	3585	9	0	0.0	[]
3728	que la cir-constance du Dimanche vous engage à me faire cette question.	11	3586	13	0	0.0	[]
3729	Je lui avouai qu'elle avait deviné, etamp;	11	3587	8	0	0.0	[]
3730	elle ne put s'empêcher de m'embrasser à cet aveu.	11	3588	11	0	0.0	[]
3731	Elle me dit qu'il y avait à Staford un certain nombre de catho-liques qui y entretenaient un aumônier.	11	3589	20	0	0.0	[]
3732	Que comme ils étaient fort tranquilles, etamp; que dans les dernières rebellions ils avaient montré beaucoup de fidé-lité, on leur laissait librement exercer leur religion.	11	3590	26	1	0.038461538461538464	[['fort']]
3733	On l'appela dans la cuisine, etamp;	11	3591	7	0	0.0	[]
3734	m'ayant souhaité le bon soir elle me quitta après m'avoir fait don-ner de quoi écrire.	11	3592	18	0	0.0	[]
3735	Il était neuf heures, on nous servit un morceau dans notre chambre, etamp;	11	3593	13	0	0.0	[]
3736	je me hâtois de souper pour commencer à me jus-tifier auprès de vous, lorsque cette femme monta d'un air effrayé dans ma chambre, etamp;	11	3594	26	0	0.0	[]
3737	"me dit: Ma chère <pb n=""285""/> <fw> <hi rend=""small caps"">Clarice.</hi> 271</fw> <O/>Dame, j'ai tout d'un coup senti une grande inclination pour vous, quand je vous ai vue, etamp;"	11	3595	33	1	0.030303030303030304	[['grand']]
3738	je serais au déses	11	3596	4	0	0.0	[]
3739	-poir qu'il vous arrivât quelque mal-heur dans ma maison.	11	3597	10	0	0.0	[]
3740	Parlez-moi franchement:	11	3598	3	0	0.0	[]
3741	Auriez-vous quelque mauvaise affaire?	11	3599	5	0	0.0	[]
3742	Quand j'aurois eu dessein de nier la vérité, la pâleur de mon visage, m'eût certainement tra-hie.	11	3600	19	2	0.10526315789473684	[['pâleur'], ['visage']]
3743	Ecoutez, continua-t-elle, je ne demande qu'à vous rendre service, etamp;	11	3601	13	0	0.0	[]
3744	je ne saurais croire que vous soyez coupable du crime dont on vous accuse.	11	3602	14	0	0.0	[]
3745	Lorsque vous êtes descendue de votre voiture, il y avait un homme qui ne faisait que d'arriver à cheval	11	3603	20	0	0.0	[]
3746	, il vous a beaucoup examinée, etamp;	11	3604	6	0	0.0	[]
3747	lorsque votre cocher est venu sou-per, il lui a demandé si vous ne veniez pas du côté de Londres.	11	3605	20	0	0.0	[]
3748	Et pourquoi me faites-vous cette question, lui a répondu votre cocher?	11	3606	12	0	0.0	[]
3749	C'est que je serais bien trompé, a-t-il répondu, si ce n'est pas la jeune personne dont on a mis le signalement dans les papiers publics;	11	3607	29	0	0.0	[]
3750	elle vaudrait la peine d'être arrêtée, on dit qu'elle a voulu empoi- sonner son père.	11	3608	17	0	0.0	[]
3751	Et que m'importe à moi, répondit le cocher, elle me paie bien, etamp;	11	3609	14	0	0.0	[]
3752	"tous ceux qui me paient <pb n=""286""/> <fw>272 <hi rend=""small caps"">La Nouvelle</hi> </fw> <O/>bien, je les crois honnêtes gens."	11	3610	22	0	0.0	[]
3753	Je ne suis pas si crédule, a répondu l'au-tre;	11	3611	11	0	0.0	[]
3754	mais j'en aurai le cœur net.	11	3612	7	0	0.0	[]
3755	Voyez donc, ma chère	11	3613	4	0	0.0	[]
3756	Dame	11	3614	1	0	0.0	[]
3757	, si vous auriez quelque chose à craindre, etamp;	11	3615	8	0	0.0	[]
3758	comptez sur ma discrétion.	11	3616	4	0	0.0	[]
3759	Le Baron prenant son parti sur le champ dit à cette femme: je ne vous dissimu-lerai pas qu'un mariage d'inclination a brouillé mon épouse avec une famille puissante;	11	3617	31	0	0.0	[]
3760	mais vous avez jugé en brave etamp;	11	3618	7	0	0.0	[]
3761	honnête personne, qu'elle n'est pas capable du crime dont ce misérable ose l'accuser.	11	3619	16	0	0.0	[]
3762	J'avoue pour-tant que je serais au désespoir qu'elle retombât au pouvoir de ses parents avant de s'être réconciliée avec eux;	11	3620	24	0	0.0	[]
3763	ainsi, Madame, vous acquerrez un droit éternel à notre réconnaissance, si vous voulez bien nous aider à échapper aux regards du curieux qui nous à examinés.	11	3621	26	2	0.07692307692307693	[['droit'], ['regard']]
3764	Je vais vous parler plus ouvertement, reprit cette femme.	11	3622	9	0	0.0	[]
3765	Ce misérable a dit à mon mari lors	11	3623	8	0	0.0	[]
3766	-qu'il a eu un coup dans la tête, qu'il y avait mille livres sterling à gagner pour celui qui vous arrêterait, etamp;	11	3624	24	1	0.041666666666666664	[['tête']]
3767	il prétend qu'il ne laissera pas échapper cette aubaine, etamp;	11	3625	11	0	0.0	[]
3768	"qu'après vous avoir encore examinée demain au matin, <pb n=""287""/> <fw>"	11	3626	14	0	0.0	[]
3769	"<hi rend=""small caps"">Clarice.</hi> 273</fw> <O/>il avertiroit un Connétable, pour vous faire arrêter."	11	3627	13	0	0.0	[]
3770	Mon avis serait donc que vous profitassiez de la nuit pour vous échapper, etamp;	11	3628	14	0	0.0	[]
3771	comme Ma-dame est d'une figure très	11	3629	8	1	0.125	[['figure']]
3772	-remarqua-blé	11	3630	2	0	0.0	[]
3773	, je pense qu'elle devrait déguiser son sexe.	11	3631	8	0	0.0	[]
3774	J'ai un fils à peu près de sa taille, je l'accommoderai d'un de ses habits etamp;	11	3632	19	1	0.05263157894736842	[['taille']]
3775	de sa redingote;	11	3633	3	0	0.0	[]
3776	vous quit-terez le grand chemin, il fait un peu de Lune, vous pourrez couper à tra-vers champs, en tirant toujours sur votre gauche, c'est un chemin extrê-mement détourné, etamp; peu fréquenté, il n'y a pas d'apparence qu'on vous y cherche.	11	3634	47	1	0.02127659574468085	[['grand']]
3777	Et pendant tout ce solilo-que, votre pauvre amie versait des larmes qui firent couler celles de notre charitable hôtesse;	11	3635	20	1	0.05	[['pendant']]
3778	mon époux désespéré de ma situation, m'embras-soit en me conjurant de reprendre cou-rage.	11	3636	16	1	0.0625	[['cou']]
3779	La Providence, me disait-il, se déclare pour nous, puisqu'elle a inspiré à Madame le généreux dessein de nous aider, etamp;	11	3637	22	0	0.0	[]
3780	en même temps, tirant de son doigt une jolie bague que je lui avais donnée, etamp; qui pouvait valoir dix pièces, il la pria de l'accepter comme une légère preuve de notre réconnaissance.	11	3638	34	1	0.029411764705882353	[['doigt']]
3781	"Elle en fit d'abord dif- <pb n=""288""/> <fw>274 <hi rend=""small caps"">La Nouvelle</hi> </fw> <O/>ficulté, cependant je m'aperçu que ce petit présent donnait un nouveau degré de chaleur à son zèle."	11	3639	35	1	0.02857142857142857	[['petit']]
3782	Elle se hâta de m'apporter les habits de son fils, etamp;	11	3640	12	0	0.0	[]
3783	m'en revêtit elle-même.	11	3641	4	0	0.0	[]
3784	Le Baron eût donné toutes choses au monde pour avoir un cheval, mais c'eût été nous exposer à faire suivre nos traces.	11	3642	23	0	0.0	[]
3785	Nous remerciâmes mille fois la bonne hôtesse, qui nous con-duisit elle-même par une porte de der-riere, etamp;	11	3643	19	1	0.05263157894736842	[['con']]
3786	nous fit traverser une lande d'un quart de mille, après quoi elle nous désigna, du mieux qu'il lui fut possible, des sentiers qui devaient nous conduire proche de Flint, dans la Principauté de Galles.	11	3644	36	0	0.0	[]
3787	Vous n'aurez que la première nuit de pénible, nous dit-elle, etamp;	11	3645	13	0	0.0	[]
3788	une fois écartés d'une douzaine de milles de cette route, il vous sera facile de trouver un cheval.	11	3646	19	0	0.0	[]
3789	Lorsque cette femme nous eut quittés, une foule d'idées vinrent m'assaillir.	11	3647	13	0	0.0	[]
3790	Etoit-ce donc la petite fille du Comte d'Asaph, cette riche héritière qui se trouvait au milieu de la nuit exposée à de pareilles aventures?	11	3648	26	2	0.07692307692307693	[['petit'], ['riche']]
3791	Si cette pensée était décourageante, celle qui suivit fut bien consolante.	11	3649	11	0	0.0	[]
3792	"Quelles ressources la Providence m'a-t-elle <pb n=""289""/> <fw> <hi rend=""small caps"">Clarice.</hi> 275</fw> <O/>ménagées dans mon malheur!"	11	3650	22	0	0.0	[]
3793	Que serais-je devenue si je fusse tombée entre les mains d'un mal-honnête homme, d'un rustre?	11	3651	18	1	0.05555555555555555	[['main']]
3794	il serait déjà rebuté des périls qu'il aurait à courir en cher-chant à me sauver, etamp;	11	3652	18	0	0.0	[]
3795	peut-être ce que j'aurois à en espérer de plus avan	11	3653	11	0	0.0	[]
3796	-tageux	11	3654	1	0	0.0	[]
3797	, serait d'en être abandonnée dans ces lieux écartés, malheur que sa conduite m'aurait peut-être fait re-garder comme un bonheur.	11	3655	21	0	0.0	[]
3798	Le Baron, mon tendre époux, ne me laissa pas long-temps dans ces pensées.	11	3656	14	2	0.14285714285714285	[['tendre'], ['long']]
3799	Que je souffre, ma chère Clarice, me dit-il, de l'extrémité où vous êtes!	11	3657	15	1	0.06666666666666667	[['extrémité']]
3800	Comment, dans l'état où vous ont réduit vos malheurs, aurez-vous la force de faire un si long chemin?	11	3658	20	1	0.05	[['long']]
3801	Si vous vous-liez me permettre de vous soulager de temps en temps, j'aurois moins d'inquiétude.	11	3659	18	0	0.0	[]
3802	Je suis dans la force de l'âge, vous êtes d'une délicatesse qui doit vous rendre fort légère, je pour-rois vous épargner une partie de la fatigue en vous portant;	11	3660	32	1	0.03125	[['fort']]
3803	un fardeau si précieux adouciroit pour moi la longueur du chemin.	11	3661	11	0	0.0	[]
3804	Cet excès de tendresse sembla me rendre une nou-velle vigueur.	11	3662	11	0	0.0	[]
3805	Que me proposez-vous, mon cher, lui dis-je?	11	3663	9	0	0.0	[]
3806	"Croyez-vous <pb n=""290""/> <fw>276 <hi rend=""small caps"">La Nouvelle</hi> </fw> <O/>que je voulusse ménager une vie déjà si traversée aux dépens de la vôtre?"	11	3664	27	0	0.0	[]
3807	Non, si le Ciel a décrété ma perte, j'aime mieux mourir de fatigue, que de la douleur de vous voir succomber sous celle que je vous aurois causée.	11	3665	29	1	0.034482758620689655	[['mourir']]
3808	Mais pourquoi présumer si mal de mon courage etamp;	11	3666	9	0	0.0	[]
3809	de ma force?	11	3667	3	0	0.0	[]
3810	Dans des temps plus heureux, j'eusse regardé la route que je suis obligée de faire à pied comme une promenade: j'a-voue que les malheurs que je viens d'essuyer ont affaibli mon tempéra-ment;	11	3668	37	1	0.02702702702702703	[['pied']]
3811	mais par la raison des contraires, les événements favorables qui ont été la suite de mes infortunes doivent me rendre ma vigueur.	11	3669	22	0	0.0	[]
3812	Mes peines présentes ont produit tout le bonheur de ma vie, pouvais-je trop l'acheter?	11	3670	16	0	0.0	[]
3813	Le Baron,	11	3671	2	0	0.0	[]
3814	sans considérer le lieu où nous étions, était à mes pieds pour me témoigner sa vive réconnaissance;	11	3672	17	2	0.11764705882352941	[['pied'], ['vif']]
3815	je m'efforçais de le relever, lorsqu'un bruit que nous entendîmes assez pro-che de nous, l'engagea à se mettre en état de défense;	11	3673	25	1	0.04	[['relever']]
3816	car j'ai oublié de vous dire qu'il s'était muni d'une paire de pistolets.	11	3674	17	0	0.0	[]
3817	"La Lune donnait si peu de clarté que nous entendîmes ce bruit quelques minutes avant d'ap- <pb n=""291""/>"	11	3675	19	0	0.0	[]
3818	"<fw> <hi rend=""small caps"">Clarice.</hi> 277</fw> <O/>percevoir ce qui le causait, en sorte que nous nous trouvâmes vis-à-vis de trois hommes qui nous parurent d'assez mau-vaise mine, etamp;"	11	3676	31	0	0.0	[]
3819	qui ne prirent pas de nous une idée plus avantageuse.	11	3677	10	0	0.0	[]
3820	Nous demeurâmes tous immobiles à nous regarder de la tête aux pieds, etamp;	11	3678	13	2	0.15384615384615385	[['tête'], ['pied']]
3821	un de ces trois hommes dit en français  à ses compagnons.	11	3679	12	0	0.0	[]
3822	Qu'avons nous à craindre, ils ne sont que deux, ne serions-nous pas les plus forts?	11	3680	17	0	0.0	[]
3823	N'avez-vous jamais vu une de ces scènes de Moliere, où deux poltrons se rencon	11	3681	16	0	0.0	[]
3824	-trent de nuit, etamp;	11	3682	4	0	0.0	[]
3825	affectent un courage démenti par le son de leur voix, pour s'intimider mutuellement?	11	3683	14	1	0.07142857142857142	[['voix']]
3826	Nous faisions alors une excellente représen-tation de ces scènes, etamp;	11	3684	11	0	0.0	[]
3827	pourtant je dois dire, à la louange de tous les acteurs qu'il n'y avait que moi de poltronne, aussi l'étais-je à un tel point, que mes cheveux se dressaient d'horreur sur ma tête.	11	3685	38	1	0.02631578947368421	[['cheveux']]
3828	Je m'égaie à présent d'une aventure qui faillit à m'ôter la vie, semblable à ces vieux marins qui au coin de leur feu diver-tissent leur famille du récit d'un naufrage auquel ils ont échappé, etamp; qui intéressent à proportion du danger qu'ils ont couru.	11	3686	50	1	0.02	[['vieux']]
3829	"Mais il est bien <pb n=""292""/> <fw>278 <hi rend=""small caps"">La Nouvelle</hi> </fw> <O/>temps de vous tenir en inquiétude, en m'amusant à discourir."	11	3687	26	0	0.0	[]
3830	Le Baron se douta d'abord de la vérité de cette rencontre etamp;	11	3688	13	0	0.0	[]
3831	répondit à ses compa-triotes.	11	3689	5	0	0.0	[]
3832	Des malheureux dont l'infor-tune est pareille, ne doivent point s'alarmer mutuellement.	11	3690	14	0	0.0	[]
3833	Vous êtes prisonniers François, Messieurs, etamp;	11	3691	6	0	0.0	[]
3834	vous cherchez comme nous à recou-vrer votre liberté?	11	3692	9	0	0.0	[]
3835	Vous l'avez deviné, répondit un de ces trois hommes qui avait un son de voix si terrible qu'il me fit trembler.	11	3693	23	1	0.043478260869565216	[['voix']]
3836	Asseyons-nous un moment, etamp;	11	3694	5	0	0.0	[]
3837	voyons si nous pourrons nous aider dans notre dessein.	11	3695	9	0	0.0	[]
3838	Comme je marchais depuis plusieurs heures, etamp;	11	3696	7	0	0.0	[]
3839	que je commençais à être bien lasse, nous acceptâmes la proposition.	11	3697	11	0	0.0	[]
