2503	Il y a beaucoup de vers parmi ces papiers, etamp;	11	2361	10	0	0.0	[]
2504	la poésie n'en est pas mé	11	2362	7	0	0.0	[]
2505	-diocre.	11	2363	1	0	0.0	[]
2506	S'il n'est pas Poëte, du moins il aime la poésie, voilà encore un goût singulier pour un homme de sa sorte;	11	2364	23	0	0.0	[]
2507	le choix des pièces marque son discernement.	11	2365	7	0	0.0	[]
2508	Juste Ciel!	11	2366	2	0	0.0	[]
2509	j'entends le signal qu'il m'a donné, déjà de retour!	11	2367	12	0	0.0	[]
2510	Mes forces sont prêtes à m'abandonner.	11	2368	7	0	0.0	[]
2511	Que j'ai de choses à vous apprendre, ma chère Hariote;	11	2369	11	0	0.0	[]
2512	qui me débrouil	11	2370	3	0	0.0	[]
2513	-lera le cahot dans lequel je me perds.	11	2371	8	0	0.0	[]
2514	Fatal	11	2372	1	0	0.0	[]
2515	voyage!	11	2373	1	0	0.0	[]
2516	"ce fut dans sa colère contre moi que le Ciel vous mit dans <pb n=""196""/> <fw>182 <hi rend=""small caps"">La Nouvelle</hi> </fw> <O/>la nécessité de le faire."	11	2374	29	0	0.0	[]
2517	Je n'en mur-mure point!	11	2375	6	0	0.0	[]
2518	ô mon Dieu, ne suis-je pas votre créature, obligée de me soumettre à vos divins décrets, quel-que rigoureux qu'ils me paraissent! ne m'avez-vous pas montré que vous êtes mon père dans la protection que vous m'avez accordée pour échapper au plus grand de tous les maux.	11	2376	52	1	0.019230769230769232	[['grand']]
2519	Vous acheverez votre ouvrage, vous cou-vrirez de vos ailes la plus vertueuse de toutes les femmes, vous me remet-trez dans ses bras etamp;	11	2377	25	2	0.08	[['cou'], ['bras']]
2520	dans ceux de la plus tendre des amies, ou si vous me réfusez ces biens dont je ne suis pas digne, vous me donnerez le cou-rage nécessaire pour vous en faire le sacrifice.	11	2378	34	2	0.058823529411764705	[['tendre'], ['cou']]
2521	Voici	11	2379	1	0	0.0	[]
2522	ce que Chevalier vient de m'apprendre.	11	2380	7	0	0.0	[]
2523	„	11	2381	1	0	0.0	[]
2524	Arrivé à l'auberge d'Oldswind-	11	2382	6	0	0.0	[]
2525	„ sord, il fut long	11	2383	5	0	0.0	[]
2526	-temps	11	2384	1	0	0.0	[]
2527	sans pou-„ voir attirer l'attention du maître, „ auquel il demandait un morceau „ à manger, etamp;	11	2385	19	0	0.0	[]
2528	du domestique auquel „ il criait de mettre son cheval à „ l'écurie: tout y paraissait dans le „ trouble, on allait, on venait, on „ faisait des exclamations.	11	2386	30	0	0.0	[]
2529	"Enfin, „ l'hôtesse rentra en s'écriant: non, „ il aura beau dire, on ne croira <pb n=""197""/> <fw> <hi rend=""small caps"">Clarice.</hi> 183</fw> <O/>„ point que Madame Derby, non „ plus que sa fille aient fait quelque „ chose contre le devoir;"	11	2387	47	2	0.0425531914893617	[['rentrer'], ['beau']]
2530	la pauvre „ Fani se tue de le dire, etamp;	11	2388	10	0	0.0	[]
2531	ce brutal „ de valet la menace, comme si „ c'était un crime aux yeux de Mon-„ sieur, de dire qu'il a la plus hon-„ nête femme, etamp;	11	2389	32	1	0.03125	[['oeil']]
2532	la plus vertueuse „	11	2390	4	0	0.0	[]
2533	fille du monde.	11	2391	3	0	0.0	[]
2534	Que n'ameno t-„ tu ici cette pauvre fille, lui dit le „ Maître de la maison: j'ai tout ours „ eu mauvaise opinion de ce Jacques, „ je ne la crois pas trop en sûreté „ avec lui, cours l'appeler, dit-il à „ sa servante, dis-lui qu'elle vienne „ prendre une tasse de thé avec nous;	11	2392	63	0	0.0	[]
2535	„ la pauvre fille, j'en suis sur, n'aura „ pas eu le courage de déjeuner;	11	2393	17	0	0.0	[]
2536	puis „ apercevant à la fin Chevalier qui „ tenait encore la bride de son cheval, „ je vous demande excuse, Monsieur, „ de vous avoir fait attendre, vous „ nous voyez tout hors de nous, „ voulez-vous prendre un déjeuner?	11	2394	42	1	0.023809523809523808	[['fin']]
2537	„	11	2395	1	0	0.0	[]
2538	"De tout mon cœur, répondit Che-„ valier, je prendrai volontiers le „ thé avec vous, en attendant quel-„ que chose de plus solide, mettez-„ moi s'il vous plaît quelque chose „ à la broche, car je ne veux pas <pb n=""198""/> <fw>184 <hi rend=""small caps"">La Nouvelle</hi> </fw> <O/>„ m'arrêter d'ici à Londres."	11	2396	62	1	0.016129032258064516	[['solide']]
2539	Mais „ Pourroit-on vous demander ce qui „ est arrivé de nouveau dans ce „ quartier?	11	2397	17	0	0.0	[]
2540	“ Vraiment, dit l'hôtesse, nous n'en savons encore que quelques mots par-ci par-là; mais voilà Mistriss Fani, la femme de chambre d'une excellente Demoiselle qui a été enlevée, elle nous dira comme tout cela s'est passé.	11	2398	42	0	0.0	[]
2541	Fani avait les yeux extrêmement rouges, etamp;	11	2399	7	2	0.2857142857142857	[['oeil'], ['rouge']]
2542	il était aisé de voir qu'elle avait beaucoup pleuré.	11	2400	10	1	0.1	[['aiser']]
2543	Elle montra beaucoup de prudence dans tout ce qu'elle dit.	11	2401	11	0	0.0	[]
2544	La jeune maîtresse s'était échappée pendant la nuit, la trace de ses pas dans le jardin, avait conduit jusqu'à la muraille, etamp;	11	2402	24	1	0.041666666666666664	[['pendant']]
2545	les mêmes traces de l'autre côté, avaient indiqué de quel côté il fallait faire des recherches.	11	2403	17	0	0.0	[]
2546	Sir Derby, Montalve etamp;	11	2404	4	0	0.0	[]
2547	trois domesti	11	2405	2	0	0.0	[]
2548	-ques s'étaient mis à sa poursuite	11	2406	7	0	0.0	[]
2549	, quelques heures après Montalve etamp;	11	2407	5	0	0.0	[]
2550	Jacques étaient revenus a la maison.	11	2408	6	0	0.0	[]
2551	Le premier s'était fait conduire à une chambre écartée, où était Madame Derby, etamp;	11	2409	15	0	0.0	[]
2552	"en avait fait sauter la ser-rure, Jacques qui voulait s'y opposer en avait été battu, après une demi-heure de conversation, sa maîtresse <pb n=""199""/> <fw> <hi rend=""small caps"">Clarice.</hi> 185</fw> <O/>était montée dans une chaise de poste que Montalve escortoit à cheval."	11	2410	46	0	0.0	[]
2553	Les cris de Jacques avaient émeuté tout le village, il criait qu'on trahissait Monsieur, qu'après lui avoir ravi sa fille on lui enlevait son épouse; mais Madame Derby ayant dit quelques paroles, tout avait été apaisé.	11	2411	38	0	0.0	[]
2554	Elle ajouta que l'infâme Jacques la mena-çoit de la mettte entre les mains de la justice, comme une voleuse, parce qu'elle avait aidé à sa jeune maîtresse à enfoncer des armoires pour emporter des diamants.	11	2412	38	2	0.05263157894736842	[['main'], ['enfoncer']]
2555	Tous les gens de la maison, etamp;	11	2413	7	0	0.0	[]
2556	plusieurs voisins se récrie	11	2414	4	0	0.0	[]
2557	-rent beaucoup contre cette méchanceté, etamp;	11	2415	6	0	0.0	[]
2558	conseillerent à Fani d'aller porter ses plaintes à Windsord où elle pour-rait jurer la paix contre ce domestique: tous s'offraient à l'y conduire.	11	2416	27	0	0.0	[]
2559	Non, dit Fani, je ne veux mêler personne dans mes embarras, pourvu qu'on me trouve un cheval, j'irai fort bien toute seule faire ma déposition.	11	2417	27	1	0.037037037037037035	[['fort']]
2560	Chevalier prit alors la parole.	11	2418	5	0	0.0	[]
2561	J'ai quelques affaires à Windsord, lui dit-il, etamp;	11	2419	10	0	0.0	[]
2562	j'y puis dîner aussi-bien qu'ici;	11	2420	8	0	0.0	[]
2563	je vous offre la croupe de mon cheval, etamp;	11	2421	9	1	0.1111111111111111	[['croupe']]
2564	"comme j'ai l'honneur d'être fort connu du juge de paix, j'espère qu'il rendra <pb n=""200""/> <fw>186 <hi rend=""small caps"">La Nouvelle</hi> </fw> <O/>à Mademoiselle toute la justice qu'elle mérite."	11	2422	37	1	0.02702702702702703	[['fort']]
2565	Je ne demande qu'une ré-compense pour le service que je lui rendrai, ce sera de m'instruire demain de la suite de cette affaire, je m'in-téresse au sort de ces Dames, etamp;	11	2423	35	0	0.0	[]
2566	si je n'étais pas forcé d'être aujourd'hui à Londres pour une affaire pressante, je remettrois mon voyage.	11	2424	19	0	0.0	[]
2567	Fani bénit l'honnête	11	2425	4	0	0.0	[]
2568	-homme qui s'intéressait à son sort, etamp;	11	2426	8	0	0.0	[]
2569	avant de quitter la maison, vida ses poches, ôta sa robe, secoua ses jupes qu'elle fit tâter à plusieurs femmes, pour mon-trer qu'elle n'emportait rien.	11	2427	28	0	0.0	[]
2570	Le maî-tre de l'auberge poussait la générosité jusqu'à ne vouloir rien prendre pour la dépense de Chevalier;	11	2428	20	0	0.0	[]
2571	celui-ci n'y a point voulu consentir, il a jeté une guinée sur la table, etamp;	11	2429	16	0	0.0	[]
2572	a laissé cinq schelings pour son déjeuner, etamp;	11	2430	8	0	0.0	[]
2573	pour le dîner qu'il avait fait préparer, ce qui a donné une grande idée de lui, etamp;	11	2431	18	1	0.05555555555555555	[['grand']]
2574	l'a fait prendre pour un homme de conséquence;	11	2432	9	0	0.0	[]
2575	car il avait emprunté une redingote au village, qui cachait son habit.	11	2433	12	0	0.0	[]
2576	A peine Chevalier a-t-il été à un demi-mille du village, qu'il s'est ou	11	2434	17	0	0.0	[]
2577	-vert à ma femme de chambre.	11	2435	6	0	0.0	[]
2578	"Cette <pb n=""201""/> <fw> <hi rend=""small caps"">Clarice.</hi> 187</fw> <O/>pauvre fille a manqué mourir de joie, lorsqu'elle a entendu prononcer mon nom: elle voulait à toute force me joindre;"	11	2436	32	2	0.0625	[['mourir'], ['prononcer']]
2579	Chevalier lui a fait entendre qu'elle me serait plus utile à Oldwind-sord, parce que nous pourrions être instruits par elle des mesures qu'on prendrait pour découvrir mes traces.	11	2437	31	0	0.0	[]
2580	Ils sont convenus que la démarche qu'elle faisait était absolument néces	11	2438	12	0	0.0	[]
2581	-saire à sa sûreté;	11	2439	4	0	0.0	[]
2582	mais comme elle craignait que le retardement de Che-valier ne me causa trop d'inquiétude, elle l'a prié de me rejoindre, etamp;	11	2440	24	0	0.0	[]
2583	a continué sa route à pied.	11	2441	6	0	0.0	[]
2584	Quand le désirs d'apprendre des nou-velles ne me retiendrait pas où je suis, une autre raison plus forte m'empêche-rait de m'éloigner.	11	2442	26	1	0.038461538461538464	[['fort']]
2585	Jacques a laissé échapper que je serais entre les mains de mon père avant qu'il fût vingt-quatre heures, parce qu'il m'avait consignée à toutes les barrières, etamp;	11	2443	30	1	0.03333333333333333	[['main']]
2586	qu'ainsi je serais arrêtée de quelque côté que je me présentasse.	11	2444	12	0	0.0	[]
2587	A quelle extrémité suis-je réduite!	11	2445	6	1	0.16666666666666666	[['extrémité']]
2588	Forcée de fouler aux pieds la bienséance en passant la nuit avec un inconnu	11	2446	14	1	0.07142857142857142	[['pied']]
2589	, je suis en cela plus à plaindre que la Clarice de Monsieur Ritcharson;	11	2447	13	0	0.0	[]
2590	"elle <pb n=""202""/> <fw>188 <hi rend=""small caps"">La Nouvelle</hi> </fw> <O/>avait la compagnie de quelques fem-mes."	11	2448	19	0	0.0	[]
2591	Cependant en confrontant nos avantures, je me trouverais moins à plaindre qu'elle, si je pouvais être rassurée sur le sort de ma très-chère mère.	11	2449	26	0	0.0	[]
2592	Je n'ai point à me reprocher de m'être jetée dans la situation où je me trouve, le cas d'une indispensable nécessité justifie ma fuite.	11	2450	27	0	0.0	[]
2593	Je ne me suis point mise volontairement sous la protection d'un homme, cet homme n'est point etamp;	11	2451	19	0	0.0	[]
2594	ne peut devenir mon amant.	11	2452	5	0	0.0	[]
2595	S'il avait fallu choisir entre tous ceux que je connais, excepté Milord, je doute que j'eusse pu ren-contrer quelqu'un avec lequel je fusse plus en sûreté.	11	2453	30	0	0.0	[]
2596	La lettre que vous recevrez par le prochain ordinaire vous apprendra combien je suis fon-dée à vous parler ainsi.	11	2454	20	0	0.0	[]
2597	Ce sera vous qui la recevrez cette seconde lettre, ma chère Hariote.	11	2455	12	0	0.0	[]
2598	La situation où je me trouve, excuse l'indiscrétion de la prière que je vais vous faire.	11	2456	17	0	0.0	[]
2599	Je ne puis être en aucun endroit aussi cachée qu'ici, Fani m'y viendra joindre aussi	11	2457	17	1	0.058823529411764705	[['joindre']]
2600	-tôt qu'elle cessera de m'être nécessaire à Oldvindsord.	11	2458	10	0	0.0	[]
2601	Je suis donc résolue d'y attendre la fin de mes infortunes.	11	2459	12	1	0.08333333333333333	[['fin']]
2602	"Je les croirai passées au moment où <pb n=""203""/> <fw> <hi rend=""small caps"">Clarice.</hi> 189</fw> <O/>je pourrai me jeter entre les mains etamp;"	11	2460	25	1	0.04	[['main']]
2603	sous la protection de Milord, etamp;	11	2461	6	0	0.0	[]
2604	passer avec lui en France.	11	2462	5	0	0.0	[]
2605	Je sais qu'à mon âge on est encore sous l'autorité d'un père, il peut me réclamer.	11	2463	19	0	0.0	[]
2606	Je sais aussi que l'acte par lequel il m'a cédée à ma tante peut annéantir sa réclamation, ou du moins l'affaiblir, etamp;	11	2464	25	0	0.0	[]
2607	mitiger le pouvoir qu'il a reçu de la nature;	11	2465	10	0	0.0	[]
2608	mais je m'exposerois à tout plutôt que de diffamer l'auteur de ma naissance.	11	2466	15	0	0.0	[]
2609	S'il peut oublier que je suis sa fille, je n'oublierai jamais qu'il est mon père, etamp;	11	2467	19	0	0.0	[]
2610	avec le secours du Ciel, je ne m'écarterai jamais de ce que je lui dois en cette qualité.	11	2468	19	0	0.0	[]
2611	Le plus sûr parti est donc de fuir ma patrie, etamp;	11	2469	11	0	0.0	[]
2612	d'y abandonner tout ce que je possède.	11	2470	8	0	0.0	[]
2613	C'est ma fortune qui m'ôte mon père, elle m'est odieuse, qu'il en jouisse etamp;	11	2471	18	0	0.0	[]
2614	qu'il me rende son cœur.	11	2472	6	0	0.0	[]
2615	J'espère que Milord aura la générosité de vouloir bien partir à lettre vue;	11	2473	14	0	0.0	[]
2616	il m'en coûte infiniment de vous proposer une telle privation dans l'état où vous êtes: cependant il est le seul qui puisse ôter aux yeux du public, ce que ma fuite a d'o-dieux, sur-tout l'orsqu'il m'est impossi	11	2474	44	1	0.022727272727272728	[['oeil']]
2617	"-blé d'alléguer les raisons que j'ai eues <pb n=""204""/> <fw>190 <hi rend=""small caps"">La Nouvelle</hi> </fw> <O/>de prendre ce parti."	11	2475	24	0	0.0	[]
2618	Son nom fera bien présumer d'une action presque toujours condamnable.	11	2476	11	0	0.0	[]
2619	C'est la seule raison de la bienséance qui me fait rester ici, jusqu'à l'arrivée de Milord.	11	2477	19	0	0.0	[]
2620	Chevalier m'assure qu'il trouverait des moyens de me conduire sûrement en France.	11	2478	14	0	0.0	[]
2621	Je ne balancerois pas à m'abandonner à sa conduite, si tout le monde avait de lui l'opinion que j'en ai conçue.	11	2479	24	0	0.0	[]
2622	Mais Sir Derby saisiroit peut-être cette occasion de me décrier, etamp;	11	2480	11	0	0.0	[]
2623	s'il faut souffrir avec résignation la perte de sa réputation, quand Dieu l'ordonne;	11	2481	15	0	0.0	[]
2624	je regarde comme un devoir sacré le juste soin qu'on en doit prendre, etamp;	11	2482	15	0	0.0	[]
2625	j'ai toujours ces paroles présentes, malheur à celui par qui le scandale arrive, etamp;c.	11	2483	15	0	0.0	[]
2626	Hélas!	11	2484	1	0	0.0	[]
2627	je suis tombée dans ce malheur, le plus grand de tous à mon gré.	11	2485	14	1	0.07142857142857142	[['grand']]
2628	Ma seule consolation est la résolution où je suis de ne point l'aggraver.	11	2486	14	0	0.0	[]
2629	La poste me force de finir, je vous apprendrai le reste par la première lettre.	11	2487	15	0	0.0	[]
2630	"<graphic/> <pb n=""205""/>"	11	2488	4	0	0.0	[]
2631	"<fw> <hi rend=""small caps"">Clarice.</hi> 191</fw> <graphic/> <head> <hi rend=""italic"">LETTRE</hi> DE CLARICE <hi rend=""italic;"	11	2489	17	0	0.0	[]
2632	"small caps"">a Milady"	11	2490	3	0	0.0	[]
2633	"Hariote.</hi> </head> <hi rend=""small caps"">"	11	2491	8	0	0.0	[]
2634	"<hi rend=""caps"" type=""initials"">C</hi>Omme</hi> je prévois, chère"	11	2492	7	0	0.0	[]
2635	Hariote,	11	2493	1	0	0.0	[]
2636	que j'aurai beaucoup de choses à vous mander, je commence	11	2494	11	0	0.0	[]
2637	cette se-conde	11	2495	3	0	0.0	[]
2638	lettre un jour avant celui où elle partira, etamp;	11	2496	9	0	0.0	[]
2639	je vais reprendre le fil de mes tristes aventures à l'endroit où la poste me força de les interrompre.	11	2497	20	1	0.05	[['triste']]
2640	Les occupations de Chevalier le for-cerent à me quitter aussi	11	2498	11	0	0.0	[]
2641	-tôt qu'il m'eût rendu compte de son voyage.	11	2499	10	0	0.0	[]
2642	Il avait eu l'attention de se pourvoir d'un poulet froid, etamp;	11	2500	13	1	0.07692307692307693	[['froid']]
2643	du reste de ce qui était nécessaire pour sustenter une vie qui menace d'être bien traversée, mais que Dieu m'ordonne de conser-ver: je m'élevai donc au dessus de mon abattement pour prendre quel	11	2501	37	1	0.02702702702702703	[['menacer']]
2644	-que nourriture, etamp;	11	2502	3	0	0.0	[]
2645	il me semble que ce petit secours rendit quelque vigueur à mon esprit.	11	2503	13	1	0.07692307692307693	[['petit']]
2646	"J'avais sur-tout deux choses qui me causaient une inquiétude <pb n=""206""/> <fw>192 <hi rend=""small caps"">La Nouvelle</hi> </fw> <O/>mortelle."	11	2504	22	0	0.0	[]
2647	La première regardait mon incertitude sur le sort de ma vertueuse mère.	11	2505	12	0	0.0	[]
2648	Quelquefois je me rappellais les promesses que Montalve m'avait faites la veille, etamp;	11	2506	14	0	0.0	[]
2649	je me disais que le pre-mier effet de son repentir, avait été de soustraire Madame Derby aux fu-reurs de son époux.	11	2507	23	0	0.0	[]
2650	Elle l'avait vo	11	2508	4	0	0.0	[]
2651	-lontairement suivi, etamp;	11	2509	3	0	0.0	[]
2652	il fallait pour l'engager à ce coup d'éclat, qu'il lui eût découvert toute la trame qu'on avait ourdie contre nous.	11	2510	24	0	0.0	[]
2653	Montalve ne pouvait probablement la conduire que chez sa mère, la conversion de cette pauvre femme n'était point équi-voque;	11	2511	20	0	0.0	[]
2654	elle avait coupé dans le vif pour m'écrire la lettre qui m'avait fait éviter mes malheurs;	11	2512	18	1	0.05555555555555555	[['vif']]
2655	de pareils com	11	2513	3	0	0.0	[]
2656	-mencements mènent loin, etamp;	11	2514	4	0	0.0	[]
2657	je la regardais comme une personne que Dieu avait choisie pour en faire un exemple de sa miséricorde.	11	2515	18	0	0.0	[]
2658	En suppo	11	2516	2	0	0.0	[]
2659	-sant à son fils les plus mauvaises inten-tions dans l'enlévement de ma mère, il devait compter sur la perversité de la sienne, etamp;	11	2517	25	0	0.0	[]
2660	ne pouvait être instruit du prodigieux changement que la grâce avait opéré.	11	2518	12	0	0.0	[]
2661	Que Je regrettais alors de n'avoir point attendu l'effet de ses promesses!	11	2519	14	0	0.0	[]
2662	"peut-être, me disais je <pb n=""207""/> <fw> <hi rend=""small caps"">Clarice.</hi> 193</fw> <O/>à moi"	11	2520	16	0	0.0	[]
2663	-même, serais-je actuellement dans les bras de ma mère. Je n'ai pas conservé long	11	2521	16	1	0.0625	[['bras']]
2664	-	11	2522	0	0	0	[]
2665	temps ce regret, il me semble que j'ai suivi les règles de la prudence	11	2523	15	0	0.0	[]
2666	, c'est elle que Dieu nous a donnée pour guider nos actions, etamp;	11	2524	13	0	0.0	[]
2667	nous ne sommes pas responsables du suc-cès.	11	2525	8	0	0.0	[]
2668	J'ai peut-être trop compté sur la mienne, etamp;	11	2526	9	0	0.0	[]
2669	Dieu prend plaisir à la confondre, pour m'apprendre à ne compter désormais que sur son secours.	11	2527	17	0	0.0	[]
2670	J'ai été forcée de quitter ma plume pour laisser le temps à cette dernière réflexion de se développer dans mon esprit.	11	2528	22	0	0.0	[]
2671	Effectivement j'ai trop compté sur le bonheur: il me semblait que celui que je me promettas était mon ouvrage;	11	2529	20	0	0.0	[]
2672	je suis sortie sans m'en apper-cevoir de cette dépendance de Dieu où il semblait qu'une longue habitude m'avait assujettie.	11	2530	23	1	0.043478260869565216	[['long']]
2673	Effet funeste de la prospérité!	11	2531	5	0	0.0	[]
2674	je m'aperçois que depuis quelques mois je m'étais insensible	11	2532	11	0	0.0	[]
2675	-ment attiédie;	11	2533	2	0	0.0	[]
2676	cette étrange disgrâce est sans doute un moyen que Dieu emploie pour me réveiller du sommeil dans lequel je tombois sans m'en apper-cevoir, plaise à sa bonté, s'il me rend le calme, de ne pas permettre qne j'en abuse encore.	11	2534	44	1	0.022727272727272728	[['calme']]
2677	"<pb n=""208""/> <fw>194 <hi rend=""small caps"">La Nouvelle</hi> </fw>"	11	2535	10	0	0.0	[]
2678	Il y a une heure que je médite un projet qui pourrait peut-être terminer mes peines, etamp;	11	2536	17	0	0.0	[]
2679	c'est le désirs de mettre fin à celles de ma mère, qui me l'ins-pire.	11	2537	17	1	0.058823529411764705	[['fin']]
2680	Qu'est-ce qui s'est opposé aux sentiments de la nature, dans le cœur de Sir Derby?	11	2538	18	0	0.0	[]
2681	Le dépit qu'il a conçu de la préférence que ma tante m'a donné sur lui.	11	2539	17	0	0.0	[]
2682	Puis-je estimer une for	11	2540	5	0	0.0	[]
2683	-tune	11	2541	1	0	0.0	[]
2684	qui me cause une si grande perte?	11	2542	7	1	0.14285714285714285	[['grand']]
2685	Non, il vaut mieux la lui abandonner, la pauvreté, l'indigence n'est qu'un mal imaginaire.	11	2543	17	0	0.0	[]
2686	Qu'il me rende ma mère, etamp;	11	2544	7	0	0.0	[]
2687	qu'il prenne mes richesses;	11	2545	5	0	0.0	[]
2688	ne sommes-nous pas convenues mille fois que richesse etamp;	11	2546	10	0	0.0	[]
2689	bonheur ne peu	11	2547	3	0	0.0	[]
2690	-vent habiter ensemble?	11	2548	3	0	0.0	[]
2691	...	11	2549	0	0	0	[]
2692	On donne le signal pour ouvrir, j'y cours.	11	2550	9	0	0.0	[]
2693	Le sommeil fuit de mes yeux	11	2551	6	0	0.0	[]
2694	, ma chère Hariote, l'étrange projet que j'étais prête à vous expliquer lorsqu'on m'a interrompue, se présente à mon esprit sous les formes les plus sédui-santes.	11	2552	30	0	0.0	[]
2695	Cependant je ne me sens pas le courage de vous le déclarer à pré-sent.	11	2553	14	0	0.0	[]
2696	Peut-être serai-je plus la maî	11	2554	7	0	0.0	[]
2697	-tresse d'une mauvaise honte, avant de finir ma lettre;	11	2555	10	0	0.0	[]
2698	"il faut en attendant que je vous entretienne de ce qui s'est passé depuis l'heure où mon libérateur <pb n=""209""/> <fw> <hi rend=""small caps"">Clarice.</hi> 195</fw> <O/>s'est retiré, jusqu'à celui où je suis demeurée seule."	11	2556	41	0	0.0	[]
2699	Une de mes inquié	11	2557	4	0	0.0	[]
2700	-tudes était la crainte de passer la nuit si proche d'un homme inconnu: quel-que soit l'estime que ses procédés m'aient inspirée	11	2558	25	0	0.0	[]
2701	, je sais que la défiance est la gardienne de la vertu.	11	2559	11	0	0.0	[]
2702	Il ne m'a pas laissé l'embarras de lui expli-quer ma peine à cet égard, etamp;	11	2560	18	0	0.0	[]
2703	m'a dit en entrant qu'il venait de se ména-ger la commodité de me laisser libre, en priant un ami de lui laisser parta-ger son lit;	11	2561	29	0	0.0	[]
2704	mais, a-t-il ajouté, je suis en usage de me retirer tous les soirs dans ma chambre, pendant que mon maître va passer une couple d'heures avec ses amis, je suis attentif à lui porter de la lumière lorsque je l'en-tends rentrer, il pourrait s'inquiéter si j'y manquais, etamp;	11	2562	55	2	0.03636363636363636	[['pendant'], ['rentrer']]
2705	peut-être me croire malade.	11	2563	4	0	0.0	[]
2706	Il a tant de bonté pour moi qu'il ne voudrait pas se coucher sans voir si je n'aurois pas besoin de secours, ce qui pourrait trahir notre secret;	11	2564	30	0	0.0	[]
2707	je suis donc forcé, Madame, de vous demander permission de passer quelques heures dans la chambre voisine, en attendant qu'il sorte, aussi	11	2565	23	0	0.0	[]
2708	-tôt que je serai seul je descendrai dans la bou	11	2566	10	0	0.0	[]
2709	-tique etamp;	11	2567	2	0	0.0	[]
2710	vous laisserai libre.	11	2568	3	0	0.0	[]
2711	"Jusques- <pb n=""210""/> <fw>196 <hi rend=""small caps"">La Nouvelle</hi> </fw> <O/>là j'ai cru qu'il valait mieux vous importuner que de lui causer des soupçons."	11	2569	28	0	0.0	[]
2712	D'ailleurs j'ai besoin de prendre vos ordres;	11	2570	9	0	0.0	[]
2713	si vous étiez for-cée par quelque accident imprévu de quitter cet asile, vous auriez besoin d'habits plus simples que celui que vous portez, vous manquez de linge etamp;	11	2571	30	0	0.0	[]
2714	de mille choses nécessaires	11	2572	4	0	0.0	[]
2715	, si votre femme de chambre n'est pas en état de vous en procurer, ne serait-il pas convenable que je cherchasse à vous en pourvoir?	11	2573	26	0	0.0	[]
2716	Je louai les soins etamp;	11	2574	5	0	0.0	[]
2717	l'attention de mon protecteur;	11	2575	5	0	0.0	[]
2718	etamp;	11	2576	1	0	0.0	[]
2719	comme j'avais une grande curiosité de le connaître plus particulièrement, je saisis cette occa-sion de la satisfaire.	11	2577	19	1	0.05263157894736842	[['grand']]
2720	Vous aimez la solitude, à ce que vois, lui dis-je;	11	2578	11	0	0.0	[]
2721	c'est un goût louable dans un homme de votre âge;	11	2579	11	0	0.0	[]
2722	car vous ne paraissez pas avoir plus de vingt ans.	11	2580	10	0	0.0	[]
2723	Pourrois	11	2581	1	0	0.0	[]
2724	-je	11	2582	1	0	0.0	[]
2725	vous demander sans indiscrétion à quoi vous vous occupez tous les soirs?	11	2583	12	0	0.0	[]
2726	J'aime la lecture, répondit Chevalier, etamp;	11	2584	7	0	0.0	[]
2727	ce qui m'a été de plus pénible depuis près d'une année que je suis ici, c'est la disette des bons auteurs.	11	2585	24	0	0.0	[]
2728	"Depuis quelques mois ma profession m'ayant ouvert l'entrée de quelques <pb n=""211""/> <fw> <hi rend=""small caps"">Clarice.</hi> 197</fw> <O/>bonnes maisons, je me suis procuré des livres Anglois, je commence à les entendre, etamp;"	11	2586	37	0	0.0	[]
2729	je regrette de n'avoir pas eu occasion de commencer cette lecture plutôt, il y a un si grand nombre de bons ouvrages dans votre langue, que mon seul devoir m'arrache à la lecture.	11	2587	35	1	0.02857142857142857	[['grand']]
2730	Vous me rappelez, Madame, un oubli que je me reproche, j'aurois du vous offrir ma chétive bibliothèque, cela vous eut rendu la journée plus courte?	11	2588	26	0	0.0	[]
2731	Je ne lis point de romans, répondis-je.	11	2589	8	0	0.0	[]
2732	Avez-vous des livres d'un autre genre.	11	2590	8	0	0.0	[]
2733	Il est des romans qu'on peut lire avec plaisir, répondit-il, je vous avouerai pourtant qu'il est peu d'Anglois qui aient réussi dans ce genre.	11	2591	28	0	0.0	[]
2734	Je préfère les livres qui traitent de la morale etamp;	11	2592	10	0	0.0	[]
