482	Je suis lié des liens de l' infamie, mais tu l' es de ceux de la gloire.	1	112	17	0	0.0	[]
483	Au moins je vis tranquille au fond de mon précipice; et toi, toujours tremblante sur le bord du tien.	1	113	19	0	0.0	[]
484	Le même destin qui t' a enlevé ta mère, te menace aussi de t' enlever un jour.	1	114	17	2	0.11764705882352941	[['ton'], ['menacer']]
485	Tu n' as reçu qu' une vie, et tu dois mourir de deux morts: si ta propre mort ne te fait descendre au tombeau, celle de ton époux t' y entraînera toute vivante.	1	115	33	3	0.09090909090909091	[['mourir'], ['ton'], ['ton']]
486	Je pleurais, et elle pleurait: nos yeux, baignés de larmes, se rencontrèrent, et se parlèrent comme ceux des malheureux: elle détourna les siens, s' enveloppa de son voile, et se retira.	1	116	31	1	0.03225806451612903	[['oeil']]
487	La nuit suivante, je revins au même lieu.	1	117	8	0	0.0	[]
488	Cette fois elle avait mis une plus grande provision de vivres sur le tombeau de sa mère: elle avait jugé que j' en avais besoin;	1	118	25	1	0.04	[['grand']]
489	et comme les brames empoisonnent souvent leurs mets funéraires, pour empêcher les parias de les manger;	1	119	16	0	0.0	[]
490	pour me rassurer sur l' usage des siens, elle n' y avait apporté que des fruits.	1	120	16	0	0.0	[]
491	Je fus touché de cette marque d' humanité;	1	121	8	0	0.0	[]
492	et pour lui témoigner le respect que je portais à son offrande filiale, au lieu de prendre ses fruits, j' y joignis des fleurs: c' étaient des pavots, qui exprimaient la part que je prenais à sa douleur.	1	122	38	1	0.02631578947368421	[['joindre']]
493	La nuit suivante, je vis avec joie qu' elle avait approuvé mon hommage;	1	123	13	0	0.0	[]
494	les pavots étaient arrosés, et elle avait mis un nouveau panier de fruits à quelque distance du tombeau.	1	124	18	0	0.0	[]
495	La pitié et la reconnaissance m' enhardirent.	1	125	7	0	0.0	[]
496	N' osant lui parler comme paria, de peur de la compromettre, j' entrepris, comme homme, de lui exprimer toutes les affections qu' elle faisait naître dans mon âme: suivant l' usage des Indes, j' empruntai, pour me faire entendre, le langage des fleurs;	1	126	43	0	0.0	[]
497	j' ajoutai aux pavots des soucis.	1	127	6	0	0.0	[]
498	La nuit d' après, je retrouvai mes pavots et mes soucis baignés d' eau.	1	128	14	0	0.0	[]
499	La nuit suivante, je devins plus hardi;	1	129	7	0	0.0	[]
500	je joignis aux pavots et aux soucis une fleur de foulsapatte, qui sert aux cordonniers à teindre leurs cuirs en noir, comme l' expression d' un amour humble et malheureux.	1	130	30	3	0.1	[['joindre'], ['teindre'], ['noir']]
501	Le lendemain, dès l' aurore, je courus au tombeau;	1	131	9	0	0.0	[]
502	mais j' y vis la foulsapatte desséchée, parce qu' elle n' avait pas été arrosée.	1	132	15	1	0.06666666666666667	[['dessécher']]
503	La nuit suivante, j' y mis, en tremblant, une tulipe dont les feuilles rouges et le cœur noir exprimaient les feux dont j' étais brûlé: le lendemain je retrouvai ma tulipe dans l' état de la foulsapatte.	1	133	37	3	0.08108108108108109	[['rouge'], ['noir'], ['brûler']]
504	J' étais accablé de chagrin;	1	134	5	0	0.0	[]
505	cependant le surlendemain j' y apportai un bouton de rose avec ses épines, comme le symbole de mes espérances mêlées de beaucoup de craintes.	1	135	24	1	0.041666666666666664	[['rose']]
506	Mais quel fut mon désespoir quand je vis, aux premiers rayons du jour, mon bouton de rose loin du tombeau!	1	136	20	1	0.05	[['rose']]
507	Je crus que je perdrais la raison.	1	137	7	0	0.0	[]
508	Quoi qu' il pût m' en arriver, je résolus de lui parler.	1	138	12	0	0.0	[]
509	La nuit suivante, dès qu' elle parut, je me jetai à ses pieds;	1	139	13	0	0.0	[]
510	mais j' y restai tout interdit en lui présentant ma rose.	1	140	11	0	0.0	[]
511	"Elle prit la parole, et me dit: "" infortuné!"	1	141	9	0	0.0	[]
512	Tu me parles d' amour, et bientôt je ne serai plus.	1	142	11	0	0.0	[]
513	Il faut, à l' exemple de ma mère, que j' accompagne au bûcher mon époux qui vient de mourir: il était vieux, je l' épousai enfant: adieu;	1	143	27	2	0.07407407407407407	[['mourir'], ['vieux']]
514	retire	1	144	1	0	0.0	[]
515	-toi	1	145	1	0	0.0	[]
516	,	1	146	0	0	0	[]
517	et oublie-moi;	1	147	3	0	0.0	[]
518	dans trois jours, je ne serai qu' un peu de cendre.	1	148	11	0	0.0	[]
519	""" en disant ces mots, elle soupira."	1	149	6	0	0.0	[]
520	Pour moi, pénétré de douleur	1	150	5	1	0.2	[['pénétrer']]
521	", je lui dis: "" malheureuse bramine!"	1	151	6	1	0.16666666666666666	[['luire']]
522	La nature a rompu les liens que la société vous avait donnés;	1	152	12	0	0.0	[]
523	achevez de rompre ceux de la superstition: vous le pouvez, en me prenant pour votre époux.-quoi!	1	153	16	0	0.0	[]
524	Reprit-elle en pleurant, j' échapperais à la mort pour vivre avec toi dans l' opprobre!	1	154	16	0	0.0	[]
525	Ah!	1	155	1	0	0.0	[]
526	Si tu m' aimes, laisse-moi mourir.-à dieu ne plaise, m' écriai-je, que je ne vous tire de vos maux que pour vous plonger dans les miens!	1	156	28	0	0.0	[]
527	Chère bramine, fuyons ensemble au fond des forêts;	1	157	8	0	0.0	[]
528	il vaut encore mieux se fier aux tigres qu' aux hommes.	1	158	11	0	0.0	[]
529	Mais le ciel, dans qui j' espère, ne nous abandonnera pas.	1	159	11	0	0.0	[]
530	Fuyons: l' amour, la nuit, ton malheur, ton innocence, tout nous favorise.	1	160	12	2	0.16666666666666666	[['ton'], ['ton']]
531	Hâtons-nous, veuve infortunée!	1	161	4	0	0.0	[]
532	Déja ton bûcher se prépare, et ton époux mort t' y appelle.	1	162	12	2	0.16666666666666666	[['ton'], ['ton']]
533	Pauvre liane renversée, appuie	1	163	4	0	0.0	[]
534	-toi sur moi, je serai ton palmier.	1	164	7	1	0.14285714285714285	[['ton']]
535	""" alors elle jeta, en gémissant, un regard sur le tombeau de sa mère, puis vers le ciel; et laissant tomber une de ses mains dans la mienne, de l' autre elle prit ma rose."	1	165	34	2	0.058823529411764705	[['regard'], ['main']]
536	Aussitôt je la saisis par le bras, et nous nous mîmes en route.	1	166	13	1	0.07692307692307693	[['bras']]
537	Je jetai son voile dans le Gange, pour faire croire à ses parents qu' elle s' y était noyée.	1	167	19	0	0.0	[]
538	Nous marchâmes pendant plusieurs nuits le long du fleuve, nous cachant, le jour, dans es rizières.	1	168	16	2	0.125	[['pendant'], ['long']]
539	Enfin, nous arrivâmes dans cette contrée que la guerre autrefois a dépeuplée d' habitants.	1	169	14	0	0.0	[]
540	Je pénétrai aufond de ce bois, où j' ai bâti cette cabane, et planté un petit jardin: nous y vivons très-heureux.	1	170	22	2	0.09090909090909091	[['pénétrer'], ['petit']]
541	Je révère ma femme comme le soleil, et je l' aime comme la lune.	1	171	14	0	0.0	[]
542	Dans cette solitude, nous nous tenons lieu de tout: nous étions méprisés du monde;	1	172	14	0	0.0	[]
543	mais, comme nous nous estimons mutuellement, les louanges que je lui donne, ou celles que j' en reçois, nous paraissent plus douces que les applaudissements d' un peuple.	1	173	28	1	0.03571428571428571	[['douce']]
544	""" en disant ces mots, il regardait son enfant dans son berceau, et sa femme qui versait des larmes de joie."	1	174	20	0	0.0	[]
545	"Le docteur, en essuyant les siennes, dit à son hôte: "" en vérité, ce qui est en honneur chez les hommes est souvent digne de leur mépris, et ce qui est méprisé d' eux mérite souvent d' en être honoré."	1	175	40	0	0.0	[]
546	Mais Dieu est juste;	1	176	4	0	0.0	[]
547	vous êtes mille fois plus heureux	1	177	6	0	0.0	[]
548	dans votre obscurité	1	178	3	0	0.0	[]
549	,	1	179	0	0	0	[]
550	que le chef des brames de Jagrenat dans toute sa gloire.	1	180	11	1	0.09090909090909091	[['chef']]
551	Il est exposé, ainsi que sa caste, à toutes les révolutions de la fortune;	1	181	14	0	0.0	[]
552	c' est sur les brames que tombent la plupart des fléaux des guerres civiles et étrangères qui désolent votre beau pays depuis tant de siècles;	1	182	25	1	0.04	[['beau']]
553	c' est à eux qu' on s' adresse souvent pour avoir des contributions forcées, à cause de l' empire qu' ils exercent sur l' opinion des peuples.	1	183	27	0	0.0	[]
554	Mais, ce qu' il y a de plus cruel pour eux, ils sont les premières victimes de leur religion inhumaine.	1	184	20	0	0.0	[]
555	à force de prêcher l' erreur, ils s' en pénètrent eux-mêmes au point de perdre le sentiment de la vérité, de la justice, de l' humanité, de la piété;	1	185	30	0	0.0	[]
556	ils sont liés des chaînes de la superstition dont ils veulent captiver leurs compatriotes;	1	186	14	0	0.0	[]
557	ils sont forcés à chaque instant de se laver, de se purifier, et de s' abstenir d' une multitude de jouissances innocentes;	1	187	22	0	0.0	[]
558	enfin, ce qu' on ne peut dire sans horreur, par une suite de leurs dogmes barbares, ils vaient brûler vives leurs parentes, leurs mères, leurs sœurs et leurs propres filles: ainsi les punit la nature, dont ils ont violé les lois.	1	188	41	1	0.024390243902439025	[['brûler']]
559	Pour vous, il vous est permis d' être sincère, bon, juste, hospitalier, pieux;	1	189	13	0	0.0	[]
560	et vous échappez aux coups de la fortune et aux maux de l' opinion par votre humiliation même.	1	190	18	0	0.0	[]
561	""" après cette conversation, le paria prit congé de son hôte pour le laisser reposer, et se retira, avec sa femme et le berceau de son enfant, dans une petite pièce voisine."	1	191	31	1	0.03225806451612903	[['petit']]
562	Le lendemain, au lever de l' aurore, le docteur fut réveillé par le chant des oiseaux nichés dans les branches du figuier d' Inde, et par les voix du paria et de sa femme, qui faisaient ensemble la prière du matin.	1	192	41	1	0.024390243902439025	[['voix']]
563	Il se leva, et fut bien fâché lorsque, le paria et sa femme ouvrant leur porte pour lui souhaiter le bonjour, il vit qu' il n' y avait pas d' autre lit dans la cabane que le lit conjugal, et qu' ils avaient veillé toute la nuit pour le lui céder.	1	193	51	0	0.0	[]
564	Après qu' ils lui eurent fait le salam, ils se hâtèrent de lui préparer à déjeuner.	1	194	16	0	0.0	[]
565	Pendant ce temps-là, il fut faire un tour dans le jardin: il letrouva, ainsi que la cabane, entouré des arcades du figuier d' Inde, si entrelacées, qu' elles formaient une haie impénétrable même à la vue.	1	195	37	1	0.02702702702702703	[['pendant']]
566	Il apercevait seulement au-dessus de leur feuillage les flancs rouges du rocher qui flanquait le vallon tout autour de lui;	1	196	20	1	0.05	[['rouge']]
567	il en sortait une petite source qui arrosait ce jardin planté sans ordre.	1	197	13	1	0.07692307692307693	[['petit']]
568	On y voyait pêle-mêle-mêle des mangoustans, des orangers, des cocotiers, des litchis, des durions, des manguiers, des jacquiers, des bananiers, et d' autres végétaux tous chargés de fleurs ou de fruits.	1	198	31	0	0.0	[]
569	Leurs troncs mêmes en étaient couverts;	1	199	6	1	0.16666666666666666	[['tronc']]
570	le bétel serpentait autour du palmier arec, et le poivrier le long de la canne à sucre.	1	200	17	1	0.058823529411764705	[['long']]
571	L' air était embaumé de leurs parfums.	1	201	7	0	0.0	[]
572	Quoique la plupart des arbres fussent encore dans l' ombre, les premiers rayons de l' aurore éclairaient déjà leurs sommets;	1	202	20	0	0.0	[]
573	on y voyait voltiger des colibris étincelants comme des rubis et des topazes, tandis que des bengalis et des sensa-soulé, ou cinq cents voix, cachés sous l' humide feuillée, faisaient entendre sur leurs nids leurs doux concerts.	1	203	38	2	0.05263157894736842	[['voix'], ['dou']]
574	Le docteur se promenait sous ces charmants ombrages, loin des pensées savantes et ambitieuses, lorsque le paria vint l' inviter à déjeuner.	1	204	22	0	0.0	[]
575	""" votre jardin est délicieux, dit l' anglais;"	1	205	7	1	0.14285714285714285	[['délicieux']]
576	je ne lui trouve d' autre défaut que d' être trop petit;	1	206	12	0	0.0	[]
577	à votre place, j' y ajouterais un boulingrin, et je l' étendrais dans la forêt.-seigneur, lui répondit le paria, moins on tient de place, plus on est à couvert: une feuille suffit au nid de l' oiseau-mouche.	1	207	38	0	0.0	[]
578	""" en disant ces mots, ils entrèrent dans la cabane, où ils trouvèrent dans un coin la femme du paria qui allaitait son enfant: elle avait servi le déjeuner."	1	208	28	0	0.0	[]
579	"Après un repas silencieux, le docteur se préparant à partir, l' indien lui dit: "" mon hôte, les campagnes sont encore inondées des pluies de la nuit, les chemins sont impraticables;"	1	209	31	0	0.0	[]
580	passez ce jour avec nous.-je ne le peux, dit le docteur, j' ai trop de monde avec moi.-jele vois, reprit le paria, vous avez hâte de quitter le pays des brames pour retourner dans celui des chrétiens, dont la religion fait vivre tous les hommes en frères.	1	210	47	0	0.0	[]
581	""" le docteur se leva en soupirant."	1	211	6	0	0.0	[]
582	Alors le paria fit un signe à sa femme, qui, les yeux baissés et sans parler, présenta au docteur une corbeille de fleurs et de fruits.	1	212	26	2	0.07692307692307693	[['oeil'], ['baissé']]
583	"Le paria, prenant la parole pour elle, dit à l' anglais: "" seigneur, excusez notre pauvreté;"	1	213	16	0	0.0	[]
584	nous n' avons, pour parfumer nos hôtes suivant l' usage de l' Inde, ni ambre gris, ni bois d' aloès;	1	214	20	2	0.1	[['parfumer'], ['gris']]
585	nous n' avons que des fleurs et des fruits;	1	215	9	0	0.0	[]
586	"mais j' espère que vous ne mépriserez pas cette petite corbeille remplie par les mains de ma femme: il n' y a ni pavots, ni soucis, mais des jasmins, du mougris et des bergamottes, symboles, par la durée de leurs parfums, de notre affection, dont le souvenir nous restera lors même que nous ne vous verrons plus. "" le docteur prit la corbeille, et dit au paria: "" je ne saurais trop reconnaître votre hospitalité, et vous témoigner toute l' estime que je vous porte: acceptez cette montre d' or;"	1	216	90	2	0.022222222222222223	[['petit'], ['main']]
587	elle est de Graham, le plus fameux horloger de Londres;	1	217	10	0	0.0	[]
588	on ne la remonte qu' une fois par an.	1	218	9	0	0.0	[]
589	""" le paria lui répondit: "" seigneur, nous n' avons pas besoin de montre;"	1	219	13	0	0.0	[]
590	nous en avons une qui va toujours, et qui ne se dérange jamais;	1	220	13	0	0.0	[]
591	c' est le soleil.-ma montre sonne les heures, ajouta le docteur.-nos oiseaux les chantent, repartit le paria.-au moins, dit le docteur, recevez ces cordons de corail pour faire des colliers rouges à votre femme et à votre enfant.-ma femme et mon enfant, répondit l' indien, ne manqueront jamais de colliers rouges, tant que notre jardin produira des pois d' angole.-acceptez donc, dit le docteur, ces pistolets pour vous défendre des voleurs dans votre solitude.-la pauvreté, dit le paria, est un rempart qui éloigne de nous les voleurs;	1	221	87	2	0.022988505747126436	[['rouge'], ['rouge']]
592	l' argent dont vos armes sont garnies suffirait pour les attirer.	1	222	11	0	0.0	[]
593	Au nom de Dieu qui nous protège, et de qui nous attendons notre récompense, ne nous enlevez pas le prix de notre hospitalité!-cependant, reprit l' anglais, je desirerais que vous conservassiez quelque chose de moi.-eh bien, mon hôte, répondit le paria, puisque vous le voulez, j' oserai vous proposer un échange: donnez-moi votre pipe, et recevez la mienne: lorsque je fumerai dans la vôtre, je me rappellerai qu' un pandect européen n' a pas dédaigné d' accepter l' hospitalité chez un pauvre paria.	1	223	84	0	0.0	[]
594	""" aussitôt le docteur lui présenta sa pipe de cuir d' Angleterre, dont l' embouchure était d' ambre jaune, et reçut en retour celle du paria, dont le tuyau était de bambou, et le fourneau de terre cuite."	1	224	37	1	0.02702702702702703	[['jaune']]
595	Ensuite il appela ses gens, qui étaient tous morfondus de leur mauvaise nuit passée; et après avoir embrassé le paria, il monta dans son palanquin.	1	225	25	0	0.0	[]
596	La femme du paria, qui pleurait, resta sur la porte de la cabane, tenant son enfant dans ses bras;	1	226	19	0	0.0	[]
597	mais son mari accompagna le docteur jusqu' à la sortie du bois, en le comblant de bénédictions.	1	227	17	0	0.0	[]
598	""" que Dieu soit votre récompense, lui disait-il, pour votre bonté envers les malheureux!"	1	228	14	0	0.0	[]
599	Que je lui sois en sacrifice pour vous!	1	229	8	0	0.0	[]
600	"Qu' il vous ramène heureusement en Angleterre, ce pays de savants et d' amis, qui cherchent la vérité par tout le monde pour le bonheur des hommes! "" le docteur lui répondit: "" j' ai parcouru la moitié du globe, et je n' ai vu partout que l' erreur et la discorde: je n' ai trouvé la vérité et le bonheur que dans votre cabane."	1	230	65	0	0.0	[]
601	""" en disant ces mots, ils se séparèrent l' un de l' autre en versant des larmes."	1	231	16	0	0.0	[]
602	Le docteur était déjà bien loin dans la campagne, qu' il voyait encore le bon paria au pied d' un arbre, qui lui faisait signe des mains pour lui dire adieu.	1	232	31	2	0.06451612903225806	[['pied'], ['main']]
603	Le docteur, de retour à Calcutta, s' embarqua pour Chandernagor, d' où il fit voile pour l' Angleterre.	1	233	18	0	0.0	[]
604	Arrivé à Londres, il remit les quatre-vingt-dix ballots de sesmanuscrits au président de la société royale, qui les déposa au muséum britannique, où les savants et les journalistes s' occupent encore aujourd' hui à en faire des traductions, des éloges, des diatribes, des critiques et des pamphlets.	1	234	47	1	0.02127659574468085	[['royal']]
605	Quant au docteur, il garda pour lui les trois réponses du paria sur la vérité.	1	235	15	0	0.0	[]
606	Il fumait souvent dans sa pipe;	1	236	6	0	0.0	[]
607	"et quand on le questionnait sur ce qu' il avait appris de plus utile dans ses voyages, il répondait: "" il faut chercher la vérité avec un cœur simple;"	1	237	29	0	0.0	[]
608	on ne la trouve que dans la nature;	1	238	8	0	0.0	[]
609	on ne doit la dire qu' aux gens de bien.	1	239	10	0	0.0	[]
610	""" à quoi il ajoutait: on n' est heureux qu' avec une bonne femme."	1	240	13	0	0.0	[]
