304	car, puisqu' ils persécutent ceux qui la leur disent, quel est le docteur qui osera les instruire?-celui, répondit le paria, qui persécute lui-même les hommes pour la leur apprendre;	0	304	29	0	0.0	[]
305	le malheur.-oh!	0	305	2	0	0.0	[]
306	Pour cette fois, homme de la nature, reprit l' anglais, je crois que vous vous trompez.	0	306	16	0	0.0	[]
307	Le malheur jette les hommes dans la superstition;	0	307	8	0	0.0	[]
308	il abat le cœur et l' esprit.	0	308	7	1	0.14285714285714285	[['abattre']]
309	Plus les hommes sont misérables, plus ils sont vils, crédules et rampants.-c' est qu' ils ne sont pas assez malheureux, repartit le paria.	0	309	23	0	0.0	[]
310	Le malheur ressemble à la montagne noire de Bember, aux extrémités du royaume brûlant de Lahor: tant que vous la montez, vous ne voyez devant vous que de stériles rochers;	0	310	30	3	0.1	[['noir'], ['extrémité'], ['brûler']]
311	mais quand vous êtes au sommet, vous apercevez le ciel sur votre tête, et à vos pieds le royaume de Cachemire.	0	311	21	2	0.09523809523809523	[['tête'], ['pied']]
312	""" "" charmante et juste comparaison!"	0	312	5	0	0.0	[]
313	Reprit le docteur;	0	313	3	0	0.0	[]
314	chacun, en effet, a dans la vie sa montagne à grimper.	0	314	11	0	0.0	[]
315	La vôtre, vertueux solitaire, a dû être bien rude, car vous êtes élevé par	0	315	14	1	0.07142857142857142	[['rude']]
316	-dessus tous les hommes que je connais.	0	316	7	0	0.0	[]
317	Vous avez donc été bien malheureux!	0	317	6	0	0.0	[]
318	Mais, dites-moi d' abord, pourquoi votre caste est-elle si avilie dans l' Inde, et celle des brames si honorée?	0	318	20	0	0.0	[]
319	Je viens de chez le supérieur de la pagode de Jagrenat, qui ne pense pas plus que son idole, et qui se fait adorer comme un dieu.-c' est, répondit le paria, parce que les brames disent que dans l' origine ils sont sortis de la tête du dieu Brama, et que les parias sont descendus de ses pieds.	0	319	58	1	0.017241379310344827	[['tête']]
320	Ils ajoutent de plus, qu' un jour Brama, en voyageant, demanda à manger à un paria, qui lui présenta de la chair humaine: depuis cette tradition, leur caste est honorée, et la nôtre est maudite dans toute l' Inde.	0	320	39	1	0.02564102564102564	[['chair']]
321	Il ne nous est pas permis d' approcher des villes, et tout naïre ou reispoute peut nous tuer, si nous l' approchons seulement à la portée de notre haleine.-par saint George, s' écria l' anglais, voilà qui est bien fouet bien injuste!	0	321	42	0	0.0	[]
322	Comment les brames ont-ils pu persuader une pareille sottise aux indiens?-en la leur apprenant dès l' enfance, dit le paria, et en la leur répétant sans cesse: les hommes s' instruisent comme les perroquets.-infortuné!	0	322	35	0	0.0	[]
323	Dit l' anglais, comment avez-vous fait pour vous tirer de l' abîme de l' infamie où les brames vous avaient jeté en naissant?	0	323	24	0	0.0	[]
324	Je ne trouve rien de plus désespérant pour un homme, que de le rendre vil à ses propres yeux: c' est lui ôter la première des consolations;	0	324	27	1	0.037037037037037035	[['oeil']]
325	car la plus sûre de toutes est celle qu' on trouve à rentrer en soi-même.	0	325	16	1	0.0625	[['rentrer']]
326	""" "" je me suis dit d' abord, reprit le paria: l' histoire du dieu Brama est-elle bien vraie?"	0	326	18	0	0.0	[]
327	Il n' y a que les brames, intéressés à se donner une origine céleste, qui la racontent.	0	327	17	1	0.058823529411764705	[['céleste']]
328	Ils ont sans doute imaginé qu' un paria avait voulu rendre Brama anthropophage, pour se venger des parias qui refusaient de croire ce qu' ils débitaient de leur sainteté.	0	328	29	0	0.0	[]
329	Après cela je me suis dit:supposons que ce fait soit vrai: Dieu est juste, il ne peut rendre toute une caste coupable du crime d' un de ses membres, lorsque la caste n' y a pas participé.	0	329	38	1	0.02631578947368421	[['membre']]
330	Mais en supposant que toute la caste des parias ait pris part à ce crime, leurs descendants n' en ont pas été complices.	0	330	23	0	0.0	[]
331	Dieu ne punit pas plus dans les enfants les fautes de leurs aïeux qu' ils n' ont jamais vus, qu' il ne punirait dans les aïeux les fautes de leurs petits-enfants qui ne sont pas encore nés.	0	331	37	0	0.0	[]
332	Mais supposons encore que j' aie part aujourd' hui à la punition d' un paria, perfide envers son Dieu il y a des milliers d' années, sans avoir eu part à on crime;	0	332	33	0	0.0	[]
333	est-ce que quelque chose pourrait subsister, haï de Dieu, sans être détruit aussitôt?	0	333	14	0	0.0	[]
334	Si j' étais maudit de Dieu, rien de ce que je planterais ne réussirait.	0	334	14	0	0.0	[]
335	Enfin, je me dis: je suppose que je sois haï de Dieu, qui me fait du bien; je veux tâcher de me rendre agréable à lui, en faisant, à son exemple, du bien à ceux que je devrais haïr.	0	335	39	1	0.02564102564102564	[['agréable']]
336	""" "" mais, lui demanda l' anglais, comment faisiez-vous pour vivre, étant repoussé de tout le monde?-d' abord, dit l' indien, je me dis:"	0	336	24	0	0.0	[]
337	si tout le monde est ton ennemi, sois à toi	0	337	10	1	0.1	[['ton']]
338	-même ton ami.	0	338	3	1	0.3333333333333333	[['ton']]
339	Ton malheur n' est pas au-dessus des forces d' un homme.	0	339	11	1	0.09090909090909091	[['ton']]
340	Quelque grande que soit la pluie, un petit oiseau n' en reçoit qu' une goutte à la fois.	0	340	18	2	0.1111111111111111	[['grand'], ['petit']]
341	J' allais dans les bois et le long des rivières chercher à manger;	0	341	13	1	0.07692307692307693	[['long']]
342	mais je n' y recueillais le plus souvent que quelque fruit sauvage, et j' avais à craindre les bêtes féroces: ainsi je connus que la nature n' avait presque rien fait pour l' homme seul, et qu' elle avait attaché mon existence à cette même société qui me rejetait de son sein.	0	342	52	0	0.0	[]
343	Je fréquentai alors les champs abandonnés, qui sont en grand nombre dans l' Inde, et j' y rencontrais toujours quelque plante comestible qui avait survécu à la ruine de ses cultivateurs.	0	343	31	1	0.03225806451612903	[['grand']]
344	Je voyageais ainsi de province en province, assuré de trouver partout ma subsistance dans les débris de l' agriculture.	0	344	19	0	0.0	[]
345	Quand je trouvais les semences de quelque végétal utile, je les ressemais, en disant: si ce n' est pas pour moi, ce sera pour d' autres.	0	345	26	0	0.0	[]
346	Je me trouvais moins misérable, en voyant que je pouvais faire quelque bien.	0	346	13	0	0.0	[]
347	Il y avait une chose que je desirais passionnément;	0	347	9	0	0.0	[]
348	c' était d' entrer dans quelques villes.	0	348	7	0	0.0	[]
349	J' admirais de loin leurs remparts et leurs tours, le concours prodigieux de barques sur leurs rivières, et de caravanes sur leurs chemins, chargées de marchandises qui y abordaient de tous les points de l' horizon;	0	349	36	0	0.0	[]
350	les troupes de gens de guerre, qui y venaient monter la garde du fond des provinces;	0	350	16	0	0.0	[]
351	les marches des ambassadeurs avec leurs suites nombreuses, qui y arrivaient des royaumes étrangers pour y notifier des événements heureux, ou pour y faire des alliances.	0	351	26	0	0.0	[]
352	Je m' approchais le plus qu' il m' était permis de leurs avenues, contemplant avec étonnement les longues colonnes de poussière que tant de voyageurs y faisaient lever, et je tressaillais de désirs à ce bruit confus qui sort des grandes villes, et qui dans les campagnes voisines ressemble au murmure des flots qui se brisent sur les rivages de la mer.	0	352	62	2	0.03225806451612903	[['long'], ['grand']]
353	Je me disais: une congrégation d' hommes de tant d' états différents, qui mettent en commun leur industrie, leurs richesses et leur joie, doit faire d' une ville un séjour de délices.	0	353	32	0	0.0	[]
354	Mais s' il ne m' est pas permis d' en approcher pendant le jour, qui m' empêche d' y entrer pendant la nuit?	0	354	23	2	0.08695652173913043	[['pendant'], ['pendant']]
355	Une faible souris, qui a tant d' ennemis, va et vient ou elle veut à la faveur des ténèbres;	0	355	19	1	0.05263157894736842	[['faible']]
356	elle passe de la cabane du pauvre dans le palais des rois.	0	356	12	0	0.0	[]
357	Pour jouir de la vie, il lui suffit de la lumière des étoiles: pourquoi me faut-il celle du soleil?	0	357	20	0	0.0	[]
358	C' était aux environs de Delhi que je faisais ces réflexions;	0	358	11	0	0.0	[]
359	elles m' enhardirent au point que j' entrai dans la ville avec la nuit: j' y pénétrai par la porte de Lahor.	0	359	22	1	0.045454545454545456	[['pénétrer']]
360	D' abord je parcourus une longue rue solitaire, formée, à droite et à gauche, de maisons bordées de terrasses, portées par des arcades, où sont les boutiques des marchands.	0	360	29	1	0.034482758620689655	[['long']]
361	De distance à autre je rencontrais de grands caravenserails bien fermés, et de vastes bazars ou marchés, où régnait le plus grand silence.	0	361	23	3	0.13043478260869565	[['grand'], ['vaste'], ['grand']]
362	En approchant de l' intérieur de la ville, je traversai le superbe quartier des omrahs, rempli de palais et de jardins situés le long de la Gemna.	0	362	27	2	0.07407407407407407	[['superbe'], ['long']]
363	Tout y retentissait du bruit des instruments et des chansons des bayadères, qui dansaient sur les bords du fleuve à la lueur des flambeaux.	0	363	24	0	0.0	[]
364	Je me présentai à la porte d' un jardin pour jouir d' un si doux spectacle;	0	364	16	1	0.0625	[['dou']]
365	mais j' en fus repoussé par des esclaves, qui en chassaient les misérables à coups de bâton.	0	365	17	0	0.0	[]
366	En m' éloignant du quartier des grands, je passai près de plusieurs pagodes de ma religion, où un grand nombre d' infortunés, prosternés à terre, se livraient aux larmes.	0	366	29	2	0.06896551724137931	[['grand'], ['grand']]
367	Je me hâtai de fuir à la vue de ces monuments de la superstition et de la terreur.	0	367	18	0	0.0	[]
368	Plus loin, les voix perçantes des mollahs,qui annonçaient du haut des airs les heures de la nuit, m' apprirent que j' étais au pied des minarets d' une mosquée.	0	368	30	3	0.1	[['voix'], ['haut'], ['pied']]
369	Près de là étaient les factoreries des européens, avec leurs pavillons, et des gardiens qui criaient sans cesse kuber-dar!	0	369	20	0	0.0	[]
370	prenez garde à vous!	1	0	4	0	0.0	[]
371	Je côtoyai ensuite un grand bâtiment, que je reconnus pour une prison, au bruit des chaînes et aux gémissements qui en sortaient.	1	1	22	1	0.045454545454545456	[['grand']]
372	J' entendis bientôt les cris de la douleur dans un vaste hôpital, d' où l' on sortait des chariots pleins de cadavres.	1	2	22	2	0.09090909090909091	[['vaste'], ['plein']]
373	Chemin faisant, je rencontrai des voleurs qui fuyaient le long des rues;	1	3	12	1	0.08333333333333333	[['long']]
374	des patrouilles de gardes qui couraient après eux;	1	4	8	0	0.0	[]
375	des groupes de mendiants qui, malgré les coups de rotin, sollicitaient aux portes des palais quelques débris de leurs festins, et partout des femmes qui se prostituaient publiquement pour avoir de quoi vivre.	1	5	33	0	0.0	[]
376	Enfin, après une longue marche dans la même rue, je parvins à une place immense, qui entoure la forteresse habitée par le grand Mogol.	1	6	24	2	0.08333333333333333	[['long'], ['grand']]
377	Elle était couverte de tentes des rajahs ou nababs de sa garde, et de leurs escadrons, distingués les uns des autres par des flambeaux, des étendards, et de longues cannes terminées par des queues de vaches du Thibet.	1	7	38	1	0.02631578947368421	[['long']]
378	Un large fossé plein d' eau, et hérissé d' artillerie, faisait, comme la place, le tour de la forteresse.	1	8	19	3	0.15789473684210525	[['large'], ['plein'], ['hérissé']]
379	Je considérais, à la clarté des feux de la garde, les tours du château qui s' élevaient jusqu' aux nues, et la longueur de ses remparts qui se perdaient dans l' horizon.	1	9	32	0	0.0	[]
380	J' aurais bien voulu y pénétrer; mais de grands korahs, ou fouets, suspendus à des poteaux, m' ôtèrent même le désirs de mettre le pied dans la place.	1	10	28	3	0.10714285714285714	[['pénétrer'], ['grand'], ['pied']]
381	Je me tins donc à une de ses extrémités, auprès de quelques nègres esclaves, qui me permirent de me reposer auprès d' un feu autour duquel ils étaient assis.	1	11	29	1	0.034482758620689655	[['extrémité']]
382	De là je considérai avec admiration le palais impérial, et je me dis: c' est donc ici que demeure le plus heureux des hommes!	1	12	24	1	0.041666666666666664	[['impérial']]
383	C' est pour son obéissance que tant de religions prêchent;	1	13	10	0	0.0	[]
384	pour sa gloire, que tant d' ambassadeurs arrivent;	1	14	8	0	0.0	[]
385	pour ses trésors, que tant de provinces s' épuisent; pour ses voluptés, que tant de caravanes voyagent;	1	15	17	0	0.0	[]
386	et pour sa sûreté, que tant d' hommes armés veillent en silence!	1	16	12	0	0.0	[]
387	""""	1	17	0	0	0	[]
388	pendant que je faisais ces réflexions, de grands cris de joie se firent entendre dans toute la place, et je vis passer huit chameaux décorés de banderoles.	1	18	27	2	0.07407407407407407	[['pendant'], ['grand']]
389	J' appris qu' ils étaient chargés de têtes de rebelles, que les généraux du Mogol lui envoyaient de la province du Décan, où un de ses fils, qu' il en avait nommé gouverneur, lui faisait la guerre depuis trois ans.	1	19	40	1	0.025	[['tête']]
390	Un peu après, arriva, à bride abattue, un courrier monté sur un dromadaire;	1	20	13	0	0.0	[]
391	il venait annoncer la perte d' une ville frontière de l' Inde, par la trahison d' un de ses commandants qui l' avait livrée au roi de Perse.	1	21	28	0	0.0	[]
392	à peine ce courrier était passé, qu' un autre, envoyé par le gouverneur du Bengale,vint apporter la nouvelle que des européens, auxquels l' empereur avait accordé, pour le bien du commerce, un comptoir à l' embouchure du Gange, y avaient bâti une forteresse, et s' y étaient emparés de la navigation du fleuve.	1	22	54	0	0.0	[]
393	Quelques moments après l' arrivée de ces deux courriers, on vit sortir du château un officier à la tête d' un détachement des gardes.	1	23	24	1	0.041666666666666664	[['tête']]
394	Le Mogol lui avait ordonné d' aller dans le quartier des omrahs, et d' en amener trois des principaux, chargés de chaînes, accusés d' être d' intelligence avec les ennemis de l' état.	1	24	33	0	0.0	[]
395	Il avait fait arrêter la veille un mollah, qui faisait dans ses sermons l' éloge du roi de Perse, et disait hautement que l' empereur des Indes était infidèle, parce que, contre la loi de Mahomet, il buvait du vin.	1	25	40	0	0.0	[]
396	Enfin, on assurait qu' il venait de faire étrangler et jeter dans la Gemna une de ses femmes, et deux capitaines de sa garde, convaincus d' avoir trempé dans la rébellion de son fils.	1	26	34	1	0.029411764705882353	[['étrangler']]
397	Pendant que je réfléchissais surces tragiques événements, une longue colonne de feu s' éleva tout-à-coup des cuisines du sérail;	1	27	19	2	0.10526315789473684	[['pendant'], ['long']]
398	ses tourbillons de fumée se cofondaient avec les nuages, et sa lueur rouge éclairait les tours de la forteresse, ses fossés, la place, les minarets des mosquées, et s' étendait jusqu' à l' horizon.	1	28	34	1	0.029411764705882353	[['rouge']]
399	Aussitôt les grosses timbales de cuivre, et les karnas ou grands hautbois de la garde, sonnèrent l' alarme avec un bruit épouvantable: des escadrons de cavalerie se répandirent dans la ville, enfonçant les portes des maisons voisines du château, et forçant, à grands coups de korahs, leurs habitants d' accourir au feu.	1	29	52	4	0.07692307692307693	[['grosse'], ['grand'], ['enfoncer'], ['grand']]
400	J' éprouvai aussi moi	1	30	4	0	0.0	[]
401	-même combien le voisinage des grands est dangereux aux petits.	1	31	10	1	0.1	[['grand']]
402	Les grands sont comme le feu, qui brûle même ceux qui lui jettent de l' encens, s' ils s' en approchent de trop près.	1	32	24	1	0.041666666666666664	[['grand']]
403	Je voulus m' échapper;	1	33	4	0	0.0	[]
404	mais toutes les avenues de la place étaient fermées.	1	34	9	0	0.0	[]
405	Il m' eût été impossible d' en sortir, si, par la providence deDieu, le côté où je m' étais mis n' eût été celui du serail.	1	35	26	0	0.0	[]
406	Comme les eunuques en déménageaient les femmes sur des éléphants, ils facilitèrent mon évasion;	1	36	14	0	0.0	[]
407	car si partout les gardes obligeaient, à coups de fouet, les hommes de venir au secours du château, les éléphants, à coups de trompe, les forçaient de s' en éloigner.	1	37	30	0	0.0	[]
408	Ainsi, tantôt poursuivi par les uns, tantôt repoussé par les autres, je sortis de cet affreux chaos;	1	38	17	0	0.0	[]
409	et, à la clarté de l' incendie, je gagnai l' autre extrémité du faubourg, où, sous des huttes, loin des grands, le peuple reposait en paix de ses travaux.	1	39	29	2	0.06896551724137931	[['extrémité'], ['grand']]
410	Ce fut là que je commençai à respirer.	1	40	8	0	0.0	[]
411	Je me dis: j' ai donc vu une ville!	1	41	9	0	0.0	[]
412	J' ai vu la demeure des maîtres des nations!	1	42	9	0	0.0	[]
413	Oh!	1	43	1	0	0.0	[]
414	De combien de maîtres ne sont-ils pas eux	1	44	9	0	0.0	[]
415	-mêmes les esclaves!	1	45	3	0	0.0	[]
416	Ils obéissent, jusque dans le temps du repos, aux voluptés, à l' ambition, à la superstition, à l' avarice: ils ont à craindre, même dans le sommeil, une foule d' êtres misérables et malfaisants dont ils sont entourés, des voleurs, des mendiants, des courtisanes, des incendiaires, et jusqu' à leurs soldats, leurs grands et leurs prêtres.	1	46	56	1	0.017857142857142856	[['grand']]
417	Que doit-ce être d' une ville pendant le jour, si elle est ainsi troublée pendant la nuit?	1	47	18	2	0.1111111111111111	[['pendant'], ['pendant']]
418	Les maux de l' homme croissent avec ses jouissances: combien l' empereur, qui les réunit toutes, n' est-il pas à plaindre!	1	48	22	0	0.0	[]
419	Il a à redouter les guerres civiles et étrangères, et les objets mêmes qui font sa consolation et sa défense, ses généraux, ses gardes, ses mollahs, ses femmes et ses enfants.	1	49	31	0	0.0	[]
420	Les fossés de sa forteresse ne sauraient arrêter les fantômes de la superstition;	1	50	13	0	0.0	[]
421	ni ses éléphants, si bien dressés, repousser loin de lui les noirs soucis.	1	51	13	1	0.07692307692307693	[['noir']]
422	Pour moi, je ne crains rien de tout cela: aucun tyran n' a d' empire ni sur mon corps ni sur mon âme.	1	52	23	1	0.043478260869565216	[['corps']]
423	Je peux servir Dieu suivant ma conscience, et je n' ai rien à redouter d' aucun homme, si je ne me tourmente moi-même: en vérité, un paria est moins malheureux qu' un empereur.	1	53	34	0	0.0	[]
424	En disant ces mots, les larmes me vinrent aux yeux; et tombant à genoux, je remerciai le ciel qui, pour m' apprendre à supporter mes maux, m' en avait montré de plus intolérables que les miens.	1	54	36	2	0.05555555555555555	[['oeil'], ['genou']]
425	""" depuis ce temps, je n' ai fréquenté dans Delhi que les faubourgs."	1	55	12	0	0.0	[]
426	De là je voyais les étoiles éclairer les habitations des hommes et se confondre avec leurs feux, comme si le ciel et la ville n' eussent fait qu' un même domaine.	1	56	31	0	0.0	[]
427	Quand la lune venait éclairer ce paysage, j' y apercevais d' autres couleurs que celles du jour.	1	57	17	1	0.058823529411764705	[['couleur']]
428	J' admirais les tours, les maisons et les arbres, à-la-fois argentés et couverts de crêpes, qui se reflétaient au loin dans les eaux de la Gemna.	1	58	26	1	0.038461538461538464	[['argenter']]
429	Je parcourais en liberté de grands quartiers solitaires et silencieux, et il me semblait alors que toute la ville était à moi.	1	59	22	1	0.045454545454545456	[['grand']]
430	Cependant l' humanité m' y aurait refusé une poignée de riz, tant la religion m' y avait rendu odieux!	1	60	19	0	0.0	[]
431	Ne pouvant donc trouver à vivre parmi les vivants,j' en cherchais parmi les morts;	1	61	15	0	0.0	[]
432	j' allais dans les cimetières manger sur les tombeaux les mets offerts par la piété des parents.	1	62	17	0	0.0	[]
433	C' était dans ces lieux que j' aimais à réfléchir.	1	63	10	0	0.0	[]
434	Je me disais: c' est ici la ville de la paix;	1	64	11	0	0.0	[]
435	ici ont disparu la puissance et l' orgueil;	1	65	8	0	0.0	[]
436	l' innocence et la vertu sont en sûreté: ici sont mortes toutes les craintes de la vie, même celle de mourir: c' est ici l' hôtellerie où pour toujours le charretier a dételé, et où le paria repose.	1	66	38	2	0.05263157894736842	[['mourir'], ['mourir']]
437	Dans ces pensées, je trouvais la mort désirable, et je venais à mépriser la terre.	1	67	15	0	0.0	[]
438	Je considérais l' orient d' où sortait à chaque instant une multitude d' étoiles.	1	68	14	0	0.0	[]
439	Quoique leurs destins me fussent inconnus, je sentais qu' ils étaient liés avec ceux des hommes, et que la nature qui a fait ressortir à leurs besoins tant d' objets qu' ils ne vaient pas, y avait au moins attaché ceux qu' elle offrait à leur vue.	1	69	47	0	0.0	[]
440	Mon âme s' élevait donc dans le firmament avec les astres;	1	70	11	0	0.0	[]
441	et lorsque l' aurore venait joindre à leurs douces et éternelles clartés ses teintes de rose, je me croyais aux portes du ciel.	1	71	23	3	0.13043478260869565	[['joindre'], ['douce'], ['rose']]
442	Mais dès que ses feux doraient les sommets des pagodes, je disparaissais comme une ombre;	1	72	15	0	0.0	[]
443	j' allais, loin des hommes, me reposer dans les champs au pied d' un arbre, où je m' endormais au chant des oiseaux.	1	73	23	1	0.043478260869565216	[['pied']]
444	""" "" homme sensible et infortuné, dit l' anglais, votre récit est bien touchant: croyez-moi, la plupart des villes ne méritent d' être vues que la nuit."	1	74	27	0	0.0	[]
445	Après tout, la nature a des beautés nocturnes qui ne sont pas les moins touchantes;	1	75	15	0	0.0	[]
446	un poète fameux de mon pays n' en a pas célébré d' autres.	1	76	13	0	0.0	[]
447	Mais, dites-moi, comment enfin avez-vous fait pour vous rendre heureux à la lumière du jour?	1	77	17	0	0.0	[]
448	""" "" c' était déjà beaucoup d' être heureux la nuit, reprit l' indien;"	1	78	13	0	0.0	[]
449	la nature ressemble à une belle femme, qui, pendant le jour, ne montre au vulgaire que les beautés de son visage, et qui, pendant la nuit, en dévoile de secrètes à son amant.	1	79	33	4	0.12121212121212122	[['bel'], ['pendant'], ['visage'], ['pendant']]
450	Maissi la solitude a ses jouissances, elle a ses privations;	1	80	10	0	0.0	[]
451	elle paraît à l' infortuné un port tranquille, d' où il voit s' écouler les passions des autres hommes sans en être ébranlé;	1	81	23	1	0.043478260869565216	[['port']]
452	mais, pendant qu' il se félicite de son immobilité, le temps l' entraîne lui-même.	1	82	14	1	0.07142857142857142	[['pendant']]
453	On ne jette point l' ancre dans le fleuve de la vie;	1	83	12	0	0.0	[]
454	il emporte également celui qui lutte contre son cours et celui qui s' y abandonne, le sage comme l' insensé; et tous deux arrivent à la fin de leurs jours, l' un après en avoir abusé, et l' autre sans en avoir joui.	1	84	43	1	0.023255813953488372	[['fin']]
455	Je ne voulais pas être plus sage que la nature, ni trouver mon bonheur hors des lois qu' elle a prescrites à l' homme.	1	85	24	0	0.0	[]
456	Je desirais surtout un ami à qui je pusse communiquer mes plaisirs et mes peines.	1	86	15	0	0.0	[]
457	Je le cherchai long	1	87	4	0	0.0	[]
458	-	1	88	0	0	0	[]
459	temps	1	89	1	0	0.0	[]
460	parmi mes égaux	1	90	3	0	0.0	[]
461	;	1	91	0	0	0	[]
462	mais je n' y vis que des envieux.	1	92	8	0	0.0	[]
463	Cependant	1	93	1	0	0.0	[]
464	j' en trouvai un sensible, reconnaissant, fidèle, et inaccessible aux préjugés: à la vérité, ce n' était pas dans mon espèce, mais dans celle des animaux;	1	94	26	0	0.0	[]
465	c' était ce chien que vous voyez.	1	95	7	0	0.0	[]
466	On l' avait exposé, tout petit, au coin d' une rue, où il était près de mourir de faim.	1	96	19	2	0.10526315789473684	[['petit'], ['mourir']]
467	Il me toucha de compassion;	1	97	5	0	0.0	[]
468	je l' élevai: il s' attacha à moi, et je m' en fis un compagnon inséparable.	1	98	16	0	0.0	[]
469	Ce n' était pas assez: il me fallait un ami plus malheureux qu' un chien, qui connût tous les maux de la société humaine, et qui m' aidât à les supporter;	1	99	31	0	0.0	[]
470	qui ne desirât que les biens de la nature, et avec qui je pusse en jouir.	1	100	16	0	0.0	[]
471	Ce n' est qu' en s' entrelaçant que deux faibles arbrisseaux résistent à l' orage.	1	101	15	1	0.06666666666666667	[['faible']]
472	La providence combla mes désirs en me donnant une bonne femme.	1	102	11	0	0.0	[]
473	Ce fut à la source de mes malheurs que je trouvai celle de mon bonheur.	1	103	15	0	0.0	[]
474	Une nuit que j' étais au cimetière des brames, j' aperçus, au clair de la lune, une jeune bramine, à demi couverte de son voile jaune.	1	104	26	1	0.038461538461538464	[['clair']]
475	à l' aspect d' une femme du sang de mes tyrans, je reculai d' horreur;	1	105	15	0	0.0	[]
476	mais je m' en rapprochai de compassion, en voyant le soin dont elle était occupée.	1	106	15	0	0.0	[]
477	Elle mettait à manger sur un tertre qui couvrait les cendres de sa mère, brûlée depuis peu, toute vive, avec le corps de son père, suivant l' usage de sa caste;	1	107	31	3	0.0967741935483871	[['brûler'], ['vif'], ['corps']]
478	et elle y brûlait de l' encens, pour appeler son ombre.	1	108	11	1	0.09090909090909091	[['brûler']]
479	Les larmes me vinrent aux yeux, en voyant une personne plus infortunée que moi.	1	109	14	1	0.07142857142857142	[['oeil']]
480	Je me dis:	1	110	3	0	0.0	[]
481	hélas!	1	111	1	0	0.0	[]
