1066	Je n' en dis pas davantage aujourd' hui, reprit Brochure, parce que je suis chargé de la part des deux parties de faire imprimer les mémoires qu' elles ont fait à ce sujet.	66	117	33	0	0.0	[]
1067	J' en retiens deux exemplaires, repartit le chevalier, un pour le Vicomte De Marné, et l' autre pour moi.	66	118	19	0	0.0	[]
1068	Ah!	66	119	1	0	0.0	[]
1069	Vous connaissez donc ce M De Marné, répliqua le colporteur?	66	120	10	0	0.0	[]
1070	Presqu' autant qu' il connaissait la femme du baron, répondit le chevalier.	66	121	12	0	0.0	[]
1071	Le petit vicomte aurait-il eu Madame De Mérival, demanda la marquise?	66	122	12	1	0.08333333333333333	[['petit']]
1072	Oui, madame, reprit Brochure, et n' en déplaise à l' amitié que m.	66	123	13	0	0.0	[]
1073	Le chevalier a pour lui, les procédés qu' il a eus avec la baronne l' ont déshonoré.	66	124	17	0	0.0	[]
1074	Voilà de grandsmots, m.	66	125	4	0	0.0	[]
1075	Le colporteur, repartit le chevalier.	66	126	5	0	0.0	[]
1076	Je suis sûr de mon fait, répondit celui-ci; et quand vous m' aurez entendu, je doute fort que vous soyez encore l' ami de M De Marné.	66	127	27	1	0.037037037037037035	[['fort']]
1077	Ecoutons donc, répliqua la marquise.	66	128	5	0	0.0	[]
1078	Madame De Mérival, continua Brochure, ressemblait à beaucoup de femmes;	66	129	10	0	0.0	[]
1079	elle épousa le baron sans amour, et celui-ci ne voulant point se séparer en bonne forme de son épouse, et continuant de vivre, Madame De Mérival prit le parti d' avoir un amant, retirée dans un vieux château de Normandie, où elle passait sa vie à jouer au volant , et à lire le petit pompée , rapsodie qui a entamé l' espèce de réputation que l' auteur des mœurs s' était faite, et que la diction tudesque de la gazette de Bruxelles lui a totalement enlevée.	66	130	85	2	0.023529411764705882	[['vieux'], ['petit']]
1080	C' est le destin de cette gazette, reprit le chevalier, d' être toujours écrite par des gens qui parlent notre langue, comme on la parle à Vienne et dans le léopolstad .	66	131	31	0	0.0	[]
1081	M Néron, malgré sa qualité transcendante d' avocat en parlement, rédigeoit cette feuille politique en Allemand francisé.	66	132	17	0	0.0	[]
1082	Son trop illustre successeur, le fameux Maubert De Gouvest, avait beaucoup plus de force dans le raisonnement que l' ex-avocat, mais beaucoup moins de pureté dans le style;	66	133	28	0	0.0	[]
1083	toutes ses phrases commencent par ces mots vicieux, ç	66	134	9	0	0.0	[]
1084	' a été ;	66	135	2	0	0.0	[]
1085	il met toujours le mot fut pour alla , celui de récompense pour indemnité , et commet trois mille autres fautes aussi grossières, que l' on relevera avec soin dans le catalogue raisonné de ses ouvrages, qui terminera l' histoire de sa vie actuellement sous presse.	66	136	44	1	0.022727272727272728	[['relever']]
1086	M Toussaint, autre avocat en parlement, n' écrit pas une gazette qu' elle ne soit remplie d' inversions germaniques;	66	137	19	0	0.0	[]
1087	il ne sait pourtant pas un mot d' allemand: il faut que ce soit un vice de terroir, auquel cas ces trois innocent ne méritent pas les épigrammes dont je viens de les affubler mal à propos.	66	138	37	0	0.0	[]
1088	M. Le chevalier répare joliment, dit Brochure, en reprenant l' histoire de Madame De Mérival.	66	139	15	0	0.0	[]
1089	La baronne, continua-t-il, lassée d' un train de vie aussi fastidieux, cassa un beau jour ses raquettes, jeta le petit pompée au feu, et chercha un amusement plus doux dans la société d' un homme aimable.	66	140	38	3	0.07894736842105263	[['casser'], ['beau'], ['petit']]
1090	Le Vicomte	66	141	2	0	0.0	[]
1091	De Marné se présenta;	66	142	4	0	0.0	[]
1092	c' est une de ses figures chiffonnées qui ne piquent point, mais qui plaisent.	66	143	14	2	0.14285714285714285	[['figure'], ['chiffonner']]
1093	La baronne l' écouta, et elle devint sensible.	66	144	8	0	0.0	[]
1094	Le vicomte obligé de retourner à Paris, convint d' une personne discrete, sous l' enveloppe de qui il écrirait à Madame De Mérival.	66	145	23	0	0.0	[]
1095	Les adieux furent touchant, les pleurs et les plaisirs les scélerent.	66	146	11	1	0.09090909090909091	[['pleur']]
1096	Le vicomte ne fut pas plutôt arrivé, qu' il écrivit les lettres les plus tendres à la baronne qui,aimant de bonne foi, répondit sur le même ton.	66	147	28	1	0.03571428571428571	[['tendre']]
1097	Ce commerce, dont Madame De Mérival ne prévoyait pas les suites, dura pendant trois mois.	66	148	15	1	0.06666666666666667	[['pendant']]
1098	M	66	149	1	0	0.0	[]
1099	De Marné qui observait un ordre didactique dans ses intrigues galantes, revint en Normandie, et jouant l' homme inquiet, il mit la baronne dans le cas de lui demander d' où provenait le chagrin qui semblait le dévorer.	66	150	38	0	0.0	[]
1100	Quel pays que Paris, madame, s' écria-t-il!	66	151	9	0	0.0	[]
1101	Quel pays!	66	152	2	0	0.0	[]
1102	Je suis en marché d' une charge à la cour, elle convient à ma situation et à mon nom;	66	153	19	0	0.0	[]
1103	avec cent mille francs de bons contrats, je n' ai trouvé que vingt mille écus;	66	154	15	0	0.0	[]
1104	les notaires sont des arabes.	66	155	5	0	0.0	[]
1105	Il me manque vingt mille francs, je comptais les trouver ici chez mes fermiers, mais les nouveaux impôts dont ils viennent d' être chargés, ne leur permettant point de faire cette avance	66	156	32	0	0.0	[]
1106	, je me vois déshonoré, faute de pouvoir remplir les conditions de mon contrat.	66	157	13	0	0.0	[]
1107	Vous m' effrayez, vicomte, répondit Madame De Mérival, en parlant ainsi;	66	158	11	0	0.0	[]
1108	votre triste confidence me pèse d' autant plus, que vous connaissez ma situation: réduite à une chétive pension de deux mille francs, je me trouve dans l' affreuse impossibilité de vous tirer de ce mauvais pas.	66	159	36	2	0.05555555555555555	[['triste'], ['peser']]
1109	Ah, ciel!	66	160	2	0	0.0	[]
1110	Qu' osez-vous dire, repartit le vicomte en colère?	66	161	9	0	0.0	[]
1111	M' estimeriez-vous assez peu pour vouloir m' engager à recevoir un bienfait qui m' humilierait?Je ne vous retrouve pas là, ma chère baronne, et j' ai cru que vous me connaissiez mieux.	66	162	33	0	0.0	[]
1112	Mais qu' allez-vous devenir, repartit Madame De Mérival?	66	163	9	0	0.0	[]
1113	Ma résolution est prise, poursuivit M De Marné, j' ai un vieux oncle qui vit dans une terre qu' il a aux pieds des Pyrénées, je vais me sequestrer pour jamais, en cachant au reste de l' univers ma retraite et mon nom.	66	164	43	2	0.046511627906976744	[['vieux'], ['pied']]
1114	Mais ce dessein, reprit la baronne, n' est pas sage.	66	165	10	0	0.0	[]
1115	Pensons de sang froid, et imaginons quelque expédient honnête qui vous tire d' embarras.	66	166	14	1	0.07142857142857142	[['froid']]
1116	J' ai tout vu, madame, répliqua le vicomte, les hommes sont des tyrans, je les quitte avec plaisir.	66	167	18	0	0.0	[]
1117	Le seul regret qui me suivra dans ma retraite, et que j' emporterai au tombeau, est celui de vous perdre.	66	168	20	0	0.0	[]
1118	Heureux encore dans ma douleur de trouver une consolation dans votre portrait et dans vos lettres!	66	169	16	0	0.0	[]
1119	Adieu, madame, dit-il, d' une voix entrecoupée par les sanglots;	66	170	11	1	0.09090909090909091	[['voix']]
1120	puissiez-vous vivre heureuse, je ne mourrai jamais que de la douleur de vous avoir perdue.	66	171	16	1	0.0625	[['mourir']]
1121	Non, non, reprit la baronne en se jetant au cou de son amant, vous ne partirez point, à moins qu' insensible à mes prières, vous ne vouliez que ma mort suive ce funeste instant.	66	172	34	1	0.029411764705882353	[['cou']]
1122	Vos désirs sont des ordres pour moi, reprit le vicomte; mais m' estimez-vous assez peu pour m' exposer à montrerà toute la cour ma honte et ma médiocrité?	66	173	29	0	0.0	[]
1123	Ecoutez, répliqua la respectable Madame De Mérival, vos fermiers vous donneront de l' argent dans des temps plus heureux.	66	174	19	0	0.0	[]
1124	Et oui, madame, répondit M De Marné; mais puis-je attendre six mois?	66	175	13	0	0.0	[]
1125	Ce délai est trop long, et je perds tout.	66	176	9	1	0.1111111111111111	[['long']]
1126	Un moment, reprit la baronne, vous ne perdez rien, et j' ai un moyen infaillible de vous tirer d' embarras.	66	177	20	0	0.0	[]
1127	Je l' accepterai avec plaisir, repartit le vicomte, mais à condition qu' il ne vous compromettra point.	66	178	17	0	0.0	[]
1128	En rien, répliqua Madame De Mérival;	66	179	6	0	0.0	[]
1129	j' ai mes diamants ici, je n' en porte jamais à la campagne: je puis en disposer pour six mois;	66	180	20	0	0.0	[]
1130	partez sans dire mot pour Rouen, où vous trouverez sans peine les vingt-mille francs qui vous manquent, sur trente mille écus de bijoux.	66	181	23	0	0.0	[]
1131	Mais, répondit M De Marné, pouvez-vous bien me proposer des arrangement qui blessent ma délicatesse?	66	182	16	0	0.0	[]
1132	Point de repliques, dit vivement la baronne: si j' avais besoin d' une somme d' argent, et que je fusse sûre de vous la rendre dans un terme convenu, je ne trouverais pas mauvais que vous missiez des effets en gages pour me la procurer.	66	183	45	0	0.0	[]
1133	Ces mots me désarment, répliqua le vicomte, et je me rends à vos ordres: mais souvenez-vous toujours que vous me l' ordonnez.	66	184	23	0	0.0	[]
1134	M	66	185	1	0	0.0	[]
1135	De Marné, muni de l' écrainde Madame De Mérival, partit pour Rouen, d' où il écrivit à la baronne qu' il avait rempli son objet, et qu' il allait le lendemain à Paris, à l' effet d' y consommer son marché, comme il n' y avait rien que de très-naturel dans la lettre du vicomte, la baronne lui répondit à Paris à son adresse ordinaire: mais deux couriers étant arrivés sans qu' elle reçut de réponse, elle eut quelques inquiétudes.	66	186	81	1	0.012345679012345678	[['naturel']]
1136	Ces premières alarmes ne firent que glisser sur son esprit, parce que la candeur de son âme, et la sincérité de ses procédés, lui faisant croire que chacun lui ressemblait, elle ne pouvait soupçonner personne de fourberie.	66	187	37	0	0.0	[]
1137	Madame De Mérival, trompée par une passion vive qui lui faisait illusion, attendait toujours des nouvelles de son amant;	66	188	19	1	0.05263157894736842	[['vif']]
1138	mais un gentilhomme du voisinage, qui arrivait de Rouen, parlant du gros jeu qu' on y jouait, nomma parmi les heureux le Vicomte	66	189	23	1	0.043478260869565216	[['gros']]
1139	De Marné, qui venait de gagner quatre-vingt mille livres.	66	190	9	0	0.0	[]
1140	Ces mots commenceront à éclairer la baronne sur le caractère du vicomte;	66	191	12	0	0.0	[]
1141	elle écrivit à Rouen à une de ses amies qui pût l' instruire de la conduite que Monsieur De Marné y menait.	66	192	22	0	0.0	[]
1142	La réponse qu' elle reçut, l' accabla du chagrin le plus cuisant;	66	193	12	0	0.0	[]
1143	on lui marqua que le vicomte qui avait gagné des sommes immenses, entretenait la petite Bernaut, actrice de la comédie;	66	194	20	1	0.05	[['petit']]
1144	qu' il venoitde lui donner une demi-fortune , et des robes de grand prix.	66	195	13	1	0.07692307692307693	[['grand']]
1145	Ces funestes éclaircissement déciderent le caractère de Monsieur De Marné dans l' esprit de Madame De Mérival;	66	196	17	0	0.0	[]
1146	elle jugea dès-lors qu' il était un escroc.	66	197	9	0	0.0	[]
1147	Le mot est dur, monsieur le chevalier.	66	198	7	1	0.14285714285714285	[['dur']]
1148	Et très-convenable, si tu dis vrai, repartit celui-ci en rougissant, car Madame De Sarmé le connaissait très-peu délicat sur l' intérêt.	66	199	23	1	0.043478260869565216	[['délicat']]
1149	Convenez, dit la marquise, que vous aviez là un vilain ami.	66	200	11	1	0.09090909090909091	[['vilain']]
1150	Oh, répondit le chevalier, c' est un malheureux que je connaissais mal;	66	201	12	0	0.0	[]
1151	le bandeau tombe, et je le livre aux épigrammes de Brochure.	66	202	11	0	0.0	[]
1152	Ce premier trait, quelque fripon qu' il soit, n' est rien en le comparant à celui que je vais vous rapporter.	66	203	21	1	0.047619047619047616	[['fripon']]
1153	Les six mois expirerent, et la baronne n' ayant eu aucune nouvelle de Marné, tomba dans une langueur qui fit craindre pour ses jours.	66	204	24	0	0.0	[]
1154	Son mari manda	66	205	3	0	0.0	[]
1155	les médecins les moins ignorant de la province, et le résultat de leurs consultations fut d' ordonner un changement d' air à la malade qui se disposa de retourner à Paris;	66	206	31	0	0.0	[]
1156	et comme elle était dans un état à ne pouvoir vaquer par elle-même aux arrangement relatifs à son départ, et que son mari ne voulait point que ses diamants fussent confiés àune femme-de-chambre, il la pria de les lui remettre.	66	207	40	0	0.0	[]
1157	La baronne tomba à ces mots dans une faiblesse que lui ravit l' usage de tous ses sens;	66	208	18	0	0.0	[]
1158	Monsieur De Mérival appela du secours, et parvint à faire revenir sa femme qui, ne pouvant feindre, lui raconta la fripponnerie du vicomte.	66	209	23	0	0.0	[]
1159	Le baron partit en recommandant Madame De Mérival aux soins de ses gens, et il arriva le même soir à Rouen.	66	210	21	0	0.0	[]
1160	Marné y était trop connu pour qu' on ignorât sa demeure;	66	211	11	0	0.0	[]
1161	le baron se rendit chez lui et débuta par lui demander l' écrain de sa femme.	66	212	16	0	0.0	[]
1162	Le vicomte, qui voulait profiter du grand âge et de la faiblesse du baron, fit l' insolent, et dit que ces sortes d' affaires ne se décidoient qu' à la campagne.	66	213	31	1	0.03225806451612903	[['grand']]
1163	Quand vous m' aurez restitué, reprit Mérival, les diamants de ma femme, nous irons où vous voudrez:	66	214	17	0	0.0	[]
1164	mais je vous déclare que si vous ne me les remettez sur le champ, je vais vous poursuivre en justice.	66	215	20	0	0.0	[]
1165	Et moi, répondit Marné, je vous signifie que si vous faites la moindre démarche, je vais faire imprimer un recueil de 150 lettres galantes de Madame De Mérival.	66	216	28	0	0.0	[]
1166	Vous connaissez, continua-t-il, en ouvrant son bureau et lui montrant les billets de la baronne, vous connaissez ce caractère: eh bien, le public va rire à vos dépens;	66	217	30	1	0.03333333333333333	[['rir']]
1167	je n' en ferai tirer que 3000 exemplaires que j' aurai soin de répandre à Paris et dans toutes les provincesdu royaume.	66	218	22	0	0.0	[]
1168	Un coup de foudre aurait moins accablé le baron que ces derniers mots.	66	219	13	0	0.0	[]
1169	Malgré son abattement, il eut le courage de demander la lecture de quelques-unes de ces lettres, et le vicomte l' insolence de lui accorder cette grâce barbare.	66	220	28	0	0.0	[]
1170	Mérival, outré des perfidies de sa femme, dont il aurait soutenu l' innocence contre tout l' arrière-ban de la Normandie, tomba dans un fauteuil, et demanda, d' une voix attendrie, si la restitution de ces lettres ne pouvait pas compenser l' écrain.	66	221	42	2	0.047619047619047616	[['voix'], ['attendrir']]
1171	Les diamants, répliqua impudemment Marné, m' ont été donnés;	66	222	9	0	0.0	[]
1172	et je les garde, parce que rien n' est si pur que le don.	66	223	14	1	0.07142857142857142	[['pur']]
1173	Les lettres m' ont été écrites, elles sont à moi, et j' en ferai mon profit.	66	224	16	0	0.0	[]
1174	Un libraire de cette ville, à qui je les ai lues, m' en offre déjà 100 louis, jugez du prix qu' il y mettra, quand il saura le nom de celle qui les écrit.	66	225	34	0	0.0	[]
1175	Mérival assommé, offrit 150 louis des lettres de sa femme.	66	226	10	0	0.0	[]
1176	Le scélérat de Marné osa balancer long-temps sur la médiocrité du prix, et finit par mettre le comble à ses escroqueries, en ruinant un honnête homme, dont il allait combler la disgrâce en déchirant son cœur.	66	227	37	1	0.02702702702702703	[['long']]
1177	Mérival eut à peine la force de se lever et de gagner sa chaise à porteurs.	66	228	16	0	0.0	[]
1178	Quoique le jour fût tombé, il prit des chevaux de poste, et arriva chez lui au milieu de la nuit.	66	229	20	0	0.0	[]
1179	Une affluence de monde, quiremplissoit la cour du château, lui fit présumer que la baronne touchait à sa dernière heure.	66	230	20	0	0.0	[]
1180	Il entra, hors de lui-même, dans l' appartement de sa femme, qui n' eut que le temps de lui demander pardon, et de rendre la vie entre ses bras.	66	231	29	0	0.0	[]
1181	Mérival, que ce funeste spectacle avait attendri, voulut embrasser son épouse qu' il appela des noms les plus doux: mais il ne trouva plus qu' une ombre.	66	232	27	1	0.037037037037037035	[['attendrir']]
1182	Ses gens l' emporterent dans son appartement, où, après avoir brûlé les lettres qu' il venait d' acheter, il rendit le dernier soupir, en prononçant le nom du malheureux qui venait de le priver de sa femme et du jour.	66	233	40	1	0.025	[['brûler']]
1183	Ah, quel monstre!	66	234	3	0	0.0	[]
1184	S' écria la marquise, et que les femmes sont à plaindre, quand, sous des dehors gracieux, des scélérats parviennent à les subjuguer.	66	235	22	1	0.045454545454545456	[['gracieux']]
1185	On prétend, reprit le colporteur, qu' un coquin de la même trempe, qui vit actuellement avec la Fauconnier, vice-doyenne de nos messalines, lui a donné les premiers élémens de cette fatale science: je le croirais d' autant plus volontiers, qu' ils ont composé en société le dictionnaire du monde .	66	236	49	0	0.0	[]
1186	Eh, quel est ce livre, repartit la marquise?	66	237	8	0	0.0	[]
1187	Je suis surprise que vous ne me l' ayez pas apporté dans le temps.	66	238	14	0	0.0	[]
1188	C' était mon projet, madame, répliqua le colporteur;	66	239	8	0	0.0	[]
1189	mais la police craignant que ce dictionnaire ne formât des cartouches d' un nouveau genre, elle me défendit d' en vendre;	66	240	21	0	0.0	[]
1190	il ne m' en reste que cet exemplaire, que je fais connaître aux pratiques qui demandent à le parcourir.	66	241	19	0	0.0	[]
1191	Ah!	66	242	1	0	0.0	[]
1192	Parbleu, dit le chevalier, nous en lirons quelque chose.	66	243	9	0	0.0	[]
1193	Voyez, monsieur, et amusez-vous, répondit Brochure, en lui remettant le livre.	66	244	12	0	0.0	[]
1194	Voyons d' abord le titre, reprit le chevalier: dictionnaire du monde, nécessaire à tous les gens aimables qui veulent ruiner les femmes, composé par un gentilhomme florentin, revu par deux chevaliers gascons, et publié par l' auteur de la comédie des tuteurs .	66	245	42	0	0.0	[]
1195	Quel mot chercherons-nous, continua le chevalier?	66	246	7	0	0.0	[]
1196	Ah, ma foi, répondit Madame De Sarmé, tirez trois ou quatre articles au hasard.	66	247	14	0	0.0	[]
1197	Soit, reprit le chevalier;	66	248	4	0	0.0	[]
1198	ouvrons.	66	249	1	0	0.0	[]
1199	actrice.	67	0	1	0	0.0	[]
1200	une actrice est bonne à connaître, quand elle est, comme cela arrive très-souvent, belle et sans talents: il faut sans lui avoir fait la moindre déclaration, rompre des lances pour elle dans les tables d' hôte, aux cafés, dans les cercles, et sur-tout aux foyers du spectacle où elle est attachée.	68	0	52	1	0.019230769230769232	[['bel']]
1201	Ce zèle lui parvient, et la médiocrité ayant besoin d' appui, elle vous fait rechercher.	68	1	15	0	0.0	[]
1202	L' occasion est trop favorable pour n' être pas saisie.	68	2	10	0	0.0	[]
1203	Vous y courez un bras en écharpe, parce que vous devez lui persuader que vous vous êtes battucontre l' amant d' une autre actrice qui est sa rivale.	68	3	28	1	0.03571428571428571	[['bras']]
1204	Votre situation, dont vous glissez un mot dans la conversation, la touche d' autant plus que vous ne lui faites aucune proposition tendre.	68	4	23	0	0.0	[]
1205	Elle vous offre des secours, et si l' amant qui l' entretient n' est pas homme à l' enrichir dans peu, vous lui procurez un jeune hollandais, un mylord à guinées, un américain embarassé de sa fortune, ou un vieux financier, et vous prenez, suivant l' usage, cinq pour cent par mois sur la somme que le monsieur paie.	68	5	59	2	0.03389830508474576	[['hollandais'], ['vieux']]
1206	Voilà de jolis préceptes, dit le chevalier, poursuivons.	68	6	8	1	0.125	[['joli']]
1207	boire.	69	0	1	0	0.0	[]
1208	est un vice dans la société générale: il faut qu' un gentilhomme, qui aspire à la connaissance du monde, conserve son sang froid dans toutes les occasions où il doit entrer en commerce avec le beau sexe.	70	0	37	2	0.05405405405405406	[['froid'], ['beau']]
1209	Il est cependant important que, s' attachant au goût d' une femme, il essaie dans un repas tête-à-tête si le vin la rend tendre;	70	1	24	0	0.0	[]
1210	il doit, dans ce cas, lui faire perdre insensiblement sa raison: une femme dans cet état ne refuse rien de tout ce qu' on lui demande, et quand elle ne s' exécute pas, on prend;	70	2	35	0	0.0	[]
1211	elle croit le lendemain qu' elle a donné.	70	3	8	0	0.0	[]
1212	jalousie.	71	0	1	0	0.0	[]
1213	quand un homme est parvenu à rendre une femme folle de lui, et qu' il l' a soutirée au caramel (ce sont les termesde l' art) il doit s' en éloigner; mais pour se conserver une réputation d' honnêteté auprès des autres femmes, il faut qu' il mette de la décence dans ses procédés, et que, jouant le jaloux, il attribue le moindre geste, la phrase la plus indifférente, la promenade la moins suspecte, le compliment le plus trivial à un esprit de coquetterie qui cherche un nouvel amant.	72	0	89	0	0.0	[]
1214	On veut s' excuser, il n' écoute rien, il s' emporte, et s' éloigne en feignant de pleurer son malheur et de regretter celle qu' il abandonne.	72	1	27	0	0.0	[]
1215	Il faut observer cependant que s' il survenait une succession ou quelque avantage inattendu à la femme qu' on quitte, on renouera avec elle en pratiquant le précepte qui se trouve au mot explication .	72	2	34	0	0.0	[]
1216	lettres.	73	0	1	0	0.0	[]
1217	aussi	74	0	1	0	0.0	[]
1218	-tôt que l' on est parvenu à mériter ou à surprendre les faveurs d' une femme, il faut s' assurer d' elle, et des moyens de la déshonorer en cas qu' elle ne paie point le tribut.	74	1	37	0	0.0	[]
1219	Pour remplir ce plan avec succès, il suffira de lui écrire des lettres tendres et pleines de confiance;	74	2	18	2	0.1111111111111111	[['tendre'], ['plein']]
1220	son esprit flatté échauffera son cœur, et elle répondra de façon à avouer sa honte et sa défaite.	74	3	18	0	0.0	[]
1221	Ces lettres deviennent alors un titre avec lequel on la perd dans le monde, quand on n' en espère pas tout le bien qu' elle pourrait faire.	74	4	27	0	0.0	[]
1222	Oh, l' infâme vicomte, dit la marquise, n' a mis que trop efficacement, pourle malheur de la pauvre baronne, ces odieuses leçons en usage!	74	5	24	0	0.0	[]
1223	L' article est de lui, répondit Brochure.	74	6	7	0	0.0	[]
1224	Il est bon, reprit le chevalier, de lire ce dictionnaire, pour connaître toutes les fripponneries de ces marauds qui viennent en imposer par des équipages brillant, et des habits d' éclat, qui sont le fruit de la scélératesse;	74	7	38	0	0.0	[]
1225	allons plus avant.	74	8	3	0	0.0	[]
1226	monde.	75	0	1	0	0.0	[]
1227	le monde est un labyrinthe d' où l'	76	0	8	0	0.0	[]
1228	on ne peut se tirer qu' avec le fil d' ariane ;	76	1	11	0	0.0	[]
1229	il faut donc que la jeune noblesse qui aspire à jouer un rôle dans la société, sorte de l' enveloppe grossière où l' ignorance et le défaut de l' éducation la tiennent ensévelie, et que connaissant les usages, elle puisse résister aux maneges des femmes intéressées, amener dans ses filets celles qui paient par excès de tempérament, ou par défaut d' appas, et briller aux dépens de ces douairieres sexagénaires, qui veulent se rappeler leur jeune âge et les plaisirs qui y étaient attachés.	76	2	84	1	0.011904761904761904	[['briller']]
1230	Pour attirer une femme intéressée dans le piège;	76	3	8	0	0.0	[]
1231	il faut l' aborder avec un air insolent d' opulence, lui persuader qu' on n' a pour elle qu' une fantaisie qu' on veut satisfaire aux dépens de sa bourse;	76	4	30	0	0.0	[]
1232	montrer de l' or, faire des promesses, jouir et partir.	76	5	10	0	0.0	[]
1233	Comme ces créatures ne veulent pas passer pour dupes, dans la crainte d' être rayées du catalogue, elles se taisent, et on va en tromper d' autres.	76	6	27	0	0.0	[]
1234	Celles qui joignent la laideur au tempérament, méritent des efforts et des égards à la première entrevue.	76	7	17	0	0.0	[]
1235	Comme ces préceptes sont la quintessence de l' esprit du monde, on prie les candidats d' apporter la plus grande attention à ce qui suit.	76	8	25	1	0.04	[['grand']]
1236	les efforts consistent à dompter la répugnance que la figure de l' objet auquel	77	0	14	1	0.07142857142857142	[['figure']]
1237	on se lie, peut inspirer: ce dégoût surmonté, il faut jouer le galant, l' empressé;	77	1	15	0	0.0	[]
1238	ne point penser à tout ce qui peut révolter, et diviniser même les imperfections de la nature.	77	2	17	0	0.0	[]
1239	Il arrive presque toujours qu' une femme qui est dans ce cas, doute qu' un joli homme puisse penser ainsi: elle vous accuse de flatterie;	77	3	25	1	0.04	[['joli']]
1240	c' est alors que, ranimant toute votre ardeur, vous devez lui prouver, par des déclarations réitérées, que vous êtes sincère.	77	4	20	0	0.0	[]
1241	Cette première épreuve lui donne bonne idée d' elle-même et de votre sincérité;	77	5	13	0	0.0	[]
1242	l' objet est de la maintenir dans cette erreur pendant quelques jours, et le meilleur moyen d' y parvenir, est d' employer ce que nous appelons les égards , c' est-à-dire, qu' il faut montrer un grand désintéressement, et beaucoup de tendresse: on peut seulement se permettre quelques déclamations contre la dureté des temps, l' avarice des parents, ou contre l' odieuse économie des tuteurs.	77	6	64	2	0.03125	[['pendant'], ['grand']]
1243	Ces propos glissés avec art, trouvent leur place à la seconde entrevue,et la voluptueuse bégueule est ruinée par gradation, sans espoir de ressources.	77	7	24	1	0.041666666666666664	[['voluptueux']]
