1403	mais quand on connaît le théatre, et qu' on veut suivre de près cet usurpateur de réputation, on est forcé de convenir qu' il n' a pour lui que la beauté de l' attitude, et l' expression des gestes: encore verrait-on, si on les suivait de près, qu' ils ne sont pas naturels, et qu' étant compensés au miroir, ils ont une uniformité qui, sentant l' étude et la contrainte, n' a pas l' air d' avoir été dirigée par la situation: d' ailleurs votre Lekain est un convulsionnaire qui, ne saisissant jamais le vrai sens d' un rôle, est toujours au-delà de la nature.	87	14	106	1	0.009433962264150943	[['naturel']]
1404	Aboyeur éternel, il est furieux dans toutes les positions;	87	15	9	1	0.1111111111111111	[['furieux']]
1405	ainsi je conclus qu' il faut qu' il se borne à jouer les rôles de martyr , si analogues à sa figure pitoyable, et à sa voix piteuse.	87	16	27	2	0.07407407407407407	[['figure'], ['voix']]
1406	Je vois, repartit la marquise, que je n' y gagnerai rien;	87	17	11	0	0.0	[]
1407	ainsi, laissons-là les comédiens de profession, et parlons des gens du bel air, qui veulent se donner en spectacle.	87	18	20	1	0.05	[['bel']]
1408	Où aboutit cette manie, dites-le moi je vous prie?	87	19	10	0	0.0	[]
1409	Où elle aboutit, répliqua le chevalier?	87	20	6	0	0.0	[]
1410	à arranger les affaires du cœur, à tromper les surveillant, les mère vigilantes et les maris jaloux.	87	21	17	0	0.0	[]
1411	Une femme ou une fille qui ne peut voir son amant, qui vit cependant dans la même société, convientde prendre dans la pièce qui est sur le tapis, un rôle qui se rapporte à sa situation, et les deux amant jouissent du plaisir d' un tendre épanchement, et de parler pendant deux heures le langage de l' amour, sans que leurs surveillant, toujours ridiculisés dans ces comédies, puissent se plaindre.	87	22	70	2	0.02857142857142857	[['tendre'], ['pendant']]
1412	Au contraire, on les voit enchantés du talent de leurs femmes ou de leurs filles, applaudir à leur jeu, et se féliciter tout haut d' un art dangereux qui doit faire le malheur des admirateurs.	87	23	35	1	0.02857142857142857	[['haut']]
1413	Cela n' est pas maladroit, dit Madame De Sarmé, et j' adopte volontiers les remarques que vous faites à ce sujet.	87	24	21	0	0.0	[]
1414	Rien n' est si positif, répliqua Brochure, et j' ai vu l' abbé de Courval, vivre long-temps du bénéfice que la disposition des rôles lui procurait de la part des amant qu' il réunissat sur la scène.	87	25	38	1	0.02631578947368421	[['long']]
1415	Mais mon serrurier et le laquais de monsieur, reprit la marquise, n' étant pas dans ce cas, pourquoi ces animaux-là jouent-ils?	87	26	23	0	0.0	[]
1416	Pour singer les grands, madame, répliqua Brochure, et se donner un air.	87	27	12	1	0.08333333333333333	[['grand']]
1417	Vous savez qu' à Paris rien n' est si arrogant que le petit peuple et la valetaille : ce sont exactement les arlequins de la société, dont la fureur balourde est de parodier tout;	87	28	33	1	0.030303030303030304	[['petit']]
1418	on va aux tragédies qu' ils jouent, comme aux parades du boulevard, où l' on met sa raison à l' écart pour s' amuser davantage.	87	29	25	0	0.0	[]
1419	J' ai vu, reprit la marquise, une fille de Paris violemment entichée de ces bouffonneries, elle y passait réellement la moitié de sa vie, et finissant par jouer la grandeur, elle donnait à Giles, au bon homme Cassandre ou à maneselle Zisabelle un présent, comme elle donna autrefois une tabatiere à Lekain.	87	30	52	0	0.0	[]
1420	Ah, palsambleu, s' écria le chevalier, il n' y a plus d' énigme, et vous nous parlez ici de la Pelissier!	87	31	21	0	0.0	[]
1421	Il est vrai, répliqua le colporteur, que dans le temps même qu' elle montrait en ville , elle avait l' orgueil de faire une pension aux directeurs des marionnettes, pour lui jouer deux parades par jour.	87	32	35	0	0.0	[]
1422	Avant d' aller plus loin, dit la marquise, je veux savoir ce que vous appellez montrer en ville .	87	33	18	0	0.0	[]
1423	Je ne sais trop, repartit Brochure, comment vous gaser cela, mais figurez-vous un maître de danse qu' on ne paie qu' au mois, et qui prend dans chaque maison où il donne leçon un cachet qu' on retire à l' expiration du terme: la Pelissier avait la vogue, et l' Angleterre seule, qui était alors en paix avec nous, lui valait des sommes considérables.	87	34	65	0	0.0	[]
1424	Un comte allemand, qui en devint amoureux, la captiva de façon qu' il ne luifut plus possible de continuer l' exercice d' un talent aussi lucratif.	87	35	26	0	0.0	[]
1425	Le comte, allemand dans tous les points, était de tous le corps germanique l' observateur le plus rigide de l' étiquette;	87	36	21	1	0.047619047619047616	[['corps']]
1426	cette humeur orgueilleuse paraissait justifiée par le titre de souverain qu' il portait sans usurpation, puisqu' il fournissait deux hommes au contingent de l' empire, et que son auguste visage était empreint sur un morceau de cuivre blanchi avec plus d' art que de bonne foi, qui courait pour trois sols dans toute l' étendue de sa domination.	87	37	58	3	0.05172413793103448	[['fournir'], ['visage'], ['blanchir']]
1427	Le comte aimait vivement la Pelissier, mais pas assez pour lui laisser une sorte de liberté sur ses goûts les plus indifférent.	87	38	22	0	0.0	[]
1428	Ses compagnies et ses lectures étaient réglées par son amant;	87	39	10	0	0.0	[]
1429	ce n' est pas qu' il fût jaloux: l' amour seul de la grave étiquette le décidait en tout.	87	40	19	1	0.05263157894736842	[['grave']]
1430	Les allées du palais royal et des Tuileries, où les femmes de robe, et les fermieres générales, se promenaient, étaient interdites à la Pelissier;	87	41	24	1	0.041666666666666664	[['royal']]
1431	elle ne pouvait paraître que dans celles où à l' aide du microscope on développait quelques duchesses ou des femmes à seize quartiers.	87	42	23	0	0.0	[]
1432	Le comte voulait bien qu' elle reçut compagnie, mais il fallait que les hommes qui venaient lui faire la cour, fussent chevaliers de malthe, ou au moins capitaines de cavalerie, et les demoiselles du monde qu' elle pouvait voir, devoientêtre entretenues par des princes ou par des ducs.	87	43	48	0	0.0	[]
1433	La manie de ce fastidieux comte me rappelle l' usage ridicule qui s' observe dans les cercles ennuyeux de beaucoup de provinces d' Allemagne, où un étranger ne peut avoir la prérogative de danser avec une madame à seize quartiers , qu' il n' ait étalé ses titres; et s' il descendait en droite ligne des Duchatelet et des Beaufremont, et qu' il fût au service sans avoir le rang de capitaine , il ne pourrait être que spectateur immobile de ces fêtes généalogiques, où l' amour-propre porte l' ennui dans le sein des plaisirs.	87	44	94	1	0.010638297872340425	[['sein']]
1434	La Pelissier contrainte jusques dans ses lectures, ne pouvait lire que l' armorial de l' Allemagne, l' histoire de l' empire, et quelques autres ouvrages où les hauts faits des ancêtres du comte étaient détaillés avec la pesanteur des erudits de Leipsick.	87	45	42	1	0.023809523809523808	[['haut']]
1435	Cette bibliothèque n' était pas considérable;	87	46	6	0	0.0	[]
1436	mais il y avait suppléé en faisant imprimer l' histoire de toutes ses possessions;	87	47	14	0	0.0	[]
1437	domaines admirables dans lesquels l' œil perçant des physiciens avait découvert de l' eau, de l' herbe et des chaumieres.	87	48	20	0	0.0	[]
1438	La table seule pouvait indemniser la Pelissier de la gêne dans laquelle on la tenait.	87	49	15	0	0.0	[]
1439	Trois services de seize plats analogues aux seize quartiers, formaient son ordinaire;	87	50	12	1	0.08333333333333333	[['plat']]
1440	mais elle ne pouvait trouver délicieux quece qui était cher: et docile à la manie de son illustre amant, elle ne touchait point aux mets qui n' étaient plus dans leur primeur: aussi quand le plat de petits pois était au-dessous de cinquante francs, le comte voulait bien qu' on lui en servit, mais il ne permettait pas qu' elle en mangeât.	87	51	63	3	0.047619047619047616	[['délicieux'], ['plat'], ['petit']]
1441	Il lui était aussi défendu de boire des vins qui n' avaient pas été recueillis dans un fonds noble, et sa haine pour la roture était telle, que, ne pouvant se déterminer à boire de l' eau de la Seine, qui était commune à tout Paris, il envoyait tous les jours chercher un baril d' eau à dix lieues de la ville, mais il était sûr de ne point se mésallier en en buvant;	87	52	74	1	0.013513513513513514	[['noble']]
1442	elle sortait d' une source vive qui appartenait à un prince du sang.	87	53	13	1	0.07692307692307693	[['vif']]
1443	Voilà un personnage bien singulier, reprit Madame De Sarmé;	87	54	9	0	0.0	[]
1444	mais il fallait cependant qu' il fût fort riche pour mener ce train de vie bizarre et dispendieux.	87	55	18	2	0.1111111111111111	[['fort'], ['riche']]
1445	Il jouissait, repartit le colporteur, de cent mille écus de rente.	87	56	11	0	0.0	[]
1446	Tu te mocques de nous, perruque, répliqua le chevalier;	87	57	9	0	0.0	[]
1447	la table aux seize quartiers aurait déjà emporté cette somme.	87	58	10	0	0.0	[]
1448	Patience, monsieur le chevalier, patience, répondit Brochure;	87	59	7	0	0.0	[]
1449	le comte vivait deux années dans ses états, où il s' occupait à faire battre sa petite monnaie, à faire couper ses bois, et à tuer beaucoupde gibier qu' il vendait forcement à ses vassaux: sa maison qui n' était plus montée sur le ton généalogique, vivait ainsi que lui, de lievres, de saucisses, et du fin plat de choux vinaigrés, mets délicieux, le seul des choses communes qui tienne encore à l' étiquette allemande.	87	60	75	5	0.06666666666666667	[['petit'], ['ton'], ['fin'], ['plat'], ['délicieux']]
1450	Ces épargnes entassées, le comte reprenait l' air souverain, et venait jouer la dignité à Paris, où il affectait modestement de parler de ses troupes, de sa régence et de ses ministres, et ces petites misères l' indemnisoient de l' égalité que le français  le moins noble osait mettre entre son altesse et lui.	87	61	55	2	0.03636363636363636	[['petit'], ['noble']]
1451	Oh, ce ne sont pas seulement, repartit le chevalier, les princes allemands à qui nos petits insectes titrés manquent de respect;	87	62	21	1	0.047619047619047616	[['petit']]
1452	je me souviens qu' après la paix d' Aix-La-Chapelle, un prince souverain d' Italie, dont la maison est très-ancienne, étant dans l' appartement de la reine, le Marquis De J, lui proposa de jouer deux cens louis au piquet.	87	63	40	0	0.0	[]
1453	Le duc ayant répondu que ce jeu était trop mince pour lui.	87	64	12	1	0.08333333333333333	[['mince']]
1454	Eh bien, monsieur le duc, répliqua le marquis d' un ton persifleur, je vais, si vous voulez, jouer dans un cent de piquet vos petits états contre une partie de mes terres.	87	65	32	2	0.0625	[['ton'], ['petit']]
1455	Le duc indigné se retira.	87	66	5	0	0.0	[]
1456	Les hommes sensés blamerent l' indécence du marquis qui eut pour lui le suffrage de tous nos illustres freluquets.	87	67	19	0	0.0	[]
1457	J' avoue, repartit la marquise, qu' il y a bien de la petitesse dans les détails de l' étiquette, mais on doit une sorte de considération à un étranger qui joint à sa naissance le titre de souverain toujours respectable pour tous les hommes.	87	68	44	1	0.022727272727272728	[['joindre']]
1458	Que l' on rie tout bas de son orgueil ridicule, passe, mais on lui doit dans le public une honnêteté de convention, de laquelle il est sage de ne pas s' écarter.	87	69	32	1	0.03125	[['bas']]
1459	Quand le prince retourne dans ses états, demanda le chevalier, que devient la Pelissier?	87	70	14	0	0.0	[]
1460	L' amant, répondit Brochure, promet de lui faire payer exactement sa pension;	87	71	12	0	0.0	[]
1461	elle, de son côté, jure d' être sage, tous deux manquent à leur parole, et s' oublient.	87	72	17	0	0.0	[]
1462	La nymphe auguste voulant bien déroger, descend à la roture ou à la noblesse du troisième rang, et elle ne retient des femmes de condition, dont elle a effleuré le rôle, que la manie des caprices.	87	73	36	0	0.0	[]
1463	C' est dans une de ses fantaisies qu' elle a pris Vervilly.	87	74	12	0	0.0	[]
1464	Ah, bon dieu!	87	75	3	0	0.0	[]
1465	S' écria la marquise, de quel fat subalterne s' est-elle empêtrée?	87	76	11	0	0.0	[]
1466	C' est bien le petit monsieur le plus ridicule et le plus avantageux que je connaisse.	87	77	16	1	0.0625	[['petit']]
1467	Je sortais un jour de l' opéra, l' aboyeur avait demandé vingt fois mon carrosse qui ne venait point;	87	78	19	0	0.0	[]
1468	Vervilly m' offrit effrontément le sien.	87	79	6	0	0.0	[]
1469	Comme je soupois dans une maison où l' on sert régulièrement à neuf heures, je l' acceptaisans balancer, parce que je l' avais vu deux ou trois fois chez sa mère.	87	80	31	0	0.0	[]
1470	Ce carrosse, offert avec tant d' empressement, n' arriva point, puisqu' il n' existait pas, mais mon impudent, voulant soutenir la gageure, joua l' impatience, cria dix fois qu' il était le gentilhomme de France le plus mal servi;	87	81	39	0	0.0	[]
1471	jura qu' il ferait une réforme dans sa maison, et partit incognito le talon rouge en l' air, et cherchant à travers la lueur des lanternes le moyen de ne point imprimer ses souliers dans la boue.	87	82	37	1	0.02702702702702703	[['rouge']]
1472	C' est bien lui, reprit le colporteur; un auteur de mes amis mit un jour malignement au bas de son portrait exposé dans le salon du Louvre, les six vers suivant, qui peignent, on ne peut pas mieux, cet original.	87	83	40	1	0.025	[['bas']]
1473	talons rouges à pié, poudre sur ses habits pincé comme un danseur, et de lui seul épris, verbiageant sur-tout, tantôt pour, tantôt contre, son premier compliment est d' étaler sa montre, meuble cher et pesant, où cent colifichets montrent moins un seigneur qu' un marchand de cachets.	88	0	47	3	0.06382978723404255	[['rouge'], ['pincer'], ['peser']]
1474	redites-moi ces vers que je les copie, dit la marquise, ils peignent Vervilly d' après nature, et le voila tout craché ;	89	0	22	0	0.0	[]
1475	mais vit-il ces vers?	89	1	5	0	0.0	[]
1476	Un des premiers, répondit Brochure, et ils parurent si frappants, que Mademoiselle D' Anville, qui les lut au salon, ne voulut plus recevoir Vervilly qui était au mieux avec elle, si l' on en croit la gazette de Cythere.	89	2	39	0	0.0	[]
1477	Vous pourriez, reprit le chevalier, être ici dans l' erreur, mon cher Brochure: je crois avoir entendu dire qu' elle ne quitta ce fat que parce qu' il s' avisa de faire un couplet sur l' histoire de la cheminée , qui a rendu cette femme fort célèbre.	89	3	47	1	0.02127659574468085	[['fort']]
1478	Vous tombez ici dans un anacronisme, repartit le colporteur, et l' anecdote de la cheminée est postérieure de plus de deux ans aux vers mis au-dessous du portrait de Vervilly.	89	4	31	0	0.0	[]
1479	Mais en vérité, reprit Madame De Sarmé, je ne sais d' où je viens, et je crois que je suis une femme de l' autre monde: vous venez l' un et l' autre de raconter là une infinité d' aventures dont je ne savais pas le premier mot.	89	5	48	0	0.0	[]
1480	C' est que toutes ces choses, repartit le chevalier, se sont apparemment passées dans le temps que vous étiez dévote.	89	6	20	0	0.0	[]
1481	Encore un coup, monsieur, point de mauvaises plaisanteries, répliqua la marquise, laissons	89	7	12	0	0.0	[]
1482	-là	89	8	1	0	0.0	[]
1483	vos propos	89	9	2	0	0.0	[]
1484	,	89	10	0	0	0	[]
1485	et écoutons Brochure qui va nous faire l' histoire de cette cheminée	89	11	12	0	0.0	[]
1486	.	89	12	0	0	0	[]
1487	Le baron de Mazanges, reprit le colporteur, devenu amoureux fou de Madame D' Anville, s' introduisit dans sa maison de campagne, sous le prétexte d' y jouer la comédie.	89	13	29	0	0.0	[]
1488	M D' Anville avait la fureur de faire des pièces que sa femme avait la manie de représenter.	89	14	18	0	0.0	[]
1489	C' est à l' art de ce financier que nous devons le flegmatique , le mélancolique , et les dangers du faste , trois comédies dont les représentations lui coûterent cent mille francs.	89	15	30	1	0.03333333333333333	[['mélancolique']]
1490	Ce n' était pas là prêcher d' exemple;	89	16	8	0	0.0	[]
1491	mais telle est la fatalité des auteurs et des prédicateurs, s' ils s' élèvent toujours avec véhémence contre les défauts dans lesquels ils tombent à chaque instant.	89	17	27	0	0.0	[]
1492	Mazanges eut le bonheur de parler d' amour à Madame D' Anville, et d' en être écouté favorablement;	89	18	18	0	0.0	[]
1493	mais les yeux jaloux d' un mari ne les quittaient point, et quand celui-ci était obligé d' aller bavarder auprès d' un tapis vert, où le traitant cruel boit en guise de limonnade le sang des peuples dans des coupes d' or, il mettait à la suite de sa femme un vieux grison constamment attaché à la persécuter.	89	19	58	2	0.034482758620689655	[['oeil'], ['vieux']]
1494	Deux amants gênés imaginent bientôt des moyens pourrompre leurs entraves;	89	20	10	0	0.0	[]
1495	le baron avait à ses ordres un machiniste habile, qui, ayant à se venger personnellement de M D' Anville, imagina de soustraire les deux amants aux yeux des jaloux, et de les réunir dans des moment où on les croyait fort éloignés l' un de l' autre.	89	21	47	2	0.0425531914893617	[['oeil'], ['fort']]
1496	Il inventa pour cet effet une cheminée mouvante, dans le goût des tours de religieuses, au moyen de laquelle Mazanges pouvait, quand il le desiroit, passer dans l' appartement de Madame D' Anville, qui depuis long	89	22	36	0	0.0	[]
1497	-	89	23	0	0	0	[]
1498	temps ne couchait plus avec son mari.	89	24	7	0	0.0	[]
1499	Le baron songea d' abord à se mettre à l' abri du soupçon, en faisant louer par un nommé Mérobert , qui était alors garçon de bureau de la marine, un appartement chez un baigneur de la rue De Richelieu, qui était mitoyen à celui que Madame D' Anville occupait.	89	25	49	0	0.0	[]
1500	L' hyver ayant rappelé tous les honnêtes gens à Paris, Mazanges, qui demeurait place Royale, ne parut plus chez le financier;	89	26	21	1	0.047619047619047616	[['royal']]
1501	celui-ci fut enchanté de la séparation, et ceux qui aiment à imaginer des raisons qui puissent avilir les personnes auxquelles ils en veulent, se turent sur cet événement, parce qu' ils l' attribuerent à la variété des plaisirs qui enchaînoient le baron.	89	27	42	0	0.0	[]
1502	D' Anville qui avait acquis par une fatale expérience le privilege d' être jaloux, eût des soupçons qu' il voulut éclaircir.	89	28	21	0	0.0	[]
1503	maison neuve , c' est le nom du vieux grison qui portait celui de Galepin avant qu' il eut jugé à propos de faire banqueroute, fut chargé de l' opération, et le maudit vieillard découvrit que le baron de Mazanges passait au moyen de la cheminée dans la chambre de Madame D' Anville qu' il vit un jour dans les bras de son amant par le trou d' une serrure.	90	0	69	2	0.028985507246376812	[['vieux'], ['bras']]
1504	Le grison, fier de sa découverte, courut enfoncer le poignard dans le sein de son protecteur, en lui dévoilant la perfidie de sa femme dont il voulait ignorer la conduite, en cherchant à l' approfondir.	90	1	35	2	0.05714285714285714	[['enfoncer'], ['sein']]
1505	D' Anville monta, et il ne vit rien.	90	2	8	0	0.0	[]
1506	Galepin, que ses yeux n' avaient point trompé, voulut le persuader de l' existence de cette cheminée tournante , qu' il assurait avoir vue.	90	3	23	1	0.043478260869565216	[['oeil']]
1507	Le financier, outré de l' insolence du grison, le punit en le condamnant à copier une de ses comédies.	90	4	19	0	0.0	[]
1508	Vous me réduiriez, dit Galepin, à mourir de faim, ou, ce qui revient au même, à transcrire les tragédies à la glace de Titus et de Térée, que j' affirmerois ce que j' ai l' honneur de dire à votre opulence ;	90	5	41	1	0.024390243902439025	[['mourir']]
1509	j' ai vu continua, le surveillant, et quand je vois, je vois bien.	90	6	13	0	0.0	[]
1510	Finissons, reprit financiérement D' Anville, vous êtes un sot qui n' avez que des yeux, et moi j' ai de la tête.	90	7	22	1	0.045454545454545456	[['oeil']]
1511	Je sais un moyen infaillible qui m' assurera de votre imposture ou de l' innocence de ma femme à laquelle je ne crois cependant pas plus que de raison.	90	8	29	0	0.0	[]
1512	Epiez par vous	90	9	3	0	0.0	[]
1513	-même ou par les commis que je vous paie, le baron de Mazanges, la première fois qu' il reviendra chez ce maudit baigneur, et sur votre indication j' aviserai au maintien de mon honneur qu' on veut léser dans cette partie .	90	10	41	1	0.024390243902439025	[['maintien']]
1514	Galepin qui était fait à ce jargon financier, jura d' obéir, et le lendemain Mazanges, qu' il vit entrer dans l' hôtel suspect, lui procura l' occasion de se justifier auprès de son protecteur.	90	11	34	0	0.0	[]
1515	D' Anville hésita, le grison affirma, et le fermier plein de rage et d' impatience, monta dans l' appartement de sa femme qui n' était point à la maison.	90	12	29	1	0.034482758620689655	[['plein']]
1516	Arrivé dans cette chambre funeste, il imagina que s' il y avait de la réalité dans l' intrigue	90	13	18	0	0.0	[]
1517	qu' il soupçonnait, il y avait un signal convenu entre sa femme et le baron, et tirant une clef de sa poche, il frappa deux coups contre lemur mitoyen.	90	14	29	0	0.0	[]
1518	Mazanges croyant que l' horloge du plaisir venait de sonner pour lui, se mit dans le tour, et se trouva dans les bras du financier qu' il ne cherchait point.	90	15	30	1	0.03333333333333333	[['bras']]
1519	On ne peut mieux peindre l' embarras du baron, et la surprise de D' Anville, qu' en comparant leur situation à celle de Tartuffe et d' Orgon sortant de dessous la table pour surprendre le séducteur de sa femme.	90	16	39	0	0.0	[]
1520	Mazanges revenu de son premier étonnement, prit le ton ricanneur qui lui était assez naturel, et dit au financier: eh, que faites-vous ici, monsieur?	90	17	25	2	0.08	[['ton'], ['naturel']]
1521	Croyez de bonne foi que ce n' est point vous que j' y cherchais, adieu.	90	18	15	0	0.0	[]
1522	D' Anville ne sortit de son abattement que pour ordonner à son portier de ne jamais laisser entrer madame dans la maison, éclat scandaleux qui le perdit, parce que n' ayant pu résister à tous les écrits orageux qui vinrent fondre sur lui, il tomba dans une langueur qui ne lui laissa que le temps de faire un codicile et son epitaphe.	90	19	62	0	0.0	[]
1523	L' un et l' autre sont assez plaisant pour que je vous en fasse mention: j' ai ici copie de la première pièce;	90	20	23	0	0.0	[]
1524	écoutez.	90	21	1	0	0.0	[]
1525	codicile de Louis Alexandre-Metrophile	91	0	5	0	0.0	[]
1526	-Auguste D' Anville, seigneur haut-justicier de trente-deux paroisses, et de la rue De Grenelle S Honoré en partie.	91	1	18	0	0.0	[]
1527	comme le chagrin fait de vives impressions sur une âme élevée, et qu' aussi délicat et plus convaincu que César qui ne voulait pas que sa femme fût seulement soupçonnée, j' ai vu de mes propres yeux la fatale cheminée, au moyen de laquelle mon honneur a souffert plus d' un échec, et que l' éclat de mon nom, et la gloire attachée au rang que j' occupe, ne me permettent point de soutenir plus long	92	0	76	2	0.02631578947368421	[['délicat'], ['oeil']]
1528	-temps	92	1	1	0	0.0	[]
1529	le poids de la vie: j' ai résolu d' en sortir, et pour cet effet, j' ai choisi le moyen le plus prompt en me remettant entre les mains des médecins les plus fameux, et par conséquent les plus expéditifs	92	2	40	1	0.025	[['main']]
1530	.	92	3	0	0	0	[]
1531	Espérant donc que la science de ces messieurs m' arrachera dans peu de jours aux maux qui m' accablent, je vais, dans le présent codicile qui ne sera ouvert qu' un mois après ma mort, disposer de cent mille écus, dont le remboursement vient de m' être fait, et ajouter quelques articles que j' ai obmis dans mon testament.	92	4	59	0	0.0	[]
1532	primo.	93	0	1	0	0.0	[]
1533	je veux et entends que mes trois pièces de théatre saient, à l' exemple de ce qui se pratiquait pour les tragédies d' Eschile, enfermées dans des boîtes d' or qu' on ouvrira alternativement au renouvellement de chaque bail des fermes générales, pour être jouées et applaudies.	94	0	47	0	0.0	[]
1534	J' ai payé pour cela.	94	1	5	0	0.0	[]
1535	item.	95	0	1	0	0.0	[]
1536	je fonde à perpétuité une fête lugubre qui sera célébrée tous les ans au jour anniversaire de mon trépas	96	0	19	0	0.0	[]
1537	, dans l' hôtel des fermes, où mon éloge sera prononcé par un des soixante heureux de la compagnie, s' il s' en trouve qui sache lire et parler une autre langue que celle de barême.	96	1	35	1	0.02857142857142857	[['prononcer']]
1538	Item.	96	2	1	0	0.0	[]
1539	je donne et legue mille écus à chacun des beaux esprits qui diront du bien de moi après ma mort, et cinquante mille francs au poète qui fera dans une pièce de vers l' éloge de mon goût pour les arts.	97	0	41	1	0.024390243902439025	[['beau']]
1540	item.	98	0	1	0	0.0	[]
1541	je legue cinquante mille livres à ceux de mes neveux qui ne se seront pas réjouis de mon trépas.	99	0	19	0	0.0	[]
1542	item.	100	0	1	0	0.0	[]
1543	je donne cent mille francs à Madame D' Anville, si elle n' est pas consolée de ma mort lors de l' ouverture du présent codicile.	101	0	25	1	0.04	[['consoler']]
1544	item.	102	0	1	0	0.0	[]
