891	Vous, dont l' âme honnête avait mérité tous mes sentiments, ô Seligny!	47	4	12	0	0.0	[]
892	Que faites-vous maintenant?	47	5	4	0	0.0	[]
893	Où êtes-vous?	47	6	3	0	0.0	[]
894	Connoissez-vous mon sort?	47	7	4	0	0.0	[]
895	Hélas!	47	8	1	0	0.0	[]
896	Vous ignorez combien je souffre;	47	9	5	0	0.0	[]
897	le ciel seul en esttémoin: c' est devant lui que je répands mon cœur ulcéré par la douleur;	47	10	18	0	0.0	[]
898	c' est à lui que j' adresse mes plaintes: et ce ciel est impitoyable!	47	11	14	0	0.0	[]
899	Le brillant avenir qui s' offrait à mon esprit séduit a disparu comme un rêve.	47	12	15	0	0.0	[]
900	Ton image même, ton image adorée, n' est plus qu' un fantôme qui se perd dans la nuit de mes songes.	47	13	21	2	0.09523809523809523	[['ton'], ['ton']]
901	ô mon ami!	47	14	3	0	0.0	[]
902	Tu n' es pas ici pour me consoler: tu es peut-être bien loin: tu me cherches peut-être... va!	47	15	18	1	0.05555555555555555	[['consoler']]
903	Tu n' es pas le plus à plaindre: ta liberté ne t' est pas ravie: tu n' as point à respecter la main quite frappe: tes murmures ne sont pas un crime...	47	16	32	2	0.0625	[['ton'], ['main']]
904	mais, moi!	47	17	2	0	0.0	[]
905	Que mon état est digne de pitié!	47	18	7	0	0.0	[]
906	Parmi de pieuses solitaires qui cachent le fiel dans leur cœur, au milieu des haines, des jalousies, des intrigues!	47	19	19	0	0.0	[]
907	Et cependant il faut vivre avec ces passions, qui se nourrissent dans le silence du cloître!	47	20	16	0	0.0	[]
908	Il faut essuyer les sermons de ces froides vestales!	47	21	9	0	0.0	[]
909	Et toi, mon ami, tu viens me tourmenter aussi!	47	22	9	0	0.0	[]
910	Et ton idée qui me poursuit, et ma religion qui m' épouvante, et mon dieu qui m' appelle, et ma merequi me menace, tout se réunit pour déchirer ma blessure!	47	23	30	2	0.06666666666666667	[['ton'], ['menacer']]
911	ô!	47	24	1	0	0.0	[]
912	Que cette religion est impuissante contre le délire des passions!	47	25	10	0	0.0	[]
913	Non, je n' écouterai point sa voix;	47	26	7	0	0.0	[]
914	je ne serai point parjure à mon amant.	47	27	8	0	0.0	[]
915	On ne m' a laissé d' autre parti que celui de prendre le voile ou d' épouser Norton.	47	28	18	0	0.0	[]
916	Mais j' en connais un autre qui me sauvera des persécutions.	47	29	11	0	0.0	[]
917	Je te perdrai, Seligny;	47	30	4	0	0.0	[]
918	nous serons séparés, du moins dans ce monde.	47	31	8	0	0.0	[]
919	Il faudra que je renonce à l' espoir flatteur d' être un jour ta compagne: cette seule idée m' arrache destorrents de larmes, et je sens mon courage prêt à m' échapper.	47	32	32	1	0.03125	[['ton']]
920	Mais mon tendre ami!	47	33	4	1	0.25	[['tendre']]
921	Ton Henriette ne sera point à d' autres qu' à toi: elle portera dans le cercueil un cœur dont tu reçus les prémices, et dont les derniers soupirs seront encore pour toi.	47	34	32	1	0.03125	[['ton']]
922	Je n' appartiendrai plus alors qu' à l' être souverainement bon, qui fera grâce à ma faiblesse, et qui ne me punira point du malheur d' avoir aimé.	47	35	28	0	0.0	[]
923	Alors mon cœur se délassera de ses longues fatigues;	47	36	9	1	0.1111111111111111	[['long']]
924	il se consumera doucement, et ses cendres conserveront encore les étincellesde ce feu dont il brûla pour toi.	47	37	18	0	0.0	[]
925	J' ai long-temps désiré de te revoir, pour te dire un dernier adieu, pour mourir dans tes bras: c' eût été ma consolation.	47	38	24	4	0.16666666666666666	[['long'], ['mourir'], ['ton'], ['bras']]
926	Le ciel me la refuse, et je l' en bénis: tu ne m' aurois pas rendu la vie; et le spectacle de mes douleurs aurait empoisonné la tienne.	47	39	28	0	0.0	[]
927	ô!	47	40	1	0	0.0	[]
928	Combien j' ai souffert, depuis que tu m' as quittée! D' effrayants symptômes semblent m' annoncer que j' ai vécu.	47	41	20	0	0.0	[]
929	Je n' ai fait qu' entrevoir le bonheur;	47	42	8	0	0.0	[]
930	il faut y renoncer.	47	43	4	0	0.0	[]
931	Il faut rompre tous les nœuds qui m' attachaient à la vie!	47	44	12	0	0.0	[]
932	Il estdonc pénible de mourir?	47	45	5	0	0.0	[]
933	Je ne le croyais pas... adieu!	47	46	6	0	0.0	[]
934	Adieu!	47	47	1	0	0.0	[]
935	Souviens	47	48	1	0	0.0	[]
936	-toi quelquefois d' une amie qui ne desiroit de vivre que pour te rendre heureux.	47	49	15	0	0.0	[]
937	Il faut nous quitter... déjà je ne suis plus à rien, mon faible cerveau se trouble, mes sens s' alterent, mon esprit s' éteint;	47	50	24	1	0.041666666666666664	[['faible']]
938	je meurs;	47	51	2	0	0.0	[]
939	je m' échappe à moi-même.	47	52	6	0	0.0	[]
940	ô mon Seligny!	47	53	3	0	0.0	[]
941	Tu n' as plus de Henriette.	47	54	6	0	0.0	[]
942	Une moitié de moi m' a déjà laissée;	47	55	8	0	0.0	[]
943	l' autre va la suivre.	47	56	5	0	0.0	[]
944	Les cruels l' emportent!	47	57	4	0	0.0	[]
945	Ils sont parvenus à m' ôter le peu de raison qui me restait.	47	58	13	0	0.0	[]
946	Quels fantômes m' environnent!Où suis-je?	47	59	6	0	0.0	[]
947	Le voilà ce Norton!	47	60	4	0	0.0	[]
948	Ce monstre!	47	61	2	0	0.0	[]
949	Il m' aborde!	47	62	3	0	0.0	[]
950	Il ose me presser d' être à lui!	47	63	8	1	0.125	[['presser']]
951	Et cette mère cruelle! ô dieu!	47	64	6	0	0.0	[]
952	Je n' ai pas même l' asile de la nature!	47	65	10	0	0.0	[]
953	Ses bras refusent de s' ouvrir à mon infortune: elle m' a bannie de son cœur!	47	66	16	1	0.0625	[['bras']]
954	Il faut donc tout pleurer à la fois;	47	67	8	0	0.0	[]
955	et les plus doux sentiments, qui devaient faire mon bonheur, sont la cause de mon supplice!	47	68	16	1	0.0625	[['dou']]
956	Ah	47	69	1	0	0.0	[]
957	!	47	70	0	0	0	[]
958	N' aimez jamais, cœurs sensibles!	47	71	5	0	0.0	[]
959	Mon exemple est une leçon terrible des effets de l' amour: puissé-je être sa dernière victime?	47	72	17	0	0.0	[]
960	LETTRE 25 la supérieure du couvent de * à Madame De Berville.	48	0	11	0	0.0	[]
961	nous vous rendons une infortunée qui n' est plus en état de nous entendre, et qui a moins besoin de nos secours spirituels que de ceux du médecin.	49	0	28	0	0.0	[]
962	Nous ne forçons point les volontés: notre maison est l' asile de la piété, et non la prison du désespoir;	49	1	20	0	0.0	[]
963	et nous ne savons pas lutter contre la vocation.	49	2	9	0	0.0	[]
964	Sans prétendre vous éclairer sur vos devoirs,madame, nous croyons qu' il serait à propos de suspendre des rigueurs qui, peut-être, ont été portées trop loin.	49	3	26	0	0.0	[]
965	Nous vous exhortons à ménager cette âme sensible, et profondément affectée;	49	4	11	0	0.0	[]
966	son délire mérite toute la pitié d' une mère;	49	5	9	0	0.0	[]
967	vos soins la sauveront, si quelque chose peut la sauver: mais nous avons lieu de craindre que le coup mortel ne soit porté.	49	6	23	0	0.0	[]
968	Si vous la perdiez, ce serait un grand malheur, elle eût fait l' ornement du monde.	49	7	16	1	0.0625	[['grand']]
969	Nous vous en parlons les larmes aux yeux.	49	8	8	0	0.0	[]
970	Au milieu de ses peines,jamais on n' a conservé plus de résignation, plus de vrai courage.	49	9	17	0	0.0	[]
971	Sa douceur nous charme, sa piété confond la nôtre.	49	10	9	0	0.0	[]
972	Elle a, dans ses accès, une énergie de pensée, une vigueur d' expression, une éloquence, qui nous étonnent.	49	11	18	0	0.0	[]
973	Vous ne l' avez point connue, madame, ou vous auriez un cruel reproche à vous faire.	49	12	16	0	0.0	[]
974	Nous vous offrons nos vœux pour cette enfant, qui emporte les regrets de toutes ses compagnes.	49	13	16	0	0.0	[]
975	Nous allons conjurer le ciel de rendre le calme à son âme, et de chasser les nuages dont sa raison est offusquée.	49	14	22	1	0.045454545454545456	[['calme']]
976	Puissent nos prières, n' être point vaines et tardives!	49	15	9	0	0.0	[]
977	LETTRE 26 Cécile à Emilie.	50	0	5	0	0.0	[]
978	ma sœur nous est rendue.	51	0	5	0	0.0	[]
979	Mais hélas!	51	1	2	0	0.0	[]
980	Ce n' est plus elle!	51	2	5	0	0.0	[]
981	Son corps ne paraît se mouvoir que par ressorts.	51	3	9	1	0.1111111111111111	[['corps']]
982	Ses traits sont dérangés;	51	4	4	0	0.0	[]
983	une froide langueur les a flétris: elle n' a plus qu' une idée confuse des personnes qu' elle a connues.	51	5	20	1	0.05	[['flétrir']]
984	Le seul objet de sa fatale erreur l' occupe toute entière: elle l' appelle.	51	6	14	0	0.0	[]
985	Souvent elle croit le voir.	51	7	5	0	0.0	[]
986	Elle observe d' un air inquiet tous ceux qui l' approchent, et paraît chercher à le reconnaître.	51	8	17	0	0.0	[]
987	Maisce qui l' affecte encore plus, ce qui, sans doute, a causé son délire, c' est l' idée de Norton.	51	9	20	0	0.0	[]
988	Elle n' entend son nom qu' avec un sentiment de terreur.	51	10	11	0	0.0	[]
989	Quand on en parle, elle frissonne, ses yeux s' égarent, son visage s' enflamme.	51	11	14	2	0.14285714285714285	[['oeil'], ['visage']]
990	Rendue à elle-même, elle sent toute l' horreur de son état, et n' en est que plus à plaindre.	51	12	19	0	0.0	[]
991	Ces intervalles de raison la plongent dans une douleur muette, concentrée: elle arracheroit alors des larmes au cœur le plus dur.	51	13	21	0	0.0	[]
992	"Dans un de ces moments, elle nous a parlé des malheurs de l' amour; et elle ajoutait, en meserrant la main: "" souvenez-vous de moi, ma sœur, pour ne jamais aimer."	51	14	32	1	0.03125	[['main']]
993	Je reconnais l' erreur qui m' a séduite, et je ne crains plus de l' avouer.	51	15	16	0	0.0	[]
994	J' aimais: j' aime peut-être encore;	51	16	6	0	0.0	[]
995	"mais bientôt, je n' aimerai plus "" ."	51	17	7	0	0.0	[]
996	Quand Madame De Berville s' est présentée pour la voir, elle a pâli, rougi, tremblé.	51	18	15	0	0.0	[]
997	Jamais impression d' effroi ne fut plus forte.	51	19	8	0	0.0	[]
998	Madame, a-t-elle dit en soupirant, vous voyez votre ouvrage!	51	20	11	0	0.0	[]
999	Ma mère s' est détournée pour cacher les premières larmes, peut-être, qu' elle ait versées sur ses enfants.	51	21	18	0	0.0	[]
1000	Elle l' a nommée plusieurs fois sa fille, ce qui ne lui était pas encore arrivé: elle l' a même serrée dans ses bras.	51	22	24	1	0.041666666666666664	[['serrée']]
1001	Henriette, qui n' avait pas encore goûté les plaisirs de la nature, pénétrée de réconnaissance, et frappée d' un sentiment nouveau	51	23	21	1	0.047619047619047616	[['pénétrer']]
1002	, s' est jetée aux pieds de sa mère, et les a mouillés de ses pleurs.	51	24	15	1	0.06666666666666667	[['pied']]
1003	Madame De Berville l' a relevée, et s' est éloignée sur-le-champ.	51	25	11	1	0.09090909090909091	[['relever']]
1004	Ma sœur me voit la plume à la main, et me demande à qui j' écris.	51	26	16	1	0.0625	[['main']]
1005	Je vous nomme: elle gémit.	51	27	5	0	0.0	[]
1006	Cette chère amie!	51	28	3	0	0.0	[]
1007	Dit-elle;	51	29	2	0	0.0	[]
1008	que je voudrais la voir!	51	30	5	0	0.0	[]
1009	Mais quand elle viendra, il ne sera plus temps.	51	31	9	0	0.0	[]
1010	LETTRE 27 Cécile à Emilie.	52	0	5	0	0.0	[]
1011	Seligny, qui rode depuis deux jours autour de la maison, m' a fait demander une entrevue.	53	0	16	0	0.0	[]
1012	Je l' ai trouvé pâle, abattu: il m' a fait pitié.	53	1	11	2	0.18181818181818182	[['pâle'], ['abattre']]
1013	J' aurois harsardé de l' introduire;	53	2	6	0	0.0	[]
1014	mais j' avais des ordres contraires.	53	3	6	0	0.0	[]
1015	Après l' avoir instruit de l' état de son amie, je suis rentrée.	53	4	13	0	0.0	[]
1016	Dans mon absence, Henriette avait gagné ses femmes!	53	5	8	0	0.0	[]
1017	Elle s' était levée, achevait sa toilette, et se disposait à sortir.	53	6	12	0	0.0	[]
1018	Elle m' a souri.	53	7	4	0	0.0	[]
1019	Suis-je encore jolie?Crois	53	8	4	0	0.0	[]
1020	-	53	9	0	0	0	[]
1021	tu que je plaise à Seligny?	53	10	6	0	0.0	[]
1022	Je me suis prêtée à son erreur, et je l' ai félicitée sur l' éclat de son teint.	53	11	18	0	0.0	[]
1023	Cela suffit, m' a-t-elle dit à demi-voix: veux-tu me suivre?	53	12	13	0	0.0	[]
1024	Et elle s' est avancée vers la porte.	53	13	8	0	0.0	[]
1025	Je l' ai retenue.	53	14	4	0	0.0	[]
1026	Où voulez-vous aller?-le voir.-mais où est-il?-je n' en sais rien.-êtes-vous sûre de le trouver?-non: je le chercherai, fût-ce au bout de la terre (en disant ces mots elle pleurait): je le chercherai, puisque l' ingrat m' évite.	53	15	41	0	0.0	[]
1027	Pourquoi n' est-il pas ici?	53	16	6	0	0.0	[]
1028	Il sait que je meurs,et il ne vient pas me fermer les paupières!-elle s' est appuyée sur mon bras;	53	17	20	0	0.0	[]
1029	car les forces lui manquaient, et elle a tenu long-temps sur ses yeux un mouchoir qui était inondé de ses larmes.	53	18	22	2	0.09090909090909091	[['long'], ['oeil']]
1030	Je l' ai ramenée près de son lit, où elle s' est précipitée avec un mouvement de désespoir.-il ne viendra donc pas?	53	19	22	0	0.0	[]
1031	Je ne le reverrai jamais!	53	20	5	0	0.0	[]
1032	Je l' ai quitté pour l' éternité!-et elle répétait sans cesse: quoi!	53	21	12	0	0.0	[]
1033	Je ne le verrai plus!	53	22	5	0	0.0	[]
1034	Le pasteur est entré.	53	23	4	0	0.0	[]
1035	Dans le premier moment, elle a cru voirSeligny.	53	24	8	0	0.0	[]
1036	Elle s' est écriée: elle a volé dans ses bras.	53	25	10	0	0.0	[]
1037	Mais reconnaissant sa méprise, et frappée de ce vêtement noir, de cet air grave et lugubre, elle l' a repoussé.-que demandez-vous ici, monsieur?	53	26	24	2	0.08333333333333333	[['noir'], ['grave']]
1038	êtes-vous ce Norton, ou quelqu' un de ses émissaires?	53	27	10	0	0.0	[]
1039	Le pasteur, avec l' éloquence la plus douce, la plus insinuante, a rappelé ses esprits égarés.	53	28	16	1	0.0625	[['douce']]
1040	Ses accès deviennent moins fréquents.	53	29	5	0	0.0	[]
1041	Le médecin nous donne des espérances;	53	30	6	0	0.0	[]
1042	il se flatte de la sauver.	53	31	6	0	0.0	[]
1043	Mais il n' est pas secondé: Madame De Berville, depuisson apparition, ne s' est pas montrée une seule fois.	53	32	19	0	0.0	[]
1044	Elle semble oublier sa fille;	53	33	5	0	0.0	[]
1045	et sa haine poursuivra l' infortunée jusqu' au tombeau.	53	34	9	0	0.0	[]
1046	LETTRE 28 Cécile à Emilie.	54	0	5	0	0.0	[]
1047	j' ai dormi cette nuit pendant quelques heures.	55	0	8	1	0.125	[['pendant']]
1048	à mon réveil! ô surprise!	55	1	5	0	0.0	[]
1049	Je ne n' ai plus vu ma sœur.	55	2	8	0	0.0	[]
1050	J' ai trouvé son lit désert, sa chambre abandonnée.	55	3	9	0	0.0	[]
1051	J' ai couru, tremblante;	55	4	4	0	0.0	[]
1052	j' ai appelé les gens;	55	5	5	0	0.0	[]
1053	je les ai interrogés: personne ne voulait m' instruire.	55	6	9	0	0.0	[]
1054	Enfin, un vieux domestique, nourricier de Henriette, m' a dit en pleurant, que madame l' avait emmenée... je n' ose poursuivre... ô ciel!	55	7	23	1	0.043478260869565216	[['vieux']]
1055	Henriette!	55	8	1	0	0.0	[]
1056	Masoeur!	55	9	1	0	0.0	[]
1057	La fille de Madame De Berville!	55	10	6	0	0.0	[]
1058	Dans une maison de force!	55	11	5	0	0.0	[]
1059	J' ai frémi d' horreur!	55	12	5	0	0.0	[]
1060	Je me suis fait répéter deux fois les mêmes paroles: deux fois tout mon sang s' est glacé!	55	13	18	0	0.0	[]
1061	L' affreuse maison est à quelques lieues de Trénel.	55	14	9	0	0.0	[]
1062	J' ai proposé au nourricier de m' y conduire.	55	15	9	0	0.0	[]
1063	Il tiendra des chevaux prêts.	55	16	5	0	0.0	[]
1064	Nous partirons demain avant le jour... au moment où j' écris, j' entends du bruit: on entre.	55	17	17	0	0.0	[]
1065	C' est Seligny;	55	18	3	0	0.0	[]
1066	c' est lui-même.	55	19	3	0	0.0	[]
1067	Il s' avance brusquement.	55	20	4	0	0.0	[]
1068	Je l' arrête.-osez-vous entrer dans deslieux dont l' accès vous est fermé?	55	21	13	0	0.0	[]
1069	Qui cherchez-vous?	55	22	3	0	0.0	[]
1070	Henriette n' est plus ici.-il me regarde.- Henriette n' est plus ici!	55	23	12	0	0.0	[]
1071	Qu' entends-je?	55	24	3	0	0.0	[]
1072	Où peut-elle être?	55	25	4	0	0.0	[]
1073	... mais non;	55	26	2	0	0.0	[]
1074	je ne vous crois point: c' est un artifice: vous voulez me la cacher.-et me prenant la main:	55	27	18	0	0.0	[]
1075	venez, Cécile!	55	28	2	0	0.0	[]
1076	Conduisez-moi.	55	29	2	0	0.0	[]
1077	Que je la voie.	55	30	4	0	0.0	[]
1078	Il m' entraînait.	55	31	3	0	0.0	[]
1079	Madame De Berville paraît.	55	32	4	0	0.0	[]
1080	Il court à ses pieds.-Henriette!	55	33	5	1	0.2	[['court']]
1081	Madame, Henriette!	55	34	2	0	0.0	[]
1082	Qu' en avez-vous fait?	55	35	5	0	0.0	[]
1083	Je ne vous quitte point que je n' aie appris son sort.-levez-vous, a reprisfierement Madame De Berville.	55	36	18	0	0.0	[]
1084	Allez, jeune insensé!	55	37	3	0	0.0	[]
1085	Allez voir le beau fruit de vos amours!	55	38	8	1	0.125	[['beau']]
1086	Votre Henriette est maintenant digne de vous: elle est renfermée parmi les folles de son espèce, qui se laissent tromper par un séducteur.-Seligny est resté frappé comme d' un coup de foudre.	55	39	32	0	0.0	[]
1087	ô monstre!	55	40	2	0	0.0	[]
1088	A-t-il dit.	55	41	4	0	0.0	[]
1089	Il lui a lancé un regard terrible;	55	42	7	1	0.14285714285714285	[['regard']]
1090	s' est précipité vers la porte, et a disparu.	55	43	9	0	0.0	[]
1091	LETTRE 29 Cécile à Emilie.	56	0	5	0	0.0	[]
1092	ô mademoiselle!	57	0	2	0	0.0	[]
1093	J' arrive de l' horrible prison: j' ai l' âme encore déchirée de cet affreux tableau.	57	1	16	0	0.0	[]
1094	Le seul aspect des géolieres m' a fait frémir: je ne vous dirai point par où elles m' ont conduite: je ne voyais rien.	57	2	24	0	0.0	[]
1095	à chaque pas, je sentais mon cœur défaillir.	57	3	8	0	0.0	[]
1096	On m' a laissée sous une voûte où le jour n' entrait que par une étroite ouverture.	57	4	17	0	0.0	[]
1097	J' ai entendu des gémissements;	57	5	5	0	0.0	[]
1098	je me suis avancée: j' avais peine à distinguerles objets: j' ai étendu mes mains vers une ombre qui semblait s' approcher de moi.	57	6	24	1	0.041666666666666664	[['main']]
1099	Je lui ai dit, d' une voix tremblante: Henriette!	57	7	9	1	0.1111111111111111	[['voix']]
1100	Est-ce vous?	57	8	3	0	0.0	[]
1101	Est-ce vous, ma sœur!	57	9	5	0	0.0	[]
1102	Je suis Cécile.	57	10	3	0	0.0	[]
1103	à l' instant je me suis sentie pressée dans les bras de l' infortunée.	57	11	14	2	0.14285714285714285	[['presser'], ['bras']]
1104	Sa tête s' est posée sur mon sein;	57	12	8	1	0.125	[['tête']]
1105	sa bouche y est restée collée, et ses larmes, qui coulaient par torrent, m' ont inondée.	57	13	16	1	0.0625	[['bouche']]
1106	Nous nous sommes tenues long	57	14	5	0	0.0	[]
1107	-temps muettes, immobiles, et dans les bras l' une de l' autre.	57	15	12	1	0.08333333333333333	[['bras']]
1108	J' ai rompu le silence.	57	16	5	0	0.0	[]
1109	Dans quel lieu, dans quelétat je vous vois, ma sœur!	57	17	10	0	0.0	[]
1110	Oh!	57	18	1	0	0.0	[]
1111	Que vous devez souffrir.-elle m' a fait toucher ses bras;	57	19	10	0	0.0	[]
1112	ils étaient chargés de chaînes, et tous meurtris.	57	20	8	0	0.0	[]
1113	Tu vois comme on me traite, a-t-elle dit.	57	21	10	0	0.0	[]
1114	Eh bien!	57	22	2	0	0.0	[]
1115	Ces maux ne sont rien encore près des tortures que je sens dans mon cœur.	57	23	15	0	0.0	[]
1116	Il est là (mettant la main sur son sein), il est là le cruel, qui m' abandonne: il n' en sortira qu' avec ma vie.	57	24	26	2	0.07692307692307693	[['main'], ['sein']]
1117	Mais qu' elle est longue cette vie!	57	25	7	1	0.14285714285714285	[['long']]
1118	Qu' elle tarde à finir!-les sanglots me suffoquaient:	57	26	8	0	0.0	[]
1119	j' étouffois: je ne pouvais parler; mais je tenais ses mainsque je couvrois de baisers.	57	27	15	0	0.0	[]
1120	Elle m' a montré sa couche;	57	28	6	0	0.0	[]
1121	c' était un mauvais lit de paille: elle m' a fait voir à terre un morceau de pain noir et une cruche d' eau.	57	29	24	1	0.041666666666666664	[['noir']]
1122	Alors soulevant ses mains, qu' elle a laissé retomber sans force: oh!	57	30	12	1	0.08333333333333333	[['main']]
1123	Qui m' eût dit que ce genre de vie, un jour, serait destiné pour moi: que du sein du bonheur et de l' aisance, je descendrois dans cet abîme de misère et d' infortune! (elle s' est mise à pleurer.	57	31	41	1	0.024390243902439025	[['sein']]
1124	) les insensés!	57	32	2	0	0.0	[]
1125	Ils m' apportent des aliments, comme si j' avais besoin de vivre!	57	33	12	0	0.0	[]
1126	Ah!	57	34	1	0	0.0	[]
1127	Qu' ils me donnentdu poison: je ne veux plus d' autre nourriture.	57	35	12	0	0.0	[]
1128	Je la suppliois de se conserver: je lui faisais entrevoir l' espérance d' une délivrance prochaine;	57	36	16	1	0.0625	[['luire']]
1129	je lui parlais de Seligny, elle restait muette.	57	37	8	0	0.0	[]
1130	Enfin, me prenant la main, et s' approchant du soupirail, elle m' a dit: regarde-moi!	57	38	16	1	0.0625	[['main']]
1131	Je l' ai fixée: elle m' a fait peur.	57	39	9	0	0.0	[]
1132	Elle était pâle, décharnée, mourante.	57	40	5	1	0.2	[['pâle']]
1133	J' allois sortir pour lui chercher du secours: elle m' a retenue.-les morts n' ont besoin de rien, et tu vois que je suis dans mon tombeau.	57	41	27	0	0.0	[]
1134	Séparée des vivants	57	42	3	0	0.0	[]
1135	, je n' aide société qu' avec mes bourreaux: du moins, quand je serai dans la terre, ils me laisseront en paix.-comment puis-je achever.	57	43	24	0	0.0	[]
1136	Je ne vois plus ce que j' écris: mes larmes inondent ce papier.	57	44	13	0	0.0	[]
1137	On est venu m' avertir qu' il fallait nous séparer.	57	45	10	0	0.0	[]
1138	Elle s' est jetée dans mes bras, en poussant des cris plaintifs: elle me conjurait de ne la point quitter.	57	46	20	1	0.05	[['bras']]
1139	Voyez-vous, disait-elle, ce Norton, qui me poursuit!	57	47	9	0	0.0	[]
1140	Et elle se pressait sur mon sein avec un air d' épouvante.	57	48	12	2	0.16666666666666666	[['presser'], ['sein']]
1141	La voix terrible des géolieres l' a fait trembler: elle est retombéesur sa couche, en s' écriant: ma sœur!	57	49	19	2	0.10526315789473684	[['voix'], ['trembler']]
1142	Dites à Seligny que je meurs pour lui.	57	50	8	0	0.0	[]
1143	J' ignore ce qui s' est passé: on m' a traînée hors de sa vue: j' ai perdu connaissance; et quand j' ai repris mes sens, les murs de sa prison étaient entre elle et moi.	57	51	36	0	0.0	[]
1144	LETTRE 30 Cécile à Emilie.	58	0	5	0	0.0	[]
1145	comment vous écrire?	59	0	3	0	0.0	[]
1146	Mes idées se confondent: la douleur m' égare: j' ai besoin de pleurer... Henriette!	59	1	14	0	0.0	[]
1147	Henriette!	59	2	1	0	0.0	[]
1148	Ma sœur!	59	3	2	0	0.0	[]
1149	Ma compagne!	59	4	2	0	0.0	[]
1150	Mon amie!	59	5	2	0	0.0	[]
1151	Tu n' es plus!	59	6	4	0	0.0	[]
1152	Tu n' es plus au milieu de ce monde qui ne t' a point connue, au milieu des cruels qui t' ont donné la mort!	59	7	25	0	0.0	[]
1153	Tu dors maintenant à l' abri de leur haine: ton âme n' est plus en proie au délire de l' amour: tes yeux ne versent plus de larmes...	59	8	28	2	0.07142857142857142	[['ton'], ['oeil']]
1154	va!Je te félicite, et je ne plains que les infortunés qui te survivent!	59	9	13	0	0.0	[]
1155	LETTRE DERNIÈRE	60	0	2	0	0.0	[]
1156	Seligny à Mad De Berville.	60	1	5	0	0.0	[]
1157	enfin, vous triomphez, et votre fille est dans le tombeau!	61	0	10	1	0.1	[['triompher']]
1158	Il ne vous reste plus qu' à sacrifier encore une victime, et vous n' entendrez plus prononcer le nom de mère, qui vous est odieux.	61	1	25	1	0.04	[['prononcer']]
1159	Rassurez-vous, madame, on ne croira jamais que vous l' ayez porté.	61	2	12	0	0.0	[]
1160	Appelle-t-on mère, une marâtre, qui vient de trancher les jours de sa fille?	61	3	15	0	0.0	[]
1161	Ce que je ne conçois pas, c' est que vous ayez pu mettre au mondecette fille douce et sensible!	61	4	19	1	0.05263157894736842	[['douce']]
1162	Il était donc un instant où vous avez dépouillé votre naturel féroce, pour donner la vie à cet infortunée?	61	5	19	1	0.05263157894736842	[['naturel']]
1163	Comment ne l' avez-vous pas étouffée en naissant?	61	6	9	0	0.0	[]
1164	Vous auriez, une fois du moins, produit le bonheur d' un seul être!	61	7	13	0	0.0	[]
1165	Mais il n' est pas en vous de faire le bien.	61	8	11	0	0.0	[]
1166	Je vous ai étudiée;	61	9	4	0	0.0	[]
1167	je vous ai suivie: j' ai vu la conduite la plus bizarre, unie au caractère le plus cruel.	61	10	18	0	0.0	[]
1168	Etiez-vous digne du nom de mère?	61	11	7	0	0.0	[]
1169	Vous, qui m' avez abandonné votre fille avant de me connaître?	61	12	11	0	0.0	[]
1170	Vous, qui laissiez deuxjeunes	61	13	4	0	0.0	[]
1171	gens	61	14	1	0	0.0	[]
1172	dans une solitude, livrés à toute l' inquiétude de leur âge, et dans des moments dangereux sans doute,	61	15	18	0	0.0	[]
1173	si la vertu de Henriette n' avait été sa sauvegarde?	61	16	10	0	0.0	[]
1174	Vous, qui prépariez vous-même leur penchant, en armant la nature de tous les moyens qui le déterminent?	61	17	18	0	0.0	[]
1175	Vous, qui, après les avoir mis dans la nécessité de s' aimer, les avez séparés, quand l' avarice vous a présenté un appât plus séduisant?	61	18	25	0	0.0	[]
1176	Etiez-vous mère?	61	19	3	0	0.0	[]
1177	Vous, qui avez traîné votre fille dans un cloître, et qui avez mis, dans l' affreuse alternative deson choix, un himen qu' elle abhorroit, ou une vocation forcée?	61	20	28	0	0.0	[]
1178	Etiez-vous mère?	61	21	3	0	0.0	[]
1179	Grand dieu!	61	22	2	1	0.5	[['grand']]
1180	Vous, qui, après avoir égaré sa raison, l' avez rejettée loin de vous comme un objet d' opprobre?	61	23	18	0	0.0	[]
1181	Vous, qui avez fait taire les entrailles maternelles, et qui l' avez abandonnée à la pitié publique?	61	24	17	0	0.0	[]
1182	ô femme dénaturée!	61	25	3	0	0.0	[]
1183	Si les lois humaines n' ont pas établi de châtiments contre la tyrannie d' une mère, la justice divine a les siens, et tu ne pourras leur échapper!	61	26	28	0	0.0	[]
1184	Tremble!	61	27	1	0	0.0	[]
1185	La vengeance est lente à descendre; mais ellearrive enfin; et plus elle a tardé, plus ses effets sont terribles.	61	28	19	0	0.0	[]
1186	Elle a déjà frappé ton complice;	61	29	6	1	0.16666666666666666	[['ton']]
1187	Norton est mort: j' ai versé tout son sang en sacrifice aux manes de ta victime.	61	30	16	1	0.0625	[['ton']]
1188	Ton tourment approche;	61	31	3	1	0.3333333333333333	[['ton']]
1189	il est déjà dans ton cœur.	61	32	6	1	0.16666666666666666	[['ton']]
1190	Mais, que dis-je?	61	33	4	0	0.0	[]
1191	Le repentir est-il fait pour toi?	61	34	7	0	0.0	[]
1192	Non: je te prépare un autre supplice.	61	35	7	0	0.0	[]
