1164	je le conçois;	109	45	3	0	0.0	[]
1165	mais je n'ai pu obtenir qu'il fût plus long.—Obtenir!…—J'ai tenté l'impossible, Mademoiselle: car je savais combien vous désiriez prolonger votre séjour chez la comtesse.—Certainement,… mais…—Mais vos parents sont demeurés inflexibles.—Vous dites, Madame, que mes parents	109	46	44	0	0.0	[]
1166	…	109	47	1	0	0.0	[]
1167	?—Ils ne vous ont accordé que quinze jours.—Vous dites que mes parents m'ont accordé…—Oui, seulement quinze jours.	109	48	21	0	0.0	[]
1168	Rien n'a pu les déterminer à se priver, pour un temps plus long, du bonheur de vous posséder chez eux.—Quinze jours, Madame la baronne!	109	49	25	1	0.04	[['long']]
1169	Vous êtes sûre?…—Je	109	50	5	0	0.0	[]
1170	suis sûre, Mademoiselle, qu'ils ne vous permettront pas de rester plus longtemps;	109	51	13	0	0.0	[]
1171	arrangez-vous d'après cela, dans quinze jours je vous remmène, c'est une chose convenue.—Convenue!—Oui, Mademoiselle, décidée.—Décidée, Madame!—Irrévocablement décidée, Mademoiselle.—Ah!	109	52	21	0	0.0	[]
1172	ah!—En attendant, je viendrai vous voir presque tous les jours, comme vous pensez bien.—Oui, Madame.—Et presque tous les jours aussi je les verrai, vos parents.—Oui, Madame.—Ainsi vous aurez perpétuellement de leurs nouvelles.—Oui, Madame.—Et ils recevront continuellement des vôtres.—Oui, Madame.—Tenez, ce soir je soupe avec l'un d'entre eux.—Je le sais;	109	53	51	0	0.0	[]
1173	c'est même un de mes grands-parents, celui-là, je crois?—Justement, Mademoiselle, je lui parlerai de vous, de votre absence.—Ah!	109	54	21	1	0.047619047619047616	[['grand']]
1174	je vous en serai bien obligée.—Je ne doute pas que d'abord cette séparation de quinze jours ne l'effraye, comme les autres;	109	55	23	0	0.0	[]
1175	mais je lui ferai entendre raison là	109	56	7	0	0.0	[]
1176	-dessus.—Vous me rendrez un vrai service.—Je vous réponds qu'il ne sera pas fâché.—Madame, je m'en rapporte à vous.	109	57	20	0	0.0	[]
1177	»	109	58	1	0	0.0	[]
1178	On conçoit que je demeurai très surpris de la manière artificieuse et hardie dont la baronne venait de m'établir, pour ainsi dire malgré moi, chez la comtesse.	110	0	28	0	0.0	[]
1179	Cependant je n'oserais pas dire que j'en fus bien fâché, car peu de gens me croiraient; mais du moins, ô ma Sophie!	110	1	24	0	0.0	[]
1180	j'assurerai qu'à l'instant même je pris intérieurement la ferme résolution de conserver mes relations avec Mme de B…, pour être, en cas de besoin, promptement informé de ses découvertes et pour me conduire en conséquence.	110	2	39	0	0.0	[]
1181	Le comte, qui n'avait rien perdu de mon dialogue avec Mme de Fonrose, demanda si mes parents demeuraient maintenant à Paris;	111	0	22	0	0.0	[]
1182	la baronne répondit qu'ils y étaient incognito pour des raisons qu'elle savait, mais qu'elle ne pouvait dire.	111	1	20	0	0.0	[]
1183	Nous allons nous mettre à table: je fus placé entre le mari et la femme;	112	0	15	0	0.0	[]
1184	de temps en temps, la comtesse passait adroitement sous la nappe une main qui rencontrait toujours la mienne, et mon genou touchait le sien.	112	1	24	2	0.08333333333333333	[['main'], ['genou']]
1185	Aussi	112	2	1	0	0.0	[]
1186	M. de Lignolle se fût-il étonné de nos fréquentes distractions, si Mme de Fonrose, toujours attentive et toujours complaisante, n'eût vingt fois relevé la conversation prête à tomber, et vingt fois ne nous eût très habilement avertis de nos imprudences ou tirés de nos rêveries.	112	3	47	1	0.02127659574468085	[['relever']]
1187	Au dessert, cependant, il fallut payer de ma personne.	112	4	9	0	0.0	[]
1188	La baronne, soit qu'elle voulût me distraire de l'objet dont elle me voyait trop occupé, soit qu'elle prît quelque plaisir à me tourmenter un peu, la baronne s'avisa de me porter un coup plus difficile à parer que tous les autres.	112	5	45	0	0.0	[]
1189	«	112	6	1	0	0.0	[]
1190	A propos, dit-elle, vous savez sans doute la grande nouvelle?	112	7	11	1	0.09090909090909091	[['grand']]
1191	Le chevalier de Faublas est sorti de la Bastille.—Qui, le chevalier de Faublas?	112	8	13	0	0.0	[]
1192	demanda le comte.—Ne vous rappelez-vous pas l'histoire de ce joli garçon qui, sous des habits de femme…—S'est introduit chez le marquis de B	112	9	28	1	0.03571428571428571	[['joli']]
1193	…?—Oui, oui.—Et l'on a remis en liberté ce mauvais sujet?	112	10	13	0	0.0	[]
1194	Et ce petit garnement ne sera pas claquemuré pour le reste de sa vie?—Comte, vous êtes bien sévère.	112	11	18	1	0.05555555555555555	[['petit']]
1195	On dit que c'est un très aimable enfant.—Un fieffé libertin, qu'on aurait dû fouetter en place publique!	112	12	19	0	0.0	[]
1196	» La baronne alors m'adressa la parole: «Mlle de Brumont ne dit mot;	112	13	15	0	0.0	[]
1197	est-elle de l'avis de monsieur?—Non, Madame, pas tout à fait, non…	112	14	13	0	0.0	[]
1198	Ce chevalier de Faublas dont vous parlez, je le juge excusable;	112	15	11	0	0.0	[]
1199	il est bien jeune encore: à moins qu'il n'ait commis de ces fautes…—Il a fait des horreurs, s'écria M. de Lignolle.	112	16	26	0	0.0	[]
1200	Vous ne savez donc pas son histoire, Mademoiselle?	112	17	8	0	0.0	[]
1201	Je vais vous la conter.	112	18	5	0	0.0	[]
1202	D'abord, il a quitté les habits de son sexe, et, se donnant pour femme, il est entré dans le lit de la marquise de B…, presque sous les yeux de son mari.	112	19	34	1	0.029411764705882353	[['oeil']]
1203	N'est-ce pas affreux?—Permettez que je vous arrête, Monsieur;	112	20	10	0	0.0	[]
1204	ceci ne me paraît pas vraisemblable.	112	21	6	0	0.0	[]
1205	Est-il possible qu'un homme ressemble à une femme si bien qu'on s'y méprenne?—Cela n'est pas ordinaire, mais cela s'est vu.—Si vous ne me l'assuriez, je ne le croirais pas, dit la comtesse.—Il faut le croire, répondit-il, car c'est un fait.	112	22	48	0	0.0	[]
1206	Au reste, ce marquis de B… n'en est pas moins un imbécile avec ses connaissances physionomiques.	112	23	18	0	0.0	[]
1207	C'est la science du cœur humain qu'il faut posséder.	112	24	11	0	0.0	[]
1208	» Je l'interrompis: «	112	25	5	0	0.0	[]
1209	Il me paraît que, si vous aviez été à la place du malheureux marquis, ce M. de Faublas ne vous eût pas fait sa dupe.—Oh!	112	26	25	0	0.0	[]
1210	soyez-en sûre.	112	27	3	0	0.0	[]
1211	Je n'ai peut-être pas plus d'esprit qu'un autre;	112	28	11	0	0.0	[]
1212	mais je suis observateur, je connais le cœur de l'homme, et nulle affection de l'âme ne m'échappe .—Nous savons cela, dit la baronne;	112	29	26	0	0.0	[]
1213	mais, pour revenir à notre mauvais sujet, je vais un peu vous étonner en vous apprenant qu'il a l'obligation de sa liberté à la marquise.—A Mme de B…?	112	30	31	0	0.0	[]
1214	s'écria le comte.—A Mme de B…! s'écria la comtesse avec beaucoup de vivacité.—A Mme de B…!	112	31	20	0	0.0	[]
1215	m'écriai-je moi-même, en jouant l'étonnement.—A Mme de B…, répéta froidement la baronne.	112	32	17	0	0.0	[]
1216	Tout le monde l'assure.	112	33	5	0	0.0	[]
1217	» La comtesse se leva brusquement et m'adressa la parole: «Quoi!	112	34	13	0	0.0	[]
1218	c'est la marquise?	112	35	4	0	0.0	[]
1219	…	112	36	1	0	0.0	[]
1220	»	112	37	1	0	0.0	[]
1221	Elle parlait si haut et si vite, elle paraissait tellement surprise, inquiète et fâchée, que, tremblant de l'entendre me faire ou quelque imprudent reproche ou quelque dangereuse question, je me hâtai de l'interrompre:	113	0	35	2	0.05714285714285714	[['haut'], ['trembler']]
1222	«	113	1	1	0	0.0	[]
1223	Adressez-vous	113	2	2	0	0.0	[]
1224	à madame la baronne	113	3	4	0	0.0	[]
1225	.	113	4	0	0	0	[]
1226	Qu'allez-vous me demander, à moi qui ne sais pas un mot de toute cette fable?	113	5	17	0	0.0	[]
1227	» M. de Lignolle daigna me seconder.	113	6	7	0	0.0	[]
1228	«	113	7	1	0	0.0	[]
1229	Une fable, comme dit fort bien mademoiselle.	113	8	7	1	0.14285714285714285	[['fort']]
1230	En effet, comment imaginer que la marquise ait osé…—Il n'y a rien que de vrai dans ce que j'avance, reprit la baronne.	113	9	26	0	0.0	[]
1231	Qu'une fille toute neuve, une vierge pure, sans malice, sans passions et sans reproche, trouve fort scandaleux l'événement que j'annonce, et que, dans l'innocence de son cœur, elle refuse d'y croire, cela me paraît fort naturel.	113	10	41	3	0.07317073170731707	[['pur'], ['fort'], ['fort']]
1232	Je ne puis même, en passant, m'empêcher de blâmer la comtesse, qui a déjà quelque usage du monde, d'avoir été tout à l'heure tentée de questionner, sur certaine matière, une personne aussi inexpérimentée que l'est sa demoiselle de compagnie.	113	11	43	0	0.0	[]
1233	Mais que M. de Lignolle, homme d'esprit, homme de tête, M. de Lignolle, qui a l'expérience du monde, de la cour, et des femmes surtout, que M. de Lignolle, observateur profond, excellent juge, M. de Lignolle, enfin, appelle fable un fait peu commun sans doute, mais qui n'est pas sans exemple et paraîtra même vraisemblable à quiconque connaît les mœurs de ce siècle de corruption, voilà ce que je ne conçois pas.—Encore, répondit le comte, faudrait-il que j'eusse particulièrement étudié le caractère de Mme de B…	113	12	92	2	0.021739130434782608	[['tête'], ['profond']]
1234	Je ne la connais que pour avoir entendu quelquefois parler d'elle.—Et moi, malheureusement, pour l'avoir souvent rencontrée dans mon chemin.	113	13	22	0	0.0	[]
1235	Je pourrais lui contester les dons naturels et les dons acquis;	113	14	11	1	0.09090909090909091	[['naturel']]
1236	mais la plupart des jeunes gens de la cour disent qu'elle est belle, et ils le savent bien;	113	15	19	1	0.05263157894736842	[['bel']]
1237	mais les vieux courtisans assurent qu'elle est plus qu'eux tous adroite, insinuante, artificieuse et dissimulée: il faut les croire.	113	16	21	1	0.047619047619047616	[['vieux']]
1238	Ceux-ci lui accordent beaucoup d'esprit, ceux-là lui reconnaissent de grands talents;	113	17	14	1	0.07142857142857142	[['grand']]
1239	tous généralement conviennent qu'elle est née pour l'intrigue.	113	18	10	0	0.0	[]
1240	Les uns s'étonnent que l'ambition puisse régner avec tant d'empire dans un cœur qu'ils craient fait pour des passions plus douces;	113	19	25	0	0.0	[]
1241	les autres, la voyant sans cesse occupée de plus grands intérêts, ne conçoivent pas par quel miracle il lui reste un moment pour l'amour.	113	20	25	1	0.04	[['grand']]
1242	Ce que chacun ne peut se lasser d'admirer en elle, c'est un continuel mélange de l'audace qui distingue les forts, et de l'astuce qui semble n'appartenir qu'aux faibles.	113	21	34	1	0.029411764705882353	[['fort']]
1243	Quelquefois elle étonne ses ennemis et ses rivales par les coups hardis qu'elle frappe;	113	22	15	0	0.0	[]
1244	souvent elle les fatigue de sa tranquille patience et de sa persévérance éternelle.	113	23	13	0	0.0	[]
1245	Tantôt c'est le tigre irrité qui s'élance sur le chasseur et le terrasse, et tantôt le chat sournois qu'on voit des heures entières tapi près de la retraite de la proie qu'il attend.	113	24	37	1	0.02702702702702703	[['sournois']]
1246	Tenez, je ne veux pour preuve de sa rare capacité que la manière dont elle s'est relevée plus puissante après sa terrible chute.	113	25	24	3	0.125	[['rare'], ['relever'], ['puissant']]
1247	Quand son affaire avec le chevalier de Faublas fit tant de bruit, nous la crûmes perdue, elle seule eut le courage de ne pas désespérer de sa fortune.	113	26	28	0	0.0	[]
1248	Vous dire comment elle persuada à son mari coiffé, battu et mécontent, qu'il n'était pas un sot, je ne le saurais: ce qu'il y a de certain, c'est qu'aujourd'hui nous voyons qu'ils vivent très bien ensemble.	113	27	42	0	0.0	[]
1249	Au reste, c'est là le moindre des succès qu'elle s'était promis: dès qu'elle eut enchanté le bon époux, elle songea à délivrer l'ami charmant.	113	28	29	0	0.0	[]
1250	Pour cela, que fait-elle?	113	29	5	0	0.0	[]
1251	M. de , qui avait beaucoup de partisans parce qu'il jouissait d'un léger mérite et d'une fortune considérable, M. de , depuis longtemps, était vainement amoureux d'elle, et vainement visait au ministère.	113	30	34	0	0.0	[]
1252	La marquise entre dans le parti nombreux qui le porte aux premières places;	113	31	13	0	0.0	[]
1253	après quatre mois d'efforts elle culbute le ministre, effraye un des concurrent, trompe l'autre, et l'heureux compétiteur qu'elle sert se voit enfin nanti du fameux portefeuille.	113	32	30	0	0.0	[]
1254	Alors sa bienfaitrice ne dédaigne pas de devenir son amante…	113	33	11	0	0.0	[]
1255	Vous paraissez étonnée, Mademoiselle de Brumont?	113	34	6	0	0.0	[]
1256	…	113	35	1	0	0.0	[]
1257	Hélas!	113	36	1	0	0.0	[]
1258	oui, la belle victime s'est immolée…	113	37	8	1	0.125	[['bel']]
1259	Elle a généreusement consommé le grand sacrifice.	113	38	7	1	0.14285714285714285	[['grand']]
1260	Ainsi Mme de B	113	39	4	0	0.0	[]
1261	… retrouve son premier crédit, qu'elle augmente encore.	113	40	9	0	0.0	[]
1262	Ainsi le chevalier de Faublas est rendu à la société, pour y faire, si nous n'y prenons garde, quelque nouvelle incartade.	113	41	22	0	0.0	[]
1263	»	113	42	1	0	0.0	[]
1264	Enfin, Mme de Fonrose se tut, et, puisqu'elle ne voulait que m'embarrasser, elle eut lieu de s'applaudir de la nouvelle fatale;	114	0	24	0	0.0	[]
1265	fatale!	114	1	1	0	0.0	[]
1266	car je m'en affligeai beaucoup.	114	2	6	0	0.0	[]
1267	En ne m'examinant qu'un peu, je ne trouvais guère probable que l'adorateur de Sophie et l'amant de la comtesse fût encore amoureux de Mme de B	114	3	30	0	0.0	[]
1268	…;	114	4	1	0	0.0	[]
1269	cependant j'entendais s'élever du fond de mon cœur une voix secrète qui me criait que la marquise aurait dû me laisser en prison.	114	5	25	1	0.04	[['voix']]
1270	Oui, dans mon déplaisir extrême, j'osais accuser mon amie d'avoir trop fait pour moi.	114	6	16	0	0.0	[]
1271	Ils auraient donc raison, les consolans moralistes qui tous les jours impriment que l'homme est naturellement ingrat?	114	7	18	0	0.0	[]
1272	Mme de Lignolle, mécontente de mon chagrin, qu'il n'était pas malaisé d'apercevoir, fit tout haut cette remarque:	115	0	20	1	0.05	[['haut']]
1273	«Vous avez l'air bien sérieux, Mademoiselle?—Vraiment oui», dit le comte.	115	1	13	0	0.0	[]
1274	Je ne répondis rien à la comtesse parce que la baronne, habile à deviner et prompte à prévenir les imprudences de son amie, déjà s'était emparée d'elle, et tout bas lui disait sans doute ce qu'elle croyait propre à la retenir et à la calmer; mais je saisis ce moment pour m'approcher de M. de Lignolle et lui confier un grand secret:	115	2	66	2	0.030303030303030304	[['bas'], ['grand']]
1275	«Monsieur, si j'ai bonne mémoire, vous m'avez autrefois témoigné le désir qu'il ne fût jamais question d'amourette et de galanterie devant votre jeune épouse.	115	3	29	0	0.0	[]
1276	» Il me répondit: «	115	4	5	0	0.0	[]
1277	Cela est vrai, mais il est question de ce libertin, je prends de l'humeur, je me laisse entraîner, et j'oublie mes résolutions.	115	5	24	0	0.0	[]
1278	Au reste, je vous remercie de l'avis que vous voulez bien me donner, j'en vais profiter, nous allons nous entretenir d'autre chose.	115	6	25	0	0.0	[]
1279	» Il me tint cruellement parole;	115	7	6	0	0.0	[]
1280	je fus, toute la soirée, obligé de deviner des charades, d'entendre de longues dissertations sur les affaires de l'âme.	115	8	21	1	0.047619047619047616	[['long']]
1281	A dix heures, la baronne se retira pour aller souper avec celui qu'elle appelait mon grand-parent.	116	0	17	0	0.0	[]
1282	A minuit, M. de Lignolle souhaite à la comtesse une bonne nuit, et un bon sommeil à Mlle de Brumont.	116	1	20	0	0.0	[]
1283	De ces deux souhaits si contraires, un seul pouvait être exaucé: la comtesse eut une bonne nuit, justement parce que Mlle de Brumont dormit peu.	116	2	25	0	0.0	[]
1284	Ne vous en étonnez pas, vous qui vous souvenez qu'hier au soir, et ce matin, Justine	117	0	17	0	0.0	[]
1285	m'a passablement occupé.	117	1	4	0	0.0	[]
1286	Songez à ma détention trop longue, songez que l'économique régime du célibat, rigoureusement gardé pendant cent vingt mortels jours, a dû convenablement me préparer aux excès dispendieux de plusieurs nuits heureuses.	117	2	32	2	0.0625	[['long'], ['pendant']]
1287	Et vous aussi, malheureux amant, qui, pour avoir rencontré la satiété dans les bras de l'amour, ne concevez plus un bonheur trop au-dessus de vos forces, recevez avec mes preuves un avis salutaire, et prenez courage: faites-vous mettre à la Bastille, restez-y quatre mois seulement, et, quand vous en sortirez, vous verrez de quoi vous serez capables, avec quel empressement vous volerez aux genoux de vos maîtresses!	118	0	70	2	0.02857142857142857	[['bras'], ['genou']]
1288	Ah! que de fois vous leur direz: «	118	1	8	0	0.0	[]
1289	Je vous aime», si elles vous le disent une fois!	118	2	11	0	0.0	[]
1290	Ah!	118	3	1	0	0.0	[]
1291	que vous les retrouverez jolies, si vous les retrouvez fidèles!	118	4	10	0	0.0	[]
1292	La mienne l'était, et jura de l'être toujours.	119	0	10	0	0.0	[]
1293	De mon côté, je la rassurai si bien que le lendemain matin son cœur ne conservait aucun soupçon jaloux.	119	1	19	0	0.0	[]
1294	Nous fîmes ensemble un déjeuner charmant, car nous ne fûmes pas gênés par la présence d'un tiers.	119	2	18	0	0.0	[]
1295	M. de Lignolle, en partant pour Versailles, où il allait passer plusieurs jours, m'avait recommandé de tenir fidèle compagnie à sa femme et d'avoir bien soin d'elle.	119	3	30	0	0.0	[]
1296	Ce fut elle qui prit soin de moi.	120	0	8	0	0.0	[]
1297	Ses petites mains arrangèrent mes cheveux	120	1	6	2	0.3333333333333333	[['petit'], ['main']]
1298	, ses petites mains m'habillèrent.	120	2	5	2	0.4	[['petit'], ['main']]
1299	Il est vrai que je n'en fus ni mieux coiffé ni mieux vêtu.	120	3	14	0	0.0	[]
1300	Il est vrai que, plein de réconnaissance, je lui rendis, maladroitement si l'on veut, mais pourtant fort bien, à ce qu'elle disait, tous les services que j'avais reçus d'elle.	120	4	33	2	0.06060606060606061	[['plein'], ['fort']]
1301	La matinée tout entière, comme un instant, s'écoula dans ces occupations si douces.	120	5	14	0	0.0	[]
1302	Nombrez, s'il se peut, les distractions qui prolongèrent nos travaux et les folies qui les interrompirent.	120	6	17	0	0.0	[]
1303	Mme de Lignolle, naturellement si vive, est devenue plus étourdie de moitié;	120	7	12	1	0.08333333333333333	[['vif']]
1304	Faublas, que vous connaissez, serait-il plus raisonnable qu'elle?	120	8	10	0	0.0	[]
1305	Figurez-vous notre enfantine joie, nos comiques tendresses, nos bruyant transports.	120	9	11	0	0.0	[]
1306	Imaginez jusqu'à quel point nos caprices peuvent être amusans, et nos espiègleries piquantes.	120	10	14	0	0.0	[]
1307	Devinez le babil de nos querelles et le silence de nos combats.	120	11	12	0	0.0	[]
1308	Représentez-vous ce que nos bouderies ont de plus intéressant, et nos raccommodemens de plus voluptueux: fille de compagnie peu respectueuse, je viens de faire à ma maîtresse une malice presque impertinente, et, pour m'attirer plus sûrement le châtiment que je mérite, j'ai l'air de vouloir m'y dérober.	120	12	52	2	0.038461538461538464	[['voluptueux'], ['impertinent']]
1309	La comtesse, qui me voit fuir, vole sur mes pas, et sur mes pas se précipite dans la sombre alcôve où je parois chercher à me cacher.	120	13	27	1	0.037037037037037035	[['sombre']]
1310	Un cri qu'elle pousse annonce que je suis découverte et saisie; mais le vainqueur, tout à coup vaincu, reconnaît trop tard le piège qu'on lui tendait, il tombe et demande grâce;	120	14	33	1	0.030303030303030304	[['tendre']]
1311	je reste inexorable, et je donne un baiser.	120	15	8	0	0.0	[]
1312	O vous, qui que vous soyez, que ces jeux effarouchent, si dans vos sévérités vous voulez du moins vous montrer équitables, ne nous jugez point selon les rigoureuses lois qui gouvernent les hommes!	120	16	33	0	0.0	[]
1313	Je n'ai pas dix-huit	120	17	5	0	0.0	[]
1314	ans encore, la comtesse en compte à peine seize;	120	18	9	0	0.0	[]
1315	nous sommes deux enfants.	120	19	4	0	0.0	[]
1316	Mme de Lignolle n'avait pas fait défendre sa porte pour tout le monde.	121	0	14	0	0.0	[]
1317	Nous reçûmes, dans l'après-dîner, la visite de Mme de Fonrose, qui m'apporta des nouvelles de mon père, et celle de la marquise d'Armincour, à qui sa nièce avait mandé le retour de Mlle de Brumont.	121	1	38	0	0.0	[]
1318	La bonne tante, enchantée de me revoir, me prodigua les compliment.	121	2	11	0	0.0	[]
1319	Pénétrée pour moi de la plus profonde estime, elle n'avait point oublié que je réunissois, à l'avantage assez commun de tout connaître, le rare talent de tout expliquer,	121	3	30	1	0.03333333333333333	[['rare']]
1320	et que, dans une circonstance embarrassante, je l'avais puissamment aidée à donner à son Éléonore des instructions de première nécessité.	121	4	21	0	0.0	[]
1321	La vieille marquise m'aimait tant et me faisait tant de caresses que je ne pouvais, sans manquer à la réconnaissance, trouver sa visite trop longue.	121	5	26	1	0.038461538461538464	[['vieux']]
1322	Sur quoi j'observerai que la baronne, qui apparemment me jugeait ingrat, s'efforça, par toutes sortes de moyens, d'amener la bonne tante souper chez elle.	121	6	27	0	0.0	[]
1323	Quand elle vit qu'il était impossible de l'y décider, elle prit elle-même le parti de rester avec nous.	121	7	20	0	0.0	[]
1324	A minuit, nos deux convives se retirèrent;	121	8	7	0	0.0	[]
1325	la même jolie femme de chambre qui m'avait habillée s'empressa de détruire son ouvrage, et l'amie de la comtesse redevint son amant.	121	9	25	1	0.04	[['joli']]
1326	Je dis l'amie de la comtesse, et je dis bien.	122	0	11	0	0.0	[]
1327	On savait chez elle que je n'étais plus sa demoiselle de compagnie.	122	1	13	0	0.0	[]
1328	Au reste, je crois que, dans l'occasion, tout bon gentilhomme pourrait, sans déroger, se mettre en condition comme j'y eusse été.	122	2	23	0	0.0	[]
1329	Vraiment!	122	3	1	0	0.0	[]
1330	le matin présider à la toilette de madame, causer l'après-dîner dans son boudoir, et le soir entrer dans son lit, je ne vois rien là qu'un jeune homme bien né doive trouver pénible et ne puisse faire honorablement.	122	4	40	0	0.0	[]
1331	Quant à moi, je sais bien que je remplissois les différents devoirs de ma place avec grand plaisir et sans craindre de compromettre ma noblesse.	122	5	25	1	0.04	[['grand']]
1332	De toutes manières, je me trouvais chez Mme de Lignolle aussi bien que chez moi.	122	6	15	0	0.0	[]
1333	Aussi bien que	123	0	3	0	0.0	[]
1334	chez moi!	123	1	2	0	0.0	[]
1335	… de temps en temps, mais pas toujours.	123	2	8	0	0.0	[]
1336	Non, mon père, non.	123	3	4	0	0.0	[]
1337	Quoique deux journées seulement se fussent écoulées depuis notre séparation, je sentais le besoin de vous revoir.	123	4	17	0	0.0	[]
1338	O ma Sophie!	123	5	3	0	0.0	[]
1339	je brûlais du désir d'aller chez Justine savoir si Mme de B… n'avait rien appris de ton sort, et l'idée de tes infortunes empoisonnait mon coupable bonheur.	123	6	31	2	0.06451612903225806	[['brûler'], ['ton']]
1340	Ce fut pour l'amour de ma femme que j'eus avec ma maîtresse un démêlé sérieux	124	0	17	0	0.0	[]
1341	dès que le jour parut.	124	1	5	0	0.0	[]
1342	«	124	2	1	0	0.0	[]
1343	Je crois que tu pleures, s'écria la comtesse étonnée;	124	3	10	0	0.0	[]
1344	qu'as-tu donc?	124	4	4	0	0.0	[]
1345	» Lui avouer que je donnais ces larmes à l'absence de Sophie, c'eût été vraiment une cruauté;	124	5	19	0	0.0	[]
1346	j'aimai mieux me permettre un officieux mensonge.	124	6	8	0	0.0	[]
1347	«	124	7	1	0	0.0	[]
1348	Je m'afflige parce qu'il faut, mon Éléonore, que je vous quitte pour quelques heures.—Me quitter! pourquoi faire?—Une visite…	124	8	21	0	0.0	[]
1349	—A qui?—Pas à mon père, car il me retiendrait, et je veux revenir; mais à ma sœur.—A ta sœur! mon bon ami, rien ne presse.—Je ne puis m'en dispenser aujourd'hui.—Tu ne le peux?—Non.—Absolument?—Absolument.—Eh bien, j'irai avec toi.—Quelle idée!	124	9	42	1	0.023809523809523808	[['ton']]
1350	Nous montrer ensemble dans les rues de Paris!	124	10	8	0	0.0	[]
1351	On n'a qu'à me reconnaître.—Nous baisserons les stores.—Oui! ne faut-il pas toujours descendre de voiture et y remonter?	124	11	21	0	0.0	[]
1352	Et puis est-il possible que je te mène à ce couvent?	124	12	12	0	0.0	[]
1353	à quoi cela ressemblerait	124	13	4	0	0.0	[]
1354	-il?—Je t'attendrai à la porte.—Eh!	124	14	6	0	0.0	[]
1355	non, non.—Vous ne voulez pas?—Je le voudrais de tout mon cœur;	124	15	11	0	0.0	[]
1356	mais…—Vous me trompez.—Ma jolie petite amie, peux	124	16	9	2	0.2222222222222222	[['joli'], ['petit']]
1357	-tu le croire?—Je le crois: vous méditez une infidélité.—Éléonore!	124	17	9	0	0.0	[]
1358	…—Ce n'est pas chez votre sœur que vous allez, mais chez cette indigne marquise, ou peut-être chez cette petite sotte de Montdésir.—Ma chère Éléonore!…—Mais, si vous avez des rendez-vous, vous les manquerez: car je vous défends de sortir.—Vous me le défendez?—Oui, je vous le défends.—Madame, prenez ce ton avec M. de Lignolle, tant qu'il voudra bien le permettre;	124	18	64	2	0.03125	[['petit'], ['ton']]
1359	quant à moi, je vous déclare que je ne le souffrirai pas, et que je veux sortir tout à l'heure.—Et moi, Monsieur, je vous déclare que vous ne sortirez pas.—Je ne sortirai pas?—Non.—Ah!	124	19	34	0	0.0	[]
1360	nous allons voir.	124	20	3	0	0.0	[]
1361	»	124	21	1	0	0.0	[]
1362	Je fis un mouvement pour me précipiter hors du lit;	125	0	10	0	0.0	[]
1363	de la main droite, elle me retint par les cheveux, et, de la gauche, elle tira le cordon de sa sonnette avec tant de violence qu'elle le cassa.	125	1	29	2	0.06896551724137931	[['main'], ['cheveux']]
1364	Ses femmes effrayées accoururent à sa porte.	125	2	7	0	0.0	[]
