4230	Les pleurs qu' après cinq ans ce triste souvenir m' arrache encore, doivent vous donner une idée de la douleur où me livra ce funeste événement.	26	186	26	2	0.07692307692307693	[['pleur'], ['triste']]
4231	Pendant que mon désespoir mettait ma vie en danger, milord rendait les derniers devoirs à son malheureux frère.	26	187	18	1	0.05555555555555555	[['pendant']]
4232	Il le fit embaumer et porter à Arundel dans le tombeau de ses ancêtres.	26	188	14	0	0.0	[]
4233	Je restai trois mois incapable de consolation.	26	189	7	0	0.0	[]
4234	Mes cris, mes gémissement entretenaient les chagrins de Milord Arundel.	26	190	10	0	0.0	[]
4235	Sa tendre compassion l' attachait près de moi, il mêlait ses larmes avec les miennes;	26	191	15	1	0.06666666666666667	[['tendre']]
4236	enfin il parvint à me faire quitter des lieux où l' amertume de mes regrets se renouvelait sans cesse.	26	192	19	0	0.0	[]
4237	Nous revînmes à Londres;	26	193	4	0	0.0	[]
4238	mais ne pouvant me déterminer à paraître, à voir du monde, il me conduisit ici.	26	194	15	0	0.0	[]
4239	Je passai l' année de mon deuil dans cette charmante solitude.	26	195	11	0	0.0	[]
4240	Le temps n' effaça point ma tristesse.	26	196	7	0	0.0	[]
4241	Je me destinois à vivre seule, à m' occuper toujours des fâcheux souvenirs dont mon âme était remplie.	26	197	18	0	0.0	[]
4242	Mais Milord Arundel avait promis à son frère de me rendre heureuse, et cet engagement lui paraissait inviolable.	26	198	18	0	0.0	[]
4243	Il venait souvent me voir.	26	199	5	0	0.0	[]
4244	Ses soins généreux me procuroient tout ce qu' il croyait capable de me plaire.	26	200	14	0	0.0	[]
4245	""" ma sœur, me dit-il un jour, j' attends un effort de votre complaisance."	26	201	14	0	0.0	[]
4246	Ma tendre amitié mérite de l' obtenir.	26	202	7	1	0.14285714285714285	[['tendre']]
4247	Le ciel ne me permet pas de faire le bonheur de la femme qu' il m' a donnée;	26	203	18	0	0.0	[]
4248	j' ai perdu la douce espérance de vivre avec un frère dont j' étais l' ami: privé du plaisir d' élever une famille, presque sans parents, je me vois environné d' étrangers;	26	204	32	1	0.03125	[['douce']]
4249	vous, qui deviez tenir le premier rang dans ma maison, refuserez-vous de l' habiter, de la diriger, d' en faire les honneurs, de la rendre aimable pour moi, et attrayante pour les autres?	26	205	34	0	0.0	[]
4250	Venez, Miladi D' Anglesey, ajouta-t-il, venez à Londres.	26	206	10	0	0.0	[]
4251	Daignez partager la fortune d' un frère, d' un ami.	26	207	10	0	0.0	[]
4252	Dès ce moment, je vous donne, sur tout ce qui m' appartient, l' autorité que j' accorderois à la propre fille de mon père, et j' aurai pour vous la condescendance, le respect et la tendresse qu' elle aurait droit d' attendre de moi.	26	208	44	1	0.022727272727272728	[['droit']]
4253	""" le ton dont Milord Arundel me fit cette obligeante prière, me persuada que je l' affligerois par un refus;"	26	209	19	1	0.05263157894736842	[['ton']]
4254	je consentis à ses désirs.	26	210	5	0	0.0	[]
4255	à mon arrivée à Londres, je trouvai Ladi Lattimer disposée à oublier le cruel procédé dont j' avais payé sa tendresse et ses bontés.	26	211	24	0	0.0	[]
4256	Je pleurai beaucoup en la revoyant;	26	212	6	0	0.0	[]
4257	elle me rendit son amitié, et voulut bien attribuer mon imprudence à ma grande jeunesse.	26	213	15	1	0.06666666666666667	[['grand']]
4258	Une cour brillante m' environna bientôt.	26	214	6	0	0.0	[]
4259	On s' empressa à me plaire, à m' amuser.	26	215	9	0	0.0	[]
4260	Je demeurai indifférente;	26	216	3	0	0.0	[]
4261	mais des soins qui ne peuvent toucher, servent pourtant à distraire;	26	217	11	0	0.0	[]
4262	si je ne perdis pas le souvenir de mes peines, j' éprouvai aumoins qu' une continuelle attention pour les autres, nous arrache insensiblement à nos propres idées, et nous rend enfin capables d' éloigner de notre esprit les réflexions affligeantes qu' entretiennent la retraite et l' habitude de s' occuper de soi-même.	26	218	53	0	0.0	[]
4263	Que l' amitié vous engage à m' imiter, ma chère Jenny, continua la comtesse;	26	219	14	0	0.0	[]
4264	promettez-moi de ne plus nourrir votre mélancolie par une application constante à vous rappeler vos chagrins.	26	220	17	0	0.0	[]
4265	Milord Arundel me demande toujours si vous êtes heureuse: ses lettres sont remplies de l' intérêt qu' il prend au sort de mon aimable amie.	26	221	25	0	0.0	[]
4266	La fin de la campagne est prochaine, il va bientôt revenir;	26	222	11	1	0.09090909090909091	[['fin']]
4267	jouissez dès à présent de la douceur de penser que vous avez en lui un protecteur puissant et zélé.	26	223	19	1	0.05263157894736842	[['puissant']]
4268	Cessez donc de répandre des larmes, quittez ces habits lugubres.	26	224	10	0	0.0	[]
4269	Nous allons attendre à Londres le retour de mon frère, une foule nombreuse va nous environner.	26	225	16	0	0.0	[]
4270	Si vous conservez au milieu du monde cet air abattu, on imaginera que ma parente trouve chez moi des sujets de s' attrister.	26	226	23	0	0.0	[]
4271	Cette gravité, si peu convenable à votre âge, ces longs soupirs, vos yeux toujours humides de pleurs, exciteront la curiosité.	26	227	20	3	0.15	[['long'], ['oeil'], ['pleur']]
4272	On voudra savoir pourquoi vous avez laissé la province, qui vous êtes, d' où naissent vos ennuis;	26	228	17	0	0.0	[]
4273	ces considérations doivent vous porter à faire un effort sur vous-même, je l' attends de votre raison, et je l' exige de votre amitié.	26	229	25	0	0.0	[]
4274	Le récit de Miladi D' Anglesey me disposait naturellement à satisfaire ses désirs.	26	230	13	0	0.0	[]
4275	L' exemple de Ladi Sara et le sien, m' apprenoient que la tranquillité, le bonheur, n' étaient point attachés à une naissance distinguée,aux égards que le rang et la fortune pouvaient attirer.	26	231	33	0	0.0	[]
4276	En voyant tous les états assujettis à la douleur, je cessai de me regarder comme une créature marquée par le destin pour éprouver des peines, pour être seule malheureuse.	26	232	29	0	0.0	[]
4277	Si dans une situation brillante on baissait les yeux sur des infortunés, afin de mieux sentir son bonheur, ce serait être cruel;	26	233	22	1	0.045454545454545456	[['oeil']]
4278	mais les arrêter, quand on souffre, sur des objets plus dignes de pitié que nous-mêmes, c' est un moyen, non de se consoler, mais au moins de se soumettre et de supporter patiemment ses peines.	26	234	36	1	0.027777777777777776	[['consoler']]
4279	Ma réconnaissance et mes réflexions me déterminèrent donc à tenir une conduite différente.	26	235	13	0	0.0	[]
4280	Depuis ce jour, on me vit à toute heure auprès de Miladi D' Anglesey.	26	236	14	0	0.0	[]
4281	Attentive à cacher ma tristesse, je cherchais à goûter ce qu' on nommait plaisir, à m' occuper de ces soins frivoles et de ces vains amusement qui remplissent les moment d' une personne heureuse.	26	237	34	0	0.0	[]
4282	Il m' en coûtait beaucoup; mais plus je sacrifiois au soin de contenter ma tendre bienfaitrice, plus j' espérais lui prouver la sincérité de mon attachement.	26	238	26	1	0.038461538461538464	[['tendre']]
4283	La vivacité du sien parut s' augmenter encore par ma condescendance;	26	239	11	0	0.0	[]
4284	elle me combla d' éloges, de caresses, m' obligea d' accepter des présent considérables, et fit venir de Londres tout ce qui m' était nécessaire pour y paraître à ses côtés sous le titre dont elle m' honorait.	26	240	38	0	0.0	[]
4285	Une lettre de Milord Arundel l' engagea à presser son départ: nous nous rendîmes à la ville vers le milieu de septembre;	26	241	22	1	0.045454545454545456	[['presser']]
4286	mais trompé dans son attente, milord ne repassa pas la mer aussitôt qu' il l' avait espéré.	26	242	17	0	0.0	[]
4287	La maison du Comte D' Arundel, réglée par les ordres de Miladi D' Anglesey, offrait tous les agrément que le goût, la richesse et la décence peuvent rassembler.	26	243	28	0	0.0	[]
4288	Une table délicate, un jeu modéré, de la musique, souvent des bals, attiraient chez la comtesse une compagnie nombreuse.	26	244	19	1	0.05263157894736842	[['délicat']]
4289	Son caractère aimable, les charmes de sa personne, beaucoup d' esprit et de douceur, lui faisaient acquérir des amis, et attachaient près d' elle une foule d' amant empressés à lui plaire;	26	245	32	0	0.0	[]
4290	mais elle voyait leurs soins avec indifférence, et paraissait déterminée à ne jamais quitter le nom D' Anglesey.	26	246	18	0	0.0	[]
4291	Je ne connaissais pas le monde, ses dehors séduisant n' avaient point encore frappé mes regards;	26	247	16	0	0.0	[]
4292	j' y entrais compagne d' une femme de vingt et un ans, qui attirait sur ses pas l' élite de ces courtisans oisifs et polis, seulement occupés de la recherche du plaisir.	26	248	32	0	0.0	[]
4293	Etonnée d' abord, distraite ensuite, insensiblement amusée, le souvenir de mes peines, souvent interrompu par la variété des objets, commençait à s' affaiblir, à s' éloigner;	26	249	26	0	0.0	[]
4294	deux mois de séjour à Londres en effaçaient presque la trace, quand un matin, avant l' heure où j' étais accoutumée d' entrer chez miladi, on vint me prier de sa part d' aller à l' instant la trouver dans son cabinet;	26	250	42	0	0.0	[]
4295	je m' y rendis.	26	251	4	0	0.0	[]
4296	""" vous m' avez si souvent demandé des nouvelles de M Jennisson, me dit-elle d' un air gai, que je crois vous obliger en me hâtant de vous instruire de son retour."	26	252	32	0	0.0	[]
4297	L' aimable	26	253	2	0	0.0	[]
4298	ministre	26	254	1	0	0.0	[]
4299	est arrivé cette nuit, son soin le plus pressant est de voir et d' entretenir Miss Jenny: cependant, malgré votre tendre amitié pour lui, j' ai voulu vousprévenir, et préparer le cœur de ma sensible amie à se défendre contre un peu de surprise.	26	255	44	2	0.045454545454545456	[['presser'], ['tendre']]
4300	M Jennisson est fort changé, une extrême différence dans son extérieur va vous frapper, ce ne sera pas désagréablement, je l' espère; mais dites-moi, ma chère, continua-t-elle en riant, l' image de cet honnête chapelain est-elle bien présente à votre mémoire?	26	256	44	1	0.022727272727272728	[['fort']]
4301	""" cette question, et le ton de miladi en la faisant, m' étonnèrent."	26	257	12	1	0.08333333333333333	[['ton']]
4302	""" je m' accuserois d' une noire ingratitude, madame, répondis-je, si j' avais oublié celui dont la compassion excita la vôtre, vous toucha en faveur d' une fille inconnue, et me plaça auprès de vous."	26	258	35	1	0.02857142857142857	[['noir']]
4303	Comment perdrais-je jamais le souvenir de la première cause de vos bontés?-plus vous aimerez M Jennisson, plus vous m' obligerez, reprit miladi;	26	259	23	0	0.0	[]
4304	je l' ai vu très-inquiet de l' accueil que vous lui feriez, mais j' ai cru pouvoir le rassurer.	26	260	20	0	0.0	[]
4305	""" en parlant, elle ouvrit la porte d' un arrière-cabinet, d' où l' on passait dans plusieurs pièces, dont la dernière communiquait à l' appartement de Milord Arundel."	26	261	27	0	0.0	[]
4306	Un homme sortit de ce cabinet;	26	262	6	0	0.0	[]
4307	il s' avança vers moi en s' inclinant profondément, sa figure noble et majestueuse s	26	263	15	3	0.2	[['figure'], ['noble'], ['majestueux']]
4308	' attira toute mon attention;	26	264	4	0	0.0	[]
4309	la gaîté de miladi, cet abord familier, l' ordre éclatant qui relevait la parure de ce seigneur, m' annonçaient Milord Arundel;	26	265	21	1	0.047619047619047616	[['relever']]
4310	pendant qu' il m' adressait un compliment flatteur, mes yeux attachés sur lui démêlaient en même temps dans ses traits et M Jennisson et ce cavalier en habit de campagne, dont la physionomie intéressante et l' air de grandeur m' avaient fait impression chez Palmer, au moment où Sir James me trompait par une feinte cérémonie.	26	266	56	2	0.03571428571428571	[['pendant'], ['oeil']]
4311	Quand, sous l' habit de ministre et le titre de chapelain de Miladi D' Anglesey, il vint me secourir, ses vêtements longs et fort larges cachant la beauté de sa taille, une coiffure noire couvrant ses cheveux, je m' en étais rappelé confusément l' idée, mais sans pouvoir le reconnaître;	26	267	50	6	0.12	[['long'], ['fort'], ['large'], ['taille'], ['noir'], ['cheveux']]
4312	rien ne le masquant alors, je vis en lui le confident de Sir James.	26	268	14	0	0.0	[]
4313	Je pâlis, je tremblai, mes regards effrayés se tournèrent vers la comtesse;	26	269	12	2	0.16666666666666666	[['trembler'], ['regard']]
4314	"incapable de cacher la douloureuse émotion de mon cœur: "" ah!"	26	270	11	0	0.0	[]
4315	Que vois-je, m' écriai-je!	26	271	6	0	0.0	[]
4316	Devois-je m' attendre à trouver dans le frère de Miladi D' Anglesey, l' ami, le complice de Milord Danby.	26	272	20	0	0.0	[]
4317	""" le comte et sa sœur s' approchèrent du siège où je m' étais jetée;"	26	273	14	1	0.07142857142857142	[['siège']]
4318	ils s' empressèrent à me rassurer;	26	274	6	0	0.0	[]
4319	ils voulaient apaiser l' agitation violente de mes sens;	26	275	9	0	0.0	[]
4320	milord me parlait, je ne l' entendais point;	26	276	8	0	0.0	[]
4321	de cruelles réflexions, de funestes idées révoltaient mon âme et la remplissaient de terreur;	26	277	14	0	0.0	[]
4322	il me semblait qu' on venait de détruire la sûreté de mon asile, de m' ôter la sécurité qui me le rendait agréable et cher;	26	278	25	1	0.04	[['agréable']]
4323	la protection de miladi, ses bontés, sa tendresse, ses soins ne me touchaient plus, si je les devais à Milord Danby, à ses amis, aux égards qu' ils avaient pour lui.	26	279	31	0	0.0	[]
4324	La comtesse prit mes mains dont je couvrois mon visage inondé de pleurs:	26	280	13	2	0.15384615384615385	[['main'], ['visage']]
4325	""" si vous étiez moins affligée, je me plaindrais de vous, dit-elle doucement."	26	281	13	0	0.0	[]
4326	Quoi, ma chère Jenny, la présence de Milord Arundel, de mon frère, de la plus noble des créatures, vous cause de vives alarmes! C' est avec moi, c' est dans mes bras que vous vous livrez à la crainte.	26	282	39	2	0.05128205128205128	[['noble'], ['bras']]
4327	Je croyais vous inspirer plus de confiance.	26	283	7	0	0.0	[]
4328	Que pensez-vous donc?	26	284	4	0	0.0	[]
4329	Qu' osez-vous imaginer?	26	285	4	0	0.0	[]
4330	Malgré les plus fortes apparences, le Comte D' Arundel n' est point	26	286	12	1	0.08333333333333333	[['fort']]
4331	, il ne peut être le complice de Milord Danby, et vous deviez...	26	287	12	0	0.0	[]
4332	-ah!	26	288	1	0	0.0	[]
4333	Ne vous offensez pas, madame, interrompis-je, pénétrée de ce reproche, ne vous offensez pas d' un mouvement involontaire, ou d' une expression indiscrète;	26	289	24	1	0.041666666666666664	[['pénétrer']]
4334	tout ce qui me rappelle l' instant où je fus cruellement séduite, tout ce qui me présente le vil auteur de mon infortune, me trouble, m' épouvante, et renouvelle l' amertume de mes premières douleurs.	26	290	35	0	0.0	[]
4335	La vue d' un témoin de mon funeste engagement, vient de ranimer le sentiment de ma honte et l' horreur que m' inspire un perfide.	26	291	25	0	0.0	[]
4336	Pardonnez, milord, pardonnez-moi cet étrange accueil;	26	292	7	0	0.0	[]
4337	vous prîtes le titre de mon père pour me donner à Sir James;	26	293	13	0	0.0	[]
4338	en vous voyant,	26	294	3	0	0.0	[]
4339	en vous reconnaissant, il m' a semblé que vous alliez me rendre à lui, me remettre au pouvoir de cet inhumain.-revenez d' une fatale prévention, chère miss, me dit le Comte D' Arundel;	26	295	33	0	0.0	[]
4340	vos larmes me touchent, mais elles ne m' offensent point.	26	296	10	0	0.0	[]
4341	J' ai dû paraître criminel à vos yeux, daignez m' entendre et me juger sur mes intentions.	26	297	17	1	0.058823529411764705	[['oeil']]
4342	Oui, le hasard, ma bonne foi, peut-être un peu d' imprudence, me rendirent témoin de votre mariage avec Sir James;	26	298	20	0	0.0	[]
4343	je participai, sans le savoir, à la basse supercherie d' un homme dont je croyais le cœur noble et les sentiment réglés par l' honneur.	26	299	25	2	0.08	[['bas'], ['noble']]
4344	"Je vais vous découvrir comment je pris ce titre de père... "" milord allait poursuivre;"	26	300	15	0	0.0	[]
4345	mais la comtesse, voulant me laisser le temps de calmer mes sens,demanda du thé: ses femmes en servirent.	26	301	19	0	0.0	[]
4346	La douceur et l' aménité de Milord Arundel, ses discours obligeant, firent, pendant ce court intervalle, l' effet que Miladi D' Anglesey désirait.	26	302	23	2	0.08695652173913043	[['pendant'], ['court']]
4347	Je me rappelai tout ce qu' elle m' avait dit de ce frère aimable et vertueux;	26	303	16	0	0.0	[]
4348	je condamnai mes craintes, mes soupçons, et je me disposai à l' écouter avec toute la confiance qu' il méritait de m' inspirer.	26	304	23	0	0.0	[]
4349	PARTIE 4	27	0	2	0	0.0	[]
4350	"Quand les femmes de miladi furent retirées, milord prit la parole, et s' adressant à moi: "" pendant le cours de mes premiers voyages, dit-il, je connus Sir James Huntley;"	27	1	31	1	0.03225806451612903	[['pendant']]
4351	nous nous rencontrâmes en France, et parcourûmes ensemble l' Allemagne et une partie de l' Italie.	27	2	16	0	0.0	[]
4352	Mille qualités solides, de l' esprit, une conduite sage, des principes vrais, de la douceur, m' attachèrent à lui.	27	3	19	1	0.05263157894736842	[['solide']]
4353	Ce fut avec regret que je m' en séparai à Rome où il restait.	27	4	14	0	0.0	[]
4354	Nous entretînmes long	27	5	3	0	0.0	[]
4355	-	27	6	0	0	0	[]
4356	temps	27	7	1	0	0.0	[]
4357	une correspondance régulière.	27	8	3	0	0.0	[]
4358	Mais, comme il arrive assez ordinairement dans le cours des longues absences, nos lettres devinrent moins fréquentes.	27	9	17	1	0.058823529411764705	[['long']]
4359	Je conservois toujours l' espérance de le revoir, et le désir de me lier intimement avec lui.	27	10	17	0	0.0	[]
4360	Il resta plusieurs années hors du royaume;	27	11	7	0	0.0	[]
4361	je cessai de recevoir de ses nouvelles, et d' autres soins l' éloignèrent un peu de mon souvenir, sans pourtant l' en effacer.	27	12	23	0	0.0	[]
4362	Sous le prétexte de visiter une cour dont le maître pouvait exciter la curiosité, j' étais passé dans le nord, chargé d' une négociation secrète et importante, lorsque Sir James se rendit à Londres avec le projet de s' y fixer.	27	13	41	0	0.0	[]
4363	Six mois après, la Duchesse De Rutland l' épousa.	27	14	9	0	0.0	[]
4364	Eloigné, ayant trop peu de loisir pour m' occuper de ces nouvelles, qui intéressent quand le désœuvrement permet de s' amuser de tout, ou j' ignoraile mariage de Miladi Rutland, et la création d' un Comte Danby, ou l' un et l' autre ne laissèrent aucune trace dans ma mémoire.	27	15	50	0	0.0	[]
4365	L' affaire confiée à mes soins heureusement terminée, je demandai mon rappel.	27	16	12	0	0.0	[]
4366	On venait de déclarer la guerre;	27	17	6	0	0.0	[]
4367	mon régiment allait servir, et je voulais le commander moi-même.	27	18	11	0	0.0	[]
4368	La cour était à Windsor quand j' arrivai.	27	19	8	0	0.0	[]
4369	J' y reçus l' ordre de m' embarquer promptement.	27	20	9	0	0.0	[]
4370	Miladi D' Anglesey m' attendait à Arundel;	27	21	7	0	0.0	[]
4371	je désirais y rester deux jours, et pris tous les arrangement nécessaires pour ne pas me priver du plaisir de la voir.	27	22	22	0	0.0	[]
4372	En passant à Londres, je trouvai chez moi M Pitel, son écuyer, fort chagrin de s' être laissé enlever sept chevaux napolitains que sa maîtresse souhaitait.	27	23	26	1	0.038461538461538464	[['fort']]
4373	La Duchesse	27	24	2	0	0.0	[]
4374	De Cleveland venait de mourir;	27	25	5	0	0.0	[]
4375	ma sœur lui connaissait cet attelage, et s' était hâtée d' envoyer l' acheter.	27	26	14	0	0.0	[]
4376	L' humeur ménagère de Pitel, l' ayant fait marchander trop long-temps, il avait été prévenu.	27	27	16	1	0.0625	[['long']]
4377	Je sentis beaucoup d' envie d' obliger la comtesse dans cette légère occasion, et de lui mener moi-même cet attelage, si, à force d' argent, je pouvais engager l' acheteur à me le céder.	27	28	35	0	0.0	[]
4378	Je courus chez l' homme qui venait de le vendre.	27	29	10	0	0.0	[]
4379	Il me donna l' espérance de réussir, en m' apprenant qu' un nommé Palmer, espèce de brocanteur, lié avec quantité de jeunes lords, et s' entremettant de toutes sortes d' affaires, avait acheté les chevaux, sans doute chargé par un autre de l' emplette, ou dans le dessein d' en tirer avantage en les revendant.	27	30	55	0	0.0	[]
4380	Il m' indiqua la demeure de ce Palmer, et je m' y rendis à l' instant.	27	31	16	0	0.0	[]
4381	Mon carrosse arrêtait à peine à sa porte, qu' onl' ouvrit.	27	32	11	0	0.0	[]
4382	Une femme assez jolie me dit en souriant de monter vite.	27	33	11	2	0.18181818181818182	[['joli'], ['sourire']]
4383	Elle ne demanda ni mon nom, ni ce qui m' amenait.	27	34	11	0	0.0	[]
4384	Cette singularité me frappa.	27	35	4	0	0.0	[]
4385	"Comme je mettais le pied sur un escalier étroit et tournant, on me cria d' en haut: "" eh, mon cher comte, vous m' aviez écrit que peut-être vous ne viendriez pas."	27	36	32	2	0.0625	[['pied'], ['haut']]
4386	"Je n' espérais plus recevoir de vous la main de miss... "" celui qui parlait, me découvrant alors tout entier, loin d' achever, poussa un cri de surprise, et j' en jetai un de joie en reconnaissant Sir James Huntley."	27	37	40	1	0.025	[['main']]
4387	Charmé de cette rencontre, et sensible au plaisir de le revoir, je l' embrassai tendrement.	27	38	15	0	0.0	[]
4388	Il me rendit mes caresses, et m' introduisit dans un grand cabinet un peu obscur où nous nous assîmes.	27	39	19	1	0.05263157894736842	[['grand']]
4389	Après les premiers compliment, il me pria de l' instruire du sujet qui me conduisait chez Palmer.	27	40	17	0	0.0	[]
4390	Je satisfis sa curiosité.	27	41	4	0	0.0	[]
4391	Il me dit d' un air embarassé, que cet homme, parti le matin de Londres, n' y reviendrait pas de huit jours, et ne pourrait d' ailleurs me servir, l' attelage ne dépendant plus de lui.	27	42	36	0	0.0	[]
4392	Je lui demandai à mon tour s	27	43	7	1	0.14285714285714285	[['luire']]
4393	' il logeait dans cette maison, et l' explication des paroles qu' il venait de m' adresser, en me prenant pour un autre.	27	44	22	0	0.0	[]
4394	Il baissa les yeux, rougit;	27	45	5	1	0.2	[['oeil']]
4395	éludant ma question, il me parla de mon frère, regretta sa perte.	27	46	12	0	0.0	[]
4396	Changeant tout de suite de conversation, il m' entretint du mariage de Ladi Huntley, de la situation fâcheuse où la folle passion de sa mère allait le réduire, sans l' extrême amitié d' une parente dont la générosité venait, depuis un mois, de relever sa fortune, même de lui faire un sort capable de remplir toute son ambition: il ajouta que son premier soin, en arrivantà Londres, avait été de m' y chercher;	27	47	73	1	0.0136986301369863	[['relever']]
4397	et que, me croyant encore actuellement en Prusse ou en Dannemarck, il s' était trouvé très-étonné de me voir à la place du Comte Overbury, à l' instant même où cet ami s' excusait par un billet de venir le joindre en ce lieu, pour lui rendre un léger service, après l' avoir engagé lui-même dans l' affaire où il lui devenait utile.	27	48	64	1	0.015625	[['joindre']]
4398	Si un homme qui a seulement deux heures à rester à Londres, peut vous obliger, mon cher James, lui dis-je, disposez de moi.	27	49	24	0	0.0	[]
4399	Je me trouverai heureux de vous servir.	27	50	7	0	0.0	[]
4400	Il me regarda, rougit encore, et me répondit qu' on n' employait pas indifféremment tous ses amis aux mêmes usages.	27	51	20	0	0.0	[]
4401	Comme je connaissais le Comte Overbury pour un homme peu régulier dans ses mœurs, ce propos me fit penser qu' une intrigue galante attirait Sir James en ce lieu.	27	52	29	0	0.0	[]
4402	Ne voulant pas le troubler, j' allois me lever et lui dire adieu, quand une porte, opposée à celle par où j' étais entré, s' ouvrant assez brusquement, je vis paraître un ministre en surplis.	27	53	35	0	0.0	[]
4403	Il s' avançait vers nous en souriant;	27	54	7	0	0.0	[]
4404	mais Sir James, courant précipitamment au-devant de ses pas, l' arrêta, et lui demanda avec autant d' humeur que de vivacité, s' il ne me voyait point?	27	55	28	0	0.0	[]
4405	Le ministre m' envisagea, changea de couleur, recula, sortit et referma la porte.	27	56	13	1	0.07692307692307693	[['couleur']]
4406	Sir James resta debout, immobile, muet, les yeux fixés à terre; et dans une consternation inexprimable.	27	57	16	1	0.0625	[['oeil']]
4407	Le désordre où je le voyais, ses premières paroles et l' apparition de ce prêtre, me découvraient assez le sujet de l' embarras de Sir James.	27	58	26	0	0.0	[]
4408	Il allait contracterun mariage secret: tout me l' annonçait.	27	59	9	0	0.0	[]
4409	Je me sentais extrêmement mortifié d' avoir pénétré ce mystère, et de causer de l' inquiétude à un homme que j' aimais.	27	60	22	1	0.045454545454545456	[['pénétrer']]
4410	"Chagrin d' être venu si mal-à-propos, cherchant à le quitter sans lui laisser connaître mes soupçons, je prenais congé de lui, quand, revenant à lui-même, il tressaillit, m' arrêta: "" un moment, milord, me dit-il;"	27	61	36	0	0.0	[]
4411	au nom du ciel accordez-moi un seul instant, vous en avez trop vu pour ne pas comprendre ce qui va se passer ici.	27	62	24	0	0.0	[]
4412	Ma fortune, mon honneur, sont à présent entre vos mains.	27	63	10	0	0.0	[]
4413	Qu' allez-vous penser?	27	64	4	0	0.0	[]
4414	Comment me regarderez-vous?	27	65	4	0	0.0	[]
4415	Quelle idée va vous donner de moi une action si contraire à mes propres principes?	27	66	15	0	0.0	[]
4416	Je suis perdu!	27	67	3	0	0.0	[]
4417	""" et se jetant sur un siège, cachant son visage, respirant à peine: "" ah mon dieu!"	27	68	16	2	0.125	[['siège'], ['visage']]
4418	Ah mon dieu!	27	69	3	0	0.0	[]
4419	Répétoit-il, je suis le plus malheureux des hommes!	27	70	9	0	0.0	[]
