3004	mais voyez sa lettre, continua-t-elle;	17	27	7	0	0.0	[]
3005	son inquiétude et l' agitation de ses esprits ont peut-être changé ses idées.	17	28	13	0	0.0	[]
3006	""" Lidy ne put me persuader de fixer mes regards sur des caractères devenus si odieuxpour moi."	17	29	16	1	0.0625	[['regard']]
3007	à ma prière elle rompit le cachet, et lut ce qui suit: lettre de Milord Danby, à Miss Jenny Glanville.	17	30	20	0	0.0	[]
3008	""" après avoir profané les noms sacrés d' ami, d' époux, de protecteur;"	18	0	12	0	0.0	[]
3009	avili celui d' amant, abusé de tous!	18	1	7	0	0.0	[]
3010	Sous quel titre oserai-je encore me montrer attaché à vous, à vos intérêts, fille charmante;	18	2	16	0	0.0	[]
3011	objet de ma profonde vénération, de mon immortelle tendresse!	18	3	9	0	0.0	[]
3012	Ah!	18	4	1	0	0.0	[]
3013	Punissez-moi, j' y consens, rejetez tous les vœux d' un coupable, mais que l' horreur qu' il vous inspire, ne vous réduise point à éprouver de nouvelles infortunes.	18	5	29	0	0.0	[]
3014	Quels sont vos desseins?	18	6	4	0	0.0	[]
3015	à quoi vous destinez-vous?	18	7	5	0	0.0	[]
3016	Quel asile vous est ouvert?	18	8	5	0	0.0	[]
3017	Où vous conduira le désir empressé de m' éviter?	18	9	9	0	0.0	[]
3018	Eh!	18	10	1	0	0.0	[]
3019	Pourquoi me craignez-vous?	18	11	4	0	0.0	[]
3020	Ai-je tenté de troubler votre solitude?	18	12	7	0	0.0	[]
3021	Ai-je cherché à vous voir?	18	13	6	0	0.0	[]
3022	Est-il besoin de fuir un malheureux que vos ordres peuvent tenir éloigné de vous?	18	14	14	0	0.0	[]
3023	Je ne demande point à Miss Jenny un pardon que je ne puis jamais m' accorder à moi-même.	18	15	19	0	0.0	[]
3024	Les suites de mon crime m' en ont fait connaître toute l' énormité.	18	16	13	0	0.0	[]
3025	De quel trait j' ai blessé votre cœur!	18	17	8	0	0.0	[]
3026	En quel état je vous ai vue!	18	18	7	0	0.0	[]
3027	La pâleur de la mort cent fois répandue sur cet aimable visage: ces yeux si chers, prêts à se fermer pour toujours!	18	19	22	2	0.09090909090909091	[['pâleur'], ['oeil']]
3028	Dans ces affreux moment, que j' ai détesté votre cruel assassin!	18	20	11	0	0.0	[]
3029	Si vous eussiez succombé, ma main, prompte à vous venger... mais effaçons, s' il se peut, le terrible souvenir de votre danger;	18	21	22	1	0.045454545454545456	[['main']]
3030	il déchire mon cœur.ô, miss, miss!	18	22	6	0	0.0	[]
3031	Si vous pénétriez dans ce cœur où vous régnez, ma funeste situation vous toucherait peut-être.	18	23	15	0	0.0	[]
3032	Livré à la honte, au regret, à l' amertume;	18	24	9	0	0.0	[]
3033	accablé sous le poids de mes remords, de votre haine...	18	25	10	0	0.0	[]
3034	mais ne parlons point de moi;	18	26	6	0	0.0	[]
3035	je ne mérite pas d' exciter votre pitié.	18	27	8	0	0.0	[]
3036	Parlons de vous, dont le cœur pur et les innocentes intentions doivent faire renaître la paix et la tranquillité.	18	28	19	1	0.05263157894736842	[['pur']]
3037	Si supérieure à l' homme méprisable qui vous a trompée, combien de motifs consolans se présentent naturellement à vos idées!	18	29	20	0	0.0	[]
3038	Pourriez-vous conserver une éternelle douleur, quand vous n' avez rien à vous reprocher?	18	30	14	0	0.0	[]
3039	Détaché de moi	18	31	3	0	0.0	[]
3040	-même, uniquement occupé de vous, j' ose vous supplier d' accepter la seule réparation que je sois en état de vous offrir à présent.	18	32	24	0	0.0	[]
3041	Daignez, miss, daignez vous retirer chez vous, y vivre indépendante.	18	33	10	0	0.0	[]
3042	Pour expier le crime horrible de vous avoir trahie, je m' imposerai un rigoureux exil.	18	34	15	0	0.0	[]
3043	Je n' approcherai point de votre demeure, je ne vous écrirai point.	18	35	12	0	0.0	[]
3044	Content de recevoir par Lidy des assurances du repos dont vous jouirez, je subirai loin de vous le juste châtiment de ma faute.	18	36	23	0	0.0	[]
3045	Je ferai plus encore;	18	37	4	0	0.0	[]
3046	si vous l' exigez, j' accepterai l' ambassade de Vienne.	18	38	10	0	0.0	[]
3047	J' irai sous un autre ciel regretter le bonheur que j' ai perdu, et gémir des moyens odieux employés pour me le procurer.	18	39	23	0	0.0	[]
3048	ô miss, aimable et chère miss!	18	40	6	0	0.0	[]
3049	Je ne vous verrai donc plus!	18	41	6	0	0.0	[]
3050	Qu' il me soit permis de mettre un prix à ce dur sacrifice.	18	42	13	1	0.07692307692307693	[['dur']]
3051	Accordez une grâce, une seule grâce à mon repentir.	18	43	9	0	0.0	[]
3052	Laissez	18	44	1	0	0.0	[]
3053	-moi espérerdu temps un heureux changement;	18	45	6	0	0.0	[]
3054	laissez-moi entrevoir un pardon éloigné, demandé seulement à l' instant où, libre de vous offrir des vœux plus purs, je pourrai recevoir au pied des autels le nom délicieux que j' avais usurpé.	18	46	34	3	0.08823529411764706	[['pur'], ['pied'], ['délicieux']]
3055	Une simple promesse écrite de votre main, satisfera tous les désirs que le plus malheureux des hommes ose encore former.	18	47	20	1	0.05	[['main']]
3056	Dès demain, dès ce soir, on vous conduira dans votre terre.	18	48	11	0	0.0	[]
3057	""" p. S."	18	49	2	0	0.0	[]
3058	""" au nom du ciel, n' écoutez plus cette fierté cruelle, source de tous nos maux."	19	0	15	0	0.0	[]
3059	Ne me désespérez point par un refus méprisant: eh!	19	1	9	0	0.0	[]
3060	Grand dieu, qui peut prévoir où m' entraîneroit la crainte de vous savoir errante dans le monde, exposée à mille dangers, celle de perdre pour jamais vos traces?	19	2	28	1	0.03571428571428571	[['grand']]
3061	Au milieu de l' abattement où me plongent les reproches de mon cœur, je ne suis ranimé que par l' espérance d' assurer votre sort, de le rendre un jour brillant et heureux.	19	3	33	0	0.0	[]
3062	ô fille aimable!	19	4	3	0	0.0	[]
3063	Vous dont l' âme est si tendre, si compatissante, ne me l' ôtez pas cette douce espérance!	19	5	17	2	0.11764705882352941	[['tendre'], ['douce']]
3064	Elle est l' unique bien qui me reste.	19	6	8	0	0.0	[]
3065	""" j' écoutai cette longue lettre avec impatience, avec indignation"	19	7	9	1	0.1111111111111111	[['long']]
3066	.	19	8	0	0	0	[]
3067	Elle me parut une suite des artifices de Milord Danby.	19	9	10	0	0.0	[]
3068	Son repentir, feint ou véritable, ne me touchait point.	19	10	9	0	0.0	[]
3069	J' étais bien éloignée de m' engager par des promesses à lui conserver des droits sur ma personne.	19	11	18	1	0.05555555555555555	[['droit']]
3070	Je me sentais humiliée par ses propositions, et plus encore par ses espérances.	19	12	13	0	0.0	[]
3071	Juste ciel, m' écriai-je en pleurant, combien l' indigence nous abaisse dans les idées d' une âme vile!	19	13	19	0	0.0	[]
3072	Cet homme me croit donc capable de lui pardonner!Plus je réfléchissois sur ses offres, moins j' étais disposée à les accepter.	19	14	21	0	0.0	[]
3073	Moi, habiter une terre qu' il m' aurait donnée!	19	15	9	0	0.0	[]
3074	Vivre de ses bienfaits!	19	16	4	0	0.0	[]
3075	ç' eût été mettre un prix à mon innocence, reconnaître en Milord Danby le pouvoir de me dédommager du bien précieux qu' il avait osé me ravir.	19	17	27	0	0.0	[]
3076	Mon cœur dédaignait ses secours;	19	18	5	0	0.0	[]
3077	l' abandon et la misère ne m' effrayaient point, comparés à la honte de lui devoir ma subsistance.	19	19	18	0	0.0	[]
3078	Lidy pensait comme moi: un nouveau piège lui semblait caché sous les apparences d' une si grande soumission.	19	20	18	1	0.05555555555555555	[['grand']]
3079	Dès les commencement de ma maladie, Francis, le valet de chambre, confident et complice de milord, lui avait dit que son maître était nommé à l' ambassade de Vienne.	19	21	29	0	0.0	[]
3080	Ainsi Milord	19	22	2	0	0.0	[]
3081	Danby	19	23	1	0	0.0	[]
3082	voulait à présent se faire un mérite auprès de moi d' une absence forcée, ou Francis répandait ce bruit par son ordre.	19	24	22	0	0.0	[]
3083	Mais que milord demeurât en Angleterre ou se rendît en Allemagne, j' étais déterminée à ne jamais lui rien devoir.	19	25	20	0	0.0	[]
3084	Sans m' embarrasser de ses prières, ni de l' espèce de menace qui terminait sa lettre, je voulais me retirer à l' instant de chez Palmer;	19	26	26	0	0.0	[]
3085	mais Lidy me répéta que je ne pouvais sortir.	19	27	9	0	0.0	[]
3086	Francis et les gens de la maison veillaient à la porte de mon appartement;	19	28	14	0	0.0	[]
3087	ils s' opposeroient, me dit-elle, à mon passage, et me refuseraient absolument la liberté de descendre.	19	29	17	0	0.0	[]
3088	Cette connaissance me causa une douleur si vive, qu' elle me parut impossible à soutenir.	19	30	15	1	0.06666666666666667	[['vif']]
3089	En cédant à la force, on éprouve un sentiment dont l' amertume ne peut être exprimée.	19	31	16	0	0.0	[]
3090	Depuis ce jour, l' éloignement et le mépris que je sentais pour Milord Danby, se changèrent en uneaversion si grande, que le temps n' a jamais pu la détruire, ni la diminuer.	19	32	32	1	0.03125	[['grand']]
3091	Lidy me conseilla de ne point m' abandonner au dépit violent dont j' étais animée.	19	33	15	0	0.0	[]
3092	Elle me représenta la nécessité de dissimuler avec milord, afin de ne pas redoubler la vigilance de mes surveillant.	19	34	19	0	0.0	[]
3093	La sécurité où le mettrait une réponse ménagée, me laisserat le loisir de chercher les moyens de me soustraire à son pouvoir.	19	35	22	0	0.0	[]
3094	Soumise à ses avis, je surmontai ma répugnance, et j' écrivis à Milord Danby.	19	36	14	0	0.0	[]
3095	Me trouvant faible encore, lui disais-je, incertaine dans mes idées, et voulant réfléchir sur ma position actuelle, je croyais devoir passer huit jours de plus chez Palmer; une situation aussi triste que la mienne, ajoutois-je, me disposerait naturellement à ne pas rejeter tous les secours offerts, si, après m' être vue inhumainement trompée, ma confiance pouvait renaître.	19	37	59	2	0.03389830508474576	[['faible'], ['triste']]
3096	Je finissois en l' assurant qu' il serait bientôt instruit du parti auquel il me paraîtrait convenable de m' arrêter.	19	38	20	0	0.0	[]
3097	Cent fois tentée d' ouvrir mon âme toute entière à Mistriss Palmer, une considération m	19	39	15	0	0.0	[]
3098	' avait toujours retenue.	19	40	3	0	0.0	[]
3099	Si en effet cette femme pensait bien, si elle ignorait à quel malheureux son mauvais sort l' associait, devais-je le lui apprendre?	19	41	23	0	0.0	[]
3100	Il me paraissait dur et cruel de sacrifier sa tranquillité à mon intérêt.	19	42	13	1	0.07692307692307693	[['dur']]
3101	Son assistance me devenait alors si nécessaire, que je pris enfin la résolution de lui parler.	19	43	16	0	0.0	[]
3102	J' observai tous les ménagement possibles dans ma confidence.	19	44	9	0	0.0	[]
3103	Sans nommer les complices de Milord Danby, j' instruisis Mistriss Palmer de sa noire trahison;	19	45	15	1	0.06666666666666667	[['noir']]
3104	je luimontrai sa lettre, et la conjurai de m' aider à fuir un homme dont l' amour et les soins m' étaient également odieux.	19	46	24	0	0.0	[]
3105	J' ignore par quel récit fabuleux on parvint à l' intéresser, à l' abuser en me remettant entre ses mains;	19	47	20	0	0.0	[]
3106	mais la lettre de Milord Danby ne lui laissait aucun doute sur ma sincérité.	19	48	14	0	0.0	[]
3107	Cette douce et tendre créature me plaignit, pleura avec moi, s' étonna de la complaisance de son mari, le blâma d' employer la force pour me retenir chez lui;	19	49	29	2	0.06896551724137931	[['douce'], ['tendre']]
3108	elle attribua ce procédé condamnable à la façon de penser trop libre des hommes, toujours prêts, disait-elle, à s' aider dans leurs intrigues, à se lier contre l' innocence sans appui.	19	50	32	0	0.0	[]
3109	En me montrant un désir très-vif de m' obliger, elle me laissa voir peu de dispositions à s' opposer aux volontés de son mari.	19	51	25	1	0.04	[['vif']]
3110	J' aperçus même en elle tant de crainte de l' irriter ou de lui déplaire, qu' il me parut difficile de la déterminer à rien entreprendre.	19	52	26	0	0.0	[]
3111	Je continuais cependant à la presser, elle m' écoutait d' un air distrait.	19	53	13	1	0.07692307692307693	[['presser']]
3112	Je vis ses yeux fixés sur un écrin ouvert près de moi;	19	54	12	1	0.08333333333333333	[['oeil']]
3113	je venais d' y chercher une bague de peu de valeur, dont Milord Revell m' avait fait présent dans mon enfance.	19	55	21	0	0.0	[]
3114	Les diamants qui remplissaient cet écrin, attiraient les regards de Mistriss Palmer, et détournoient son attention de mes discours.	19	56	19	1	0.05263157894736842	[['regard']]
3115	Le plaisir qu' elle paraissait prendre à contempler ces pierreries, me fit naître l' idée d' en employer une partie à me procurer la liberté.	19	57	25	0	0.0	[]
3116	Cette occasion était la seule où je pouvais, sans rougir, m' approprier les dons de Milord Danby.	19	58	17	0	0.0	[]
3117	Je tirai de cet écrin des boucles de grand prix, et un superbe collier.	19	59	14	3	0.21428571428571427	[['boucle'], ['grand'], ['superbe']]
3118	Je priaiMistriss Palmer de s' en parer, de les recevoir comme une marque de ma réconnaissance, et un moyen de la rendre excusable aux yeux de son mari, s' il découvrait jamais qu' elle eût favorisé ma fuite.	19	60	38	1	0.02631578947368421	[['oeil']]
3119	Cette femme, attendrie par mes pleurs, et peut-être éblouie de la richesse du présent, hésita quelques moment encore, se rendit enfin à mes instances, et consentit à seconder le projet de mon évasion.	19	61	33	2	0.06060606060606061	[['attendrir'], ['pleur']]
3120	Avec le dessein de me soustraire aux recherches de Milord Danby, il ne m' était plus possible de retourner chez la sœur de Lidy.	19	62	24	0	0.0	[]
3121	Je ne connaissais personne, personne ne me connaissait;	19	63	8	0	0.0	[]
3122	j' ignorais en quel lieu je pourrais me retirer.	19	64	9	0	0.0	[]
3123	Mistriss Palmer se chargea du soin de me trouver un logement convenable et sûr.	19	65	14	0	0.0	[]
3124	Dès ce même jour, elle le retint.	19	66	7	0	0.0	[]
3125	Une bonne veuve, demeurant au milieu de la cité, s' apprêta à me recevoir.	19	67	14	0	0.0	[]
3126	Sa maison, composée de deux seuls appartements, partagée entre elle et moi, ne m' exposeroit point à de fâcheuses rencontres.	19	68	20	0	0.0	[]
3127	Mistriss Palmer convint du loyer et de la pension.	19	69	9	0	0.0	[]
3128	Comme cette femme la connaissait depuis long-temps, elles s' arrangèrent aisément ensemble.	19	70	13	1	0.07692307692307693	[['long']]
3129	Ce point important réglé, nous concertâmes les mesures qu' il nous restait à prendre.	19	71	14	0	0.0	[]
3130	Plusieurs circonstances rendaient ma sortie moins difficile qu' elle ne l' avait paru d' abord.	19	72	15	0	0.0	[]
3131	Cette même semaine, Mistriss Palmer partait pour aller à Colchester, où sa mère demeurait.	19	73	14	0	0.0	[]
3132	Son mari soupoit tous les jeudis à Hilldegate avec des jeunes gens, qui formaient entre eux une société dont Palmer était l' âme.	19	74	23	0	0.0	[]
3133	Comme ces jours-là il se retirait fort avant dans la nuit, il n' entroitpoint chez sa femme.	19	75	18	1	0.05555555555555555	[['fort']]
3134	Elle fixa ma sortie au soir du jeudi, et son départ au vendredi matin.	19	76	14	0	0.0	[]
3135	à l' exception de deux robes et d' une petite quantité de linge, mes habits, mêlés avec les siens dans ses coffres, me seraient renvoyés à loisir.	19	77	27	1	0.037037037037037035	[['petit']]
3136	Le portrait de ma mère, détaché de sa bordure, la cassette qui renfermait ses papiers, seuls biens dont la conservation me fût chère, pouvaient être emportés de même.	19	78	28	0	0.0	[]
3137	On ne s' apercevroit de ma retraite que le lendemain, à l' heure où l' on entrait ordinairement chez moi: Mistriss Palmer aurait déjà fait plusieurs milles, et ne serait exposée ni aux reproches de Milord Danby, ni aux premiers mouvement de la colère de son mari.	19	79	47	0	0.0	[]
3138	Il ne restait que Francis dont la vigilance nous embarrassait;	19	80	10	0	0.0	[]
3139	mais on découvrit un moyen de la rendre inutile.	19	81	9	0	0.0	[]
3140	Mistriss	19	82	1	0	0.0	[]
3141	Palmer se souvint d' une porte de mon cabinet, que le froid avait obligé de condamner.	19	83	16	1	0.0625	[['froid']]
3142	Elle me la fit voir derrière des tablettes garnies de livres.	19	84	11	1	0.09090909090909091	[['derrière']]
3143	Cette porte donnait sur une petite terrasse qui communiquait à son antichambre.	19	85	12	1	0.08333333333333333	[['petit']]
3144	Nous levâmes aisément les tablettes;	19	86	5	0	0.0	[]
3145	un des battant, cédant à nos efforts, s' ouvrit,	19	87	9	0	0.0	[]
3146	et nous offrit la commodité de passer pendant la nuit de mon appartement au sien, sans être vues de ses gens, ni de Francis, et d' ôter de chez moi ce que je voudrais emporter.	19	88	35	1	0.02857142857142857	[['pendant']]
3147	Le soir du jeudi, je fis fermer ma porte en dedans à l' heure accoutumée.	19	89	15	0	0.0	[]
3148	J' attendis impatiemment celle dont nous étions convenues.	19	90	8	0	0.0	[]
3149	Elle sonna enfin, et je sortis par le cabinet avec Lidy.	19	91	11	0	0.0	[]
3150	Nous traversâmes la terrasse.	19	92	4	0	0.0	[]
3151	Mistriss Palmer me reçut sans lumière à la porte de son appartement, et m' introduisit dans sachambre.	19	93	17	0	0.0	[]
3152	Je tremblais;	19	94	2	0	0.0	[]
3153	Lidy se soutenait à peine, et ma conductrice inquiète s' arrêtait à chaque pas.	19	95	14	0	0.0	[]
3154	Quand elle se crut assurée que ses gens, rassemblés pour souper, ne pouvaient ni nous voir, ni nous entendre, elle nous fit descendre doucement, ouvrit sans bruit la porte de la rue, et me remit entre les mains d' un homme âgé, frère de Mistriss Tomkins, chez qui j' allois loger.	19	96	51	1	0.0196078431372549	[['main']]
3155	Depuis une heure, il m' attendait à dix pas avec une voiture.	19	97	12	0	0.0	[]
3156	Je serrai Mistriss Palmer dans mes bras, sans pouvoir lui exprimer ma réconnaissance que par mes larmes;	19	98	17	2	0.11764705882352941	[['serrer'], ['bras']]
3157	je me hâtai de gagner le carrosse.	19	99	7	0	0.0	[]
3158	L' honnête vieillard m' aida à y monter, rendit le même service à Lidy, se plaça près d' elle, et suivant sa direction, on nous conduisit à ma nouvelle demeure.	19	100	30	0	0.0	[]
3159	Il était près de minuit quand nous arrivâmes.	19	101	8	0	0.0	[]
3160	La maîtresse de la maison me reçut d' un air civil et respectueux;	19	102	13	0	0.0	[]
3161	elle me croyait une fille de qualité, échappée, par le secours de Mistriss Palmer, aux importunes sollicitations d' un tuteur intéressé, qui voulait la contraindre à épouser son fils, pour s' emparer des biens confiés à ses soins.	19	103	38	0	0.0	[]
3162	Je devais attendre chez elle le retour d' une parente absente, et me cacher à tous les yeux jusqu' à son arrivée.	19	104	22	1	0.045454545454545456	[['oeil']]
3163	Deux guinées, dont je récompensai les peines de son frère, lui donnèrent l' espérance de tirer un profit considérable du séjour que ferait dans sa maison une personne riche et libérale;	19	105	31	1	0.03225806451612903	[['riche']]
3164	espérance qu	19	106	2	0	0.0	[]
3165	' elle ne perdit pas sans chagrin, quand le temps lui découvrit son erreur.	19	107	13	0	0.0	[]
3166	Elle m' ouvrit un appartement très-propre et fort commode, où elle me laissa en liberté de prendre le repos qu' elle me souhaita.	19	108	24	1	0.041666666666666664	[['fort']]
3167	Dès que je fus seule avec Lidy, je l' embrassai étroitement;	19	109	11	0	0.0	[]
3168	mon cœur se sentait soulagé d' une de ses peines.	19	110	10	0	0.0	[]
3169	Je n' étais plus au pouvoir de Milord Danby;	19	111	9	0	0.0	[]
3170	mais que le souvenir d' y avoir été, détruisit bientôt ce léger mouvement de satisfaction!	19	112	15	0	0.0	[]
3171	Nous pleurâmes long-temps toutes deux sans nous parler;	19	113	9	1	0.1111111111111111	[['long']]
3172	je cachois mon visage dans le sein de cette tendre amie, je la pressais contre le mien.	19	114	17	4	0.23529411764705882	[['visage'], ['sein'], ['tendre'], ['presser']]
3173	"Rompant enfin ce triste silence: "" ô ma chère"	19	115	9	1	0.1111111111111111	[['triste']]
3174	Lidy, lui dis-je, que la douleur dont je me sens oppressée a d' amertume!	19	116	15	0	0.0	[]
3175	Quelle différence des larmes que je versois en quittant Oxford, en sortant du château d' Alderson, à celles que m' arrache mon humiliante disgrâce.	19	117	24	0	0.0	[]
3176	Je ne trouve plus en moi cette dignité, ce sentiment intérieur qui, au milieu de mes peines, dans le sein de la pauvreté, m' élevait à mes propres yeux.	19	118	29	1	0.034482758620689655	[['sein']]
3177	Hélas!	19	119	1	0	0.0	[]
3178	Qu' est-il donc devenu?	19	120	5	0	0.0	[]
3179	Comment le crime de cet homme me réduit-il à la honte, à l' abaissement, à n' oser fixer mes regards sur les autres, à rougir en les tournant sur moi-même?	19	121	32	0	0.0	[]
3180	""" ne vous abandonnez point à ces cruelles réflexions, interrompit Lidy, vous n' avez offensé ni le ciel, ni l' honneur; puisse une certitude si consolante accompagner toujours vos pleurs!"	19	122	29	1	0.034482758620689655	[['consoler']]
3181	Chère miss, elle doit à présent bannir le trouble de votre âme, vous aider à supporter le malheur dont vous gémissez;	19	123	21	0	0.0	[]
3182	eh, pourquoi cesseriez-vous de vous estimer, quand l' homme qui vous a si bassement trompée, vous respecte lui-même, rougit des avantages qu' il a remportés sur vous, et ne peut se les rappeler sans honte et sans remords?	19	124	39	0	0.0	[]
3183	Le succès de sa feinte est devenu la punition de son crime.	19	125	12	0	0.0	[]
3184	Il conserve pour vous cette passion ardente, ces sentiment vifs qui l' égarèrent;	19	126	13	1	0.07692307692307693	[['vif']]
3185	en satisfaisant ses désirs, il les a augmentés, et s' est rendu si malheureux, que je doute si vos chagrins égalent les siens.	19	127	23	0	0.0	[]
3186	Elle me raconta alors une partie de ses entretiens avec Milord Danby;	19	128	12	0	0.0	[]
3187	et s' efforçant de porter mes idées sur des sujets moins révoltans, elle me parla de Miladi Rutland	19	129	18	0	0.0	[]
3188	, me conseilla de lui rappeler ses généreuses offres, et de ranimer ses tendres dispositions à mon égard par le détail de mes peines passées, et de ma situation présente.	19	130	29	1	0.034482758620689655	[['tendre']]
3189	Mistriss	19	131	1	0	0.0	[]
3190	Palmer s' était chargée de me faire savoir si la duchesse se trouvait encore à Londres.	19	132	16	0	0.0	[]
3191	Dans la supposition que cette dame en fût déjà partie, elle devait s' informer du lieu où je pourrais lui adresser une lettre, et m' en instruire.	19	133	27	0	0.0	[]
3192	Dix jours se passèrent à attendre des nouvelles de Mistriss Palmer.	19	134	11	0	0.0	[]
3193	Enfin, on m' apporta de sa part mes habits et une lettre;	19	135	12	0	0.0	[]
3194	ce qu' elle m' apprit redoubla tous mes chagrins.	19	136	9	0	0.0	[]
3195	Après un séjour de six semaines à la cour, Miladi Rutland en était partie pour reprendre le cours ordinaire de ses voyages, et visitoit actuellement les amis qu	19	137	28	0	0.0	[]
3196	' elle cultivait dans les différentes provinces du royaume.	19	138	8	0	0.0	[]
3197	Sans être dirigé par elle, il paraissait impossible de suivre sa marche, ou de parvenir à l' atteindre.	19	139	18	0	0.0	[]
3198	Mistriss Palmer me conseillait d' adresser mes lettres en écosse, d' où elles seraient renvoyées à miladi.	19	140	17	0	0.0	[]
3199	Elle me disait que Milord Danby, prêt à partir pour se rendre en Allemagne, venait de tomber dangereusement malade.	19	141	19	0	0.0	[]
3200	Son mari et lui ne doutaient point qu' elle ne m' eût prêté son assistance;	19	142	15	0	0.0	[]
3201	mais milord, dans la crainte peut-être de la trouver trop instruite, et de l' exciter à répandre son secret,avait expressément défendu à Palmer de la chagriner à ce sujet.	19	143	30	0	0.0	[]
3202	Ainsi les reproches de son mari étaient sans aigreur.	19	144	9	0	0.0	[]
3203	Elle finissait en me marquant beaucoup de regret de n' être plus à portée de me donner de nouvelles informations, devant s' embarquer incessamment pour l' Irlande, où sa mère et elle allaient recueillir une succession, dont les droits contestés en partie, les forceraient peut-être à un long séjour.	19	145	49	2	0.04081632653061224	[['droit'], ['long']]
3204	Cette lettre m' affligea sensiblement.	19	146	5	0	0.0	[]
3205	La maladie de Milord Danby éloignait son départ, m' obligeait à me cacher, m' ôtoit la liberté d' aller chez Mistriss Mabel, où la nécessité de diminuer ma dépense me faisait souhaiter de retourner.	19	147	34	0	0.0	[]
3206	Je donnais deux guinées par semaine à Mistriss Tomkins, et devais les donner toujours en avance.	19	148	16	0	0.0	[]
3207	Entre Lidy et moi, nous n' en possédions que vingt, en sortant de chez Palmer.	19	149	15	0	0.0	[]
3208	Je ne pouvais plus espérer un secours prochain de Miladi Rutland.	19	150	11	0	0.0	[]
3209	Je lui écrivis cependant: mais qu' attendre de cette démarche, et dans quel temps en saurais-je l' effet?	19	151	19	0	0.0	[]
3210	Pour comble de disgrâce, Lidy, ma chère Lidy!	19	152	8	0	0.0	[]
3211	Qui mettait tous ses soins à me consoler, s' efforçait de m' engager à m' occuper moins de ma cruelle aventure, en était si douloureusement affectée elle-même, que peu à peu elle tomba dans une langueur, dont sa piété ni son courage ne purent lui faire repousser les dangereuses atteintes.	19	153	50	1	0.02	[['consoler']]
3212	Elle perdit le sommeil, prit du dégoût pour tous les aliments, et s' abandonna à la noire mélancolie qui la consumait.	19	154	21	0	0.0	[]
3213	Pâle, faible, abattue, elle attachait sur moi ses yeux baignés de pleurs;	19	155	12	4	0.3333333333333333	[['pâle'], ['faible'], ['abattre'], ['oeil']]
3214	"elle joignit ses mains, les levait vers le ciel, et s' écriait: "" hélas!"	19	156	14	2	0.14285714285714285	[['joindre'], ['main']]
3215	Que fera-t-elle!	19	157	4	0	0.0	[]
3216	Quedeviendra-t-elle!	19	158	3	0	0.0	[]
3217	"En quel état vais-je la laisser! "" ses larmes, son inquiétude"	19	159	12	0	0.0	[]
