1532	essayons d' assurer le succès de nos désirs, et ne risquons point d' imprudentes démarches.	9	400	15	0	0.0	[]
1533	Il me vient une idée, continua-t-elle;	9	401	8	0	0.0	[]
1534	milord est actuellement dans le comté de Leicester;	9	402	8	0	0.0	[]
1535	j' ai ordre d' aller l' attendre à sa maison de Windsor;	9	403	12	0	0.0	[]
1536	il s' y rendra vers la fin du mois prochain.	9	404	10	1	0.1	[['fin']]
1537	La saison commence à s' adoucir	9	405	6	0	0.0	[]
1538	, venez toutes deux à Windsor avec moi;	9	406	7	0	0.0	[]
1539	miss a besoin de dissipation;	9	407	5	0	0.0	[]
1540	cet agréable séjour est propre à lui en procurer.	9	408	9	1	0.1111111111111111	[['agréable']]
1541	Là, nous penserons à loisir à l' importance de cette affaire.	9	409	11	0	0.0	[]
1542	Sir Humfroi recouvrera peut-être ses forces et sa raison;	9	410	9	0	0.0	[]
1543	"peut-être le ciel daignera-t-il nous découvrir un moyen de réussir, que nos vues bornées ne peuvent même entrevoir "" ."	9	411	21	0	0.0	[]
1544	Je consentis sans peine à l' accompagner.	9	412	7	0	0.0	[]
1545	Le lendemain, nous partîmes toutes trois pour Windsor.	9	413	8	0	0.0	[]
1546	La terre de milord tenait à la forêt;	9	414	8	0	0.0	[]
1547	et comme Mistriss Hammon l' avait annoncé, elle offrait un aspect charmant.	9	415	12	0	0.0	[]
1548	PARTIE 2	10	0	2	0	0.0	[]
1549	La situation riante de cette maison, me rappela les jardins de Milord Clare, et la différence que si peu de temps venait de mettre dans mon sort.	10	1	27	0	0.0	[]
1550	Cependant la pureté de l' air, la beauté des promenades, les soins tendres et attentifs de Mistriss Hammon, modérèrent un peu mon affliction.	10	2	23	1	0.043478260869565216	[['tendre']]
1551	Les chagrins embarrassans que nous cause l' indigence, n' ont pas les traits aigus dont le cœur est continuellement blessé par les peines que le sentiment lui fait souffrir.	10	3	29	0	0.0	[]
1552	Le cruel apesantissement de ces peines tient sans cesse l' âme oppressée, et détruit en elle toute espèce de sensibilité: mais l' inquiète idée de la mauvaise fortune s' éloigne quelquefois de l' esprit, laisse goûter des plaisirs momentanés, et ne rend point incapables de se livrer à la dissipation que le hasard ou le soin d' un ami présente.	10	4	60	0	0.0	[]
1553	Trois semaines se passèrent à agiter entre nous les moyens d' apprendre à milord, sans l' irriter, la destinée de sa fille, et mon existence.	10	5	25	0	0.0	[]
1554	Je rejetois absolument ceux qui exposaient Mistriss Hammon à perdre sa bienveillance, je ne voulais point me préparer un dur reproche.	10	6	21	1	0.047619047619047616	[['dur']]
1555	De tous les malheurs, celui d' avoir causé la ruine d' un obligeant ami	10	7	14	0	0.0	[]
1556	, est le seul dont le temps n' adoucit jamais l' amertume.	10	8	11	0	0.0	[]
1557	Aucun parti ne fixait encore nos idées, quand milordnous surprit, en devançant de beaucoup le temps où il était attendu.	10	9	20	0	0.0	[]
1558	Le hasard me plaça sur son passage, sans qu' il me fût possible d' éviter sa rencontre.	10	10	17	0	0.0	[]
1559	Je le saluai;	10	11	3	0	0.0	[]
1560	ma figure assez distinguée le frappa.	10	12	6	1	0.16666666666666666	[['figure']]
1561	Il s' inclina profondément, s' arrêta pour me laisser passer, me suivit des yeux, demanda ensuite à qui j' appartenois, et comment je me trouvais chez lui.	10	13	27	1	0.037037037037037035	[['oeil']]
1562	Sans trop s' éloigner de la vérité, Mistriss Hammon satisfit sa curiosité.	10	14	12	0	0.0	[]
1563	""" Miss Jenny Glanville est une jeune orpheline, milord, lui dit-elle, élevée dans l' abondance, dans la certitude d' une fortune honnête, réduite à présent, par l' imprudence de son tuteur, à chercher une protection étrangère, à se trouver heureuse si ses talents, son esprit, et les grâces de sa personne lui procurent l' appui d' une femme titrée, ou d' une bourgeoise opulente, qui daigne la recevoir dans sa maison en qualité d' humble amie; triste ressource pour une fille dont la naissance est noble, et qui possédait, il y a trois mois, plus de vingt mille livres sterlings."	10	15	100	2	0.02	[['triste'], ['noble']]
1564	Elle ajouta à ces détails tout ce qu' elle crut capable d' exciter en lui le désir de me connaître, et l' envie de m' obliger.	10	16	26	0	0.0	[]
1565	""" milord, accoutumé à la voir s' intéresser à tous ceux qui lui semblaient mériter de la compassion, ne fut pas surpris de la chaleur de ses expressions."	10	17	27	0	0.0	[]
1566	Il l' approuva de m' avoir donné un asile, loua la bonté de son cœur, lui permit de me garder près d' elle, souhaita que l' on pût me trouver une place convenable, me plaignit, et changea de discours.	10	18	39	0	0.0	[]
1567	Il se passa un peu de temps sans que l' occasion de voir milord se présentât.	10	19	16	0	0.0	[]
1568	Un soir, il entra dans unesalle basse où j' étais avec Mistriss Hammon.	10	20	13	1	0.07692307692307693	[['bas']]
1569	Il l' appela, lui donna quelques ordres.	10	21	7	0	0.0	[]
1570	Ses yeux se tournant vers moi, je le saluai respectueusement.	10	22	10	1	0.1	[['oeil']]
1571	Une légère inclination de tête fut tout ce qu' il crut devoir à une fille dont la naissance, quoique noble, n' était point accompagnée des avantages brillant qui attirent de la considération dans le monde.	10	23	35	3	0.08571428571428572	[['tête'], ['noble'], ['briller']]
1572	La différence marquée de cette révérence me frappa;	10	24	8	0	0.0	[]
1573	elle me fit éprouver une sorte de mortification que la fierté seule n' excitait pas.	10	25	15	0	0.0	[]
1574	Je me sentis touchée.	10	26	4	0	0.0	[]
1575	Le peu d' attention de milord pour ma présence m' affligeant trop, je m' approchai insensiblement d' une porte opposée à celle où il se tenait, et sortis de la salle.	10	27	31	0	0.0	[]
1576	""" Mistriss Hammon, dit-il assez haut, je serais fâché de gêner votre jeune amie, rappelez-la, je vais vous laisser."	10	28	20	1	0.05	[['haut']]
1577	""" elle obéit, mais je ne répondis point, et me hâtai de gagner une allée du jardin où j' allai répandre des pleurs, sans pouvoir me rendre compte en ce moment du sentiment qui me les arrachait."	10	29	36	1	0.027777777777777776	[['pleur']]
1578	Mistriss Hammon saisit cette occasion de parler encore de moi à milord.	10	30	12	0	0.0	[]
1579	Elle lui fit une peinture touchante de ma situation, lui vanta mes talents.	10	31	13	0	0.0	[]
1580	Elle s' efforçait de lui inspirer au moins le désir de s' en amuser.	10	32	14	0	0.0	[]
1581	Il aimait passionnément la musique, et je la savais assez bien.	10	33	11	0	0.0	[]
1582	Il l' écouta sans paraître fatigué de ses discours, mais sans montrer qu' ils lui fissent impression, et la quitta bientôt en répétant, rappelez-la, je ne veux point la gêner.	10	34	31	1	0.03225806451612903	[['fatiguer']]
1583	Deux jours après cet entretien, milord demanda un matin à Mistriss Hammon si elle ne pourrait pas lui procurer le plaisir de m' entendre jouer du clavecin,et chanter quelques airs.	10	35	31	0	0.0	[]
1584	Cette femme, transportée de joie, accourut à moi.	10	36	8	0	0.0	[]
1585	Il veut vous voir, miss, s' écria-t-elle;	10	37	9	0	0.0	[]
1586	il veut vous entendre, le ciel sans doute a mis ce désir dans son cœur.	10	38	15	0	0.0	[]
1587	Ne rougissez point de montrer de la complaisance pour milord.	10	39	10	0	0.0	[]
1588	Employez votre esprit à lui plaire, vos talents à l' amuser, devenez-lui nécessaire, qu' il souhaite, s' il se peut, de ne jamais vous perdre de vue.	10	40	28	0	0.0	[]
1589	Chère miss, cet instant va peut-être décider du bonheur de vos jours.	10	41	12	0	0.0	[]
1590	Il était inutile de m' exciter à montrer de la déférence à Milord Alderson;	10	42	14	0	0.0	[]
1591	sa vue m' avait émue puissamment.	10	43	6	1	0.16666666666666666	[['émouvoir']]
1592	La physionomie noble et majestueuse de ce seigneur, l' air vénérable que l' âge donnait à des traits dont la beauté se faisait admirer encore;	10	44	25	3	0.12	[['noble'], ['majestueux'], ['vénérable']]
1593	la douceur de lever les yeux pour la première fois sur une personne à laquelle le sang me lioit, dispensée par la loi de me protéger, mais engagée par la nature à me plaindre, à m' aimer, à me secourir; mille sentiment réunis m' affectaient à son aspect, et préparaient mon cœur à respecter et à chérir le père de Ladi Sara.	10	45	62	1	0.016129032258064516	[['oeil']]
1594	Conduite par Mistriss Hammon, j' entrai dans le salon où milord m' attendait.	10	46	13	0	0.0	[]
1595	Il me reçut avec politesse.	10	47	5	0	0.0	[]
1596	Après une courte apologie sur l' envie de m' entendre, et la peine que j' allois prendre pour la satisfaire, il me pria de m' asseoir au clavecin.	10	48	28	1	0.03571428571428571	[['court']]
1597	J' obéis.	10	49	2	0	0.0	[]
1598	Tant que j' exécutai des pièces, milord parut surpris de la légèreté de ma main; et quand je chantai, il se montra charmé de la douceur et de la flexibilité de ma voix.	10	50	33	2	0.06060606060606061	[['main'], ['charmer']]
1599	Passant de mes louanges à celles du compositeurd' un morceau qui l' avait extrêmement flatté, il parla des goûts divers sur l' harmonie, étendit ce sujet, et le traita en connoisseur.	10	51	31	0	0.0	[]
1600	Il lui rappela plusieurs particularités de ses voyages en France et en Italie, pays où la dispute s' élevait aisément, disait-il, sur la préférence que chaque nation croyait mériter.	10	52	30	0	0.0	[]
1601	Je l' écoutais avec attention;	10	53	5	0	0.0	[]
1602	ses récits s' enchaînoient l' un à l' autre;	10	54	9	0	0.0	[]
1603	ils durèrent jusqu' au moment où on vint l' avertir qu' il était servi.	10	55	14	0	0.0	[]
1604	Je me préparais à sortir, mais il me retint, et me pria de lui accorder ma compagnie à table.	10	56	19	0	0.0	[]
1605	Mistriss Hammon se hâta d' accepter cet honneur pour moi.	10	57	10	0	0.0	[]
1606	Pendant le repas, milord conserva sa gaieté.	10	58	7	1	0.14285714285714285	[['pendant']]
1607	Il avait ordonné que ses chevaux fussent attelés à cinq heures, il parut fâché de s' être engagé à sortir;	10	59	20	0	0.0	[]
1608	en me quittant, il me remercia des moment agréables que je venais de lui faire passer.	10	60	16	1	0.0625	[['agréable']]
1609	Cet heureux commencement offrait une riante perspective.	10	61	7	0	0.0	[]
1610	Cependant	10	62	1	0	0.0	[]
1611	Lidy se refusait aux espérances que Mistriss Hammon en concevait.	10	63	10	0	0.0	[]
1612	Elle évitait soigneusement les regards de milord, et craignait toujours pour elle et pour moi, l' instant où il apprendrait à qui je devais la vie.	10	64	26	1	0.038461538461538464	[['regard']]
1613	Le lendemain, à l' heure du dîner, on vint me dire que milord m' attendait.	10	65	15	0	0.0	[]
1614	Charmée de cette invitation, je courus à son appartement.	10	66	9	0	0.0	[]
1615	J' y fus reçue comme une personne dont la présence était désirée.	10	67	12	0	0.0	[]
1616	Je jouai du clavecin après le dîner, et ne quittai milord qu' à l' heure où il se retirait ordinairement pour prendre du repos.	10	68	24	0	0.0	[]
1617	Chaque jour augmenta ma faveur auprès de Milord Alderson.	10	69	9	0	0.0	[]
1618	J' obtenois déjà des grâces légères.	10	70	6	0	0.0	[]
1619	à laprière de son chapelain, je lui présentois les humbles requêtes de ses vassaux ou de ses fermiers.	10	71	18	0	0.0	[]
1620	J' obligeois toute sa maison;	10	72	5	0	0.0	[]
1621	le respect de ses gens pour moi croissait avec les distinctions du maître.	10	73	13	0	0.0	[]
1622	On commençait à se dire en secret:	10	74	7	0	0.0	[]
1623	Miss Jenny sera bientôt Miladi Alderson.	10	75	6	0	0.0	[]
1624	on croyait milord fort attaché à ma personne.	11	0	8	1	0.125	[['fort']]
1625	Ceux qui le pensaient, ne savaient pas combien celui dont la complaisance amuse un grand, peut séduire son esprit sans intéresser son cœur.	11	1	23	1	0.043478260869565216	[['grand']]
1626	Je vécus plus d' un mois dans cette espèce d' intimité avec milord;	11	2	13	0	0.0	[]
1627	mangeant à sa table, et passant une partie du jour auprès de lui, sans qu' il daignât me faire une seule question sur la situation fâcheuse de ma fortune, s' informer des particularités de mon malheur, ou des ressources qui pouvaient me rester.	11	3	43	0	0.0	[]
1628	Une fluxion sur les yeux le privait depuis long-temps de la promenade.	11	4	13	2	0.15384615384615385	[['oeil'], ['long']]
1629	Les jalousies de son appartement demeuraient fermées, et l' obscurité me laissait à peine lire les pièces difficiles qu' il aimait à m' entendre jouer.	11	5	25	0	0.0	[]
1630	Il guérit enfin, et se vit avec plaisir en liberté de parcourir ses jardins, et de jouir des nouveaux embellissemens qu' on venait d' y faire.	11	6	26	0	0.0	[]
1631	Un matin, il m' envoya prier de l' accompagner à la promenade.	11	7	12	0	0.0	[]
1632	Je me rendis avec lui au bord d' une pièce d' eau, où se jouaient quantité d' oiseaux aquatiques, accoutumés à venir au plus léger signal se disputer des grains qu' on leur jetait.	11	8	34	0	0.0	[]
1633	Le jour était fort grand dans ce lieu où rien ne l' ombrageait.	11	9	13	2	0.15384615384615385	[['fort'], ['grand']]
1634	Milord ne m' avait point encore regardée avec autant d' attention ni de facilité de m' examiner.	11	10	17	0	0.0	[]
1635	Il me considéra long-temps.	11	11	5	1	0.2	[['long']]
1636	Un mouvement de surprise le fitse retirer en arrière, lever les mains et prononcer des mots entrecoupés, dont le sens ne m' échappa point.	11	12	24	2	0.08333333333333333	[['main'], ['prononcer']]
1637	Il revint à moi, s' éloigna encore, se rapprocha, me regarda fixement sans parler.	11	13	14	0	0.0	[]
1638	"Ensuite s' appuyant sur une balustrade qui régnait autour du bassin, il baissa la tête du côté de l' eau, et s' écria: "" quels traits, quel rapport, quelle étonnante conformité!"	11	14	31	1	0.03225806451612903	[['tête']]
1639	""" que mon cœur était agité, madame!"	11	15	6	1	0.16666666666666666	[['agité']]
1640	Milord s' apercevait de ma ressemblance avec Ladi Sara;	11	16	9	0	0.0	[]
1641	elle le frappait, mais sa surprise ne paraissait mêlée d' aucun attendrissement;	11	17	12	0	0.0	[]
1642	la sévérité de ses regards venait de me glacer.	11	18	9	1	0.1111111111111111	[['regard']]
1643	Inquiète, troublée, je gardois le silence, j' attendais en tremblant que milord le rompît lui-même.	11	19	15	1	0.06666666666666667	[['trembler']]
1644	Son air devenu si sombre en un instant, sembla s' éclaircir peu à peu.	11	20	14	1	0.07142857142857142	[['sombre']]
1645	Il se tourna vers moi, me fit une espèce d' excuse de sa longue distraction.	11	21	15	1	0.06666666666666667	[['long']]
1646	""" vous m' avez vivement rappelé, me dit-il, une personne dont le souvenir m' est odieux."	11	22	16	0	0.0	[]
1647	Vos traits sont semblables aux siens	11	23	6	0	0.0	[]
1648	, je souhaite que le ciel ne vous ait pas destinée à vous conduire comme elle, et qu' il vous garantisse de ses faiblesses.	11	24	23	0	0.0	[]
1649	""" nous continuâmes notre promenade, et pour la première fois milord m' interrogea sur le temps où j' avais perdu mes parents, sur les événements qui me privoient de mes biens, et sur le rang et la fortune de mon père."	11	25	40	0	0.0	[]
1650	Instruite de ce que je devais répondre, il m' était aisé de le satisfaire sans me trahir: mais peu accoutumée à déguiser la vérité, j' hésitois, mon embarras paraissait jusque dans le son de ma voix, et je cherchais à détourner la conversation d' un sujet dont lasincérité de mon cœur se sentait blessée.	11	26	54	2	0.037037037037037035	[['aiser'], ['voix']]
1651	Milord rentra plus tôt qu' il ne semblait se l' être proposé.	11	27	12	1	0.08333333333333333	[['rentrer']]
1652	Sous prétexte d' un peu de lassitude, et de vouloir se reposer, il me quitta assez brusquement.	11	28	17	0	0.0	[]
1653	Je me crus perdue.	11	29	4	0	0.0	[]
1654	Mistriss Hammon et Lidy pensèrent comme moi, qu' il allait me retirer sa faveur.	11	30	14	0	0.0	[]
1655	Cependant à l' heure du dîner, on vint à l' ordinaire me dire qu' il m' attendait.	11	31	17	0	0.0	[]
1656	Je ne vis point de changement dans sa contenance, mais il me parla moins, et m' observa davantage.	11	32	18	0	0.0	[]
1657	Ce qui devait me rendre plus chère à son cœur m' en éloigna.	11	33	13	0	0.0	[]
1658	Je le trouvais souvent froid et sérieux.	11	34	7	1	0.14285714285714285	[['froid']]
1659	Pendant plusieurs jours, il me saluoit en sortant de table, et se retirait promptement, marquant une sorte de crainte que je ne le suivisse.	11	35	24	1	0.041666666666666664	[['pendant']]
1660	Cette conduite abattit	11	36	3	0	0.0	[]
1661	mon espoir, affligea Mistriss Hammon, et confirma Lidy dans l' idée qu' il serait imprudent de lui découvrir ma naissance, et de l' instruire d' un secret dont la connaissance le rendrait mon ennemi	11	37	34	0	0.0	[]
1662	.	11	38	0	0	0	[]
1663	Milord eut un peu de fièvre, il s' y joignit une violente attaque de goutte.	11	39	15	1	0.06666666666666667	[['joindre']]
1664	Malgré l' indifférence qu' il me montrait depuis notre promenade, mes premiers sentiment n' étaient point affaiblis.	11	40	17	0	0.0	[]
1665	Ses cris pénétraient mon cœur.	11	41	5	1	0.2	[['pénétrer']]
1666	Empressée à partager avec Mistriss Hammon l' emploi de le servir, assidue près de son lit, je volois pour exécuter ses ordres.	11	42	22	0	0.0	[]
1667	Je ne pouvais retenir mes larmes en l' entendant se plaindre tout haut des maux aigus qu' il souffrait.	11	43	19	1	0.05263157894736842	[['haut']]
1668	Pendant sa convalescence, il parut se souvenir de mes soins, et se montra sensible à ceux que je prenais alors de dissiper ses ennuis.	11	44	24	1	0.041666666666666664	[['pendant']]
1669	Il commençait à marcher dans sa chambre, àreprendre ses forces.	11	45	10	0	0.0	[]
1670	Je sentais une joie véritable de son heureux rétablissement, je la lui marquais souvent.	11	46	14	0	0.0	[]
1671	Je croyais m' apercevoir qu' il se plaisait aux preuves tendres et naïves de mon attachement, et ma vive amitié en redoublait encore.	11	47	23	3	0.13043478260869565	[['tendre'], ['naïf'], ['vif']]
1672	Seule un jour près de lui, je lisais un livre français qu' on venait de lui envoyer;	11	48	17	0	0.0	[]
1673	il paraissait s' en amuser beaucoup.	11	49	6	0	0.0	[]
1674	Un flacon qu' il tenait, échappa de ses mains, je me précipitai à terre pour l' empêcher d' y toucher et de s' y briser.	11	50	25	1	0.04	[['main']]
1675	En me baissant, un ruban étroit, où le portrait de mon père était attaché, se cassa;	11	51	16	0	0.0	[]
1676	imprudemment je l' ôtai de mon col.	11	52	7	0	0.0	[]
1677	Le portrait caché dans mon sein, parut, excita la curiosité de milord;	11	53	12	1	0.08333333333333333	[['sein']]
1678	il me demanda à le voir, et fit un mouvement pour le prendre.	11	54	13	0	0.0	[]
1679	Ma rougeur, l' extrême embarras qui se peignit sur mon visage, ma consternation, mon effroi, frappèrent Milord Alderson.	11	55	18	1	0.05555555555555555	[['visage']]
1680	Il saisit le portrait, l' enleva aisément d' une main faible;	11	56	11	1	0.09090909090909091	[['main']]
1681	la crainte avait glacé mon sang, elle me rendait muette et presque' inanimée.	11	57	13	0	0.0	[]
1682	La haine, ainsi que l' amour, grave les idées dans la mémoire.	11	58	12	1	0.08333333333333333	[['grave']]
1683	Milord reconnut l' image d' édouard.	11	59	6	0	0.0	[]
1684	Il poussa un cri étouffé, suivi de plusieurs exclamations.	11	60	9	1	0.1111111111111111	[['étouffé']]
1685	""" où suis-je, disait-il?"	11	61	5	0	0.0	[]
1686	Quel piège veut-on me tendre?	11	62	6	0	0.0	[]
1687	Quel complot odieux se forme ici contre moi?	11	63	8	0	0.0	[]
1688	"Cette ressemblance singulière avec Sara, ce portrait, ont sans doute inspiré à des âmes viles le projet de m' en imposer, de se jouer de ma vieillesse, de me tromper... "" un mouvement impétueux me fit tomber à ses pieds, saisir une de ses mains, la presser, la baiser; et trouvant la force de parler, dans celle du sentimentdont j' étais animée: "" on ne vous tend point de piège, milord, lui dis-je;"	11	64	74	3	0.04054054054054054	[['pied'], ['main'], ['presser']]
1689	on ne vous trompe point.	11	65	5	0	0.0	[]
1690	Pardonnez-moi, ah!	11	66	3	0	0.0	[]
1691	Pardonnez à l' infortunée qui implore votre pitié, ne me punissez pas d' avoir espéré en vous.	11	67	17	0	0.0	[]
1692	C' est la fille de Ladi Sara;	11	68	7	0	0.0	[]
1693	c' est la vôtre qui gémit à vos pieds;	11	69	9	0	0.0	[]
1694	ah!	11	70	1	0	0.0	[]
1695	Ne me haïssez pas!	11	71	4	0	0.0	[]
1696	Je ne mérite point votre haine.	11	72	6	0	0.0	[]
1697	""" mes pleurs me contraignirent de m' arrêter."	11	73	7	1	0.14285714285714285	[['pleur']]
1698	De la main que je lui laissais libre, milord s' efforça de me repousser.	11	74	14	1	0.07142857142857142	[['main']]
1699	"Mais passant mes bras autour de lui, le serrant avec ardeur: "" ôtez-moi la vie, lui criois-je;"	11	75	19	1	0.05263157894736842	[['bras']]
1700	mais ne m' accablez pas de votre colère, de vos dédains;	11	76	11	0	0.0	[]
1701	ne détournez point vos regards d' une fille pauvre, abandonnée, plus sensible à vos mépris qu' à ses malheurs.	11	77	19	1	0.05263157894736842	[['regard']]
1702	Non, ce n' est plus un protecteur, c' est un père que je cherche en vous!	11	78	16	0	0.0	[]
1703	Je vous respecte, je vous aime!	11	79	6	0	0.0	[]
1704	Votre première vue a élevé dans mon cœur un sentiment inconnu, il me fait désirer votre tendresse plus que vos secours.	11	80	21	0	0.0	[]
1705	Des regards moins sévères, une seule expression caressante, dont vous daigneriez m' honorer, me serait plus chère	11	81	17	1	0.058823529411764705	[['regard']]
1706	que le retour de ma fortune; nommez-moi votre fille!	11	82	10	0	0.0	[]
1707	Permettez-moi de vous donner une fois, une seule fois le nom de père, et je me croirai heureuse!	11	83	19	0	0.0	[]
1708	""" il voulut encore me repousser: "" non, non, vous ne m' échapperez point!"	11	84	13	0	0.0	[]
1709	M' écriai-je;	11	85	3	0	0.0	[]
1710	mon cœur vous est pour jamais attaché.	11	86	7	0	0.0	[]
1711	Ah!	11	87	1	0	0.0	[]
1712	Ne m' éloignez point de votre présence, ne me bannissez point de votre maison, n' importe à quel titre j' y demeure;	11	88	22	0	0.0	[]
1713	contente de rester près de vous, je vous révèrerai comme mon père, ou vous servirai comme mon maître, si vous l' exigez.	11	89	22	0	0.0	[]
1714	""" si l' oppression de mon cœur n' eût étouffé ma voix, j' aurois pu parler plus long-temps."	11	90	18	3	0.16666666666666666	[['étouffé'], ['voix'], ['long']]
1715	La fureur de milord le rendait immobile et ne lui permettait pas de m' interrompre.	11	91	15	0	0.0	[]
1716	Elle éclata enfin;	11	92	3	0	0.0	[]
1717	"il s' arracha de mes bras, et prenant ce ton terrible, qui le faisait paraître si redoutable aux malheureux dont le sort dépendait de lui: "" jeune audacieuse, s' écria-t-il, oses"	11	93	33	2	0.06060606060606061	[['bras'], ['ton']]
1718	-tu te dire de mon sang?	11	94	6	0	0.0	[]
1719	Eh!	11	95	1	0	0.0	[]
1720	Quand tu en serais! ... tremble, frémis, crains la juste punition de ton mensonge et de ta hardiesse.	11	96	18	2	0.1111111111111111	[['ton'], ['ton']]
1721	Te nommer ma fille, toi!	11	97	5	0	0.0	[]
1722	Eh!	11	98	1	0	0.0	[]
1723	Qui es-tu?	11	99	3	0	0.0	[]
1724	"Vil rebut, peut-être... "" mais pourquoi me retracer un moment si douloureux, si humiliant!"	11	100	14	0	0.0	[]
1725	Ah!	11	101	1	0	0.0	[]
1726	Madame, avec quelle inhumanité je fus traitée!	11	102	7	0	0.0	[]
1727	Je rougis encore au souvenir des expressions de cet homme dur et artificieux;	11	103	13	1	0.07692307692307693	[['dur']]
1728	elles me prouvèrent trop qu' il me croyait vraie; mais sa haine pour mes parents s' étendait jusqu' à moi.	11	104	20	0	0.0	[]
1729	Il fit appeler Mistriss Hammon, l' interrogea d' un ton impérieux.	11	105	11	1	0.09090909090909091	[['ton']]
1730	Apprenant par elle que Lidy était dans sa maison, il la demanda, l' accabla de menaces, lui donna les noms les plus durs, nous reprocha à toutes trois un complot infâme, formé en commun pour le tromper;	11	106	37	1	0.02702702702702703	[['dur']]
1731	il ne voulait rien écouter, rien entendre;	11	107	7	0	0.0	[]
1732	il traita leurs discours d' impostures, de lâches suppositions, de mensonges inventés dans le coupable dessein de noircir la mémoire de Sara, d' établir ma fortune et la leur sur la perte de sa réputation.	11	108	35	0	0.0	[]
1733	Il me semble voir encore ces femmes prosternées aux pieds de ce cruel.	11	109	13	1	0.07692307692307693	[['pied']]
1734	Moi, la tête appuyée sur le siège qu' il venait de quitter; cachant mon visage et mes pleurs, m' efforçant en vain de retenir mes cris,et redoutant plus que la mort les regards méprisans de milord.	11	110	37	5	0.13513513513513514	[['tête'], ['siège'], ['visage'], ['pleur'], ['regard']]
1735	""" sauvez l' innocente et infortunée fille de ma chère maîtresse, lui disait Lidy, sauvez"	11	111	14	0	0.0	[]
1736	-la des dangers où l' expose l' abandon de la nature entière.	11	112	12	0	0.0	[]
1737	Eh!	11	113	1	0	0.0	[]
1738	Pourquoi, milord, pourquoi vous tromperois-je!	11	114	6	0	0.0	[]
1739	Est-ce mon intérêt qui m' engage à implorer vos bontés?	11	115	11	0	0.0	[]
1740	Ah!	11	116	1	0	0.0	[]
1741	Je ne demande point à les partager: née pauvre, je puis vivre sans peine du fruit de mon travail.	11	117	19	0	0.0	[]
1742	Mais miss, élevée dans l' aisance, n' a point appris à supporter l' abaissement et la misère.	11	118	17	0	0.0	[]
1743	Je le jure en présence du ciel;	11	119	7	0	0.0	[]
1744	je ne vous en impose point, c' est la fille de Ladi Sara, dont vous voyez couler les pleurs, dont vous entendez les gémissement;	11	120	24	1	0.041666666666666664	[['pleur']]
1745	lui refuserez-vous un asile?	11	121	5	0	0.0	[]
1746	Assurez son sort... ah!	11	122	4	0	0.0	[]
1747	Si milord eût daigné lire la lettre de sa fille, de sa fille expirante!	11	123	14	0	0.0	[]
